basepk,hid,speechdate,pid,opid,speakeroldname,speakerposition,maintopic,subtopic,subsubtopic,speechtext,speakerparty,speakerriding,speakername,speakerurl
4638517,ca.proc.d.2015-05-11.16839.141,2015-05-11,5f76e2e0-e77a-4928-aa31-a8d066f384a4,1813,"Ms. Lise St-Denis (Saint-Maurice—Champlain, Lib.)",,Oral Questions,Forestry Industry,,"Mr. Speaker, more layoffs have hit the forestry industry in Mauricie.
More than 300 jobs were cut last week when the Resolute Forest Products plant shut down in Rivière-aux-Rats.
In light of this closing and of the closing of the plant in Grand-Mère a short time ago, does the government agree that it is important to create a national policy on the harvesting, processing and use of wood?",Liberal,Saint-Maurice--Champlain,Lise St-Denis,http://www.parl.gc.ca/parlinfo/Files/Parliamentarian.aspx?Item=5f76e2e0-e77a-4928-aa31-a8d066f384a4&Language=E&Section=ALL
4638518,ca.proc.d.2015-05-11.16839.142,2015-05-11,78cd5419-2f3c-4798-9c5b-0e55843ef9fb,604,"Mrs. Kelly Block (Parliamentary Secretary to the Minister of Natural Resources, CPC)",,Oral Questions,Forestry Industry,,"Mr. Speaker, our government's balanced budget will continue to create jobs and grow our economy. We will continue to make targeted investments in research and development along with expanding and diversifying our exports to new and emerging markets.
However, do not take my word for it. The Forest Products Association of Canada has applauded our budget for its job creation measures.",Conservative,Saskatoon--Rosetown--Biggar,Kelly Block,http://www.parl.gc.ca/parlinfo/Files/Parliamentarian.aspx?Item=78cd5419-2f3c-4798-9c5b-0e55843ef9fb&Language=E&Section=ALL
4638519,ca.proc.d.2015-05-11.16839.143,2015-05-11,63525202-2bba-4063-8092-224f751f211d,1772,"Ms. Françoise Boivin (Gatineau, NDP)",,Oral Questions,Canada Post,,"Mr. Speaker, the City of Gatineau recently passed a resolution calling for a moratorium on the installation of community mailboxes. My constituents are outraged by the lack of public consultation and by the fact that Canada Post is acting unilaterally without taking into account municipal realities. Over 500 cities have now condemned Canada Post's attitude.
Will the government finally listen to what cities, including Gatineau, are asking for, or will it keep forcing people to use community mailboxes?",New Democratic Party,Gatineau,Françoise Boivin,http://www.parl.gc.ca/parlinfo/Files/Parliamentarian.aspx?Item=63525202-2bba-4063-8092-224f751f211d&Language=E&Section=ALL
4638520,ca.proc.d.2015-05-11.16839.144,2015-05-11,b6808e95-1c75-4909-ab86-319d3519016a,579,"Hon. Lisa Raitt (Minister of Transport, CPC)",,Oral Questions,Canada Post,,"Mr. Speaker, Canada Post has a five-point plan to ensure that it returns to self-sufficiency. One part of that is to convert the last remaining one-third of Canadian households to community mailboxes. In doing this work, it is expected to work with the municipalities in siting and take into consideration the concerns of the people who will be having this change. We expect that it will do that in a very thoughtful manner.
In terms of the number of municipalities, it is very clear that the resolution that was attempted to be passed at the Federation of Canadian Municipalities failed miserably with respect to taking us to task for these decisions.",Conservative,Halton,Lisa Raitt,http://www.parl.gc.ca/parlinfo/Files/Parliamentarian.aspx?Item=b6808e95-1c75-4909-ab86-319d3519016a&Language=E&Section=ALL
4638521,ca.proc.d.2015-05-11.16839.145,2015-05-11,55c46957-54e9-422a-8afd-7c709bcf16a0,9281,"Mr. John Barlow (Macleod, CPC)",,Oral Questions,Employment,,"Mr. Speaker, Canada needs more than one million new skilled workers over the next decade. Unfortunately, there are still many young people who are looking for jobs.
Can the Minister of Employment and Social Development update the House on what our government is doing to ensure that young Canadians have every opportunity to receive the skills they need for the good, high-paying, quality jobs that are available?",Conservative,Macleod,John Barlow,
4638522,ca.proc.d.2015-05-11.16839.146,2015-05-11,ad4032f2-6bb1-497b-b146-f321cfb71ba9,233,"Hon. Pierre Poilievre (Minister of Employment and Social Development and Minister for Democratic Reform, CPC)",,Oral Questions,Employment,,"Mr. Speaker, for years, limousine Liberals and champagne socialists turned their noses up at the trades. When we took office, there were not programs to help young people get into the skilled trades. There were plenty of grants for university, but none for apprentices, so we brought in the Canada apprentice grant. We have given out half a million of these grants that help young people get their skills and get their ticket so they can practise in 57 Red Seal trades that are in extremely high demand.
We are going to need one million skilled workers over the next seven years, and our government is giving the grants to the young people to fill those jobs.",Conservative,Nepean--Carleton,Pierre Poilievre,http://www.parl.gc.ca/parlinfo/Files/Parliamentarian.aspx?Item=ad4032f2-6bb1-497b-b146-f321cfb71ba9&Language=E&Section=ALL
4638523,ca.proc.d.2015-05-11.16839.147,2015-05-11,4b9cf7c8-d5db-4efa-a24e-c26afde48cc3,232,"Mr. Louis Plamondon (Bas-Richelieu—Nicolet—Bécancour, BQ)",,Oral Questions,Marine Transportation,,"Mr. Speaker, the St. Lawrence is more than a waterway. It is a great conduit of Quebec's history and development, but the federal government could not care less about it.
For example, in Beauharnois, the wreck of the Kathryn Spirit has been on the verge of splitting open since 2011, but nothing is being done. Supertankers are docking at the Tracy terminal even though ships one-tenth their size have broken their moorings during loading. Moreover, neither safety at the handling facilities nor the storm lines are up to standard.
Will the Minister of Transport finally do something to protect the river, make up for the federal government's blatant carelessness and step up to her marine transportation responsibilities—",Bloc Québécois,Bas-Richelieu--Nicolet--Bécancour,Louis Plamondon,http://www.parl.gc.ca/parlinfo/Files/Parliamentarian.aspx?Item=4b9cf7c8-d5db-4efa-a24e-c26afde48cc3&Language=E&Section=ALL
4638524,ca.proc.d.2015-05-11.16839.148,2015-05-11,6519cfba-0080-419d-baa9-8ae6e56d032f,256,The Speaker,,Oral Questions,Marine Transportation,,Order. The hon. Minister of Transport.,Conservative,Regina--Qu'Appelle,Andrew Scheer,http://www.parl.gc.ca/parlinfo/Files/Parliamentarian.aspx?Item=6519cfba-0080-419d-baa9-8ae6e56d032f&Language=E&Section=ALL
4638525,ca.proc.d.2015-05-11.16839.149,2015-05-11,b6808e95-1c75-4909-ab86-319d3519016a,579,"Hon. Lisa Raitt (Minister of Transport, CPC)",,Oral Questions,Marine Transportation,,"Mr. Speaker, this government is very proud of its work and its history with respect to the St. Lawrence Seaway. It is an incredibly important lifeline into the heart of Canada's hinterland, and indeed, it allows us to move goods in a very efficient manner all the way into the United States from the ports in the Great Lakes.
Of course we look after it. We invest heavily with respect to the St. Lawrence Seaway and all of the ports along the river as well. Montreal, Quebec, and Trois-Rivières have all seen significant investment by this government, and we will continue to make sure that we look out for their best interests.",Conservative,Halton,Lisa Raitt,http://www.parl.gc.ca/parlinfo/Files/Parliamentarian.aspx?Item=b6808e95-1c75-4909-ab86-319d3519016a&Language=E&Section=ALL
4638526,ca.proc.d.2015-05-11.16839.150,2015-05-11,f7899969-1755-480c-b74d-a9afeb018b7b,552,"Mr. Scott Andrews (Avalon, Ind.)",,Oral Questions,Fisheries and Oceans,,"Mr. Speaker, last Friday afternoon, inshore crab fishers in areas 8A and 9A were informed that they must relocate their crab pots from specific coordinates this week to make way for the laying of a subsea cable. These fishers are concerned about the potential damage to the environment and to the crab habitat. The timing could not be worse. It is halfway through the season. Some crab are spawning, and the potential destruction to gear could be costly.
Could the Minister of Fisheries and Oceans act immediately to stop this cable from being laid on the ocean floor while there are pots in the water, and will she share the information DFO has on the potential destruction of the crab habitat?",Independent,Avalon,Scott Andrews,http://www.parl.gc.ca/parlinfo/Files/Parliamentarian.aspx?Item=f7899969-1755-480c-b74d-a9afeb018b7b&Language=E&Section=ALL
4638527,ca.proc.d.2015-05-11.16839.151,2015-05-11,70388a77-892d-4a62-b707-aef2a521b436,556,"Hon. Gail Shea (Minister of Fisheries and Oceans, CPC)",,Oral Questions,Fisheries and Oceans,,"Mr. Speaker, I will look into the matter and get back to the member promptly.",Conservative,Egmont,Gail Shea,http://www.parl.gc.ca/parlinfo/Files/Parliamentarian.aspx?Item=70388a77-892d-4a62-b707-aef2a521b436&Language=E&Section=ALL
4638528,ca.proc.d.2015-05-11.16839.152,2015-05-11,8131817f-bf86-4739-9a70-6ef9de6f11b6,23,"Mr. André Bellavance (Richmond—Arthabaska, Ind.)",,Oral Questions,Employment,,"Mr. Speaker, the government claims that the changes to the temporary foreign worker program do not affect the farming sector. However, the Fondation des entreprises en recrutement de main-d'oeuvre agricole étrangère tells us that processing companies are having to dramatically reduce the number of foreign workers they hire and that the maximum stay for Guatemalan workers, who make up half the foreign agricultural workers in Quebec, has been reduced from 48 months to 24 months.
Does the minister realize that these measures are truly hurting Quebec's agri-food sector and consumers, who will have to foot the bill at the end of the day?",Independent,Richmond--Arthabaska,André Bellavance,http://www.parl.gc.ca/parlinfo/Files/Parliamentarian.aspx?Item=8131817f-bf86-4739-9a70-6ef9de6f11b6&Language=E&Section=ALL
4638529,ca.proc.d.2015-05-11.16839.153,2015-05-11,ad4032f2-6bb1-497b-b146-f321cfb71ba9,233,"Hon. Pierre Poilievre (Minister of Employment and Social Development and Minister for Democratic Reform, CPC)",,Oral Questions,Employment,,"Mr. Speaker, a special temporary foreign worker program already exists for the farming industry. The farming industry aside, we want Quebeckers to be first in line for jobs in Quebec, and we will never allow the temporary foreign worker program to replace Quebec workers. Quebeckers are our priority. Quebeckers first, Quebeckers above all.",Conservative,Nepean--Carleton,Pierre Poilievre,http://www.parl.gc.ca/parlinfo/Files/Parliamentarian.aspx?Item=ad4032f2-6bb1-497b-b146-f321cfb71ba9&Language=E&Section=ALL
4638530,ca.proc.d.2015-05-11.16839.154,2015-05-11,fe517b95-bc62-4fe8-96aa-998994aefd48,173,"Mr. Tom Lukiwski (Parliamentary Secretary to the Leader of the Government in the House of Commons, CPC)",,Routine Proceedings,Government Response to Petitions,,"Mr. Speaker, pursuant to Standing Order 36(8), I have the honour to table, in both official languages, the government's responses to 34 petitions.",Conservative,Regina--Lumsden--Lake Centre,Tom Lukiwski,http://www.parl.gc.ca/parlinfo/Files/Parliamentarian.aspx?Item=fe517b95-bc62-4fe8-96aa-998994aefd48&Language=E&Section=ALL
4638531,ca.proc.d.2015-05-11.16839.155,2015-05-11,d3b34b92-4b9c-4beb-9c3b-dd6146fb8b2c,65,"Mr. David Christopherson (Hamilton Centre, NDP)",,Routine Proceedings,Committees of the House,Public Accounts,"Mr. Speaker, I have the honour to present, in both official languages, the following reports from the Standing Committee on Public Accounts: the 17th report, on Chapter 5, Support to the Automotive Sector, of the Fall 2014 report of the Auditor General of Canada, and the 18th report, on Main Estimates 2015-16, Vote 1, under Auditor General, and to report the same.
Pursuant to Standing Order 109 of the House of Commons, the committee requests that the government table a comprehensive response for the 17th report.",New Democratic Party,Hamilton Centre,David Christopherson,http://www.parl.gc.ca/parlinfo/Files/Parliamentarian.aspx?Item=d3b34b92-4b9c-4beb-9c3b-dd6146fb8b2c&Language=E&Section=ALL
4638532,ca.proc.d.2015-05-11.16839.156,2015-05-11,9afd15e3-d6df-4779-ba0f-5a305ebb77b5,268,"Mrs. Joy Smith (Kildonan—St. Paul, CPC)",,Routine Proceedings,Petitions,Assisted Suicide,"Mr. Speaker, today I would like to present to the House hundreds of signatures against physician-assisted suicide. It is noted that in the state of Oregon, where assisted suicide is legal, patients desiring treatment under the government's health plan have been offered assisted suicide instead. People across our country are very concerned about assisted suicide and the path it may lead down for very vulnerable populations.",Conservative,Kildonan--St. Paul,Joy Smith,http://www.parl.gc.ca/parlinfo/Files/Parliamentarian.aspx?Item=9afd15e3-d6df-4779-ba0f-5a305ebb77b5&Language=E&Section=ALL
4638533,ca.proc.d.2015-05-11.16839.157,2015-05-11,9bcb731e-774b-4fe3-bb03-8c92f59eaa6c,1823,"Ms. Alexandrine Latendresse (Louis-Saint-Laurent, NDP)",,Routine Proceedings,Petitions,Taxation,"Mr. Speaker, today I am pleased to present a number of petitions with hundreds of signatures from people opposed to the federal tax on feminine hygiene products. This is an important cause because this tax is fundamentally sexist. These products are essential for half the population in our society. They are not optional.
We are very pleased to know that this evening the government will be supporting the motion the NDP moved on this issue.",New Democratic Party,Louis-Saint-Laurent,Alexandrine Latendresse,http://www.parl.gc.ca/parlinfo/Files/Parliamentarian.aspx?Item=9bcb731e-774b-4fe3-bb03-8c92f59eaa6c&Language=E&Section=ALL
4638534,ca.proc.d.2015-05-11.16839.158,2015-05-11,44647433-13cb-467e-8632-d49b131d5bb6,166,"Hon. Dominic LeBlanc (Beauséjour, Lib.)",,Routine Proceedings,Petitions,Agriculture,"Mr. Speaker, I have the honour to present a petition circulated in my riding by a group called Development and Peace. This group has done a tremendous amount of good, not just in New Brunswick, but around the world. It has collected the signatures of people living primarily in Kent County and the Sainte-Marie, Saint-Antoine and Shediac areas.
The petition calls on the government to take into consideration small farmers in its international aid and development policies. Many people are concerned that the policies of the federal government and other countries are detrimental to small-scale farmers in developing countries. They are calling on the government to correct this situation. ",Liberal,Beauséjour,Dominic LeBlanc,http://www.parl.gc.ca/parlinfo/Files/Parliamentarian.aspx?Item=44647433-13cb-467e-8632-d49b131d5bb6&Language=E&Section=ALL
4638535,ca.proc.d.2015-05-11.16839.159,2015-05-11,eb8710eb-e6dd-4c04-9d9a-60e7c8503565,3139,"Mr. Kennedy Stewart (Burnaby—Douglas, NDP)",,Routine Proceedings,Petitions,The Environment,"Mr. Speaker, I rise today to present a petition from constituents opposed to the Kinder Morgan pipeline. These constituents in Burnaby and across British Columbia are angry about the Conservatives' attempt to force this through Burnaby, as well as the Liberal support for this pipeline. ",New Democratic Party,Burnaby--Douglas,Kennedy Stewart,http://www.parl.gc.ca/parlinfo/Files/Parliamentarian.aspx?Item=eb8710eb-e6dd-4c04-9d9a-60e7c8503565&Language=E&Section=ALL
4638536,ca.proc.d.2015-05-11.16839.160,2015-05-11,e6d671ec-9039-4ed6-bd6f-cca3ddd257e1,8790,"Mr. Ted Hsu (Kingston and the Islands, Lib.)",,Routine Proceedings,Petitions,Pensions,"Mr. Speaker, I have a petition today signed by constituents in Kingston, Ontario, and surrounding communities. It asks parliamentarians to recognize that raising the retirement age from 65 to 67 years will cost many people a lot of retirement benefits, especially the lowest-income seniors. The two years they will miss will cost lowest-income individuals over $30,000 and couples over $50,000. At the same time, the government is introducing tax changes that would benefit the rich more.
Instead of changing the tax system to benefit the rich more, my constituents are calling on the government to first reduce the retirement age back to 65 to protect our lowest-income seniors in the years to come.",Liberal,Kingston and the Islands,Ted Hsu,http://www.parl.gc.ca/parlinfo/Files/Parliamentarian.aspx?Item=e6d671ec-9039-4ed6-bd6f-cca3ddd257e1&Language=E&Section=ALL
4638537,ca.proc.d.2015-05-11.16839.161,2015-05-11,578e32b7-b45f-41d4-aa62-4823f5b3ee20,8659,"Ms. Marie-Claude Morin (Saint-Hyacinthe—Bagot, NDP)",,Routine Proceedings,Petitions,Taxation,"Mr. Speaker, today I have the honour to table a petition signed by hundreds of Canadians supporting the abolition of a tax on feminine hygiene products, which quite frankly is rather sexist.
As one of my colleagues said earlier, these are essential products for half the population. I am pleased to table a petition addressing this issue.",New Democratic Party,Saint-Hyacinthe--Bagot,Marie-Claude Morin,http://www.parl.gc.ca/parlinfo/Files/Parliamentarian.aspx?Item=578e32b7-b45f-41d4-aa62-4823f5b3ee20&Language=E&Section=ALL
4638538,ca.proc.d.2015-05-11.16839.162,2015-05-11,8826a32c-2e29-49be-b6e2-c1f10363639b,440,"Ms. Irene Mathyssen (London—Fanshawe, NDP)",,Routine Proceedings,Petitions,Taxation,"Mr. Speaker, I too have a petition that calls upon the Government of Canada to end the tax on menstrual hygiene products, because they are essential products. They are not a luxury, and it creates difficulty for many women and girls in this country.
The petitioners are calling on the government to end the GST on feminine hygiene products.",New Democratic Party,London--Fanshawe,Irene Mathyssen,http://www.parl.gc.ca/parlinfo/Files/Parliamentarian.aspx?Item=8826a32c-2e29-49be-b6e2-c1f10363639b&Language=E&Section=ALL
4638539,ca.proc.d.2015-05-11.16839.163,2015-05-11,21582cac-ecab-43f1-a06d-d00be71b0832,8582,"Mr. Jonathan Genest-Jourdain (Manicouagan, NDP)",,Routine Proceedings,Petitions,Agriculture,"Mr. Speaker, I would like to submit to the House three very similar petitions about the need for the Government of Canada to adopt international aid policies that support small farmers, especially women, and recognize their vital role in the struggle against hunger and poverty. ",New Democratic Party,Manicouagan,Jonathan Genest-Jourdain,http://www.parl.gc.ca/parlinfo/Files/Parliamentarian.aspx?Item=21582cac-ecab-43f1-a06d-d00be71b0832&Language=E&Section=ALL
4638540,ca.proc.d.2015-05-11.16839.164,2015-05-11,cedf1659-ebb1-4f26-b723-5c7c5353988b,573,"Mrs. Carol Hughes (Algoma—Manitoulin—Kapuskasing, NDP)",,Routine Proceedings,Petitions,Taxation,"Mr. Speaker, I am also pleased to rise in the House to table petitions to remove the GST on menstrual hygiene products. This is causing some financial hardship for many Canadians, given the fact that this is an essential product that should not have GST attached to it.
We are certainly hoping that the government will keep its word and support the opposition day motion to remove such a tax.",New Democratic Party,Algoma--Manitoulin--Kapuskasing,Carol Hughes,http://www.parl.gc.ca/parlinfo/Files/Parliamentarian.aspx?Item=cedf1659-ebb1-4f26-b723-5c7c5353988b&Language=E&Section=ALL
4638541,ca.proc.d.2015-05-11.16839.165,2015-05-11,4efcc2e2-bd91-4234-b907-a24838d4f1aa,1371,"Ms. Christine Moore (Abitibi—Témiscamingue, NDP)",,Routine Proceedings,Petitions,Taxation,"Mr. Speaker, I am pleased to present to the House a petition that calls for the elimination of the GST on feminine hygiene products. 
Back in the day, a long time ago, women used rags. At that time, feminine hygiene products likely would have been considered a luxury. However, we have come a long way since then, and I think that it is high time that the government removed the tax on these products, which are truly essential for women. This is an unfair tax that is detrimental to women.",New Democratic Party,Abitibi--Témiscamingue,Christine Moore,http://www.parl.gc.ca/parlinfo/Files/Parliamentarian.aspx?Item=4efcc2e2-bd91-4234-b907-a24838d4f1aa&Language=E&Section=ALL
4638542,ca.proc.d.2015-05-11.16839.166,2015-05-11,eaa6694f-1e20-4aae-ad3b-e694b0e12c59,9187,"Ms. Elizabeth May (Saanich—Gulf Islands, GP)",,Routine Proceedings,Petitions,The Environment,"Mr. Speaker, I rise today to present two petitions.
The first has over 475 signatures from residents within my riding and calls for an end to fracking. This is an important petition.",Green,Saanich--Gulf Islands,Elizabeth May,http://www.parl.gc.ca/parlinfo/Files/Parliamentarian.aspx?Item=eaa6694f-1e20-4aae-ad3b-e694b0e12c59&Language=E&Section=ALL
4638543,ca.proc.d.2015-05-11.16839.167,2015-05-11,eaa6694f-1e20-4aae-ad3b-e694b0e12c59,9187,"Ms. Elizabeth May (Saanich—Gulf Islands, GP)",,Routine Proceedings,Petitions,41st General Election,"Mr. Speaker, the second petition is from residents primarily in the Vancouver area, who continue to be concerned that we have not got to the bottom of the so-called robocall events that took place during the election of 2011. They would like an inquiry.",Green,Saanich--Gulf Islands,Elizabeth May,http://www.parl.gc.ca/parlinfo/Files/Parliamentarian.aspx?Item=eaa6694f-1e20-4aae-ad3b-e694b0e12c59&Language=E&Section=ALL
4638544,ca.proc.d.2015-05-11.16839.168,2015-05-11,fe517b95-bc62-4fe8-96aa-998994aefd48,173,"Mr. Tom Lukiwski (Parliamentary Secretary to the Leader of the Government in the House of Commons, CPC)",,Routine Proceedings,Questions on the Order Paper,,"Mr. Speaker, the following question will be answered today: No. 1131.",Conservative,Regina--Lumsden--Lake Centre,Tom Lukiwski,http://www.parl.gc.ca/parlinfo/Files/Parliamentarian.aspx?Item=fe517b95-bc62-4fe8-96aa-998994aefd48&Language=E&Section=ALL
4638545,ca.proc.d.2015-05-11.16839.169,2015-05-11,86dd8955-957c-4ff9-9a81-76305a0f26ac,421,Mr. Paul Dewar,,Routine Proceedings,Questions on the Order Paper,Question No. 1131," With regard to Canadian military operations in Iraq: (a) did the letter sent by the United States Department of Defence, received on September 19, 2014, proposing options for an additional Canadian contribution to the military operations against the Islamic State of Iraq and Syria (ISIS) in Iraq, specifically propose the deployment of Canadian air strike capabilities; (b) what alternative options did this letter propose; (c) how many direct requests for Canadian assistance were received from members of the US-led coalition against ISIS prior to October 3, 2014; (d) of the requests identified in (c), how many specifically requested the deployment of Canadian air strike capabilities; (e) has the government undertaken legal consultations regarding the potential deployment of Canadian Forces personnel or equipment in Syria; (f) what are the incremental costs of the military mission in Iraq to date; (g) what are the full costs of the military mission in Iraq to date; (h) when did the Government of Canada receive formal authorization from the Government of Iraq and the Kurdish Regional Government to conduct ground operations on Iraqi and Kurdish territory; (i) do these authorizations enable Canada to engage in ground combat operations on Iraqi or Kurdish territory; and (j) does Canada have a Status of Forces Agreement with Iraq governing the operations and liability of Canadian Forces on Iraqi territory? ",New Democratic Party,Ottawa Centre,Paul Dewar,http://www.parl.gc.ca/parlinfo/Files/Parliamentarian.aspx?Item=86dd8955-957c-4ff9-9a81-76305a0f26ac&Language=E&Section=ALL
