basepk,hid,speechdate,pid,opid,speakeroldname,speakerposition,maintopic,subtopic,subsubtopic,speechtext,speakerparty,speakerriding,speakername,speakerurl
4636593,ca.proc.d.2015-04-30.16813.168,2015-04-30,1d35e58c-52b0-42f0-a344-c31524b2d07a,589,"Mr. Paul Calandra (Parliamentary Secretary to the Prime Minister and for Intergovernmental Affairs, CPC)",,Oral Questions,Ethics,,"Mr. Speaker, I have already answered that question with respect to constitutional practice.
Having said that, of course, this is a party that fought tooth and nail when we were trying to bring accountability to the Senate. The Liberal Party tried to make victims out of these senators. We are doing just the opposite. Of course, it was the Liberal Party that appointed someone like disgraced senator Mac Harb, who owes the Canadian taxpayers $250,000. It was prime minister Trudeau who I believe appointed the senator from Puerto Vallarta who never sat in the Senate but was happy to collect his things. I do not recall him doing anything about that. Of course, there was Senator Lavigne. 
We are bringing accountability to it— ",Conservative,Oak Ridges--Markham,Paul Calandra,http://www.parl.gc.ca/parlinfo/Files/Parliamentarian.aspx?Item=1d35e58c-52b0-42f0-a344-c31524b2d07a&Language=E&Section=ALL
4636594,ca.proc.d.2015-04-30.16813.169,2015-04-30,02c2cb20-f27d-46a5-8e78-ab4b405bf07b,453,The Acting Speaker (Mr. Bruce Stanton),,Oral Questions,Ethics,,The hon. member for Malpeque.,Conservative,Simcoe North,Bruce Stanton,http://www.parl.gc.ca/parlinfo/Files/Parliamentarian.aspx?Item=02c2cb20-f27d-46a5-8e78-ab4b405bf07b&Language=E&Section=ALL
4636595,ca.proc.d.2015-04-30.16813.170,2015-04-30,a76af2a6-7a43-4f8f-a887-0d10b3a0a3c1,96,"Hon. Wayne Easter (Malpeque, Lib.)",,Oral Questions,Ethics,,"Mr. Speaker, the government knows absolutely nothing about accountability. 
Is the parliamentary secretary just afraid to answer the question? Even Nigel Wright told the Prime Minister's lawyer that he “will not communicate the [Prime Minister]’s view that ownership of property equates to residence...”. Was Wright hiding this information for good reason: because it goes against the Constitution? Is it not true that the Prime Minister wanted Duffy as a senator because he was the golden goose of Conservative fundraising? 
Why did the Prime Minister violate the Constitution for a Conservative fundraiser, and doing so wrongly?",Liberal,Malpeque,Wayne Easter,http://www.parl.gc.ca/parlinfo/Files/Parliamentarian.aspx?Item=a76af2a6-7a43-4f8f-a887-0d10b3a0a3c1&Language=E&Section=ALL
4636596,ca.proc.d.2015-04-30.16813.171,2015-04-30,1d35e58c-52b0-42f0-a344-c31524b2d07a,589,"Mr. Paul Calandra (Parliamentary Secretary to the Prime Minister and for Intergovernmental Affairs, CPC)",,Oral Questions,Ethics,,"Again, Mr. Speaker, the constitutional practice on this has been clear for almost 150 years, but it is awkward when that member asks a question about ethics when, of course, he was one of the members who was identified as having to return living expenses. I am not sure why they would have him ask this question. There are other people in the caucus who could ask it. 
The member for Vancouver Centre—but she has campaign debts outstanding, so she could not ask it. Maybe the leader could have asked it, but of course, he accepted speaking fees when he was a member of Parliament, so he could not ask that question. When we go down that—",Conservative,Oak Ridges--Markham,Paul Calandra,http://www.parl.gc.ca/parlinfo/Files/Parliamentarian.aspx?Item=1d35e58c-52b0-42f0-a344-c31524b2d07a&Language=E&Section=ALL
4636597,ca.proc.d.2015-04-30.16813.172,2015-04-30,02c2cb20-f27d-46a5-8e78-ab4b405bf07b,453,The Acting Speaker (Mr. Bruce Stanton),Interjection,Oral Questions,Ethics,,The hon. member for Surrey North.,Conservative,Simcoe North,Bruce Stanton,http://www.parl.gc.ca/parlinfo/Files/Parliamentarian.aspx?Item=02c2cb20-f27d-46a5-8e78-ab4b405bf07b&Language=E&Section=ALL
4636598,ca.proc.d.2015-04-30.16813.173,2015-04-30,8e00cb1e-2b6e-4836-8664-f50de4a195c2,9199,"Mr. Jasbir Sandhu (Surrey North, NDP)",,Oral Questions,Public Safety,,"Mr. Speaker, gang violence in Surrey has reached crisis levels. My community needs urgent action now from the government, but instead, yesterday Conservatives stood in the House and patted themselves on the back for a job well done. Last night, the minister was backpedalling, doing damage control, but he has still refused to make any concrete commitments. It is unacceptable to me. Surrey needs more resources, including youth gang prevention programs.
Will the government start immediately approving the 100 RCMP officers the city of Surrey has requested?",New Democratic Party,Surrey North,Jasbir Sandhu,http://www.parl.gc.ca/parlinfo/Files/Parliamentarian.aspx?Item=8e00cb1e-2b6e-4836-8664-f50de4a195c2&Language=E&Section=ALL
4636599,ca.proc.d.2015-04-30.16813.174,2015-04-30,7e517cde-1b3a-46c1-afdb-4ddddeec7b81,1037,"Ms. Roxanne James (Parliamentary Secretary to the Minister of Public Safety and Emergency Preparedness, CPC)",,Oral Questions,Public Safety,,"Mr. Speaker, when it comes to gang violence, I think the member was here yesterday when I brought forward the good news that the government had invested $2.8 million in crime prevention in Surrey alone.
Having said that, I am very proud of our government's actions in tackling crime. We have actually passed more than 30 tough-on-crime policies. It is only this government that stands for the protection of all Canadians.
I would like to ask that member how many of those policies that we passed he actually voted for.",Conservative,Scarborough Centre,Roxanne James,http://www.parl.gc.ca/parlinfo/Files/Parliamentarian.aspx?Item=7e517cde-1b3a-46c1-afdb-4ddddeec7b81&Language=E&Section=ALL
4636600,ca.proc.d.2015-04-30.16813.175,2015-04-30,ee8f6ddb-8734-41d4-9d72-00bff431336a,9166,"Ms. Jinny Jogindera Sims (Newton—North Delta, NDP)",,Oral Questions,Public Safety,,"Mr. Speaker, there should be no more excuses and no more empty promises.
The city and the province are waiting for the government's approval for 100 new RCMP officers. The people of Surrey need more police on the streets now. They need more gang prevention and drug crime prevention funding.
Conservatives' self-congratulation for their failures is not going to fix the problem. The violence on our streets is real, and the government needs to take real action.
Will the minister commit, here and now, to approve the new officers and resources, and provide clear timelines for when they will arrive?",New Democratic Party,Newton--North Delta,Jinny Sims,http://www.parl.gc.ca/parlinfo/Files/Parliamentarian.aspx?Item=ee8f6ddb-8734-41d4-9d72-00bff431336a&Language=E&Section=ALL
4636601,ca.proc.d.2015-04-30.16813.176,2015-04-30,7e517cde-1b3a-46c1-afdb-4ddddeec7b81,1037,"Ms. Roxanne James (Parliamentary Secretary to the Minister of Public Safety and Emergency Preparedness, CPC)",,Oral Questions,Public Safety,,"Mr. Speaker, of course our Conservative government has taken strong action to keep British Columbians and all Canadians safe.
It is very interesting that they are standing here in the House asking for more resources when in fact this government has increased resources for the RCMP seven times, and seven times the member who asked that question voted against it.",Conservative,Scarborough Centre,Roxanne James,http://www.parl.gc.ca/parlinfo/Files/Parliamentarian.aspx?Item=7e517cde-1b3a-46c1-afdb-4ddddeec7b81&Language=E&Section=ALL
4636602,ca.proc.d.2015-04-30.16813.177,2015-04-30,62bfd797-8d32-425b-91b1-1422ca16694f,611,"Mr. Blake Richards (Wild Rose, CPC)",,Oral Questions,Taxation,,"Mr. Speaker, I have spoken to thousands of hard-working parents in my riding about their child care choices and the cost of raising a family.
They have expressed their strong support for our new family tax cut and enhanced universal child care benefit that will make every single family, including single parents, better off. However, they are deeply concerned that the NDP and the Liberals would take that away from them.
Can the Minister of State for Social Development please outline how our balanced budget is providing real, tangible support to middle-class families?",Conservative,Wild Rose,Blake Richards,http://www.parl.gc.ca/parlinfo/Files/Parliamentarian.aspx?Item=62bfd797-8d32-425b-91b1-1422ca16694f&Language=E&Section=ALL
4636603,ca.proc.d.2015-04-30.16813.178,2015-04-30,9d3d2220-818c-494e-8d58-29f7cee7b65d,600,"Hon. Candice Bergen (Minister of State (Social Development), CPC)",,Oral Questions,Taxation,,"Mr. Speaker, the member for Wild Rose is correct. His constituents need to be worried about the NDP and the Liberals and what they would do given the chance.
We are giving benefits to every family with children in this country. What the NDP does is insult families when they do not use licensed daycare, and 90% of them do not. We respect what families decide to do in terms of looking after their children.
That is why we are giving every family with kids $160 for each child under the age of six, $60 for every child over the age seven, because we believe that money belongs to Canadian families, not to bureaucracies, not to unions, not to government coffers.",Conservative,Portage--Lisgar,Candice Bergen,http://www.parl.gc.ca/parlinfo/Files/Parliamentarian.aspx?Item=9d3d2220-818c-494e-8d58-29f7cee7b65d&Language=E&Section=ALL
4636604,ca.proc.d.2015-04-30.16813.179,2015-04-30,6bde42a3-d07c-4c1f-b9d4-9e14a124f465,89,"Hon. Stéphane Dion (Saint-Laurent—Cartierville, Lib.)",,Oral Questions,Employment,,"Mr. Speaker, the Conservatives' inconsistent management approach has made a terrible mess of the temporary foreign worker program.
After leaving this program wide open to abuse, the Conservatives are now going to the other extreme and closing the floodgates to the point where employers are being denied workers they legitimately need to keep our economy going. The Quebec government and the Chambre de commerce du Québec are condemning this mess and have every right to seek to negotiate terms. 
When will the Conservatives stop hurting the economy with their incompetence and arrogance?",Liberal,Saint-Laurent--Cartierville,Stéphane Dion,http://www.parl.gc.ca/parlinfo/Files/Parliamentarian.aspx?Item=6bde42a3-d07c-4c1f-b9d4-9e14a124f465&Language=E&Section=ALL
4636605,ca.proc.d.2015-04-30.16813.180,2015-04-30,ad4032f2-6bb1-497b-b146-f321cfb71ba9,233,"Hon. Pierre Poilievre (Minister of Employment and Social Development and Minister for Democratic Reform, CPC)",,Oral Questions,Employment,,"Mr. Speaker, Quebec has known about these changes since June 2014, and we have spoken with the Government of Quebec about them since that announcement was made.
However, 143,000 Quebeckers have been receiving employment insurance benefits this year and they need jobs. Jobs in Quebec should be going to Quebeckers. It is shameful that the Liberal Party wants to take jobs away from Quebeckers and give them to temporary foreign workers. That is completely shameful.",Conservative,Nepean--Carleton,Pierre Poilievre,http://www.parl.gc.ca/parlinfo/Files/Parliamentarian.aspx?Item=ad4032f2-6bb1-497b-b146-f321cfb71ba9&Language=E&Section=ALL
4636606,ca.proc.d.2015-04-30.16813.181,2015-04-30,d00c3703-619a-496a-8369-0e113da41c9f,405,"Mr. Dennis Bevington (Northwest Territories, NDP)",,Oral Questions,Foreign Affairs,,"Mr. Speaker, Canada's two-year reign over the Arctic Council has been labelled a failure by the international community.
Climate change is one of the greatest threats to the north, and the Conservatives chose to ignore it. The United States have taken charge and declared that the Arctic Council will return to critical issues, like the impact of Arctic climate change, the development of renewable energy, public education, monitoring ocean acidification.
Why did the government waste two years of Arctic Council time and spoil its efforts on the international stage?",New Democratic Party,Northwest Territories,Dennis Bevington,http://www.parl.gc.ca/parlinfo/Files/Parliamentarian.aspx?Item=d00c3703-619a-496a-8369-0e113da41c9f&Language=E&Section=ALL
4636607,ca.proc.d.2015-04-30.16813.182,2015-04-30,b42374fa-e181-4337-93e9-2a5c41eb5d1e,212,"Hon. Rob Nicholson (Minister of Foreign Affairs, CPC)",,Oral Questions,Foreign Affairs,,"Mr. Speaker, I do not know where this member has been on this file, but we have championed a program of economic development and environmental sustainability.
This hon. member said something about a failure. I was at that conference. Every single permanent member there praised our government and the Minister of the Environment for her chairmanship of the Arctic Council.
He is the only one, and they are the only ones, who are questioning this. Nobody else is.",Conservative,Niagara Falls,Rob Nicholson,http://www.parl.gc.ca/parlinfo/Files/Parliamentarian.aspx?Item=b42374fa-e181-4337-93e9-2a5c41eb5d1e&Language=E&Section=ALL
4636608,ca.proc.d.2015-04-30.16813.183,2015-04-30,7a4f8db3-76e7-4e83-ab76-883371f0f4d2,8975,"Mr. Lawrence Toet (Elmwood—Transcona, CPC)",,Oral Questions,Foreign Affairs,,"Mr. Speaker, our Conservative government, under the leadership of this Prime Minister, has been unequivocal in our support for Ukraine. 
Whether it takes 5 months or 50 years, we will never, ever recognize the illegal annexation and occupation of Crimea, which is sovereign Ukrainian territory.
Can the Minister of Foreign Affairs please update the House on the most recent measures our government has taken to support Ukraine and its territorial integrity?",Conservative,Elmwood--Transcona,Lawrence Toet,http://www.parl.gc.ca/parlinfo/Files/Parliamentarian.aspx?Item=7a4f8db3-76e7-4e83-ab76-883371f0f4d2&Language=E&Section=ALL
4636609,ca.proc.d.2015-04-30.16813.184,2015-04-30,b42374fa-e181-4337-93e9-2a5c41eb5d1e,212,"Hon. Rob Nicholson (Minister of Foreign Affairs, CPC)",,Oral Questions,Foreign Affairs,,"Mr. Speaker, Canada strongly condemns the actions of the combined Russian separatist forces, and we remain concerned about what appears to be Vladimir Putin's command and control of militants in occupied Ukraine.
Today, I was pleased to announce, along with the Ukrainian Foreign Minister, Pavlo Klimkin, Canadian funding for a series of projects to strengthen human rights and improve Ukraine's business environment.
This is in addition to Canada's significant military contribution, NATO's assurance packages, and the world's strongest sanctions.
We should make no mistake: under the leadership of this Prime Minister, Canada stands with Ukraine.",Conservative,Niagara Falls,Rob Nicholson,http://www.parl.gc.ca/parlinfo/Files/Parliamentarian.aspx?Item=b42374fa-e181-4337-93e9-2a5c41eb5d1e&Language=E&Section=ALL
4636610,ca.proc.d.2015-04-30.16813.185,2015-04-30,eaa6694f-1e20-4aae-ad3b-e694b0e12c59,9187,"Ms. Elizabeth May (Saanich—Gulf Islands, GP)",,Oral Questions,Public Safety,,"Mr. Speaker, let me parenthetically agree entirely with the member for Northwest Territories. Canada's performance as chair of the Arctic Council was a disgrace.
My question is related to Bill C-51 and the 94th application of time allocation. Earlier today, the government House leader made the absurd claim that I had not read Bill C-51, which I assure the House I have studied assiduously, and I doubt that the hon. member has.
I would like to know if the government House leader knows the difference between oversight, review, and issuing a warrant. They are three entirely different concepts. Bill C-51 does not contain any judicial oversight.",Green,Saanich--Gulf Islands,Elizabeth May,http://www.parl.gc.ca/parlinfo/Files/Parliamentarian.aspx?Item=eaa6694f-1e20-4aae-ad3b-e694b0e12c59&Language=E&Section=ALL
4636611,ca.proc.d.2015-04-30.16813.186,2015-04-30,aa58e8f5-4a46-4c79-8e97-b9ebe28c9d9a,295,"Hon. Peter Van Loan (Leader of the Government in the House of Commons, CPC)",,Oral Questions,Public Safety,,"Mr. Speaker, when we introduced this legislation and drafted it, we had a choice. We could ask politicians after the fact to examine the activities of the Canadian Security Intelligence Service with regard to its new powers, or we could give that power to judges to examine, in advance before acts were undertaken, whether they were appropriate, and if they thought so, to grant a warrant. 
That is the choice we made. We chose to have judges review these matters rather than politicians.",Conservative,York--Simcoe,Peter Van Loan,http://www.parl.gc.ca/parlinfo/Files/Parliamentarian.aspx?Item=aa58e8f5-4a46-4c79-8e97-b9ebe28c9d9a&Language=E&Section=ALL
4636612,ca.proc.d.2015-04-30.16813.187,2015-04-30,27d16187-5e2a-448b-b76a-fd6229606f1b,8589,"Mr. Jean-François Fortin (Haute-Gaspésie—La Mitis—Matane—Matapédia, FD)",,Oral Questions,Employment,,"Mr. Speaker, the Minister of Employment should look outside and see that summer is just around the corner. It is a crucial time for many businesses that will need many workers, including temporary foreign workers, to operate.
This morning, Quebec minister Kathleen Weil criticized Ottawa's refusal to understand Quebec's needs and to modify the current criteria of the temporary foreign worker program, which will penalize many employers and sectors of activity.
Does the minister realize that his refusal to fix the program will hurt the economy and inevitably the workers he claims he is protecting? ",Forces et Démocratie,Haute-Gaspésie--La Mitis--Matane--Matapédia,Jean-François Fortin,http://www.parl.gc.ca/parlinfo/Files/Parliamentarian.aspx?Item=27d16187-5e2a-448b-b76a-fd6229606f1b&Language=E&Section=ALL
4636613,ca.proc.d.2015-04-30.16813.188,2015-04-30,ad4032f2-6bb1-497b-b146-f321cfb71ba9,233,"Hon. Pierre Poilievre (Minister of Employment and Social Development and Minister for Democratic Reform, CPC)",,Oral Questions,Employment,,"Mr. Speaker, 143,000 Quebeckers received employment insurance in 2013. Employers should hire those Quebeckers instead of hiring temporary foreign workers. Quebeckers are entitled to work in their own province.
We will protect this right by ensuring that employers look to hire Quebeckers and not just temporary foreign workers.",Conservative,Nepean--Carleton,Pierre Poilievre,http://www.parl.gc.ca/parlinfo/Files/Parliamentarian.aspx?Item=ad4032f2-6bb1-497b-b146-f321cfb71ba9&Language=E&Section=ALL
4636614,ca.proc.d.2015-04-30.16813.189,2015-04-30,02c2cb20-f27d-46a5-8e78-ab4b405bf07b,453,The Acting Speaker (Mr. Bruce Stanton),,Oral Questions,Employment,,"That will bring question period to an end for today.
However, I would like to draw the attention of all hon. members to the upcoming centenary, on May 3, 2015, of Lieutenant Colonel John McCrae's iconic poem In Flanders Fields.
McCrae, a surgeon in the Canadian Field Artillery, was in charge of a field hospital during the second battle of Ypres in 1915. His friend and former student, Lieutenant Alexis Helmer, was killed in the battle. It was his burial among the poppies that in part inspired the poem, first published anonymously in the magazine Punch.
Over time, the poem has come to symbolize the collective mourning of all Canadians in remembrance of those who, in service of their country, have made the ultimate sacrifice for all of us.
Hon. members may have noticed that the words of McCrae's well-known poem are engraved in English and in French on two of the marble panels that line the walls of the Memorial Chamber.
This room is a reflection of the country’s profound sense of loss following the First World War and, like the poem, it has come to represent our nation’s immeasurable gratitude for all those who have died in service to Canada.
I am pleased to inform all hon. members that the Department of Veterans Affairs has given permission to modify the page-turning schedule of the First World War Book of Remembrance so that the page that bears the name of Lieutenant Colonel John McCrae will be displayed today, April 30.",Conservative,Simcoe North,Bruce Stanton,http://www.parl.gc.ca/parlinfo/Files/Parliamentarian.aspx?Item=02c2cb20-f27d-46a5-8e78-ab4b405bf07b&Language=E&Section=ALL
4636615,ca.proc.d.2015-04-30.16813.190,2015-04-30,02c2cb20-f27d-46a5-8e78-ab4b405bf07b,453,The Acting Speaker (Mr. Bruce Stanton),,Oral Questions,Presence in Gallery,,"I would also like to take this opportunity to acknowledge members of the clan McCrae, who are present today in the gallery.",Conservative,Simcoe North,Bruce Stanton,http://www.parl.gc.ca/parlinfo/Files/Parliamentarian.aspx?Item=02c2cb20-f27d-46a5-8e78-ab4b405bf07b&Language=E&Section=ALL
4636616,ca.proc.d.2015-04-30.16813.191,2015-04-30,,,,intervention,Oral Questions,Presence in Gallery,," Hear, hear!",,,Some hon. members,
4636617,ca.proc.d.2015-04-30.16813.192,2015-04-30,b41c3b7e-c64f-4415-9f58-79d7462e5d8e,146,"Mr. Peter Julian (Burnaby—New Westminster, NDP)",,Oral Questions,Business of the House,,"Mr. Speaker, I have bad news and good news.
The bad new is that today, the government sadly used a closure and time allocation motion for the 94th time to shut down debate on Bill C-51, which is a threat to our rights and freedoms.
The government even seems to want to move a 95th closure motion after question period. Unbelievable. This government will not allow debate.
The good news is that tomorrow is May 1. That means that there are only 170 days left in the life of the Conservative government. There are only 30 sitting days. What that means is that the damage the Conservative government is doing is going to start being repaired as of Oct 19, when an NDP government comes in and starts repairing all that the government has broken over the course of the last few years. That is good news for Canadians.
That being said, I would like to ask my hon. colleague, the government House leader, what will be on the government's agenda in the coming week.",New Democratic Party,Burnaby--New Westminster,Peter Julian,http://www.parl.gc.ca/parlinfo/Files/Parliamentarian.aspx?Item=b41c3b7e-c64f-4415-9f58-79d7462e5d8e&Language=E&Section=ALL
4636618,ca.proc.d.2015-04-30.16813.193,2015-04-30,aa58e8f5-4a46-4c79-8e97-b9ebe28c9d9a,295,"Hon. Peter Van Loan (Leader of the Government in the House of Commons, CPC)",,Oral Questions,Business of the House,,"Mr. Speaker, I admire the quality of optimism, and I know that hope springs eternal in my colleague's breast.
After this statement, we will complete the motion, pursuant to Standing Order 78, in relation to Bill C-51. After that, we will consider Bill C-46, the pipeline safety act at report stage, and then proceed to debate it at third reading. This bill would ensure that Canada's pipeline safety regime remains world class. That debate will continue next week, on Wednesday.
Tomorrow we will wrap up the second reading debate on Bill C-50, the citizen voting act. The House will have an opportunity later today, I hope, to deliberate on how that will proceed.
 Monday, we will conclude the report stage debate of Bill C-51, the Anti-terrorism Act, 2015. Our Conservative government takes all threats to the security of Canada and Canadians very seriously.
That is why we are moving forward with Bill C-51 and the crucial provisions contained in it to protect our national security. Third reading of this important bill will take place Tuesday.
Thursday, before question period, we will consider Bill S-3, the port state measures agreement implementation act at report stage, and hopefully, third reading. This bill passed at second reading with widespread support, and I am optimistic that third reading will be no different.
I understand that the Standing Committee on Transport, Infrastructure and Communities is meeting this afternoon to give clause-by-clause consideration to Bill C-52, the Safe and Accountable Rail Act. This bill would further strengthen Canada's rail safety regime and ensure that adequate compensation is available. If the committee finishes that work today, we will consider the bill at report stage and third reading after question period next Thursday.
At second reading, New Democrats spoke about the importance of passing this bill urgently and therefore I hope that they will see to letting this legislation pass next week, so that the Senate will have plenty of time to complete its consideration of the bill before the summer adjournment.",Conservative,York--Simcoe,Peter Van Loan,http://www.parl.gc.ca/parlinfo/Files/Parliamentarian.aspx?Item=aa58e8f5-4a46-4c79-8e97-b9ebe28c9d9a&Language=E&Section=ALL
4636619,ca.proc.d.2015-04-30.16813.194,2015-04-30,02c2cb20-f27d-46a5-8e78-ab4b405bf07b,453,The Acting Speaker (Mr. Bruce Stanton),,Oral Questions,Business of the House,,The Chair has notice of a question of privilege. We will proceed with that now.,Conservative,Simcoe North,Bruce Stanton,http://www.parl.gc.ca/parlinfo/Files/Parliamentarian.aspx?Item=02c2cb20-f27d-46a5-8e78-ab4b405bf07b&Language=E&Section=ALL
