basepk,hid,speechdate,pid,opid,speakeroldname,speakerposition,maintopic,subtopic,subsubtopic,speechtext,speakerparty,speakerriding,speakername,speakerurl
4628328,ca.proc.d.2015-02-20.16622.90,2015-02-20,4efcc2e2-bd91-4234-b907-a24838d4f1aa,1371,"Ms. Christine Moore (Abitibi—Témiscamingue, NDP)",,Oral Questions,Health,,"Mr. Speaker, the Conservatives' incompetence and flip-flop on the approval of citronella has had a negative impact on our economy.
A Quebec company lost more than $1 million, and some employees lost their jobs. The company was even forced to buy back stock from customers, in addition to paying fines.
This entire industry is in the process of rebuilding. This is amateur hour. 
How does the minister explain this whole mess?",New Democratic Party,Abitibi--Témiscamingue,Christine Moore,http://www.parl.gc.ca/parlinfo/Files/Parliamentarian.aspx?Item=4efcc2e2-bd91-4234-b907-a24838d4f1aa&Language=E&Section=ALL
4628329,ca.proc.d.2015-02-20.16622.91,2015-02-20,9c9a64e6-58f1-4367-9f49-93ad31744c96,612,"Mrs. Cathy McLeod (Parliamentary Secretary to the Minister of Health and for Western Economic Diversification, CPC)",,Oral Questions,Health,,"Mr. Speaker, our government is committed to ensuring that Canadians have access to a wide array of choice for natural health products, and Health Canada's oversight recognizes the lower risk of most natural health products. The department has approved thousands of products as being safe and effective.
Regarding citronella, the department has announced a review to ensure that these products have the proper level of oversight, and this review will ensure that Canadians have access to safe and effective products.",Conservative,Kamloops--Thompson--Cariboo,Cathy McLeod,http://www.parl.gc.ca/parlinfo/Files/Parliamentarian.aspx?Item=9c9a64e6-58f1-4367-9f49-93ad31744c96&Language=E&Section=ALL
4628330,ca.proc.d.2015-02-20.16622.92,2015-02-20,c5378648-5d94-4645-bc05-339090e1077b,577,"Ms. Kirsty Duncan (Etobicoke North, Lib.)",,Oral Questions,International Development,,"Mr. Speaker, as the fourth anniversary of the Syria crisis approaches, 5.6 million children are in need of assistance. Will the Minister of International Development personally attend the donor conference in Kuwait on March 31, and will he make a meaningful contribution on behalf of all Canadians to champion the children of Syria?",Liberal,Etobicoke North,Kirsty Duncan,http://www.parl.gc.ca/parlinfo/Files/Parliamentarian.aspx?Item=c5378648-5d94-4645-bc05-339090e1077b&Language=E&Section=ALL
4628331,ca.proc.d.2015-02-20.16622.93,2015-02-20,b7266d04-f318-4305-ab9f-580a06be7d08,587,"Ms. Lois Brown (Parliamentary Secretary to the Minister of International Development, CPC)",,Oral Questions,International Development,,"Mr. Speaker, I want to thank my colleague for that question. Indeed, the conference is coming up in March in Kuwait. We are still in consideration of whether or not the minister is going to attend that. However, I can tell the House that Canada has been one of the largest donors. It is the third-largest donor to the World Food Programme, helping the people of Syria and helping the people who are most vulnerable.
We will continue to assess the situation with our allies and continue to work with our partners.",Conservative,Newmarket--Aurora,Lois Brown,http://www.parl.gc.ca/parlinfo/Files/Parliamentarian.aspx?Item=b7266d04-f318-4305-ab9f-580a06be7d08&Language=E&Section=ALL
4628332,ca.proc.d.2015-02-20.16622.94,2015-02-20,0d8486f0-be42-41d4-ac82-c51a7f9c0fa9,72,"Hon. Irwin Cotler (Mount Royal, Lib.)",,Oral Questions,Foreign Affairs,,"Mr. Speaker, the imprisonment and cruel and inhumane treatment of Saudi blogger Raif Badawi continues to be met with outrage in Canada and around the world.
The government called for clemency, but calling for clemency does not guarantee that Raif Badawi and his lawyer will be immediately and unconditionally released, nor does it allow Raif to be reunited with his family in Quebec.
Will the government explicitly demand that these two individuals be released immediately and unconditionally and that Raif be reunited with his family here in Quebec?",Liberal,Mount Royal,Irwin Cotler,http://www.parl.gc.ca/parlinfo/Files/Parliamentarian.aspx?Item=0d8486f0-be42-41d4-ac82-c51a7f9c0fa9&Language=E&Section=ALL
4628333,ca.proc.d.2015-02-20.16622.95,2015-02-20,661a3062-86d1-4ba3-9e70-81c866aa2fc3,9,"Mr. David Anderson (Parliamentary Secretary to the Minister of Foreign Affairs and Consular, CPC)",,Oral Questions,Foreign Affairs,,"Mr. Speaker, the Canadian government considers the punishment of Mr. Badawi to be a violation of human dignity, and we continue to call for clemency in this case. 
The promotion and protection of human rights is an integral part of our Canadian foreign policy. Mr. Badawi is not a Canadian citizen, but we will continue to make our position known both publicly and through diplomatic channels. Our government has made representation, and it will continue to do that.",Conservative,Cypress Hills--Grasslands,David Anderson,http://www.parl.gc.ca/parlinfo/Files/Parliamentarian.aspx?Item=661a3062-86d1-4ba3-9e70-81c866aa2fc3&Language=E&Section=ALL
4628334,ca.proc.d.2015-02-20.16622.96,2015-02-20,288315ef-2fe8-48ad-8ae0-833ac097bac0,3658,"Mr. Philip Toone (Gaspésie—Îles-de-la-Madeleine, NDP)",,Oral Questions,Rail Transportation,,"Mr. Speaker, VIA Rail is caught in a vicious cycle. It has fewer customers as a result of bad service. The fewer customers it has, the less service it provides. The equipment and service in the east are pathetic. 
Parliament must regain control of this fundamental service and impose a governance and funding structure on VIA Rail, as has been done in the United States with Amtrak.
Will the Conservatives support a legislative framework for VIA Rail? Why are they treating passengers like second-class citizens?",New Democratic Party,Gaspésie--Îles-de-la-Madeleine,Philip Toone,http://www.parl.gc.ca/parlinfo/Files/Parliamentarian.aspx?Item=288315ef-2fe8-48ad-8ae0-833ac097bac0&Language=E&Section=ALL
4628335,ca.proc.d.2015-02-20.16622.97,2015-02-20,b6808e95-1c75-4909-ab86-319d3519016a,579,"Hon. Lisa Raitt (Minister of Transport, CPC)",,Oral Questions,Rail Transportation,,"Mr. Speaker, VIA Rail's primary objective is to provide safe and efficient passenger service, but it has to do it in as cost-effective a manner as possible. The government has supported VIA Rail significantly since 2006. In fact, $1 billion in investment has gone into this passenger rail service.
We always ask VIA Rail how it plans to increase ridership and how it plans to improve service. It is its job to get it done, and we expect it to do so.",Conservative,Halton,Lisa Raitt,http://www.parl.gc.ca/parlinfo/Files/Parliamentarian.aspx?Item=b6808e95-1c75-4909-ab86-319d3519016a&Language=E&Section=ALL
4628336,ca.proc.d.2015-02-20.16622.98,2015-02-20,640aa965-9166-4aa6-b864-278dd1071a10,119,"Mr. Yvon Godin (Acadie—Bathurst, NDP)",,Oral Questions,Justice,,"Mr. Speaker, the New Brunswick Court of Appeal has six judges. At present, there are three anglophone and two francophone judges. The Association des juristes d'expression française du Nouveau-Brunswick is justified in asking that the next judge be a francophone, so that both communities have equal representation.
Will the minister undertake to appoint a francophone to the New Brunswick Court of Appeal and promise not to pick from the list of Conservative organizers, as they did with Justice Richard Bell?",New Democratic Party,Acadie--Bathurst,Yvon Godin,http://www.parl.gc.ca/parlinfo/Files/Parliamentarian.aspx?Item=640aa965-9166-4aa6-b864-278dd1071a10&Language=E&Section=ALL
4628337,ca.proc.d.2015-02-20.16622.99,2015-02-20,46dccbed-4370-40f0-975f-d08fe1688aa2,177,"Hon. Peter MacKay (Minister of Justice and Attorney General of Canada, CPC)",,Oral Questions,Justice,,"Mr. Speaker, the member certainly understands that we must have a non-partisan judicial system. Judges are picked on the basis of their qualifications and merit. We are happy to continue that practice. I have confidence in the competence of the judicial system in New Brunswick, or anywhere else in Canada.",Conservative,Central Nova,Peter MacKay,http://www.parl.gc.ca/parlinfo/Files/Parliamentarian.aspx?Item=46dccbed-4370-40f0-975f-d08fe1688aa2&Language=E&Section=ALL
4628338,ca.proc.d.2015-02-20.16622.100,2015-02-20,55c46957-54e9-422a-8afd-7c709bcf16a0,9281,"Mr. John Barlow (Macleod, CPC)",,Oral Questions,Natural Resources,,"Mr. Speaker, we have an important opportunity to build on our record of responsible resource development while securing long-term security for all Canadians, which I think is particularly important for the people of my riding of Macleod. This is why our government is taking action to ensure that we benefit from the economic potential of our natural resources.
Can the Parliamentary Secretary to the Minister of Natural Resources update the House on the Prime Minister's exciting announcement yesterday?",Conservative,Macleod,John Barlow,
4628339,ca.proc.d.2015-02-20.16622.101,2015-02-20,78cd5419-2f3c-4798-9c5b-0e55843ef9fb,604,"Mrs. Kelly Block (Parliamentary Secretary to the Minister of Natural Resources, CPC)",,Oral Questions,Natural Resources,,"Mr. Speaker, I would like to thank the member for Macleod for that question.
Countries around the world are looking to do business with Canada because it offers the best fiscal conditions for secure energy supply. Yesterday's announcement by the Prime Minister reaffirmed our government's commitment to promoting Canada's resources on the world stage through the capital cost allowance for the emerging LNG industry.
In contrast to the high tax-and-spend agenda of the Liberals and the NDP, our low-tax plan is delivering results for Canadians by creating jobs and economic growth from coast to coast to coast.",Conservative,Saskatoon--Rosetown--Biggar,Kelly Block,http://www.parl.gc.ca/parlinfo/Files/Parliamentarian.aspx?Item=78cd5419-2f3c-4798-9c5b-0e55843ef9fb&Language=E&Section=ALL
4628340,ca.proc.d.2015-02-20.16622.102,2015-02-20,d282a075-d49f-40b7-ab6d-64455eb9a5a8,265,"Mr. Scott Simms (Bonavista—Gander—Grand Falls—Windsor, Lib.)",,Oral Questions,Fisheries and Oceans,,"Mr. Speaker, over the coming weeks, there are about to be severe cuts to the shrimp fishery in northeastern Newfoundland and Labrador for the entire province. This coming Monday, there is a large protest scheduled by citizens on Fogo Island. Specifically, they are going after the last-in, first-out policy. Recently the provincial government, their fellow Conservatives, said that if this policy exists, the inshore fishery will be devastated. 
Therefore, my question for the Minister of Fisheries and Oceans is this: Finally, will she eliminate the last-in, first-out policy and save our inshore fishery?",Liberal,Bonavista--Gander--Grand Falls--Windsor,Scott Simms,http://www.parl.gc.ca/parlinfo/Files/Parliamentarian.aspx?Item=d282a075-d49f-40b7-ab6d-64455eb9a5a8&Language=E&Section=ALL
4628341,ca.proc.d.2015-02-20.16622.103,2015-02-20,ccfa05f8-2114-48f1-9ff4-5434e3279acb,148,"Mr. Randy Kamp (Parliamentary Secretary to the Minister of Fisheries and Oceans, CPC)",,Oral Questions,Fisheries and Oceans,,"Mr. Speaker, I appreciate my colleague's interest in this issue. I can tell him that the minister is committed to balancing economic opportunity while promoting the sustainability of the northern shrimp fishery. Reductions to quotas are never easy, but our priority has to be sustainability.
The last-in, first-out policy has been part of this fishery since 1997, when it was introduced by the Liberal government. Under that policy, the new entrants received the vast majority of the new access with the understanding that if reductions were necessary in the future, the LIFO policy would be in effect.
It is our view that the terms agreed to previously need to be respected. ",Conservative,Pitt Meadows--Maple Ridge--Mission,Randy Kamp,http://www.parl.gc.ca/parlinfo/Files/Parliamentarian.aspx?Item=ccfa05f8-2114-48f1-9ff4-5434e3279acb&Language=E&Section=ALL
4628342,ca.proc.d.2015-02-20.16622.104,2015-02-20,6222fa27-d631-48b9-9cec-bd5d6c2de441,430,"Hon. Laurie Hawn (Edmonton Centre, CPC)",,Oral Questions,Veterans Affairs,,"Mr. Speaker, yesterday the Quebec government confirmed that the Ste. Anne's veterans hospital transfer is a hundred per cent ready to go, and it will be transferred at the beginning of 2016. 
Could the Parliamentary Secretary to the Minister of Veterans Affairs please update the House on the status of this project?",Conservative,Edmonton Centre,Laurie Hawn,http://www.parl.gc.ca/parlinfo/Files/Parliamentarian.aspx?Item=6222fa27-d631-48b9-9cec-bd5d6c2de441&Language=E&Section=ALL
4628343,ca.proc.d.2015-02-20.16622.105,2015-02-20,213c7c78-812a-4123-ac14-dc73da49de1f,435,"Mr. Pierre Lemieux (Parliamentary Secretary to the Minister of Veterans Affairs, CPC)",,Oral Questions,Veterans Affairs,,"Mr. Speaker, I thank the member for Edmonton Centre for his personal commitment to our veterans. 
Our government continues to work diligently with the Government of Quebec toward a successful transfer of the Ste-Anne-de-Bellevue veterans hospital while maintaining excellence in care for veterans in the language of their choice. 
Contrary to what the member for Lac-Saint-Louis and his federal Liberal Party claims, our government is standing up for veterans and delivering tangible results. Veterans can count on our government to ensure that our veterans have the best care available and to continue to support our veterans in every capacity. ",Conservative,Glengarry--Prescott--Russell,Pierre Lemieux,http://www.parl.gc.ca/parlinfo/Files/Parliamentarian.aspx?Item=213c7c78-812a-4123-ac14-dc73da49de1f&Language=E&Section=ALL
4628344,ca.proc.d.2015-02-20.16622.106,2015-02-20,137d51b0-f7d5-4ad7-9bc0-529314cc2d99,8538,"Mr. Claude Patry (Jonquière—Alma, BQ)",,Oral Questions,Intergovernmental Relations,,"Mr. Speaker, while the current Quebec government is hurting the regions by making ill-advised decisions to supposedly improve public finances, the fiscal imbalance between Ottawa and the provinces continues to grow. Between 2009 and 2013, Quebec lost $6.5 billion in federal transfers.
Will the government stop lining its own pockets at the expense of Quebec and the provinces, and will it restore transfers based on people's needs?",Bloc Québécois,Jonquière--Alma,Claude Patry,http://www.parl.gc.ca/parlinfo/Files/Parliamentarian.aspx?Item=137d51b0-f7d5-4ad7-9bc0-529314cc2d99&Language=E&Section=ALL
4628345,ca.proc.d.2015-02-20.16622.107,2015-02-20,f66407a4-934e-4c46-b524-b4dacd035ceb,613,"Mr. Andrew Saxton (Parliamentary Secretary to the Minister of Finance, CPC)",,Oral Questions,Intergovernmental Relations,,"Mr. Speaker, we are protecting transfers to provinces, and transfers for health and social programs continue to increase. The Liberals made drastic cuts to transfers to the provinces and the territories. We will never do that. We will ensure that every territory and province has the capacity to provide health care, education and other social services that families need.",Conservative,North Vancouver,Andrew Saxton,http://www.parl.gc.ca/parlinfo/Files/Parliamentarian.aspx?Item=f66407a4-934e-4c46-b524-b4dacd035ceb&Language=E&Section=ALL
4628346,ca.proc.d.2015-02-20.16622.108,2015-02-20,548690b8-3ef5-4bfa-b1ad-bb32de4dfaa1,607,"Mr. Brent Rathgeber (Edmonton—St. Albert, Ind.)",,Oral Questions,Citizenship and Immigration,,"Mr. Speaker, Maria Venancio was a Filipino temporary foreign worker who worked at a McDonald's Restaurant in Edmonton. In 2011, Ms. Venancio was biking to work and was struck by a motor vehicle, rendering her a paraplegic and therefore unable to work.
Under the rules of the temporary foreign worker program, as she is unable to work, she has no status and is currently facing deportation. Ms. Venancio has applied to become a permanent resident, but deporting her to the Phillippines while she is convalescent would seem to be inhumane and even un-Canadian. 
Why will the Minister of Immigration or the minister in charge of border services not intervene to protect an extremely vulnerable temporary foreign worker?",Independent,Edmonton--St. Albert,Brent Rathgeber,http://www.parl.gc.ca/parlinfo/Files/Parliamentarian.aspx?Item=548690b8-3ef5-4bfa-b1ad-bb32de4dfaa1&Language=E&Section=ALL
4628347,ca.proc.d.2015-02-20.16622.109,2015-02-20,0bb713a8-19fa-4695-8f26-64a5420953dc,8896,"Mr. Costas Menegakis (Parliamentary Secretary to the Minister of Citizenship and Immigration, CPC)",,Oral Questions,Citizenship and Immigration,,"Mr. Speaker, the member will know that because of privacy laws, I cannot speak to the specifics of this particular case. 
I will state this. Canada has one of the most fair and generous immigration systems in the world. With that said, we must ensure that we continue to welcome newcomers while respecting Canadian taxpayers at all times.",Conservative,Richmond Hill,Costas Menegakis,http://www.parl.gc.ca/parlinfo/Files/Parliamentarian.aspx?Item=0bb713a8-19fa-4695-8f26-64a5420953dc&Language=E&Section=ALL
4628348,ca.proc.d.2015-02-20.16622.110,2015-02-20,548690b8-3ef5-4bfa-b1ad-bb32de4dfaa1,607,"Mr. Brent Rathgeber (Edmonton—St. Albert, Ind.)",,Oral Questions,Public Safety,,"Mr. Speaker, the government claims to be cracking down on terrorists, and through Bill C-51, our security agencies are about to assume broad new powers. However, our security agencies lack the resources to carry out even their current mandates. Both the RCMP commissioner and the deputy CSIS director clearly told parliamentary committees last October as much, that a lack of resources makes tracking all extremists at all times simply impossible. Now we have learned that collectively, CSIS, the RCMP, and the Department of Defence have allowed $11 billion to go unspent and lapse. 
In its zeal to balance its budget in an election year, does the government not understand that increased security powers without adequate resources is an exercise in futility?",Independent,Edmonton--St. Albert,Brent Rathgeber,http://www.parl.gc.ca/parlinfo/Files/Parliamentarian.aspx?Item=548690b8-3ef5-4bfa-b1ad-bb32de4dfaa1&Language=E&Section=ALL
4628349,ca.proc.d.2015-02-20.16622.111,2015-02-20,7e517cde-1b3a-46c1-afdb-4ddddeec7b81,1037,"Ms. Roxanne James (Parliamentary Secretary to the Minister of Public Safety and Emergency Preparedness, CPC)",,Oral Questions,Public Safety,,"Mr. Speaker, in actual fact, we have increased resources to our national security agencies by over one-third. 
Just recently, this last week, we experienced more terror in the world, in Copenhagen. We have also seen attacks in Australia, recently in Paris, and of course here, on October 22. It is absolutely imperative, when we talk about legislation that is before this House, that we pass it to enable us to give the resources and tools to our security agencies to keep our national security and our citizens safe.",Conservative,Scarborough Centre,Roxanne James,http://www.parl.gc.ca/parlinfo/Files/Parliamentarian.aspx?Item=7e517cde-1b3a-46c1-afdb-4ddddeec7b81&Language=E&Section=ALL
4628350,ca.proc.d.2015-02-20.16622.112,2015-02-20,8131817f-bf86-4739-9a70-6ef9de6f11b6,23,"Mr. André Bellavance (Richmond—Arthabaska, Ind.)",,Oral Questions,Democratic Reform,,"Mr. Speaker, the government quite rightly decided to appeal the decision to allow people to cover their faces during the swearing-in part of citizenship ceremonies. The Conservative Party even started a petition to require people to show their faces during the swearing-in. 
With just a few months to go until the election, the Canada Elections Act does not forbid veiled voting. I would think that voting is at least as important as a swearing-in ceremony.
Will the government keep the promise it made in the 2007 throne speech and honour the two bills it introduced subsequently? Will it say that veiled voting is not the way we do things here?",Independent,Richmond--Arthabaska,André Bellavance,http://www.parl.gc.ca/parlinfo/Files/Parliamentarian.aspx?Item=8131817f-bf86-4739-9a70-6ef9de6f11b6&Language=E&Section=ALL
4628351,ca.proc.d.2015-02-20.16622.113,2015-02-20,ad4032f2-6bb1-497b-b146-f321cfb71ba9,233,"Hon. Pierre Poilievre (Minister of Employment and Social Development and Minister for Democratic Reform, CPC)",,Oral Questions,Democratic Reform,,"Mr. Speaker, the Fair Elections Act requires all voters to show identification before voting.
As I recall, the Bloc Québécois opposed that requirement and the bill. It is interesting that the member wants people to show their faces without a piece of identification that can be used to confirm who they are. The Bloc Québécois really should start reading and thinking about its own contradictions.",Conservative,Nepean--Carleton,Pierre Poilievre,http://www.parl.gc.ca/parlinfo/Files/Parliamentarian.aspx?Item=ad4032f2-6bb1-497b-b146-f321cfb71ba9&Language=E&Section=ALL
4628352,ca.proc.d.2015-02-20.16622.114,2015-02-20,b6808e95-1c75-4909-ab86-319d3519016a,579,"Hon. Lisa Raitt (Minister of Transport, CPC)",,Routine Proceedings,Safe and Accountable Rail Act,," moved for leave to introduce Bill C-52, An Act to amend the Canada Transportation Act and the Railway Safety Act.
 (Motions deemed adopted, bill read the first time and printed) ",Conservative,Halton,Lisa Raitt,http://www.parl.gc.ca/parlinfo/Files/Parliamentarian.aspx?Item=b6808e95-1c75-4909-ab86-319d3519016a&Language=E&Section=ALL
4628353,ca.proc.d.2015-02-20.16622.115,2015-02-20,0d8486f0-be42-41d4-ac82-c51a7f9c0fa9,72,"Hon. Irwin Cotler (Mount Royal, Lib.)",,Routine Proceedings,Petitions,Foreign Affairs,"Mr. Speaker, I am pleased to present a petition today signed by many Canadians from the Sherbrooke area.
The petitioners are calling on the Government of Canada to immediately use every diplomatic means necessary to ensure that Raif Badawi is released and reunited with his family, which has sought refuge in Sherbrooke, Quebec. Raif was sentenced to 10 years in prison and 1,000 lashes for creating an online program in Saudi Arabia.
The petitioners are joining with the parliamentarians in all parties who have already asked the government to take action on this case.",Liberal,Mount Royal,Irwin Cotler,http://www.parl.gc.ca/parlinfo/Files/Parliamentarian.aspx?Item=0d8486f0-be42-41d4-ac82-c51a7f9c0fa9&Language=E&Section=ALL
4628354,ca.proc.d.2015-02-20.16622.116,2015-02-20,288315ef-2fe8-48ad-8ae0-833ac097bac0,3658,"Mr. Philip Toone (Gaspésie—Îles-de-la-Madeleine, NDP)",,Routine Proceedings,Petitions,VIA Rail,"Mr. Speaker, I am honoured to present a petition today signed by hundreds of people from my area in eastern Quebec and northern New Brunswick who are calling for better VIA Rail service in our region.
The railway is in terrible condition. Service is declining and the frequency is diminishing. A lot of improvements are needed. We hope the federal government will listen. ",New Democratic Party,Gaspésie--Îles-de-la-Madeleine,Philip Toone,http://www.parl.gc.ca/parlinfo/Files/Parliamentarian.aspx?Item=288315ef-2fe8-48ad-8ae0-833ac097bac0&Language=E&Section=ALL
4628355,ca.proc.d.2015-02-20.16622.117,2015-02-20,c5378648-5d94-4645-bc05-339090e1077b,577,"Ms. Kirsty Duncan (Etobicoke North, Lib.)",,Routine Proceedings,Petitions,Eating Disorders,"Mr. Speaker, eating disorders such as anorexia and bulimia are serious mental illnesses that incapacitate more than 600,000 Canadians and can be fatal.
Petitioners call upon the government to work with the provinces, territories, and stakeholders to develop a comprehensive pan-Canadian strategy for eating disorders, including better prevention, diagnosis, treatment, and support.",Liberal,Etobicoke North,Kirsty Duncan,http://www.parl.gc.ca/parlinfo/Files/Parliamentarian.aspx?Item=c5378648-5d94-4645-bc05-339090e1077b&Language=E&Section=ALL
4628356,ca.proc.d.2015-02-20.16622.118,2015-02-20,b41c3b7e-c64f-4415-9f58-79d7462e5d8e,146,"Mr. Peter Julian (Burnaby—New Westminster, NDP)",,Routine Proceedings,Petitions,Agriculture,"Mr. Speaker, I am pleased to present a petition in the House today, signed by hundreds of residents of the city I represent, New Westminster, but also Richmond, British Columbia, and Delta, British Columbia.
These Canadians are concerned about increasing illegality because of seed patents that are being privatized. The petitioners are calling for Parliament to ensure that the Government of Canada and the House of Commons are committing to international aid policies that support small family farmers, especially women, and recognize their vital role in the struggle against hunger and poverty; that they ensure that Canadian policies and programs are developed in consultation with small family farmers; and that they protect the rights of small family farmers, particularly in the global south, to preserve, use, and freely exchange seeds.",New Democratic Party,Burnaby--New Westminster,Peter Julian,http://www.parl.gc.ca/parlinfo/Files/Parliamentarian.aspx?Item=b41c3b7e-c64f-4415-9f58-79d7462e5d8e&Language=E&Section=ALL
