basepk,hid,speechdate,pid,opid,speakeroldname,speakerposition,maintopic,subtopic,subsubtopic,speechtext,speakerparty,speakerriding,speakername,speakerurl
4638586,ca.proc.d.2015-05-11.16839.210,2015-05-11,8826a32c-2e29-49be-b6e2-c1f10363639b,440,"Ms. Irene Mathyssen (London—Fanshawe, NDP)",,Government Orders,Business of Supply,Opposition Motion—Care for Veterans,"Mr. Speaker, I am honoured to speak to this motion today, because Canadian veterans are our heroes, and they should be treated with the utmost respect and provided with all the support we can possible give.
Conservatives continuously remind us to support our troops—we hear it all the time—but fail to understand that support must continue once those Canadian Forces are no longer active and they become veterans. We owe them that much. We were, and are, a country engaged in modern-day conflicts in places like Somalia, Bosnia, Lebanon, Cyprus, East Timor, Afghanistan, and now Iraq.
 Our troops have answered the call to assist communities jeopardized by floods, earthquakes, ice storms, forest fires, hurricanes, and tornadoes domestically and around the world. However, Veterans Affairs Canada has not adapted to the very real needs of the veterans of the modern day. This government has failed to support the obligations we owe veterans who served in the great wars, in Korea, and on peacekeeping missions. 
In fact, because of the shortsightedness of the Conservative government, our relationship with our veterans has been damaged and diminished rather than enhanced. Older veterans were told to learn to use the Internet, for example, for continued service when local VAC offices faced service reductions and closures.
 The Conservatives have cut—and this has been said a number of times—more than 900 jobs from Veterans Affairs since 2009. That is 23% of the workforce. 
Compensation for funerals under the Last Post Fund has not kept up with the actual costs, leaving cash-strapped veterans and their families to pay the difference. Veterans requiring long-term care beds have been shuffled off to provincial jurisdictions because they have had the misfortune of outliving their life expectancy.
The ministry refuses to extend our obligation as a courtesy to them beyond the contracted dates. These are veterans with special needs who need special care as a result of their service to our country.
 New Democrats have long advocated for the continuation of the veterans long term care program. The rates of homelessness and suicide among our veteran population are horrifying, but testimony to that fact and effects of post-traumatic stress are not being seriously addressed. Families are left without the supports they need to deal with younger veterans suffering from post-traumatic stress, and injured veterans with obvious disabilities as a result of their service must suffer the delay and humiliation of proving to the department over and over again that they have been disabled, in order that they continue to receive support.
The current government's Bill C-58, as proposed, is a good start, but many veterans feel it just doesn't go far enough in enhancing programs and services for all veterans and their families under the new charter. New Democrats agree with these veterans and their families. That is part of why we have chosen to dedicate this opposition day to point out that financial compensation and support services to past and active members of the Canadian Armed Forces who have been injured, disabled, or died as a result of military service, and to their dependents, must improve. We have a moral, social, and legal as well as fiduciary obligation to do that.
Dr. Pierre Morisset, a retired major general and the chair of the Scientific Advisory Committee for Veterans' Health, was a witness before the veterans affairs committee last year, and he said, “When a soldier leaves the forces and is officially known as a veteran, then he's treated in the civilian health sector”. Dr. Morisset went on to say that the civilian health care system is “not necessarily tuned to the reality of what kind of life the soldier may have had”. 
Similarly, Dr. Ruth Stewart of Athabasca University argued that:
 The Canadian Forces represent a distinct culture, containing distinct subcultures. They possess unique languages, norms, and customs, and are socially stratified to a degree completely foreign to most north American civilians. 
Once a soldier leaves the military, he or she is left to the care of civilian doctors who will do their best, but they do not have the expertise to deal with the specific issues veterans face. Veterans are our national heroes and, as such, they are a federal responsibility and should be looked after by the federal government. They are not, as the government believes, a problem to be dismissed, undervalued, or offloaded to the provinces.
This Parliament's veterans affairs committee identified three core themes for the study resulting in the new veterans charter: care and support of the most seriously disabled, support for families, and improving how Veterans Affairs Canada delivers the programs, services, and benefits of the new charter. 
The Conservatives' Bill C-58 would only partly address some of the 14 recommendations contained in that unanimous report. It would, for instance, only provide assistance to help 100 of the most seriously injured.
The NDP believes that we have the obligation, and capability, to help all veterans and their families.
 New Democrats will push for the retirement income security benefits to be increased from 70%, as outlined in the bill, to 100% of what the veterans received in VAC financial benefits before age 65, to ensure that veterans have financial stability.
The critical injury benefit proposed under Bill C-58 would provide a $70,000 tax-free award to support the most severely injured and ill Canadian Forces members and veterans. However, under the proposed criteria for qualification, only two or three people per year would qualify. This is simply not good enough for our veterans. They have given their lives and their careers for this country.
We have also heard from veterans who are disappointed in the government for not addressing the disparities and unfairness related to lump-sum disability payments, as compared with civilian court awards for pain and suffering.
 Scott Maxwell, executive director of Wounded Warriors Canada, said the new benefits under Bill C-58 would go to just 1% of all severely disabled vets and Sean Bruyea, veteran advocate, has expressed similar concerns.
Injured and disabled vets should not have to fight their own government in court for the compensation and care they deserve, but sadly, this has become all too common under the current government.
If the Conservatives are serious about improving the care of our veterans, they should stop fighting those veterans in court and recognize our historic covenant.
Today, New Democrats are calling upon the government to restore our country's relationship with the veterans to one that is based upon respect rather than neglect.
Instead of including provisions to assist veterans in an omnibus budget bill—a cynical attempt to force opposition parties that support the measures for veterans to vote against them—the Conservatives should recognize the historic covenant that we share with veterans and honour it with decisive action.
I would like to speak, now, about the proud history of military service in London, Ontario.
I cherish the relationship I have been able to foster with the veterans in my community who have served us so well over the years. Their participation in our community enriches all of us. They support hospitals, young athletes, the homeless, the wounded, and the forgotten. I feel very privileged to stand with our veterans in the community.
Perhaps members have heard of the proposed demolition of many buildings at Wolseley Barracks, including the historic officers' mess. Bob Marshall, president of the Duchess of Kent Legion, would like to see the officers' mess repurposed as the Legion's new home, rather than demolition.
This is a reasonable proposal, a win for the Legion, a win for Wolseley Barracks, and a win for the community. I am fully behind it. I hope that the Minister of Defence has had time to consider this proposal adequately and that he will support it.
I would also like to remind the House that, when in opposition, the Conservatives promised they would make significant veteran reforms. Sadly, after nearly a decade in office, they have done little to address the gaping holes in the services offered Canadian veterans and their families. In fact, they have gone so far as to challenge the existence of our sacred covenant with those veterans.
The Conservatives have forgotten our veterans and the contribution of modern-day Canadian Forces veterans and RCMP who served in peacekeeping around the world. That is absolutely unacceptable. Canadians are passionate and proud in our gratitude for our veterans.
During Remembrance Week and beyond, Canadians choose to honour the men and women who gave us a strong and free country. It is long past time for our federal government to likewise honour all veterans, both past and present, by serving their needs.
Monuments and parades are lovely, but they are cold comfort to the veterans and families who are suffering neglect.
It is time to mean what we say when we repeat the promise to remember. It must be accompanied by real action. That is what New Democrats are promising and proposing today with this motion
The NDP is the only party with a comprehensive veterans policy that we intend to implement when we become the government of this great country.
I am proud to support today's motion. I hope everyone in this House will do so also.",New Democratic Party,London--Fanshawe,Irene Mathyssen,http://www.parl.gc.ca/parlinfo/Files/Parliamentarian.aspx?Item=8826a32c-2e29-49be-b6e2-c1f10363639b&Language=E&Section=ALL
4638587,ca.proc.d.2015-05-11.16839.211,2015-05-11,2347a7b8-8e45-4c51-bdc6-f6c32375ad50,189,"Mr. Brian Masse (Windsor West, NDP)",,Government Orders,Business of Supply,Opposition Motion—Care for Veterans,"Mr. Speaker, I have a quick question for my colleague from London—Fanshawe, and I would like to thank her for her eloquent speech. 
I would really like to know what we should expect. When the Prime Minister talked about motions in the past, it was in respect for this House to implement them, but the challenges we have today are because of not implementing those motions. I think today is a good day to reinstate that philosophy of actually following through from the government to the opposition.",New Democratic Party,Windsor West,Brian Masse,http://www.parl.gc.ca/parlinfo/Files/Parliamentarian.aspx?Item=2347a7b8-8e45-4c51-bdc6-f6c32375ad50&Language=E&Section=ALL
4638588,ca.proc.d.2015-05-11.16839.212,2015-05-11,8826a32c-2e29-49be-b6e2-c1f10363639b,440,Ms. Irene Mathyssen,Interjection,Government Orders,Business of Supply,Opposition Motion—Care for Veterans,"Mr. Speaker, the member is quite right. We have heard a great deal in this House, and it goes back to our involvement in Afghanistan with the call to support our troops, making it very clear from the Prime Minister's Office that somehow support, or lack of support, for the troops was integral to the way the House would operate and do business. Therefore, there is a lot of talk, but very little action. 
I would like to underscore some of the things about which I am very concerned. One is a lack of long-term care for our veterans. 
If veterans were in World War II or Korea, yes, they would have long-term care, but for post-Korean veterans or veterans who suffered in the Golan Heights or gave all that there was to give in Afghanistan, they are not covered in terms of long-term care. 
This is an affront to the men and women who put their lives on the line. Yet, we still see the Conservative government making excuses about why it cannot make sure that all veterans are provided with the services they absolutely need and deserve.",New Democratic Party,London--Fanshawe,Irene Mathyssen,http://www.parl.gc.ca/parlinfo/Files/Parliamentarian.aspx?Item=8826a32c-2e29-49be-b6e2-c1f10363639b&Language=E&Section=ALL
4638589,ca.proc.d.2015-05-11.16839.213,2015-05-11,07cf5767-802c-406c-92a7-7dc92af79b40,4264,"Mr. Kevin Lamoureux (Winnipeg North, Lib.)",,Government Orders,Business of Supply,Opposition Motion—Care for Veterans,"Mr. Speaker, I would like to base my question on a quote that the Liberal critic for veterans affairs gave earlier. In the shadow of the First World War, the then prime minister Sir Robert Borden made a covenant to those Canadians who fought. On the eve of Vimy Ridge, he told Canadians that: 
 You can go into this action feeling assured of this, and as the head of the government I give you this assurance: That you need not fear that the government and the country will fail to show just appreciation of your service to the country and Empire in what you are about to do and what you have already done. 
 The government and the country will consider it their first duty to see that a proper appreciation of your effort and of your courage is brought to the notice of people at home that no man, whether he goes back or whether he remains in Flanders, will have just cause to reproach the government for having broken faith with the men who won and the men who died. 
When we reflect on that covenant and look at what has taken place over the last couple of years and what we are hearing from veterans from all regions of Canada, does the member believe that the government has been in keeping with what was then quoted by then prime minister Borden?",Liberal,Winnipeg North,Kevin Lamoureux,http://www.parl.gc.ca/parlinfo/Files/Parliamentarian.aspx?Item=07cf5767-802c-406c-92a7-7dc92af79b40&Language=E&Section=ALL
4638590,ca.proc.d.2015-05-11.16839.214,2015-05-11,8826a32c-2e29-49be-b6e2-c1f10363639b,440,Ms. Irene Mathyssen,Interjection,Government Orders,Business of Supply,Opposition Motion—Care for Veterans,"Mr. Speaker, I do not think that the covenant has been broken just in the last few years. Rather, I think it has been broken over the last many decades. 
It is interesting that, when Borden made that covenant with the men and women who went to war, I think it was from a sense of real and profound gratitude. Canadians knew how those men and women suffered in the fields, from the gas attacks, the constant bombardment, the discomfort of the trenches, and the lack of any hope in some cases. There was a real understanding. Unfortunately, almost 100 years later, that recognition seems to have faded. 
Canadians go to Remembrance Day ceremonies, and they are absolutely genuine in their gratitude. I just wish the government were as grateful. I wish that the covenant spoken 100 years ago were part and parcel of what the governments of the last few decades understood as their obligation. Sadly, it quite simply is not.",New Democratic Party,London--Fanshawe,Irene Mathyssen,http://www.parl.gc.ca/parlinfo/Files/Parliamentarian.aspx?Item=8826a32c-2e29-49be-b6e2-c1f10363639b&Language=E&Section=ALL
4638591,ca.proc.d.2015-05-11.16839.215,2015-05-11,d34b2845-a4e3-457b-b0eb-e95ac232d51d,8337,"Mr. Scott Armstrong (Parliamentary Secretary to the Minister of Employment and Social Development and Minister of Labour, CPC)",,Government Orders,Business of Supply,Opposition Motion—Care for Veterans,"Mr. Speaker, I am pleased to rise today to address the motion put forward by the member of Parliament for New Westminster—Coquitlam. 
I will be splitting my time with the member for Mississauga East—Cooksville.
I urge the NDP to work with our government to improve the well-being of Canada's veterans and their families. We understand the need to provide those who have bravely served our nation in uniform with the support they need to transition to civilian life.
Our recently announced increased benefits and services are evidence of our commitment to ensuring that Canadian veterans and their families are treated with care, compassion, and respect. It is through these new measures, which are included in economic action plan 2015, that we are demonstrating the importance we place on being there for our brave men and women when they need us most.
These new benefits and services we are proposing take significant strides in improving the new veterans charter. We are moving to better support families and caregivers, those who play such a vital role in the transition process. We are respecting reservists. The purpose clause in Division 17 of Bill C-59, the economic action plan 2015 act, which my colleagues have discussed, demonstrates our government's duty and commitment to veterans. It is an ongoing commitment.
I encourage all colleagues to listen to the debate today and recognize that the measures our government is introducing would enhance the lives of those who have served our nation. It is not only about supporting those who have served, it is also about supporting their families. 
We recognize the vital role the families play in the lives of the men and women in uniform and how veterans' health issues can impact those who stand by them. We understand the important role those who stand beside Canada's veterans play in their recovery and well-being. 
I would like to highlight the action we have taken to support families and caregivers. 
We recognize that the family caregivers of Canada's veterans play a large supporting role in providing those who have served with the care they need and deserve, which is why I am pleased to tell the House about a new benefit our government has introduced to help relieve some of the burden facing the families of those who are severely injured. A serious physical or mental injury causes not only immense challenges for the serviceman or woman but serious stress and strain on their families. Our government has proposed a new family caregiver relief benefit to provide an annual tax-free grant of $7,238. Family members who help with the care of the most seriously injured veterans can have the added flexibility of getting relief during times of added stress on the family or even help to recharge their batteries, if that is what needs to happen.
Today Veterans Affairs already pays for in-home medical care for the most severely injured veterans. This funding would be in addition to other VAC benefits already in place to support veterans' daily needs. It is a recognition of their sacrifice and the sacrifice of their families. It tops things up just a bit and makes things a little easier.
This benefit is for caregivers in the home—spouses, common-law partners, parents, or adult children—who often try to juggle raising children or family duties alongside assisting their injured loved ones. Their own careers are often sidetracked or reduced, and often their own health and wellness can be impacted when there is an injured veteran at home. This new benefit recognizes their important work and would provide them with a little extra flexibility. 
This funding could be used for relief options, such as covering the cost of having a professional caregiver come into the home or covering the cost of another family member or friend travelling to the veteran's home, and it would be provided in addition to other benefits already in place to support veterans' health care needs. It is a supplement. We believe that this would make a tremendous difference for these families.
This recently announced benefit is not the only action we have taken in support of veterans. Last year we announced an increase in the number of psychological counselling sessions for families of veterans from eight to 20 sessions. 
We have also invested in research to help us gain a better understanding of the impact operational stress injuries, such as post-traumatic stress disorder, have on the mental health of the spouses and children of Canadian veterans. Post-traumatic stress disorder and other mental injuries have an effect on the whole family, not just on the injured veteran. Research such as this will help us get a better handle on the complex challenges facing today's veterans, their spouses, and their children when it comes to their mental health and their mental well-being. We want to identify possible next steps in this area.
We announced that we will develop and implement veteran-specific mental-health first aid training across the country for both veterans and their families. This will provide family members and caregivers of veterans with the training they need to support their loved ones in a time of crisis. It will do this by teaching them about mental-health conditions; training them in the signs and symptoms of common mental-health disorders; providing them with the opportunity to practise crisis first aid for those with mental-health conditions; ensuring that they know where, when, and how to get help; and providing education on what type of help has been shown to be effective in their situation and why.
Those are some of the actions our government has taken to honour our commitment not only to members of the Canadian Armed Forces and veterans but to their families as well. I am disappointed to see that once again the New Democrats are playing their political games when our government has been unprecedented in the investments we have made in improving the well-being of Canadian veterans and those family members and caregivers who stand by the side of those injured veterans.
I urge all members of this House to vote in favour of the new measures our government is introducing in support of veterans and their families. It is by taking action and passing these measures that we will demonstrate our commitment and our duty to provide those who have bravely served our nation, and their families, with the help they need.",Conservative,Cumberland--Colchester--Musquodoboit Valley,Scott Armstrong,http://www.parl.gc.ca/parlinfo/Files/Parliamentarian.aspx?Item=d34b2845-a4e3-457b-b0eb-e95ac232d51d&Language=E&Section=ALL
4638592,ca.proc.d.2015-05-11.16839.216,2015-05-11,4efcc2e2-bd91-4234-b907-a24838d4f1aa,1371,"Ms. Christine Moore (Abitibi—Témiscamingue, NDP)",,Government Orders,Business of Supply,Opposition Motion—Care for Veterans,"Mr. Speaker, I would like to know whether my colleague thinks that it is also extremely important to understand the reality on the ground in order to understand the situation of veterans and soldiers.
Many of them have said that it is very difficult to obtain services and that they often feel they have to fight to get them. They say that they have to go through a long process that sometimes causes them more psychological pain than the incident itself.
Given what they have gone through, should we not make their lives easier by taking into account what they are saying and improving the process they have to go through to get help?",New Democratic Party,Abitibi--Témiscamingue,Christine Moore,http://www.parl.gc.ca/parlinfo/Files/Parliamentarian.aspx?Item=4efcc2e2-bd91-4234-b907-a24838d4f1aa&Language=E&Section=ALL
4638593,ca.proc.d.2015-05-11.16839.217,2015-05-11,d34b2845-a4e3-457b-b0eb-e95ac232d51d,8337,Mr. Scott Armstrong,Interjection,Government Orders,Business of Supply,Opposition Motion—Care for Veterans,"Mr. Speaker, I absolutely agree that we need to make sure that Veterans Affairs Canada makes the process for gaining benefits for veterans clear, simple, and easy to apply for. The minister has been very clear on the personal steps he has taken to make sure that every veteran in this country has the ability to access the benefits due to them.
 We are not only expanding the breadth and seriousness of the benefits we are putting in place to support veterans, we are also making changes to make sure that any forms that have to be filled out, any phone calls veterans have to make, any online applications they endeavour to take part in are easy and that veterans have support in doing that. Not only do we need to make sure that our veterans have the ability to get this large number of benefits our government is providing for them but we are working to make sure that those veterans have the ease of application and that those benefits are readily available to them.",Conservative,Cumberland--Colchester--Musquodoboit Valley,Scott Armstrong,http://www.parl.gc.ca/parlinfo/Files/Parliamentarian.aspx?Item=d34b2845-a4e3-457b-b0eb-e95ac232d51d&Language=E&Section=ALL
4638594,ca.proc.d.2015-05-11.16839.218,2015-05-11,07cf5767-802c-406c-92a7-7dc92af79b40,4264,"Mr. Kevin Lamoureux (Winnipeg North, Lib.)",,Government Orders,Business of Supply,Opposition Motion—Care for Veterans,"Mr. Speaker, what the government actually has done is close a number of offices in different regions of the country. They include, for example, Cornerbrook, Newfoundland and Labrador; Charlottetown, P.E.I.; Sydney, Nova Scotia; Windsor, Ontario; Thunder Bay, Ontario; Brandon, in my home province of Manitoba; Saskatoon, Saskatchewan; Kelowna, British Columbia; and Prince George, British Columbia.
 I wonder if the member could comment on why the government found it necessary to close those Veterans Affairs offices, given that there is a big difference between talking on the telephone to someone and being able to meet face to face with an individual, which is something the employees in these offices did on a daily basis.",Liberal,Winnipeg North,Kevin Lamoureux,http://www.parl.gc.ca/parlinfo/Files/Parliamentarian.aspx?Item=07cf5767-802c-406c-92a7-7dc92af79b40&Language=E&Section=ALL
