basepk,hid,speechdate,pid,opid,speakeroldname,speakerposition,maintopic,subtopic,subsubtopic,speechtext,speakerparty,speakerriding,speakername,speakerurl
4642913,ca.proc.d.2015-06-05.16866.0,2015-06-05,5d65749e-0cdb-4c03-88d4-f57a905acc33,8436,"Hon. Bernard Valcourt (Minister of Aboriginal Affairs and Northern Development, CPC)",,Government Orders,Yukon and Nunavut Regulatory Improvement Act,," moved that Bill S-6, An Act to amend the Yukon Environmental and Socio-economic Assessment Act and the Nunavut Waters and Nunavut Surface Rights Tribunal Act, be read the third time and passed. 
Mr. Speaker, in 2007, this government launched a comprehensive northern strategy focused on sovereignty, the environment, the economy, and governance. Under the leadership of this Prime Minister, for the past nine years we have been providing northerners with the tools they need to take advantage of the vast natural resources at their disposal in an environmentally sustainable manner. By doing so, we are creating jobs and economic opportunities for northerners, ensuring the long-term prosperity of the north for generations to come.
 Members can take great satisfaction from our progress in advancing the northern strategy in recent years thanks to extensive federal infrastructure investments, whether it be the creation of the Canadian Northern Economic Development Agency under the able leadership of the Minister of the Environment, the devolution of the Northwest Territories, the Canadian High Arctic Research Station in the eastern Arctic, the Inuvik to Tuktoyaktuk highway, Canada's leadership on the Arctic Council, or the extension of protected land and marine areas, and the list goes on.
 The bill before us today, Bill S-6, is the next example of how we are delivering on our northern strategy. This bill will complete the modernization of regulatory regimes in the north by bringing Yukon and Nunavut's regulatory regimes up to speed and on par with other Canadian jurisdictions.
 This legislative work was started in 2013 with the Northern Jobs and Growth Act and completed in the Northwest Territories last year with the Northwest Territories Devolution Act. Now it is time to finish what we have started.
The proposed amendments to the Yukon Environmental and Socio-Economic Assessment Act and the Nunavut Waters and Nunavut Surface Rights Tribunal Act are designed to make the regulatory systems in Yukon and Nunavut more efficient and effective, while ensuring sound environmental stewardship.
This is what Yukon Premier Darrell Pasloski told senators during hearings on the bill:
 We [the Yukon] are now in a position where we are not as competitive with other jurisdictions. Quite frankly, we would like to get back on an equal footing with the other jurisdictions in this country. 
Bill S-6 would do just that. It would make the two territories' regulatory regimes consistent with others across the north and in the rest of Canada. This would ensure Yukon and Nunavut remain attractive places to live, work and invest for generations to come.
Let me briefly highlight the many advantages of Bill S-6 for each territory. I will begin by summarizing some facts about updating YESAA.
It is important to underline that the amendments were informed by extensive discussions and consultations in Yukon over a period of seven years. These included the five-year review of YESAA as well as more recent engagement on this legislation. 
Bill S-6 is consistent with the Umbrella Final Agreement and the individual first nations final agreements signed by the federal and territorial governments and Yukon first nations.
 Decision-making powers over natural resources that currently rest with the territorial government or the Yukon Environmental and Socio-economic Assessment Board would not change. Neither the federal government nor the territorial government would have the authority to influence, direct, or interfere with an assessment process. It is especially important that aboriginal input and participation would remain central to the YESAA process.
It is important to point out that the Senate Standing Committee Energy, the Environment and Natural Resources completed its review of the legislation last fall. At the end of its review, it endorsed the bill unanimously. I submit that it correctly recognized that the passage of this bill would help foster economic development in the region and would create jobs, growth, and long-term prosperity in an increasingly global marketplace.
These are the facts.
 Allow me to take a moment to clarify, for the record, a few of the concerns that have been raised with regard to this bill, because as with every bill that comes through this place, there is very rarely unanimity. Bill S-6 would provide the Minister of Aboriginal Affairs and Northern Development with the authority to give binding policy direction to the Yukon Environmental and Socio-economic Assessment Board. The minister could also delegate his authority to the Government of Yukon in certain situations, if the need arose.
Including the power to delegate authorities to the territorial government is, I submit, consistent with the northern strategy and its aim of devolving and improving northern governance. It does not conflict with land claim agreements nor does it disrupt the tripartite spirit of the environmental assessment process. Further, and I have made this very clear, the government has no intention of exercising its authority to delegate any powers to the territorial government in the near term. Of course, if any such delegation were contemplated in the future, it would be consistent with the Umbrella Final Agreement and would also be in the best interests of Yukoners, including Yukon first nations.
When it comes to the issue of policy direction, there has been a lot of fearmongering about what types of policy direction the minister could issue. Allow to me alleviate these concerns. Not only does this power already exist in the Mackenzie Valley Resource Management Act, but in each and every case when this power was exercised, which was four times, it was to protect the interests of first nations and to ensure that all the parties involved, namely the board, had a common understanding, with the government, of agreements the government had subsequently undertaken. That is important to point out.
 Policy direction could only be given within the framework of existing legislation and land claims agreements and after consultation with the board. This amendment would apply to matters such as board conduct, the use of new technology, and satisfying roles and responsibilities regarding aboriginal consultation.
Contrary to the myths that have been spread around, it absolutely does not affect the independence of the board or the board's decision-making abilities with respect to a project under consideration or a completed assessment. The board maintains the jurisdiction, as set out in the agreement, of an independent arm's-length body responsible for making recommendations to decision-making bodies based on their socioeconomic and environmental assessment.
Finally, and I am not sure if my colleagues are aware of it, this authority also exists and is consistent with territorial legislation that allows a Yukon minister to issue policy direction to boards, which has been done on one occasion. 
While the Yukon Environmental and Socio-economic Assessment Board has a clear record of completing reviews in a timely manner, the Yukon Environmental and Socio-Economic Assessment Act does not set out the “beginning-to-end” time limits for project reviews that exist in every other jurisdiction in Canada.
Bill S-6 fixes that problem. The time limits in Bill S-6 are intended to put Yukon on a level playing field with the rest of Canada and the world, minimize investor uncertainty and make project planning more predictable, while allowing for necessary extensions that could arise with more complex projects. 
Of course, the time required by the proponent to gather information and undertake any studies necessary for the review would be excluded. We heard repeatedly from government and industry about the time and money spent on assessments for minor changes that had no substantive impact on a project or the environment. 
This proposed legislation clarifies that authorization to renew or amend a project would only require a new assessment where there has been a significant change to the project. This would reduce the administrative burden on the proponent and the board and ensure predictability for established projects. 
First nations would have a direct role in determining whether there has been a significant change when the project is located on settlement land and the first nation is a decision body for the project.
There has been much debate about the Yukon component of this bill, particularly with regard to the concerns I just mentioned. I think hon. members will have no choice but to agree, after hearing these remarks, that indeed the bill was developed with the best interests of Yukoners in mind, including those of Yukon first nations, and will help us to finally bring this bill into law.
I want to take a moment to recognize the tireless efforts of the member of Parliament for Yukon on this bill. If it were not for him, it would not have been possible, due to the NDP's interminable ban on committee travel, for the committee to have concluded its hearings in Yukon to hear directly from Yukoners, which was significant. I think Yukoners should be grateful for such a hard-working Conservative member of Parliament.
Another aspect of this bill that has not been debated, it seems to me, is the one that concerns Nunavut. For the record, the Government of Nunavut has called on us to take action to modernize the Nunavut Waters and Nunavut Surface Rights Tribunal Act.
The hon. Johnny Mike, Minister of Environment in Nunavut stated:
 ...the Government of Nunavut believes that this bill will make a number of improvements to the regulatory regime in Nunavut....this is an important piece of legislation for the North and will contribute to the environmental protection and economic development of Nunavut. 
In developing this proposed legislation, the Government of Canada sought the input of the territorial government and Nunavut Tunnagavik Inc., NTI, which represents the Inuit of Nunavut. We also engaged with the Nunavut Water Board, with industry and other federal government departments prior to preparing the Nunavut related provisions of Bill S-6. We listened closely to the input received during consultation, which is reflected in the proposed legislation.
Residents of Nunavut can look forward to an improved regulatory environment as a result of these efforts. The changes proposed would introduce beginning to end time limits on the issuance of water licences and reduce the duplication and uncertainty of unnecessary reviews. They would also give the Nunavut Water Board the ability, at its discretion, to issue water licences for the anticipated duration of a project. Life of project water licences would extend the maximum duration of a licence from 25 years to the anticipated life of the project. This would enable companies to undertake long-term planning and implement the principle of one project, one assessment.
Bill S-6 also addresses the long-standing disincentive to investment in Nunavut, security over bonding. Over bonding occurs when a company is required to provide more security than would be required to remediate a project at its completion because both regional Inuit associations and the Nunavut Water Board have set security amounts. With Bill S-6, the federal minister of aboriginal affairs and northern development would be given legislative authority to enter into agreements relating to security with Inuit landowners and the project applicant. The Nunavut Water Board would still be responsible for setting the amount of security, but the board would be required to consider any arrangement reached. 
Bill S-6 would also implement stronger enforcement provisions to increase environmental stewardship, as well as align the act with other federal environmental statutes. The proposed legislation would increase fines for violations and allow for the creation of administrative monetary penalties to encourage compliance with regulatory requirements and remove the financial benefit of rule breaking.
There is broad support for the Yukon and Nunavut regulatory improvement act throughout Nunavut. Northerners recognize that consultation has been robust and that the proposed amendments would foster investor confidence, economic opportunities and growth while promoting sound environmental stewardship in the eastern Arctic. 
For example, while giving testimony at the Senate committee, the witness from the Nunavut Water Board said:
 ...we were very much part of the working group and very much contributed to that working group all throughout and indeed are quite satisfied how well some of the issues we raised were heard. 
As well, the President of NTI, Cathy Towtongie, wrote to me, saying, “NTI has no objections to the modest changes proposed to the Nunavut Waters and Nunavut Surface Rights Tribunal Act”. 
My colleague, the Minister of the Environment, who represents Nunavut, has further reinforced the desire of her constituents to see Bill S-6 passed. As she has observed, the proposed legislation plays a crucial role in preparing for devolution to be successful in Nunavut. It would ensure the water management regime that is eventually transferred from the federal government to the Government of Nunavut would encourage investment and allow the territory to fully benefit from increased resource development. 
Of course, our government remains committed to moving forward with the implementation of the legislative changes in a collaborative manner, respecting the spirit and intent of the land claims agreement in both territories.
For all of these reasons, I urge all-party support for this most worthy proposed legislation.",Conservative,Madawaska--Restigouche,Bernard Valcourt,http://www.parl.gc.ca/parlinfo/Files/Parliamentarian.aspx?Item=5d65749e-0cdb-4c03-88d4-f57a905acc33&Language=E&Section=ALL
4642914,ca.proc.d.2015-06-05.16866.1,2015-06-05,0c9d00b0-a035-46d3-ba51-0db3e8da19b8,9253,"Mr. Murray Rankin (Victoria, NDP)",,Government Orders,Yukon and Nunavut Regulatory Improvement Act,,"Mr. Speaker, I appreciate the remarks of the minister today about the debate on Bill S-6 that would affect the people of Yukon so dramatically.
 I think it first should be noted, this is the first and only day of debate on third reading for Bill S-6, as the government has decided to, once again in an unprecedented way, use time allocation to shut down debate on legislation in this place.
The minister talked about “broad support” for the bill, and it respecting the spirit and intent of the Umbrella Final Agreement in land claims in Yukon. One of the great accomplishments of Canada was the creation of the Yukon Environmental and Social Assessment Board, YESA. That was a three-legged stool with the equal participation by statute after the Umbrella Final Agreement, of first nations, Yukon government and federal government.
 I had occasion to work. I was the legal adviser to the Yukon government during the self-government agreement preceding YESA. With this bill, people of Yukon are saying that this is tilting that three-legged stool in an unbalanced way to the federal government, and Council of Yukon First Nations are talking about lawsuits in order to stop this misguided legislation.
My question to the minister is, how does he say that there is this “broad support” for the legislation when people are talking about lawsuits to stop it and to change the balance that had been created so effectively when YESA was first created?",New Democratic Party,Victoria,Murray Rankin,http://www.parl.gc.ca/parlinfo/Files/Parliamentarian.aspx?Item=0c9d00b0-a035-46d3-ba51-0db3e8da19b8&Language=E&Section=ALL
4642915,ca.proc.d.2015-06-05.16866.2,2015-06-05,5d65749e-0cdb-4c03-88d4-f57a905acc33,8436,Hon. Bernard Valcourt,Interjection,Government Orders,Yukon and Nunavut Regulatory Improvement Act,,"Mr. Speaker, to answer the hon. member's question, I would like to point out the fact, which he omits to mention, that the vast majority of the amendments in Bill S-6 to the YESA process stem from the five-year review that took place. 
I referred in my remarks to a seven-year process that took place in order to bring Bill S-6 before this House.
 When I talked of broad support, the fact of the matter is that there is indeed broad support, total support for all of those measures except four particular amendments. These four particular amendments have also been the subject of consultation with the first nations. As the record will show, all Yukoners, stakeholders, industry, government and first nations participated in the consultation process on these amendments, and the four particular amendments in question are probably most important to level the playing field I referred to.
The Yukon Territory deserves to benefit from the same rules as other territories and those provinces south of 60, and they ensure the certainty required to promote investment into the responsible natural resource development of the territory.",Conservative,Madawaska--Restigouche,Bernard Valcourt,http://www.parl.gc.ca/parlinfo/Files/Parliamentarian.aspx?Item=5d65749e-0cdb-4c03-88d4-f57a905acc33&Language=E&Section=ALL
4642916,ca.proc.d.2015-06-05.16866.3,2015-06-05,07cf5767-802c-406c-92a7-7dc92af79b40,4264,"Mr. Kevin Lamoureux (Winnipeg North, Lib.)",,Government Orders,Yukon and Nunavut Regulatory Improvement Act,,"Mr. Speaker, the minister is so confident about the legislation he has brought forward, and yet, as has been pointed out, again through time allocation, is limiting participation, which is somewhat typical of the entire process of the bill.
I was not able to be there at the committee stage to hear the witnesses, but I have heard from a significant number of individuals in regard to Bill S-6. If the minister believes his legislation is so great, why then has there been so much resistance by the different stakeholders in coming on board with the member's legislation?
On the one hand we have the government saying, “Here is this wonderful piece of legislation”, but the communities that it is affecting are obviously offside with the minister.
How does the minister justify bringing forward legislation when he was not able to even come close to achieving any sort of consensus6 To illustrate just how bad it is, the only way the government has been able to pass this thing through to date is through time allocation. If it was not using its majority, it would not be passing the legislation.",Liberal,Winnipeg North,Kevin Lamoureux,http://www.parl.gc.ca/parlinfo/Files/Parliamentarian.aspx?Item=07cf5767-802c-406c-92a7-7dc92af79b40&Language=E&Section=ALL
4642917,ca.proc.d.2015-06-05.16866.4,2015-06-05,5d65749e-0cdb-4c03-88d4-f57a905acc33,8436,Hon. Bernard Valcourt,Interjection,Government Orders,Yukon and Nunavut Regulatory Improvement Act,,"Mr. Speaker, the observation of the hon. member, again, is very isolated. The fact of the matter is that this bill is fully supported and asked for by the entire legislature of the Yukon. The Government of Yukon supports this bill, asked for its implementation, and what is more important is that all of the provisions in the bill are fully consistent with the letter of the Umbrella Final Agreement.
This is not news to anybody in the Yukon who has read the Umbrella Final Agreement. All of these measures were contemplated, and I cannot understand why Liberals would want to keep the Yukon on a playing field that is inferior to that of other jurisdictions in Canada so as to prevent investment in the Yukon. That is what this bill would achieve.",Conservative,Madawaska--Restigouche,Bernard Valcourt,http://www.parl.gc.ca/parlinfo/Files/Parliamentarian.aspx?Item=5d65749e-0cdb-4c03-88d4-f57a905acc33&Language=E&Section=ALL
4642918,ca.proc.d.2015-06-05.16866.5,2015-06-05,2b4c3e77-e409-4739-b561-06e5c5725b7b,441,"Mr. Colin Mayes (Okanagan—Shuswap, CPC)",,Government Orders,Yukon and Nunavut Regulatory Improvement Act,,"Mr. Speaker, as the minister mentioned in his speech, last year the NDP acted unilaterally to impose a travel ban on committee travel. This is clearly a case of the NDP not acting in collaboration with first nations and northerners, as our government has been doing.
Thankfully, due to the strong leadership of the member of Parliament for Yukon, who strongly advocated for committee hearings to take place in Yukon, we were able to hear from Yukoners. I lived in Yukon for 28 years, consider myself a former Yukoner, and I know that Yukoners appreciate Ottawa hearing their voice.
This is significant. Could the minister please take a moment to highlight for the members opposite how this government continues to work in collaboration with northerners and first nations?",Conservative,Okanagan--Shuswap,Colin Mayes,http://www.parl.gc.ca/parlinfo/Files/Parliamentarian.aspx?Item=2b4c3e77-e409-4739-b561-06e5c5725b7b&Language=E&Section=ALL
4642919,ca.proc.d.2015-06-05.16866.6,2015-06-05,5d65749e-0cdb-4c03-88d4-f57a905acc33,8436,Hon. Bernard Valcourt,Interjection,Government Orders,Yukon and Nunavut Regulatory Improvement Act,,"Mr. Speaker, I briefly want to thank the hon. member for his question. Notwithstanding that he no longer lives there, he has a strong commitment to Yukon.
The hon. member referred to the member of Parliament for Yukon, and I want to pay tribute to that Conservative member, because he rose above politics. Unfortunately, every time he brings a measure that is aimed at trying to do something positive for the benefit of people, other people, especially opposition members, try to score cheap political points.
Let us forget the fundamental of what is aimed for here. The member for Yukon, throughout all of this debate, and it has been tough at points, always rose above politics and addressed the best interests of Yukoners. If there was any doubt in anybody's mind on this side of the House that this is not in the best interests of Yukoners and also of Canada, then the bill would not be here. 
This is about promoting growth, creating jobs, ensuring long-term prosperity and creating opportunities for Canadians in the north, Yukoners who love to live there, but would prefer to continue improving their standard of living, which this bill would achieve.",Conservative,Madawaska--Restigouche,Bernard Valcourt,http://www.parl.gc.ca/parlinfo/Files/Parliamentarian.aspx?Item=5d65749e-0cdb-4c03-88d4-f57a905acc33&Language=E&Section=ALL
4642920,ca.proc.d.2015-06-05.16866.7,2015-06-05,8edb5e32-fc50-4216-bbe1-b112eada513c,80,"Ms. Libby Davies (Vancouver East, NDP)",,Government Orders,Yukon and Nunavut Regulatory Improvement Act,,"Mr. Speaker, having listened to the minister's comments, I want him to know that he is completely incorrect when he says that the entire legislature of Yukon supported this bill. I was up there a few weeks ago and spoke on this bill. I met with many people, and I can say that there are members of the legislative assembly in Whitehorse who are very opposed to this bill. They reflected first nations and community concerns, because people believe that this bill would undermine agreements that are already in place.
I would like to ask the minister to withdraw his comment that this bill is supported by, I think he said, the whole legislative assembly. That is simply not true. He can check the record. It is not true.",New Democratic Party,Vancouver East,Libby Davies,http://www.parl.gc.ca/parlinfo/Files/Parliamentarian.aspx?Item=8edb5e32-fc50-4216-bbe1-b112eada513c&Language=E&Section=ALL
4642921,ca.proc.d.2015-06-05.16866.8,2015-06-05,5d65749e-0cdb-4c03-88d4-f57a905acc33,8436,Hon. Bernard Valcourt,Interjection,Government Orders,Yukon and Nunavut Regulatory Improvement Act,,"Mr. Speaker, I will admit that when the House of Commons passes something and they vote against it, that does not prevent the statement that the House approved it. The legislature approved it, and that is a fact.
As to the other point the member made about some people being against it, of course they are. However, we have to look at the overall players. There are a few objectors to a few of the provisions of the bill, but the overwhelming majority of the provisions are endorsed by first nations, by the legislature of the Yukon, and hopefully also by this House, because the Senate has already unanimously approved the bill.",Conservative,Madawaska--Restigouche,Bernard Valcourt,http://www.parl.gc.ca/parlinfo/Files/Parliamentarian.aspx?Item=5d65749e-0cdb-4c03-88d4-f57a905acc33&Language=E&Section=ALL
