basepk,hid,speechdate,pid,opid,speakeroldname,speakerposition,maintopic,subtopic,subsubtopic,speechtext,speakerparty,speakerriding,speakername,speakerurl
4625716,ca.proc.d.2015-02-02.16582.31,2015-02-02,de0591ef-9a02-4f97-9541-63de484c96e3,87,The Acting Speaker (Mr. Barry Devolin),,Government Orders,Business of Supply,Opposition Motion—Newfoundland and Labrador Fisheries Investment Fund,"Before I go to the minister, I once again remind the member to address the Chair. She is not a newcomer to this place. It is not optional behaviour. It is in fact required.
The hon. Minister of State.",Conservative,Haliburton--Kawartha Lakes--Brock,Barry Devolin,http://www.parl.gc.ca/parlinfo/Files/Parliamentarian.aspx?Item=de0591ef-9a02-4f97-9541-63de484c96e3&Language=E&Section=ALL
4625717,ca.proc.d.2015-02-02.16582.32,2015-02-02,06f7fc82-e362-4d7e-8333-ec9b77dafdfc,207,Hon. Rob Moore,Interjection,Government Orders,Business of Supply,Opposition Motion—Newfoundland and Labrador Fisheries Investment Fund,"Mr. Speaker, I would say absolutely that we are encouraging the province to come to the table with us. 
This is an historic opportunity. We have talked today already about some of the benefits to the seafood and fish sector, manufacturers, and exporters in Newfoundland and Labrador and about the benefits that can accrue to that province.
We also know the hurdles when it comes to access to the European Union. I mentioned some of the tariffs of over 10%, including some as high as over 20%, on the very exports we want to make to that very important market of over 500 million people. 
It is in everyone's interest that we come together to finalize this fund that will be to the benefit of Newfoundland and Labrador, a fund that will protect the seafood industry from any potential negative impacts for having given up minimum processing requirements, and indeed, to move forward on an agreement that will benefit all of us as Canadians.",Conservative,Fundy Royal,Rob Moore,http://www.parl.gc.ca/parlinfo/Files/Parliamentarian.aspx?Item=06f7fc82-e362-4d7e-8333-ec9b77dafdfc&Language=E&Section=ALL
4625718,ca.proc.d.2015-02-02.16582.33,2015-02-02,3dd9162a-4763-4000-8c8a-706a788f7e50,9265,"Ms. Chrystia Freeland (Toronto Centre, Lib.)",,Government Orders,Business of Supply,Opposition Motion—Newfoundland and Labrador Fisheries Investment Fund,"Mr. Speaker, thank you for giving me the opportunity to join this important debate. 
Newfoundland and Labrador's support for CETA hinged to a significant degree on the Government of Canada's promise to help the industry adjust to the recent removal of minimum processing requirements. That promise should have been kept. CETA will eliminate trade barriers and boost free trade between Canada and the European Union. It will also create opportunities for the middle class. 
The Liberal Party of Canada supports free trade because it will open markets to Canadian goods and services, grow export-oriented businesses, create jobs and provide choice and lower prices to Canadian consumers.
Unfortunately, the Conservatives negotiated this agreement without holding a proper public debate. As a result, the government did not adequately address concerns about sectors that could suffer because of CETA, particularly the sector that employs fish plant workers in Newfoundland and Labrador. The removal of minimum processing requirements is definitely a huge concern for the people of Newfoundland and Labrador. The province's support hinged to a significant degree on the federal government's promise to help the industry adjust to this new reality. That promise should be kept. 
 I would also like to quote my colleague, the member for Saint-Laurent—Cartierville, who talked about this matter last week:
 However esoteric federal-provincial relationships might appear to many Canadians, all Canadians want their leaders, especially their Prime Minister, to be trustworthy. 
This is very important. I would like to thank my colleagues, especially the francophone members, for listening to my bad French, and I hope it was understandable.
Now I will continue in English. I thank my francophone colleagues for tolerating my efforts. It is important for us to try, as practice will make perfect.
As my colleague has already suggested in her line of questioning, what is at stake here are some very fundamental issues that go right to the heart of the terrible way the government is conducting itself. I would like to focus on two in particular, and they are the fact that so often, and not just when it comes to trade but it comes to economic policy in general and foreign policy, the government talks big but does not deliver. The government's rhetoric is not matched by execution. One way to put it is that it is obverse of the usual advice, that one should speak softly and carry a big stick. Today's Government of Canada speaks loudly and carries a small stick, particularly when it comes to executing it.
This CETA deal is a perfect example of that. I have lost count of the number of official announcements we have had of this deal being concluded. I have lost count of the amount of taxpayer money that has been spent to celebrate the conclusion of this deal and yet the deal, manifestly, is not there. 
What is more, with each passing week, some new real obstacle, some new hurdle, which the government had to overcome and should have overcome before all of these glorious announcements, manifests itself. This conflict between the federal government and Newfoundland and Labrador is just the latest example.
The second thing I would like to emphasize is something I spoke about a bit earlier when citing my colleague. This dispute speaks so profoundly to way in which the government has failed at one of the essential tasks of statesmanship, and that is relationship building, relationship building with the provinces, one of the central jobs of Ottawa, and relationship building with our partners in the world.
I have a somewhat homey metaphor. I am a mother and I have three kids. Nowadays in classrooms kids do not sit in desks by themselves; the desks are put together in a group. Modern pedagogy understands that the way to accomplish big jobs in the world is through teamwork. Therefore, my 10-year-old daughter sits around a group of tables with other kids. She is already being taught that teamwork is essential. That lesson seems to be lost on the other side of the House.
It is not just in elementary school. During the winter break, I had the privilege of visiting the University of Windsor and seeing its magnificent new engineering department. In its beautiful modern new lecture halls, the students do not sit in seats one by one separated from one another; they sit grouped around tables. Again, teamwork is the key to success in the modern economy. This is an approach that the government is either unable to carry out, or simply does not understand how essential it is.
It is particularly important when it comes to trade. Trade, after all, is about partnerships and relationships. We see the breakdown here when it comes to the relationship between the federal government and Labrador and Newfoundland, but that is far from the only trade relationship that has been dangerously eroded. It is shocking to me to note that in fact our biggest trade and economic relationship, what should be the bedrock international relationship for any Canadian government, the relationship with the United States, has also fallen prey to this my way or the highway bullying approach of the government. We see the evidence of that failure at relationship building and statesmanship in issues like the fact that the Keystone pipeline has not been approved, that it has become a huge and contentious issue in U.S. politics and that there is a huge fight over the port at Prince Rupert.
This unnecessary fight between the federal government and Newfoundland and Labrador is really just a manifestation of a broader failure on many fronts and of these two very characteristic flaws of the government.
 What is particularly troubling to me and my colleagues is that the support of Newfoundland and Labrador for CETA was earned in part by a promise from the Government of Canada to help the industry adjust to the abolition of minimum processing requirements. Is it not elementary that a government should honour its promises? Sadly, that is not what we are seeing.
I would like to quote some comments from representatives of Newfoundland and Labrador. In the St. John's newspaper, The Telegram, Minister Darin King said that if it could not get a deal with Ottawa with the Minister of International Trade, Newfoundland and Labrador planned to take this dispute over the head of the Canadian government to Brussels. Here is what he said to The Telegram:
 Our plan would be to go into the EU — Brussels — and meet with member states and members of the union to outline our position and to seek support from them....We want a resolution. We want to put this to bed because we recognize that CETA is good for the country and good for our province, and we want to put this deal to bed and move forward and get on with things. 
Imagine how Canada would look, how ridiculous our international position would appear, if we had warring Canadian factions travelling to Brussels to present contradictory positions. 
That is not how a well-managed country is run. That is not the way we get a good deal from our counterparties. This is particularly dangerous. This dispute flaring up within our own family, in public, in the House, comes at a particularly dangerous moment. As I sure members know, at this moment, the CETA deal, which we strongly support and believe is really important to the Canadian economy, is facing new objections and pressures from some of the key European Union players. There have been voices raised against it in France and, particularly, in Germany. At a time when support is fraying, this is not a time for us to fail to get our ducks in a row at home and to fail to have unity, to break promises within the Canadian families. I am disappointed to say that this is what is happening.
Trade deals are an area where, like so much economic policy, timing matters and delaying costs people real money. This is not an issue where the government has the luxury of fighting interpersonal battles or ideological battles. To delay is to take money out of the pockets of hard-working Canadians. We have had a very clear and stark example of that reality very recently, and that is in our trade with South Korea.
The United States, the EU and even Australia got to a trade deal with Korea ahead of us. We are delighted that a deal has finally been done, but because of that delay during that period, Canadian exporters lost 30% of market share. Experts calculate that this was a loss of about $8 billion. That is a lot of money, which simply through delay, was effectively taken out of the pockets of hard-working Canadian business people. We really need to focus on timing. We need to get beyond the rhetoric and get this deal done, not have fighting at home. 
I am getting increasingly concerned about CETA. Last week, I met with many business people whose businesses depend directly upon this deal getting done. They are worried that we have not completed the deal, despite multiple announcements.
There is a very real reason to be worried. If we cannot resolve our disputes at home and get the deal done, it will be in real jeopardy.
As members know, the United States is now negotiating its own trade deal with Europe. This is a huge political issue in Europe, indeed, an issue which raises concerns at a much higher, much more emotional level than the deal with Canada. It is essential for us to get our deal done, to get it signed, to get it out the door before the debate around the negotiations with the U.S. really becomes a central political focus in Europe.
It is also essential for us to get this done, to resolve our disputes at home, because the EU negotiators will not have time for us forever. They will not be able to focus on internal Canadian squabbles forever, on possible visits this month from officials from Newfoundland and Labrador to Brussels. Their focus will be shifting to the U.S. deal. It is absolutely incumbent upon the government to resolve this dispute and to get the deal done.
Why does the Liberal Party feel so strongly about the importance of trade, of getting deals done, of getting access to market for Canadian producers? Eighty per cent of our economy is dependent, directly or indirectly, upon trade. That is huge. Our dependence on having effective relationships and effective access to international markets is particularly great today. As 2015 has dawned, we have seen a global economy looking much less rosy than we were hearing from the other side of the House all last year. 
We are entering a global economic environment of unexpectedly falling commodity prices, including low oil prices, which is a very serious issue for the Canadian economy, as everyone from the Bank of Canada to TD have said. There is another really big issue out there that is shadowing our economy. It is the issue of what Larry Summers, the former secretary of the U.S. Treasury, likes to call “secular stagnation”. This is the idea that the western industrialized economies might currently be stuck in a period of low growth.
I am very sad to say that because of the shortsighted ideological thinking of the government, because of its all-eggs-in-one-basket play in the oil sector, Canada is unprepared for these rocky international waters. At a time like this, more than ever we simply cannot afford to be fighting amongst ourselves, to have these embarrassing unprofessional fights between a provincial government and the federal one over a trade deal that we desperately need to conclude. We need to get it done. It is really not acceptable, in fact it is incredibly dangerous, for our country to be stalled in this space with Newfoundland and Labrador's really objecting and talking about a trust betrayed. 
I would like to tell the House what some of the leaders from Newfoundland and Labrador, in their own words, had to say. Premier Paul Davis said: “We’re at a crossroads where the federal government has changed the rules”.
That, to me, goes to the heart of the issue here, that in the midst of this incredibly important, much bally-hooed, and incredibly complex deal that is central to our economy, the government dropped the ball on this key federal-provincial relationship and had the temerity to change the rules half way through. That is not statesmanship. That is not grown-up management of a country, of an economy, and of a trade negotiation.
Darin King, Newfoundland and Labrador's business minister, said: “The federal government’s failure to honour the terms of this fund is jeopardizing CETA for all industries, economic sectors, and indeed all Canadian and European Union citizens”.
He had it exactly right. We all want this deal done. The government had the privilege of negotiating the deal not just with the EU, but also with our Canadian provincial partners. It has simply dropped the ball. It is being accused by its partners of failing in what is a key duty of a federal government, to be trustworthy and to keep its word. 
Finally, I want to quote the intergovernmental affairs minister, Keith Hutchings, who said: 
 We've got to be able to hold fast to those items that we negotiated. It's a much bigger issue. Once we go down that road of giving the authority to the federal government and saying, “Well, you can negotiate something, but once it gets to the final stages you can pull back and say no, that's fine.” As a government we can't approve of that. 
What is really at stake here is probably the most fundamental issue of leadership and governance. That is integrity. It is trust. The real issue is the economy is at stake. A trade deal is at stake. Even more crucially, the government's ability to be trusted by Canadians is at stake. That is why I am delighted we have the opportunity to debate this in the House today. I hope the government will see the light. ",Liberal,Toronto Centre,Chrystia Freeland,http://www.parl.gc.ca/parlinfo/Files/Parliamentarian.aspx?Item=3dd9162a-4763-4000-8c8a-706a788f7e50&Language=E&Section=ALL
4625719,ca.proc.d.2015-02-02.16582.34,2015-02-02,fafe6874-861e-4e93-a90e-0817e5765d67,1063,"Mr. Ryan Cleary (St. John's South—Mount Pearl, NDP)",,Government Orders,Business of Supply,Opposition Motion—Newfoundland and Labrador Fisheries Investment Fund,"Mr. Speaker, the hon. member made a very good point about relationship-building. Of course, the Conservative government has no relationship with Newfoundland and Labrador, but then, two betrayals do not make for a good relationship.
This dispute comes down to two sides of the story. On the one hand, the Province of Newfoundland and Labrador said that the fisheries fund was all about transition, development, and renewal. That is what the $400 million fund was for. That is the province's take on this. 
The federal Conservatives say that this fisheries fund is compensation for losses as a result of the province's giving up minimum processing requirements. In other words, it is compensation for losses incurred by giving up this major fisheries policy. This is a $400 million fund and if the Conservatives are right, the fund is to compensate for losses. The Conservatives are contributing $280 million and the provincial government is contributing $120 million. 
Why would the Government of Newfoundland and Labrador contribute $120 million to a fund to compensate itself? Does that itself not raise questions about the Conservatives' side of the story?",New Democratic Party,St. John's South--Mount Pearl,Ryan Cleary,http://www.parl.gc.ca/parlinfo/Files/Parliamentarian.aspx?Item=fafe6874-861e-4e93-a90e-0817e5765d67&Language=E&Section=ALL
4625720,ca.proc.d.2015-02-02.16582.35,2015-02-02,3dd9162a-4763-4000-8c8a-706a788f7e50,9265,Ms. Chrystia Freeland,Interjection,Government Orders,Business of Supply,Opposition Motion—Newfoundland and Labrador Fisheries Investment Fund,"Mr. Speaker, the hon. member has an important point. I very much agree with him that this hits the fundamental issue of trust and transparency.
A lot of our discussion today feels as if it were some kind of cheap detective novel or divorce case, a he-said versus she-said issue, as we parse exactly what the email did and did not contain and what the intentions of the different parties were. That is not the way a healthy federation works. There should not be this sort of fight between a federal government and the provinces if the government has a good, healthy, trust-based relationships with them. This is essential for Canada to function.",Liberal,Toronto Centre,Chrystia Freeland,http://www.parl.gc.ca/parlinfo/Files/Parliamentarian.aspx?Item=3dd9162a-4763-4000-8c8a-706a788f7e50&Language=E&Section=ALL
4625721,ca.proc.d.2015-02-02.16582.36,2015-02-02,a52ac646-bd34-440f-b534-2474625065e9,175,"Mr. James Lunney (Nanaimo—Alberni, CPC)",,Government Orders,Business of Supply,Opposition Motion—Newfoundland and Labrador Fisheries Investment Fund,"Mr. Speaker, I would like to quote Sharon Horan, 2014 chair of the St. John’s Board of Trade, who stated:
 The CETA agreement provides significant opportunity for our members to do business with the affluent 500 million consumers in Europe, CETA is one of the most significant trade deals ever negotiated for Canadian business, including businesses right here in St. John’s. 
Therefore, there is no negative impact at the present time. As everyone knows, the deal has not been concluded. Most of the impact from CETA would be positive and any negative impact would be compensated.
Does the member encourage or support the Government of Newfoundland and Labrador coming to the table to negotiate whatever its concerns and differences are so that the compensation can be delivered as it is intended when the time is appropriate?",Conservative,Nanaimo--Alberni,James Lunney,http://www.parl.gc.ca/parlinfo/Files/Parliamentarian.aspx?Item=a52ac646-bd34-440f-b534-2474625065e9&Language=E&Section=ALL
4625722,ca.proc.d.2015-02-02.16582.37,2015-02-02,3dd9162a-4763-4000-8c8a-706a788f7e50,9265,Ms. Chrystia Freeland,Interjection,Government Orders,Business of Supply,Opposition Motion—Newfoundland and Labrador Fisheries Investment Fund,"Mr. Speaker, with all due respect, the quote cited by the hon. member misses the point. There is no dispute between the federal government and Newfoundland and Labrador about the overall benefits of CETA. Indeed, there is no dispute between the party opposite and my own about the overall benefits of CETA. We believe that it is essential for Canada to have a trade deal with the European Union. Our only disappointment is that there seem to be a lot more announcements and big, expensive parties than actual done deals.
When it comes to the conduct of the Province of Newfoundland and Labrador, my concern is that we are hearing from the elected representatives of that province in the clearest most direct and most aggrieved terms that they feel betrayed by the federal government. I think the people who need to come to the table today and fix this relationship are the members opposite and the federal government.",Liberal,Toronto Centre,Chrystia Freeland,http://www.parl.gc.ca/parlinfo/Files/Parliamentarian.aspx?Item=3dd9162a-4763-4000-8c8a-706a788f7e50&Language=E&Section=ALL
4625723,ca.proc.d.2015-02-02.16582.38,2015-02-02,4abeb9b5-279b-4117-9e04-b8901d9ccc53,255,"Mr. Francis Scarpaleggia (Lac-Saint-Louis, Lib.)",,Government Orders,Business of Supply,Opposition Motion—Newfoundland and Labrador Fisheries Investment Fund,"Mr. Speaker, I noticed that the hon. member brought up the situation in Prince Rupert, which it turns out is an extremely complicated situation. There is the fact that Alaska is leasing the port. It is also complicated by the fact that there is the potential for different suppliers of steel for this port. Another element is the fact we are talking about a local labour force that would be called upon to build the port. The last factor is that cruise ships can bypass that port if need be.
We saw the government react rather quickly and aggressively to the news that buy American was going to apply there. However, given the complexity of the situation, should Canada and the government not have entered into some fairly sophisticated discussions with the players on this issue? Why do we have an embassy if it cannot engage governors and legislators to solve these problems?",Liberal,Lac-Saint-Louis,Francis Scarpaleggia,http://www.parl.gc.ca/parlinfo/Files/Parliamentarian.aspx?Item=4abeb9b5-279b-4117-9e04-b8901d9ccc53&Language=E&Section=ALL
4625724,ca.proc.d.2015-02-02.16582.39,2015-02-02,3dd9162a-4763-4000-8c8a-706a788f7e50,9265,Ms. Chrystia Freeland,Interjection,Government Orders,Business of Supply,Opposition Motion—Newfoundland and Labrador Fisheries Investment Fund,"Mr. Speaker, I thank my hon. colleague for his excellent question. As many in the House know, he has a long-standing and deep interest and expertise in all of Canada's waterways.
I raised the issue of Prince Rupert precisely because it is symptomatic of the high-handed, my-way-or-the-highway conduct of the current government, which we are again seeing manifested in this dispute with Newfoundland and Labrador. As my hon. colleague rightly points out, we have an excellent diplomatic service and an excellent ambassador in the United States. However, his hands are tied because the only message he is allowed to deliver is, “We're going to do it my way”. That kind of behaviour, those kinds of ideological blinders, and that kind of rhetoric is not working in our relationship with the United States and, I am sad to say, it is not working in Ottawa's relationship with the provinces. It is time for a change.",Liberal,Toronto Centre,Chrystia Freeland,http://www.parl.gc.ca/parlinfo/Files/Parliamentarian.aspx?Item=3dd9162a-4763-4000-8c8a-706a788f7e50&Language=E&Section=ALL
