basepk,hid,speechdate,pid,opid,speakeroldname,speakerposition,maintopic,subtopic,subsubtopic,speechtext,speakerparty,speakerriding,speakername,speakerurl
4625803,ca.proc.d.2015-02-02.16582.118,2015-02-02,cbc560fb-146a-42d9-b7a4-19ee7de9c9a6,8353,"Mr. Robert Sopuck (Dauphin—Swan River—Marquette, CPC)",,Oral Questions,National Defence,,"Mr. Speaker, Canada continues to stand in solidarity with the people of Ukraine in the face of clear Russian military aggression. This is precisely why we have made significant contributions to NATO's Ukrainian assurance measures. Canadian fighter jets have conducted Baltic air policing. The HMCS Fredericton is assigned to NATO's standing Maritime task force, and Canadian Armed Forces personnel have conducted training exercises in eastern Europe. 
Can the Parliamentary Secretary to the Minister of National Defence provide the House with an update on the latest actions that our government is taking to show Canada's support for Ukraine?",Conservative,Dauphin--Swan River--Marquette,Robert Sopuck,http://www.parl.gc.ca/parlinfo/Files/Parliamentarian.aspx?Item=cbc560fb-146a-42d9-b7a4-19ee7de9c9a6&Language=E&Section=ALL
4625804,ca.proc.d.2015-02-02.16582.119,2015-02-02,72dace30-741a-4877-8c1c-31b5dc3e4a8e,28,"Mr. James Bezan (Parliamentary Secretary to the Minister of National Defence, CPC)",,Oral Questions,National Defence,,"Mr. Speaker, I want to thank the member for Dauphin—Swan River—Marquette for his continued support for the people of Ukraine. I am pleased to announce that today Canada will join the United States-Ukraine joint commission on defence reform and bilateral co-operation. This will significantly improve Canada's ability to provide assistance to the Ukrainian armed forces. Together, we will increase the capacity of the Ukraine security forces to defend Ukraine's territorial integrity.
In the face of this unacceptable Russian military aggression, Canada will do its part to support Ukraine, its sovereign territory, and the people of Ukraine.",Conservative,Selkirk--Interlake,James Bezan,http://www.parl.gc.ca/parlinfo/Files/Parliamentarian.aspx?Item=72dace30-741a-4877-8c1c-31b5dc3e4a8e&Language=E&Section=ALL
4625805,ca.proc.d.2015-02-02.16582.120,2015-02-02,000a129f-5449-40ed-94d2-7e21a262b0b1,8528,"Ms. Nycole Turmel (Hull—Aylmer, NDP)",,Oral Questions,Labour,,"Mr. Speaker, the Supreme Court just struck down a law that prevented Saskatchewan public servants from striking. The court reiterated that the right to strike is protected by the Constitution and that the government cannot arbitrarily expand the scope of what constitutes essential services.
Will the Conservatives acknowledge this decision and amend Bill C-4, which drastically restricts the right to strike and labour relations in the public service?",New Democratic Party,Hull--Aylmer,Nycole Turmel,http://www.parl.gc.ca/parlinfo/Files/Parliamentarian.aspx?Item=000a129f-5449-40ed-94d2-7e21a262b0b1&Language=E&Section=ALL
4625806,ca.proc.d.2015-02-02.16582.121,2015-02-02,3060b2f8-9254-4bba-8c6a-07906e591f1c,8918,"Hon. K. Kellie Leitch (Minister of Labour and Minister of Status of Women, CPC)",,Oral Questions,Labour,,"Mr. Speaker, the decision rendered by the Supreme Court last Friday focused on essential services legislation governing Saskatchewan's public sector employees. As such, it does not directly deal with the federal labour legislation. Our government is reviewing this decision. We will be moving forward in the future. However, as I said, this is about the public sector in Saskatchewan.",Conservative,Simcoe--Grey,Kellie Leitch,http://www.parl.gc.ca/parlinfo/Files/Parliamentarian.aspx?Item=3060b2f8-9254-4bba-8c6a-07906e591f1c&Language=E&Section=ALL
4625807,ca.proc.d.2015-02-02.16582.122,2015-02-02,000a129f-5449-40ed-94d2-7e21a262b0b1,8528,"Ms. Nycole Turmel (Hull—Aylmer, NDP)",,Oral Questions,Labour,,"Mr. Speaker, on Friday the Supreme Court recognized that the right to strike is protected under the Constitution. The Conservatives have shown a blatant disregard for the right to strike, even stripping it from federal workers with Bill C-4. That deal is nearly identical to the Saskatchewan law that the Supreme Court just ruled is not constitutional. Will the minister sit down with the unions and come up with an agreement, or will he waste tax dollars fighting to protect an unconstitutional law?",New Democratic Party,Hull--Aylmer,Nycole Turmel,http://www.parl.gc.ca/parlinfo/Files/Parliamentarian.aspx?Item=000a129f-5449-40ed-94d2-7e21a262b0b1&Language=E&Section=ALL
4625808,ca.proc.d.2015-02-02.16582.123,2015-02-02,3060b2f8-9254-4bba-8c6a-07906e591f1c,8918,"Hon. K. Kellie Leitch (Minister of Labour and Minister of Status of Women, CPC)",,Oral Questions,Labour,,"Mr. Speaker, I meet regularly with both employees and employers. I receive their input on a wide range of subject matters. I am quite happy to say, yet again, as I mentioned earlier, that the Supreme Court came forward with its ruling. It is focused specifically with respect to Saskatchewan's public sector union. We are reviewing it. As I say, I will continue to work with both the employers and employees in the labour sector to make sure that we have a productive Canadian economy.",Conservative,Simcoe--Grey,Kellie Leitch,http://www.parl.gc.ca/parlinfo/Files/Parliamentarian.aspx?Item=3060b2f8-9254-4bba-8c6a-07906e591f1c&Language=E&Section=ALL
4625809,ca.proc.d.2015-02-02.16582.124,2015-02-02,4bc128a9-b349-4867-a545-ad05122c0e46,598,"Ms. Niki Ashton (Churchill, NDP)",,Oral Questions,Aboriginal Affairs,,"Mr. Speaker, this government has also abandoned aboriginal communities. Aboriginal people continue to face deplorable living conditions. They are often living in poorly insulated, overcrowded houses with no clean drinking water.
Departmental statistics show that nearly 25% of aboriginal children live in poverty in Canada, a G7 country. That is unacceptable.
What is the government waiting for? When will it finally take action?",New Democratic Party,Churchill,Niki Ashton,http://www.parl.gc.ca/parlinfo/Files/Parliamentarian.aspx?Item=4bc128a9-b349-4867-a545-ad05122c0e46&Language=E&Section=ALL
4625810,ca.proc.d.2015-02-02.16582.125,2015-02-02,5d65749e-0cdb-4c03-88d4-f57a905acc33,8436,"Hon. Bernard Valcourt (Minister of Aboriginal Affairs and Northern Development, CPC)",,Oral Questions,Aboriginal Affairs,,"Mr. Speaker, the government works every day and every week with its aboriginal partners across the country to address the challenges that are present in many of these communities.
We know that the NDP measures the government's effort based on the tax dollars that have been invested. If we use that as our yardstick, we can see that since 2006, investments to improve life in aboriginal communities have increased significantly.",Conservative,Madawaska--Restigouche,Bernard Valcourt,http://www.parl.gc.ca/parlinfo/Files/Parliamentarian.aspx?Item=5d65749e-0cdb-4c03-88d4-f57a905acc33&Language=E&Section=ALL
4625811,ca.proc.d.2015-02-02.16582.126,2015-02-02,4bc128a9-b349-4867-a545-ad05122c0e46,598,"Ms. Niki Ashton (Churchill, NDP)",,Oral Questions,Aboriginal Affairs,,"Mr. Speaker, I am talking about levels of child poverty that are unprecedented in our country. This country is having an unprecedented conversation about systemic racism, and the only one that is not part of it is the federal government.
Internal reports from AANDC last week showed that first nations in Manitoba have the most challenging living conditions. People love their communities. They love where they come from, and they want to be part of making these places better, but they agree that conditions must change. Under the government, access to education, housing, and economic opportunities are below other first nations, and, of course, non-first nation communities. 
Will the minister step up, acknowledge the systemic discrimination, and be part of the solution?",New Democratic Party,Churchill,Niki Ashton,http://www.parl.gc.ca/parlinfo/Files/Parliamentarian.aspx?Item=4bc128a9-b349-4867-a545-ad05122c0e46&Language=E&Section=ALL
4625812,ca.proc.d.2015-02-02.16582.127,2015-02-02,5d65749e-0cdb-4c03-88d4-f57a905acc33,8436,"Hon. Bernard Valcourt (Minister of Aboriginal Affairs and Northern Development, CPC)",,Oral Questions,Aboriginal Affairs,,"Mr. Speaker, as I have said before, our government believes that aboriginal people should have the same quality of life and the same opportunities as other Canadians. That is why we continue to take action and move forward on key priorities. 
Since 2006, our investment in housing, for example, just in Manitoba, has resulted in the construction of more than 1,800 new homes. We have committed significant funds to Manitoba's water and waste water infrastructure. We have also made investments in education and job training, and we will continue that.",Conservative,Madawaska--Restigouche,Bernard Valcourt,http://www.parl.gc.ca/parlinfo/Files/Parliamentarian.aspx?Item=5d65749e-0cdb-4c03-88d4-f57a905acc33&Language=E&Section=ALL
4625813,ca.proc.d.2015-02-02.16582.128,2015-02-02,f470e27a-a074-4b16-8304-960ffe8c9289,24,"Hon. Carolyn Bennett (St. Paul's, Lib.)",,Oral Questions,Persons with Disabilities,,"Mr. Speaker, the Conservative government is cynically trying to balance its budget by holding back money that is allocated to Canadians with disabilities. In previous years, almost every penny allocated to the enabling accessibility fund was spent, but last year the government lapsed more than a third of that budget. More shocking is where this small amount of money is going; almost three-quarters of the money is spent in Conservative-held ridings.
Will the government stop playing politics with some of Canada's most vulnerable people?",Liberal,St. Paul's,Carolyn Bennett,http://www.parl.gc.ca/parlinfo/Files/Parliamentarian.aspx?Item=f470e27a-a074-4b16-8304-960ffe8c9289&Language=E&Section=ALL
4625814,ca.proc.d.2015-02-02.16582.129,2015-02-02,9d3d2220-818c-494e-8d58-29f7cee7b65d,600,"Hon. Candice Bergen (Minister of State (Social Development), CPC)",,Oral Questions,Persons with Disabilities,,"Mr. Speaker, we are very proud of the enabling accessibility fund. We have funded over 1,800 projects across the country. Of course, projects need to actually be applied for in order to receive the funding, and the ridings and regions that have received funding are in direct proportion to the applications they have submitted.
We look forward to applications coming in from every corner of the country, from every riding, and to continuing to fund the enabling accessibility fund for people with disabilities.",Conservative,Portage--Lisgar,Candice Bergen,http://www.parl.gc.ca/parlinfo/Files/Parliamentarian.aspx?Item=9d3d2220-818c-494e-8d58-29f7cee7b65d&Language=E&Section=ALL
4625815,ca.proc.d.2015-02-02.16582.130,2015-02-02,6bde42a3-d07c-4c1f-b9d4-9e14a124f465,89,"Hon. Stéphane Dion (Saint-Laurent—Cartierville, Lib.)",,Oral Questions,Persons with Disabilities,,"Mr. Speaker, Quebec received only 7% of the funding available to renovate buildings to make them accessible to people with disabilities. Why did Quebec receive only 7%?
Is it because the Conservatives are allocating two-thirds or more of this funding to Conservative ridings, which are few and far between in Quebec? Is it because the Conservatives are neglecting Quebec? Is it because the Quebec ministers are asleep at the wheel? Is it for all of the above reasons?",Liberal,Saint-Laurent--Cartierville,Stéphane Dion,http://www.parl.gc.ca/parlinfo/Files/Parliamentarian.aspx?Item=6bde42a3-d07c-4c1f-b9d4-9e14a124f465&Language=E&Section=ALL
4625816,ca.proc.d.2015-02-02.16582.131,2015-02-02,9d3d2220-818c-494e-8d58-29f7cee7b65d,600,"Hon. Candice Bergen (Minister of State (Social Development), CPC)",,Oral Questions,Persons with Disabilities,,"Mr. Speaker, the proportion of funds that were allocated to projects are consistent with the applications received. 
Let me give an example. In Ontario that particular year, there were a total of 1,092 applications received. In Quebec there were 206.
I would encourage all members to let their constituents, their community places know about the enabling accessibility fund. We are continuing to fund these projects, but I would encourage them to let their ridings know. Whatever their province they are from, those members of Parliament should help their community places know about our enabling accessibility fund.",Conservative,Portage--Lisgar,Candice Bergen,http://www.parl.gc.ca/parlinfo/Files/Parliamentarian.aspx?Item=9d3d2220-818c-494e-8d58-29f7cee7b65d&Language=E&Section=ALL
4625817,ca.proc.d.2015-02-02.16582.132,2015-02-02,f4efade5-e605-4926-b4d9-cea84ef76f14,2038,"Mr. Randall Garrison (Esquimalt—Juan de Fuca, NDP)",,Oral Questions,National Defence,,"Mr. Speaker, emails released to the Ottawa Citizen today show that on the day of the shooting on Parliament Hill in October, Canadian military leaders were saying that the event presented a “strategic opportunity” to affirm Canada's participation in the war in Iraq.
Subsequently, senior officials expressed the desire to appear alongside Ottawa Police at a press conference the next day.
These are emotional times for all, but would the government agree that describing the events on Parliament Hill as a strategic opportunity is regrettable?",New Democratic Party,Esquimalt--Juan de Fuca,Randall Garrison,http://www.parl.gc.ca/parlinfo/Files/Parliamentarian.aspx?Item=f4efade5-e605-4926-b4d9-cea84ef76f14&Language=E&Section=ALL
4625818,ca.proc.d.2015-02-02.16582.133,2015-02-02,72dace30-741a-4877-8c1c-31b5dc3e4a8e,28,"Mr. James Bezan (Parliamentary Secretary to the Minister of National Defence, CPC)",,Oral Questions,National Defence,,"Mr. Speaker, as we have said right from the start, we are in a battle with ISIL and the terrorists. They were the ones who declared war on Canada and her allies. We will continue to confront them head on.
I am proud of the job our Canadian Armed Forces is doing in Operation Impact. Whether it is the air task force or our special operations forces, they are aiding, assisting and providing the advice that is required by the Iraqi security forces and the Kurdish peshmerga.",Conservative,Selkirk--Interlake,James Bezan,http://www.parl.gc.ca/parlinfo/Files/Parliamentarian.aspx?Item=72dace30-741a-4877-8c1c-31b5dc3e4a8e&Language=E&Section=ALL
4625819,ca.proc.d.2015-02-02.16582.134,2015-02-02,383ed93c-f141-4f87-b873-124d3051a31f,8621,"Ms. Élaine Michaud (Portneuf—Jacques-Cartier, NDP)",,Oral Questions,National Defence,,"Mr. Speaker, according to an email exchange obtained by the Ottawa Citizen, one of the Prime Minister's military advisors described the October 22 attacks in Ottawa as “a strategic opportunity” to affirm the purpose of the Canadian military mission in Iraq.
Does it seem normal to the government that on the day of the attacks in Ottawa, people in the Langevin Block were thinking about scoring political points and justifying the war in Iraq rather than focusing exclusively on the safety of Canadians?",New Democratic Party,Portneuf--Jacques-Cartier,Élaine Michaud,http://www.parl.gc.ca/parlinfo/Files/Parliamentarian.aspx?Item=383ed93c-f141-4f87-b873-124d3051a31f&Language=E&Section=ALL
4625820,ca.proc.d.2015-02-02.16582.135,2015-02-02,72dace30-741a-4877-8c1c-31b5dc3e4a8e,28,"Mr. James Bezan (Parliamentary Secretary to the Minister of National Defence, CPC)",,Oral Questions,National Defence,,"Mr. Speaker, I know the NDP is opposed to protecting the innocent people of Iraq who have been brutalized and terrorized by ISIL. We will continue to work with our Iraqi security forces and our allies in this coalition to defeat ISIL, and ensure it is not able to bring its brand of terrorism to us in Canada.",Conservative,Selkirk--Interlake,James Bezan,http://www.parl.gc.ca/parlinfo/Files/Parliamentarian.aspx?Item=72dace30-741a-4877-8c1c-31b5dc3e4a8e&Language=E&Section=ALL
4625821,ca.proc.d.2015-02-02.16582.136,2015-02-02,a10a55d4-becb-4b98-b780-9fa8cfd5aa12,575,"Mr. Phil McColeman (Brant, CPC)",,Oral Questions,Public Safety,,"Mr. Speaker, terrorism is one of the greatest threats facing society today. These barbarians from the so-called Islamic State despise the Canadian values of equality and prosperity.
 Our Conservative Government has taken strong action to meet this challenge by joining our allies in military action to degrade and destroy the threat they pose, and by giving our security agencies the tools they need to keep Canadians safe.
 Could the Minister of Public Safety and Emergency Preparedness please update the House on legislative measures to combat the terrorist threat?",Conservative,Brant,Phil McColeman,http://www.parl.gc.ca/parlinfo/Files/Parliamentarian.aspx?Item=a10a55d4-becb-4b98-b780-9fa8cfd5aa12&Language=E&Section=ALL
4625822,ca.proc.d.2015-02-02.16582.137,2015-02-02,22a96405-bed6-45e9-811a-69d055416803,408,"Hon. Steven Blaney (Minister of Public Safety and Emergency Preparedness, CPC)",,Oral Questions,Public Safety,,"Mr. Speaker, the international jihadi movement has declared war on Canada. Canadians are being targeted by jihadi terrorists simply because these terrorists hate our society and the values it represents, our values.
Jihadi terrorism is not a UN right. It is a criminal act. That is why, under the leadership of this government, we put forward the Combating Terrorism Act more than a year ago with no support from the NDP.
We are ready to revoke passports. We are ready to take action like removing dual citizenship to protect Canadians. There is no support from the NDP. We are standing up to protect Canadians.",Conservative,Lévis--Bellechasse,Steven Blaney,http://www.parl.gc.ca/parlinfo/Files/Parliamentarian.aspx?Item=22a96405-bed6-45e9-811a-69d055416803&Language=E&Section=ALL
4625823,ca.proc.d.2015-02-02.16582.138,2015-02-02,86fed1de-3861-4448-8242-ad414073ef2e,550,"Ms. Joyce Murray (Vancouver Quadra, Lib.)",,Oral Questions,Veterans Affairs,,"Mr. Speaker, the new Minister of Veterans Affairs tabled a progress report on government changes to the new veterans charter. It was so lacking, he slipped it out on a Friday night. 
He still does not address the benefit clawbacks for the most severely disabled, the unfairness of the lump sum payout, caseworker overloading, nor the unequal treatment of reservists. His solution for the lack of help for spouses of veterans with severe PTSD, like Jenny Migneault, is an online app.
These problems were identified years ago. How much longer will the minister make our injured forces members and our veterans wait?",Liberal,Vancouver Quadra,Joyce Murray,http://www.parl.gc.ca/parlinfo/Files/Parliamentarian.aspx?Item=86fed1de-3861-4448-8242-ad414073ef2e&Language=E&Section=ALL
4625824,ca.proc.d.2015-02-02.16582.139,2015-02-02,213c7c78-812a-4123-ac14-dc73da49de1f,435,"Mr. Pierre Lemieux (Parliamentary Secretary to the Minister of Veterans Affairs, CPC)",,Oral Questions,Veterans Affairs,,"Mr. Speaker, MPs from all parties on the Standing Committee on Veterans Affairs worked together cohesively and they made a number of constructive recommendations. One of these recommendations was that the government update the committee on January 30, and that is exactly what the minister did.
He released a six-page letter in which he outlined the progress the government was making on recommendations. I am running out of time, but I will list one of them. One of the recommendations was to extend psychological counselling to the families of veterans. 
On December 1, 2014, we extended the number of psychological counselling sessions available to family members of veterans.",Conservative,Glengarry--Prescott--Russell,Pierre Lemieux,http://www.parl.gc.ca/parlinfo/Files/Parliamentarian.aspx?Item=213c7c78-812a-4123-ac14-dc73da49de1f&Language=E&Section=ALL
4625825,ca.proc.d.2015-02-02.16582.140,2015-02-02,ee8f6ddb-8734-41d4-9d72-00bff431336a,9166,"Ms. Jinny Jogindera Sims (Newton—North Delta, NDP)",,Oral Questions,Veterans Affairs,,"Mr. Speaker, there has been a lot of Conservative talk about safety, but not a single cent of new resources for the police.
 A year ago, the NDP proposed a common sense Surrey accord that would put more police on our streets. A year later, violent crime in my community is up and the only response from Conservatives has been more cuts to the RCMP.
 When will the Conservatives keep their promise to put more police on Surrey streets?",New Democratic Party,Newton--North Delta,Jinny Sims,http://www.parl.gc.ca/parlinfo/Files/Parliamentarian.aspx?Item=ee8f6ddb-8734-41d4-9d72-00bff431336a&Language=E&Section=ALL
4625826,ca.proc.d.2015-02-02.16582.141,2015-02-02,22a96405-bed6-45e9-811a-69d055416803,408,"Hon. Steven Blaney (Minister of Public Safety and Emergency Preparedness, CPC)",,Oral Questions,Veterans Affairs,,"Mr. Speaker, over the course of the years we have increased the budget of our police by seven times, and seven times we did not get support from the opposition.
 The real question is this. When will police officers get real money from the opposition instead of empty talk? They can count on us to provide the resources they need. ",Conservative,Lévis--Bellechasse,Steven Blaney,http://www.parl.gc.ca/parlinfo/Files/Parliamentarian.aspx?Item=22a96405-bed6-45e9-811a-69d055416803&Language=E&Section=ALL
4625827,ca.proc.d.2015-02-02.16582.142,2015-02-02,e6ed9cc9-b42d-47f6-aac8-3335ed0fe78b,704,"Mr. John Carmichael (Don Valley West, CPC)",,Oral Questions,Health,,"Mr. Speaker, last week we heard reports of a marijuana home grow op located right beside a school in Markham. Parents are outraged that their kids keep coming home from school stinking of pot, yet this grow op continues to be allowed because the courts are standing in the way of our government's efforts to stop old Liberal programs that allowed grow ops. 
Could the Minister of Health please update the House on our government's efforts to shut down these dangerous grow ops and protect families?",Conservative,Don Valley West,John Carmichael,http://www.parl.gc.ca/parlinfo/Files/Parliamentarian.aspx?Item=e6ed9cc9-b42d-47f6-aac8-3335ed0fe78b&Language=E&Section=ALL
4625828,ca.proc.d.2015-02-02.16582.143,2015-02-02,cf6f39df-d304-45e1-a559-70a0cf20a720,6,"Hon. Rona Ambrose (Minister of Health, CPC)",,Oral Questions,Health,,"Mr. Speaker, it is for these very reasons that we have made tough new laws ending home grow ops for marijuana. Unfortunately, we are battling the courts with the delay. 
However, as health minister, I am absolutely appalled that the Liberal leader actually has defended these home grow ops and continues to advocate for mass legalization of marijuana. When we legalize something, we normalize it and when we normalize it, the message to kids is that it is okay. It is not okay for kids to smoke marijuana. It is harmful for their health, and we will be the government that will continue to protect the health of kids. ",Conservative,Edmonton--Spruce Grove,Rona Ambrose,http://www.parl.gc.ca/parlinfo/Files/Parliamentarian.aspx?Item=cf6f39df-d304-45e1-a559-70a0cf20a720&Language=E&Section=ALL
4625829,ca.proc.d.2015-02-02.16582.144,2015-02-02,4b9cf7c8-d5db-4efa-a24e-c26afde48cc3,232,"Mr. Louis Plamondon (Bas-Richelieu—Nicolet—Bécancour, BQ)",,Oral Questions,Regional Development,," Mr. Speaker, over the weekend, the Conseil du patronat du Québec gave us lesson on how to lose touch with the regions. I should point out that the federal government has brought in austerity measures, such as the latest EI reforms, which have spurred the rural and regional exodus.
Do the Prime Minister and his minister not think that it is time to implement measures, such as the ones the Bloc Québécois has proposed, to target the regions and help create jobs, develop our communities and help these regions prosper?",Bloc Québécois,Bas-Richelieu--Nicolet--Bécancour,Louis Plamondon,http://www.parl.gc.ca/parlinfo/Files/Parliamentarian.aspx?Item=4b9cf7c8-d5db-4efa-a24e-c26afde48cc3&Language=E&Section=ALL
4625830,ca.proc.d.2015-02-02.16582.145,2015-02-02,655f75f0-7c4c-4dd1-b0d7-317be0595660,545,"Hon. Denis Lebel (Minister of Infrastructure, Communities and Intergovernmental Affairs and Minister of the Economic Development Agency of Canada for the Regions of Quebec, CPC)",,Oral Questions,Regional Development,,"Mr. Speaker, Canada's economic action plan for the regions of Quebec is present in all regions of Quebec. We are carrying out projects all across Quebec, by partnering with and supporting proponents. We are obviously aware of what was said by the Conseil du patronat du Québec, but Mr. Dorval has backtracked a little. 
We believe we must continue to support economic development in every region of Canada and Quebec.",Conservative,Roberval--Lac-Saint-Jean,Denis Lebel,http://www.parl.gc.ca/parlinfo/Files/Parliamentarian.aspx?Item=655f75f0-7c4c-4dd1-b0d7-317be0595660&Language=E&Section=ALL
4625831,ca.proc.d.2015-02-02.16582.146,2015-02-02,eaa6694f-1e20-4aae-ad3b-e694b0e12c59,9187,"Ms. Elizabeth May (Saanich—Gulf Islands, GP)",,Oral Questions,Public Safety,,"Mr. Speaker, I want to make it very clear that I completely agree with every word in today's Globe and Mail editorial. I think every MP should read it. 
This Parliament must not allow the Conservatives to turn CSIS into a secret police force. The words that are found in the definition of activities that affect the security of Canadians are so overly broad that I believe they could apply to almost anything.
 Despite the inclusion of saying that it does not apply to lawful protest, would the minister tell us if this will apply to non-violent civil disobedience, such as that against pipelines?",Green,Saanich--Gulf Islands,Elizabeth May,http://www.parl.gc.ca/parlinfo/Files/Parliamentarian.aspx?Item=eaa6694f-1e20-4aae-ad3b-e694b0e12c59&Language=E&Section=ALL
