basepk,hid,speechdate,pid,opid,speakeroldname,speakerposition,maintopic,subtopic,subsubtopic,speechtext,speakerparty,speakerriding,speakername,speakerurl
4626618,ca.proc.d.2015-02-05.16592.53,2015-02-05,2347a7b8-8e45-4c51-bdc6-f6c32375ad50,189,Mr. Brian Masse,,Government Orders,Opposition Motion—Job Creation,," You did blow the deal. You started to negotiate in public with some of your members. That is what took place.
I will provide a little snapshot of our trade deficit. These statistics on our trade deficit cover several years. Pertaining to manufacturing goods, I will use the year 2010 because it was significant as the year when things flipped over. The deficit was creeping and creeping, but our manufacturing exports versus our imports at that time went to an $80 billion deficit, and that deficit has continued to grow.
However, we have a chance right now, with the dollar being low and by using the capital cost reduction allowance, to attract some of that investment back. That is what makes us much more successful. 
In conclusion, our skills, our abilities, and our support systems, such as health care, are net advantages to attract employers to locate in this country. Dropping the corporate tax rate has not done it. We have witnessed the bleeding of manufacturing jobs and value-added jobs—dirty words to the government—out of this country. Let us act now and take back some of those jobs.",New Democratic Party,Windsor West,Brian Masse,http://www.parl.gc.ca/parlinfo/Files/Parliamentarian.aspx?Item=2347a7b8-8e45-4c51-bdc6-f6c32375ad50&Language=E&Section=ALL
4626619,ca.proc.d.2015-02-05.16592.54,2015-02-05,07cf5767-802c-406c-92a7-7dc92af79b40,4264,"Mr. Kevin Lamoureux (Winnipeg North, Lib.)",,Government Orders,Opposition Motion—Job Creation,,"Mr. Speaker, I agree that we need to pay more attention to the issue of manufacturing jobs, among others. However, the manufacturing industry has taken a significant hit over the last number of years.
 In my home province of Manitoba, the pork industry has been doing relatively well. It has seen benefits in terms of potential growth and is still growing. One of the things feeding that growth is international trade. International trade is important to the Canadian economy and a lot of different industries in providing the necessary good quality, middle-class jobs that have real value. I wonder if the member could talk about the importance of us expanding our boundaries by looking at trade agreements, and so forth, as a way to help small businesses.",Liberal,Winnipeg North,Kevin Lamoureux,http://www.parl.gc.ca/parlinfo/Files/Parliamentarian.aspx?Item=07cf5767-802c-406c-92a7-7dc92af79b40&Language=E&Section=ALL
4626620,ca.proc.d.2015-02-05.16592.55,2015-02-05,2347a7b8-8e45-4c51-bdc6-f6c32375ad50,189,Mr. Brian Masse,Interjection,Government Orders,Opposition Motion—Job Creation,,"Mr. Speaker, I would highlight a couple of things that have taken place over the last number of years.
One is the distain or disconnect the government has with respect to trade with the United States. We have seen the repercussions of that. Whether it has been with regard to coal or cattle, there has been a series of impediments at the border. I agree that we need to reach out internationally and open new markets, but we are watching our number one market close us down. That has been an unfortunate consequence of the government's preoccupation with trying to push pipelines in the face of America and Washington, and not looking after the real projects, such as the new border crossing project in my riding of Windsor West. Of the $3.5 trillion U.S. budget, we could not even get $250 million for the American plaza. Instead, we are paying for the border crossing and for the plazas on both the Canadian and American sides because of neglect.",New Democratic Party,Windsor West,Brian Masse,http://www.parl.gc.ca/parlinfo/Files/Parliamentarian.aspx?Item=2347a7b8-8e45-4c51-bdc6-f6c32375ad50&Language=E&Section=ALL
4626621,ca.proc.d.2015-02-05.16592.56,2015-02-05,6da8653f-692f-4bbc-acb2-86e088f0d60d,8571,"Mr. Pierre Nantel (Longueuil—Pierre-Boucher, NDP)",,Government Orders,Opposition Motion—Job Creation,,"Mr. Speaker, first of all, I would like to say that the heckling across the way is quite annoying. This member has worked a long time on these issues. He has a lot to teach us and he comes from a region that has been hit hard by the bad choices of his friends on the other side. 
I have a factual question for him. We have seen a high number of closures. We know about what happened in London with Kellogg, and we see what is now going on with Wrigley.
What does he think explains the closing of these factories that manufacture American products, which we will continue to buy and which will continue to come across our borders?",New Democratic Party,Longueuil--Pierre-Boucher,Pierre Nantel,http://www.parl.gc.ca/parlinfo/Files/Parliamentarian.aspx?Item=6da8653f-692f-4bbc-acb2-86e088f0d60d&Language=E&Section=ALL
4626622,ca.proc.d.2015-02-05.16592.57,2015-02-05,2347a7b8-8e45-4c51-bdc6-f6c32375ad50,189,Mr. Brian Masse,Interjection,Government Orders,Opposition Motion—Job Creation,,"Mr. Speaker, a number of significant things took place. We had the peaking of the Canadian dollar based on our raw export resource-based economy, which weakened the the manufacturing sector. We had no plan and no auto strategy. In the area I come from, if there is any potential attempt for auto investment, it becomes a Hail Mary pass, not a plan.
We have what is called the Canadian Automotive Partnership Council, where the entire industry came together to create report cards and progress cards on how to move the industry forward. We do not use that. Rather, we just wait for that moment as opposed to pushing for it. That is why I like the idea of the capital cost allowance right now, because with that and an organized plan, we could fight to get some of these jobs back. The administration in the United States is doing that; it is rebirthing manufacturing. We do not see that here. 
The Liberal leader came to London, Ontario, and talked about how we basically have to diversify away from auto manufacturing because it is a dead industry. Then he came down to Windsor and had no auto strategy, despite the fact there is money still available for such a strategy. We have put one forth before. Our first was a green auto strategy that involved David Suzuki and the CAW. There are 13 countries in the world that have a specific auto strategy. What I mean by an auto strategy is the assigning of targets and measure and referring back to those targets, whether with respect to the environment, production, diversification, or parts supply improvements. ",New Democratic Party,Windsor West,Brian Masse,http://www.parl.gc.ca/parlinfo/Files/Parliamentarian.aspx?Item=2347a7b8-8e45-4c51-bdc6-f6c32375ad50&Language=E&Section=ALL
4626623,ca.proc.d.2015-02-05.16592.58,2015-02-05,14433f87-ee9b-4bcf-97f1-4e5fb273de36,729,"Mrs. Stella Ambler (Mississauga South, CPC)",,Government Orders,Opposition Motion—Job Creation,,"Mr. Speaker, it is an absolute pleasure for me today to speak to this motion, because it gives me an opportunity to talk about the many measures that our government has taken to improve Canada's economy.
First, let me say that I will be splitting my time with the member for Brant.
As I said, it gives me an opportunity to speak about our low-tax plan for Canadians, which began back in 2006 when our government was first elected. As my hon. colleagues will know, the world was a different place at that time. Markets were booming and economic growth was strong. We took advantage of these good conditions to cut taxes for hard-working families and job-creating businesses, and we paid down the federal debt. 
Then in 2009, during the depths of the world's largest global economic recession in a generation, we acted quickly to protect our Canadian economy with targeted and temporary stimulus. We introduced the economic action plan and funded thousands of infrastructure projects across the country, many in my own riding of Mississauga South. These included the construction of roads, bridges and border crossings, as well as innovative knowledge-based infrastructure, like research labs in universities and colleges, and the expansion of broadband Internet in rural areas. That access of course was helpful to businesses of all sizes.
Since that time, we have also been working hard to position Canada as an attractive place to invest and to grow business by systematically putting in place the right conditions for success. I mentioned some of our early tax reductions. These have been a priority of the government since day one. We know that low-tax environments attract business, as well as boost domestic and foreign direct investment. These factors are of course crucial to job creation, innovation, skills development, productivity and growth.
Today Canada is in constant competition for domestic and foreign investment dollars. Our government knows that a low-tax regime helps Canada attract new investment. We are committed to ensuring Canada has the most competitive tax regime possible. In fact, in the past five years alone, we have delivered tax reductions totalling more than $60 billion to job-creating businesses.
For example, we reduced the federal general corporate tax rate from 22% to 15%. We extended the accelerated capital cost allowance for manufacturing and processing machinery and equipment. We implemented a three-year freeze on the EI rate at its 2013 level, saving employers and employees an estimated $660 million last year alone.
In particular, for our small and medium-size businesses, we reduced the small business tax rate from 15% to 11%, and increased the amount of income eligible for this lower rate from $300,000 to $500,000. We also raised the lifetime capital gains exemption for small business owners from $500,000 to $800,000. This new limit is now indexed to inflation, so it will continue to rise.
We expanded and extended temporary hiring credits for small businesses, and have introduced the new small business job credit that will save small businesses more than half a billion dollars over two years.
Today, I am proud to say that all of these actions are paying off. Even in today's still uncertain global economic climate, Canada's economy is widely recognized as one of the world's strongest. Over the past 10 years, we have led the G7 countries in economic growth. We are second only to the U.S. in growth among G7 countries during the recession and recovery. We have a strong record of job creation. In fact, our economy has created almost 1.2 million new jobs since the height of the recession, one of the strongest job creation records in the G7. Moreover, all major rating agencies have affirmed Canada's AAA credit rating. 
Clearly, this is a great place to do business. Do not just take my word for it, because the world is taking notice. KPMG reports that total business tax costs in Canada are the lowest in the G7 and over 40% lower than those in the United States. In 2013, Canada leapt from sixth to second place in Bloomberg's ranking of the most attractive destinations for business. Once more, for the seventh consecutive year, the World Economic Forum has declared Canada's banking system to be the soundest in the world. 
I think we can all give our former finance minister many of the kudos for that and the policies put in place under this government over the past nine years. Simply put, Canada has a record that investors and business people are confident in. 
 In addition to mentioning some of the measures we are taking to support our small and medium-size businesses, I want to point out to the House that these businesses represent over 99% of all Canadian businesses and account for nearly nine in ten jobs in the private sector, contributing about 40% to our GDP. They are clearly the lifeblood of the Canadian economy. 
I have a great respect for small business owners. My father ran a small business for 40 years, and I started working for him when I was quite young. I saw day to day the struggles that the average small business owner has to deal with in meeting a payroll, paying suppliers, and generally doing business. Of course, when a person runs a business for 40 years, there are going to ups and downs, peaks and valleys. However, our small business owners in Canada not only understand and know how to deal with those, but they also appreciate it when they have a government that understands those struggles and challenges and is there to support them, as this government is. 
This is why we have taken action and implemented all kinds of measures. For example, we have improved access to financing for small business, which of course is critical at all stages of growth for businesses. Most recently, we announced changes to the Canada small business financing program to allow more small businesses to apply for and receive larger loans. We have also brought in the venture capital action plan to improve access to SME financing so that companies have the capital they need to create jobs and growth in the area of venture capital. 
We have also introduced the business innovation access program, which speaks in part to the NDP motion today. This is a pilot program that provides $20 million in funding to SMEs to help them access business services or technical assistance to bring bigger and better innovations to market faster. 
We established the immigrant investor venture capital pilot program to support innovative Canadian start-ups with high-growth potential. We have made investments in Futurpreneur Canada, formerly known as the Canada Youth Business Foundation, to help Canada's next generation of entrepreneurs. We have invested $100 million in the Canada accelerator and incubator program to help entrepreneurs create new companies and receive intensive mentoring and other resources to develop their business. We have also instructed the Business Development Bank of Canada, BDC, to be more responsive to the unique needs of small business. 
Our government is also committed to reducing red tape in order to support a flourishing and healthy business environment, which is the foundation for creating jobs and long-term prosperity. Accordingly, our government introduced the red tape reduction action plan, which we have heard quite a bit about in the House. It addresses specific irritants to small business, reduces their paperwork, and makes the system more transparent and accountable.
Contrast this with the actions of opposition members who voted against lowering the federal corporate income tax rate to 15%. They voted against extending the accelerated capital cost allowance for new investment in manufacturing. They voted against the automotive innovation fund. They voted against the establishment of the national shipbuilding procurement strategy, and they voted against the advanced manufacturing fund. There is such a long list of our initiatives that opposition members have voted against, it is quite disappointing, whether it is the Federal Economic Development Agency, FedDev; the job grant; apprentice loans and grants; the extension of the lifetime capital gains tax that I mentioned or the SR and ED credits.
Our government has been deliberately enacting a whole series of policies and programs to further fuel Canada's economic growth. Unlike the opposition, our government has a sustained approach to responsible fiscal management, which responds directly to the priorities of Canadian business owners. ",Conservative,Mississauga South,Stella Ambler,http://www.parl.gc.ca/parlinfo/Files/Parliamentarian.aspx?Item=14433f87-ee9b-4bcf-97f1-4e5fb273de36&Language=E&Section=ALL
4626624,ca.proc.d.2015-02-05.16592.59,2015-02-05,95ed53a7-7538-4c0f-85a4-64af76065f95,616,"Mr. Don Davies (Vancouver Kingsway, NDP)",,Government Orders,Opposition Motion—Job Creation,,"Mr. Speaker, I think all Canadians realized over the last 10 years that the manufacturing sector in Canada has had a difficult time. We have seen a number of Canadian champions, longstanding Canadian companies, close and shed the jobs that come with them, often family-sustaining jobs. 
What the New Democrats are calling for today is for the Canadian government to take immediate action to build a balanced economy, support the middle class, and encourage manufacturing and small business creation, specifically by extending the accelerated capital cost allowance by two years; reducing the small business income tax rate from 11% to 10% immediately and then to 9% when finances permit; and finally, by introducing an innovation tax credit to support investment in machinery, equipment, and property for further innovation and to increase productivity. I wonder if my hon. colleague across the way could tell us which of those three proposals her government has a problem with. Is it reducing the tax rate for small business, extending the accelerated capital cost allowance, or introducing an innovation tax credit?",New Democratic Party,Vancouver Kingsway,Don Davies,http://www.parl.gc.ca/parlinfo/Files/Parliamentarian.aspx?Item=95ed53a7-7538-4c0f-85a4-64af76065f95&Language=E&Section=ALL
4626625,ca.proc.d.2015-02-05.16592.60,2015-02-05,14433f87-ee9b-4bcf-97f1-4e5fb273de36,729,Mrs. Stella Ambler,Interjection,Government Orders,Opposition Motion—Job Creation,,"Mr. Speaker, that is an interesting question, because I do not understand why the NDP has voted consistently against the measures we put in place that, to me, sound exactly like the motion being put forward.
We have provided $1.4 billion in tax relief to the manufacturing sector, and total business tax costs in Canada are the lowest in the G7. I am not sure if the member is aware of an industry committee study done here in Parliament, which was released in 2007. It recommended that the accelerated capital cost allowance be extended for five years. Later that year, in the budget, the then finance minister did in fact extend the accelerated capital cost exemption for machinery and equipment for two years; and every two years since then, it has been renewed. 
I did speak a bit about innovation. Perhaps I will get a chance later. Absolutely, our government is doing all of those things. I am just left wondering why the opposition did not vote for them if it supports them. ",Conservative,Mississauga South,Stella Ambler,http://www.parl.gc.ca/parlinfo/Files/Parliamentarian.aspx?Item=14433f87-ee9b-4bcf-97f1-4e5fb273de36&Language=E&Section=ALL
4626626,ca.proc.d.2015-02-05.16592.61,2015-02-05,07cf5767-802c-406c-92a7-7dc92af79b40,4264,"Mr. Kevin Lamoureux (Winnipeg North, Lib.)",,Government Orders,Opposition Motion—Job Creation,,"Mr. Speaker, it is about priorities, and the government determined its priority in the fall was to give literally hundreds of millions of dollars, totalling $2 billion plus annually, to an income split. This is something we in the Liberal Party have adamantly opposed. 
When we look at the priorities, imagine if the government actually invested today in our infrastructure. It would not only directly help small businesses in Canada with the potential for contracts, but indirectly through the improvement of infrastructure we would be better able to export and transport our products.
Why does the member believe that the Prime Minister  got the issue of priorities for Canadians wrong? ",Liberal,Winnipeg North,Kevin Lamoureux,http://www.parl.gc.ca/parlinfo/Files/Parliamentarian.aspx?Item=07cf5767-802c-406c-92a7-7dc92af79b40&Language=E&Section=ALL
4626627,ca.proc.d.2015-02-05.16592.62,2015-02-05,14433f87-ee9b-4bcf-97f1-4e5fb273de36,729,Mrs. Stella Ambler,Interjection,Government Orders,Opposition Motion—Job Creation,,"Mr. Speaker, I would like to point out that it is indeed about priorities, and our government has its priorities straight. 
Absolutely, we believe in tax cuts for families across Canada. In fact, the transfer of income, also known as income splitting, has worked so well for seniors that we have made it a priority to provide that same kind of tax relief to families as well. I certainly make no apologies for that. 
Also on the subject of priorities, I would like the member opposite to know that small and medium-sized businesses are indeed a priority. That is why we have lowered taxes for SMEs from 15% to 11%, to make it easier for them. We have also put in place the three-year freeze on the EI rate, which I mentioned, again making it easier for businesses in Canada to do business, to make money, and then create those jobs, those almost 1.2 million jobs that our economy has created since the depths of the recession in 2009.
These are the kinds of initiatives and programs, measures that our government has taken, that have consistently put us at the head of the G7 in terms of economic growth and job creation. I am very proud of that. ",Conservative,Mississauga South,Stella Ambler,http://www.parl.gc.ca/parlinfo/Files/Parliamentarian.aspx?Item=14433f87-ee9b-4bcf-97f1-4e5fb273de36&Language=E&Section=ALL
