basepk,hid,speechdate,pid,opid,speakeroldname,speakerposition,maintopic,subtopic,subsubtopic,speechtext,speakerparty,speakerriding,speakername,speakerurl
4636643,ca.proc.d.2015-04-30.16813.218,2015-04-30,413f63e9-daa1-4444-b83b-c0135109dbba,9240,Mr. Craig Scott,Interjection,Government Orders,Citizen Voting Act,Bill C-50—Time Allocation Motion,"Mr. Speaker, one of the concerns I continue to have is the false impression being left by the government in general, with the current minister having to carry the can, apparently. I will not go further than to say that she is responding to questions and others are not.
The first thing is that a distinct impression was intended to be left. That is a very awkward way of putting it, but back in December, for two weeks we were all under the impression that the government had decided not to appeal the Frank case. The whole presentation of Bill C-50 was that we needed this to implement the Frank decision as if we were complying. It was a constitutional judgment, the government realized it did not stand any hope of winning an appeal, so it would no longer fight against enfranchising all these Canadians who had, before now, been disenfranchised, and it would not appeal. That turned out to be totally false. Once we started probing, the government case continued.
There is no actual interest on the part of the government in enfranchising Canadians, and that should inform how we understand what it is trying to do with this bill. When it is forced by the courts to abide by the Frank judgment, this is how it is going to do it, and it is going to do it in a way that makes it exceedingly difficult when compared to what the process used to be for citizens abroad.
 It has to be put on the record that the government is appealing the Frank decision. That is part and parcel of why it is seeking to make it more difficult for Canadians to vote through this new bill, and why the government does not want a lot of debate or awareness about the bill at all.
The second thing is that our colleague has made a very good effort to present it in a way that suggests that some streamlining is going on here. The presentation is that a bunch of rules are being cleaned up and the Frank judgment has kind of spurred that analysis of how to make the process of citizens voting from abroad more efficient, secure, fair and everything else. The fact is that of the three or four major changes, the single biggest change in the bill is that those who are abroad cannot begin the process of voting until after the writ drops. Only at that point are they allowed to register. Then there is a whole series of steps involving the mail across the globe, which creates the huge risk that they will never get the vote at all. Therefore, the streamlining subtext of this is absolutely inaccurate.
 It is really important to know that both of the points I have made about the Frank judgment, and what is going on with the judgment with respect to my last point, speak to why the government delayed so long in bringing it back for debate: because of the attention it would continue to generate. It now wants almost no attention, which is tied to the fact that the bill is set down for debate tomorrow, Friday, the day when the least attention is paid to bills in the House.",New Democratic Party,Toronto--Danforth,Craig Scott,http://www.parl.gc.ca/parlinfo/Files/Parliamentarian.aspx?Item=413f63e9-daa1-4444-b83b-c0135109dbba&Language=E&Section=ALL
4636644,ca.proc.d.2015-04-30.16813.219,2015-04-30,9225dd6b-e672-44d5-8bb7-c634b7e72f2e,9042,Hon. Michelle Rempel,Interjection,Government Orders,Citizen Voting Act,Bill C-50—Time Allocation Motion,"Mr. Speaker, to set the context for my response to this question, I want to make it clear for people watching this debate that when my colleague says Canadians cannot vote, I want to really ensure they understand what the context of the Frank ruling is.
In May, 2014, this decision through the Ontario Superior Court struck down the law preventing citizens from voting if they had been out of the country for more than five consecutive years and had no intention of returning. That is the group of folks we are dealing with in this ruling. I want to make that perfectly clear for those who are listening.
In terms of the appeal of that decision, yes, our government has said that we will continue with the appeal, but we have also been very clear about that all along in this debate. Therefore, I disagree with my colleague's assertion that somehow this fact has been hidden. 
Part of the role of government is to take positions on certain policies, which we have in the appeal of this decision, and deal with the reality that court decisions provide. Because of this decision, there are certain ambiguities that need to be tightened up in our legislation, which is why this bill was presented. There is no reason why both of these things cannot happen at the same time.
 With regard to the member's particular point about the time to register, I would note that right now in Canada, we have a process for special balloting. I have friends and colleagues who live outside the country for a greater period of time. They are the snowbird type folks who we all know. When they go abroad and an election is called, they can register for a special ballot, which comes to them. There is already a procedure to deal with folks who are living abroad. Therefore, it is reasonable, since there are Canadian residents who perhaps have not been gone for that long a period and who already prescribe to a process like this, that it could certainly work for folks who fall under the category outlined in the Frank ruling.
When we talk about streamlining, this is not reinventing the wheel. This is about saying that we have a precedent on how to deal with this special balloting, so why would we not make that consistent for those who fall under this ruling?
The form and substance of the bill is to provide clarity and consistency in how we deal with voters who are abroad during a federal election.",Conservative,Calgary Centre-North,Michelle Rempel,http://www.parl.gc.ca/parlinfo/Files/Parliamentarian.aspx?Item=9225dd6b-e672-44d5-8bb7-c634b7e72f2e&Language=E&Section=ALL
4636645,ca.proc.d.2015-04-30.16813.220,2015-04-30,d282a075-d49f-40b7-ab6d-64455eb9a5a8,265,Mr. Scott Simms,Interjection,Government Orders,Citizen Voting Act,Bill C-50—Time Allocation Motion,"Mr. Speaker, it is also a question of practicality in this particular case. Uniformity across this country, yes, I get that, but for example, the international list worked really well. Many people, once they go abroad, are able to use their past addresses, if they so chose, and get on that international list, which made it functional for them to be involved in elections. The reason, of course, is what she just mentioned. It takes long enough in this country to request a special ballot, receive a special ballot, vote, and send back the special ballot. For a snowbird who is in Greece, it is a little much. 
The practicality of it is something that is not being addressed. I think all of the concerns brought up by the Chief Electoral Officer will certainly be addressed over the next little while. The other concern is about the respect of the courts. If that were the case, we would not have been discussing all of these court challenges for the past little while. The term “court tested” has now become a national term that everyone knows about. Is it Supreme Court tested? We do not know. As well, the government does not seem to know beforehand, and then we get into the courts and go through this again. 
Then, of course, as my colleague pointed out, we expect legislation and compliance, which is not particularly the case. It is in line with the system that exists in this country, but is not practical for people outside of the country.",Liberal,Bonavista--Gander--Grand Falls--Windsor,Scott Simms,http://www.parl.gc.ca/parlinfo/Files/Parliamentarian.aspx?Item=d282a075-d49f-40b7-ab6d-64455eb9a5a8&Language=E&Section=ALL
4636646,ca.proc.d.2015-04-30.16813.221,2015-04-30,9225dd6b-e672-44d5-8bb7-c634b7e72f2e,9042,Hon. Michelle Rempel,Interjection,Government Orders,Citizen Voting Act,Bill C-50—Time Allocation Motion,"First, Mr. Speaker, in my speech last time on this bill, I noted that I went to the Canada Post website, which stated that it takes four to seven business days for international ballots to reach their destinations. If we look at the ways people can register to vote, especially in a special ballot situation—and this would be a similar procedure—we see they can register by mail, online, at embassies, by fax. There are numerous ways in which people can register and get this information back and forth. Because there are folks who take advantage of the system that is in place already, it is reasonable to suggest that we could apply it to a group of people who are potentially in the exact same situation.
I think this is reasonable. Again, if we can ensure we have the right processes in place to advertise that process and to teach voters how to vote, we are probably in a good situation to ensure that takes place.
I will say this in closing. My colleague brings up “court tested”, and certainly the courts have a very important role in our government system, but the legislature also has the ability and responsibility to put forward legislation, and I do not believe in the assertion, which I think is a very dangerous thing to say, that everything we do and say has to first be put forward by a court, because our responsibility as legislators is to put forward policy and legislate upon that.",Conservative,Calgary Centre-North,Michelle Rempel,http://www.parl.gc.ca/parlinfo/Files/Parliamentarian.aspx?Item=9225dd6b-e672-44d5-8bb7-c634b7e72f2e&Language=E&Section=ALL
4636647,ca.proc.d.2015-04-30.16813.222,2015-04-30,1b175d0f-9278-4e04-9fa8-0368e591c5a5,69,The Deputy Speaker,,Government Orders,Citizen Voting Act,Bill C-50—Time Allocation Motion,"Order. It is my duty to interrupt the proceedings and put forthwith the question necessary to dispose of the motion now before the House. 
 The question is on the motion. Is it the pleasure of the House to adopt the motion? ",New Democratic Party,Windsor--Tecumseh,Joe Comartin,http://www.parl.gc.ca/parlinfo/Files/Parliamentarian.aspx?Item=1b175d0f-9278-4e04-9fa8-0368e591c5a5&Language=E&Section=ALL
4636648,ca.proc.d.2015-04-30.16813.223,2015-04-30,,,,intervention,Government Orders,Citizen Voting Act,Bill C-50—Time Allocation Motion," Agreed. 
 No. ",,,Some hon. members,
4636649,ca.proc.d.2015-04-30.16813.224,2015-04-30,1b175d0f-9278-4e04-9fa8-0368e591c5a5,69,The Deputy Speaker,,Government Orders,Citizen Voting Act,Bill C-50—Time Allocation Motion, All those in favour of the motion will please say yea. ,New Democratic Party,Windsor--Tecumseh,Joe Comartin,http://www.parl.gc.ca/parlinfo/Files/Parliamentarian.aspx?Item=1b175d0f-9278-4e04-9fa8-0368e591c5a5&Language=E&Section=ALL
4636650,ca.proc.d.2015-04-30.16813.225,2015-04-30,,,,intervention,Government Orders,Citizen Voting Act,Bill C-50—Time Allocation Motion, Yea. ,,,Some hon. members,
4636651,ca.proc.d.2015-04-30.16813.226,2015-04-30,1b175d0f-9278-4e04-9fa8-0368e591c5a5,69,The Deputy Speaker,,Government Orders,Citizen Voting Act,Bill C-50—Time Allocation Motion, All those opposed will please say nay. ,New Democratic Party,Windsor--Tecumseh,Joe Comartin,http://www.parl.gc.ca/parlinfo/Files/Parliamentarian.aspx?Item=1b175d0f-9278-4e04-9fa8-0368e591c5a5&Language=E&Section=ALL
4636652,ca.proc.d.2015-04-30.16813.227,2015-04-30,,,,intervention,Government Orders,Citizen Voting Act,Bill C-50—Time Allocation Motion, Nay. ,,,Some hon. members,
4636653,ca.proc.d.2015-04-30.16813.228,2015-04-30,1b175d0f-9278-4e04-9fa8-0368e591c5a5,69,The Deputy Speaker,,Government Orders,Citizen Voting Act,Bill C-50—Time Allocation Motion," In my opinion the yeas have it. 
 And five or more members having risen: 
 Call in the members. ",New Democratic Party,Windsor--Tecumseh,Joe Comartin,http://www.parl.gc.ca/parlinfo/Files/Parliamentarian.aspx?Item=1b175d0f-9278-4e04-9fa8-0368e591c5a5&Language=E&Section=ALL
4636654,ca.proc.d.2015-04-30.16813.229,2015-04-30,,,,stagedirection,Government Orders,Citizen Voting Act,,"(The House divided on the motion, which was agreed to on the following division:)
Vote #390",,,,
4636655,ca.proc.d.2015-04-30.16813.230,2015-04-30,1b175d0f-9278-4e04-9fa8-0368e591c5a5,69,The Deputy Speaker,,Government Orders,Citizen Voting Act,,I declare the motion carried.,New Democratic Party,Windsor--Tecumseh,Joe Comartin,http://www.parl.gc.ca/parlinfo/Files/Parliamentarian.aspx?Item=1b175d0f-9278-4e04-9fa8-0368e591c5a5&Language=E&Section=ALL
4636656,ca.proc.d.2015-04-30.16813.231,2015-04-30,,,,stagedirection,Government Orders,Pipeline Safety Act,," The House proceeded to the consideration of Bill C-46, An Act to amend the National Energy Board Act and the Canada Oil and Gas Operations Act, as reported (with amendment) from the committee. ",,,,
4636657,ca.proc.d.2015-04-30.16813.232,2015-04-30,1b175d0f-9278-4e04-9fa8-0368e591c5a5,69,The Deputy Speaker,,Government Orders,Pipeline Safety Act,,"There being no motions at report stage, the House will now proceed, without debate, to the putting of the question on the motion to concur in the bill at report stage.",New Democratic Party,Windsor--Tecumseh,Joe Comartin,http://www.parl.gc.ca/parlinfo/Files/Parliamentarian.aspx?Item=1b175d0f-9278-4e04-9fa8-0368e591c5a5&Language=E&Section=ALL
4636658,ca.proc.d.2015-04-30.16813.233,2015-04-30,60f0a037-1e3d-4e48-902c-61a731ed99ab,581,Hon. Greg Rickford,Interjection,Government Orders,Pipeline Safety Act,, moved that the bill be concurred in.,Conservative,Kenora,Greg Rickford,http://www.parl.gc.ca/parlinfo/Files/Parliamentarian.aspx?Item=60f0a037-1e3d-4e48-902c-61a731ed99ab&Language=E&Section=ALL
4636659,ca.proc.d.2015-04-30.16813.234,2015-04-30,1b175d0f-9278-4e04-9fa8-0368e591c5a5,69,The Deputy Speaker,,Government Orders,Pipeline Safety Act,, Is it the pleasure of the House to adopt the motion? ,New Democratic Party,Windsor--Tecumseh,Joe Comartin,http://www.parl.gc.ca/parlinfo/Files/Parliamentarian.aspx?Item=1b175d0f-9278-4e04-9fa8-0368e591c5a5&Language=E&Section=ALL
4636660,ca.proc.d.2015-04-30.16813.235,2015-04-30,,,,intervention,Government Orders,Pipeline Safety Act,, Agreed. ,,,Some hon. members,
4636661,ca.proc.d.2015-04-30.16813.236,2015-04-30,1b175d0f-9278-4e04-9fa8-0368e591c5a5,69,The Deputy Speaker,,Government Orders,Pipeline Safety Act,, I declare the motion carried.,New Democratic Party,Windsor--Tecumseh,Joe Comartin,http://www.parl.gc.ca/parlinfo/Files/Parliamentarian.aspx?Item=1b175d0f-9278-4e04-9fa8-0368e591c5a5&Language=E&Section=ALL
4636662,ca.proc.d.2015-04-30.16813.237,2015-04-30,60f0a037-1e3d-4e48-902c-61a731ed99ab,581,Hon. Greg Rickford,,Government Orders,Pipeline Safety Act,,"(Motion agreed to)
When shall the bill be read a third time? By leave, now?",Conservative,Kenora,Greg Rickford,http://www.parl.gc.ca/parlinfo/Files/Parliamentarian.aspx?Item=60f0a037-1e3d-4e48-902c-61a731ed99ab&Language=E&Section=ALL
4636663,ca.proc.d.2015-04-30.16813.238,2015-04-30,,,,intervention,Government Orders,Pipeline Safety Act,, Agreed.,,,Some hon. members,
4636664,ca.proc.d.2015-04-30.16813.239,2015-04-30,60f0a037-1e3d-4e48-902c-61a731ed99ab,581,Hon. Greg Rickford,Interjection,Government Orders,Pipeline Safety Act,, moved that the bill be read the third time and passed. ,Conservative,Kenora,Greg Rickford,http://www.parl.gc.ca/parlinfo/Files/Parliamentarian.aspx?Item=60f0a037-1e3d-4e48-902c-61a731ed99ab&Language=E&Section=ALL
