basepk,hid,speechdate,pid,opid,speakeroldname,speakerposition,maintopic,subtopic,subsubtopic,speechtext,speakerparty,speakerriding,speakername,speakerurl
4626675,ca.proc.d.2015-02-05.16592.110,2015-02-05,3b00808c-6ef4-44a2-8204-dc48574a870e,9263,"Mr. Ted Falk (Provencher, CPC)",,Statements By Members,Entrepreneurs,,"Mr. Speaker, in my riding of Provencher, we are blessed to have strong, healthy, vibrant communities. Much of that growth can be attributed to an incredible entrepreneurial spirit.
 I would like to take a moment to recognize some of the local businesses that have recently received awards for their superior products and services. 
The Carillon, the largest rural newspaper in Manitoba, has won hundreds of awards both provincially and nationally.
 Bothwell Cheese has taken home many awards, most recently first place for both its marble and cheddar cheese at the British Empire cheese show.
Canadian Gold, in Marchand, was named best bottled water in the world at the prestigious Berkeley Springs International Water Tasting competition.
Hylife Foods of La Broquerie, a vertically integrated food processing company with over 1,500 employees, recently received the Canadian Manufacturers &amp; Exporters' export award.
These are just a few of the success stories in Provencher. Our Conservative government will continue to support measures that will help entrepreneurs grow their businesses and prosper.",Conservative,Provencher,Ted Falk,
4626676,ca.proc.d.2015-02-05.16592.111,2015-02-05,5f76e2e0-e77a-4928-aa31-a8d066f384a4,1813,"Ms. Lise St-Denis (Saint-Maurice—Champlain, Lib.)",,Statements By Members,Tomcod Fishing,,"Mr. Speaker, there is an impressive number of seasonal festivals for the people of Mauricie to enjoy. 
 Although the federal government has shown absolutely no interest, the Sainte-Anne-de-la-Pérade Festival de pêche aux petits poissons des chenaux is holding its 77th annual tomcod fishing festival.
This type of festival is an essential way to keep people involved in the region, and the government has a duty to ensure its survival. 
In spite of obstacles and a lack of significant funding from the federal government, Sainte-Anne-de-la-Pérade still welcomes visitors from across Canada who want to experience ice fishing in one of the oldest francophone communities in the country.
Today we pay tribute to the organizers of this festival, which is a cultural signpost along the winding Chemin du Roy tourist route.",Liberal,Saint-Maurice--Champlain,Lise St-Denis,http://www.parl.gc.ca/parlinfo/Files/Parliamentarian.aspx?Item=5f76e2e0-e77a-4928-aa31-a8d066f384a4&Language=E&Section=ALL
4626677,ca.proc.d.2015-02-05.16592.112,2015-02-05,e849cb7a-82f0-49eb-aea4-573c06169a5d,9294,"Mr. Jim Eglinski (Yellowhead, CPC)",,Statements By Members,Fallen Four Memorial Park,,"Mr. Speaker, on March 3, 2005, four RCMP constables were shot and killed near Mayerthorpe, Alberta in my riding of Yellowhead.
 A tribute park was built by the Fallen Four Memorial Society to honour the memories of fallen constables Schiemann, Johnston, Gordon and Myrol. 
In the park are four bronze statues, representing each fallen member, and a 24-foot centre obelisk honouring all uniformed peace officers across Canada. It is topped by doves representing the heroes whose spirits now fly free.
 The Fallen Four Memorial Park was built by volunteers with donations from across the country. It is a promise to loved ones who have grieved, that their heroes will never be forgotten.
We are nearing the 10th anniversary of this tragic event. I invite all Canadians to join me in remembering them, either in person or in spirit, at the remembrance ceremony and memorial candle lighting at the Fallen Four Memorial Park on March 3.
 Lest we forget.",Conservative,Yellowhead,Jim Eglinski,
4626678,ca.proc.d.2015-02-05.16592.113,2015-02-05,b827c44d-5a4e-4298-9ed0-522570f78f17,1804,"Mr. Alain Giguère (Marc-Aurèle-Fortin, NDP)",,Statements By Members,Infrastructure,,"Mr. Speaker, my region, the Lower Laurentians, is Quebec's future economic backbone because of its cutting-edge aeronautics, aerospace, pharmaceutical and transit vehicle companies. 
Nevertheless, to support the economic development of our businesses, the federal government has to invest in transportation infrastructure so that traffic jams cease to be an obstacle to production.
Canada has a $200 billion infrastructure deficit, and our regions cannot meet the needs associated with that growth. This situation is hitting the Lower Laurentians particularly hard. 
The NDP is demanding that the government develop infrastructure in Canada so that our regions can prosper and foster innovation and economic growth.",New Democratic Party,Marc-Aurèle-Fortin,Alain Giguère,http://www.parl.gc.ca/parlinfo/Files/Parliamentarian.aspx?Item=b827c44d-5a4e-4298-9ed0-522570f78f17&Language=E&Section=ALL
4626679,ca.proc.d.2015-02-05.16592.114,2015-02-05,e4fac630-d103-47ac-9170-4da50dd3aec8,423,"Mr. Rick Dykstra (St. Catharines, CPC)",,Statements By Members,John Larocque,,"Mr. Speaker, on January 17, St. Catharines lost one of its best loved media personalities. Nicknamed the “Mayor of the Morning”, Radio Station CHSC's John Larocque passed away following a long battle with both Alzheimer's and Parkinson's disease.
John was a familiar voice for nearly 30 years in his post as CHSC's morning man. He was also a familiar face at almost every kind of community event we could think of. From hosting hundreds of charity functions to attending probably thousands of local sporting events, John was the epitome of CHSC's old slogan “All About this Town”.
The week before John died, the building that housed CHSC Radio on Queenston Street was bulldozed to the ground. I cannot help but find some symmetry to the fact that this was the last week John was on this earth, and made his exit.
For St. Catharines, the loss of CHSC and of John Larocque is truly the end of an era.",Conservative,St. Catharines,Rick Dykstra,http://www.parl.gc.ca/parlinfo/Files/Parliamentarian.aspx?Item=e4fac630-d103-47ac-9170-4da50dd3aec8&Language=E&Section=ALL
4626680,ca.proc.d.2015-02-05.16592.115,2015-02-05,0460b90d-6936-4178-9c1b-f2de6a79ef7b,610,"Mr. Earl Dreeshen (Red Deer, CPC)",,Statements By Members,Retirement Congratulations,,"Mr. Speaker, I am honoured to stand today to pay tribute to two friends of mine from the Alberta provincial legislature who will not be seeking re-election.
Last month, both Mary Anne Jablonski and Cal Dallas announced that they would be moving on to the next chapter in their lives. Both have spent lifetimes devoted to Red Deer and have served residents with honour and dignity.
Mary Anne Jablonski has represented Red Deer North since 2000, and Cal Dallas has represented Red Deer South since 2008. I am grateful for their service and I will miss their passion and commitment to our community.
We in the House are well aware of the commitments and sacrifices that come with public life, most notably the stress it puts on families. Fortunately, both Mary Anne and Cal have been able to count on tremendous support from their spouses, Bob and Jackie. Mary Anne and Cal can look forward to spending more time with their families as they begin the next chapter in their lives.
In closing, I would like to wish both Cal and Mary Anne enjoyable retirements. Once again, I thank them for their service.",Conservative,Red Deer,Earl Dreeshen,http://www.parl.gc.ca/parlinfo/Files/Parliamentarian.aspx?Item=0460b90d-6936-4178-9c1b-f2de6a79ef7b&Language=E&Section=ALL
4626681,ca.proc.d.2015-02-05.16592.116,2015-02-05,5dcb8c60-bb95-4d0f-9e2f-06dd3624a80f,8656,"Mrs. Djaouida Sellah (Saint-Bruno—Saint-Hubert, NDP)",,Statements By Members,Mental Health,,"Mr. Speaker, this is suicide prevention week in Quebec, and I would like to acknowledge the exceptional work done by the stakeholders in my riding of Saint-Bruno—Saint-Hubert, as well as all the work done in the greater Longueuil area.
On November 11, 2014, I invited some mental health professionals to a round table in order to identify best practices for suicide prevention. 
Today I am very pleased to act as a spokesperson for those stakeholders and call on the government to grant mental health organizations the resources they need to create a network of significant, positive and constructive support. 
We have to work even harder to ensure that mental illness is not ignored. It is time to invest in the psychological health and well-being of Canadians.",New Democratic Party,Saint-Bruno--Saint-Hubert,Djaouida Sellah,http://www.parl.gc.ca/parlinfo/Files/Parliamentarian.aspx?Item=5dcb8c60-bb95-4d0f-9e2f-06dd3624a80f&Language=E&Section=ALL
4626682,ca.proc.d.2015-02-05.16592.117,2015-02-05,f6937160-f4b0-4abd-b74a-a24349b6c2b0,290,"Mr. Brad Trost (Saskatoon—Humboldt, CPC)",,Statements By Members,New Democratic Party of Canada,,"Mr. Speaker, respecting taxpayers dollars should be a paramount concern for parliamentarians. The New Democrats have been directed to pay back $2.7 million they funnelled into partisan satellite offices. Once again, the NDP continues to defend its illegal partisan satellite offices and to deny any wrongdoing. This is simply an abuse of taxpayers. 
Unlike the NDP, I believe that political parties should pay for their campaign offices, using their own funds. The rules have always been clear that it is not acceptable to use House of Commons resources to fund the offices of parties. 
It is time for the NDP to take responsibility for its wrongdoings. These 68 members across the floor need to apologize to the Canadian taxpayers and immediately pay them back.",Conservative,Saskatoon--Humboldt,Bradley Trost,http://www.parl.gc.ca/parlinfo/Files/Parliamentarian.aspx?Item=f6937160-f4b0-4abd-b74a-a24349b6c2b0&Language=E&Section=ALL
4626683,ca.proc.d.2015-02-05.16592.118,2015-02-05,d013e8ca-fdd5-4eb4-a0e4-b5f0782a8f6d,8333,"Mr. Fin Donnelly (New Westminster—Coquitlam, NDP)",,Statements By Members,Employment,,"Mr. Speaker, the people of New Westminster—Coquitlam and Port Moody are telling me they want real action to stimulate job creation. Last month we were shocked to learn that Williams Moving &amp; Storage, a family-owned and operated company with its headquarters in my riding, filed for bankruptcy.
Under Conservative mismanagement, the economy has stalled. Whether it is the rubber-stamping of botched foreign takeovers like Target, which resulted in more than 17,000 Canadians losing their jobs in 133 communities, including Coquitlam, or the destabilization of Canada's once-balanced economy, the Conservative approach is failing middle-class Canadians.
Unlike the Conservatives, the New Democrats have a plan to create good jobs, which would immediately help working families. An NDP government would reduce taxes on Canada's real job creators, small and medium-sized businesses, and would launch an innovation tax credit to encourage investment.
When it comes to real job creation, only Canada's NDP can deliver.",New Democratic Party,New Westminster--Coquitlam,Fin Donnelly,http://www.parl.gc.ca/parlinfo/Files/Parliamentarian.aspx?Item=d013e8ca-fdd5-4eb4-a0e4-b5f0782a8f6d&Language=E&Section=ALL
4626684,ca.proc.d.2015-02-05.16592.119,2015-02-05,b15d7c05-f054-45fe-804e-54d178f2d3b4,603,"Mr. Randy Hoback (Prince Albert, CPC)",,Statements By Members,New Democratic Party of Canada,,"Mr. Speaker, not surprisingly, the New Democrats have been found guilty of inappropriately spending Canadian taxpayer dollars to fund their own partisan political agenda. Sixty-eight MPs have to repay a total of $2.7 million they took from Canadian taxpayers. What is worse is that the opposition leader's office does not believe they should have to repay the $2.7 million. 
The rules have always been clear. It is not acceptable to use House of Commons resources to fund party offices. It is sad that the NDP has demonstrated a pattern of abuse of taxpayer dollars. On this side of the House, we believe it should immediately repay the funds.",Conservative,Prince Albert,Randy Hoback,http://www.parl.gc.ca/parlinfo/Files/Parliamentarian.aspx?Item=b15d7c05-f054-45fe-804e-54d178f2d3b4&Language=E&Section=ALL
4626685,ca.proc.d.2015-02-05.16592.120,2015-02-05,8b42e1fd-2c9c-4d2c-9d29-c9e2be599d6b,21,"Hon. Mauril Bélanger (Ottawa—Vanier, Lib.)",,Statements By Members,Canadian Flag,,"Mr. Speaker, I was elected to Canada's Parliament for the first time two days before the 30th anniversary of our flag. In 10 days, we will be celebrating its 50th anniversary. I have since come to learn more about and appreciate the origins and significance of the maple leaf as the symbol of our great country.
It is important for our young people, the generation who will one day run our institutions, to learn that it is sometimes necessary to make difficult decisions, controversial though they might be.
To that end, I have prepared a poster highlighting the history of our flag and distributed it to every school and every student in the riding I have the privilege of representing. I have also shared it with all my colleagues for their use, should they so wish, with appropriate modifications, of course.
Next week we will be in our ridings. I hope that everyone will have the opportunity to take part in events to celebrate the 50th anniversary of our distinctive and elegant flag.",Liberal,Ottawa--Vanier,Mauril Bélanger,http://www.parl.gc.ca/parlinfo/Files/Parliamentarian.aspx?Item=8b42e1fd-2c9c-4d2c-9d29-c9e2be599d6b&Language=E&Section=ALL
4626686,ca.proc.d.2015-02-05.16592.121,2015-02-05,3a48d31a-42fc-4320-a84f-da61c251bccd,412,"Mr. Blaine Calkins (Wetaskiwin, CPC)",,Statements By Members,Public Safety,,"Mr. Speaker, the international jihadist movement has declared war on Canada. That is why Canada is not sitting on the sidelines, as the Liberals would have us do, and is instead joining our allies in supporting the international coalition in the fight against ISIL. 
I was shocked to hear the Liberal member for Malpeque say, “We knew what kind of brutality was happening.” This was before he and his leader opposed the mission against ISIL. I guess it should be no surprise that the member thinks that only giving out blankets is the best way to fight terrorists. 
When the member for Malpeque was the solicitor general, he obstructed Conservative efforts to list Hezbollah as a terrorist organization, saying, “CSIS in fact does not need to have people on a list in order to do its job.” We will always oppose this type of soft on terror approach. Only a Conservative government will stand up to support and protect Canadians.",Conservative,Wetaskiwin,Blaine Calkins,http://www.parl.gc.ca/parlinfo/Files/Parliamentarian.aspx?Item=3a48d31a-42fc-4320-a84f-da61c251bccd&Language=E&Section=ALL
4626687,ca.proc.d.2015-02-05.16592.122,2015-02-05,f4efade5-e605-4926-b4d9-cea84ef76f14,2038,"Mr. Randall Garrison (Esquimalt—Juan de Fuca, NDP)",,Statements By Members,Public Safety,,"Mr. Speaker, many Canadians are raising serious questions about the Conservatives' new anti-terrorism legislation. Everyone in this place agrees that terrorism is a real threat and must be confronted head on, so people are wondering why the Conservatives are dismissing advice from experts, and even from commissions of inquiry.
 Conservatives are calling better civilian oversight “red tape.” The Prime Minister's campaign-style announcement wrongly singled out Canada's one million Muslims, yet Conservatives refuse to apologize for this divisive approach.
Canadians are worried the Conservatives may go too far in eroding our freedoms and rights, so imagine people's shock when they learned the Liberal leader was offering the Prime Minister a blank cheque. He says that the Liberals will vote for Bill C-51 even if improved oversight is not there, and the Liberal leader openly admitted his reasons were based on politics, not evidence. 
Canadians deserve leaders with the judgment and experience to give legislation like this the careful scrutiny it deserves.",New Democratic Party,Esquimalt--Juan de Fuca,Randall Garrison,http://www.parl.gc.ca/parlinfo/Files/Parliamentarian.aspx?Item=f4efade5-e605-4926-b4d9-cea84ef76f14&Language=E&Section=ALL
4626688,ca.proc.d.2015-02-05.16592.123,2015-02-05,a10a55d4-becb-4b98-b780-9fa8cfd5aa12,575,"Mr. Phil McColeman (Brant, CPC)",,Statements By Members,Taxation,,"Mr. Speaker, under the strong, dependable leadership of our Prime Minister, our government will balance the budget and put money where it belongs: into the pockets of hard-working Canadians.
Our family tax cut and enhanced universal child care benefit will give 100% of families with kids an average of more than $1,100 per year to spend on their priorities. Families in Brantford-Brant and across Canada will receive nearly $2,000 per year for every child under six and $720 per year for every child between six and 17, thanks to the enhanced universal child care benefit.
The Liberal leader would reverse our tax cuts and do exactly what the Liberal Party elites always do: raise taxes for ordinary Canadians while handing that money over to bureaucrats.
Moms and dads do not need to be told how to spend their money. Our Conservative government is the only party Canadians can trust, and with our family tax cut and benefits, we are proud to be standing up for their future.",Conservative,Brant,Phil McColeman,http://www.parl.gc.ca/parlinfo/Files/Parliamentarian.aspx?Item=a10a55d4-becb-4b98-b780-9fa8cfd5aa12&Language=E&Section=ALL
4626689,ca.proc.d.2015-02-05.16592.124,2015-02-05,551183c2-2f3e-41ba-8660-2d194cf60169,546,"Hon. Thomas Mulcair (Leader of the Opposition, NDP)",,Oral Questions,Employment,,"Mr. Speaker, over 17,000 workers at Target have started liquidating 133 stores in every corner of this country. These will be their last days on the job. We are talking about vulnerable workers, new employees working irregular hours. Many, if not most, will not even qualify for EI. 
Would the Minister of Finance please tell the House, and will he please tell those workers from Target who are losing their jobs, what he will actually do for those workers.",New Democratic Party,Outremont,Thomas Mulcair,http://www.parl.gc.ca/parlinfo/Files/Parliamentarian.aspx?Item=551183c2-2f3e-41ba-8660-2d194cf60169&Language=E&Section=ALL
4626690,ca.proc.d.2015-02-05.16592.125,2015-02-05,106c623c-3606-40ae-a2f6-f4a619cf02f6,152,"Hon. Jason Kenney (Minister of Employment and Social Development and Minister for Multiculturalism, CPC)",,Oral Questions,Employment,,"Mr. Speaker, of course we all feel badly for those at that company who have lost their jobs. We have already reached out. In fact, within hours of the announcement made by this U.S. retailer, we reached out to the company and its employees, offering a special accelerated process for EI claims, offering job bridging and connections to jobs that are available through the Job Bank, and offering training programs. We will be there to support those individuals. 
The most important thing is that we have a strong and growing economy so that there are alternatives when people lose their jobs. That is why we are cutting taxes to create those jobs, rather than taking the NDP's approach of raising taxes. ",Conservative,Calgary Southeast,Jason Kenney,http://www.parl.gc.ca/parlinfo/Files/Parliamentarian.aspx?Item=106c623c-3606-40ae-a2f6-f4a619cf02f6&Language=E&Section=ALL
4626691,ca.proc.d.2015-02-05.16592.126,2015-02-05,551183c2-2f3e-41ba-8660-2d194cf60169,546,"Hon. Thomas Mulcair (Leader of the Opposition, NDP)",,Oral Questions,Employment,,"Mr. Speaker, most of them will not even qualify for EI. All he is talking about is accelerated refusal. 
The Conservatives were caught with their pants down by the drop in the price of oil and their failure to diversify the economy. 
We have brought forward tangible and responsible measures to help the manufacturing sector, boost SMEs and stimulate job creation in Canada.
Given that they do not even have a budget, can the Minister of Finance tell us if he will at least support our motion in order to create jobs for the middle class?",New Democratic Party,Outremont,Thomas Mulcair,http://www.parl.gc.ca/parlinfo/Files/Parliamentarian.aspx?Item=551183c2-2f3e-41ba-8660-2d194cf60169&Language=E&Section=ALL
4626692,ca.proc.d.2015-02-05.16592.127,2015-02-05,c7660459-7e05-4540-b825-ce3958285806,208,"Hon. James Moore (Minister of Industry, CPC)",,Oral Questions,Employment,,"Mr. Speaker, we will be voting against the motion because it is misguided, as most NDP policies are. Our government believes in having a strong, balanced, effective economy that supports manufacturing in all regions of the country. 
For example, we are putting forward our national shipbuilding procurement policy, which the NDP has opposed. This is a policy that the Conference Board of Canada last week said is going to lead to strong growth in the manufacturing sector in the provinces of British Columbia and Nova Scotia.
We have put forward, for example, the automotive innovation fund, which has led to an expansion of 1,200 new jobs at Linamar in Guelph and an expansion of 1,200 new jobs in Oakville by Ford through with those policies we put forward. 
Again and again, on accelerated capital cost allowance and key investments, the NDP has voted—",Conservative,Port Moody--Westwood--Port Coquitlam,James Moore,http://www.parl.gc.ca/parlinfo/Files/Parliamentarian.aspx?Item=c7660459-7e05-4540-b825-ce3958285806&Language=E&Section=ALL
4626693,ca.proc.d.2015-02-05.16592.128,2015-02-05,6519cfba-0080-419d-baa9-8ae6e56d032f,256,The Speaker,,Oral Questions,Employment,, The hon. Leader of the Opposition.,Conservative,Regina--Qu'Appelle,Andrew Scheer,http://www.parl.gc.ca/parlinfo/Files/Parliamentarian.aspx?Item=6519cfba-0080-419d-baa9-8ae6e56d032f&Language=E&Section=ALL
4626694,ca.proc.d.2015-02-05.16592.129,2015-02-05,551183c2-2f3e-41ba-8660-2d194cf60169,546,"Hon. Thomas Mulcair (Leader of the Opposition, NDP)",,Oral Questions,Infrastructure,,"Mr. Speaker, there were 400,000 manufacturing jobs were lost on their watch. My colleague from Sackville—Eastern Shore has always stood up for shipbuilding in our country. We have no lessons to receive from them.
The Conservatives have no plan for cities. Municipalities across the country are faced with crumbling infrastructure, an affordable housing crisis, and gridlock. Mayors are saying the government is not working with them. Last week the Minister of Finance called Canada's premiers “delusional” because they wanted to talk about improving transit.
What we want to know is this: are they going to take the same sort of arrogant attitude with the mayors of the country this afternoon and insult them the way the finance minister did?",New Democratic Party,Outremont,Thomas Mulcair,http://www.parl.gc.ca/parlinfo/Files/Parliamentarian.aspx?Item=551183c2-2f3e-41ba-8660-2d194cf60169&Language=E&Section=ALL
4626695,ca.proc.d.2015-02-05.16592.130,2015-02-05,a20523be-cae0-4d31-9595-e9303275e40d,583,"Mr. Peter Braid (Parliamentary Secretary for Infrastructure and Communities, CPC)",,Oral Questions,Infrastructure,,"Mr. Speaker, notwithstanding the sound and fury that they may hear in this place from time to time, municipalities can be assured that they have the strongest partner in this Conservative government that they have ever had.
Our Conservative government has introduced the largest infrastructure plan in Canadian history, a $75 billion plan over the next decade. This includes a $53 billion plan for municipalities, provinces, and territories. Also, in the fall the Prime Minister announced $6 billion specifically for federally owned infrastructure.
We are not only doing our part; we are doing much more. ",Conservative,Kitchener--Waterloo,Peter Braid,http://www.parl.gc.ca/parlinfo/Files/Parliamentarian.aspx?Item=a20523be-cae0-4d31-9595-e9303275e40d&Language=E&Section=ALL
4626696,ca.proc.d.2015-02-05.16592.131,2015-02-05,8b25c8e3-9469-45c8-9995-ecdf3f119c0c,8461,"Ms. Rosane Doré Lefebvre (Alfred-Pellan, NDP)",,Oral Questions,Public Safety,,"Mr. Speaker, on the Conservative's new security bill, Canadians have more questions than answers about whether these new powers are necessary, or even what they do. 
Would the minister please explain what new activities would be allowed by the clause that gives CSIS the power to “disrupt threats”?",New Democratic Party,Alfred-Pellan,Rosane Doré Lefebvre,http://www.parl.gc.ca/parlinfo/Files/Parliamentarian.aspx?Item=8b25c8e3-9469-45c8-9995-ecdf3f119c0c&Language=E&Section=ALL
4626697,ca.proc.d.2015-02-05.16592.132,2015-02-05,46dccbed-4370-40f0-975f-d08fe1688aa2,177,"Hon. Peter MacKay (Minister of Justice and Attorney General of Canada, CPC)",,Oral Questions,Public Safety,,"Mr. Speaker, this is a very comprehensive bill. However, with respect to CSIS, it would not only allow CSIS to share more information and work closely with Canadian security forces but also allow us to engage more with our Five Eyes community and to track terrorists that pose a threat to Canadians. It would allow our CSIS officers to operate as other security agencies do in protecting Canadians, both at home and abroad. ",Conservative,Central Nova,Peter MacKay,http://www.parl.gc.ca/parlinfo/Files/Parliamentarian.aspx?Item=46dccbed-4370-40f0-975f-d08fe1688aa2&Language=E&Section=ALL
