basepk,hid,speechdate,pid,opid,speakeroldname,speakerposition,maintopic,subtopic,subsubtopic,speechtext,speakerparty,speakerriding,speakername,speakerurl
4628385,ca.proc.d.2015-02-20.16622.147,2015-02-20,371336d4-a92b-4661-94b4-14d8939d7e94,296,"Mr. Maurice Vellacott (Saskatoon—Wanuskewin, CPC)",,Government Orders,Victims Bill of Rights Act,,"Mr. Speaker, I am very pleased to speak today in support of this important bill, Bill C-32, the victims bill of rights. It has been a long time coming, yet many people over decades prior have seen the need for something in the order of what we have here today.
The victims bill of rights is unlike any other legislative proposal for victims of crime in our country. It would create a stand-alone act, the Canadian victims bill of rights, or the CVBR. As my esteemed colleague just moments ago spoke so very eloquently about, it would enshrine 12 rights for victims at the federal level, for the first time in Canadian history. That is what the bill is all about. 
My colleague mentioned those 12 rights being grouped into some different areas of information, protection, participation, and also restitution. All would be enforceable through the remedy scheme proposed in the bill. That is only the first part of the reforms included in Bill C-32. In order to give life to the 12 rights set out in the Canadian victims bill of rights, Bill C-32 includes amendments to the Criminal Code, the Corrections and Conditional Release Act, and the Canada Evidence Act. 
I am very proud to be part of this historic recognition of the important role of victims in the criminal justice process. It is on the eve of my departure from this place in the fall, along with my colleague who spoke prior and others around this place. However, there is a great sense of satisfaction that we got this together and it is being passed under our watch, so to speak. 
The Standing Committee on Justice and Human Rights has just finished an extensive study of this important piece of legislation. I was very pleased to hear so many members of the committee, from all parties, expressing their support for the bill. We have already heard those inferences here this morning. 
This support speaks to the importance of the bill's overall goal of recognizing victims and ensuring that they occupy a more meaningful place in our criminal justice system. I was also pleased that so many witnesses took the time to testify at committee. Indeed, some 40 witnesses appeared before the standing committee to offer their views on the victims bill of rights. Most of those witnesses expressed their overall support for the bill while offering some specific constructive comments and suggestions for its improvement. Many acknowledged the importance of the bill in taking this first step toward treating victims as more than mere witnesses in the criminal justice process.
We also heard some criticisms. Some argued that the bill would cause excessive delays in an already overburdened justice system. In particular, they felt that a victims's right to information, supported by changes in the Criminal Code, would bring the criminal justice system to a halt. For example, proposed new subsection 606(4.1) would require a court that has accepted a guilty plea from an accused as a result of a plea agreement for a serious personal injury offence or murder to inquire of the prosecutor whether reasonable steps have been taken to inform the victim of the agreement. If it is not reasonable in the circumstance to do so, the crown would then be required to notify the victim as soon as possible. 
That amendment would allow victims to be informed, at an early opportunity, of potential plea bargains as they are on the horizon. Victims would be entitled, under proposed new subsection 606(4.2), to ask the crown attorney to notify them of plea agreements in cases involving other indictable offences with a maximum punishment of imprisonment of five years or more. 
It is clear that these amendments were carefully crafted to respond to victims' desire to be informed of plea agreements, to respect the independence of crown prosecutors, and to avoid delays in the criminal justice system that could infringe on an accused's right to be tried within a reasonable time, or which would otherwise grind the system to a halt. 
It is worth noting that section 20 of the Canadian victims bill of rights addresses aspects of that concern directly, and that the act is to be applied in a manner that would not likely interfere with the proper administration of justice. That would include causing excessive delay in the prosecution of an offence. This particular amendment, which supports a victim's right to information, has been criticized by some for not going far enough. We have heard from witnesses who would like a victim's right to participation to include an ability to present their views on plea agreements before they are accepted by the court. 
Some are aware that in developing this victims bill of rights, all of the views presented during the in-person and online consultations were considered. They were weighed, and it is very much a balancing act. In this bill, I think we have it right. 
Victims have repeatedly noted the importance of being informed of a plea agreement as soon as practical. The committee heard testimony from witnesses who spoke of the positive effects of informing victims of plea agreements. It can make them feel more included in the criminal justice process and more likely to understand the nature of the plea agreement. 
The issue of possible delays in the criminal justice system resulting from informing victims of plea agreements was raised at committee. In particular, the testimony provided by Mr. Gilhooly, who shared his experiences as a victim in the criminal justice system, summed it up perfectly. When asked if he thought the new duty to inform victims of a plea bargain would somehow delay the court process, he replied, “it would have taken 15 minutes to have kept me apprised”, when referring to the plea agreement reached for hockey coach Graham James.
 I agree with Mr. Gilhooly's remarks. Bill C-32 has struck the right balance between informing victims while avoiding delays in the criminal justice system.
Another Criminal Code amendment that has received a great deal of attention is proposed in the new section 486.31, which would codify the common law practice of enabling a witness to testify without revealing his or her true identity, typically through the use of a pseudonym. This provision has been criticized as being contrary to principles of fundamental justice and unconstitutional. However, I disagree, as would many around this place, obviously. 
 The proposed scheme would be discretionary and would require a judge to determine that such an order was in the interest of the proper administration of justice, a test that is well established in our current criminal law. The judge would consider a number of factors when considering whether to make that order. These factors would include fair trial rights, the interests of the witness in question, and societal interests relating to the proper functioning of our criminal justice system.
This provision would recognize the critical role witnesses play in the criminal justice system. Intimidation, such as threats of harm, can be directed at witnesses to impact their evidence, or indeed, in some cases, to prevent them from testifying at all.
 In the 2007 case of Named Person v. Vancouver Sun, the Supreme Court of Canada also recognized that it may be appropriate, in certain circumstances, to order a witness to testify using a pseudonym. Indeed, courts across Canada have done so. For example, in the case of R v. Moosemay, 2002, an Alberta court authorized a witness in a Wildlife Act prosecution to testify using a pseudonym to protect his safety. Similarly, in R. v. Gingras,1992, the Alberta Court of Appeal made an order to protect the safety of a prison inmate who testified and feared for his safety if his identity was made public. These cases demonstrate that orders such as these can be important in a wide variety of situations. 
The standing committee heard from one witness who works with victims of human trafficking and who was threatened as a result of her testimony at trial. She too very much supports this provision to protect the security of victims. 
The fair trial rights of the accused will always remain at the centre of the criminal justice system. However, a criminal trial must acknowledge and accommodate, to the extent possible, other important societal interests, such as protecting those who agree to testify as witnesses.
We know that the Canadian victims bill of rights cannot be all things to all people. It has been criticized by some for going too far in recognizing victims rights and by others for not going far enough. I, for one, believe that the bill has struck the right balance. It provides in plain language the rights victims should be able to exercise in the criminal justice and corrections systems. It also includes appropriate limitations that respect the myriad interests at play in the criminal justice system, including the rights of an accused. Most importantly, it provides the framework upon which all levels of government, federal, provincial, and territorial, can build to continue to strengthen the criminal justice system's treatment of victims.
 I hope that all members will support Bill C-32 and take part in this historic change in our Canadian criminal law. ",Conservative,Saskatoon--Wanuskewin,Maurice Vellacott,http://www.parl.gc.ca/parlinfo/Files/Parliamentarian.aspx?Item=371336d4-a92b-4661-94b4-14d8939d7e94&Language=E&Section=ALL
4628386,ca.proc.d.2015-02-20.16622.148,2015-02-20,6519cfba-0080-419d-baa9-8ae6e56d032f,256,The Speaker,,Government Orders,Victims Bill of Rights Act,,"It being 1:15 p.m., pursuant to an order made on Wednesday, February 4, 2015, it is my duty to interrupt the proceedings and put forthwith every question necessary to dispose of the third reading stage of the bill now before the House.
 The question is on the motion. Is it the pleasure of the House to adopt the motion? ",Conservative,Regina--Qu'Appelle,Andrew Scheer,http://www.parl.gc.ca/parlinfo/Files/Parliamentarian.aspx?Item=6519cfba-0080-419d-baa9-8ae6e56d032f&Language=E&Section=ALL
4628387,ca.proc.d.2015-02-20.16622.149,2015-02-20,,,,intervention,Government Orders,Victims Bill of Rights Act,," Agreed. 
 No. ",,,Some hon. members,
4628388,ca.proc.d.2015-02-20.16622.150,2015-02-20,6519cfba-0080-419d-baa9-8ae6e56d032f,256,The Speaker,,Government Orders,Victims Bill of Rights Act,, All those in favour of the motion will please say yea. ,Conservative,Regina--Qu'Appelle,Andrew Scheer,http://www.parl.gc.ca/parlinfo/Files/Parliamentarian.aspx?Item=6519cfba-0080-419d-baa9-8ae6e56d032f&Language=E&Section=ALL
4628389,ca.proc.d.2015-02-20.16622.151,2015-02-20,,,,intervention,Government Orders,Victims Bill of Rights Act,, Yea. ,,,Some hon. members,
4628390,ca.proc.d.2015-02-20.16622.152,2015-02-20,6519cfba-0080-419d-baa9-8ae6e56d032f,256,The Speaker,,Government Orders,Victims Bill of Rights Act,, All those opposed will please say nay. ,Conservative,Regina--Qu'Appelle,Andrew Scheer,http://www.parl.gc.ca/parlinfo/Files/Parliamentarian.aspx?Item=6519cfba-0080-419d-baa9-8ae6e56d032f&Language=E&Section=ALL
4628391,ca.proc.d.2015-02-20.16622.153,2015-02-20,,,,intervention,Government Orders,Victims Bill of Rights Act,, Nay. ,,,Some hon. members,
4628392,ca.proc.d.2015-02-20.16622.154,2015-02-20,6519cfba-0080-419d-baa9-8ae6e56d032f,256,The Speaker,,Government Orders,Victims Bill of Rights Act,," In my opinion the yeas have it. 
 And five or more members having risen: 
 Pursuant to Standing Order 45, the recorded division stands deferred until Monday, February 23, 2015 at the ordinary hour of daily adjournment. 
The hon. chief government whip is rising on a point of order.",Conservative,Regina--Qu'Appelle,Andrew Scheer,http://www.parl.gc.ca/parlinfo/Files/Parliamentarian.aspx?Item=6519cfba-0080-419d-baa9-8ae6e56d032f&Language=E&Section=ALL
4628393,ca.proc.d.2015-02-20.16622.155,2015-02-20,cb60b9db-e3bd-48d9-af20-0b0702a06589,95,Hon. John Duncan,Interjection,Government Orders,Victims Bill of Rights Act,,"Mr. Speaker, I think if you seek it you shall find agreement to see the clock at 1:30 p.m.",Conservative,Vancouver Island North,John Duncan,http://www.parl.gc.ca/parlinfo/Files/Parliamentarian.aspx?Item=cb60b9db-e3bd-48d9-af20-0b0702a06589&Language=E&Section=ALL
4628394,ca.proc.d.2015-02-20.16622.156,2015-02-20,6519cfba-0080-419d-baa9-8ae6e56d032f,256,The Speaker,,Government Orders,Victims Bill of Rights Act,, Shall I see the clock at 1:30?,Conservative,Regina--Qu'Appelle,Andrew Scheer,http://www.parl.gc.ca/parlinfo/Files/Parliamentarian.aspx?Item=6519cfba-0080-419d-baa9-8ae6e56d032f&Language=E&Section=ALL
4628395,ca.proc.d.2015-02-20.16622.157,2015-02-20,,,,intervention,Government Orders,Victims Bill of Rights Act,, Agreed.,,,Some hon. members,
4628396,ca.proc.d.2015-02-20.16622.158,2015-02-20,288315ef-2fe8-48ad-8ae0-833ac097bac0,3658,"Mr. Philip Toone (Gaspésie—Îles-de-la-Madeleine, NDP)",,Private Members' Business,VIA Rail Canada Act,," moved that Bill C-640, An Act respecting VIA Rail Canada and making consequential amendments to the Canada Transportation Act, be read the second time and referred to a committee.
Mr. Speaker, it is an honour to begin the debate today on Bill C-640, the VIA Rail Canada Act. This bill, which is long overdue, directly addresses the cause of many of the problems that have been facing our public passenger rail service ever since it was created in 1977. The bill provides the main, most crucial measure needed to resolve those problems.
When VIA Rail was created with the goal of taking charge of the declining passenger rail service, which was then provided by CN and CP, it was given very few of the tools needed to carry out that enormous task. One of the fundamental tools was legislation that clearly and fully explained the rights, powers, obligations and mandate of the new crown corporation. VIA Rail was never given that. Instead, it was created in a rather ad hoc, ill-considered manner. In the end, it was basically like a rudderless ship, without any navigational aids or even an engine. 
We saw the sad result. The management of VIA Rail has been unstable for nearly four decades. Its funding varies considerably. The company has barely been modernized. The fees for accessing the freight network are excessive. Passengers are made to wait for hours to give priority to freight trains. The worst part is that the public interest has been set aside countless times when, instead of providing support, governments have said that the only solution to VIA Rail's problems is radical cuts rather than rational changes.
This contrasts sharply with the U.S., where Amtrak, under similar circumstances, was founded to perform the same role as VIA. Before it ever turned its first wheel, in 1971, Amtrak was given the strong legislative foundation required to restore passenger rail. Its enabling act set the course for its growth into the useful, efficient, and cost-effective public transit service it is today. While it has not always been smooth sailing, Amtrak has weathered many financial and legislative storms because of its comprehensive legislation.
My member's bill is intended to do the same for Canadians. Like the act that launched Amtrak, it spells out what VIA must do to deliver nationwide rail passenger service that will play a strategic role in the economic, social, and environmental life of Canada. It would delineate a basic national network. It would set realistic and attainable performance standards. It would establish a mechanism to adjust VIA services, when necessary, here in the House of Commons. It would specifically end the backroom decision-making that has on several occasions wiped Canadian communities off the rail passenger map.
Many communities across this great nation depend on the services offered by VIA Rail to attract trade and commerce. In my riding of Gaspésie—Îles-de-la-Madeleine, passenger rail service was suspended beginning in 2011. 
Many people come to my riding to experience its natural beauty and especially to reach destinations such as Percé Rock and Forillon National Park. I have known many an individual who has come to visit these landmarks, with the train trip being an integral part of the excursion. However, declining train frequency has led to a gradual decline in the number of passengers. Reduced track speed due to deferred track maintenance has further led to declines in use. More recently, VIA has closed or sold a number of train stations. There is no joy in waiting for a train in the dead of night in a rural region without the shelter of a train station. Fighting winter storms often leads to scheduling delays, while passengers wait on unsheltered platforms. This is no way to increase ridership.
Passenger rail is important to keep local economies moving. It also performs a basic public service.
Seniors and people with mobility challenges depend on passenger rail to reach destinations, such as clinics and hospitals. For many, such as in my riding, with public services such as hospitals so very far apart, the bus is simply not an option, and a flight is prohibitively expensive. The train is their best and sometimes only possible solution.
I have heard from people across this country about the need to improve passenger service. I have gone to train stops to ask people what they would like to see in passenger rail. I mainly hear that they seek a reliable, on-time, frequent service. 
Rural regions with less than daily service typically see a gradual decline in the number of passengers. A recent example would be the Ocean, the Montreal to Halifax train. This route, the longest-running continuous train service in this country, having recently celebrated 110 years of continuous service, was cut from six trains a week to three. The effect was almost instantaneous. The passenger load dropped by nearly 40%. The route was even further threatened by the closure of its very rails in New Brunswick. After significant public pressure, the government did come up with a funding solution to keep the track open for the next 15 years.
As a member of the official opposition, I do not have a lot of opportunities to congratulate the government, but in this case, I will make an exception. The track, for now, is safe, but were it not for the public pressure that so many people in eastern Quebec and New Brunswick performed, the government surely would have let that track go.
Bill C-640 would also give VIA the fair and logistical rights it requires to operate effectively in the real world of competitive, multi-modal transportation. It proposes a cost-sharing basis by which VIA could partner with provincial or regional governments to add service to the basic national network. It would reaffirm the need for passenger trains to have reasonable priority over freight. It would also provide for the development of a fee schedule that would grant VIA access to the freight railway lines on terms that would be fair to all parties.
Around the globe, modern passenger trains are vital elements of the mobility strategies of nations with which we compete. If Canada is to be a part of this worldwide rail passenger renaissance, we must finally put VIA on a proper footing. That it has survived this long without a legislative mandate is a tribute to the inherent strength of the very concept of passenger railroads.
I have the opportunity to right a historic transportation wrong with this legislation, and I encourage others to support this bill. I certainly encourage the government to look at it again and consider sending this to committee for more debate.
I want to acknowledge the invaluable assistance of many people who have helped me draft this bill and who have also accompanied me in our passionate resistance to the decline of passenger rail in this country.
 I would like to start with Greg Gormick, an expert in passenger rail, an expert who has worked tirelessly all his life to bring the issue of passenger rail to the forefront. He has been speaking in many communities bringing the issue of passenger rail forward. Without his clear and honest work, we never would have made it as far as we have.
The people who live in eastern Quebec and northern New Brunswick are especially to be applauded for the amount of energy they have expended trying to save not only their passenger rail but the very rail system on which they depend.
 The passenger rail service in our part of the world has decayed substantially, and we need to see the government show that it is willing to support our remote communities with one of the vital links we have to the outside world. 
We do not have an exemplary bus transportation system. We do not have an affordable airline system. What we do have is the potential for daily rail service. We have had it in the past. If a train were to run as often as it should, we would be able to get that ridership back up again.
The interest is there, the capacity is there, and the freight that is the very backbone of the sustenance to keep that rail system going in eastern Canada is also present. We have all of the tools required. The only element that is missing is the government's unconditional support.
Some may wring their hands over the so-called subsidy required by our passenger rail system while, ironically, they regard much more massive spending on highways and air traffic as investments. Every modern country with passenger rail has operating costs. Imagine if Canada decided to eliminate everything from our lives that requires public investment. We would scrap schools and libraries. The parks would be gone, as well as hospitals and firefighters and anything we could name. We need to invest in public infrastructure if we want this country to work.
Trains are solid public investments. The U.S. Department of Commerce reports that every dollar spent on passenger rail service generates three to four times that amount back into the economy. That logic has simply not taken hold here. While VIA languishes and we debate its legislative future, Canadian-built passenger trains are thundering over steel rails of America, some of them at 250 kilometres an hour. American politicians of all stripes realize the issue is not whether America can afford to have passenger trains but whether it can afford not to have them. 
The contrasts and contradictions between VIA and its expanding publicly owned American cousin Amtrak are shocking. The most fundamental difference between the two railways is legislation. Amtrak has it; VIA does not. 
Bill C-640 would address this glaring legislative gap by providing a sort of bill of rights for passenger trains. It would give VIA the mandate it requires to deliver a large portion of the sustainable intercity mobility needed in 21st century Canada.
Visionary legislation set Amtrak rolling in 1971, and Bill C-640 could establish the mechanism to restore service to all communities that lost their trains through political expediencies here in Ottawa. Northwestern Ontario has had good news. After 104 years of continuous service, Thunder Bay lost its passenger service, the Canadian, back in January 1990 ,as a result of the Mulroney government's slashing of VIA's financing by 50%. In 2012, the current government cut $41 million from VIA's annual subsidy, which had been previously cut and frozen at $166 million by the Liberal government in 1988, with no provision for inflation.
I would like to make it clear that this legislation is the next step in VIA's evolution. VIA needs to know that there is a legislative framework that is going to keep this company rolling and that passenger rail has a future in this country. We have capacity in Thunder Bay and La Pocatière, Quebec, to build the rolling stock that we need. This bill would create jobs in areas that really need that support, and passenger rail has been proven to be a shot in the arm for the economies of the communities where trains pass through. 
We need VIA Rail in our communities. It is a fundamental choice that Canadians must make. This bill is the first step. The government needs to take the next.",New Democratic Party,Gaspésie--Îles-de-la-Madeleine,Philip Toone,http://www.parl.gc.ca/parlinfo/Files/Parliamentarian.aspx?Item=288315ef-2fe8-48ad-8ae0-833ac097bac0&Language=E&Section=ALL
4628397,ca.proc.d.2015-02-20.16622.159,2015-02-20,379a808d-9183-4a07-90c7-cdeb0ec3de63,302,"Mr. Jeff Watson (Parliamentary Secretary to the Minister of Transport, CPC)",,Private Members' Business,VIA Rail Canada Act,,"Mr. Speaker, it is interesting to see a bill about support for VIA when that party consistently votes against the funding we put forward for VIA. 
To the bill in question, first, I notice that the legislative framework that the NDP is proposing mimics the framework for Canada Post. I find that a little peculiar, because the business of sorting and delivering mail is substantially different from the business of passenger rail.
Aside from that, this bill proposes major restrictions on the independence and governance of VIA Rail such that it could not function properly as a corporation.
As well, there would be major legislated fixed costs to VIA if this bill were to pass. The most recent Amtrak statistics I have are for 2012, when Amtrak lost $1.4 billion. It loses somewhere in that range every single year. VIA had a subsidy of $305 million on behalf of taxpayers last year. Is the member trying to bury VIA or does he want the government to nationalize VIA?",Conservative,Essex,Jeff Watson,http://www.parl.gc.ca/parlinfo/Files/Parliamentarian.aspx?Item=379a808d-9183-4a07-90c7-cdeb0ec3de63&Language=E&Section=ALL
