basepk,hid,speechdate,pid,opid,speakeroldname,speakerposition,maintopic,subtopic,subsubtopic,speechtext,speakerparty,speakerriding,speakername,speakerurl
4636425,ca.proc.d.2015-04-30.16813.0,2015-04-30,fe517b95-bc62-4fe8-96aa-998994aefd48,173,"Mr. Tom Lukiwski (Parliamentary Secretary to the Leader of the Government in the House of Commons, CPC)",,Routine Proceedings,Government Response to Petitions,,"Mr. Speaker, pursuant to Standing Order 36(8), I have the honour to table, in both official languages, the government's responses to two petitions.",Conservative,Regina--Lumsden--Lake Centre,Tom Lukiwski,http://www.parl.gc.ca/parlinfo/Files/Parliamentarian.aspx?Item=fe517b95-bc62-4fe8-96aa-998994aefd48&Language=E&Section=ALL
4636426,ca.proc.d.2015-04-30.16813.1,2015-04-30,bb27e38b-4887-48e1-b182-ba18b39d411b,46,"Mr. Gordon Brown (Leeds—Grenville, CPC)",,Routine Proceedings,Interparliamentary Delegations,,"Mr. Speaker, pursuant to Standing Order 34(1), I have the honour to present, in both official languages, four reports of the Canadian delegation of the Canada-United States Inter-parliamentary Group. 
The first report concerns the seventh annual conference of the Southeastern United States--Canadian Provinces Alliance that was held in Raleigh, North Carolina, United States of America, May 4 to 6, 2014.
The second concerns the 24th Annual Summit of the Pacific NorthWest Economic Region held in Whistler, British Columbia, Canada, from July 20 to 24, 2014.
The third concerns the National Conference of State Legislatures legislative summit held in Minneapolis, Minnesota, United States of America, from August 18 to 22, 2014.
The fourth report concerns the Canadian/American Border Trade Alliance conference that was held in Washington, D.C., United States, September 28 to 30, 2014.",Conservative,Leeds--Grenville,Gord Brown,http://www.parl.gc.ca/parlinfo/Files/Parliamentarian.aspx?Item=bb27e38b-4887-48e1-b182-ba18b39d411b&Language=E&Section=ALL
4636427,ca.proc.d.2015-04-30.16813.2,2015-04-30,474155a0-d5ce-4780-9881-898c2502398d,237,"Mr. Joe Preston (Elgin—Middlesex—London, CPC)",,Routine Proceedings,Interparliamentary Delegations,,"Mr. Speaker, pursuant to Standing Order 34(1), I have the honour to present, in both official languages, two reports of the Canadian delegation of the Commonwealth Parliamentary Association.
The first report is respecting participation in the mid-year executive committee held in London, United Kingdom, April 28 to May 1.
The second report is respecting participation in the 60th Commonwealth Parliamentary Conference held in Yaoundé, Cameroon, from October 2 to10, 2014.",Conservative,Elgin--Middlesex--London,Joe Preston,http://www.parl.gc.ca/parlinfo/Files/Parliamentarian.aspx?Item=474155a0-d5ce-4780-9881-898c2502398d&Language=E&Section=ALL
4636428,ca.proc.d.2015-04-30.16813.3,2015-04-30,a71a1741-7ff2-4246-b0da-4622e96b10cf,1082,"Mr. Guy Caron (Rimouski-Neigette—Témiscouata—Les Basques, NDP)",,Routine Proceedings,Committees of the House,Finance," moved: 
 That the Eighth Report of the Standing Committee on Finance, presented on Wednesday, December 10, 2014, be concurred in. 
Mr. Speaker, I would like to begin by saying that I will be sharing my time with the excellent member for Welland.
I would like to talk about the prebudget consultations, since that is the subject of the report. I am in a good mood this morning, because yesterday we learned that the Rimouski Oceanic will be taking part in the Memorial Cup as the champions of the Quebec major junior hockey league. This will be their fourth time participating in 20 years, which is remarkable.
My good mood is a little tempered, however, by the content of the prebudget consultations. This is in no way a criticism of the chair of the Standing Committee on Finance, the member for Edmonton—Leduc, for he is doing an excellent job. I think all the parties in the House and all members of the finance committee recognize what a great job he is doing.
Although there are some interesting points in the prebudget consultation report, there are also some really troubling elements. We have no problem with some of the points, and we have supported them. Some of them even appear in budget 2015. Others, however, do pose a problem.
Until January, I was a member of the Standing Committee on Finance and had been for three years. Usually, the recommendations were a fairly accurate—though not perfect, by any means—reflection of the testimony we heard. However, the recommendations in this report, which was tabled in December 2014, make it more of a pre-election document for the existing government. Most if not all of the recommendations are from the Conservative side. Not a single NDP or Liberal amendment was accepted.
Annual prebudget consultations are an opportunity to hear from witnesses from many parts of Canadian society. Whether they are from the business sector, unions or civil society, their concerns deserve to be heard and properly reflected in the prebudget consultation report. 
In this case, there are a number of problematic elements. Several recommendations in the report are nothing more than lip service. For example, recommendation 23 says that the federal government should consider new ways to increase support for the Canadian aerospace industry, but does not say how. This recommendation is akin to many of the other 47 recommendations in this report in that it says where the government wants to go but not how to get there. 
That is a problem because other recommendations are more than just wishful thinking. They are blatantly a rationale for Conservative policies. In any case, the committee itself was not even able to unanimously agree on those recommendations.
When the government proposes to continue reducing tariffs, for example, it fails to mention that, overall, tariffs have gone up because it eliminated the general preferential tariff.
Prebudget consultations should be an exercise that reflects what was heard in committee, but in this case what we got seemed more like the Conservative government's shopping list to prepare for the next election. We think that is unfortunate because the Standing Committee on Finance should be the place where we can thoroughly examine all the policies that were adopted by the government. That also includes Conservative members.
A committee meeting is the only place where we can call members by name. The reason for that is that, in committee, they are not government members and they do not represent their riding. They are there to use their expertise to advise the government on what direction it should take. That is not what happened in the prebudget consultations. This time, the consultations were much more negative than previous consultations and reports.
We submitted a minority report, which is a supplementary rather than dissenting report. It is supplementary to the 47 recommendations presented by the government. There was consensus on some of those recommendations, but the two opposition parties voted against others.
One problematic issue that the government refused to address, even though it was mentioned a number of times during the consultations, is employment insurance. The report was tabled in December 2014, but at that time, we were already worried about the government using the employment insurance fund to balance its budget since we have seen that happen before. That concern is included in the NDP's supplementary report. We had no idea what the budget was going to look like, but we were worried about that happening because of what we had been hearing. This is what we wrote in our supplementary report:
 The Conservatives are banking on surpluses in the EI Account in order to fund their return to budget balance—at the same time that they continue to restrict access through the implementation of their regressive EI reforms. 
By “regressive reforms” we specifically mean all the measures that were adopted during the major reform of 2012. These measures have made it impossible for many Canadians to get employment insurance even though they contributed to it. Today, less than 38% of Canadians who contribute to employment insurance, who make their contributions expecting that employment insurance will help them, can get it when they lose their job. This does not make sense and, at the end of the day, it is very detrimental to regions like mine, like the Lower St. Lawrence, eastern Quebec, and eastern Canada. The economy in these regions has historically depended on seasonal employment, to a great extent, and still does. I am proud of the efforts my riding and my region have made over the past few years to diversify their economy and ensure that they are not as reliant on seasonal employment as they have been in the past. When we talk about seasonal jobs, we are talking mostly about jobs in the primary sector, the resource sector, the forestry or the fishery. We are also talking about jobs in the service sector, which for obvious reasons are only seasonal jobs, in the tourism industry for example. Going back to natural resources, there are also core industries such as agriculture. A farmer cannot harvest in winter. Maple syrup producers cannot do much of their work in the fall or winter either.
The government has failed to acknowledge this reality that affects several regions. We spoke out against this when the reform was introduced. Year after year, many witnesses have told us that the system is no longer adequate today. The EI fund has a surplus because of the increase in premiums imposed by the Conservatives. The government no longer knows what to do with it. One of the recommendations we received was to increase access to the program. The Conservatives completely ignored the recommendations. Instead they took part of the surplus and decided to give it to small and medium-sized businesses. That measure was passed last year. Small and medium-sized businesses were handed over $550 million of the employment insurance surplus with the hope of creating jobs. However, the House will remember that the Parliamentary Budget Officer's report stated that it would take over half a billion dollars to create 800 jobs, contrary to what the government was saying. Today, we find ourselves in a situation where the surplus in the EI fund, which we would like to be independent, has in large part funded the balanced budget that the federal government is boasting about.
The prebudget consultation report contains several interesting items. The work of the committee chair, the member from Edmonton—Leduc was impeccable. However, I would like to submit to the House the problems that exist in terms of the philosophy of implementing the prebudget consultations. The government is moving steadily away from taking the consultations into account and that remains a serious concern for us.
On that note, I will turn the floor over to the member for Welland, who is certainly going to continue in the same vein.",New Democratic Party,Rimouski-Neigette--Témiscouata--Les Basques,Guy Caron,http://www.parl.gc.ca/parlinfo/Files/Parliamentarian.aspx?Item=a71a1741-7ff2-4246-b0da-4622e96b10cf&Language=E&Section=ALL
4636429,ca.proc.d.2015-04-30.16813.4,2015-04-30,07cf5767-802c-406c-92a7-7dc92af79b40,4264,"Mr. Kevin Lamoureux (Winnipeg North, Lib.)",,Routine Proceedings,Committees of the House,Finance,"Mr. Speaker, there is a great deal of concern with regard to the budget and the manner in which the Minister of Finance has presented what I would suggest is a bogus balanced budget, not to mention its unfairness to the middle class on taxation policy.
 This is a budget that does nothing for real tangible economic growth for Canada. The government does not seem to get it. It does not understand that it is the middle class of Canada that will be the driving force of our economy. Giving strength to our middle class will give strength to the Canadian economy. That should be the priority. Obviously, the minister was not listening when he canvassed and solicited opinions on the budget. 
The question I have for the member is on the general behaviour of the Minister of Finance. For example, ever since the budget presentation, he has not stood in his place to answer any questions related to the budget. I am wondering if the member might want to comment on the facade of having budget consultations and then not even having the courage to answer questions on the budget after he has delivered it.",Liberal,Winnipeg North,Kevin Lamoureux,http://www.parl.gc.ca/parlinfo/Files/Parliamentarian.aspx?Item=07cf5767-802c-406c-92a7-7dc92af79b40&Language=E&Section=ALL
4636430,ca.proc.d.2015-04-30.16813.5,2015-04-30,a71a1741-7ff2-4246-b0da-4622e96b10cf,1082,Mr. Guy Caron,Interjection,Routine Proceedings,Committees of the House,Finance,"Mr. Speaker, I will start by answering the question about the balanced budget.
Indeed, a large part of the balanced budget this government brags about so much comes from sources that were not recommended in pre-budget consultations.
The first source is the EI surplus, which was about $1.8 billion. Since the surplus announced by the government is just $1.4 billion, it had to take the $1.8 billion from the EI surplus and add it to the consolidated revenue fund, even though the Finance Minister's predecessor, Jim Flaherty, had said that the government would never use the EI surplus to finance a balanced budget.
The second source is the contingency fund—not just this year's fund, which went from $3 billion to $1 billion, but the fund for the next two years as well. This measure was not recommended in the pre-budget consultations either. No one made that suggestion.
The third source is the early sale of GM shares, worth $3.1 billion. You have to add the $2 billion to this $3.1 billion. I said “early sale” because the government lost a lot of money on these GM shares. If it had waited just one more week to sell them, it would have made $100 million more.
At the end of the day, we are talking about nearly $7 billion taken from these three sources to achieve this balanced budget.",New Democratic Party,Rimouski-Neigette--Témiscouata--Les Basques,Guy Caron,http://www.parl.gc.ca/parlinfo/Files/Parliamentarian.aspx?Item=a71a1741-7ff2-4246-b0da-4622e96b10cf&Language=E&Section=ALL
4636431,ca.proc.d.2015-04-30.16813.6,2015-04-30,95ed53a7-7538-4c0f-85a4-64af76065f95,616,"Mr. Don Davies (Vancouver Kingsway, NDP)",,Routine Proceedings,Committees of the House,Finance,"Mr. Speaker, the people of Vancouver Kingsway have been very clear for a number of years about the kinds of issues they believe are important and which they really would like the federal government to address.
There is a crushing, critical shortage of affordable housing in Vancouver. People are extremely concerned about the lack of good quality, full-time jobs, the kind of jobs on which people can raise a family. 
People are very concerned about the environment in Vancouver Kingsway. They are worried about climate change and protecting Canada's pristine environment. They want to make sure our children and our children's children can enjoy that. 
I am wondering if my hon. colleague can comment on whether or not he feels that this budget has done an adequate job in addressing those major pivotal concerns of affordable housing, good jobs and protecting the environment.",New Democratic Party,Vancouver Kingsway,Don Davies,http://www.parl.gc.ca/parlinfo/Files/Parliamentarian.aspx?Item=95ed53a7-7538-4c0f-85a4-64af76065f95&Language=E&Section=ALL
4636432,ca.proc.d.2015-04-30.16813.7,2015-04-30,a71a1741-7ff2-4246-b0da-4622e96b10cf,1082,Mr. Guy Caron,Interjection,Routine Proceedings,Committees of the House,Finance,"Mr. Speaker, I thank my colleague from Vancouver Kingsway for that very important question.
Affordable housing is definitely one of the biggest losers in this budget. Many organizations have condemned the lack of adequate funding. None of the recommendations coming out of the pre-budget consultations really address this issue in any meaningful way, despite the fact that we heard witnesses talk about the importance of investing in housing and express disappointment in the federal government's lack of interest in this issue.
Also, in our supplementary report, we specifically talked about how the government should take immediate action to address the affordable housing crisis facing Canadian municipalities by renewing social housing agreements and working to develop and implement a national housing strategy as proposed by Bill C-400.
Unfortunately, the government did not pay attention to that recommendation, which is a real shame because the affordable housing crisis is affecting the whole country and is not getting any real attention from the federal government.",New Democratic Party,Rimouski-Neigette--Témiscouata--Les Basques,Guy Caron,http://www.parl.gc.ca/parlinfo/Files/Parliamentarian.aspx?Item=a71a1741-7ff2-4246-b0da-4622e96b10cf&Language=E&Section=ALL
