basepk,hid,speechdate,pid,opid,speakeroldname,speakerposition,maintopic,subtopic,subsubtopic,speechtext,speakerparty,speakerriding,speakername,speakerurl
4628249,ca.proc.d.2015-02-20.16622.11,2015-02-20,8131817f-bf86-4739-9a70-6ef9de6f11b6,23,"Mr. André Bellavance (Richmond—Arthabaska, Ind.)",,Statements By Members,Genetically Modified Foods,," Mr. Speaker, the Conservative government has always had a laissez-faire attitude towards genetically modified foods, and the recent decision by the U.S. department of agriculture is reviving Quebec consumers' and producers' concerns. 
 The Americans have just approved two varieties of genetically modified apples that will be put on the market within five years and whose main characteristic is that they do not turn brown. Some conventional apples already have this characteristic. According to a survey of 1,500 Canadians, 69% are opposed to the sale of genetically modified apples in Canada. Furthermore, 91% are calling for mandatory labelling of GM foods. The Fédération des producteurs de pommes du Québec is: 
 ...concerned and still opposes the introduction of a genetically modified apple on the market, because it believes that consumers are skeptical and this could have a negative impact on the consumption and sales of apples in Canada. 
The government must take a firm stand, prohibit the sale of genetically modified apples and make labelling of GM foods mandatory, as Canadians and producers themselves are calling for.",Independent,Richmond--Arthabaska,André Bellavance,http://www.parl.gc.ca/parlinfo/Files/Parliamentarian.aspx?Item=8131817f-bf86-4739-9a70-6ef9de6f11b6&Language=E&Section=ALL
4628250,ca.proc.d.2015-02-20.16622.12,2015-02-20,9c7defca-7fe0-4b22-80a4-8cb4686cfc9a,157,"Mr. Daryl Kramp (Prince Edward—Hastings, CPC)",,Statements By Members,Legion of Honour Recipient,,"Mr. Speaker, today I wish to recognize Ewart Wannamaker, a young 92-year-old and a native of Carlow Township who is now a knight in the National Order of the Legion of Honour of France.
At a ceremony at the Bancroft Legion, he received his medal and certificate from Lieutenant Colonel Roger Vandomme, deputy defence attaché at the French embassy. In his presentation Lieutenant Colonel Vandomme spoke of the French nation's desire to honour young Canadians who left their homes and careers to bring freedom to France. “The medal is but a small token of our continuing gratitude to those Canadians”, he declared.
When joining the Canadian army in 1942 as a corporal craftsman with the Royal Canadian Electrical Mechanical Engineers, he help liberate France, Belgium, and Holland from the Nazis. Wannamaker was in the advance recovery unit, salvaging damaged vehicles so they could be repaired and returned to action or destroyed. He is still a member of the Bancroft Legion, and for his work he has received both a Certificate of Merit and a national Meritorious Service Medal.
To his family and friends, we honour Corporal Wannamaker, now a French knight as well as a beloved native son.",Conservative,Prince Edward--Hastings,Daryl Kramp,http://www.parl.gc.ca/parlinfo/Files/Parliamentarian.aspx?Item=9c7defca-7fe0-4b22-80a4-8cb4686cfc9a&Language=E&Section=ALL
4628251,ca.proc.d.2015-02-20.16622.13,2015-02-20,63525202-2bba-4063-8092-224f751f211d,1772,"Ms. Françoise Boivin (Gatineau, NDP)",,Statements By Members,World Day of Social Justice,,"Mr. Speaker, today, the UN invites us to commemorate the World Day of Social Justice. Oh, how social justice has suffered for decades in Canada at the hands of both Liberal and Conservative governments. The middle class ends up paying the price, as inflation erodes its purchasing power and the federal government keeps cutting services.
A lifetime ago, one prime minister even promised Canadians a just society. When he was unable to deliver on his promise, a journalist asked him what happened. The elder Trudeau replied, “Ask Jesus Christ. He promised it first.” How cynical.
Liberal and Conservative governments lower standards, violate the public's trust and then send them the bill. What they forget is that the erosion they cause will inevitably be their downfall. As the saying goes, “You reap what you sow.”
Social justice should be a priority for every government. It is one of the NDP's key principles, and we will never back away from our plan to create greater social justice for all.",New Democratic Party,Gatineau,Françoise Boivin,http://www.parl.gc.ca/parlinfo/Files/Parliamentarian.aspx?Item=63525202-2bba-4063-8092-224f751f211d&Language=E&Section=ALL
4628252,ca.proc.d.2015-02-20.16622.14,2015-02-20,7f45dfd9-dd4b-4b04-8dc9-20cb0730d279,428,"Mr. Jacques Gourde (Lotbinière—Chutes-de-la-Chaudière, CPC)",,Statements By Members,Hooked on School Days,,"Mr. Speaker, this week Quebec marked Hooked on School Days with events across the province. It was an opportunity to raise awareness and rally the public to encourage our young people throughout their school days. The purpose of the week is to increase not only the number of students who stay in school, but also the number of students who pursue a higher education.
As a member of Parliament, it is always a privilege for me to see the pride and enthusiasm in the students whom I congratulate every year at graduation. Today's young people are tomorrow's workforce. Whatever we can do to help as individuals or a community goes a long way.
I would like to acknowledge the exceptional work of all the organizations in Lotbinière—Chutes-de-la-Chaudière and all the partner organizations in Quebec that held countless activities to encourage our young people to stay in school, succeed and keep believing that they can achieve their full potential.",Conservative,Lotbinière--Chutes-de-la-Chaudière,Jacques Gourde,http://www.parl.gc.ca/parlinfo/Files/Parliamentarian.aspx?Item=7f45dfd9-dd4b-4b04-8dc9-20cb0730d279&Language=E&Section=ALL
4628253,ca.proc.d.2015-02-20.16622.15,2015-02-20,0d8486f0-be42-41d4-ac82-c51a7f9c0fa9,72,"Hon. Irwin Cotler (Mount Royal, Lib.)",,Statements By Members,Anti-Semitism,,"Mr. Speaker, recently I addressed the first-ever United Nations General Assembly meeting on anti-Semitism, which took place, symbolically and significantly, on International Holocaust Remembrance Day. It was also the 70th anniversary of the liberation of Auschwitz, the most brutal extermination camp of the 20th century, reminding us of horrors too terrible to be believed but not too terrible to have happened. 
At Auschwitz 1.3 million people were murdered, and 1.1 million of them were Jews. Let there be no mistake about it: Jews died at Auschwitz because of anti-Semitism, but anti-Semitism did not die. Indeed, we have been witness to an escalation and intensification of this oldest, most enduring, and particularly toxic hatred, reminding us that while it begins with Jews, it may not end with Jews, that anti-Semitism is the canary in the mineshaft of evil. 
I am pleased, therefore, that in response to the UN appeal to member parliaments, we will be holding a take-note debate on anti-Semitism on Tuesday evening. It is timely, necessary, and urgent that we sound the parliamentary alarm on this global evil.",Liberal,Mount Royal,Irwin Cotler,http://www.parl.gc.ca/parlinfo/Files/Parliamentarian.aspx?Item=0d8486f0-be42-41d4-ac82-c51a7f9c0fa9&Language=E&Section=ALL
4628254,ca.proc.d.2015-02-20.16622.16,2015-02-20,78cd5419-2f3c-4798-9c5b-0e55843ef9fb,604,"Mrs. Kelly Block (Saskatoon—Rosetown—Biggar, CPC)",,Statements By Members,Trinity Western University,,"Mr. Speaker, freedom of religion is a value that Canadians hold dear. Sadly, there are some people, businesses, and even law societies that are opposing this value. Citing Trinity Western University's student code of conduct, they say that either Trinity should not be allowed to have a law school or that Trinity graduates should not be allowed to practise law.
The Supreme Court of Canada has already ruled that the Trinity student code of conduct does not constitute discrimination. Thankfully, a ruling by the Supreme Court of Nova Scotia has brought some common sense to this most recent debate. Last month, Justice Jamie Campbell dismissed a decision by the Nova Scotia Barristers' Society to deny future Trinity law school graduates the right to practise law.
I call on all opponents of Trinity Western University's future law school to withdraw their opposition and support the important Canadian value of freedom of religion.",Conservative,Saskatoon--Rosetown--Biggar,Kelly Block,http://www.parl.gc.ca/parlinfo/Files/Parliamentarian.aspx?Item=78cd5419-2f3c-4798-9c5b-0e55843ef9fb&Language=E&Section=ALL
4628255,ca.proc.d.2015-02-20.16622.17,2015-02-20,8b25c8e3-9469-45c8-9995-ecdf3f119c0c,8461,"Ms. Rosane Doré Lefebvre (Alfred-Pellan, NDP)",,Statements By Members,Laval's 50th Anniversary,,"Mr. Speaker, I am proud to rise in the House today to talk about an anniversary that is very special to the people of Laval: the City of Laval's 50th anniversary. In 1965, the 14 municipalities of Île Jésus decided to merge, creating the City of Laval. Fifty years later, Quebec's third-largest city is a diversified and prosperous economic centre, as well as a city of choice for young families and seniors.
Throughout the year, there will be all kinds of celebrations for everyone. In addition to major concerts, a number of citizen-led projects will highlight the unique heritage of each neighbourhood. Programming details are available at www.50ans.laval.ca.
I tip my hat to the Corporation des célébrations 2015 à Laval, the mayor of Laval, municipal elected representatives and individuals who proposed projects. Their dedication to celebrating Laval's 50th anniversary shows that together, we can accomplish great things. I wish everyone in Laval a happy 50th anniversary.",New Democratic Party,Alfred-Pellan,Rosane Doré Lefebvre,http://www.parl.gc.ca/parlinfo/Files/Parliamentarian.aspx?Item=8b25c8e3-9469-45c8-9995-ecdf3f119c0c&Language=E&Section=ALL
4628256,ca.proc.d.2015-02-20.16622.18,2015-02-20,3427307a-a672-4e3a-bd69-7698399cbc86,877,"Mr. Parm Gill (Brampton—Springdale, CPC)",,Statements By Members,Sex Education,,"Mr. Speaker, I recently attended a town hall meeting in Brampton, where parents were outraged by the Liberal Party policies that attack our family values.
The Liberals want to legalize marijuana, making it more accessible to our children. They want to legalize prostitution in our streets and in our neighbourhoods. Now the Liberals are determined to introduce a new sex-ed curriculum in Ontario with graphic and explicit sex education for children starting in grade 1.
As a father of three, I share the concerns of many of my constituents that these policies are dangerous, expose young children to sexually explicit behaviour, and teach concepts and practices that parents consider offensive and morally questionable.
The Liberals need to stop attacking our family values and instead focus on teaching our kids a curriculum that reflects the beliefs of parents.",Conservative,Brampton--Springdale,Parm Gill,http://www.parl.gc.ca/parlinfo/Files/Parliamentarian.aspx?Item=3427307a-a672-4e3a-bd69-7698399cbc86&Language=E&Section=ALL
4628257,ca.proc.d.2015-02-20.16622.19,2015-02-20,f66407a4-934e-4c46-b524-b4dacd035ceb,613,"Mr. Andrew Saxton (North Vancouver, CPC)",,Statements By Members,International Development,,"Mr. Speaker, today I rise to bring attention to issues that affect people worldwide: clean water and proper sanitation. Currently, 2.5 billion people lack access to toilets, something that is hard for many of us here to even imagine.
Last September I met with India's Prime Minister Modi when I took part in the Global Citizen Festival, hosted by the Global Poverty Project. Prime Minister Modi spoke passionately about the great effort his country is making to ensure that all Indians have access to proper sanitation, made by famous by his “toilets before temples” campaign. 
Increasing access to and usage of toilets will not only reduce the daily death toll of some 2,000 young lives worldwide caused by sanitation-related diseases, but will also make schools a more welcoming place for girls, many of whom do not attend for this very reason. For every dollar invested in safe drinking water and sanitation, there is about $4 saved in work time, productivity, and health care costs in developing countries.
Let us work together toward sustainable development goals for the health and safety of all people worldwide.",Conservative,North Vancouver,Andrew Saxton,http://www.parl.gc.ca/parlinfo/Files/Parliamentarian.aspx?Item=f66407a4-934e-4c46-b524-b4dacd035ceb&Language=E&Section=ALL
4628258,ca.proc.d.2015-02-20.16622.20,2015-02-20,b9d8fa4f-465a-47b2-a6c4-c9f55f20dd9b,8562,"Mr. José Nunez-Melo (Laval, NDP)",,Statements By Members,Black History Month,,"Mr. Speaker, the entire month of February is Black History Month. It is a history that is marked by pain, but also by courage, hope and resilience. 
Black people have helped build this continent and this country, which we share thanks to their blood and the sweat of their brows. They had to stand up and fight against discrimination and untold violations of their rights. Great strides have been made, but a lot of work remains to be done. Exclusion is unfortunately very much a reality in our society and indeed in many unexpected spheres.
I am proud to give a voice to the minorities in my riding, Laval, and to commend their economic, political and socio-cultural contributions.
I also want to pay tribute to the late Althea Joseph-Charles Seaman of the Black Community Association. She was an amazing woman who passed away in the fall of 2013. I also want to thank Dr. Alix Rey, who took over this important work.
Let us celebrate the 24th edition of Black History Month in Laval, and let us “stand for something”.",New Democratic Party,Laval,José Nunez-Melo,http://www.parl.gc.ca/parlinfo/Files/Parliamentarian.aspx?Item=b9d8fa4f-465a-47b2-a6c4-c9f55f20dd9b&Language=E&Section=ALL
4628259,ca.proc.d.2015-02-20.16622.21,2015-02-20,5a970b67-b862-4ca8-aa9f-4a97632f3a33,8753,"Mr. Bernard Trottier (Etobicoke—Lakeshore, CPC)",,Statements By Members,Ukraine,,"Mr. Speaker, one year ago today in the Maidan in Kiev, a peaceful protest was turned into a massacre. Over three days, up to 100 people were shot dead by then-president Yanukovych's security forces. Yanukovych later fled the country and his government collapsed, but that was only the beginning.
Since then, Russia has stoked conflict in the eastern Ukraine. This conflict has claimed more than 5,000 lives. Our government stands firmly behind the people of Ukraine. We have stated clearly, loudly, and often that this conflict will only end when Russia halts its invasion, withdraws its armed forces, and stops supporting these so-called rebels.
This is why we have made significant military contributions to NATO's Ukrainian reassurance measures, why our economic sanctions regime against powerful Russian individuals is the strongest in the world, and why we have announced over $515 million in assistance since the killing of protesters took place over one year ago.
On behalf of my constituents in Etobicoke—Lakeshore, I want to be clear to the Ukrainian people on this anniversary that they have a friend in Canada.",Conservative,Etobicoke--Lakeshore,Bernard Trottier,http://www.parl.gc.ca/parlinfo/Files/Parliamentarian.aspx?Item=5a970b67-b862-4ca8-aa9f-4a97632f3a33&Language=E&Section=ALL
4628260,ca.proc.d.2015-02-20.16622.22,2015-02-20,08f8d23a-fbea-4e7b-ba41-34c9f62dde9e,8474,"Ms. Anne Minh-Thu Quach (Beauharnois—Salaberry, NDP)",,Statements By Members,Small Business,,"Mr. Speaker, SMEs are the foundation of our economy. In my riding of Beauharnois—Salaberry, 89% of businesses are SMEs. That means that over 2,000 businesses are creating jobs and generating wealth locally.
Whether it is in the manufacturing, agricultural, food processing, chemical, computer, restaurant, retail or tourism sectors, our business people are taking risks. They are innovating and they are exporting their products. Above all, they are providing jobs for people locally and are getting involved in their communities.
Why not support them? Why has the federal government abandoned the manufacturing and retail industries to provide subsidies to oil multinationals? The government has put all its eggs in the same basket. This disastrous economic management has been harmful to our businesses. Companies in Valleyfield, Beauharnois, Ormstown and Jardins-de-Napierville have had to close their doors. It is time for that to stop.
The next government—an NDP government—will provide better support for SMEs. We will make our local business people a priority by providing an innovation tax credit and lowering taxes from 11% to 9%.",New Democratic Party,Beauharnois--Salaberry,Anne Minh-Thu Quach,http://www.parl.gc.ca/parlinfo/Files/Parliamentarian.aspx?Item=08f8d23a-fbea-4e7b-ba41-34c9f62dde9e&Language=E&Section=ALL
4628261,ca.proc.d.2015-02-20.16622.23,2015-02-20,d02c368a-0fe4-4a79-91b1-f8c176e29457,151,"Mr. Gerald Keddy (South Shore—St. Margaret's, CPC)",,Statements By Members,Natural Resources,,"Mr. Speaker, Canadians expect their government to create jobs and grow the economy. Canada is blessed with an immense amount of natural resources, which provide opportunities from coast to coast to coast. Our government's responsible resource development plan has led to action on Canada's already impressive world-class safety systems for the transportation of our energy products.
While our government makes decisions based on independent, science-based review, the Liberal Party is opposing resource development before the regulatory review has even been completed. Why did the leader of the Liberal Party insist on putting ideology before science and facts, when he said the energy east oil pipeline is not socially acceptable? That statement is unacceptable.
 Our message is clear. We will stand up for Canadians' interests at home as well as abroad and continue to create jobs, growth, and opportunity for all Canadians.",Conservative,South Shore--St. Margaret's,Gerald Keddy,http://www.parl.gc.ca/parlinfo/Files/Parliamentarian.aspx?Item=d02c368a-0fe4-4a79-91b1-f8c176e29457&Language=E&Section=ALL
4628262,ca.proc.d.2015-02-20.16622.24,2015-02-20,c5378648-5d94-4645-bc05-339090e1077b,577,"Ms. Kirsty Duncan (Etobicoke North, Lib.)",,Statements By Members,Mary Harker,,"Mr. Speaker, I rise to celebrate the extraordinary Mary Harker, who was tireless in her commitment to helping others, making the world a better place, and welcoming everyone with open arms.
Mary was legendary in Etobicoke, having worked with mayors, MPPs, and MPs. She started the Nightgown Brigade and would rush to help women escaping violent situations no matter what time of night. She served on Albion Neighbourhood Services and with Youth Without Shelter, helped found Ernestine's Women's Shelter, gave four decades to the Rexdale legal clinic, and served for decades on the Community Police Liaison Committee.
The community loved Mary and recognized her thousands of hours of volunteer services with numerous awards.
Mary is now with her beloved husband Ron, and leaves behind daughters Kathy and Wendy, their partners Scott and Peter, and her grandchildren Matthew, Cameron, and Madeline. We thank them for sharing her with us. We owe them a debt of gratitude.",Liberal,Etobicoke North,Kirsty Duncan,http://www.parl.gc.ca/parlinfo/Files/Parliamentarian.aspx?Item=c5378648-5d94-4645-bc05-339090e1077b&Language=E&Section=ALL
4628263,ca.proc.d.2015-02-20.16622.25,2015-02-20,ea1b31cf-b0bd-41aa-8ded-17c0cc3c8264,8810,"Mrs. Susan Truppe (London North Centre, CPC)",,Statements By Members,Taxation,,"Mr. Speaker, while the New Democrats want to impose a job-killing carbon tax and the Liberal leader encourages his provincial comrades to do the same, the Conservative government is delivering the largest tax break in Canadian history.
Under this plan, 100% of families with children would have more money in their pockets to spend on their priorities as a family. In my riding of London North Centre, families are excited about this. Through all the new tax breaks, the average benefit to each of these families would be more than $1,100. 
We assured Canadians that we would lower taxes and put more of their hard-earned money back in their pockets. That is exactly what we are doing and what we will continue to do.",Conservative,London North Centre,Susan Truppe,http://www.parl.gc.ca/parlinfo/Files/Parliamentarian.aspx?Item=ea1b31cf-b0bd-41aa-8ded-17c0cc3c8264&Language=E&Section=ALL
4628264,ca.proc.d.2015-02-20.16622.26,2015-02-20,c7c870dc-abda-4577-802a-5f1fa1d7654c,8614,"Ms. Lysane Blanchette-Lamothe (Pierrefonds—Dollard, NDP)",,Statements By Members,Citizenship and Immigration,,"Mr. Speaker, the Conservatives surprised many when they sent out a fundraising email saying that they oppose the wearing of a hijab at a citizenship ceremony. 
It is bad enough that the Minister of Citizenship and Immigration is waging a war against Muslim women who cover their faces, but it is beyond belief that he is mixing up the terms hijab, niqab and burka for the sole purpose of confusing people and instilling fear.
He could have simply said that he had used the wrong term, but no, he chose to say that the hijab is not allowed, even though the hijab is allowed at citizenship ceremonies. He would rather create more division and fear for political gain.
The Conservatives are doing the same with Bill C-51. They are taking advantage of current circumstances to mislead the public by claiming that Bill C-51 does not give law enforcement agencies more powers.
Canadians deserve better. Canadians deserve leaders who tell the truth and do not exploit divisions for political gain.",New Democratic Party,Pierrefonds--Dollard,Lysane Blanchette-Lamothe,http://www.parl.gc.ca/parlinfo/Files/Parliamentarian.aspx?Item=c7c870dc-abda-4577-802a-5f1fa1d7654c&Language=E&Section=ALL
4628265,ca.proc.d.2015-02-20.16622.27,2015-02-20,26c8b0bc-42d4-4db5-bf7d-1e1544c7b4b5,9172,"Mr. Dan Albas (Okanagan—Coquihalla, CPC)",,Statements By Members,Taxation,,"Mr. Speaker, thanks to our new family tax cut and enhanced universal child care benefit, 100% of families with children will be better off. The average family with children in Canada will now receive just under $2,000 per child. 
The difference between our priorities and those of the opposition are very clear: while we are giving back to Canadian families, the opposition would take money away from families. While we are cutting taxes, the Liberal leader would raise taxes. While our plan helps out 100% of Canadian families with kids, the NDP plan would help only 10% of families. Our family tax cut and enhanced universal child care benefit will help every family in Canada with children. That is over four million families. 
Only this Conservative government can be trusted to put more money back into the pockets of each and every family with children in Canada.",Conservative,Okanagan--Coquihalla,Dan Albas,http://www.parl.gc.ca/parlinfo/Files/Parliamentarian.aspx?Item=26c8b0bc-42d4-4db5-bf7d-1e1544c7b4b5&Language=E&Section=ALL
4628266,ca.proc.d.2015-02-20.16622.28,2015-02-20,37174f12-1dc0-44f0-8065-4c09cf9ebca1,557,"Ms. Megan Leslie (Halifax, NDP)",,Oral Questions,Public Safety,,"Mr. Speaker, five former Supreme Court justices, seven former federal ministers and four former prime ministers, including one Conservative, are all worried about the harm that Bill C-51 could cause.
This bill could undermine public safety and human rights. It does not provide for an effective oversight mechanism for CSIS.
Why are the minister and the Liberal leader not heeding this wise advice?",New Democratic Party,Halifax,Megan Leslie,http://www.parl.gc.ca/parlinfo/Files/Parliamentarian.aspx?Item=37174f12-1dc0-44f0-8065-4c09cf9ebca1&Language=E&Section=ALL
4628267,ca.proc.d.2015-02-20.16622.29,2015-02-20,46dccbed-4370-40f0-975f-d08fe1688aa2,177,"Hon. Peter MacKay (Minister of Justice and Attorney General of Canada, CPC)",,Oral Questions,Public Safety,,"Mr. Speaker, the reality is that there is in fact oversight.
There is already oversight with SIRC. This bill is also very cognizant of the fact that judicial oversight is necessary for acting upon some of the intelligence that will be gathered by our security agencies. There is oversight with respect to the bill itself as it makes its way through the parliamentary process. There will be expert evidence heard, I am sure, at committee.
We look forward to the further participation in this important debate aimed specifically at addressing security needs in our country in this elevated environment.",Conservative,Central Nova,Peter MacKay,http://www.parl.gc.ca/parlinfo/Files/Parliamentarian.aspx?Item=46dccbed-4370-40f0-975f-d08fe1688aa2&Language=E&Section=ALL
4628268,ca.proc.d.2015-02-20.16622.30,2015-02-20,37174f12-1dc0-44f0-8065-4c09cf9ebca1,557,"Ms. Megan Leslie (Halifax, NDP)",,Oral Questions,Public Safety,,"Mr. Speaker, the minister should listen to the advice of these former prime ministers and Supreme Court justices, because they warn that “...experience has shown that serious human rights abuses can occur in the name of maintaining national security”. They recognize that our current oversight regime is wholly inadequate. In fact, our oversight is so lacking that it is uniting former Liberal and Conservative prime ministers.
Why are Conservatives turning a deaf ear to such reasonable concerns?",New Democratic Party,Halifax,Megan Leslie,http://www.parl.gc.ca/parlinfo/Files/Parliamentarian.aspx?Item=37174f12-1dc0-44f0-8065-4c09cf9ebca1&Language=E&Section=ALL
