basepk,hid,speechdate,pid,opid,speakeroldname,speakerposition,maintopic,subtopic,subsubtopic,speechtext,speakerparty,speakerriding,speakername,speakerurl
4636512,ca.proc.d.2015-04-30.16813.87,2015-04-30,de0591ef-9a02-4f97-9541-63de484c96e3,87,The Acting Speaker (Mr. Barry Devolin),,Government Orders,Citizen Voting Act,Bill C-50--Time Allocation Motion,The Chair must interrupt at this time. I remind hon. members that there will be 21 minutes remaining in this period after question period.,Conservative,Haliburton--Kawartha Lakes--Brock,Barry Devolin,http://www.parl.gc.ca/parlinfo/Files/Parliamentarian.aspx?Item=de0591ef-9a02-4f97-9541-63de484c96e3&Language=E&Section=ALL
4636513,ca.proc.d.2015-04-30.16813.88,2015-04-30,ccfa05f8-2114-48f1-9ff4-5434e3279acb,148,"Mr. Randy Kamp (Pitt Meadows—Maple Ridge—Mission, CPC)",,Statements By Members,Putting on the Glitz,,"Mr. Speaker, high school graduation marks an important milestone in the life of a student, yet there are some who find it difficult to participate fully in the celebration, often due to the cost. 
“Putting on the Glitz” is a grassroots initiative in my riding that provides underprivileged students with formal attire so that they can take part in their graduation with pride. Most of these students would not be able to join in without this assistance. 
A committee of volunteers from local community service agencies, School District 42 and other generous partners put together an evening where students can choose their formal wear and accessories for their upcoming graduation, have their hair styled and makeup done by local professionals, and have their pictures taken by a graduation photographer. 
Please join me in thanking the “Putting on the Glitz” volunteers for their great work for the third year in a row and congratulating the students of Pitt Meadows—Maple Ridge—Mission who will be graduating in the coming weeks.",Conservative,Pitt Meadows--Maple Ridge--Mission,Randy Kamp,http://www.parl.gc.ca/parlinfo/Files/Parliamentarian.aspx?Item=ccfa05f8-2114-48f1-9ff4-5434e3279acb&Language=E&Section=ALL
4636514,ca.proc.d.2015-04-30.16813.89,2015-04-30,383ed93c-f141-4f87-b873-124d3051a31f,8621,"Ms. Élaine Michaud (Portneuf—Jacques-Cartier, NDP)",,Statements By Members,Morelle Elementary School in Saint-Ubalde,,"Mr. Speaker, as you know, April 22 was Earth Day, and one of the elementary schools in my riding of Portneuf—Jacques-Cartier celebrated that event in a very special way.
For nearly five years now, the students and teachers at the Morelle elementary school in Saint-Ubalde have been actively involved in a concerted effort to learn more about the environment and sustainable development. Over the years, they have carried out many projects to help protect the environment and preserve the shorelines of Portneuf's many waterways. In order to demonstrate their commitment to this cause, the Morelle elementary school became the first elementary school in the Portneuf school board to adopt a charter of environmental and sustainable development education.
I would like to recognize the efforts of this school's young students, the principal, Marie-Claude Gignac, and all of the teaching staff who worked together to carry out this inspiring project.
This sort of initiative not only helps children become engaged and responsible citizens in the future, but it also sets a good example for all of us to follow.",New Democratic Party,Portneuf--Jacques-Cartier,Élaine Michaud,http://www.parl.gc.ca/parlinfo/Files/Parliamentarian.aspx?Item=383ed93c-f141-4f87-b873-124d3051a31f&Language=E&Section=ALL
4636515,ca.proc.d.2015-04-30.16813.90,2015-04-30,c6e8c7e8-a60d-4f4a-a0b9-1766804209e6,8446,"Mr. John Williamson (New Brunswick Southwest, CPC)",,Statements By Members,Financial Institutions,,"Mr. Speaker, I recently applied for a credit card from a major financial institution I do banking with. I am appalled at the depth and scope of the questions I was asked by one of the country's leading banks. Particularly, I was told my information could be shared with any of its other business operations. The banks are simply asking and, obviously, collecting too much information from Canadians, right down to the amount I pay for rent, my building fee, and even the liquidation value of my 2007 F-150.
 Respect is a two-way street and Canadians are entitled to it when dealing with our banks. If my treatment is typical, and I certainly hope it is not, then we are not getting that respect. We all have credit trouble at some point in our lives, so what was equally egregious is being told the card's interest rate at 20% rises to 25% if a payment is missed by the due date. When the prime lending rate is at 3%, this is near extortion on working families and makes payday loans look like a giveaway.",Conservative,New Brunswick Southwest,John Williamson,http://www.parl.gc.ca/parlinfo/Files/Parliamentarian.aspx?Item=c6e8c7e8-a60d-4f4a-a0b9-1766804209e6&Language=E&Section=ALL
4636516,ca.proc.d.2015-04-30.16813.91,2015-04-30,8c3e4bb0-ac84-4071-bc91-3b47268a13eb,260,"Hon. Judy Sgro (York West, Lib.)",,Statements By Members,Herbert H. Carnegie Future Aces Foundation,,"Mr. Speaker, I am pleased to congratulate the winners of the Herbert H. Carnegie Future Aces Foundation scholarships and awards for 2015. Karissa Hufnagel, Tamara Twumwah-Ofori and Lillian Grant are just another example of three extraordinary women from the Jane-Finch community who received these prestigious awards last Friday night. 
I had the opportunity to meet with the three young winners and their families, and I was truly impressed. The Future Aces award is given each year to students who endeavour to respect others regardless of race, language, creed or colour, and it seeks to recognize those who work each day to make a difference for others and for Canada. Karissa, Tamara and Lillian have set a powerful example for all of us by demonstrating the importance of embracing diversity as a strength and a societal asset. 
On behalf of the Liberal caucus and all members of the House, I congratulate and thank the Herbert H. Carnegie Future Aces Foundation and all of the recipients for their sacrifices and encouragement. They make us all proud.",Liberal,York West,Judy Sgro,http://www.parl.gc.ca/parlinfo/Files/Parliamentarian.aspx?Item=8c3e4bb0-ac84-4071-bc91-3b47268a13eb&Language=E&Section=ALL
4636517,ca.proc.d.2015-04-30.16813.92,2015-04-30,7f45dfd9-dd4b-4b04-8dc9-20cb0730d279,428,"Mr. Jacques Gourde (Lotbinière—Chutes-de-la-Chaudière, CPC)",,Statements By Members,Richard Desrochers,,"Mr. Speaker, I would like to pay tribute to Richard Desrochers, the state deputy of the Quebec Knights of Columbus, who lives in my riding. He has helped the Knights of Columbus movement thrive across Quebec. 
He joined the Knights of Columbus in 1991 and quickly rose through the ranks in his council, taking on many responsibilities where he was able to act on his values of friendship and service, most notably with the Fondation Maison de la Famille, Aide Alimentaire Lotbinière, FADOQ and the choir. As a knight, father and husband, he is a true ambassador for family values and charity.
Richard Desrochers has been married since 1976 to Suzanne Mercier, who supports him in all of his initiatives with the Knights of Columbus. He has three children and eight grandchildren. 
I congratulate Richard Desrochers for all of his work with the Knights of Columbus and for his humanitarian service to all Quebeckers.",Conservative,Lotbinière--Chutes-de-la-Chaudière,Jacques Gourde,http://www.parl.gc.ca/parlinfo/Files/Parliamentarian.aspx?Item=7f45dfd9-dd4b-4b04-8dc9-20cb0730d279&Language=E&Section=ALL
4636518,ca.proc.d.2015-04-30.16813.93,2015-04-30,c052aaf8-167e-4f44-982f-7f3744e7366d,595,"Mr. John Rafferty (Thunder Bay—Rainy River, NDP)",,Statements By Members,Officers of the Lake Superior Scottish Regiment and Garrison Officers' Mess,,"Mr. Speaker, this past weekend, It was my distinct honour to be invited to the 69th military ball hosted by the Officers of the Lake Superior Scottish Regiment and Garrison Officers' Mess. Let me offer a special thanks to Major David Ratz and the entire 2015 ball planning committee for organizing a wonderful evening, with a special mention to the incomparable MacGillivray Pipe Band. 
Canadians might not know that Thunder Bay is known as the “City of the Poppy”. On July 5, 1921, the Great War Veterans' Association, a forerunner of the Royal Canadian Legion, held their national organizational meeting in Port Arthur, Ontario. There, they approved the poppy to be worn on the anniversary of Armistice Day. Within a year, all Legion branches across the country wore the poppy as a means of remembrance.
 Thousands of men and women from northwestern Ontario have served in the defence of Canada. Lest we forget.",New Democratic Party,Thunder Bay--Rainy River,John Rafferty,http://www.parl.gc.ca/parlinfo/Files/Parliamentarian.aspx?Item=c052aaf8-167e-4f44-982f-7f3744e7366d&Language=E&Section=ALL
4636519,ca.proc.d.2015-04-30.16813.94,2015-04-30,77945d39-8e4a-4fd1-9786-441ff928f6f9,452,"Mr. Bev Shipley (Lambton—Kent—Middlesex, CPC)",,Statements By Members,4-H,,"Mr. Speaker, growing up, I was part of 4-H and have some great memories of that time. Today, young 4-H representatives from across Canada have come to visit Parliament Hill and observe question period. They are the future of Canadian agriculture.
 Earlier this year, our agriculture committee had the opportunity to hear from representatives of the Canadian Young Farmers' Forum, many of whom have had past involvement with 4-H. The knowledge and experience that these young farmers bring to the table is quite incredible. Farmers and the agriculture industry are the backbone of our country. As a government we will continue to do what we can to help make sure that industry sector remains strong and viable. 
 I would like to recognize the 4-H youth for their commitment and dedication to our industry and to Canada, and wish them all the best in their future endeavours..",Conservative,Lambton--Kent--Middlesex,Bev Shipley,http://www.parl.gc.ca/parlinfo/Files/Parliamentarian.aspx?Item=77945d39-8e4a-4fd1-9786-441ff928f6f9&Language=E&Section=ALL
4636520,ca.proc.d.2015-04-30.16813.95,2015-04-30,15393d37-ad90-4af1-81fa-c81872b5c8c5,560,"Mrs. Tilly O'Neill Gordon (Miramichi, CPC)",,Statements By Members,Marven McCarthy,,"Mr. Speaker, I rise in the House today to pay tribute to the memory of a dear friend, a great Irishman and a true Miramichier. Marven McCarthy passed away suddenly, surrounded by his loving family.
Marven has been described as a travel agent, a tour guide, a fund raising expert, guardian of Middle Island and a champion of all things Irish-Canadian. Most important, he was a generous Christian, an amazing husband, father, grandfather, son and brother. Born and raised in Miramichi, Marven spent his entire life on the river. He fulfilled his life's journey by teaching high school math to countless young people at James M. Hill High School. His spirit and passion for community was shown as he gave tours of Middle Island, and imparted many life lessons to the hundreds of athletes he coached and managed.
 Marven is remembered by his loving wife Mary Ann, their children and grandchildren. He will be missed by all who had the pleasure to know him and who have been affected by his generous and passionate spirit.",Conservative,Miramichi,Tilly O'Neill-Gordon,http://www.parl.gc.ca/parlinfo/Files/Parliamentarian.aspx?Item=15393d37-ad90-4af1-81fa-c81872b5c8c5&Language=E&Section=ALL
4636521,ca.proc.d.2015-04-30.16813.96,2015-04-30,78336f0e-962c-47d2-a5b8-b59a26592789,8491,"Mr. Matthew Dubé (Chambly—Borduas, NDP)",,Statements By Members,Chambly's 350th Anniversary,," Mr. Speaker, 2015 is the 350th anniversary of the arrival of the very first French regiment, the Carignan-Salières regiment, in New France. 
When Captain Jacques de Chambly and his soldiers built a wooden fort in 1665, they laid the foundations of our great story. Some months later, Henri Chastelard de Salières built Fort Sainte-Thérèse on the banks of the Richelieu River where the town of Carignan now sits.
 Paul-Henri Hudon, president of the historical society of the seigneury of Chambly, described it like this:
 The seigneury of Chambly was born 350 years ago, and along with two parishes, it would become what we now know as the municipalities of Carignan, Chambly, Richelieu, Saint-Basile-le-Grand and Saint-Mathias-sur-Richelieu. 
 We have a duty to remember. I invite all of my colleagues and constituents to join me this summer at the festivities celebrating the 350th anniversary of Chambly and the 50th anniversary of the town of Carignan.",New Democratic Party,Chambly--Borduas,Matthew Dubé,http://www.parl.gc.ca/parlinfo/Files/Parliamentarian.aspx?Item=78336f0e-962c-47d2-a5b8-b59a26592789&Language=E&Section=ALL
4636522,ca.proc.d.2015-04-30.16813.97,2015-04-30,ebbfc235-08c5-44f8-8c22-a60c671db398,461,"Mr. Chris Warkentin (Peace River, CPC)",,Statements By Members,Taxation,,"Mr. Speaker, this week the Leader of the NDP called our tax cuts, “giveaways”. On this side of the House, we will never make any apologies for allowing Canadians to keep more of their hard-earned money in their own pockets. That is why we are cutting taxes for middle-class Canadian families through the family tax cut and the enhanced universal child care benefit.
 These measures will benefit 100% of Canadian families with kids, leaving every family with more money in their own pockets to spend as they choose.
 Sadly, the Liberals and the NDP have a different plan. They want higher taxes on Canadian families. They want higher taxes on middle-class seniors. They want higher taxes on middle-class consumers.
 That is not the right plan and that is why we will continue to cut taxes for Canadian families.",Conservative,Peace River,Chris Warkentin,http://www.parl.gc.ca/parlinfo/Files/Parliamentarian.aspx?Item=ebbfc235-08c5-44f8-8c22-a60c671db398&Language=E&Section=ALL
4636523,ca.proc.d.2015-04-30.16813.98,2015-04-30,c3000ffc-065c-47e0-be26-152a24090dbd,8618,"Mr. Mathieu Ravignat (Pontiac, NDP)",,Statements By Members,The Economy,,"Mr. Speaker, for the past nine years, the Conservatives have done nothing but turn their backs on the people of the Outaouais. With their savage cuts to the public service, they have deprived thousands of workers of a steady income and poisoned the work environment for thousands more.
Refusing to back down, they even went as far as blocking the bill to protect Gatineau Park that was sponsored by my colleague, the member for Hull—Aylmer. That was one year ago today. The purpose of the bill was to provide legal protection to one of the most visited parks in Canada, a park that is truly at the heart of the identity and the economy of the Outaouais. There is a reason this bill was supported by experts and thousands of Canadians.
During the debate, the Conservatives and their Liberal friends told us that they had a better plan for our park—and we are still waiting.",New Democratic Party,Pontiac,Mathieu Ravignat,http://www.parl.gc.ca/parlinfo/Files/Parliamentarian.aspx?Item=c3000ffc-065c-47e0-be26-152a24090dbd&Language=E&Section=ALL
4636524,ca.proc.d.2015-04-30.16813.99,2015-04-30,7835967c-e9d9-4669-9725-395f6624bc26,8959,"Mr. Mark Adler (York Centre, CPC)",,Statements By Members,Vietnamese Community,,"Mr. Speaker, today marks 40 years since the capital of the Republic of South Vietnam fell to the communist invaders from the north.
An iron curtain of totalitarianism fell upon the democratic south. Many were sent to political re-education camps, tortured, beaten, and killed. More than two million people from the south fled by any means possible. Many escaped on makeshift rafts. They set out to sea in search of freedom. Some 250,000 of these boat people, as they became known, died at sea from drowning, starvation, thirst, and hunger.
 For more than 60,000, a safe haven was found in Canada. In 1979-1980, the Conservative government of the time, with the help of churches, synagogues, communities, and just plain old folks, offered them a home in Canada.
The Vietnamese community now numbers more than 300,000 strong. They are fearlessly proud Canadians. Many are here in Ottawa today to mark the 40th anniversary of the start of their journey. As a country, we are marking the passage of the Journey to Freedom Day Act, now enshrined in Canadian law.
All Canadians of Vietnamese descent, and all those who came to this country in search of hope and opportunity, have made Canada the best country in the world.",Conservative,York Centre,Mark Adler,http://www.parl.gc.ca/parlinfo/Files/Parliamentarian.aspx?Item=7835967c-e9d9-4669-9725-395f6624bc26&Language=E&Section=ALL
4636525,ca.proc.d.2015-04-30.16813.100,2015-04-30,6bde42a3-d07c-4c1f-b9d4-9e14a124f465,89,"Hon. Stéphane Dion (Saint-Laurent—Cartierville, Lib.)",,Statements By Members,Journey to Freedom Day,,"Mr. Speaker, under legislation unanimously passed by Parliament, every year on April 30, Canadians will now celebrate their fellow citizens of Vietnamese origin. Our country will commemorate the boat people and other Vietnamese refugees who came here and became a part of our country, reminding us that Canada always comes out stronger when it is welcoming, confident and generous.
All together, without excluding anyone, every year we will commemorate the Vietnamese Canadian community's personal and collective sacrifices and celebrate the promising opportunities made theirs, and ours, in a Canada made stronger by their welcome presence and outstanding contributions.
 Every year, we will celebrate together the uplifting symbiosis that arose between the Canadian and Vietnamese identities. What a great opportunity to remember where we come from, to better understand where we want to go together.",Liberal,Saint-Laurent--Cartierville,Stéphane Dion,http://www.parl.gc.ca/parlinfo/Files/Parliamentarian.aspx?Item=6bde42a3-d07c-4c1f-b9d4-9e14a124f465&Language=E&Section=ALL
4636526,ca.proc.d.2015-04-30.16813.101,2015-04-30,d6291432-a929-439c-a56e-c47bda2d2095,605,"Mr. Devinder Shory (Calgary Northeast, CPC)",,Statements By Members,Taxation,,"Mr. Speaker, now that the Prime Minister has balanced the federal budget, our government is working to help hard-working families balance theirs.
 That is why we are expanding the universal child care benefit to make it available to every single Canadian family with a child. However, there are up to 200,000 families who may not get the money that is owed to them if they do not apply. Across Canada, this represents millions of dollars in unclaimed benefits.
 Families who are not currently receiving the universal child care benefit, who have never received the benefit, or who have never applied for the Canada child tax benefit and still have children under 18 in their care must apply.
It is important that they do so quickly because the deadline is tomorrow to apply and receive the benefit in July. To sign up, please go to Canada.ca/taxsavings. This money is owed to 200,000 families, and our Conservative government is working very hard to make sure that they get it.",Conservative,Calgary Northeast,Devinder Shory,http://www.parl.gc.ca/parlinfo/Files/Parliamentarian.aspx?Item=d6291432-a929-439c-a56e-c47bda2d2095&Language=E&Section=ALL
4636527,ca.proc.d.2015-04-30.16813.102,2015-04-30,50a18bf1-9be3-4563-b657-6af367453ba0,11,"Mr. Charlie Angus (Timmins—James Bay, NDP)",,Statements By Members,Liberal Party,,"Mr. Speaker, stop the press.
The Liberal Party finally has a policy of sorts. It is their outrage about the Conservatives using taxpayers' dollars on partisan advertising. Now, I agree that is unacceptable.
I remember a time when the last Liberal government shamelessly raided the treasury for its own partisan ads. The Liberal brand has not changed much.
Let us just look at the Auditor General of Ontario, who is warning that the Liberal gang there is stripping the rules so it can flood the airways with partisan advertising.
 What do these Liberals here have to say about it? They say not a peep, not from the likes of Gerald Butts who wrote the Ontario Liberal playbook. The Liberal position is really clear: they are against partisan advertising, unless they get to do it; they support labour rights, unless they are trashing collective bargaining rights on Parliament Hill; they claim to be defenders of the Charter, except when they are supporting Bill C-51. It is Tweedledee and Tweedledum, two tired old parties cut from the same cloth.
Canadians know the difference, and they are going to show both parties the door come this election.",New Democratic Party,Timmins--James Bay,Charlie Angus,http://www.parl.gc.ca/parlinfo/Files/Parliamentarian.aspx?Item=50a18bf1-9be3-4563-b657-6af367453ba0&Language=E&Section=ALL
4636528,ca.proc.d.2015-04-30.16813.103,2015-04-30,7e517cde-1b3a-46c1-afdb-4ddddeec7b81,1037,"Ms. Roxanne James (Scarborough Centre, CPC)",,Statements By Members,Legalization of Marijuana,,"Mr. Speaker, unlike the Liberal Party, we have been very clear. We have no intention of legalizing or decriminalizing marijuana. The chiefs of police have also been very clear that they do not support legalizing marijuana.
 Now that he has joined the Liberal Party, Bill Blair has flip-flopped and now wants to legalize marijuana, which would make it easier for children to smoke pot. Already he puts it on equal footing with alcohol and is already planning to, as he says “tax the thing” and “control the price”. 
Unlike Mr. Blair and the Liberal Party, we do not intend to compromise on the safety of our youth. These drugs are illegal because of the harmful effects they have on users and on our society. One can only wonder how Mr. Blair can feel comfortable now that he belongs in the same basket as Liberal supporters such as drug-pushing Marc and Jodie Emery. ",Conservative,Scarborough Centre,Roxanne James,http://www.parl.gc.ca/parlinfo/Files/Parliamentarian.aspx?Item=7e517cde-1b3a-46c1-afdb-4ddddeec7b81&Language=E&Section=ALL
4636529,ca.proc.d.2015-04-30.16813.104,2015-04-30,b41c3b7e-c64f-4415-9f58-79d7462e5d8e,146,"Mr. Peter Julian (Burnaby—New Westminster, NDP)",,Oral Questions,Ethics,,"Mr. Speaker, we are still waiting for the Prime Minister to respond to the disturbing allegations that Mike Duffy himself raised concerns about being appointed as a senator for Prince Edward Island when he was a resident of Ontario.
The Constitution is clear: a senator must reside in the province for which he or she is appointed.
The Prime Minister has to answer sooner or later. What did the Prime Minister do when Mike Duffy told him he was not a resident of Prince Edward Island?",New Democratic Party,Burnaby--New Westminster,Peter Julian,http://www.parl.gc.ca/parlinfo/Files/Parliamentarian.aspx?Item=b41c3b7e-c64f-4415-9f58-79d7462e5d8e&Language=E&Section=ALL
4636530,ca.proc.d.2015-04-30.16813.105,2015-04-30,1d35e58c-52b0-42f0-a344-c31524b2d07a,589,"Mr. Paul Calandra (Parliamentary Secretary to the Prime Minister and for Intergovernmental Affairs, CPC)",,Oral Questions,Ethics,,"Mr. Speaker, I have already answered that question on a number of occasions. 
How disappointed Canadians must be this morning. They work hard, they play by the rules, and yet again they find out that the New Democrats are using their money callously. There are 68 of them who are accused of illegally using taxpayer resources for illegal offices, and 23 of them for inappropriate mailings. They were forced to pay back $350,000 worth of illegal union donations. They were charged $40,000 for illegal robocalls. Now we find out that working in the office of the Leader of the Opposition, using taxpayer resources, is a union member who is using taxpayer money for partisan attack.",Conservative,Oak Ridges--Markham,Paul Calandra,http://www.parl.gc.ca/parlinfo/Files/Parliamentarian.aspx?Item=1d35e58c-52b0-42f0-a344-c31524b2d07a&Language=E&Section=ALL
4636531,ca.proc.d.2015-04-30.16813.106,2015-04-30,b41c3b7e-c64f-4415-9f58-79d7462e5d8e,146,"Mr. Peter Julian (Burnaby—New Westminster, NDP)",,Oral Questions,Ethics,,"Mr. Speaker, the Conservatives say, “Let's change the subject. We don't know any Mike Duffy”, except that 74 Conservative MPs invited Mike Duffy to their ridings on the taxpayers' dime. They know him all right; he is really at the heart of Conservative scandals and entitlement.
The Prime Minister appointed former senator Mike Duffy. Now we have sources saying that the Prime Minister insisted Duffy represent Prince Edward Island, when he knew he was not a resident there. Did the Prime Minister's Office go to such great lengths to try to bury Duffy's expense scandal because it was trying to protect the Prime Minister? Is that why there is this cover-up?",New Democratic Party,Burnaby--New Westminster,Peter Julian,http://www.parl.gc.ca/parlinfo/Files/Parliamentarian.aspx?Item=b41c3b7e-c64f-4415-9f58-79d7462e5d8e&Language=E&Section=ALL
