basepk,hid,speechdate,pid,opid,speakeroldname,speakerposition,maintopic,subtopic,subsubtopic,speechtext,speakerparty,speakerriding,speakername,speakerurl
4626800,ca.proc.d.2015-02-05.16592.235,2015-02-05,000a129f-5449-40ed-94d2-7e21a262b0b1,8528,Ms. Nycole Turmel,Interjection,Government Orders,Business of Supply,Opposition Motion—Job Creation,"Mr. Speaker, I would like to thank my colleague for his question regarding the work that unions are doing to find solutions to regional economic problems.
There have been some meaningless meetings. As with everything else, this is how the Conservative government does things. What is more, the unions are in the midst of negotiations, and we know what the government thinks about negotiations.
From my personal experience as a former PSAC insider, and from what I am hearing about what is going on right now, I know that the unions are also trying to provide programs and services so that people are able to live a good life in the national capital region, especially since 4,000 jobs have been lost compared to other regions. That is very unfortunate.
If this government would listen, we could find solutions together and diversify the economy, whether it be in the national capital region or elsewhere. However, this government does not listen to us, so why would it listen to anyone else? Cuts should not be made just for the sake of making cuts. Cuts should be offset by other programs so that the regions are not affected.",New Democratic Party,Hull--Aylmer,Nycole Turmel,http://www.parl.gc.ca/parlinfo/Files/Parliamentarian.aspx?Item=000a129f-5449-40ed-94d2-7e21a262b0b1&Language=E&Section=ALL
4626801,ca.proc.d.2015-02-05.16592.236,2015-02-05,1d35e58c-52b0-42f0-a344-c31524b2d07a,589,"Mr. Paul Calandra (Parliamentary Secretary to the Prime Minister and for Intergovernmental Affairs, CPC)",,Government Orders,Business of Supply,Opposition Motion—Job Creation,"Mr. Speaker, it is clear that we are not going to agree on certain things, but I wonder if the member might comment a bit on this. 
We know that the Liberals certainly do not agree with what the New Democrats are proposing, and have not in the past, and they currently do not agree with some of the measures we have brought in for the manufacturing sector. We also know that the leader of the Liberal Party has suggested it is time to transition away from manufacturing. I think he called it something like an old 20th century concept from which we should move away.
I wonder if the member might comment on that position of the Liberal Party, the fact that the Liberals do not support manufacturing and that they want to put millions of people out of work by somehow transitioning away from manufacturing.",Conservative,Oak Ridges--Markham,Paul Calandra,http://www.parl.gc.ca/parlinfo/Files/Parliamentarian.aspx?Item=1d35e58c-52b0-42f0-a344-c31524b2d07a&Language=E&Section=ALL
4626802,ca.proc.d.2015-02-05.16592.237,2015-02-05,000a129f-5449-40ed-94d2-7e21a262b0b1,8528,Ms. Nycole Turmel,Interjection,Government Orders,Business of Supply,Opposition Motion—Job Creation,"Mr. Speaker, I would like to thank the member for his question and for his comment on the Liberal position on the manufacturing sector. 
The manufacturing sector provides good jobs that are well paid, as well as good working conditions, but the past few years have been disastrous. After receiving subsidies from the Conservative Party, some plants closed down, which led to job losses, and left with the working tools.
With regard to the Liberal Party, my colleague is speaking to the right person, because I worked with the other parties for 20 years. In 1990, it was the Liberal Party that made job cuts and program cuts, took money out of employment insurance and the pension fund, and so on. I do not think it has changed much since then. ",New Democratic Party,Hull--Aylmer,Nycole Turmel,http://www.parl.gc.ca/parlinfo/Files/Parliamentarian.aspx?Item=000a129f-5449-40ed-94d2-7e21a262b0b1&Language=E&Section=ALL
4626803,ca.proc.d.2015-02-05.16592.238,2015-02-05,031462db-8f61-48ed-bf9f-b033eb8312bb,75,"Mr. Nathan Cullen (Skeena—Bulkley Valley, NDP)",,Government Orders,Business of Supply,Opposition Motion—Job Creation,"Mr. Speaker, I would like to thank my friend from Parkdale—High Park who has put forward this important motion, which I think addresses in part the context that the Canadian economy faces today.
We have seen from the sitting government a certain element of panic, perhaps confusion, with respect to how to respond to some of the key elemental and fundamental aspects of the Canadian economy and the weakening of the economy over the last number of months. We have seen the Minister of Finance unwilling and unable to answer questions in this place and unwilling and unable to present a budget until at least two months later than was originally planned. 
 We have seen confusion among the senior ministers about key aspects. Will the government need to bring forward another austerity budget in terms of cutting services to meet its agenda to balance the books? Will it need to raise revenues? Will it need to dip into its $3 billion rainy day fund, which is meant to cover natural disasters?
To all of those basic questions for the government, we have only seen confusion. We have had completely different answers, on the same day in some instances. We have seen a government that is scrambling, with no real plan B. We have seen an economy, due in some part to the government, that overrelied on certain sectors to the detriment of others.
The reason I can say that with some confidence is that the numbers from Statistics Canada hold this picture up for Canadians and, particularly, for the Conservative government to view.
There are 400,000 lost manufacturing jobs just since the Conservatives took power. In 2014, we saw the lowest job growth since 2009. Again, these are not disputed numbers. This is the reality going on in the Canadian economy. In 2014, which was supposed to be a spectacular year for the Canadian economy, according to some of my colleagues on the Conservative benches, the Canadian economy grew at half the rate of the Canadian population, in terms of job growth.
 This should be a concern for anybody who is concerned with the economy. When the population is growing at nearly double the pace of the number of jobs that are being created, that is not a good trend.
We have seen persistently high youth unemployment, at nearly double the national average, and we now have 200,000 more Canadians out of work than before the recession started. Take a moment to think about that. We went into the recession with 1.1 million Canadians out of work, and we now have 1.3 million Canadians out of work after the recession and after the government has taken so much self-offered credit for the spectacular job it has done.
Those are the realities. The economy also shrank in November, which is a concern. These are all numbers from before the latest wave of job losses, particularly in the Canadian retail and energy sectors. There, we have seen not thousands but tens of thousands of Canadians losing their jobs. Our worry is that many of them are part time and do not qualify for employment insurance. That is just in the last number of weeks and months.
For any government to not be preoccupied is a concern, when we have six unemployed Canadians for every job opening in the Canadian economy right now. The Conservatives can spin where they want to, but the reality of those numbers comes from their own departments, and they come from Statistics Canada, and they are not to be disputed.
In light of that reality, as well as the plummeting oil prices sitting just a little north of $50 today and lost revenue to the government, we ask what the plan is. What is plan B? We have seen plan A. We have lost 400,000 manufacturing jobs, we have a high youth unemployment rate, and we have 200,000 more Canadians out of work. We have the lowest female participation in the workforce since 2002. Those are all indisputable facts. What is the government's response, other than to delay the budget?
 In that vacuum of ideas and opportunities for Canadians, New Democrats focused in on two primary sectors. The first is the small business sector, which accounts for 80% of all new jobs created and is 40% of our GDP. We also focused in on the manufacturing sector for reasons that I have already outlined.
 We have lost so many value-added jobs. In a country that is primarily basing its economy on natural resources, value-added jobs have been the cornerstone to build the middle class and the compact that the government has had with the corporations for the last 80 years. That is what built the middle class in Canada. To lose 400,000 manufacturing jobs just since taking office should be a priority for the government, but its record obviously shows that it is either not a priority or that whatever opportunities it has given have not worked.
Let us look at other planks that the NDP has laid down, steadily, fully costed and accounted for, like a $15 federal minimum wage and affordable child care for all Canadians at up to $15 a day. 
 We know from the TD Bank and private sector economists that a fully funded, affordable child care plan would have a dividend in return back to the economy.For every $1 put in by government, the government can see back as much as $1.70 to $2.40. Why? It is because productivity is increased and particularly women's ability to get back into the labour force if they so choose. Private sector employers tell us that this has been a concern for a long time. As I said earlier, Canada has the lowest female participation rate in our economy since 2002. That has been the trend. What do we do about the trend? We offer up ideas, and this is where I find such a challenge with my Conservative and Liberal colleagues today. 
Happily, we have support from the Canadian manufacturing sector and the small business advocates in this country, who historically have not always been fans of New Democratic policy. Dan Kelly and the head of the Canadian Manufacturers and Exporters say that these initiatives put forward by the leader of the NDP just last week are good for the economy. We have been reading some of their quotes all day. 
 I find it confusing when my Conservative and Liberal friends get up and make speeches and try to denounce New Democrats for what we propose. They say they are going to vote against this effort to lower the small business tax rate and help the Canadian manufacturing sector. Both those proposals alone are supported by the people who know best, the Canadian Manufacturers and Exporters and the Canadian Federation of Independent Business. The Conservatives say they are going to vote against it, but for what reason? Do they not believe that lowering the small business tax rate one point would help, potentially two points if finances allowed? Do they not believe in lengthening out the ability of the manufacturing industry to write off heavy equipment at a time when it is most critical?
The minister can make a speech any time she wants. If she wants to make a speech and tell us why they are going to vote against this—because they have not done that all day today—then I welcome her to the debate.
It is important for us. At a time when the Canadian economy is growing at half the pace of our population, when 400,000 manufacturing jobs have been lost under the Conservatives watch, one would think the government would at least be a little preoccupied with that fact. When youth unemployment is twice the national average and has been persistently so, and 200,000 more Canadians are out of work than before the recession started, one would think the government would be interested in more than just talking points and spending $1 billion on self-promoting ads to tell people how spectacular it is. An ad does not help a family feed itself. An ad does not help people get back to work when they need a job. 
The Conservatives just spent another $2 million promoting the oil sector. They spent $2 million in support of Chevron, Shell, and all the companies that had extraordinary profits, and yet they do nothing for the forestry sector, the manufacturing sector, or the clean energy sector, all groups that are looking to grow and need to grow and are on the rebound, in some cases. The Conservatives are going to buy ads for the oil lobby because it is so good at lobbying.
If the Conservatives do not want to believe me, then perhaps they will believe Jayson Myers, who is the president and CEO of Canadian Manufacturers and Exporters. He said that these tax credits for new product development and commercialization are key measures that support manufacturing success.
Dan Kelly, president and CEO of the Canadian Federation of Independent Business said that cutting the small tax rate by nearly 20% will provide a big boost to small business owners across the country and help them create jobs.
What part of that do Conservatives and Liberals not agree with? Is it simply because of the source? Is it because New Democrats are offering up these solutions that they will not vote for these things, that they will not help out the manufacturing sector, and that they will not help small business?
I was a small business owner before getting into politics. There are two things small businesses need. They need a competitive tax rate and they need customers. We have shrinking and slowing growth in the middle class sector; we have lost more than 400,000 manufacturing jobs; more than 200,000 more Canadians are unemployed than before the global crisis. My goodness, do they want to help out small businesses?
The Conservatives cut the corporate tax rate for the wealthiest corporations like banks and oil companies by 25% since coming into office. They cut it by 1% for small businesses that create 80% of all new jobs in Canada. We can see where their priorities are. They put all their eggs in one basket. ",New Democratic Party,Skeena--Bulkley Valley,Nathan Cullen,http://www.parl.gc.ca/parlinfo/Files/Parliamentarian.aspx?Item=031462db-8f61-48ed-bf9f-b033eb8312bb&Language=E&Section=ALL
4626804,ca.proc.d.2015-02-05.16592.239,2015-02-05,,,,intervention,Government Orders,Business of Supply,Opposition Motion—Job Creation, And credit card issues.,,,An hon. member,
4626805,ca.proc.d.2015-02-05.16592.240,2015-02-05,031462db-8f61-48ed-bf9f-b033eb8312bb,75,Mr. Nathan Cullen,,Government Orders,Business of Supply,Opposition Motion—Job Creation," Yes, Mr. Speaker, volunteer credit card fees. That is excellent. Small businesses are always telling us that merchant fees from credit card companies not only hurt them as small businesses but they hurt their customers who have to pay these exorbitant interest rates.
These are things that small businesses are asking for. New Democrats have answered with this motion. For heaven's sake, just get on board. Just say yes. It is so easy. All the experts in the field who know what they are talking about say these are good ideas. It is just as easy as standing and voting for it.
I look forward to their support.",New Democratic Party,Skeena--Bulkley Valley,Nathan Cullen,http://www.parl.gc.ca/parlinfo/Files/Parliamentarian.aspx?Item=031462db-8f61-48ed-bf9f-b033eb8312bb&Language=E&Section=ALL
4626806,ca.proc.d.2015-02-05.16592.241,2015-02-05,1d35e58c-52b0-42f0-a344-c31524b2d07a,589,"Mr. Paul Calandra (Parliamentary Secretary to the Prime Minister and for Intergovernmental Affairs, CPC)",,Government Orders,Business of Supply,Opposition Motion—Job Creation,"Mr. Speaker, as I just mentioned in the previous question, I am not going to sit here and explain to the hon. member how many ways he was wrong. I appreciate the fact that he has actually brought something to the table, unlike our colleagues at the end.
However, I want to touch upon two things. 
The previous speaker mentioned it, so I think it might be relevant. She talked about a raid on the EI fund by the previous governments. I wonder if the member could touch upon that briefly.
I also appreciate that the NDP is supportive of the fact that tax cuts create jobs. 
I wonder if the hon. member could comment further, because I think it is fair to get a bit of an assessment on what the other opposition party here has brought to the table with respect to manufacturing. We know that two parties have brought something to the table. They might not agree on all elements of it, and in fact probably disagree on a lot of it, but I wonder if he might also, as the finance critic, give his assessment of the Liberal Party's agenda when it comes to manufacturing. As well, if he could expand on the EI comment made by the member for Gatineau, I would appreciate it.",Conservative,Oak Ridges--Markham,Paul Calandra,http://www.parl.gc.ca/parlinfo/Files/Parliamentarian.aspx?Item=1d35e58c-52b0-42f0-a344-c31524b2d07a&Language=E&Section=ALL
4626807,ca.proc.d.2015-02-05.16592.242,2015-02-05,031462db-8f61-48ed-bf9f-b033eb8312bb,75,Mr. Nathan Cullen,Interjection,Government Orders,Business of Supply,Opposition Motion—Job Creation,"Mr. Speaker, I was just checking the numbers with my colleagues.
When the Liberals were in power, they raided the unemployment insurance fund, which, as I would remind all people, does not belong to the government. It belongs to the workers and the employers who pay into EI. It is insurance. It is there for people who need it when they lose their jobs.
The Liberals did two things when in power. The short answer is they took about $50 billion out. They took $50 billion away from the workers and from the employers and used it for an assortment of things. Some of it may have ended up in the sponsorship scandal. It is very difficult to ascertain.
The Conservatives ratcheted that down. They only took about $7 billion of the EI fund and have since stopped, which is good. Seven billion dollars versus $50 billion is varying degrees of things.
In terms of the manufacturing sector, I wish the Minister of State for Western Economic Diversification could answer this question. We have heard from manufacturers that they want to be able to take those SR and ED grants for innovation, research, and development and apply them to capital expenditures. That is an important aspect of innovation. 
Sometimes equipment is needed in order to do research and development. I know it is shocking, but the Conservatives took that option away from manufacturers, from those innovators and entrepreneurs, while we said that they should be allowed to apply it. That is one of the reasons the Canadian Manufacturers &amp; Exporters Association is supporting us. It knows this is something that would lead to the next great technological breakthroughs. When government believes in science and believes in investing in that science, the investment leads to innovation and a more robust and productive economy. ",New Democratic Party,Skeena--Bulkley Valley,Nathan Cullen,http://www.parl.gc.ca/parlinfo/Files/Parliamentarian.aspx?Item=031462db-8f61-48ed-bf9f-b033eb8312bb&Language=E&Section=ALL
4626808,ca.proc.d.2015-02-05.16592.243,2015-02-05,e4cbe8c6-8c17-4fa6-95c3-4f2f3bb7c141,8521,"Ms. Paulina Ayala (Honoré-Mercier, NDP)",,Government Orders,Business of Supply,Opposition Motion—Job Creation,"Mr. Speaker, small and medium-sized enterprises are the pillars of the Canadian economy, and they are responsible for 80% of the jobs created over the past few decades. 
What concerns me enormously is the unemployment rate for young people between the ages of 15 and 25 in Canada, which is almost 14%. This motion talks about immediately lowering the small business tax rate. However, on the other side of the House, they say that the NDP still wants to bring in new taxes. No, here we are talking about tax cuts. Why are we talking about tax cuts? In the past, grants were available for small businesses to hire young people. Those grants have been eliminated. The government also abolished an employment assistance plan and penalized SMEs. 
I would appreciate it if my colleague could explain how the Conservatives can possibly oppose a lower tax rate. It seems to me that is one of their own proposals. Can my colleague explain this reaction on the other side of the House? We all want Canadians to have jobs. We all want our young people to have an opportunity to work because they are the ones who will be paying our pensions and the taxes that will keep the country going.",New Democratic Party,Honoré-Mercier,Paulina Ayala,http://www.parl.gc.ca/parlinfo/Files/Parliamentarian.aspx?Item=e4cbe8c6-8c17-4fa6-95c3-4f2f3bb7c141&Language=E&Section=ALL
4626809,ca.proc.d.2015-02-05.16592.244,2015-02-05,031462db-8f61-48ed-bf9f-b033eb8312bb,75,Mr. Nathan Cullen,Interjection,Government Orders,Business of Supply,Opposition Motion—Job Creation,"[Member spoke in Spanish.] 
 [Translation] 
 Mr. Speaker, that is a very interesting question. This is very important, particularly for young people, because the current unemployment rate for young people is a disaster. Its effects may not necessarily be felt just today. It may hurt the entire career of someone who has the ability to do something else. 
I was a young entrepreneur. In my case, it was sometimes difficult to obtain a little bit of attention from the government and other companies. It is because we think that small businesses are not very important, even though it is in small businesses that we find young people who are creative and innovative. If we can help young Canadians to find new jobs and create new businesses, this is something that can continue on for a generation or two. This is the kind of mindset that can be encouraged with a plan like this one. ",New Democratic Party,Skeena--Bulkley Valley,Nathan Cullen,http://www.parl.gc.ca/parlinfo/Files/Parliamentarian.aspx?Item=031462db-8f61-48ed-bf9f-b033eb8312bb&Language=E&Section=ALL
4626810,ca.proc.d.2015-02-05.16592.245,2015-02-05,02c2cb20-f27d-46a5-8e78-ab4b405bf07b,453,The Acting Speaker (Mr. Bruce Stanton),,Government Orders,Business of Supply,Opposition Motion—Job Creation," It is my duty pursuant to Standing Order 38 to inform the House that the questions to be raised tonight at the time of adjournment are as follows: the hon. member for Drummond, Natural Resources; the hon. member for York South—Weston, Rail Transportation.",Conservative,Simcoe North,Bruce Stanton,http://www.parl.gc.ca/parlinfo/Files/Parliamentarian.aspx?Item=02c2cb20-f27d-46a5-8e78-ab4b405bf07b&Language=E&Section=ALL
