basepk,hid,speechdate,pid,opid,speakeroldname,speakerposition,maintopic,subtopic,subsubtopic,speechtext,speakerparty,speakerriding,speakername,speakerurl
4626565,ca.proc.d.2015-02-05.16592.0,2015-02-05,8826a32c-2e29-49be-b6e2-c1f10363639b,440,"Ms. Irene Mathyssen (London—Fanshawe, NDP)",,Routine Proceedings,Interparliamentary Delegations,,"Mr. Speaker, I have the honour today to present, pursuant to Standing Order 34(1), in both official languages, the reports of the Canadian Group of the Inter-Parliamentary Union respecting its participation at the 131st IPU assembly and related meetings in Geneva, Switzerland, from October 12 to 16, 2014, and at the annual parliamentary hearing at the United Nations in New York, New York, November 19 and 20, 2014.",New Democratic Party,London--Fanshawe,Irene Mathyssen,http://www.parl.gc.ca/parlinfo/Files/Parliamentarian.aspx?Item=8826a32c-2e29-49be-b6e2-c1f10363639b&Language=E&Section=ALL
4626566,ca.proc.d.2015-02-05.16592.1,2015-02-05,cbfb03e2-2c3a-4754-8f07-f1f778fea181,8828,"Mr. Brad Butt (Mississauga—Streetsville, CPC)",,Routine Proceedings,Petitions,Public Safety,"Mr. Speaker, I am presenting a petition today on behalf of hundreds of Canadians who are calling on the Government of Canada to list the Muslim Brotherhood as a terrorist organization.",Conservative,Mississauga--Streetsville,Brad Butt,http://www.parl.gc.ca/parlinfo/Files/Parliamentarian.aspx?Item=cbfb03e2-2c3a-4754-8f07-f1f778fea181&Language=E&Section=ALL
4626567,ca.proc.d.2015-02-05.16592.2,2015-02-05,08f8d23a-fbea-4e7b-ba41-34c9f62dde9e,8474,"Ms. Anne Minh-Thu Quach (Beauharnois—Salaberry, NDP)",,Routine Proceedings,Petitions,Optimist Movement,"Mr. Speaker, I am very proud to rise here today because hundreds and hundreds of people across Canada support my bill.
The bill calls on the government to create a national optimist movement awareness day to support optimist clubs across Canada. These clubs help develop the potential of young people in just about every region.",New Democratic Party,Beauharnois--Salaberry,Anne Minh-Thu Quach,http://www.parl.gc.ca/parlinfo/Files/Parliamentarian.aspx?Item=08f8d23a-fbea-4e7b-ba41-34c9f62dde9e&Language=E&Section=ALL
4626568,ca.proc.d.2015-02-05.16592.3,2015-02-05,8b42e1fd-2c9c-4d2c-9d29-c9e2be599d6b,21,"Hon. Mauril Bélanger (Ottawa—Vanier, Lib.)",,Routine Proceedings,Petitions,Dementia,"Mr. Speaker, I am presenting a petition signed by Canadians in the Ottawa area who are urging the government and the Minister of Health to support Bill C-356 presented by the member for Nickel Belt, which would call for a national strategy to fight dementia and Alzheimer's disease.",Liberal,Ottawa--Vanier,Mauril Bélanger,http://www.parl.gc.ca/parlinfo/Files/Parliamentarian.aspx?Item=8b42e1fd-2c9c-4d2c-9d29-c9e2be599d6b&Language=E&Section=ALL
4626569,ca.proc.d.2015-02-05.16592.4,2015-02-05,eaa6694f-1e20-4aae-ad3b-e694b0e12c59,9187,"Ms. Elizabeth May (Saanich—Gulf Islands, GP)",,Routine Proceedings,Petitions,Aboriginal Affairs,"Mr. Speaker, I rise today to present two petitions.
The first is from residents of Saanich—Gulf Islands, as well as areas surrounding Ottawa. They call on the government to call an inquiry into the ongoing scandal of missing and murdered aboriginal women in Canada. There are more than 100 signatures on this petition.",Green,Saanich--Gulf Islands,Elizabeth May,http://www.parl.gc.ca/parlinfo/Files/Parliamentarian.aspx?Item=eaa6694f-1e20-4aae-ad3b-e694b0e12c59&Language=E&Section=ALL
4626570,ca.proc.d.2015-02-05.16592.5,2015-02-05,eaa6694f-1e20-4aae-ad3b-e694b0e12c59,9187,"Ms. Elizabeth May (Saanich—Gulf Islands, GP)",,Routine Proceedings,Petitions,The Environment,"Mr. Speaker, the second petition deals with the issue of Canada's withdrawal from the convention on drought and desertification. The petitioners call on the government to play its role in the world in a responsible fashion by rejoining this convention, which seeks to share science and information as well as assist those countries facing the ongoing extent of drought and desertification, which is an urgent crisis, particularly in Africa, but could also come to Canada.",Green,Saanich--Gulf Islands,Elizabeth May,http://www.parl.gc.ca/parlinfo/Files/Parliamentarian.aspx?Item=eaa6694f-1e20-4aae-ad3b-e694b0e12c59&Language=E&Section=ALL
4626571,ca.proc.d.2015-02-05.16592.6,2015-02-05,fe517b95-bc62-4fe8-96aa-998994aefd48,173,"Mr. Tom Lukiwski (Parliamentary Secretary to the Leader of the Government in the House of Commons, CPC)",,Routine Proceedings,Questions on the Order Paper,,"Mr. Speaker, I ask that all questions be allowed to stand.",Conservative,Regina--Lumsden--Lake Centre,Tom Lukiwski,http://www.parl.gc.ca/parlinfo/Files/Parliamentarian.aspx?Item=fe517b95-bc62-4fe8-96aa-998994aefd48&Language=E&Section=ALL
4626572,ca.proc.d.2015-02-05.16592.7,2015-02-05,6519cfba-0080-419d-baa9-8ae6e56d032f,256,The Speaker,,Routine Proceedings,Questions on the Order Paper,,Is that agreed?,Conservative,Regina--Qu'Appelle,Andrew Scheer,http://www.parl.gc.ca/parlinfo/Files/Parliamentarian.aspx?Item=6519cfba-0080-419d-baa9-8ae6e56d032f&Language=E&Section=ALL
4626573,ca.proc.d.2015-02-05.16592.8,2015-02-05,,,,intervention,Routine Proceedings,Questions on the Order Paper,, Agreed.,,,Some hon. members,
4626574,ca.proc.d.2015-02-05.16592.9,2015-02-05,dead179f-dfcc-4f4d-a76b-7d2e4792095c,445,"Ms. Peggy Nash (Parkdale—High Park, NDP)",,Government Orders,Opposition Motion—Job Creation,," moved:
 That the House call on the government to take immediate action to build a balanced economy, support the middle class and encourage manufacturing and small business job creation by: (a) extending the accelerated capital cost allowance by two years; (b) reducing the small business income tax rate from 11% to 10% immediately, and then to 9% when finances permit; and (c) introducing an Innovation Tax Credit to support investment in machinery, equipment and property to further innovation and increase productivity. 
Mr. Speaker, I will be sharing my time with the hon. member for Rimouski-Neigette—Témiscouata—Les Basques.
I am very pleased to begin the debate today on our motion, which calls on the government to take immediate action to build a balanced economy, support the middle class and encourage manufacturing and small business job creation.
A defining feature of Canada is a strong middle class. It is something we value, something we want our children to aspire to, and it is the most important economic asset we have in Canada.
Sadly, over the years of Conservative government, Canada has lost more than 400,000 good manufacturing jobs. These jobs have often been replaced by jobs in the service and retail industries, many of which have not paid nearly as well, and have been very precarious and insecure. Now many of these jobs are being lost.
What I see in my community, in Parkdale—High Park, and all over Toronto is families that are struggling to make everything work. They may have jobs, but they are spending so much on housing, whether it is rent or a mortgage, and they are spending so much on child care and everything else, that they do not have any savings or, worse, they have more debt than they have income.
Some families had good jobs with decent pensions and benefits, many in the manufacturing sector, but now they are working two or three jobs, none with benefits, never mind the pension.
More than 200,000 more Canadians are out of work now than before the recession, and job growth is not even keeping up with our population growth. The Conservatives have doled out big tax cuts to big business, and now they are proposing more tax cuts to the wealthiest 15% of Canadian families. What about the 85% of Canadian families? What about everybody else who is only just barely getting by?
That is why Tom Mulcair's NDP is fighting for the middle class and fighting for the majority of Canadians. That is who we are standing up for.
Today we are calling on the government to support the middle class with concrete actions instead of empty words and tax breaks for wealthy families.
We need to strengthen the traditional sectors, such as resource extraction and manufacturing, while taking advantage of new opportunities for innovation and growth. The NDP is calling for immediate action to support Canada's manufacturing base and is sending a message to investors that an NDP government will lead the Canadian manufacturing sector into a new era.
Today, our motion in Parliament is to take immediate action to build a balanced economy, support the middle class, and encourage manufacturing and small business job creation. Our practical plan would extend the accelerated capital cost allowance by two years and reduce the small business tax rate from 11% to 10% immediately, and down to 9% when finances permit. That is the prudent way.
We are calling for the introduction of an innovation tax credit to support investment in machinery and equipment and to help many to further innovate and increase productivity. All these measures would make a difference now to diversify the economy and encourage investment in the Canadian manufacturing sector.
Let us talk about small businesses. I make a point in my community of buying local whenever I can, everything from food to supplies for my house to clothing. I talk to small business owners who are always trying to find new ways to reach customers, to promote their products, to reach and expand into other neighbours.
Giving them a tax break, cutting back on their taxes, would put money into their pockets. It is something my friends across the aisle are always advocating, putting more money back into people's pockets. It would help small businesses expand and help them hire. That is the whole point. They are the job creators. 
Government should support our motion today to help small businesses, which make up 98% of all the businesses in Canada. It should help them use their money to grow and expand. Small businesses create jobs and are invested in our communities. They enrich and diversify our communities.
Ninety percent of Canadian exporters are small businesses, and they help build our Canadian brand as high quality, highly innovative, and highly technical manufacturers in many cases.
Let us talk about manufacturing. Clearly the government has failed the manufacturing sector. What Canada needs is a government committed to cutting-edge, advanced manufacturing that looks to energy efficiency and sustainability in sectors where Canada is or could be a global leader; but sadly, it has failed.
There have been some measures that look good on paper, like the advanced manufacturing fund, until we see that actually it is slow moving and inflexible and has not released one single penny. That is some support for the manufacturing sector.
Meanwhile the Conservative government has cut hundreds of millions of dollars of support for business innovation while putting all its economic eggs in one basket, in the oil and gas sector. However, now oil prices are dropping, and most likely this sector will shed capital spending and cut jobs. Because the government has shown no interest in encouraging a diverse economy, our manufacturing sector cannot just pick up the slack.
After years of neglect, this sector has been left without the capacity it needs to increase production and take advantage of the low dollar to boost sales. We need a government committed to boosting the manufacturing sector, like most advanced countries around the world. Germany, South Korea, Brazil, and most advanced economies are fighting for their manufacturing sectors, standing up for small business. We need the government to finally wake up and start taking action.
Today is an important day. It is when members have the opportunity to stand up and be counted. Are members in the House going to stand up for Canada's middle class? Are they going to stand up for the manufacturing sector? Are they going to stand up for innovation and job creation? Are they going to stand up for small businesses in towns, cities, and communities right across this country? Every member has the chance to stand up and be counted. I urge every one of my colleagues to vote in favour of this important motion today.",New Democratic Party,Parkdale--High Park,Peggy Nash,http://www.parl.gc.ca/parlinfo/Files/Parliamentarian.aspx?Item=dead179f-dfcc-4f4d-a76b-7d2e4792095c&Language=E&Section=ALL
4626575,ca.proc.d.2015-02-05.16592.10,2015-02-05,1b175d0f-9278-4e04-9fa8-0368e591c5a5,69,The Deputy Speaker,,Government Orders,Opposition Motion—Job Creation,,"On a point of order, the member for Saanich—Gulf Islands.",New Democratic Party,Windsor--Tecumseh,Joe Comartin,http://www.parl.gc.ca/parlinfo/Files/Parliamentarian.aspx?Item=1b175d0f-9278-4e04-9fa8-0368e591c5a5&Language=E&Section=ALL
4626576,ca.proc.d.2015-02-05.16592.11,2015-02-05,eaa6694f-1e20-4aae-ad3b-e694b0e12c59,9187,"Ms. Elizabeth May (Saanich—Gulf Islands, GP)",,Government Orders,Opposition Motion—Job Creation,,"Mr. Speaker, I did not want to interrupt my hon. colleague from Parkdale—High Park, but she inadvertently used the proper name of her leader while discussing her party's positions, and I would hate to see it constantly happening in the House that we start referring to party leaders by name. I did not want to interrupt with a point of order; I just wanted to reference it now, and I am sure the Speaker will confirm that is the case.",Green,Saanich--Gulf Islands,Elizabeth May,http://www.parl.gc.ca/parlinfo/Files/Parliamentarian.aspx?Item=eaa6694f-1e20-4aae-ad3b-e694b0e12c59&Language=E&Section=ALL
4626577,ca.proc.d.2015-02-05.16592.12,2015-02-05,1b175d0f-9278-4e04-9fa8-0368e591c5a5,69,The Deputy Speaker,,Government Orders,Opposition Motion—Job Creation,,"Mr. Speaker, certainly it is the case that proper names of members of Parliament are not to be used. I have to say that I did not hear, but the Table advises me that in fact the member for Parkdale—High Park was guilty of the transgression. I was having a side conversation with the Deputy Clerk. However, properly admonished, hopefully the member will not repeat that error.
Questions and comments, the hon. member for Renfrew—Nipissing—Pembroke.",New Democratic Party,Windsor--Tecumseh,Joe Comartin,http://www.parl.gc.ca/parlinfo/Files/Parliamentarian.aspx?Item=1b175d0f-9278-4e04-9fa8-0368e591c5a5&Language=E&Section=ALL
4626578,ca.proc.d.2015-02-05.16592.13,2015-02-05,b37cad30-26f6-40c6-8e4c-dd3a0ba841bb,113,"Mrs. Cheryl Gallant (Renfrew—Nipissing—Pembroke, CPC)",,Government Orders,Opposition Motion—Job Creation,,"Mr. Speaker, why is it that the socialists across the way are always separating society into class or by class distinction? Just because individuals start out with a lower income, perhaps, when they graduate from high school, college, or university, it does not mean that they are going to be low class. With a proper economic climate, as provided by our Conservative government, the sky is the limit for anyone.",Conservative,Renfrew--Nipissing--Pembroke,Cheryl Gallant,http://www.parl.gc.ca/parlinfo/Files/Parliamentarian.aspx?Item=b37cad30-26f6-40c6-8e4c-dd3a0ba841bb&Language=E&Section=ALL
4626579,ca.proc.d.2015-02-05.16592.14,2015-02-05,dead179f-dfcc-4f4d-a76b-7d2e4792095c,445,Ms. Peggy Nash,Interjection,Government Orders,Opposition Motion—Job Creation,,"Mr. Speaker, I should first acknowledge that I regret using the proper name of our leader. It is just that he is such a great leader, I guess I got over-enthusiastic and got carried away. I thank my colleague for correcting that.
Let me address the question of the member opposite. Perhaps she misunderstood the point of my speech, which was that Canada has historically been a land of opportunity. People come to Canada, as my grandparents and parents did, from all over the world, because they believe that Canada is a land of opportunity where one can, through hard work, through study, and through effort, move up economically in the world. Sadly, as a result of the actions of her government, people are less and less able to make that move.
 Let me just give her a couple of facts, because maybe she has been unaware of them. There are nearly 1.3 million Canadians today who are unemployed. Another 4,300 lost their jobs in December. Employment growth in 2014 was a mere 1%, which is almost nothing. Clearly, our economy is stalling, and employment growth is not even keeping up with our population growth. 
Clearly, a lot of Canadians are struggling right now. We do not think that should be the case. We believe that Canadians ought to have opportunities and jobs and the ability to move into the middle class. We do not know what she would have against that.",New Democratic Party,Parkdale--High Park,Peggy Nash,http://www.parl.gc.ca/parlinfo/Files/Parliamentarian.aspx?Item=dead179f-dfcc-4f4d-a76b-7d2e4792095c&Language=E&Section=ALL
4626580,ca.proc.d.2015-02-05.16592.15,2015-02-05,07cf5767-802c-406c-92a7-7dc92af79b40,4264,"Mr. Kevin Lamoureux (Winnipeg North, Lib.)",,Government Orders,Opposition Motion—Job Creation,,"Mr. Speaker, I guess it is a bit of a compliment. The term “middle class” was not part of the New Democratic vocabulary until the leader of the Liberal Party indicated that it was going to be a major theme going into the 2015 election. Flattery is a compliment. The NDP is most welcome to use the term as much as it likes. 
We have consistently argued that it is important that we focus our attention on Canada's middle class. In fact, if we go back to 1993, the unemployment rate was 14%. It took Liberal governments to reduce that 14% to 6.5%, in 2006, which is when we left office.
One of the reasons we got that reduction was that we had a very bold initiative, which we have proposed once again, and that is the EI premium reduction, which would generate tens of thousands of jobs in every region of the country.
 Why does the NDP, which says it supports the middle class, not support an EI premium reduction so that we could employ tens of thousands more Canadians from every region of this country?",Liberal,Winnipeg North,Kevin Lamoureux,http://www.parl.gc.ca/parlinfo/Files/Parliamentarian.aspx?Item=07cf5767-802c-406c-92a7-7dc92af79b40&Language=E&Section=ALL
4626581,ca.proc.d.2015-02-05.16592.16,2015-02-05,dead179f-dfcc-4f4d-a76b-7d2e4792095c,445,Ms. Peggy Nash,Interjection,Government Orders,Opposition Motion—Job Creation,,"Mr. Speaker, if the member believes that there is a trademark on the term “middle class” and that it somehow belongs to his party, I think the rest of the world is unaware of it. 
Our leader genuinely comes from the middle class. He is a perfect example of someone who has worked hard all his life and has joined the middle class. That is why he is fighting so hard for the middle class.
If the member's comments indicate that he is going to be supporting our motion, I would really welcome that. It would be a welcome change, because I noted that when his leader was in London, Ontario, he urged that community to transition away from the manufacturing sector. If now he is in favour of the manufacturing sector, we think that is a positive step forward. Perhaps, then, we just need our colleagues across the aisle, in the Conservative Party, to join us, and we can pass the motion, get the Minister of Finance to bring in a budget, and finally get something done for Canadians here.",New Democratic Party,Parkdale--High Park,Peggy Nash,http://www.parl.gc.ca/parlinfo/Files/Parliamentarian.aspx?Item=dead179f-dfcc-4f4d-a76b-7d2e4792095c&Language=E&Section=ALL
