basepk,hid,speechdate,pid,opid,speakeroldname,speakerposition,maintopic,subtopic,subsubtopic,speechtext,speakerparty,speakerriding,speakername,speakerurl
4638376,ca.proc.d.2015-05-11.16839.0,2015-05-11,f470e27a-a074-4b16-8304-960ffe8c9289,24,"Hon. Carolyn Bennett (St. Paul's, Lib.)",,Private Members' Business,Missing Aboriginal Women,," moved: 
 That, in the opinion of the House, the tragic and inequitable issue of missing and murdered Aboriginal women and girls is of critical importance for all Canadians; that the government has failed to provide justice for the victims, healing for the families, or an end to the violence; and that the House call on the government to take immediate action to deal with this systemic problem and call a public inquiry. 
Mr. Speaker, I rise today to speak to my private member's motion about the overwhelming number of missing and murdered aboriginal women and girls in Canada and the urgent need to ensure their safety and well-being.
My motion calls on this House to recognize that the tragic and inequitable issue of missing and murdered aboriginal women and girls is of critical importance for all Canadians and that the government has failed to provide justice for the victims, healing for the families, or an end to the violence.
It also calls on the House to urge the government to take immediate action to deal with this systemic problem and call a public inquiry.
Aboriginal women in Canada experience rates of violence that are three times higher than they are for non-aboriginal women. Young aboriginal women are five times more likely to die violently than other women.
The disproportionate number of aboriginal women and girls who go missing or are victims of homicide has been an issue that has spanned many decades and many governments. That is why, in 2005, the previous Liberal government invested $5 million to fund a project called Sisters in Spirit, run by the Native Women's Association of Canada. The goal was to conduct research and raise awareness of the alarmingly high rates of violence against aboriginal women and girls.
In 2009, Sisters in Spirit released a report, “Voices of our Sisters in Spirit”, which identified almost 600 cases of missing and murdered aboriginal women and girls. The reprehensible response of the Conservative government to this worrying evidence of the scope of the crisis was to end the funding of the project.
The Sisters in Spirit report and the disgraceful government response led to the Liberal Party's call for a non-partisan, independent national inquiry in 2010. 
Last year, the RCMP released an even more disturbing report, which identified almost 1,200 aboriginal women and girls who had gone missing or had been murdered since 1980.
Despite representing only 4% of women in Canada, aboriginal women accounted for 8% of the female homicide victims in 1984 and a staggering 23% by 2012. Think of those shocking statistics. The aboriginal proportion of female homicide statistics has been steadily rising, and as of 2012, this 4% of the female population accounts for almost one-quarter of women who are murdered.
These statistics are eye opening, but we must also remember that they represent real people. They are daughters, mothers, sisters, and aunties. They leave families in unimaginable pain, and we are deprived of their tremendous potential contributions to our communities.
Canadians are beginning to take notice. From the NWAC Faceless Dolls Project started years ago—in which the missing women and girls were anonymous to most—recent victims have become household names. Loretta Saunders and Tina Fontaine are now symbols of the many other aboriginal women and girls who have been failed by Canadian society.
This is not an aboriginal issue. It is not a women's issue. It is a continuing Canadian tragedy.
 Despite this new broader awareness, the Minister of Aboriginal Affairs and Northern Development recently quoted unpublished statistics about the ethnicity of some of the perpetrators to cynically insinuate that this is an aboriginal problem. He irresponsibly referred to statistics without any context of how they compare to the general population. He also neglected to note the RCMP finding that aboriginal women are less likely to be murdered by a spouse or an intimate partner than non-aboriginal victims.
These disgraceful political games are why we need an independent and comprehensive public inquiry. It is also important to understand that a national public inquiry is not only a matter of seeking justice and reconciliation for past injustices, but it is critical if we are going to address the systemic problems underlying this ongoing crisis. 
A properly conducted, adequately funded inquiry has the potential to teach us both about the causes of the violence and how to prevent it from recurring. This is a point I want to emphasize. If we are to truly end the violence, we must find ways to prevent it. It is not enough to just better respond to crimes after they have been committed.
For an inquiry to be effective, victims' families and aboriginal organizations will need to be involved not only in the inquiry's work but in the design of its mandate and its operations. It must engage the broader public and facilitate a much wider understanding of the issues through its very operations. It must involve civil society, welcome independent research, and make it clear that all evidence it hears will be valued.
 Grieving families, indigenous leaders, victims advocates, civil society, the international community, and every provincial and territorial premier have all urged the government to call a national inquiry; yet despite this overwhelming consensus on the need for a national public inquiry, the Prime Minister stubbornly rejects it out of hand. The Prime Minister refuses to acknowledge that this ongoing national tragedy represents more than a series of individual crimes that can be dealt with by law enforcement alone. In fact, last summer, in the wake of Tina Fontaine's murder in Winnipeg, the Prime Minister insensitively said, “We should not view this as a sociological phenomenon”. He dismissed root causes being any significant part of the broader issue, calling the murders of aboriginal women and girls crimes that should be dealt with by the police. Last December, he even admitted to a national TV audience that this issue was not high on his government's radar. The Prime Minister is simply on the wrong side of history.
The Prime Minister's government tried to explain the rejection of a national inquiry by asserting the need for action, instead of study. These are not mutually exclusive measures. The urgency of this crisis requires the development and implementation of a comprehensive and multi-jurisdictional national action plan, like they had in Australia.
The effectiveness of such a national action plan depends a truly coordinated approach involving the many relevant federal departments, the provincial and territorial governments and aboriginal leaders, an approach that focuses on preventing these senseless deaths and putting an end to this senseless violence.
Such a plan should be rooted in a comprehensive, non-partisan study of this ongoing tragedy that goes beyond establishing the raw statistics.
 However, there are concrete steps that could be taken immediately. Additional funding for inadequate shelter spaces on reserve and in northern communities, addressing the horrifying numbers of aboriginal children in foster care, real approaches to keeping families together, better funding and support for aboriginal policing, and better co-ordination among all levels of government would all be positive steps. Unfortunately, the federal government's response to this urgent crisis has been complete inaction.
 The government's action plan, which members opposite will undoubtedly shortly point to, is no more than a repackaged inventory of inadequate federal programs and funding that existed before last fall's announcement. The $25 million highlighted as new money simply maintains the existing insufficient funding levels from 2010. Many of the broader initiatives noted in the larger strategy are not even directed at aboriginal people at all.
The epidemic of violence must end, and the Conservative government, which claims to be tough on crime and to stand up for victims of crime, cannot continue to ignore this appalling situation.
 Only a national inquiry would have the credibility, scope and resources to address the systemic problems underlying the violence. It would provide the accountability to ensure implementation of its recommendations, and bring justice and reconciliation to the victims and their families.
I urge all members to support my motion, and I thank so many of the aboriginal women and girls who have helped us on this journey and who still suffer so much.
 Meegwetch.",Liberal,St. Paul's,Carolyn Bennett,http://www.parl.gc.ca/parlinfo/Files/Parliamentarian.aspx?Item=f470e27a-a074-4b16-8304-960ffe8c9289&Language=E&Section=ALL
4638377,ca.proc.d.2015-05-11.16839.1,2015-05-11,ea1b31cf-b0bd-41aa-8ded-17c0cc3c8264,8810,"Mrs. Susan Truppe (Parliamentary Secretary for Status of Women, CPC)",,Private Members' Business,Missing Aboriginal Women,,"Mr. Speaker, we all have a role to play in protecting aboriginal women and girls, and our government has taken strong action to address the broader challenges facing aboriginal women and girls. Since 2006, we have been proud to introduce more than 30 new justice and public safety initiatives to keep Canadian families safe, and the party across has voted against them.
 We recently tabled our action plan to address family violence and violent crime against aboriginal women and girls. The action plan makes significant investments to support the creation of a DNA missing persons database, more community safety plans through Public Safety Canada, and better tools and resources for first nations leaders to address this problem on reserves. We are also going to engage men and boys. We are going to have projects that will break cycles of intergenerational violence.
We have heard from victims' families that now is the time for action and not more studies, so I do not know what part of the action plan the member opposite does not like. These are actual initiatives that will help aboriginal women and girls.",Conservative,London North Centre,Susan Truppe,http://www.parl.gc.ca/parlinfo/Files/Parliamentarian.aspx?Item=ea1b31cf-b0bd-41aa-8ded-17c0cc3c8264&Language=E&Section=ALL
4638378,ca.proc.d.2015-05-11.16839.2,2015-05-11,f470e27a-a074-4b16-8304-960ffe8c9289,24,Hon. Carolyn Bennett,Interjection,Private Members' Business,Missing Aboriginal Women,,"Mr. Speaker, clearly the member had not heard my remarks. What we are saying is that the Conservatives' so-called inaction plan is absolutely not addressing what we have heard. It is totally focused on the time after people have died or gone missing. It is not doing anything to help with the prevention and stopping of this epidemic of violence. They just do not get it. The DNA bank means that the victim is already dead. These are important issues for the families, but what the families really want is for this not to happen to anyone else.
Yesterday, on Mother's Day, all I could think of was those families and those mothers who did not have a daughter to say “thank you”. That is what the government does not get, and it is just so disturbing. ",Liberal,St. Paul's,Carolyn Bennett,http://www.parl.gc.ca/parlinfo/Files/Parliamentarian.aspx?Item=f470e27a-a074-4b16-8304-960ffe8c9289&Language=E&Section=ALL
4638379,ca.proc.d.2015-05-11.16839.3,2015-05-11,37174f12-1dc0-44f0-8065-4c09cf9ebca1,557,"Ms. Megan Leslie (Halifax, NDP)",,Private Members' Business,Missing Aboriginal Women,,"Mr. Speaker, I thank my colleague for bringing the motion forward. She said in her speech that the statistics are eye opening but that we must also remember that they are real people. I could not agree more. 
She brought up a few names, including that of Loretta Saunders. As we know, Loretta Saunders was a young Inuk woman going to St. Mary's University in Halifax, who was killed. Her killers have pleaded guilty and the justice system has worked. We will see what happens as these two continue to make their way through the justice system.
Loretta Saunders parents are actually still asking for an inquiry, even though the killers have pleaded guilty. Does the member agree that we do need an inquiry if we are to see justice truly served here, that it is not about these two individuals who killed Loretta Saunders, but it is the bigger issue we are trying to tackle here?",New Democratic Party,Halifax,Megan Leslie,http://www.parl.gc.ca/parlinfo/Files/Parliamentarian.aspx?Item=37174f12-1dc0-44f0-8065-4c09cf9ebca1&Language=E&Section=ALL
4638380,ca.proc.d.2015-05-11.16839.4,2015-05-11,f470e27a-a074-4b16-8304-960ffe8c9289,24,Hon. Carolyn Bennett,Interjection,Private Members' Business,Missing Aboriginal Women,,"Mr. Speaker, I thank the member for her question, and I thank her and her party for the advocacy that has continued on this. It should not be a partisan issue. 
The parents of Loretta Saunders and Holly and the rest of the community there are not only working very hard to seek justice, but they are a tremendous example of why we need a national public inquiry. They too want to deal with some of the root causes and illuminate the things we do not even know yet around not only policing but foster care and all the things we know are part and parcel of this huge difference in the numbers between aboriginal women and girls and the non-aboriginal population.
I thank the member for raising this. We too support Loretta Saunders' parents in their quest for a national inquiry. ",Liberal,St. Paul's,Carolyn Bennett,http://www.parl.gc.ca/parlinfo/Files/Parliamentarian.aspx?Item=f470e27a-a074-4b16-8304-960ffe8c9289&Language=E&Section=ALL
4638381,ca.proc.d.2015-05-11.16839.5,2015-05-11,a76af2a6-7a43-4f8f-a887-0d10b3a0a3c1,96,"Hon. Wayne Easter (Malpeque, Lib.)",,Private Members' Business,Missing Aboriginal Women,,"Mr. Speaker, I want to congratulate my colleague on the motion. I know how hard she has worked with the aboriginal women across Canada.
I think there is a misconception that public inquiries are just to find cause. Is it true that the purpose of the inquiry is to find the root causes, yes, but what is really key is the kind of recommendations that could come out of such an inquiry to make changes and improvements in the future so this kind of situation does not happen? ",Liberal,Malpeque,Wayne Easter,http://www.parl.gc.ca/parlinfo/Files/Parliamentarian.aspx?Item=a76af2a6-7a43-4f8f-a887-0d10b3a0a3c1&Language=E&Section=ALL
4638382,ca.proc.d.2015-05-11.16839.6,2015-05-11,f470e27a-a074-4b16-8304-960ffe8c9289,24,Hon. Carolyn Bennett,Interjection,Private Members' Business,Missing Aboriginal Women,,"Mr. Speaker, I agree with the hon. member that the recommendations that come out of these kinds of inquiry are hugely important. 
I have been interested in listening to some of the experts on national public inquiries and how they feel that one of the other issues is bringing the public in and having the resources to let all Canadians know how they can be part of the healing and reconciliation and be part of stopping this epidemic. 
I thank people like Christi Belcourt and the Walking With Our Sisters campaign and the kind of art and awareness-raising that has been very much part of this journey for so many families. ",Liberal,St. Paul's,Carolyn Bennett,http://www.parl.gc.ca/parlinfo/Files/Parliamentarian.aspx?Item=f470e27a-a074-4b16-8304-960ffe8c9289&Language=E&Section=ALL
4638383,ca.proc.d.2015-05-11.16839.7,2015-05-11,ea1b31cf-b0bd-41aa-8ded-17c0cc3c8264,8810,"Mrs. Susan Truppe (Parliamentary Secretary for Status of Women, CPC)",,Private Members' Business,Missing Aboriginal Women,,"Mr. Speaker, as Parliamentary Secretary for Status of Women, as well as one of the members who sat on the special committee which studied the issue of missing and murdered aboriginal women, I welcome the opportunity to participate in this important debate.
 This motion deals with a very important issue in our country: violence against aboriginal women and girls. Our government takes the issue of violence against women and girls very seriously. That is why we have put in place an ongoing series of important measures so that women and girls, including aboriginal women and girls, can live violence-free lives. I would like to take a few moments to describe some of the actions our government has taken. 
To make communities safer for all Canadians, we have enacted over 30 measures into law since 2006. These measures are making communities safer by holding violent criminals accountable for their crimes, giving victims of crime a stronger voice and increasing the efficiency of the justice system. We increased penalties for violent crimes. We introduced legislation to give police and prosecutors new tools to address cyberbullying. We introduced the victims bill of rights. 
The Government of Canada has allocated more than $140 million since 2006 to give victims a more effective voice in the criminal justice system through initiatives delivered by Justice Canada. On February 20, 2015, the Government of Canada announced a 10-year, $100 million investment to prevent, detect and combat family violence and child abuse as part of our government commitment to stand up for victims. Of this amount, $30 million is dedicated to supporting aboriginal communities through Health Canada's first nations and Inuit health branch.
 With respect to addressing violence against aboriginal women and girls specifically, our government was pleased to participate in the National Roundtable on Missing and Murdered Indigenous Women and Girls on February 27, 2015 here in Ottawa. As part of the round table, the Minister of Labour and Minister of Status of Women and the  Minister of Aboriginal Affairs And Northern Development highlighted recent actions we have taken to address family violence and violent crimes against aboriginal women and girls. For example, they highlighted our government's action plan to address family violence and violent crimes against aboriginal women, which I am pleased to announce has been implemented as of April 1, 2015. The action plan takes immediate and concrete action to prevent violence, support victims, and protect aboriginal women and girls through new and ongoing commitments totalling approximately $200 million over five years. It includes new funding of $25 million over five years starting April 1, 2015, as well as renewed and ongoing support for shelters on reserve and family violence prevention activities. 
The action plan's new funding of $25 million is broken down as follows. There is $8.6 million over five years for the development of more community safety plans across Canada. There is $2.5 million over five years for projects to break intergenerational cycles of violence and abuse by raising awareness. There is $5 million over five years for projects to engage men and boys, and empower women and girls in efforts to denounce and prevent violence. There is $7.5 million over five years to support aboriginal victims and families. There is $1.4 million over five years to share information and resources with communities and organizations, and report regularly on progress made and results achieved under the action plan. 
Above and beyond the new funding that is part of this action plan, there is further funding of $158.7 million over five years beginning with the government's new fiscal year on April 1, 2015 for the existing network of shelters on reserve and family violence prevention activities through Aboriginal Affairs and Northern Development Canada. Through Status of Women Canada funding became available April 1, 2015 to improve economic security of aboriginal women and promote their participation in leadership and decision-making roles.
 All of these actions by our government represent important steps forward in creating safer communities for aboriginal women and girls and for all Canadians. We are proud of our action plan. However, no individual, organization or government working alone can tackle this problem. I think most Canadians would agree that everyone needs to be part of the solution. That is why the actions I have talked about today are intended to complement the work of provinces and territories, police and the justice system, as well as aboriginal families, communities and organizations to address violence against aboriginal women and girls, which is why I find myself unable to support the motion before the House today. 
We have over 40 studies, along with the report from the special committee, which have aided in the development of our action plan. We believe that now is the time for action. We must continue focusing on actions that will help our country deal with the very issues the member has described in her motion. 
We will continue collaborating with aboriginal leaders, aboriginal communities and other levels of government to get the most out of our respective action plans. I am confident that by working together we can and we will help ensure aboriginal women and girls have a greater chance to live violence-free lives.
We know that helping women and girls live violence-free lives is not only the right thing to do, but that a life free of violence also can help women and girls achieve their full potential in their own lives and in the lives of their families and communities. That is what will move us toward greater equality in our country, which is something I know we all wish to see.",Conservative,London North Centre,Susan Truppe,http://www.parl.gc.ca/parlinfo/Files/Parliamentarian.aspx?Item=ea1b31cf-b0bd-41aa-8ded-17c0cc3c8264&Language=E&Section=ALL
