basepk,hid,speechdate,pid,opid,speakeroldname,speakerposition,maintopic,subtopic,subsubtopic,speechtext,speakerparty,speakerriding,speakername,speakerurl
4642954,ca.proc.d.2015-06-05.16866.41,2015-06-05,6bde42a3-d07c-4c1f-b9d4-9e14a124f465,89,"Hon. Stéphane Dion (Saint-Laurent—Cartierville, Lib.)",,Oral Questions,Taxation,,"Mr. Speaker, it is clear that the minister does not want to talk about the Liberals' Canada child benefit, since he knows that under this program, 9 of 10 Canadian families will get bigger cheques. That is what will happen and he cannot deny it. That is what all the experts are saying. The Conservatives deny this, and the minister's bad faith is becoming increasingly evident.
Do the Conservatives not see that a typical family earning $90,000 with two children will receive $2,575 more under the Liberal plan, starting in the first year of a Liberal government, an amount that is indexed and tax free?
Will the minister admit this and stop acting in bad faith?",Liberal,Saint-Laurent--Cartierville,Stéphane Dion,http://www.parl.gc.ca/parlinfo/Files/Parliamentarian.aspx?Item=6bde42a3-d07c-4c1f-b9d4-9e14a124f465&Language=E&Section=ALL
4642955,ca.proc.d.2015-06-05.16866.42,2015-06-05,ad4032f2-6bb1-497b-b146-f321cfb71ba9,233,"Hon. Pierre Poilievre (Minister of Employment and Social Development and Minister for Democratic Reform, CPC)",,Oral Questions,Taxation,,"Mr. Speaker, the Liberals already admitted wanting to eliminate the universal child care benefit. They will eliminate income splitting by increasing taxes for families and seniors.
After all that, there would still be a $2 billion hole in their plan, which will force them to increase taxes for families even more.
We are doing the opposite by lowering taxes and giving benefits to all families, regardless of income and regardless of their choice in child care.",Conservative,Nepean--Carleton,Pierre Poilievre,http://www.parl.gc.ca/parlinfo/Files/Parliamentarian.aspx?Item=ad4032f2-6bb1-497b-b146-f321cfb71ba9&Language=E&Section=ALL
4642956,ca.proc.d.2015-06-05.16866.43,2015-06-05,4bc128a9-b349-4867-a545-ad05122c0e46,598,"Ms. Niki Ashton (Churchill, NDP)",,Oral Questions,Aboriginal Affairs,,"Mr. Speaker, as the national chief said, we cannot move toward reconciliation when far too many aboriginal communities are living in desperate conditions.
Despite that, now we have learned that the Conservatives preferred to leave $1 billion just sitting there in the coffers of the Department of Aboriginal Affairs instead of funding essential services like education and access to clean water and housing.
How can the government justify this gross negligence?",New Democratic Party,Churchill,Niki Ashton,http://www.parl.gc.ca/parlinfo/Files/Parliamentarian.aspx?Item=4bc128a9-b349-4867-a545-ad05122c0e46&Language=E&Section=ALL
4642957,ca.proc.d.2015-06-05.16866.44,2015-06-05,a2d5c8bf-d42e-4b53-be9e-70af2a6fe169,9130,"Mr. Mark Strahl (Parliamentary Secretary to the Minister of Aboriginal Affairs and Northern Development, CPC)",,Oral Questions,Aboriginal Affairs,,"Of course, Mr. Speaker, that member knows that is not true. Lapsed funding is not lost funding, and in the last five years, over 97% of what was marked as lapsed funding in the public accounts has been carried forward to future years and spent on a wide range of programs, programs that member and that party voted against.
The delay in spending of these funds is not uncommon, because actually spending this money often involves negotiations with other parties or community votes from first nations memberships.
We will continue to make concrete investments in aboriginal peoples, and we would like the opposition to actually get on board and support that.",Conservative,Chilliwack--Fraser Canyon,Mark Strahl,http://www.parl.gc.ca/parlinfo/Files/Parliamentarian.aspx?Item=a2d5c8bf-d42e-4b53-be9e-70af2a6fe169&Language=E&Section=ALL
4642958,ca.proc.d.2015-06-05.16866.45,2015-06-05,4bc128a9-b349-4867-a545-ad05122c0e46,598,"Ms. Niki Ashton (Churchill, NDP)",,Oral Questions,Aboriginal Affairs,,"Mr. Speaker, the question is this. How can these Conservatives look at themselves in the mirror every day when indigenous peoples live in this country in third world conditions, in mouldy homes and in schools that are falling apart, and without safe drinking water? We find out that the Conservatives have lapsed $1.1 billion returned to their coffers, money that was allocated to them. How can they stand in this House and justify to indigenous peoples in this country this gross negligence?",New Democratic Party,Churchill,Niki Ashton,http://www.parl.gc.ca/parlinfo/Files/Parliamentarian.aspx?Item=4bc128a9-b349-4867-a545-ad05122c0e46&Language=E&Section=ALL
4642959,ca.proc.d.2015-06-05.16866.46,2015-06-05,a2d5c8bf-d42e-4b53-be9e-70af2a6fe169,9130,"Mr. Mark Strahl (Parliamentary Secretary to the Minister of Aboriginal Affairs and Northern Development, CPC)",,Oral Questions,Aboriginal Affairs,,"Mr. Speaker, of course that member knows that is not true. She knows that 97% of those lapsed funds were spent on aboriginal programming in the following year. She knows that it takes time to negotiate and get community votes for first nations spending. She also knows that she voted against water treatment plants in first nations reserves. She voted against matrimonial property rights for women on reserves. She voted against the Canadian human rights being brought onto reserve.
The New Democrats always vote against aboriginal people when they have the chance here in the House of Commons.",Conservative,Chilliwack--Fraser Canyon,Mark Strahl,http://www.parl.gc.ca/parlinfo/Files/Parliamentarian.aspx?Item=a2d5c8bf-d42e-4b53-be9e-70af2a6fe169&Language=E&Section=ALL
4642960,ca.proc.d.2015-06-05.16866.47,2015-06-05,0c9d00b0-a035-46d3-ba51-0db3e8da19b8,9253,"Mr. Murray Rankin (Victoria, NDP)",,Oral Questions,The Environment,,"Mr. Speaker, the Conservatives are ignoring our duty to first nations just like they are ignoring our duty to act on climate change. A new UN report slams Canada today for pulling out of our international efforts to fight climate change. The report points out that Conservatives are way off track to meet even their weak 2020 emissions target. Canada is going to show up at the G7 meetings with no credible plan.
 For the sake of our international reputation and for the sake of future generations, will the Conservatives finally take the threat of climate change seriously?",New Democratic Party,Victoria,Murray Rankin,http://www.parl.gc.ca/parlinfo/Files/Parliamentarian.aspx?Item=0c9d00b0-a035-46d3-ba51-0db3e8da19b8&Language=E&Section=ALL
4642961,ca.proc.d.2015-06-05.16866.48,2015-06-05,3ad715ec-41ca-4448-a759-7d1d2b901ae4,618,"Hon. Leona Aglukkaq (Minister of the Environment, Minister of the Canadian Northern Economic Development Agency and Minister for the Arctic Council, CPC)",,Oral Questions,The Environment,,"Mr. Speaker, in Canada we have seen a reduction in greenhouse gas emissions since we started recording and we will continue to take actions.
Canada was the first country in the world to ban traditional coal-fired electricity, which is one of the largest contributions to greenhouse gas emissions. We will continue to take actions. We just recently announced that we are going to move forward to reduce emissions by 30% below 2005 levels by 2030, and we will continue to take a balanced and responsible approach. We announced further actions in three sectors within Canada: reducing methane emissions from the oil and gas sector, reductions of chemical nitrogen fertilizers and regulating emissions from the natural gas sector.",Conservative,Nunavut,Leona Aglukkaq,http://www.parl.gc.ca/parlinfo/Files/Parliamentarian.aspx?Item=3ad715ec-41ca-4448-a759-7d1d2b901ae4&Language=E&Section=ALL
4642962,ca.proc.d.2015-06-05.16866.49,2015-06-05,675e2559-11e0-4951-8755-03ffbc1a6d0d,8682,"Ms. Charmaine Borg (Terrebonne—Blainville, NDP)",,Oral Questions,The Environment,,"Mr. Speaker, when it comes to fighting climate change, Canada is being increasingly singled out by its international partners because of its failure to act. A UN report published by the Africa Progress Panel highlights Canada's disengagement when it comes to reducing greenhouse gas emissions. Canada will not be proposing any concrete measures at the upcoming G7 summit.
When will the government stop lagging behind on this issue, which is so crucial to our future generations?",New Democratic Party,Terrebonne--Blainville,Charmaine Borg,http://www.parl.gc.ca/parlinfo/Files/Parliamentarian.aspx?Item=675e2559-11e0-4951-8755-03ffbc1a6d0d&Language=E&Section=ALL
4642963,ca.proc.d.2015-06-05.16866.50,2015-06-05,3ad715ec-41ca-4448-a759-7d1d2b901ae4,618,"Hon. Leona Aglukkaq (Minister of the Environment, Minister of the Canadian Northern Economic Development Agency and Minister for the Arctic Council, CPC)",,Oral Questions,The Environment,,"Mr. Speaker, our government has announced a fair and ambitious target for Canada, and it is in line with international industrialized countries. We plan to reduce greenhouse gas emissions by 30% below the 2005 levels by 2030, and will continue to take actions.
We recently announced three sectors that we will continue to regulate: reduce the methane emissions from the oil and gas sector, regulate the production of chemical nitrogen fertilizers and regulate emissions from natural-gas-fired electricity.
This is in addition to the actions that we took in the traditional coal-fired electricity sector and in the transportation sector.",Conservative,Nunavut,Leona Aglukkaq,http://www.parl.gc.ca/parlinfo/Files/Parliamentarian.aspx?Item=3ad715ec-41ca-4448-a759-7d1d2b901ae4&Language=E&Section=ALL
4642964,ca.proc.d.2015-06-05.16866.51,2015-06-05,0253e859-f573-4a61-8c88-0466545df2fa,8547,"Ms. Ève Péclet (La Pointe-de-l'Île, NDP)",,Oral Questions,Ethics,,"Mr. Speaker, the Prime Minister and his office are embroiled in one of the biggest scandals in the history of the Senate. The upper chamber has become a real embarrassment for the Conservatives and the Liberals. Canadians are fed up with paying for all these illegal expenses. The Conservative champion of law and order, who was appointed by this Prime Minister, is now under investigation by the RCMP. We know that the PMO staff are up to their necks in this scandal.
What happened to the promise this Prime Minister made 10 years ago to clean up Parliament?",New Democratic Party,La Pointe-de-l'Île,Ève Péclet,http://www.parl.gc.ca/parlinfo/Files/Parliamentarian.aspx?Item=0253e859-f573-4a61-8c88-0466545df2fa&Language=E&Section=ALL
4642965,ca.proc.d.2015-06-05.16866.52,2015-06-05,1d35e58c-52b0-42f0-a344-c31524b2d07a,589,"Mr. Paul Calandra (Parliamentary Secretary to the Prime Minister and for Intergovernmental Affairs, CPC)",,Oral Questions,Ethics,,"Mr. Speaker, as I just said, it was the Senate that actually invited in the Auditor General to review its expenses, and we expect that senators will continue to co-operate in that process.
 At the same time, we know that it is the New Democrats who owe $2.7 million to the Canadian taxpayers. In fact, this member herself took $30,000 that was meant for her riding and redistributed it to an illegal office in Montreal, against the rules of this House, and now refuses to pay back the taxpayers. I hope that she and the other 67 members will do the right thing and pay taxpayers back.",Conservative,Oak Ridges--Markham,Paul Calandra,http://www.parl.gc.ca/parlinfo/Files/Parliamentarian.aspx?Item=1d35e58c-52b0-42f0-a344-c31524b2d07a&Language=E&Section=ALL
4642966,ca.proc.d.2015-06-05.16866.53,2015-06-05,0253e859-f573-4a61-8c88-0466545df2fa,8547,"Ms. Ève Péclet (La Pointe-de-l'Île, NDP)",,Oral Questions,Ethics,,"Mr. Speaker, a few weeks ago, the Prime Minister appointed Senator Housakos as Speaker of the Senate, but today, he and his colleagues, Senator Carignan and Senator Cowan, have just been singled out by the Auditor General's report. 
They took charge of the Senate committee that deals with the report and will be the ones to set up the arbitration process. This is an absolute farce. The foxes have been put in charge of the henhouse.
How can the minister be okay with this abuse of power? ",New Democratic Party,La Pointe-de-l'Île,Ève Péclet,http://www.parl.gc.ca/parlinfo/Files/Parliamentarian.aspx?Item=0253e859-f573-4a61-8c88-0466545df2fa&Language=E&Section=ALL
4642967,ca.proc.d.2015-06-05.16866.54,2015-06-05,1d35e58c-52b0-42f0-a344-c31524b2d07a,589,"Mr. Paul Calandra (Parliamentary Secretary to the Prime Minister and for Intergovernmental Affairs, CPC)",,Oral Questions,Ethics,,"Mr. Speaker, as I said, the Senate invited the Auditor General in and we expect all senators to continue to participate in this process. It is unfortunate that this member refuses to participate in reimbursing the Canadian taxpayer the over $30,000 that the member owes to the taxpayer. 
For some reason, this member, along with 67 other members of the NDP caucus, took money out of their ridings, money meant for their constituents, and redirected it to an illegal partisan party office in Montreal, and now they are refusing to pay back the taxpayer of Canada. They should do it. Repay.",Conservative,Oak Ridges--Markham,Paul Calandra,http://www.parl.gc.ca/parlinfo/Files/Parliamentarian.aspx?Item=1d35e58c-52b0-42f0-a344-c31524b2d07a&Language=E&Section=ALL
4642968,ca.proc.d.2015-06-05.16866.55,2015-06-05,8826a32c-2e29-49be-b6e2-c1f10363639b,440,"Ms. Irene Mathyssen (London—Fanshawe, NDP)",,Oral Questions,Ethics,,"Mr. Speaker, it is no wonder these Conservatives have to recreate reality.
We are talking about repeated abuse of taxpayer dollars. With Conservative and Liberal senators submitting travel claims that were not really all about Senate business, these expenses were for partisan and personal events, where senators were campaigning on the public dime. Canadians are sick and tired of these appointed party cronies treating the Senate like an election slush fund.
Why are the Conservatives covering up for this dysfunctional institution?",New Democratic Party,London--Fanshawe,Irene Mathyssen,http://www.parl.gc.ca/parlinfo/Files/Parliamentarian.aspx?Item=8826a32c-2e29-49be-b6e2-c1f10363639b&Language=E&Section=ALL
4642969,ca.proc.d.2015-06-05.16866.56,2015-06-05,1d35e58c-52b0-42f0-a344-c31524b2d07a,589,"Mr. Paul Calandra (Parliamentary Secretary to the Prime Minister and for Intergovernmental Affairs, CPC)",,Oral Questions,Ethics,,"Mr. Speaker, it was the Senate that invited in the Auditor General to review all expenses.
At the same time, we know that the NDP caucus members, 68 of them, owe the Canadian taxpayers $2.7 million. The Leader of the Opposition himself owes $400,000 to the taxpayers. This summer the 68 of them are going to be squished into the defendant's box in the court trying to explain to the taxpayers why they refuse to pay back the money they owe them. Pay the $2.7 million back.",Conservative,Oak Ridges--Markham,Paul Calandra,http://www.parl.gc.ca/parlinfo/Files/Parliamentarian.aspx?Item=1d35e58c-52b0-42f0-a344-c31524b2d07a&Language=E&Section=ALL
4642970,ca.proc.d.2015-06-05.16866.57,2015-06-05,8826a32c-2e29-49be-b6e2-c1f10363639b,440,"Ms. Irene Mathyssen (London—Fanshawe, NDP)",,Oral Questions,Ethics,,"Oh, the desperate need for a smokescreen, Mr. Speaker.
The Prime Minister's Office has been on the inside of the Senate expense scandal from the beginning. The coverup of the Duffy spending scandal was orchestrated by the PMO. The Conservatives knew full well what their Senate cronies were up to because they were the ones who invited these senators to partisan fundraisers. The Conservative MPs here enabled the corruption of Conservative senators over there.
How can the Prime Minister continue to maintain he is innocent when all the evidence points back to his office?",New Democratic Party,London--Fanshawe,Irene Mathyssen,http://www.parl.gc.ca/parlinfo/Files/Parliamentarian.aspx?Item=8826a32c-2e29-49be-b6e2-c1f10363639b&Language=E&Section=ALL
4642971,ca.proc.d.2015-06-05.16866.58,2015-06-05,1d35e58c-52b0-42f0-a344-c31524b2d07a,589,"Mr. Paul Calandra (Parliamentary Secretary to the Prime Minister and for Intergovernmental Affairs, CPC)",,Oral Questions,Ethics,,"Again, Mr. Speaker, nothing could be further from the truth. The only person who has done enabling is the actual Leader of the Opposition, who hatched a scheme out of the office of the Leader of the Opposition to take funds of the Canadian taxpayers, funds meant for 68 members' ridings, and funnel them to an illegal office in Montreal. Now they owe the taxpayers $2.7 million. They are refusing to pay that money back. I hope they will do the right thing and pay back the taxpayers.
Do not spend your summer in court defending why it is that you refuse to pay them back. Just simply pay the taxpayer back.",Conservative,Oak Ridges--Markham,Paul Calandra,http://www.parl.gc.ca/parlinfo/Files/Parliamentarian.aspx?Item=1d35e58c-52b0-42f0-a344-c31524b2d07a&Language=E&Section=ALL
4642972,ca.proc.d.2015-06-05.16866.59,2015-06-05,1b175d0f-9278-4e04-9fa8-0368e591c5a5,69,The Deputy Speaker,,Oral Questions,Ethics,,"I would remind the parliamentary secretary to direct his comments to the Chair and not to other members across the floor.
The hon. member for Toronto—Danforth.",New Democratic Party,Windsor--Tecumseh,Joe Comartin,http://www.parl.gc.ca/parlinfo/Files/Parliamentarian.aspx?Item=1b175d0f-9278-4e04-9fa8-0368e591c5a5&Language=E&Section=ALL
4642973,ca.proc.d.2015-06-05.16866.60,2015-06-05,413f63e9-daa1-4444-b83b-c0135109dbba,9240,"Mr. Craig Scott (Toronto—Danforth, NDP)",,Oral Questions,Ethics,,"Mr. Speaker, the Senate is in total disrepute. Even former Conservative prime minister Mulroney agrees that the Senate is facing an unprecedented crisis.
The Auditor General's report will confirm just how deep the rot runs. It has never been clearer that it is not only possible but it is necessary to abolish the Senate. The Supreme Court has told us how, so will the Minister for Democratic Reform tell us whether the Conservatives will finally let Canadians get rid of this thoroughly discredited institution?",New Democratic Party,Toronto--Danforth,Craig Scott,http://www.parl.gc.ca/parlinfo/Files/Parliamentarian.aspx?Item=413f63e9-daa1-4444-b83b-c0135109dbba&Language=E&Section=ALL
4642974,ca.proc.d.2015-06-05.16866.61,2015-06-05,ad4032f2-6bb1-497b-b146-f321cfb71ba9,233,"Hon. Pierre Poilievre (Minister of Employment and Social Development and Minister for Democratic Reform, CPC)",,Oral Questions,Ethics,,"Mr. Speaker, we went to the Supreme Court to find out how we could get rid of the Senate, how we could abolish it, and, in fact, NDP provincial governments argued against doing so during those very same proceedings. The court has now said that it would require the unanimous approval of all 10 provinces and so far, that consensus has not come from the provinces, but if the provinces do bring that forward, then we will support it.",Conservative,Nepean--Carleton,Pierre Poilievre,http://www.parl.gc.ca/parlinfo/Files/Parliamentarian.aspx?Item=ad4032f2-6bb1-497b-b146-f321cfb71ba9&Language=E&Section=ALL
4642975,ca.proc.d.2015-06-05.16866.62,2015-06-05,07cf5767-802c-406c-92a7-7dc92af79b40,4264,"Mr. Kevin Lamoureux (Winnipeg North, Lib.)",,Oral Questions,Aboriginal Affairs,,"Mr. Speaker, every year, the Conservative government intentionally underspends in excess of $200 million. This is now five years in a row that has taken place. 
Every member of this chamber, I am sure, is aware of the many reserves that rely on boiling their water in order to have drinking water. Many reserves are on an advisory. Every member is aware of the deficiencies in education within the reserves.
How does the Conservative government justify stealing over $200 million a year in the past five years when the needs are so great in Canada's first nations—",Liberal,Winnipeg North,Kevin Lamoureux,http://www.parl.gc.ca/parlinfo/Files/Parliamentarian.aspx?Item=07cf5767-802c-406c-92a7-7dc92af79b40&Language=E&Section=ALL
4642976,ca.proc.d.2015-06-05.16866.63,2015-06-05,1b175d0f-9278-4e04-9fa8-0368e591c5a5,69,The Deputy Speaker,,Oral Questions,Aboriginal Affairs,,"Order. I remind all members that they have 35 seconds to ask their questions and not a minute.
The hon. Parliamentary Secretary to the Minister of Aboriginal Affairs.",New Democratic Party,Windsor--Tecumseh,Joe Comartin,http://www.parl.gc.ca/parlinfo/Files/Parliamentarian.aspx?Item=1b175d0f-9278-4e04-9fa8-0368e591c5a5&Language=E&Section=ALL
4642977,ca.proc.d.2015-06-05.16866.64,2015-06-05,a2d5c8bf-d42e-4b53-be9e-70af2a6fe169,9130,"Mr. Mark Strahl (Parliamentary Secretary to the Minister of Aboriginal Affairs and Northern Development, CPC)",,Oral Questions,Aboriginal Affairs,,"Mr. Speaker, of course, that member does know that lapsed funding is not money that has disappeared. In fact, 97% of that funding was carried forward to future years and spent on a wide range of programs. 
Every time we spend money on aboriginal programming or aboriginal infrastructure in this House, whether it is for waste water treatment, water treatment, education, or to give women on reserve the same rights as women living off reserve, we can count on the Liberal Party to vote against it.",Conservative,Chilliwack--Fraser Canyon,Mark Strahl,http://www.parl.gc.ca/parlinfo/Files/Parliamentarian.aspx?Item=a2d5c8bf-d42e-4b53-be9e-70af2a6fe169&Language=E&Section=ALL
4642978,ca.proc.d.2015-06-05.16866.65,2015-06-05,0992ca07-764f-4fa6-aa55-9a1f3f0a7327,193,"Mr. David McGuinty (Ottawa South, Lib.)",,Oral Questions,Government Advertising,,"Mr. Speaker, $30 million could provide 300 affordable housing units, one million bus passes to seniors on a pension, summer jobs for 9,000 students, and 20 million breakfasts in our elementary schools to children who go hungry, as well as reopen nine veterans' service centres. How does the Prime Minister explain spending $30 million on 10,000 blue Conservative vanity ads? ",Liberal,Ottawa South,David McGuinty,http://www.parl.gc.ca/parlinfo/Files/Parliamentarian.aspx?Item=0992ca07-764f-4fa6-aa55-9a1f3f0a7327&Language=E&Section=ALL
4642979,ca.proc.d.2015-06-05.16866.66,2015-06-05,ad4032f2-6bb1-497b-b146-f321cfb71ba9,233,"Hon. Pierre Poilievre (Minister of Employment and Social Development and Minister for Democratic Reform, CPC)",,Oral Questions,Government Advertising,,"Mr. Speaker, we are informing parents about the benefits that we are providing them. In fact, the Prime Minister just increased the universal child care benefit by nearly $2,000 for each child under 6 and $720 for each child 6 through 17.
The Liberals want to take that benefit away from families. In the meantime, the Liberal leader just announced that he wants to add an extra $1,000 to every worker's tax bill through a pension scheme proposed by Kathleen Wynne, in Ontario. We are against that idea and we will keep reducing taxes.",Conservative,Nepean--Carleton,Pierre Poilievre,http://www.parl.gc.ca/parlinfo/Files/Parliamentarian.aspx?Item=ad4032f2-6bb1-497b-b146-f321cfb71ba9&Language=E&Section=ALL
4642980,ca.proc.d.2015-06-05.16866.67,2015-06-05,0992ca07-764f-4fa6-aa55-9a1f3f0a7327,193,"Mr. David McGuinty (Ottawa South, Lib.)",,Oral Questions,Government Advertising,,"Mr. Speaker, here is what $30 million can buy: 15 MRI machines; 500 registered nurses or 900 personal support worker salaries for one year; 10,000 hip, knee and cataract surgeries; 4,250 insulin pumps for our kids coping with type 1 diabetes; 15,000 doses of chemotherapy drugs for cancer patients; 46,500 injections to treat osteoporosis. 
In the face of so many needs, how can the Prime Minister justify spending $30 million on 10,000 obscene Conservative blue vanity billboards?",Liberal,Ottawa South,David McGuinty,http://www.parl.gc.ca/parlinfo/Files/Parliamentarian.aspx?Item=0992ca07-764f-4fa6-aa55-9a1f3f0a7327&Language=E&Section=ALL
4642981,ca.proc.d.2015-06-05.16866.68,2015-06-05,ad4032f2-6bb1-497b-b146-f321cfb71ba9,233,"Hon. Pierre Poilievre (Minister of Employment and Social Development and Minister for Democratic Reform, CPC)",,Oral Questions,Government Advertising,,"Mr. Speaker, we communicate with Canadians about the benefits that the government is providing. For example, the Prime Minister has recently increased the universal child care benefit to almost $2,000 a year for each child under 6 and $720 for each child 6 through 17. 
The Liberals have not only announced that they would take the universal child care benefit away, but just last week the Liberal leader announced a plan to increase taxes by $1,000 on every worker who earns $60,000. The small business employing that worker would also have to pay the same $1,000 payroll tax. That will kill jobs and set families back, and that is why we do not support it.",Conservative,Nepean--Carleton,Pierre Poilievre,http://www.parl.gc.ca/parlinfo/Files/Parliamentarian.aspx?Item=ad4032f2-6bb1-497b-b146-f321cfb71ba9&Language=E&Section=ALL
