basepk,hid,speechdate,pid,opid,speakeroldname,speakerposition,maintopic,subtopic,subsubtopic,speechtext,speakerparty,speakerriding,speakername,speakerurl
4693315,ca.proc.d.2016-12-08.9308462,2016-12-08,d282a075-d49f-40b7-ab6d-64455eb9a5a8,219706,Mr. Scott Simms,,Routine Proceedings,Committees of the House,Electoral Reform,"I apologize if my speech is interrupting his heckling, but I will continue.
Here is the situation. That party never engaged the electorate on this. I was there when the Conservatives did the Fair Elections Act. I use air quotes because it is quite comical. The Conservatives never once said anything about a referendum. That is #disingenuous, if they want to call that a Twitter campaign activity.",Liberal,Coast of Bays—Central—Notre Dame,Scott Simms,http://www.parl.gc.ca/MembersOfParliament/ProfileMP.aspx?Key=219706&Language=E
4693316,ca.proc.d.2016-12-08.9307963,2016-12-08,f40d602c-1ae6-414e-bac3-23a2f31f1cdf,225708,"Ms. Linda Duncan (Edmonton Strathcona, NDP)",,Routine Proceedings,Committees of the House,Electoral Reform,"Mr. Speaker, it is always a pleasure to hear the member across the way speak in the House. It has been a pleasure working with him for many years in this place.
There is one profound point that my constituents, and in fact, people from right across my province, have raised many times. It is that they are fed up with the process in which less than 40% of the vote receives an even larger majority government. That is what happened with this government. We again have a mass majority government that received less than 40% of the vote. It is clear and simple. People have told me there has to be a better way to do it. 
We have had a lot of great discussions with groups like Fair Vote Canada. Professors have talked to me about systems in other countries. People were free to fill out, with no pressure, a questionnaire giving some of the options. The committee did a sensible review. What is so upsetting is that we now have the valuable information to simply make the decision at the right time, and yet we have this nonsensical survey that has people incensed.
Would the member agree with me that we should just proceed to begin making amendments?",New Democratic Party,Edmonton Strathcona,Linda Duncan,http://www.parl.gc.ca/MembersOfParliament/ProfileMP.aspx?Key=225708&Language=E
4693317,ca.proc.d.2016-12-08.9308010,2016-12-08,d282a075-d49f-40b7-ab6d-64455eb9a5a8,219706,Mr. Scott Simms,,Routine Proceedings,Committees of the House,Electoral Reform,"In the spirit of mutual admiration, Mr. Speaker, I say the same about my experience working with the member and others on electoral reform in the past, including the member for Skeena—Bulkley Valley and the leader of the Green Party as well. We have had many great discussions.
To the member, that is the valid point that we are trying to seek here with representation in the House. That is why we committed to making the previous election the last one held under the first past the post system.
The member may not like a lot of the details about the survey, but the survey is good in that it goes back to what Thomas Axworthy said, which was to explore the values of where we want to go and not get caught up in all the details first. The details will follow, but let—",Liberal,Coast of Bays—Central—Notre Dame,Scott Simms,http://www.parl.gc.ca/MembersOfParliament/ProfileMP.aspx?Key=219706&Language=E
4693318,ca.proc.d.2016-12-08.9308025,2016-12-08,02c2cb20-f27d-46a5-8e78-ab4b405bf07b,214864,The Deputy Speaker,,Routine Proceedings,Committees of the House,Electoral Reform,"Resuming debate, the hon. member for Montcalm.",Conservative,Simcoe North,Bruce Stanton,http://www.parl.gc.ca/MembersOfParliament/ProfileMP.aspx?Key=214864&Language=E
4693319,ca.proc.d.2016-12-08.9308029,2016-12-08,530dc476-c9bf-477c-83e7-6efc545f2bf8,224177,"Mr. Luc Thériault (Montcalm, BQ)",,Routine Proceedings,Committees of the House,Electoral Reform,"Mr. Speaker, I was very pleased to work with members from both sides of the House during the work of the special committee. This morning, I find it rather ironic that a Bloc Québécois MP is sharing his time with a government member.
Experts came and told us that changing the voting system would allow us to have a consensus democracy and change the way politics is done in this legislative assembly of the House of Commons. It would allow for a collaborative approach. This morning, ironically, it is the government side that is talking about collaboration and fair play.
Every parliamentarian that is part of the executive branch is a representative of the people first. I want to address those who are not part of the executive: the legislators, the representatives of the people. This House is the repository of what we call parliamentary democracy. I would like those members to express their true convictions. 
The Bloc Québécois has said from the start that it is in favour of change, but not just any change. We will not accept a voting system that diminishes the weight of the Quebec nation and relegates it to a geographic entity only. The report respects that. Together with the Conservatives, the NDP, and the Green Party, we came to a consensus. This debate must not be the sole purview of politicians, insiders, and experts. It must belong to the people if it is to be meaningful. It is up to the people to decide.
Obviously, our Liberal colleagues are having a hard time supporting that position, because, before the committee even began sitting, the executive had completely ruled out the possibility of holding a referendum. That puts the Liberal members in an awkward position. The minister is rising in the House to trivialize and discount the idea of a referendum by saying that it is an outdated way of doing things, when in fact it would allow the population to retake control over a debate as important as determining the new rules of a parliamentary democracy. It is no wonder members on the government side are having difficulty distancing themselves from that. That is unfortunate, but it is the reality. What upsets voters the most is the fact that their elected representatives are kowtowing to the executive.
When we consult people, they often criticize this way of doing politics. They want their MP to vote the way their constituents would have them vote.
It is also ironic to see that the House of Commons, which initiated a reform, still has a long way to go to catch up to the Senate, a chamber that is considered to be antiquated. Right now, the Senate is treating its independent members a lot better than this chamber is.
However, the report that was tabled does offer some hope. A consensus was reached on recommendation no. 11 and the discussions surrounding it. It reads:
 The Committee recommends that electoral system reform be accompanied by a comprehensive study of the effects on other aspects of Canada’s “governance ecosystem”... 
That means that, if we make any changes to the voting system or the Canada Elections Act, we must also look at what effect it might have on political party financing and parliamentary procedure in order to ensure that we do not create two tiers of political parties or parliamentarians. The committee was very clear about the fact that the majority of the testimony given by those who wanted change was in favour of proportional representation. 
So how do we deal with this? Committee members were not there for themselves; they were there to hear what people had to say. Every member had his or her own point of view. Initially, the Liberal Party was somewhat in favour of a proportional system; the Conservative Party wanted the status quo; the Green Party and the New Democratic Party preferred mixed-member proportional or single transferable vote, STV; and the Bloc Québécois wanted a proportional system, but not just any proportional system because, as I said earlier, it could affect our status.
The witnesses were not unanimous, but the majority of those who appeared before the committee advocated for a proportional system and a referendum to let the people decide. The idea was that a referendum would have people choose between the status quo and a proportional system. Everyone agreed on that regardless of where they stood and the outcome they wanted. Starting from scratch, the committee concluded that there must be a referendum to ask all Canadians from coast to coast if they prefer the status quo or a proportional system. That was our guiding principle. Those people over there like to talk principles; well, this is the one that guides our majority report.
Let us keep at it, because we need to get to the next phase. What will be the terms? We have been using the current system for 150 years, but what will the new proportional system look like? How big will the ridings be? All these questions will be considered in the second phase of the consultations. We believe this phase of the process should take place during the 2019 election, after a referendum. That makes more sense than a bogus, vacuous survey.",Bloc Québécois,Montcalm,Luc Thériault,http://www.parl.gc.ca/MembersOfParliament/ProfileMP.aspx?Key=224177&Language=E
4693320,ca.proc.d.2016-12-08.9308231,2016-12-08,2347a7b8-8e45-4c51-bdc6-f6c32375ad50,217273,"Mr. Brian Masse (Windsor West, NDP)",,Routine Proceedings,Committees of the House,Electoral Reform,"Mr. Speaker, one of the members from Newfoundland and Labrador who spoke previously mentioned a number of things in terms of a way of movement. I thought his speech was pretty good. Unfortunately, he criticized the notion of flip-flops, despite the fact that he has called ministers the minister of flip-flops in this House. 
Sadly, this becomes a problem for the Liberal Party in terms of credibility. The Liberals are the ones who brought this process through an electoral promise. Then it is the fault of the rest of Parliament that we have to follow through with that because they have a majority, and there is actually sincere interest in this country to have some type of electoral reform, and now it is the fault of the opposition.
I ask my colleague, why is it suddenly everybody else's fault, including the general public, who are now looking at the questionnaire out there, by the mere fact that the Prime Minister was the one who brought this forward? Why is now everybody else's fault, except for the Liberals, who are doing this themselves? That is a problem.",New Democratic Party,Windsor West,Brian Masse,http://www.parl.gc.ca/MembersOfParliament/ProfileMP.aspx?Key=217273&Language=E
4693321,ca.proc.d.2016-12-08.9308256,2016-12-08,530dc476-c9bf-477c-83e7-6efc545f2bf8,224177,Mr. Luc Thériault,,Routine Proceedings,Committees of the House,Electoral Reform,"Mr. Speaker, I am not sure that the interpretation was the problem. Perhaps it was the hon. member's thinking that was not clear.
I am not saying that it is everybody else's fault. I am just saying that there is a way to respect the consensus that was reached by this committee.
The fact that the Prime Minister made a statement with a deadline that is just hot air is one thing. However, giving a committee a mandate from this House and dismissing its hard work out of hand is unacceptable. The government will have to take the blame if the hon. members across the way, who are legislators just like me, do not call the executive to order.",Bloc Québécois,Montcalm,Luc Thériault,http://www.parl.gc.ca/MembersOfParliament/ProfileMP.aspx?Key=224177&Language=E
4693322,ca.proc.d.2016-12-08.9308274,2016-12-08,eaa6694f-1e20-4aae-ad3b-e694b0e12c59,224170,"Ms. Elizabeth May (Saanich—Gulf Islands, GP)",,Routine Proceedings,Committees of the House,Electoral Reform,"Mr. Speaker, I thank my colleague, the member for Montcalm, who represents the Bloc Québécois on the Special Committee on Electoral Reform.
We worked very hard together, and I am very proud of the work everyone did, including my Conservative, NDP, Liberal, and Bloc friends.
My question is simple. Why does the member think that our committee report is being rejected here, and why are we debating a survey on a website rather than debating the recommendations made by our committee?",Green Party,Saanich—Gulf Islands,Elizabeth May,http://www.parl.gc.ca/MembersOfParliament/ProfileMP.aspx?Key=224170&Language=E
4693323,ca.proc.d.2016-12-08.9308308,2016-12-08,530dc476-c9bf-477c-83e7-6efc545f2bf8,224177,Mr. Luc Thériault,,Routine Proceedings,Committees of the House,Electoral Reform,"Mr. Speaker, it was also a great pleasure for me to work with my colleague from the Green Party.
It is abundantly clear that the minister's reaction and therefore that of the executive, and I will choose my words carefully because I do not feel like repeating this whole debate, was to say, “Thank you and goodnight”, and then do their own thing anyway, because they did not agree with the majority consensus. It is appalling, but there it is. This is more likely than a scenario in which unrealistic deadlines were set according to a statement the Prime Minister made during the election campaign, which would be a terrible way to govern. 
I will therefore continue to appeal to my colleagues, to all parliamentarians across the aisle, and to all those who care about being an MP, a representative of the people, to call their minister and the executive branch to task, and ensure that we continue and that we quickly move on to the second phase in order to get into this debate. The people are fed up with these broken promises.",Bloc Québécois,Montcalm,Luc Thériault,http://www.parl.gc.ca/MembersOfParliament/ProfileMP.aspx?Key=224177&Language=E
4693324,ca.proc.d.2016-12-08.9308349,2016-12-08,9c9a64e6-58f1-4367-9f49-93ad31744c96,217354,"Mrs. Cathy McLeod (Kamloops—Thompson—Cariboo, CPC)",,Routine Proceedings,Committees of the House,Electoral Reform,"Mr. Speaker, I will be sharing my time with the member for Sherwood Park—Fort Saskatchewan.
I want to start first by thanking the committee for the tremendous hard work it has done. I watched my colleagues spend a good portion of their summer either in meetings in Ottawa or travelling across the country. I know they all performed their work with diligence. To be quite frank, I was very dismayed when I heard the minister be so dismissive about the work they had done. That was shameful. She did apologize, so we do need to move on, but it was an extraordinary thing to say to the members of the committee who had worked so hard during the summer, and also to Canadians across Canada who had participated in the process.
What was very fascinating about the majority report is it actually ended up, in a very unusual way, reflecting what happened in the riding of Kamloops—Thompson—Cariboo in terms of what the major recommendations were. The riding I represent is a very large riding in the middle of British Columbia. It turned out that there were two independent processes that happened. One was a local group of community members who got together, many of them with affiliations to the NDP, to the Green Party, and to the Liberal Party. I also had a process, independent from them. I was really looking at things perhaps at a hundred-thousand-foot level. I had a number of town halls, mostly in the rural communities. To be quite frank, in the middle of summer it was not very well attended in terms of engagement. They were beautiful summer days, and talking about electoral reform was not as high a priority as perhaps enjoying the very short summers we have. 
However, I did reach out, with a mail-out and a telephone survey. I had three questions. I am not someone who designs survey questions, but I think they were logical and made sense. My first question in the telephone survey was, “Are you aware that we're actually talking about the issue of changing how we vote?” Asking about awareness is probably a good start. Out of that, I was actually surprised. Some of the work over the summer had started to penetrate. This went out to 8,000 homes. It was answered by citizens across the riding. Sixty-eight per cent of the respondents actually had an awareness that there was a discussion going on around electoral reform.
The next question I asked was, “Do you believe that we should be changing our system?” Again, it is a pretty simple question, “Are you happy with what we have or do you think we need to change it?” Again, I am not an expert in survey development, but these were intuitive questions. Forty-one per cent thought we should have changes to the system. Fifty-eight per cent said it was fine the way it is. Thirty-two per cent did not have an opinion. 
My third question was about a referendum, of which 66% of the people who responded to the survey said they believed there should be a referendum. That is actually pretty similar to a lot of the responses from different groups' surveys across the country.
Independently, at the same time, the citizens' group had had more granular sessions where they had sat down with people who had a real interest in the system. They had conversations with them about if we are going to change the system what the system should look like. This was led by a former Liberal candidate. He was the one leading the charge, and he was very interested in sitting down and talking with the people. What came out of the work they did was interesting. Their recommendation was very strongly for a proportional representation system. The people who had attended were very keen on electoral reform, so the response around the issue of a referendum was perhaps smaller, but certainly I felt I had reached out to many.
What we ended up with in our riding was the two principles that came together in that majority report: a referendum and a proportional system, exactly what happened with the committee in terms of how we need to move forward. 
I think the committee and the numerous town halls from across the country gave the government a road map for moving forward with a referendum on proportional system.
It is really kind of surprising that all of a sudden, at the nth hour, the dissenting report by the Liberals says that this is confusing and complex, and that we do not need a referendum. All the other parties are trying, as my colleague from Skeena—Bulkley Valley said, to help the Liberals fulfill their promise, and it is the Liberals' dissenting report for a majority committee that sort of put the kibosh on it. It was very interesting.
 All of a sudden, the Liberals have postcards being mailed across the country. I would suggest that the step they have put in the process is, first of all, a little dubious and is muddying the water a little. The committee had offered to provide some questions, and if the government was putting out a postcard linking people to a survey, there are a few things the committee would recommend. We have looked at this all summer.
There are some questions we think the government should ask. Further, the survey does not link to the report of the committee, which to me is absolutely stunning. People can go to MyDemocracy.ca, and there is no link to see what the committee said but there are links for other things. It did not incorporate logical questions.
It incorporated perhaps logical questions about age and where to vote, but not around the issues the minister criticized the committee about. She said that the committee did not get to the details and the nuts and bolts. In the same sense, she has sent out a survey that in some ways, quite rightfully, has been widely mocked because she is not asking the basic questions and she criticized the committee for not getting to around a specific model.
The committee gave the minister some very strong directions. It is actually very bizarre that we end up in this position with no link to the work of the committee, and there are questions that sometimes miss the point.
I have other concerns about the survey. I mentioned that it did not link to the work of the committee. I had a friend call me last night. She said that she went on the website, cleared her browsing history and went on it again. She made sure she answered the questions. They were in a different order, but she answered them the same way each time. She came out with a different assessment each time, in terms of what kind of voter she was.
She asked “What is this?” That was her question. She was sending me notes and asking what it was all about. She thought it was just crazy that she was answering the questions in the same way, and was getting different results. That did not really make any sense. This person who has a bit of an interest in this topic just cleared her browsing history and kept on going.
Earlier we heard that the parliamentary secretary thinks it is perfectly all right that people from across the world can answer the survey if they choose to. It is pretty easy to look up a postal code. It is pretty easy to answer the survey. I have real problems with that. I cannot believe in this. I have no confidence in anything that actually comes out of this survey.
The minister indicated that personal information is not required. The personal information being asked is how much one makes and for their email address. Why does the government want the email addresses? I have some concerns. The minister said people could do the survey anyway, but what she did not tell us is that those responses would not count.
I think Parliament has done the work that it can and should do. I have always said, and this is my own personal belief, politicians and political parties not only have a vested interest, they have a conflict of interest, and they had guidance. It needs to go to a referendum.",Conservative,Kamloops—Thompson—Cariboo,Cathy McLeod,http://www.parl.gc.ca/MembersOfParliament/ProfileMP.aspx?Key=217354&Language=E
4693325,ca.proc.d.2016-12-08.9308504,2016-12-08,4abeb9b5-279b-4117-9e04-b8901d9ccc53,224216,"Mr. Francis Scarpaleggia (Lac-Saint-Louis, Lib.)",,Routine Proceedings,Committees of the House,Electoral Reform,"Mr. Speaker, I was on the committee, along with the member for Louis-Saint-Laurent and the member for Saanich—Gulf Islands.
We travelled across the country. We held hearings. What I noticed, and I am sure my colleagues would agree, is that many people came to the committee hearings seeking proportional representation. In some cases, it almost seemed unanimous. However, those same people were also against the idea of a referendum.
The majority report, which is really the opposition party report, called for a high level of proportional representation with a referendum.
Does the member think that is testimony to the opposition party's flexibility and ability to compromise with each other? Is that to the opposition party's credit?",Liberal,Lac-Saint-Louis,Francis Scarpaleggia,http://www.parl.gc.ca/MembersOfParliament/ProfileMP.aspx?Key=224216&Language=E
4693326,ca.proc.d.2016-12-08.9308534,2016-12-08,9c9a64e6-58f1-4367-9f49-93ad31744c96,217354,Mrs. Cathy McLeod,,Routine Proceedings,Committees of the House,Electoral Reform,"Mr. Speaker, I am going to say absolutely. I talked about what happened in my riding. The process that I undertook was a referendum. I am acknowledging the legitimacy that there was another group that went into granular levels and those people were very interested in changing the system. They essentially unanimously came out with proportional representation, so it is not incongruous that there is an agreement over how we should move forward and also the vast majority of Canadians and people in my riding believing a referendum, which is not only how they felt we should move forward, but it is what has been done traditionally in the past. I was in British Columbia as we had referendums. We could talk about the issues of thresholds and a referendum, which are not mutually exclusive, so I think it was perfectly right that they did what they did.",Conservative,Kamloops—Thompson—Cariboo,Cathy McLeod,http://www.parl.gc.ca/MembersOfParliament/ProfileMP.aspx?Key=217354&Language=E
4693327,ca.proc.d.2016-12-08.9308552,2016-12-08,4c0122f7-7958-4cbd-b99e-9d70a4dca1e8,217319,"Mr. Pierre-Luc Dusseault (Sherbrooke, NDP)",,Routine Proceedings,Committees of the House,Electoral Reform,"Mr. Speaker, I would like to thank my colleague for her speech.
I am wondering if she believes, as I do, that the reason for the new survey and a new consultation is that the government did not get the answers it was expecting from the report of the Special Committee on Electoral Reform.
I know that politicians never answer hypothetical questions. However, had the report provided the results that the minister was expecting and that would satisfy her, does the member believe we would be having another consultation? If so, does she believe that the Liberals would finally have moved forward with the promised reform? In other words, is there a new round of consultations because the results were not what the minister expected?",New Democratic Party,Sherbrooke,Pierre-Luc Dusseault,http://www.parl.gc.ca/MembersOfParliament/ProfileMP.aspx?Key=217319&Language=E
