basepk,hid,speechdate,pid,opid,speakeroldname,speakerposition,maintopic,subtopic,subsubtopic,speechtext,speakerparty,speakerriding,speakername,speakerurl
4654773,ca.proc.d.2016-03-09.17153.227,2016-03-09,c5b09363-414d-43b2-bc2c-274b997c8989,9899,Ms. Jenny Kwan,Interjection,Government Orders,Citizenship Act,,"Mr. Speaker, I would remind the member that during the campaign the Prime Minister made a commitment to the Chinese community, particularly through the Chinese media, that if the Liberals formed government he would repeal Bill C-24 in its entirety. If we use that as a barometer to what is happening right now with Bill C-6, it actually falls short. 
That being said, I do support the measures brought forward under Bill C-6 for the most part. There are areas I have identified where it needs further action and I hope I can count on the member's support in that regard.
 I know the member made a comment in the media regarding the citizenship language issue, particularly the proficiency, or the level of the language. I hope I can count on his support to get his government and his minister to move in the right direction to reduce the proficiency level and to recognize the contributions of immigrants in that regard.
I hope I can also count on the member's support on the financial barriers and reducing the citizenship application fees.",New Democratic Party,Vancouver East,Jenny Kwan,
4654774,ca.proc.d.2016-03-09.17153.228,2016-03-09,2c7cfe15-cb1e-43c5-831d-6ad09d4a16b6,9285,"Mr. Arnold Chan (Scarborough—Agincourt, Lib.)",,Government Orders,Citizenship Act,,"Mr. Speaker, I will be splitting my time with my friend from Surrey—Newton.
It is a pleasure to rise today to speak to the government's plan to repeal the unfair provisions found under the Citizenship Act that were passed in the previous Parliament under Bill C-24, which allowed for the revocation of Canadian citizenship of dual or multiple nationals on the grounds of national interest.
Once again, our government is delivering on the commitments we promised Canadians during last year's federal election. From my perspective, Bill C-24 is not only a bill that personally affects the lives of many of my constituents but it also affects many Canadians across this country.
 I note that in the speech by the Minister of Immigration, Refugees and Citizenship, he articulated two broad principles that governed the intent behind Bill C-6. 
 First and foremost, he enunciated the concept of a Canadian is a Canadian is a Canadian, which was something that we had heard throughout the campaign, and that we found the notion of two different types of classes of Canadian citizens to be offensive.
The second concept that was articulated by the minister was with respect to peeling back the changes found in Bill C-24 that imposed new barriers on welcoming immigrants to this country and becoming Canadian citizens. 
There are a series of four provisions within Bill C-6 that attempt to bring back a much more welcoming atmosphere to becoming a Canadian citizen. Those are very important principles. However, I want to focus on two different principles. 
I first want to note that I appreciated the speech made by my friend from the New Democratic Party, the member for Vancouver East, who I thought articulated in very clear terms the reasons why her party would be supporting the provisions of Bill C-6. She also put forth some legitimate criticisms that she found, namely, that we did not necessarily go far enough in Bill C-6. 
I take the point the minister raised that this government remains open to making reasonable changes, which is a reflection of this particular government. For example, this government would definitely entertain some of the issues the member articulated.
I want to get to those two broad principles that I would like to articulate in the short time I have to talk to Bill C-6 that I feel were particularly offensive under Bill C-24.
The first concept I want to advance, which was a central theme that had been articulated by the previous government and in particular by the former minister of citizenship and immigration, Chris Alexander, is the concept that citizenship is a privilege as opposed to a right. I strongly disagree with the former minister's position on this substantive fate.
The whole concept of strengthening the Canadian Citizenship Act, as minister Alexander had framed it, was that citizenship was somehow a privilege. From my perspective, once it is conferred, it attaches rights. There are obligations and responsibilities that come with citizenship, but it confers rights that are protected specifically under the charter, as my friend from Vancouver East had noted. Therefore, once it is legitimately acquired, the concept of citizenship should not be taken away capriciously.
 That brings me to the second concept. My friends in the New Democratic Party touched upon this particular theme both in the comments made by my friend from Vancouver East and in the question from the finance critic for the NDP, which is the concept of the encroachment of executive power and the lack of procedural due process that was found under Bill C-24. Again, I deeply oppose this concept.
I take the comments that my friend from Vancouver East noted seriously. She remains concerned that there needs to be procedural due process whenever citizenship is stripped away. This government would be amendable to those kinds of amendments to the legislation.
I found particularly odious the previous government's perspective to grant the minister the arbitrary right to decide which individuals would get to keep their citizenship and which ones would not. It was particularly odious because it could be done capriciously and without any sort of procedural due process. There would be no capacity to appeal. There would be no capacity to bring new facts to the table.
I know what members of the Conservative Party are ultimately going to say. They are going to say we would only be stripping citizenship from convicted terrorists. All we heard in the debate in the House from the previous minister and from my friends in the opposition is that at the end of the day once individuals are convicted of a particular crime, they should serve their time, and that is the ultimate sanction. Stripping citizenship from certain classes of individuals is not fundamentally appropriate. More important, it would undermine the whole concept of the fundamental principle of rule of law, where all citizens are treated equally. I note that concept was very well articulated earlier, and I want to reinforce that principle in my comments today.
These are really the fundamental issues of why I will be supporting Bill C-6 in addition to the principles that were enunciated by the minister. 
My sense is that this is about what it means to be Canadian, what it ultimately means to create conditions where we are a welcoming society, as noted in the opening comments of the minister, a society that values people who come from around the world. My friend from Calgary Nose Hill articulated the same principles. 
I do not agree with my friend from Sherwood Park—Fort Saskatchewan that somehow this is about an elevation of values. This is very much a values debate, but the value we are attaching is to the protection of fundamental principles, principles that are found in the charter, the principle of rule of law, the principle of equality. That is why we are here in this place. If we cannot protect those fundamental principles for the people we find most offensive in our society, then why are we here? That for me is the core of the debate and why Bill C-6 must be supported.",Liberal,Scarborough--Agincourt,Arnold Chan,
4654775,ca.proc.d.2016-03-09.17153.229,2016-03-09,b6850f16-57dc-486c-b5bb-0fd191022af4,10426,"Mr. Garnett Genuis (Sherwood Park—Fort Saskatchewan, CPC)",,Government Orders,Citizenship Act,,"Madam Speaker, the member for Scarborough—Agincourt always speaks eloquently, even when I do not agree with him. He is so good at making bad ideas sound good.
When it comes to this idea of fundamental principles, he gets at something important. When people choose to reject all the things that characterize Canadian values, when they do not buy in by trying to use the good name of Canadian citizenship to engage in violent terrorism against Canadians, against innocent people, against our values, is there not some point at which people can effectively take themselves out of that citizenship by their own convictions and actions against Canada, against Canadian values, against innocent people?
Let us make this concrete. What would happen when individuals who have the benefit of a Canadian passport travel around the world, use the access a Canadian passport gives them, undertake violence against civilians, plan terrorist activities, continue to use the good name of Canada, and have to be bailed out by us in certain situations? Is there not some point where individuals by their own actions take themselves out of the Canadian family by choosing to be involved in this kind of violence?",Conservative,Sherwood Park--Fort Saskatchewan,Garnett Genuis,
4654776,ca.proc.d.2016-03-09.17153.230,2016-03-09,2c7cfe15-cb1e-43c5-831d-6ad09d4a16b6,9285,Mr. Arnold Chan,Interjection,Government Orders,Citizenship Act,,"Mr. Speaker, we agree that people we find offensive in our society, whether that be terrorists, murders, or whatever, need to be punished to the fullest extent of the law. We support that on the government side. The question is whether we create an additional penalty for certain classes of individuals. In this case, we are only talking about people who have a dual citizenship or the potential of a dual citizenship. Therefore, it can only be applied to certain people. From my perspective, that ultimately devalues the whole notion of equality of citizenship, which is much more fundamental.
There are many other mechanisms that my friend has articulated in his question that I think allows us to deal with it, whether that be confiscation of passports or travel restrictions. There are other mechanisms that we can impose on these types of individuals, but again, it gets down to fundamental values. The concept of equality is paramount.",Liberal,Scarborough--Agincourt,Arnold Chan,
4654777,ca.proc.d.2016-03-09.17153.231,2016-03-09,a71a1741-7ff2-4246-b0da-4622e96b10cf,1082,"Mr. Guy Caron (Rimouski-Neigette—Témiscouata—Les Basques, NDP)",,Government Orders,Citizenship Act,,"Madam Speaker, I would like to thank my colleague for his speech and for highlighting the questions I asked my other colleague from British Columbia. However, I would like a more specific answer.
At the time, we opposed, as did the Liberal opposition, granting such discretionary powers to ministers on such fundamental issues. That was the case for the public safety file and several bills dealing with finances.
In this case, we are dealing with immigration. Granting discretionary power to a person and their entourage by circumventing the process is fundamentally contrary to the rule of law. I would like to ask my colleague who touched on that issue for his comments.
What do he and his colleagues think of these powers that his party, during the election campaign, promised to eliminate, but that still remain in the hands of the minister and his entourage?",New Democratic Party,Rimouski-Neigette--Témiscouata--Les Basques,Guy Caron,http://www.parl.gc.ca/parlinfo/Files/Parliamentarian.aspx?Item=a71a1741-7ff2-4246-b0da-4622e96b10cf&Language=E&Section=ALL
4654778,ca.proc.d.2016-03-09.17153.232,2016-03-09,2c7cfe15-cb1e-43c5-831d-6ad09d4a16b6,9285,Mr. Arnold Chan,Interjection,Government Orders,Citizenship Act,,"Mr. Speaker, as I said in my remarks, even the minister has acknowledged that no bill is ultimately perfect. That is why this government has adopted a process of strengthening committees and giving opportunities for members to exercise the democratic function in which they were elected.
I agree fully with the principle that executive power, particularly in a Westminster-style model, needs to be checked, and we are doing our best to do that. If there is a particular flaw in the bill, this side of the House will remain open to those effective changes.
All things ultimately require balance. At the end of the day, there is also a function of protecting Canadians and security. However, that should never be done in such a way that it is capricious, or without the application of the rule of law, or the principles of both procedural and substantive due process.",Liberal,Scarborough--Agincourt,Arnold Chan,
4654779,ca.proc.d.2016-03-09.17153.233,2016-03-09,3da57866-49d8-42d1-9f5b-c78561f67c9d,422,"Mr. Sukh Dhaliwal (Surrey—Newton, Lib.)",,Government Orders,Citizenship Act,,"Madam Speaker, as an immigrant to this country, I fondly remember the day, July 17, 1987, when I became a Canadian citizen. It was one of the proudest days of my life and something I had dreamed about ever since I moved to Canada in January of 1984.
This is my frame of reference in speaking in support of Bill C-6. I always understood Canada to be a country that welcomed refugees and immigrants and inspired them to strive to become Canadian citizens, to take that step toward full membership and permanent belonging in Canadian society. This is why Conservative Bill C-24, introduced in 2014 by the previous government, is so concerning to Canadians across Canada. 
Even the hon. member for Calgary Forest Lawn, a former parliamentary secretary and the longest continuously serving Conservative MP in the House, has publicly said that he has always opposed the bill. 
The member has been quoted as stating that he was “taken to task” by members of his own party for being one of the few MPs on that side of the House to vote against Bill C-24. 
Bill C-24 was an attempt by the Conservative Party to fundamentally change what it meant to be a Canadian as part of political branding exercise. The act created two classes of Canadians: those that only had Canadian citizenship and those who were at risk by having dual citizenship. Using their typical rhetoric of being tough on terrorism as justification, the Conservatives completely devalued what it meant to hold a Canadian passport. 
One of the most troubling aspects of the act is the way that Canadian citizenship could be so easily revoked. For example, convictions abroad that convinced a government official that an individual was a national security threat may prompt a process where Canadian citizenship could be stripped away. 
By no means does our government support citizens involved in terrorist offences, or espionage, or treason inside or outside of Canada's borders. However, this ability to remove citizenship from dual citizens is a problem.
 First, a Canadian citizen without dual citizenship from another country could never have their passport revoked for the same crimes committed abroad.
 Second, it makes Canadian citizenship a tool for the criminal justice system. Punishment for crimes should be decided in courts of law, either in Canada or outside of Canada, but the possibility of losing one's Canadian passport as a form of punishment is completely inappropriate.
 Last, for the minister to have such wide discretionary powers in the review and revocation process is a complete breach of due process and fairness. 
There are also aspects of the Conservative's Bill C-24 that only serve to discourage immigrants from wanting to become Canadian citizens. Immigrants want to apply for Canadian citizenship are automatically treated with distrust. The act measures their loyalty and attachment to Canada by the days they were physically present in the country. As a result, thousands of immigrant applicants are forced to sacrifice academic and employment opportunities or family obligations abroad just so they do not put their citizenship application process in jeopardy.
Bill C-6 will correct and repeal many of the wrongs contained in Bill C-24. Allow me to outline some of the significant changes being proposed by sharing stories I have heard over the past few months in my riding of Surrey—Newton.
To the young man I met in November who was scared about travelling to the country of his dad's birth for fear of being targeted and arrested by a repressive government regime, I say that Bill C-6 will remove the grounds for revocation of Canadian citizenship that relate to national security.
To the immigrant mother of two young children who came to my constituency office worried about what might happen to her application if she temporarily returned to her homeland to care for her sick mother, I say that Bill C-6 will reduce the number of days that someone will have to be physically present in Canada before applying for citizenship, and that they will receive credit for the time they have spent in Canada before becoming a permanent resident.
There was also a man who was very nervous about applying for citizenship for his quite elderly, sick mother, who struggled with English.
When the Minister of Immigration was giving his speech, I got a call from one of my constituents, Dawinder Mann. He came to this country many years ago as a refugee. His mother, sister, and all his brothers and children are settled here, but unfortunately his wife was not able to apply for Canadian citizenship. She is in a position where her country of origin will not issue her a passport. Now she is not able to pass the English requirement. She is 54. Therefore, she would not be able to get a passport either from Canada or her country of origin. Now her husband is very happy that his wife, Harjinder Mann, under the new legislation, in a year's time will be able to apply proudly for Canadian citizenship and be able to carry a Canadian passport.
These are the types of stories that encourage me to support the Minister of Immigration, the work he is doing, and the bill he has brought forward.
I believe passionately in the power of Canadian citizenship. I believe that the Government of Canada should do everything in its power to encourage newcomers to become Canadian citizens. The Canadian passport is sacred and highly sought after across the globe.
This is why using Canadian citizenship to fearmonger or as a means of control or simply as a political prop is so very wrong. As our Prime Minister has said, and I say again, a Canadian is a Canadian is a Canadian, and our Minister of Immigration has also said that. This is why he brought Bill C-6 forward, so that every Canadian can feel that a Canadian is a Canadian is a Canadian.
I encourage all members to support Bill C-6 so that what it means to be a Canadian can once again to be used to unite rather than divide us.
I am thankful for this opportunity to share my thoughts with my fellow members.",Liberal,Surrey--Newton,Sukh Dhaliwal,http://www.parl.gc.ca/parlinfo/Files/Parliamentarian.aspx?Item=3da57866-49d8-42d1-9f5b-c78561f67c9d&Language=E&Section=ALL
4654780,ca.proc.d.2016-03-09.17153.234,2016-03-09,106c623c-3606-40ae-a2f6-f4a619cf02f6,152,"Hon. Jason Kenney (Calgary Midnapore, CPC)",,Government Orders,Citizenship Act,,"Madam Speaker, I congratulate you on your appointment, as I congratulate the member for Surrey—Newton on his recent election back to this place.
The member repeatedly troped that a Canadian is a Canadian is a Canadian, which, of course, is true, just as it is true that a traitor who hates Canada is a traitor who hates Canada.
The member opposite can look up on YouTube a video of a Canadian citizen who went abroad to the join the genocidal terrorist organization Daesh, ISIL, in Syria. He hates Canada violently, so much so that he videotaped himself soaking his Canadian passport in gasoline, setting it on fire, and then for greater certainty, shooting it with his Kalashnikov, all the while belonging to an organization that has declared war on Canada and which seeks to kill Canadians “wherever they can be found”, according to that organization's leader, Abu Bakr al Baghdadi. 
Is it the position of the member opposite that the Government of Canada should reissue this gentleman a new passport pursuant to the adoption of the bill before us?",Conservative,Calgary Midnapore,Jason Kenney,http://www.parl.gc.ca/parlinfo/Files/Parliamentarian.aspx?Item=106c623c-3606-40ae-a2f6-f4a619cf02f6&Language=E&Section=ALL
4654781,ca.proc.d.2016-03-09.17153.235,2016-03-09,3da57866-49d8-42d1-9f5b-c78561f67c9d,422,Mr. Sukh Dhaliwal,Interjection,Government Orders,Citizenship Act,,"Madam Speaker, over many years I have had the opportunity to have discussions with the former minister of Citizenship and Immigration. He knows very well that every person in the House is strongly loyal to Canada. I am certain this is just one example that the member has given to us in the House, and I personally do not support those who are not loyal to our country. 
However, there are ways to deal with that situation, such as what the member for Vancouver East clearly said, that there are codes and the rule of the law that will deal with it. People should be punished under the law if they commit a crime. ",Liberal,Surrey--Newton,Sukh Dhaliwal,http://www.parl.gc.ca/parlinfo/Files/Parliamentarian.aspx?Item=3da57866-49d8-42d1-9f5b-c78561f67c9d&Language=E&Section=ALL
4654782,ca.proc.d.2016-03-09.17153.236,2016-03-09,eaa6694f-1e20-4aae-ad3b-e694b0e12c59,9187,"Ms. Elizabeth May (Saanich—Gulf Islands, GP)",,Government Orders,Citizenship Act,,"Madam Speaker, I want to raise two hypothetical situations for the hon. member for Surrey—Newton. 
I want to say on the record how pleased I am that the new government is bringing in Bill C-6. I wish that the Liberals would repeal Bill C-24 in its entirety.
I will give another example to the member for Calgary Midnapore, who paints the worst case. I will take that worst case and ask how does it benefit world peace and security to take someone who is dangerous and put them back in their country of origin? Would that government feel well with them? Are they barred from ever coming back to Canada?
Let me take another example. The reckless Bill C-51 passed by the previous government included offences of so-called terrorism. Part 3 of Bill C-51, which I call the “thought chill section”, deals with things placed on websites that might encourage “terrorism in general”. It could include a Che Guevara poster the way it is worded. Therefore, a person who is innocent, but might have dual citizenship, could be found guilty of a terrorism-related offence for something as innocuous as an image on a website. It is anti-democratic and wrong, and thank God the current government is bringing it down.",Green Party,Saanich--Gulf Islands,Elizabeth May,http://www.parl.gc.ca/parlinfo/Files/Parliamentarian.aspx?Item=eaa6694f-1e20-4aae-ad3b-e694b0e12c59&Language=E&Section=ALL
4654783,ca.proc.d.2016-03-09.17153.237,2016-03-09,3da57866-49d8-42d1-9f5b-c78561f67c9d,422,Mr. Sukh Dhaliwal,Interjection,Government Orders,Citizenship Act,,"Madam Speaker, I would like to thank the member for Saanich—Gulf Islands for the work she has done for Canadians, particularly on the environment file, as well as for her input in supporting what we are bringing forward on this side. 
As I said earlier about the regressive immigration policies in the Citizenship Act of the previous government, the current minister, in the first 30 days of sitting, has made a lot of progress, which I personally commend. I am sure that every person who is concerned about our Canadian values will commend the minister that we now have. ",Liberal,Surrey--Newton,Sukh Dhaliwal,http://www.parl.gc.ca/parlinfo/Files/Parliamentarian.aspx?Item=3da57866-49d8-42d1-9f5b-c78561f67c9d&Language=E&Section=ALL
