basepk,hid,speechdate,pid,opid,speakeroldname,speakerposition,maintopic,subtopic,subsubtopic,speechtext,speakerparty,speakerriding,speakername,speakerurl
4670362,ca.proc.d.2016-05-05.8899759,2016-05-05,0f7e3c8d-e579-44c0-b8b7-202b425758e4,218968,"Ms. Tracey Ramsey (Essex, NDP)",,Oral Questions,International Trade,,"Mr. Speaker, we saw the trans-Pacific partnership at the same time that the Liberals did, and that was after the campaign, after the election, after it was kept in secret by the Conservatives.
The fact is, the minister refuses to release an impact study and refuses to launch the public consultations that the Liberals promised.
The committee's work is not her own. However, we are hearing very troubling testimony. Today, RIM founder Jim Balsillie warned, “There will never be [another] large Canadian tech company under the TPP”. He has also said that Canada would be a colossal loser.
Why is the minister proceeding with a deal that will so badly damage Canada's tech sector?",New Democratic Party,Essex,Tracey Ramsey,http://www.parl.gc.ca/MembersOfParliament/ProfileMP.aspx?Key=218968&Language=E
4670363,ca.proc.d.2016-05-05.8899762,2016-05-05,3dd9162a-4763-4000-8c8a-706a788f7e50,213971,"Hon. Chrystia Freeland (Minister of International Trade, Lib.)",,Oral Questions,International Trade,,"Mr. Speaker, I am afraid that is simply not true. The NDP opposed the TPP before even reading it during the campaign. We were all there. 
We made a commitment to consult with Canadians, and that is what we are doing. Next week, I am delighted that the trade committee is actively consulting with Canadians. It will be in Montreal, Quebec City, Windsor, and Toronto. 
This is a very important national debate. It is important not to cut it short.",Liberal,University—Rosedale,Chrystia Freeland,http://www.parl.gc.ca/MembersOfParliament/ProfileMP.aspx?Key=213971&Language=E
4670364,ca.proc.d.2016-05-05.8899764,2016-05-05,78cd5419-2f3c-4798-9c5b-0e55843ef9fb,217703,"Mrs. Kelly Block (Carlton Trail—Eagle Creek, CPC)",,Oral Questions,Air Canada,,"Mr. Speaker, earlier this week, the Minister of Transport was at committee discussing his Air Canada bill. When asked by one of his own members how carrier maintenance obligations affect its competitiveness, he had no answer. Shockingly, he responded by saying, “It's a big, serious question and I don't have the answer at my fingertips..”.
If the entire purpose of this legislation is to make Air Canada more competitive, could the minister at least have done his homework before introducing this bill?",Conservative,Carlton Trail—Eagle Creek,Kelly Block,http://www.parl.gc.ca/MembersOfParliament/ProfileMP.aspx?Key=217703&Language=E
4670365,ca.proc.d.2016-05-05.8899767,2016-05-05,bc2e82f3-02f1-46e2-b9be-7d5f04ddddc9,214106,"Hon. Marc Garneau (Minister of Transport, Lib.)",,Oral Questions,Air Canada,,"Mr. Speaker, I always do my homework before I speak.
 I want to make it very clear that one of the reasons we are amending this act is not only to prevent litigation in the future, but also to allow Air Canada to have more flexibility when it is competing in a very competitive environment domestically and internationally. 
We know that by removing from Air Canada a certain obligation with respect to where it must do its maintenance, we will allow it to be more competitive. We are convinced of this, and that is why we are doing it.",Liberal,Notre-Dame-de-Grâce—Westmount,Marc Garneau,http://www.parl.gc.ca/MembersOfParliament/ProfileMP.aspx?Key=214106&Language=E
4670366,ca.proc.d.2016-05-05.8899770,2016-05-05,78cd5419-2f3c-4798-9c5b-0e55843ef9fb,217703,"Mrs. Kelly Block (Carlton Trail—Eagle Creek, CPC)",,Oral Questions,Air Canada,,"Mr. Speaker, with that answer, it is clear that the Minister of Transport still has not done his homework. 
I also asked if he could tell the committee what Air Canada's maintenance costs are, to which he responded: “No, I can't tell you what the costs are..”.
Let me try again. The minister obviously cannot explain the bill. Can he at least provide a shred of evidence to support it?",Conservative,Carlton Trail—Eagle Creek,Kelly Block,http://www.parl.gc.ca/MembersOfParliament/ProfileMP.aspx?Key=217703&Language=E
4670367,ca.proc.d.2016-05-05.8899772,2016-05-05,bc2e82f3-02f1-46e2-b9be-7d5f04ddddc9,214106,"Hon. Marc Garneau (Minister of Transport, Lib.)",,Oral Questions,Air Canada,,"Mr. Speaker, I believe that my hon. colleague is simply going on a fishing trip here. 
It is expensive for our airlines to maintain their airplanes to make sure they are very safe. It is a significant amount of their fiscal expenditures every day of the year.
We are providing Air Canada, which has over 400 airplanes, with some flexibility in deciding where it will do its maintenance while holding on to the obligation that it must do some maintenance in Ontario, Quebec, and Manitoba.",Liberal,Notre-Dame-de-Grâce—Westmount,Marc Garneau,http://www.parl.gc.ca/MembersOfParliament/ProfileMP.aspx?Key=214106&Language=E
4670368,ca.proc.d.2016-05-05.8899774,2016-05-05,75d4be3f-f1cf-499d-882b-6415247900e6,217508,"Mr. Alain Rayes (Richmond—Arthabaska, CPC)",,Oral Questions,Air Canada,,"Mr. Speaker, Quebeckers and Canadians are very concerned about the government's position on support for the aerospace industry, which is extremely important to our economy.
When we recently asked the Minister of Transport why he had pushed through Bill C-10 under a gag order, he said that it was to make Air Canada more competitive.
Will the minister finally admit that he is leaving the door wide open for Air Canada to sacrifice good-quality jobs here in Canada?",Conservative,Richmond—Arthabaska,Alain Rayes,http://www.parl.gc.ca/MembersOfParliament/ProfileMP.aspx?Key=217508&Language=E
4670369,ca.proc.d.2016-05-05.8899777,2016-05-05,bc2e82f3-02f1-46e2-b9be-7d5f04ddddc9,214106,"Hon. Marc Garneau (Minister of Transport, Lib.)",,Oral Questions,Air Canada,,"Not at all, Mr. Speaker.
Because Quebec and Manitoba decided to drop their lawsuit against Air Canada, we were able to make amendments to the Air Canada Public Participation Act, through Bill C-10. That is what we are doing.
However, I remind my colleague that Air Canada is still required to perform maintenance in Ontario, Quebec, and Manitoba.",Liberal,Notre-Dame-de-Grâce—Westmount,Marc Garneau,http://www.parl.gc.ca/MembersOfParliament/ProfileMP.aspx?Key=214106&Language=E
4670370,ca.proc.d.2016-05-05.8899779,2016-05-05,75d4be3f-f1cf-499d-882b-6415247900e6,217508,"Mr. Alain Rayes (Richmond—Arthabaska, CPC)",,Oral Questions,Air Canada,,"Mr. Speaker, if shipping the maintenance jobs out of the country is going to make Air Canada more competitive, I have some serous concerns about how the Liberals are handling this file.
While Quebec's economy minister has urged the government to take its time with its bill, the Minister of Transport seems to be in a real hurry to shut down debate for reasons that he himself cannot explain. There really is something fishy going on. 
Can the minister clarify his position and explain why he was in such a hurry to shut down debate? ",Conservative,Richmond—Arthabaska,Alain Rayes,http://www.parl.gc.ca/MembersOfParliament/ProfileMP.aspx?Key=217508&Language=E
4670371,ca.proc.d.2016-05-05.8899782,2016-05-05,bc2e82f3-02f1-46e2-b9be-7d5f04ddddc9,214106,"Hon. Marc Garneau (Minister of Transport, Lib.)",,Oral Questions,Air Canada,,"Mr. Speaker, on the contrary, I am in no hurry. In fact, I will speak very slowly to explain to my colleague.
We decided to change the legislation through Bill C-10, as I have been saying from the beginning, because the governments of Quebec and Manitoba decided to drop their lawsuit against Air Canada. This gives us the opportunity to clarify the legislation and give Air Canada more flexibility in making decisions regarding the maintenance of its planes.",Liberal,Notre-Dame-de-Grâce—Westmount,Marc Garneau,http://www.parl.gc.ca/MembersOfParliament/ProfileMP.aspx?Key=214106&Language=E
4670372,ca.proc.d.2016-05-05.8899786,2016-05-05,3176068f-62ee-4b2f-aacd-1131201c6db1,214707,The Speaker,,Oral Questions,Air Canada,,"As members know, disagreements in this place are to be expected, but members' comments must remain respectful.
The hon. member for South Okanagan—West Kootenay.",Liberal,Halifax West,Geoff Regan,http://www.parl.gc.ca/MembersOfParliament/ProfileMP.aspx?Key=214707&Language=E
4670373,ca.proc.d.2016-05-05.8899787,2016-05-05,85738a00-0a16-4a6f-89c7-9f045782d1fd,217331,"Mr. Richard Cannings (South Okanagan—West Kootenay, NDP)",,Oral Questions,Post-Secondary Education,,"Mr. Speaker, ever since the old Liberals slashed billions in funding for post-secondary education, the cost of tuition has skyrocketed. Now, according to the parliamentary budget officer, a majority of Canadian students are from higher-income families.
The PBO also said that a majority of federal funding is benefiting these same wealthy families and the Liberals' recent budget will not significantly change the situation.
The Liberals claim to help the middle class, but they are actually doing the opposite. Why do they not help all students to get a good, quality education?",New Democratic Party,South Okanagan—West Kootenay,Richard Cannings,http://www.parl.gc.ca/MembersOfParliament/ProfileMP.aspx?Key=217331&Language=E
4670374,ca.proc.d.2016-05-05.8899791,2016-05-05,5d3dfa7b-f157-4019-ac2a-4dab0cb15f92,213961,"Hon. Bill Morneau (Minister of Finance, Lib.)",,Oral Questions,Post-Secondary Education,,"Mr. Speaker, that is exactly what we are doing in budget 2016. We are helping 250,000 lower-income Canadian students with grants that are going from $2,000 to $3,000, which is a 50% increase. We are helping another 100,000 middle-income Canadian students, going from $800 to $1,200, which is a 50% increase. We are making an enormous difference for the students of today. We know that is going to help us today, and tomorrow.",Liberal,Toronto Centre,Bill Morneau,http://www.parl.gc.ca/MembersOfParliament/ProfileMP.aspx?Key=213961&Language=E
4670375,ca.proc.d.2016-05-05.8899793,2016-05-05,08f8d23a-fbea-4e7b-ba41-34c9f62dde9e,214056,"Ms. Anne Minh-Thu Quach (Salaberry—Suroît, NDP)",,Oral Questions,Post-Secondary Education,,"Mr. Speaker, the minister just does not get it. The parliamentary budget officer's report confirms today that federal measures to foster access to post-secondary education primarily benefit students from high-income families, and the announcements in budget 2016 will change nothing. 
We have also learned that the government spends less on post-secondary education for indigenous students. Furthermore, almost 40% of students are more than $25,000 in debt by the time they graduate.
The government says that it wants to help Canadian youth and the less well-off to join the middle class. Then what is it waiting for to make post-secondary education accessible to everyone?",New Democratic Party,Salaberry—Suroît,Anne Minh-Thu Quach,http://www.parl.gc.ca/MembersOfParliament/ProfileMP.aspx?Key=214056&Language=E
4670376,ca.proc.d.2016-05-05.8899796,2016-05-05,5d3dfa7b-f157-4019-ac2a-4dab0cb15f92,213961,"Hon. Bill Morneau (Minister of Finance, Lib.)",,Oral Questions,Post-Secondary Education,,"Mr. Speaker, on the contrary, we understand exactly the problems faced by students today. That is why we included some measures in budget 2016 to help them.
For example, we are going to increase grants by 50%, from $2,000 to $3,000, for 250,000 students. Grants for middle-income students will increase from $800 to $1,200. That is a big change for them and for the country. ",Liberal,Toronto Centre,Bill Morneau,http://www.parl.gc.ca/MembersOfParliament/ProfileMP.aspx?Key=213961&Language=E
4670377,ca.proc.d.2016-05-05.8899798,2016-05-05,101111c4-d4b7-46a9-9f88-9bfa542bb606,215937,"Mr. David de Burgh Graham (Laurentides—Labelle, Lib.)",,Oral Questions,Canada Post,,"Mr. Speaker, Canada Post provides important services for my constituents in Laurentides—Labelle and for all Canadians.
All across the country, people are dismayed at the lack of respect and service cuts that the previous Conservative government imposed on Canada Post. In rural ridings like mine, these impacts are even more noticeable. 
During the last election, the Liberal Party committed to a comprehensive review of the crown corporation. Would the minister responsible for Canada Post please update this House on the status of that review?",Liberal,Laurentides—Labelle,David Graham,http://www.parl.gc.ca/MembersOfParliament/ProfileMP.aspx?Key=215937&Language=E
4670378,ca.proc.d.2016-05-05.8899802,2016-05-05,669a6720-3704-48ff-a218-4035d05107a6,214324,"Hon. Judy Foote (Minister of Public Services and Procurement, Lib.)",,Oral Questions,Canada Post,,"Mr. Speaker, the Government of Canada promised Canadians that they would have a say in the service that Canada Post provided.
 Today, we are keeping that promise. Today I announced an independent review of Canada Post. 
The review will be a two-phase process, which will be completed by the end of this year.
An independent task force will prepare a discussion paper that presents viable options for Canada Post, following which a parliamentary committee will consult with Canadians from coast to coast to coast. We are encouraging all members of the public to take part in this very important review.",Liberal,Bonavista—Burin—Trinity,Judy Foote,http://www.parl.gc.ca/MembersOfParliament/ProfileMP.aspx?Key=214324&Language=E
4670379,ca.proc.d.2016-05-05.8899807,2016-05-05,febe5b3f-1a40-472b-873d-11be938a0e59,216676,"Hon. Gerry Ritz (Battlefords—Lloydminster, CPC)",,Oral Questions,Ministerial Expenses,,"Mr. Speaker, the House leader is once again being thrown under the bus by his friends on the front bench. He has turned himself into a human pretzel trying to defend the justice minister's questionable fundraising, and he is now assuming the position for the trade minister and her Hollywood agreements.
Will the trade minister finally table those agreements, or is she prepared to pay for the ongoing House leader's chiropractic treatments with her own money?",Conservative,Battlefords—Lloydminster,Gerry Ritz,http://www.parl.gc.ca/MembersOfParliament/ProfileMP.aspx?Key=216676&Language=E
4670380,ca.proc.d.2016-05-05.8899810,2016-05-05,3dd9162a-4763-4000-8c8a-706a788f7e50,213971,"Hon. Chrystia Freeland (Minister of International Trade, Lib.)",,Oral Questions,Ministerial Expenses,,"Mr. Speaker, it is my job to promote Canada to the world. That is what I did in California, meeting with business leaders, cultural leaders, and the international media.
The Conservatives oppose the positive message that I delivered on television about Syrian refugees, and to the LA Times about reducing income inequality. I was proud to do it, and I would do it again.
The Conservatives' failure on these issues is why Canadians rejected their government last fall and why they are sitting on that side of the House.",Liberal,University—Rosedale,Chrystia Freeland,http://www.parl.gc.ca/MembersOfParliament/ProfileMP.aspx?Key=213971&Language=E
4670381,ca.proc.d.2016-05-05.8899812,2016-05-05,febe5b3f-1a40-472b-873d-11be938a0e59,216676,"Hon. Gerry Ritz (Battlefords—Lloydminster, CPC)",,Oral Questions,Ministerial Expenses,,"Mr. Speaker, the reality is that the minister's marketing is working so well that the trade numbers of the U.S. are down by 6.3% in March alone.
The question is simple. Did the trade minister mislead the House leader? That is just not cool.
Will the House leader stand in his place and apologize for not being the House leader but for being the House “mis-leader”?",Conservative,Battlefords—Lloydminster,Gerry Ritz,http://www.parl.gc.ca/MembersOfParliament/ProfileMP.aspx?Key=216676&Language=E
4670382,ca.proc.d.2016-05-05.8899815,2016-05-05,3dd9162a-4763-4000-8c8a-706a788f7e50,213971,"Hon. Chrystia Freeland (Minister of International Trade, Lib.)",,Oral Questions,Ministerial Expenses,,"Mr. Speaker, here is one of the things I said on TV during that visit: “I think it is incredibly important, particularly...after the Paris attacks, particularly now with [the Islamic State in Iraq and Syria] raging around the world, to stand up for real diversity and to say our diversity is our strength.”
Now, more than ever, the Conservatives should be joining us in speaking up for our belief in diversity around the world, including in the United States.",Liberal,University—Rosedale,Chrystia Freeland,http://www.parl.gc.ca/MembersOfParliament/ProfileMP.aspx?Key=213971&Language=E
4670383,ca.proc.d.2016-05-05.8899817,2016-05-05,27d8ca3d-1740-41b6-872b-6ceb646cdd31,224217,"Mr. Scott Reid (Lanark—Frontenac—Kingston, CPC)",,Oral Questions,Democratic Reform,,"Mr. Speaker, yesterday the Prime Minister said, “We are in discussions with the other parties” to set up a committee on electoral reform. He explained that the reason why it has not yet been struck is entirely the fault of the Conservatives and the NDP, since both parties will not give consent without unreasonable preconditions. This whole process is imaginary. I have met with the relevant minister exactly twice in six months, once in December at my request, and once at a breakfast, where she sat at my table for less than 10 minutes. My NDP homologue says it is the same thing with him.
Why did the Prime Minister just invent this patently false story about opposition delay?",Conservative,Lanark—Frontenac—Kingston,Scott Reid,http://www.parl.gc.ca/MembersOfParliament/ProfileMP.aspx?Key=224217&Language=E
4670384,ca.proc.d.2016-05-05.8899823,2016-05-05,b8c04eca-f237-48a8-8975-374ccd40d1a9,214115,"Right Hon. Justin Trudeau (Prime Minister, Lib.)",,Oral Questions,Democratic Reform,,"Mr. Speaker, I apologize through you to the member in the House. We are engaged in many different processes. We know how important electoral reform is and how passionately members of the House feel about it. I look forward to ensuring that we get moving on this committee in short order.",Liberal,Papineau,Justin Trudeau,http://www.parl.gc.ca/MembersOfParliament/ProfileMP.aspx?Key=214115&Language=E
4670385,ca.proc.d.2016-05-05.8899830,2016-05-05,27d8ca3d-1740-41b6-872b-6ceb646cdd31,224217,"Mr. Scott Reid (Lanark—Frontenac—Kingston, CPC)",,Oral Questions,Democratic Reform,,"Mr. Speaker, the Prime Minister repeated this three times, so I hope we will get three apologies from him.
He said, “there are ongoing discussions with the other parties...”, which is false. He said there are ongoing discussions on “the mandate” engaged with that committee, which is also false. And, he said, “We are in discussion with the other parties about how to set up that committee..”.
This is where I tell the PM that even in the world of quantum computing, the non-binary repetition of an untrue statement does not make it true. So why—",Conservative,Lanark—Frontenac—Kingston,Scott Reid,http://www.parl.gc.ca/MembersOfParliament/ProfileMP.aspx?Key=224217&Language=E
4670386,ca.proc.d.2016-05-05.8899852,2016-05-05,3176068f-62ee-4b2f-aacd-1131201c6db1,214707,The Speaker,,Oral Questions,Democratic Reform,,"After we finish enjoying the joke, we will hear from the hon. Minister of Democratic Institutions.",Liberal,Halifax West,Geoff Regan,http://www.parl.gc.ca/MembersOfParliament/ProfileMP.aspx?Key=214707&Language=E
4670387,ca.proc.d.2016-05-05.8899859,2016-05-05,60df4944-d66b-4133-a348-2bcde37c8752,214191,"Hon. Maryam Monsef (Minister of Democratic Institutions, Lib.)",,Oral Questions,Democratic Reform,,"Mr. Speaker, I would like to remind all members of the House that my door is always open. We will deliver on our commitment to modernize our electoral system. We will deliver on that promise just as the Prime Minister delivered on our promise to reinstate the long-form census and return to evidence-based decision-making, just like he made good on his commitment to bring forward a gender-balanced cabinet, and just as he made good on his promise to introduce a merit-based, independent appointment process for appointing senators.
I am confident—",Liberal,Peterborough—Kawartha,Maryam Monsef,http://www.parl.gc.ca/MembersOfParliament/ProfileMP.aspx?Key=214191&Language=E
4670388,ca.proc.d.2016-05-05.8900258,2016-05-05,3176068f-62ee-4b2f-aacd-1131201c6db1,214707,The Speaker,,Oral Questions,Democratic Reform,,The hon. member for Hochelaga.,Liberal,Halifax West,Geoff Regan,http://www.parl.gc.ca/MembersOfParliament/ProfileMP.aspx?Key=214707&Language=E
4670389,ca.proc.d.2016-05-05.8899881,2016-05-05,a710e2c4-20f9-4df8-ba6c-2dc50c03bb75,217321,"Ms. Marjolaine Boutin-Sweet (Hochelaga, NDP)",,Oral Questions,Housing,,"Mr. Speaker, 65% of federal funding to fight homelessness is allocated to the housing first approach. That leaves only 35% of the funding for the homelessness partnering strategy for other types of intervention, including prevention.
Crisis centres are having to close beds for lack of funding. Quebec is pleading for a return to a general homelessness strategy. This week, I introduced two bills; the first is on recognizing the right to housing, and the second aims to establish a national housing strategy.
Will the government support these bills so that people no longer end up in the street? Will the government respect Quebec's wishes? ",New Democratic Party,Hochelaga,Marjolaine Boutin-Sweet,http://www.parl.gc.ca/MembersOfParliament/ProfileMP.aspx?Key=217321&Language=E
4670390,ca.proc.d.2016-05-05.8899899,2016-05-05,d67a49c2-65bd-411e-8bb4-29ff759c5829,214003,"Hon. Jean-Yves Duclos (Minister of Families, Children and Social Development, Lib.)",,Oral Questions,Housing,,"Mr. Speaker, I thank my colleague for her question and her interest in this issue that is so very important to us.
In fact, in budget 2016 we announced an investment of 50%, the first since 1999. This means an increase of $50 million a year for the next two years to support the fight against homelessness in our communities.
I am also pleased to say that I am listening to our partners and the provinces and territories and I am working with them to ensure that this is addressed properly.",Liberal,Québec,Jean-Yves Duclos,http://www.parl.gc.ca/MembersOfParliament/ProfileMP.aspx?Key=214003&Language=E
4670391,ca.proc.d.2016-05-05.8899902,2016-05-05,3c3ee442-a873-4845-84d0-7da07a66ce61,224180,"Mr. Alexandre Boulerice (Rosemont—La Petite-Patrie, NDP)",,Oral Questions,Quebec,,"Mr. Speaker, this is what happens when we need the Liberals from Quebec: “Hello. You have reached the Liberal Party. All our members are currently hiding. Please stay on the line. Your call is important to us.”
Can someone tell me what good the 40 Liberal members from Quebec are? They are no good. They are giving up 1,800 Air Canada jobs. They are betraying dairy farmers. They are ignoring everyone in Lac-Mégantic. They have forgotten about the unemployed, Canada Post, and the French language. 
Is the Liberal Party's Quebec lieutenant asleep at the switch?",New Democratic Party,Rosemont—La Petite-Patrie,Alexandre Boulerice,http://www.parl.gc.ca/MembersOfParliament/ProfileMP.aspx?Key=224180&Language=E
4670392,ca.proc.d.2016-05-05.8899906,2016-05-05,bc2e82f3-02f1-46e2-b9be-7d5f04ddddc9,214106,"Hon. Marc Garneau (Minister of Transport, Lib.)",,Oral Questions,Quebec,,"Mr. Speaker, I believe my colleague's comments got off track. 
The reality is that we are very proud of the 40 Liberal members from Quebec, who represent the interests of our province.",Liberal,Notre-Dame-de-Grâce—Westmount,Marc Garneau,http://www.parl.gc.ca/MembersOfParliament/ProfileMP.aspx?Key=214106&Language=E
4670393,ca.proc.d.2016-05-05.8899912,2016-05-05,9225dd6b-e672-44d5-8bb7-c634b7e72f2e,218569,"Hon. Michelle Rempel (Calgary Nose Hill, CPC)",,Oral Questions,"Immigration, Refugees and Citizenship",,"Mr. Speaker, six months ago the Liberals claimed they would “immediately” lift the Mexican visa requirement. Today, Liberals and officials confirmed that a standard evidence-based formal review had not been completed. Moreover, they confirmed that Mexico did not meet certain factors required to lift the visa requirements.
 Given this, at the upcoming three amigos meeting, will the Prime Minister publicly admit that he knows the exemption will not in fact be immediately lifted?",Conservative,Calgary Nose Hill,Michelle Rempel,http://www.parl.gc.ca/MembersOfParliament/ProfileMP.aspx?Key=218569&Language=E
4670394,ca.proc.d.2016-05-05.8899930,2016-05-05,826dc268-dbda-48fa-ae4a-eefebd5716e1,214209,"Hon. John McCallum (Minister of Immigration, Refugees and Citizenship, Lib.)",,Oral Questions,"Immigration, Refugees and Citizenship",,"Mr. Speaker, I can assure the hon. member that we are all convinced that our commitment to lift the visa for Mexico will indeed provide major economic benefits in tourism as well as a stronger partnership with our second North American partner.
 That being said, I am working with my colleague, the Minister of Public Safety, to ensure we mitigate any risks arising from irregular immigration that could arise from this policy change.",Liberal,Markham—Thornhill,John McCallum,http://www.parl.gc.ca/MembersOfParliament/ProfileMP.aspx?Key=214209&Language=E
