basepk,hid,speechdate,pid,opid,speakeroldname,speakerposition,maintopic,subtopic,subsubtopic,speechtext,speakerparty,speakerriding,speakername,speakerurl
4685886,ca.proc.d.2016-10-31.9203218,2016-10-31,7f01c656-5f94-4743-9018-ad3a89bb2fc4,217214,"Ms. Brigitte Sansoucy (Saint-Hyacinthe—Bagot, NDP)",,Private Members' Business,Poverty Reduction Act,," moved that Bill C-245, An Act concerning the development of a national poverty reduction strategy in Canada, be read the second time and referred to a committee.
Mr. Speaker, none of my Saint-Hyacinthe—Bagot constituents were surprised when I introduced Bill C-245 concerning a national poverty reduction strategy. I have worked for community organizations in various capacities and been involved in groups, associations, and cooperatives, so they know that I have always been driven by a desire to reduce poverty in our community. 
In choosing to introduce this bill, I have chosen to build on the work of Ed Broadbent. In 1989, he got the House to unanimously approve a motion to eliminate child poverty. I am also building on the work of Tony Martin, a member who was dedicated to laying the groundwork for this bill and working out how best to develop such a strategy. He held consultations and met with anti-poverty groups across Canada. Jean Crowder and several of my other colleagues in the House also took up the torch and fought for this kind of bill.
I would also like to thank all the organizations and individuals across this country who have expressed their support for my bill since I introduced it at first reading on February 26, 2016. I am very proud to have the support of several Canadian anti-poverty organizations.
Federal leadership is needed to reduce poverty. Canada has signed international human rights treaties that require us to make very clear commitments to guarantee each and every Canadian citizen the right to a decent standard of living. Poverty reduction is a non-partisan issue. Every member in the House represents a riding in which poverty is a reality. We all witness this when we return to our ridings. Every time I travel around my riding, Saint-Hyacinthe—Bagot, I see poverty on the faces of all kinds of people, including children, families, people who live alone, and seniors. When I meet with anti-poverty organizations in Saint-Hyacinthe—Bagot, I see how hard they are working on the ground to distribute food and clothing to help all those families.
It costs more to do nothing about poverty than it does to address it. We can do something to reduce poverty. Poverty greatly hinders both individual and community development. Grocery store and retail store owners in Saint-Hyacinthe—Bagot tell me that they are also concerned about the growing gap between the rich and the poor. When wealth is concentrated in the hands of one group, the purchasing power of regular Canadians keeps diminishing. That is what store owners in my riding are talking to me about. They tell me that they are still struggling to recover from the 2008 economic crisis because too many people continue to get poorer.
Another growing problem these days is that some people are working 40 hours a week and are still poor. Youth employment is increasingly precarious. A third of all young people have part-time employment. The use of food banks is the ultimate proof. Representatives from the Moisson Maskoutaine food bank in my riding tell me that they are seeing a growing number of workers using food banks such as Accueil Fraternel, in Saint-Hyacinthe, or the soup kitchen in Acton Vale. More and more workers need food aid. We also see many immigrants using food aid.
In some Canadian communities the cost of living, including rent and food, is high. We have to put in place a strong social and economic safety net because poverty affects everyone. We should all be concerned by the fact that, in a country as rich as ours, inequality is growing and worrisome.
In this bill I am presenting a very comprehensive poverty reduction strategy. As I mentioned, over the past decade there have been many consultations that have led to the plan put forward by this bill. This bill focuses on our obligation to produce results, not the means. All members of the House should therefore focus on the poverty reduction goal we want to achieve. Voting for this bill at second reading stage will ensure it is referred to the Standing Committee on Human Resources, Skills and Social Development and the Status of Persons with Disabilities.
The committee has undertaken a study on poverty that will wrap up next June. By adopting this bill at second reading, the ideas it contains can be discussed at the Standing Committee on Human Resources, Skills and Social Development and the Status of Persons with Disabilities. I will be a member of the committee studying poverty until June, since I am replacing my colleague from Churchill—Keewatinook Aski who usually sits on the committee. Some witnesses have already appeared and presented other tools that are consistent with the objective of this bill. Let us at least give ourselves the opportunity to use the ideas in the bill as the basis for the discussions that will take place at the committee and compare them to other ideas that will be presented so that we can make the best possible recommendations when we table our report.
As I said earlier, in 1989, the House unanimously adopted a motion to eliminate child poverty. In 2009, the House of Commons reaffirmed its desire to reduce poverty. We are now at the point where we need more than empty words. We need to establish a real strategy. Establishing a strategy means setting goals: where do we want to be in five or 10 years when it comes to reducing poverty? We also need mechanisms to measure poverty. Right now, in Canada, we still have not agreed on an official definition of poverty. We still have not established how to measure poverty. If we want to be able to see how well a program to eliminate poverty is working from year to year, we have to have mechanisms to measure progress and determine whether poverty has been reduced or not.
That is what my bill proposes. Let us develop mechanisms for measuring poverty so that, year after year, we can take steps toward reducing it. My bill would also add social condition to the Canadian Human Rights Act. We know that poverty is a ground for discrimination, but right now it is not in the list of prohibited grounds of discrimination.
We need mechanisms and indicators, but the most important point that this bill makes is that we, the federal government, need to show leadership in order to reduce poverty, but we cannot do it alone. We need to work with community organizations.
In my riding, like in those of my colleagues, day after day, community organizations work to reduce poverty by giving people food and clothing and helping families in need. In Saint-Hyacinthe, we even have the Fonds d’aide Optimiste, which helps children participate in sports so that poor children can take part in these activities, just like their friends do.
Community organizations in our ridings are doing what needs to be done. They are also working to tackle poverty at its roots because we have to focus not just on the consequences, though that is part of it, but also on the causes. We have to work with these community organizations and truly partner with them. 
Municipalities have to be partners in our poverty reduction strategy too. We know they are responsible for providing social housing. In Saint-Hyacinthe, there are 200 households on the waiting list for social housing. I am sure that MPs who meet with these organizations in their ridings will hear about households waiting for social housing. Food banks and soup kitchens cannot meet the demand. Municipalities are putting strategies in place to ensure their services and activities are available to everyone.
We have to partner with the provinces too. Many provinces, including Quebec, already have poverty elimination strategies. Other provinces tell us that Quebec's strategy is a model. Provinces that do not have strategies are thinking of adopting them, and all provinces are urging the federal government to develop its own poverty reduction strategy so we can coordinate our efforts and work better together. That is what it will take to reduce poverty.
Education is a big part of the conversation about poverty, so the provinces are involved at that level too. No child should come to school with an empty stomach. Children's academic performance should not suffer because they move too often or are worried about a parent having lost a job. Such children are less likely than others to graduate or go on to university. Those are some of the effects of poverty, and we have to work with the provinces to tackle the causes of poverty.
Children raised in poverty require more support, and there are costs associated with that. I talked about this earlier. It will be more expensive in the long run to not address poverty and let it persist. Poverty also means more health care costs, as many studies have shown. People living in poverty are ill more often and have a hard time paying for their medication.
Although I represent Quebec's agri-food capital, we still have food deserts, that is, areas where people have little or no access to fresh fruits and vegetables within walking distance. Unfortunately, some people have to get some of their groceries at Dollarama, and that is unacceptable. Everyone knows how important nutrition is to health, so we need to take action on this.
There are too many statistics right now that should frighten us. Having one in seven people living in poverty in Canada is unacceptable. We have a duty to act. The poverty rate is higher in Canada than in the other OECD countries.
When talking about poverty rates, we need to see the face of poverty. For instance, 15% of the children in my riding live in poverty, and among indigenous people, it is one out of every two children. In addition, 6% of seniors in Canada live in poverty, and 63% of low-income, single seniors are women. The median income for seniors in Quebec is $20,200 for those aged 65 to 74, and for those 75 or over it is less than $20,000. There are real people behind the statistics. Lastly, the median income for indigenous people is even less. As for immigrants, they are twice as likely to find themselves living in poverty.
In closing, we must pass this bill at second reading so it can be studied by the Standing Committee on Human Resources, Skills and Social Development and the Status of Persons with Disabilities.
We have to think of the faces of poverty in our ridings.
I will close with a quote by Nelson Mandela:
 Like slavery and apartheid, poverty is not natural. It is man-made and it can be overcome and eradicated by the actions of human beings. Overcoming poverty is not a gesture of charity. It is an act of justice. It is the protection of a fundamental human right, the right to dignity and a decent life. 
Together we can make a difference.",New Democratic Party,Saint-Hyacinthe—Bagot,Brigitte Sansoucy,http://www.parl.gc.ca/MembersOfParliament/ProfileMP.aspx?Key=217214&Language=E
4685887,ca.proc.d.2016-10-31.9203283,2016-10-31,07cf5767-802c-406c-92a7-7dc92af79b40,214668,"Mr. Kevin Lamoureux (Parliamentary Secretary to the Leader of the Government in the House of Commons, Lib.)",,Private Members' Business,Poverty Reduction Act,,"Madam Speaker, I appreciate the comments of the member. She talks a great deal on the issue of poverty and income inequality.
When we look at the past year, particularly at the last budget that was presented, we saw probably the most profound and significant movement toward more equality in income. We saw that in the increase in taxes for Canada's wealthiest. We saw a substantial decrease for Canada's middle class. We saw a huge increase in the Canada child benefit, a redistribution of wealth that I would argue has not been seen for many years.
Could the member provide comment on the last federal budget and its contribution to the redistribution of wealth? Can she think of another budget that has done as much for Canada's poor?",Liberal,Winnipeg North,Kevin Lamoureux,http://www.parl.gc.ca/MembersOfParliament/ProfileMP.aspx?Key=214668&Language=E
4685888,ca.proc.d.2016-10-31.9203286,2016-10-31,7f01c656-5f94-4743-9018-ad3a89bb2fc4,217214,Ms. Brigitte Sansoucy,,Private Members' Business,Poverty Reduction Act,,"Madam Speaker, what this bill is saying is that it is nice to include poverty reduction measures in the budget, but the problem is that we cannot measure poverty. 
Researchers who appeared before the Standing Committee on Human Resources, Skills and Social Development and the Status of Persons with Disabilities told us that they did not have any data.
According to the Minister of Families, Children and Social Development, the new Canada child benefit will reduce poverty. However, there is currently no data available to verify and validate that.
My bill will give us the mechanisms to help us back up our claims that we are reducing poverty.",New Democratic Party,Saint-Hyacinthe—Bagot,Brigitte Sansoucy,http://www.parl.gc.ca/MembersOfParliament/ProfileMP.aspx?Key=217214&Language=E
4685889,ca.proc.d.2016-10-31.9203290,2016-10-31,6e88c64b-66df-4989-84da-2a037744909c,216991,"Mr. Jamie Schmale (Haliburton—Kawartha Lakes—Brock, CPC)",,Private Members' Business,Poverty Reduction Act,,"Madam Speaker, I appreciate the hon. member's words. I think we all in this House want to tackle poverty.
The member mentioned a few things in her speech about the problem around poverty, but the system we have is that the government needs to do more. More government to solve the problem that government cannot do confuses me.
If the hon. member wants to eradicate poverty, maybe the NDP should not adopt policies that put people out of work, take more off their paycheques, and put businesses out of business. We all know that small businesses hire people. What happens when they leave? Business close up and we have blight. Blight moves in.
Instead of more taxes, more government regulation, maybe we should see less of that. I would like to hear her comments.",Conservative,Haliburton—Kawartha Lakes—Brock,Jamie Schmale,http://www.parl.gc.ca/MembersOfParliament/ProfileMP.aspx?Key=216991&Language=E
4685890,ca.proc.d.2016-10-31.9203297,2016-10-31,7f01c656-5f94-4743-9018-ad3a89bb2fc4,217214,Ms. Brigitte Sansoucy,,Private Members' Business,Poverty Reduction Act,,"Madam Speaker, I thank my colleague for the question.
I am sure that all hon. members would like to see full employment in the medium and long terms.
I have worked with troubled teenagers who wanted to change their situation. We all want everyone to have a job that values them, gives them a sense of pride, and gives them a place in our society. However, we are not there. Until then, the government has a role to play in ensuring that all the mechanisms are in place to give every individual an opportunity to improve their economic situation.
I personally think that spending this money now will enable us to save in the medium and long terms.
Doing nothing about poverty will cost us twice as much as doing something. This has been proven.",New Democratic Party,Saint-Hyacinthe—Bagot,Brigitte Sansoucy,http://www.parl.gc.ca/MembersOfParliament/ProfileMP.aspx?Key=217214&Language=E
4685891,ca.proc.d.2016-10-31.9203308,2016-10-31,a710e2c4-20f9-4df8-ba6c-2dc50c03bb75,217321,"Ms. Marjolaine Boutin-Sweet (Hochelaga, NDP)",,Private Members' Business,Poverty Reduction Act,,"Madam Speaker, what my colleague from Saint-Hyacinthe—Bagot is proposing today is that we develop an integrated strategy to eliminate poverty rather than working in a silo.
I would like my colleague to comment briefly on what advantages an integrated strategy would have over small projects here and there.",New Democratic Party,Hochelaga,Marjolaine Boutin-Sweet,http://www.parl.gc.ca/MembersOfParliament/ProfileMP.aspx?Key=217321&Language=E
4685892,ca.proc.d.2016-10-31.9203312,2016-10-31,7f01c656-5f94-4743-9018-ad3a89bb2fc4,217214,Ms. Brigitte Sansoucy,,Private Members' Business,Poverty Reduction Act,,"Madam Speaker, I think that reality shows us what those advantages are. For too long, we have been working in a silo when it comes to reducing poverty. The proof that it is not working is that, today, the gap between the rich and poor is still growing. We have more and more poor people. 
I think it is important to work together with community organizations, the municipalities, and the provinces, but it is also important to have an interdepartmental vision when it comes to eliminating poverty. ",New Democratic Party,Saint-Hyacinthe—Bagot,Brigitte Sansoucy,http://www.parl.gc.ca/MembersOfParliament/ProfileMP.aspx?Key=217214&Language=E
4685893,ca.proc.d.2016-10-31.9203316,2016-10-31,ee06377a-6024-40ae-9fe4-a059508592a4,215951,"Mr. Wayne Long (Saint John—Rothesay, Lib.)",,Private Members' Business,Poverty Reduction Act,,"Madam Speaker, I am very proud and feel privileged to rise today to speak about Bill C-245. 
As members know, I am from the riding of Saint John—Rothesay, which is in southern New Brunswick. I am very proud of that riding. It is a riding with many success stories, but it also has many challenges that beget opportunities on the poverty front.
This is why I feel privileged to speak to the private member's bill put forward by my colleague from Saint-Hyacinthe—Bagot. I would like to thank the member for her leadership and for taking a stand on poverty reduction.
I had the opportunity to meet with my colleague face to face last week, and we talked about poverty, a national poverty reduction strategy, and our passion about helping those in need. We are both very aligned and agree that the federal government can lead the way in a national poverty reduction strategy. I look forward to working with the member hand in hand to help our government come up with the proper strategy.
Our government is working hard to reduce poverty from coast to coast to coast. When a colleague, especially one who is sitting on the other side of the House, rises to show the same dedication as we have, it is very encouraging. A big part of Bill C-245 is in tune with our agenda and with what we are aiming for, which is an inclusive society where everyone will be able to take part to the fullest. 
For those who are not familiar with piece of legislation, I will explain what it is.
Bill C-245 is also known as the poverty reduction act. This act will provide not only for the development and implementation of a national strategy to reduce poverty in Canada, but also for the appointment of an independent poverty reduction commissioner. As well, it would amend the Canadian Human Rights Act, to add “social condition” as a prohibited ground of discrimination. Finally, it would amend the Department of Employment and Social Development Act to establish a national council on poverty elimination and social inclusion.
This government is in agreement that we must reduce social inequality and build stronger communities. Today, it is hard to believe that there are more three million Canadians who are living in poverty. This is clearly unacceptable.
Let us take the year 2014, as an example, and look at some numbers from Statistics Canada. The figures show that 8.8% of the Canadian population lived in low income in 2014. In 2014, 8.5% of children aged 17 and under lived in low income. 
Let us not forget seniors, because 1.3% of seniors in families lived in low income, and the rate for those living by themselves was close to 11.3%. Speaking of seniors, we have to keep in mind that they will account for close to one-quarter of our country's population by the year 2030, which is a staggering number.
When we look at this picture, we realize that the clock is ticking. As a government, as members of Parliament, we all need to work together. We need to act now on poverty reduction. We need to draw on the efforts of all Canadians to address these social and economic challenges, which is clearly reflected in Bill C-245.
The bill states that a national poverty reduction strategy must encourage the participation of Canadians, nonprofit organizations, and private sector suppliers in an effort to reduce poverty. We could not agree more.
 Bill C-245 shows an understanding that the face of poverty is changing. Many groups are affected. I am thinking about youth, children, indigenous people, women fleeing from violence, veterans, and people living with a disability.
Bill C-245 states that a national poverty reduction strategy must take some specific factors into account. Here, I am talking about the way that poverty affects different genders, the specific needs of urban, rural, and remote communities, as well as the factors that put some individuals at higher than average risk of poverty. 
On that last note, Bill C-245 does mention factors such as indigenous status, single parenthood, low-wage and precarious employment, immigration, lack of education, and prolonged illness and disability. In addition to all of that, Bill C-245 acknowledges that several provinces and some municipalities have either implemented or are delivering poverty reduction strategies. That is good news. Real work has been done here.
 Now that we have looked at this piece of legislation more closely, we see how in tune it is with what our government is already doing to reduce poverty in Canada. For example, there is the Canada poverty reduction strategy, which Employment and Social Development Canada is currently working on. This strategy will support and be aligned with those that already exist at the provincial and municipal levels. It is clear and extremely important that all three levels of government are aligned and work together to reduce poverty across our country.
We will work in collaboration with our partners. They include all Canadians, all levels of government, non-profit organizations, academics, the private sector, and, of course, people who have experienced or who are experiencing poverty. It is absolutely crucial that we involve those on the front lines and those experiencing poverty across our country. This problem will not be solved from the top down. 
In fact, the Minister of Families, Children and Social Development recently appeared before the Standing Committee on Human Resources, Skills and Social Development and the Status of Persons with Disabilities, also known as HUMA, which I am very proud to say that I, along with the member opposite, are members of. He tabled a discussion paper entitled “Towards a Poverty Reduction Strategy”. This document was designed to open a dialogue on the subject of poverty reduction in Canada. Basically, it will help us and aid us in developing a national poverty reduction strategy.
That is not all. The minister also recently launched the tackling poverty together project. This important research project will consist of six extensive case studies across Canada. I am thrilled and very pleased that the Minister of Families, Children and Social Development came to my riding of Saint John—Rothesay to announce this wonderful project and that my riding will be included in this project. It will help us better understand the impact of poverty reduction programs in communities that have identified poverty as an important issue.
Now, let us talk about the issue of housing. To lift people out of poverty, as a national government we have to address it. There is no other way around it. In fact, I would like to note that Bill C-245 also acknowledges the need to address this issue. Canadians know that housing matters. Unfortunately, too many of them are unable to find or afford a decent place to live. Again, that is unacceptable in our country.
Therefore, we are developing a national housing strategy to chart the course for better housing, and socio-economic and environmental outcomes for all Canadians, including those living in indigenous and northern communities. This strategy will also rely on existing collaboration between the federal, provincial, and territorial governments. I am glad to highlight the fact that consultations are already under way. We are reaching out to get Canadians' views on a vision for housing so that all Canadians can have access to housing that is sustainable, affordable, inclusive, and flexible.
Our government is fighting poverty through different ways and through different initiatives. In particular, there is the Canada child benefit, the increased guaranteed income supplement for seniors living alone, as well as our investments in social infrastructure.
We are working hand in hand with our partners to reduce poverty coast to coast. This bill would add greatly to our progress and contribute to our efforts, which we will make even stronger in the weeks and months ahead.",Liberal,Saint John—Rothesay,Wayne Long,http://www.parl.gc.ca/MembersOfParliament/ProfileMP.aspx?Key=215951&Language=E
