basepk,hid,speechdate,pid,opid,speakeroldname,speakerposition,maintopic,subtopic,subsubtopic,speechtext,speakerparty,speakerriding,speakername,speakerurl
4686060,ca.proc.d.2016-10-31.9204699,2016-10-31,1a1a9dee-c228-40fc-b926-42f8441d84f0,214405,"Hon. Ralph Goodale (Minister of Public Safety and Emergency Preparedness, Lib.)",,Routine Proceedings,Office of the Correctional Investigator,,"Mr. Speaker, I certainly want to applaud my colleague the Minister of International Trade for her accomplishment but I have some documents to table as well.
I am pleased to table, in both official languages, the 2015-16 Annual Report of the Office of the Correctional Investigator of Canada as required under Section 192 of the Corrections and Conditional Release Act.
I am also tabling the response to the three recommendations in the Public Safety Canada report and the response to the 24 recommendations regarding Correctional Service Canada.",Liberal,Regina—Wascana,Ralph Goodale,http://www.parl.gc.ca/MembersOfParliament/ProfileMP.aspx?Key=214405&Language=E
4686061,ca.proc.d.2016-10-31.9204702,2016-10-31,826dc268-dbda-48fa-ae4a-eefebd5716e1,214209,"Hon. John McCallum (Minister of Immigration, Refugees and Citizenship, Lib.)",,Routine Proceedings,Immigration,,"Mr. Speaker, I too would like to congratulate my colleague the international trade minister—",Liberal,Markham—Thornhill,John McCallum,http://www.parl.gc.ca/MembersOfParliament/ProfileMP.aspx?Key=214209&Language=E
4686062,ca.proc.d.2016-10-31.9204704,2016-10-31,3176068f-62ee-4b2f-aacd-1131201c6db1,214707,The Speaker,,Routine Proceedings,Immigration,,"I would like to remind ministers that this is not debate so it is not the time to congratulate, but rather it is the time to make a presentation of what they are tabling in the House.",Liberal,Halifax West,Geoff Regan,http://www.parl.gc.ca/MembersOfParliament/ProfileMP.aspx?Key=214707&Language=E
4686063,ca.proc.d.2016-10-31.9204705,2016-10-31,826dc268-dbda-48fa-ae4a-eefebd5716e1,214209,Hon. John McCallum,,Routine Proceedings,Immigration,,"Mr. Speaker, pursuant to subsection 94(1) of the Immigration and Refugee Protection Act, I have the honour to table, in both official languages, the 2016 annual report to Parliament on immigration. ",Liberal,Markham—Thornhill,John McCallum,http://www.parl.gc.ca/MembersOfParliament/ProfileMP.aspx?Key=214209&Language=E
4686064,ca.proc.d.2016-10-31.9204844,2016-10-31,3dd9162a-4763-4000-8c8a-706a788f7e50,213971,"Hon. Chrystia Freeland (Minister of International Trade, Lib.)",,Routine Proceedings,Canada-European Union Comprehensive Economic and Trade Agreement Implementation Act,," moved for leave to introduce Bill C-30, An Act to implement the Comprehensive Economic and Trade Agreement between Canada and the European Union and its Member States and to provide for certain other measures.
 (Motions deemed adopted, bill read the first time and printed) ",Liberal,University—Rosedale,Chrystia Freeland,http://www.parl.gc.ca/MembersOfParliament/ProfileMP.aspx?Key=213971&Language=E
4686065,ca.proc.d.2016-10-31.9204716,2016-10-31,dbb0dd7c-287c-4115-9424-4b2c55652877,215917,"Mr. Robert-Falcon Ouellette (Winnipeg Centre, Lib.)",,Routine Proceedings,Indian Residential School Reconciliation and Memorial Day Act,," moved for leave to introduce Bill C-318, An Act to establish Indian Residential School Reconciliation and Memorial Day.
Mr. Speaker, I would like to introduce an act to establish Indian residential school reconciliation and memorial day. I would like to thank Maeengan Linklater for helping to champion the bill's creation and member of Parliament Seamus O'Regan, the member of Parliament from Newfoundland, for seconding my bill.
My bill is designed to set aside June 2 to honour the survivors of the Indian residential school system and acknowledge Canada's colonial historical legacy of the Indian residential school system for what it is, an act of cultural genocide under the UN Convention of 1949.
I ask Parliament to support this legislation and work together, as a nation and a country, toward the revitalization of indigenous communities and to affirm the treaty relationship between Canadians and indigenous peoples. 
 Tapwe akwa khitwam. 
 (Motions deemed adopted, bill read the first time and printed) ",Liberal,Winnipeg Centre,Robert-Falcon Ouellette,http://www.parl.gc.ca/MembersOfParliament/ProfileMP.aspx?Key=215917&Language=E
4686066,ca.proc.d.2016-10-31.9204719,2016-10-31,3176068f-62ee-4b2f-aacd-1131201c6db1,214707,The Speaker,,Routine Proceedings,Indian Residential School Reconciliation and Memorial Day Act,,I thank the hon. member and would remind him that we do not refer to members by personal names but rather by the names of our ridings or by ministerial titles and so forth.,Liberal,Halifax West,Geoff Regan,http://www.parl.gc.ca/MembersOfParliament/ProfileMP.aspx?Key=214707&Language=E
4686067,ca.proc.d.2016-10-31.9204723,2016-10-31,da91c83a-bab4-427f-b9e4-973025dbcab0,215879,"Mr. Darren Fisher (Dartmouth—Cole Harbour, Lib.)",,Routine Proceedings,National Sickle Cell Awareness Day Act,," moved that Bill S-211, an act respecting National Sickle Cell Awareness Day, be read the first time. 
I am very pleased to rise in this House to introduce Bill S-211, an act respecting National Sickle Cell Awareness Day, which, about two weeks ago, passed in the Senate unanimously and without amendment. 
On September 29, my office met with Rugi Jalloh, president of the Sickle Cell Association of Nova Scotia, along with her delegation. Each of them had compelling and personal stories of how this disease has affected their health or the health of their family members.
People with sickle cell disease frequently experience extreme pain in their bones. One person we met with has a sister who is mostly bedridden and requires home care. Another person we met had lost two family members to this disease.
June 19 is recognized as World Sickle Cell Day by many organizations, including the World Health Organization. Bill S-211 seeks to add our voice to this important cause by marking June 19 as National Sickle Cell Awareness Day in Canada.
I ask that my colleagues on all sides of this House join with the Senate in the speedy passage of the bill.
 (Motion agreed to and bill read the first time) ",Liberal,Dartmouth—Cole Harbour,Darren Fisher,http://www.parl.gc.ca/MembersOfParliament/ProfileMP.aspx?Key=215879&Language=E
4686068,ca.proc.d.2016-10-31.9204737,2016-10-31,cedf1659-ebb1-4f26-b723-5c7c5353988b,214948,"Mrs. Carol Hughes (Algoma—Manitoulin—Kapuskasing, NDP)",,Routine Proceedings,Petitions,Rail Transportation," Mr. Speaker, I am pleased to rise on behalf of some constituents from Algoma—Manitoulin—Kapuskasing, in the communities of Little Rapids, Serpent River, and Thessalon, and other individuals from Sault Ste. Marie, Hamilton, and Sudbury.
The petitioners call upon the government to reinstate the modest subsidy that supported this important piece of infrastructure for this part of northern Ontario.
They remind the government that 75% of the landowners along the line relied on passenger rail to reach their properties and that any roads the government claims can be used are industrial roads that are not maintained or monitored since they are not intended for public use.
In addition, they remind the government of the positive effect passenger services had on the Algoma economy and how its absence has create significant difficulties for the businesses up and down the line. They point out that the service was important to first nations accessing traditional land and that the failure to consult the first nations before cancelling the subsidy infringed on the right to consultation.
They add that the passenger train has been the only safe, affordable, all-season access into the Algoma wilderness for the last 100 years.",New Democratic Party,Algoma—Manitoulin—Kapuskasing,Carol Hughes,http://www.parl.gc.ca/MembersOfParliament/ProfileMP.aspx?Key=214948&Language=E
4686069,ca.proc.d.2016-10-31.9204746,2016-10-31,b37cad30-26f6-40c6-8e4c-dd3a0ba841bb,218638,"Mrs. Cheryl Gallant (Renfrew—Nipissing—Pembroke, CPC)",,Routine Proceedings,Petitions,Small Business,"Mr. Speaker, I am pleased to present a petition signed by campers who stayed at Smiths Bay campsite in Eganville, Ontario, which is located in the great riding of Renfrew—Nipissing—Pembroke.
 The petitioners call upon the government to ensure that campgrounds with fewer than five full-time, year-round employees will continue to be recognized and taxed as small businesses.",Conservative,Renfrew—Nipissing—Pembroke,Cheryl Gallant,http://www.parl.gc.ca/MembersOfParliament/ProfileMP.aspx?Key=218638&Language=E
4686070,ca.proc.d.2016-10-31.9204751,2016-10-31,3b00808c-6ef4-44a2-8204-dc48574a870e,218051,"Mr. Ted Falk (Provencher, CPC)",,Routine Proceedings,Petitions,Falun Gong,"Mr. Speaker, I want to present a petition signed by dozens of individuals asking the Canadian Parliament to establish measures to stop the Chinese regime's mass murder of innocent people for their organs; including, but not limited to: introducing Canadian legislation to ban organ tourism and criminalize those involved; taking every opportunity to call for an end to the persecution of Falun Gong; and urging the Chinese authorities to bring former leader Jiang Zemin and his cohorts to justice.",Conservative,Provencher,Ted Falk,http://www.parl.gc.ca/MembersOfParliament/ProfileMP.aspx?Key=218051&Language=E
4686071,ca.proc.d.2016-10-31.9205134,2016-10-31,3b00808c-6ef4-44a2-8204-dc48574a870e,218051,"Mr. Ted Falk (Provencher, CPC)",,Routine Proceedings,Petitions,Physician-Assisted Dying,"Mr. Speaker, I also have another petition, also signed by many individuals, asking the government to enshrine in the Criminal Code the protection of conscience for physicians and health care institutions from coercion or intimidation to provide or refer for physician-assisted suicide or euthanasia.",Conservative,Provencher,Ted Falk,http://www.parl.gc.ca/MembersOfParliament/ProfileMP.aspx?Key=218051&Language=E
4686072,ca.proc.d.2016-10-31.9204754,2016-10-31,a710e2c4-20f9-4df8-ba6c-2dc50c03bb75,217321,"Ms. Marjolaine Boutin-Sweet (Hochelaga, NDP)",,Routine Proceedings,Petitions,Economic Inequalities,"Mr. Speaker, I have chosen to present this petition in the House today because we are talking about poverty in the debate on the bill introduced by my colleague from Saint-Hyacinthe—Bagot.
This petition calls on the Government of Canada to do something to reduce economic inequality in Canada. For example, it calls on the federal government to implement a federal minimum wage of $15 an hour, ensure that large corporations pay their fair share of taxes, and put an end to unfair trade agreements that result in the loss of jobs and lower wages.
I think that this was the right day to present this petition, which has been signed by dozens of my constituents.",New Democratic Party,Hochelaga,Marjolaine Boutin-Sweet,http://www.parl.gc.ca/MembersOfParliament/ProfileMP.aspx?Key=217321&Language=E
4686073,ca.proc.d.2016-10-31.9204757,2016-10-31,3838746e-29a4-4a93-8239-a2b17a3b387f,216782,"Mr. Mark Warawa (Langley—Aldergrove, CPC)",,Routine Proceedings,Petitions,Physician-Assisted Dying,"Mr. Speaker, I have a petition regarding the protection of conscience of physicians in Canada. It highlights that during the committee meetings on assisted suicide, the committee overwhelmingly heard that coercion, intimidation, and other forms of pressure intended to force physicians and health institutions to become parties to assisted suicide and euthanasia is a violation of fundamental freedom of conscience rights in Canada.
The petitioners are calling upon this Parliament to support Bill C-268 to enshrine in the Criminal Code the protection of conscience for physicians and health care institutions from coercion and intimidation.",Conservative,Langley—Aldergrove,Mark Warawa,http://www.parl.gc.ca/MembersOfParliament/ProfileMP.aspx?Key=216782&Language=E
4686074,ca.proc.d.2016-10-31.9204759,2016-10-31,bc4bee2d-993a-4485-a436-4b45cb6553da,214468,"Ms. Yvonne Jones (Labrador, Lib.)",,Routine Proceedings,Petitions,Pensions,"Mr. Speaker, I rise today to present this petition on behalf of my constituents in Labrador, hundreds of people from the town of Wabush and Labrador West, who are calling upon the government today to ensure that pension plans for workers are guaranteed under CCAA, the Companies' Creditors Arrangement Act. As members know, when Cliffs Natural Resources went bankrupt in Wabush, many workers ended up losing a large percentage of their pension plan, as they were not protected under that act. The company itself still earns revenues and profits in the United States even though it does not operate in Canada, yet Canadian workers have been left behind. 
The petitioners are asking the Government of Canada and the Government of Newfoundland and Labrador to ensure the protection of these pension funds that workers worked hard for.",Liberal,Labrador,Yvonne Jones,http://www.parl.gc.ca/MembersOfParliament/ProfileMP.aspx?Key=214468&Language=E
4686075,ca.proc.d.2016-10-31.9204764,2016-10-31,d013e8ca-fdd5-4eb4-a0e4-b5f0782a8f6d,217187,"Mr. Fin Donnelly (Port Moody—Coquitlam, NDP)",,Routine Proceedings,Petitions,Fisheries and Oceans,"Mr. Speaker, I am pleased to table this petition calling on the government to save the endangered wild Atlantic salmon of the Avon River in Nova Scotia.
The petitioners are asking the Minister of Fisheries, Oceans and the Canadian Coast Guard to restore proper fish passage to the Avon River Causeway, which would assist with the recovery of the wild Atlantic salmon and other species and their critical habitat.",New Democratic Party,Port Moody—Coquitlam,Fin Donnelly,http://www.parl.gc.ca/MembersOfParliament/ProfileMP.aspx?Key=217187&Language=E
4686076,ca.proc.d.2016-10-31.9204766,2016-10-31,b6e2c8aa-fc83-4d52-ad66-7910b8805f90,216978,"Mr. Arnold Viersen (Peace River—Westlock, CPC)",,Routine Proceedings,Petitions,Health,"Mr. Speaker, I am presenting today two petitions: one from northern Alberta, Grimshaw, Alberta; and one from people from across Ontario. I am pleased to present these petitions.
 The petitioners are concerned about the accessibility and impact of violent and degrading sexually explicit material online and the impact on public health, especially the well-being of women and girls. As such, these petitioners are calling on the House of Commons to adopt Motion No. 47.",Conservative,Peace River—Westlock,Arnold Viersen,http://www.parl.gc.ca/MembersOfParliament/ProfileMP.aspx?Key=216978&Language=E
4686077,ca.proc.d.2016-10-31.9204768,2016-10-31,cd2b5c50-ef21-4dce-af6d-ed530bdb5837,219487,"Mr. Stephen Fuhr (Kelowna—Lake Country, Lib.)",,Routine Proceedings,Petitions,Health,"Mr. Speaker, I rise to draw attention to petition e-440, which calls on Parliament to recognize May 15 as national DIPG awareness day, a step toward positive change for children with DIPG brainstem cancer. I wish to thank all those who supported this petition. This is for Caleb, Sevanah, and Ruby.",Liberal,Kelowna—Lake Country,Stephen Fuhr,http://www.parl.gc.ca/MembersOfParliament/ProfileMP.aspx?Key=219487&Language=E
4686078,ca.proc.d.2016-10-31.9204771,2016-10-31,7f01c656-5f94-4743-9018-ad3a89bb2fc4,217214,"Ms. Brigitte Sansoucy (Saint-Hyacinthe—Bagot, NDP)",,Routine Proceedings,Petitions,Poverty,"Mr. Speaker, it is with great appreciation that I, again today, table signatures in support of Bill C-245, which seeks to develop a national poverty reduction strategy.
Earlier today, we had the first hour of debate on this bill at second reading. The petitions in support of this bill keep coming in.",New Democratic Party,Saint-Hyacinthe—Bagot,Brigitte Sansoucy,http://www.parl.gc.ca/MembersOfParliament/ProfileMP.aspx?Key=217214&Language=E
4686079,ca.proc.d.2016-10-31.9204775,2016-10-31,f4efade5-e605-4926-b4d9-cea84ef76f14,217342,"Mr. Randall Garrison (Esquimalt—Saanich—Sooke, NDP)",,Routine Proceedings,Petitions,Foreign Affairs,"Mr. Speaker, I rise today to present petition e-431, initiated by Tsewang Rinzin of Toronto. This petition calls on the Government of Canada to send at the earliest opportunity a delegation of Canadian parliamentarians and/or diplomats to China to ascertain the whereabouts and well-being of the 11th Panchen Lama, Gedhun Choekyi Nyima, and to urge the Government of China to release the 11th Panchen Lama at the earliest opportunity.
The Panchen Lama is the second-highest ranking lama in Tibetan Buddhism after the Dalai Lama. The 11th Panchen Lama was declared as such on May 14, 1995. Three days later, he and his family disappeared and they have not been seen for 21 years.
I am pleased to be the sponsor of this petition, and I look forward to hearing from the government at the earliest opportunity in response.",New Democratic Party,Esquimalt—Saanich—Sooke,Randall Garrison,http://www.parl.gc.ca/MembersOfParliament/ProfileMP.aspx?Key=217342&Language=E
4686080,ca.proc.d.2016-10-31.9204780,2016-10-31,eb417798-95f7-45a0-b1e9-ca3a6526d4db,217116,"Mr. Alistair MacGregor (Cowichan—Malahat—Langford, NDP)",,Routine Proceedings,Petitions,The Environment,"Mr. Speaker, I am pleased to stand up in this flurry of petitions today to present two petitions. 
The first petition is from my constituents of Shawnigan Lake who are asking for the federal government to step in and provide assistance for the contaminated soil dump.",New Democratic Party,Cowichan—Malahat—Langford,Alistair MacGregor,http://www.parl.gc.ca/MembersOfParliament/ProfileMP.aspx?Key=217116&Language=E
4686081,ca.proc.d.2016-10-31.9205145,2016-10-31,eb417798-95f7-45a0-b1e9-ca3a6526d4db,217116,"Mr. Alistair MacGregor (Cowichan—Malahat—Langford, NDP)",,Routine Proceedings,Petitions,Seniors,"Mr. Speaker, the next petition is one I have the honour to present as the NDP critic for seniors' issues. The petitioners are calling upon Parliament to appoint a minister for seniors and to develop a national strategy for seniors, given that this demographic is about to be a very large part of the population in the next two decades.",New Democratic Party,Cowichan—Malahat—Langford,Alistair MacGregor,http://www.parl.gc.ca/MembersOfParliament/ProfileMP.aspx?Key=217116&Language=E
4686082,ca.proc.d.2016-10-31.9204782,2016-10-31,75d4be3f-f1cf-499d-882b-6415247900e6,226919,"Mr. Alain Rayes (Richmond—Arthabaska, CPC)",,Routine Proceedings,Petitions,Impaired Driving," Mr. Speaker, today I would like to present in the House two petitions urging the Government of Canada to recognize that current legislation governing impaired driving is too lenient and needs to be tougher. 
The petitioners want harsher minimum sentences for those convicted of impaired driving causing death. They want individuals responsible for such deaths to be charged with vehicular homicide. ",Conservative,Richmond—Arthabaska,Alain Rayes,http://www.parl.gc.ca/MembersOfParliament/ProfileMP.aspx?Key=226919&Language=E
4686083,ca.proc.d.2016-10-31.9204785,2016-10-31,07cf5767-802c-406c-92a7-7dc92af79b40,214668,"Mr. Kevin Lamoureux (Parliamentary Secretary to the Leader of the Government in the House of Commons, Lib.)",,Routine Proceedings,Questions on the Order Paper,,"Mr. Speaker, I would ask that all questions be allowed to stand at this time.",Liberal,Winnipeg North,Kevin Lamoureux,http://www.parl.gc.ca/MembersOfParliament/ProfileMP.aspx?Key=214668&Language=E
4686084,ca.proc.d.2016-10-31.9204787,2016-10-31,3176068f-62ee-4b2f-aacd-1131201c6db1,214707,The Speaker,,Routine Proceedings,Questions on the Order Paper,,Is that agreed?,Liberal,Halifax West,Geoff Regan,http://www.parl.gc.ca/MembersOfParliament/ProfileMP.aspx?Key=214707&Language=E
4686085,ca.proc.d.2016-10-31.p4590721,2016-10-31,,,,intervention,Routine Proceedings,Questions on the Order Paper,, Agreed.,,,Some hon. members,
4686086,ca.proc.d.2016-10-31.p4590722,2016-10-31,,,,stagedirection,Government Orders,"Budget Implementation Act, 2016, No. 2",,"The House resumed consideration of the motion that Bill C-29, A second Act to implement certain provisions of the budget tabled in Parliament on March 22, 2016 and other measures, be read the second time and referred to a committee, and of the amendment.",,,,
4686087,ca.proc.d.2016-10-31.9204793,2016-10-31,3176068f-62ee-4b2f-aacd-1131201c6db1,214707,The Speaker,,Government Orders,"Budget Implementation Act, 2016, No. 2",,The House has five minutes for questions and comments.,Liberal,Halifax West,Geoff Regan,http://www.parl.gc.ca/MembersOfParliament/ProfileMP.aspx?Key=214707&Language=E
4686088,ca.proc.d.2016-10-31.9204795,2016-10-31,07cf5767-802c-406c-92a7-7dc92af79b40,214668,"Mr. Kevin Lamoureux (Parliamentary Secretary to the Leader of the Government in the House of Commons, Lib.)",,Government Orders,"Budget Implementation Act, 2016, No. 2",,"Mr. Speaker, my question is related to the budget itself. We saw a commitment to reduce the middle-class tax bracket, which would provide millions of dollars for nine million plus Canadians. We saw a special tax increase on Canada's wealthiest. What surprised me is that in the past the Conservatives talked about giving tax breaks to Canadians, yet when it really came down to it, the Conservative Party voted against the tax decrease for Canada's middle class.
My question is fairly simple. Why did the Conservative Party vote against the tax decrease for Canada's middle class?",Liberal,Winnipeg North,Kevin Lamoureux,http://www.parl.gc.ca/MembersOfParliament/ProfileMP.aspx?Key=214668&Language=E
4686089,ca.proc.d.2016-10-31.9204801,2016-10-31,75d4be3f-f1cf-499d-882b-6415247900e6,226919,"Mr. Alain Rayes (Richmond—Arthabaska, CPC)",,Government Orders,"Budget Implementation Act, 2016, No. 2",,"Madam Speaker, I thank my colleague opposite for his question.
The answer is extremely simple. When I take a good look at this budget and try to sum in up in a few words, it is pretty straightforward: more taxes, more taxes, and more taxes. An out-of-control deficit is enabling the government to spend money and make investments while downloading those costs onto our children and grandchildren. When I look at the statistics and the real facts, I see that there are fewer full-time jobs in Canada right now. If my colleague thinks that is good for Canadians, then we will never see eye to eye, unfortunately.",Conservative,Richmond—Arthabaska,Alain Rayes,http://www.parl.gc.ca/MembersOfParliament/ProfileMP.aspx?Key=226919&Language=E
4686090,ca.proc.d.2016-10-31.9204807,2016-10-31,64cec702-209d-4f03-bb85-1943f635d077,218944,"Mr. Luc Berthold (Mégantic—L'Érable, CPC)",,Government Orders,"Budget Implementation Act, 2016, No. 2",,"Madam Speaker, I want to begin by saying that I greatly appreciated listening to my colleague, who managed to present a clear and concise argument that made it easy to understand why he is against Bill C-29, a bill to implement the Liberal government's latest budget.
I have a simple question for my colleague. Does he know any expressions to describe what the Liberal government did, in other words promise one thing and do another? ",Conservative,Mégantic—L'Érable,Luc Berthold,http://www.parl.gc.ca/MembersOfParliament/ProfileMP.aspx?Key=218944&Language=E
4686091,ca.proc.d.2016-10-31.9204822,2016-10-31,75d4be3f-f1cf-499d-882b-6415247900e6,226919,Mr. Alain Rayes,,Government Orders,"Budget Implementation Act, 2016, No. 2",,"Madam Speaker, I thank my colleague for giving me the opportunity to identify the expression we use when someone keeps talking and talking but does not do what he says he is going to do. The expression is: if you are going to talk the talk then walk the walk. The government is failing at the latter. 
We are asking that the government's actions reflect what it says. That seems simple enough to me. When we compare the announcements that are made here and there to actual facts, we see that the results do not line up with what was said.",Conservative,Richmond—Arthabaska,Alain Rayes,http://www.parl.gc.ca/MembersOfParliament/ProfileMP.aspx?Key=226919&Language=E
4686092,ca.proc.d.2016-10-31.9204829,2016-10-31,07cf5767-802c-406c-92a7-7dc92af79b40,214668,"Mr. Kevin Lamoureux (Parliamentary Secretary to the Leader of the Government in the House of Commons, Lib.)",,Government Orders,"Budget Implementation Act, 2016, No. 2",,"Madam Speaker, another aspect of the budget was the increase in the guaranteed income supplement for our seniors, which has taken some of the most vulnerable seniors across Canada, in every region, out of poverty, as well as the reduction in the age of entitlement for OAS from 67 to 65. These are two very positive measures taken by the government through the budget. 
My question is the same as before. Why did the Conservative Party vote against those benefits going to Canada's seniors?",Liberal,Winnipeg North,Kevin Lamoureux,http://www.parl.gc.ca/MembersOfParliament/ProfileMP.aspx?Key=214668&Language=E
