basepk,hid,speechdate,pid,opid,speakeroldname,speakerposition,maintopic,subtopic,subsubtopic,speechtext,speakerparty,speakerriding,speakername,speakerurl
4684292,ca.proc.d.2016-10-20.9172459,2016-10-20,d32cbf2b-5b28-4698-ba39-c1ac2f736c3e,219012,"Mr. Joël Lightbound (Louis-Hébert, Lib.)",,Statements By Members,Victims of Sexual Assault,,"Mr. Speaker, last weekend, at least 15 break-ins were reported at one of Laval University's residences, which is in the heart of my riding and my community. During four of these break-ins, sexual assaults were also committed. To show solidarity for the victims, more than 1,000 people gathered yesterday evening for a vigil in honour of the courage of these young women who reported their perpetrator. On behalf of all members of the House, I wish to express our sympathy and solidarity.
October is Women's History Month in Canada. It is a time to honour the exceptional women and girls who built our country and who helped bring us closer to gender equality. However, we know that there is still much work to be done, and one of the first things we must do as a society is to combat rape culture in all its forms, today and in the future.",Liberal,Louis-Hébert,Joël Lightbound,http://www.parl.gc.ca/MembersOfParliament/ProfileMP.aspx?Key=219012&Language=E
4684293,ca.proc.d.2016-10-20.9172464,2016-10-20,3ff878ad-e5c8-4b69-83cc-70922b56fe89,219327,"Mrs. Alexandra Mendès (Brossard—Saint-Lambert, Lib.)",,Statements By Members,Virginia Cisneros,,"Mr. Speaker, on the occasion of Women's History Month, I would like to acknowledge the extraordinary contribution women have made to building our country and enhancing its presence in the world.
One woman in particular has inspired me for many years: Virginia Cisneros, head of the welcoming, integration, and community life department at the Maison Internationale de la Rive-Sud, which has helped thousands of immigrants successfully settle in our region. For over 25 years, Virginia has been central to the exemplary social and economic integration of newcomers to the south shore. Virginia is absolutely invaluable. She is a leader in promoting the benefits of diversity, one of the undeniable strengths of Brossard—Saint-Lambert. Again, I would like to acknowledge and commend Virginia for her years of devotion to our community. 
[Member spoke in Spanish as follows:]
 Felicitaciones, Virginia. Te admiro mucho. ",Liberal,Brossard—Saint-Lambert,Alexandra Mendes,http://www.parl.gc.ca/MembersOfParliament/ProfileMP.aspx?Key=219327&Language=E
4684294,ca.proc.d.2016-10-20.9172468,2016-10-20,26a7c39b-6a77-446a-8986-1d3086f156fe,220480,"Mrs. Shannon Stubbs (Lakeland, CPC)",,Statements By Members,Carbon Tax Proposal,,"Mr. Speaker, the Prime Minister's devastating tax will make every single thing more expensive for everyone. It is regressive. It will hurt the most vulnerable and the poorest the most. 
In Lakeland, so many people are hurting, losing their livelihoods, their homes, bracing for tougher times ahead.
While my constituents are struggling, wondering how to pay the bills, the Liberals are attacking Alberta's families, farms, businesses, municipalities, and charities, with even more costs at the very worst time.
 A Vegreville restaurant predicts major increases, causing reduced staff hours and layoffs. A local feedlot says the carbon tax will wipe out its whole profit margin, hiking costs half a million dollars annually. 
One county says it will take its already sinking revenues, so road and bridge upkeep will cease, crews will have to be laid off. An Athabasca family farmer said their costs will skyrocket over $130,000 annually, at the least.
Albertans and Canadians cannot afford this dangerous Liberal scheme.",Conservative,Lakeland,Shannon Stubbs,http://www.parl.gc.ca/MembersOfParliament/ProfileMP.aspx?Key=220480&Language=E
4684295,ca.proc.d.2016-10-20.9172471,2016-10-20,79ed56c5-9960-4de7-bf05-9cd4aa51dbf5,215927,"Mr. Pat Finnigan (Miramichi—Grand Lake, Lib.)",,Statements By Members,Birthday Wishes,,"Mr. Speaker, if anyone has read the wonderful novel, The Nine Lives of Charlotte Taylor, by Sally Armstrong, then they have read about the great-great-great-great-grandmother of Helen (Nellie) Harris of Tabusintac, a community in my riding of Miramichi—Grand Lake.
I was recently invited to Nellie's 110th birthday party. 
Nellie is still a very fine, smart, beautiful lady who has spent her life on the picturesque but rugged north shore of New Brunswick. Having received congratulatory messages from Her Majesty Queen Elizabeth; Canada's Governor General, His Excellency David Johnston; and of course, our Right Hon. Prime Minister of Canada, it was a great day for Nellie who, surrounded by her family and friends, blew out all the candles on her cake.
I promised that I would rise in the House as soon as I could, so that members from across Canada could join with me in wishing her a happy 110th birthday.
Happy birthday, Nellie.",Liberal,Miramichi—Grand Lake,Pat Finnigan,http://www.parl.gc.ca/MembersOfParliament/ProfileMP.aspx?Key=215927&Language=E
4684296,ca.proc.d.2016-10-20.9172475,2016-10-20,f1ca301b-cd67-48b5-9dd4-0f6c2af5454e,217309,"Ms. Karine Trudel (Jonquière, NDP)",,Statements By Members,Arvida,,"Mr. Speaker, last spring I was very proud to be appointed to the Club des ambassadeurs d'Arvida, an exceptional heritage district in my riding of Jonquière.
I want to acknowledge the significance of this unique industrial heritage. Built in 1926, Arvida is the birthplace of Canada's aluminium industry. The old working-class neighbourhood stands out for the architectural quality of its housing. This is why Arvida won two prestigious awards in architecture, in addition to being designated a national historic site in 2012.
A committee seeking heritage recognition for Arvida is currently working on having Arvida included in the list of UNESCO world heritage sites. Now that the tentative list for Canada's world heritage sites has been reopened, we are convinced that Arvida has what it takes to be included.",New Democratic Party,Jonquière,Karine Trudel,http://www.parl.gc.ca/MembersOfParliament/ProfileMP.aspx?Key=217309&Language=E
4684297,ca.proc.d.2016-10-20.9172564,2016-10-20,72dace30-741a-4877-8c1c-31b5dc3e4a8e,216251,"Mr. James Bezan (Selkirk—Interlake—Eastman, CPC)",,Statements By Members,Terrorism,,"Mr. Speaker, today we remember and honour the lives of two members of the Canadian Armed Forces: Warrant Officer Patrice Vincent, who was murdered in Saint-Jean-sur-Richelieu on October 20, 2014, and Corporal Nathan Cirillo, who was gunned down two days later in Ottawa while guarding the Tomb of the Unknown Soldier.
These soldiers were targeted simply because they were wearing their uniforms. Many of us in this chamber were present when that terrorist threat entered this building. We are forever grateful for the quick and courageous response by the Parliamentary Security officers, RCMP, and Ottawa City Police.
When human instinct is to flee, these officers heroically ran toward danger. Less than 24 hours after the attack, my colleagues and I returned to Parliament to perform our duties to represent Canadians. Our determination in the work we do was only strengthened that day. So too is the resolve of the Canadian Armed Forces in their mission to defeat the evils of terror.
Terrorism will not stop the work of our troops, it will not shake our democratic institutions, nor will it intimidate us as Canadians.",Conservative,Selkirk—Interlake—Eastman,James Bezan,http://www.parl.gc.ca/MembersOfParliament/ProfileMP.aspx?Key=216251&Language=E
4684298,ca.proc.d.2016-10-20.9172488,2016-10-20,c127569a-6bb5-4afe-b64b-401affe669d2,219773,"Ms. Gudie Hutchings (Long Range Mountains, Lib.)",,Statements By Members,Small Business Week,,"Mr. Speaker, this is Small Business Week, and we recognize the vital role small businesses play in our economy and in all our communities. As a former small business operator, I understand the risks that owners take when they start out. I know how hard it is to grow a business, yet how satisfying it is to hire that new employee to grow and thrive.
Small and medium-size businesses are 99% of Canadian businesses. They account for 40% of our GDP and employ 10.5 million Canadians. 
I take this opportunity to thank all our small businesses from coast to coast to coast. They are doing great work in our communities.
Our government applauds your efforts. We are committed to working with you to help you grow and to help strengthen our economy.",Liberal,Long Range Mountains,Gudie Hutchings,http://www.parl.gc.ca/MembersOfParliament/ProfileMP.aspx?Key=219773&Language=E
4684299,ca.proc.d.2016-10-20.9172492,2016-10-20,655f75f0-7c4c-4dd1-b0d7-317be0595660,216725,"Hon. Denis Lebel (Lac-Saint-Jean, CPC)",,Oral Questions,Health,,"Mr. Speaker, the relationship between the federal and provincial health ministers has gone from bad to worse. 
Meanwhile, the Prime Minister wants to impose new conditions on the provincial health transfers. Respecting the provinces' jurisdiction means respecting the Canadian Constitution.
Why do the Prime Minister and his minister not respect the Canadian Constitution? Why do they want to impose more conditions on the provincial health transfers?",Conservative,Lac-Saint-Jean,Denis Lebel,http://www.parl.gc.ca/MembersOfParliament/ProfileMP.aspx?Key=216725&Language=E
4684300,ca.proc.d.2016-10-20.9172494,2016-10-20,350c31fd-6260-4c63-bd17-0746cb6f4120,214328,"Hon. Jane Philpott (Minister of Health, Lib.)",,Oral Questions,Health,,"Mr. Speaker, for 10 years there was a government in Canada that paid precious little attention to health. 
We now have a government that is firmly committed to play the role that we have a responsibility to play in the matter of health. 
We are active participants in making sure that Canadians are healthy, that they have health care systems that work for them. We have a responsibility to be good stewards of the public purse, and to make sure that when we make investments in health, they go to health care.",Liberal,Markham—Stouffville,Jane Philpott,http://www.parl.gc.ca/MembersOfParliament/ProfileMP.aspx?Key=214328&Language=E
4684301,ca.proc.d.2016-10-20.9172496,2016-10-20,655f75f0-7c4c-4dd1-b0d7-317be0595660,216725,"Hon. Denis Lebel (Lac-Saint-Jean, CPC)",,Oral Questions,Health,,"Mr. Speaker, that is totally false. 
When we were in government, we had record levels of transfers to the provinces, but we did more than that. We respected provincial jurisdiction, which the Liberals are not doing now.
Health care is under provincial authority, and the Prime Minister and Minister of Health want to tell the provinces what to do from Ottawa. They do not just disrespect the provinces, they do not respect the country's Constitution.
Why is the Prime Minister putting other conditions on health transfers to provinces?",Conservative,Lac-Saint-Jean,Denis Lebel,http://www.parl.gc.ca/MembersOfParliament/ProfileMP.aspx?Key=216725&Language=E
4684302,ca.proc.d.2016-10-20.9172499,2016-10-20,350c31fd-6260-4c63-bd17-0746cb6f4120,214328,"Hon. Jane Philpott (Minister of Health, Lib.)",,Oral Questions,Health,,"Mr. Speaker, during the decade of the previous government, tens of billions of dollars of new money went into health care, but it did not transform health care systems in this country.
I talk to Canadians all the time who say that while they are proud of our publicly-funded health care system, they know that it needs transformation, that there are actually better ways to deliver health care.
We have a responsibility to, of course, respect jurisdictions, but to work with our colleagues, as we are doing, to make sure that we invest in health, and that it actually goes to improve health care systems.",Liberal,Markham—Stouffville,Jane Philpott,http://www.parl.gc.ca/MembersOfParliament/ProfileMP.aspx?Key=214328&Language=E
4684303,ca.proc.d.2016-10-20.9172503,2016-10-20,655f75f0-7c4c-4dd1-b0d7-317be0595660,216725,"Hon. Denis Lebel (Lac-Saint-Jean, CPC)",,Oral Questions,Ethics,,"Mr. Speaker, she wants to change the health systems of the provinces. That is what she said. She wants to change the health system. That is a provincial jurisdiction.
What is even more important, when one has the honour of serving as a minister in Canada, is to be completely above reproach. Ministers, particularly the finance minister, must never put themselves in a position of conflict of interest.
However, for $1,500, people had access to Canada's Minister of Finance to lobby him and ask him for favours.
Who was at that meeting? Can we have the names and titles of those people?",Conservative,Lac-Saint-Jean,Denis Lebel,http://www.parl.gc.ca/MembersOfParliament/ProfileMP.aspx?Key=216725&Language=E
4684304,ca.proc.d.2016-10-20.9172505,2016-10-20,48fc6e8f-3117-407b-bba3-bd6eede347ec,224672,"Hon. Bardish Chagger (Leader of the Government in the House of Commons and Minister of Small Business and Tourism, Lib.)",,Oral Questions,Ethics,," Mr. Speaker, events like this one are a part of every party's fundraising and engagement work.
Federal politics is subject to some of the strictest political financing legislation and regulations in the country, and our party is taking every action to comply with them.",Liberal,Waterloo,Bardish Chagger,http://www.parl.gc.ca/MembersOfParliament/ProfileMP.aspx?Key=224672&Language=E
4684305,ca.proc.d.2016-10-20.9172507,2016-10-20,9d3d2220-818c-494e-8d58-29f7cee7b65d,224944,"Hon. Candice Bergen (Portage—Lisgar, CPC)",,Oral Questions,Ethics,,"Mr. Speaker, yesterday the Minister of Finance had the audacity to say that his $1,500 cash for access Liberal fundraiser was part of his budget consultation. What a sad joke.
To add insult to injury, the Liberals defended their Halifax appointee, Jim Spatz, who gave the Liberals $1,500 to attend said fundraiser. This is completely contrary to all the rules. 
If the Minister of Finance will not admit that what he did was unethical, will the Prime Minister do the right thing, and enforce his own rules with his own cabinet?",Conservative,Portage—Lisgar,Candice Bergen,http://www.parl.gc.ca/MembersOfParliament/ProfileMP.aspx?Key=224944&Language=E
4684306,ca.proc.d.2016-10-20.9172511,2016-10-20,48fc6e8f-3117-407b-bba3-bd6eede347ec,224672,"Hon. Bardish Chagger (Leader of the Government in the House of Commons and Minister of Small Business and Tourism, Lib.)",,Oral Questions,Ethics,,"Mr. Speaker, as I just said in French, I will say English.
 Events like this one are a part of every party's fundraising and engagement work. 
Federal politics is subject to some of the strictest political financing legislation and regulations in the country, and our party fully complies with the Elections Act in all cases. These are the rules that the previous government put in place.
This event was open, and anyone who purchased a ticket was welcome to attend. The event was made public online.",Liberal,Waterloo,Bardish Chagger,http://www.parl.gc.ca/MembersOfParliament/ProfileMP.aspx?Key=224672&Language=E
4684307,ca.proc.d.2016-10-20.9172528,2016-10-20,9d3d2220-818c-494e-8d58-29f7cee7b65d,224944,"Hon. Candice Bergen (Portage—Lisgar, CPC)",,Oral Questions,Ethics,,"This is not the Elections Act, Mr. Speaker.
Let me read to my hon. colleague from the Prime Minister's own instructions to his ministers:
 Ministers and Parliamentary Secretaries must ensure that political fundraising activities or considerations do not affect, or appear to affect, the exercise of their official duties or the access of individuals or organizations to government. 
It is clear the Minister of Finance was charging a price, and then giving special access to individuals who could benefit from that access. It is wrong. 
When will the government start becoming ethical, accountable, and stop misusing the public trust?",Conservative,Portage—Lisgar,Candice Bergen,http://www.parl.gc.ca/MembersOfParliament/ProfileMP.aspx?Key=224944&Language=E
4684308,ca.proc.d.2016-10-20.9172545,2016-10-20,48fc6e8f-3117-407b-bba3-bd6eede347ec,224672,"Hon. Bardish Chagger (Leader of the Government in the House of Commons and Minister of Small Business and Tourism, Lib.)",,Oral Questions,Ethics,,"Mr. Speaker, the member knows very well that a part of every party's activities is fundraising.",Liberal,Waterloo,Bardish Chagger,http://www.parl.gc.ca/MembersOfParliament/ProfileMP.aspx?Key=224672&Language=E
4684309,ca.proc.d.2016-10-20.p4559688,2016-10-20,,,,intervention,Oral Questions,Ethics,," Oh, oh!",,,Some hon. members,
4684310,ca.proc.d.2016-10-20.9172546,2016-10-20,3176068f-62ee-4b2f-aacd-1131201c6db1,214707,The Speaker,,Oral Questions,Ethics,,"Members may not like the answer, but we need to hear it. I certainly want to be able to hear it. I am having difficulty hearing some of the answers. I would ask members to listen to the answer, all the answers, but right now from the hon. government House leader.",Liberal,Halifax West,Geoff Regan,http://www.parl.gc.ca/MembersOfParliament/ProfileMP.aspx?Key=214707&Language=E
4684311,ca.proc.d.2016-10-20.9172548,2016-10-20,48fc6e8f-3117-407b-bba3-bd6eede347ec,224672,Hon. Bardish Chagger,,Oral Questions,Ethics,,"Mr. Speaker, federal politics is subject to some of the strictest financing legislation and regulations in the country. The party fully complies with the Elections Act in all cases.
These are the rules that were put in place by the previous government, and if it worked for it then, why does it not work for it now?",Liberal,Waterloo,Bardish Chagger,http://www.parl.gc.ca/MembersOfParliament/ProfileMP.aspx?Key=224672&Language=E
4684312,ca.proc.d.2016-10-20.9172550,2016-10-20,0c9d00b0-a035-46d3-ba51-0db3e8da19b8,217281,"Mr. Murray Rankin (Victoria, NDP)",,Oral Questions,Ethics,,"Mr. Speaker, the Prime Minister's ethics rules were very clear. I want to quote: “There should be no preferential access to government, or appearance of preferential access,” for political donors.
 Now it has come to light that the Minister of Finance has held cash-for-access fundraisers. These occurred at the same time and in the same locations as his budget consultation tour. No wonder the Liberals love consultations.
Are the new ethics standards promised to Canadians in effect for Liberal ministers as well? Yes or no.",New Democratic Party,Victoria,Murray Rankin,http://www.parl.gc.ca/MembersOfParliament/ProfileMP.aspx?Key=217281&Language=E
4684313,ca.proc.d.2016-10-20.9172555,2016-10-20,48fc6e8f-3117-407b-bba3-bd6eede347ec,224672,"Hon. Bardish Chagger (Leader of the Government in the House of Commons and Minister of Small Business and Tourism, Lib.)",,Oral Questions,Ethics,,"Mr. Speaker, it is very much true that the Minister of Finance is consulting with Canadians from coast to coast to coast.
In our election campaign, which concluded just a year ago yesterday, we committed to Canadians that we will consult with Canadians, we will listen to them, and we will improve the systems that are in place. The Minister of Finance has heard from record numbers when it comes to this budget consultation, and that is why we are delivering on the commitments we made to Canadians.
We will continue to do the good work that we are doing.",Liberal,Waterloo,Bardish Chagger,http://www.parl.gc.ca/MembersOfParliament/ProfileMP.aspx?Key=224672&Language=E
4684314,ca.proc.d.2016-10-20.9172557,2016-10-20,7f01c656-5f94-4743-9018-ad3a89bb2fc4,217214,"Ms. Brigitte Sansoucy (Saint-Hyacinthe—Bagot, NDP)",,Oral Questions,Ethics,,"Mr. Speaker, the Liberals were elected on a promise of real change, but it turns out they are fine with following the Conservatives' rules.
The Minister of Finance is just the first of many ministers planning to attend VIP fundraisers, and we are still not privy to the details of the Minister of Finance's private events.
Who was there, and, most importantly, what did they want from him?",New Democratic Party,Saint-Hyacinthe—Bagot,Brigitte Sansoucy,http://www.parl.gc.ca/MembersOfParliament/ProfileMP.aspx?Key=217214&Language=E
4684315,ca.proc.d.2016-10-20.9172560,2016-10-20,48fc6e8f-3117-407b-bba3-bd6eede347ec,224672,"Hon. Bardish Chagger (Leader of the Government in the House of Commons and Minister of Small Business and Tourism, Lib.)",,Oral Questions,Ethics,,"Mr. Speaker, the member knows perfectly well that events like these are part of each party's fundraising and engagement work. Those are the rules that were in place when the previous government was in power, and they have not changed.",Liberal,Waterloo,Bardish Chagger,http://www.parl.gc.ca/MembersOfParliament/ProfileMP.aspx?Key=224672&Language=E
4684316,ca.proc.d.2016-10-20.p4559702,2016-10-20,,,,,Oral Questions,Ethics,, Not at all.,,,Ms. Sylvie Boucher,
4684317,ca.proc.d.2016-10-20.9172562,2016-10-20,3176068f-62ee-4b2f-aacd-1131201c6db1,214707,The Speaker,,Oral Questions,Ethics,,"Order. I would ask the hon. member for Beauport—Côte-de-Beaupré—Île d'Orléans—Charlevoix to listen to the answer.
The hon. member for Saint-Hyacinthe—Bagot.",Liberal,Halifax West,Geoff Regan,http://www.parl.gc.ca/MembersOfParliament/ProfileMP.aspx?Key=214707&Language=E
4684318,ca.proc.d.2016-10-20.9172565,2016-10-20,7f01c656-5f94-4743-9018-ad3a89bb2fc4,217214,"Ms. Brigitte Sansoucy (Saint-Hyacinthe—Bagot, NDP)",,Oral Questions,Health,,"Mr. Speaker, thanks to Quebec's health minister, we now know that, when it comes time for the Liberals to fund health care, the question is, “What is in it for me politically?”
Is that what it comes down to for the Minister of Health? She should not be playing politics with the health of Quebeckers and Canadians.
Can the minister stand here today and tell us that the government is prepared to invest in mental health as the provinces requested and the Liberals promised?",New Democratic Party,Saint-Hyacinthe—Bagot,Brigitte Sansoucy,http://www.parl.gc.ca/MembersOfParliament/ProfileMP.aspx?Key=217214&Language=E
4684319,ca.proc.d.2016-10-20.9172569,2016-10-20,350c31fd-6260-4c63-bd17-0746cb6f4120,214328,"Hon. Jane Philpott (Minister of Health, Lib.)",,Oral Questions,Health,,"Mr. Speaker, when I spoke to my counterparts, the ministers of health in the provinces and territories, I made it very clear to them that this is not a political discussion. This is about doing the right thing for Canadians. This is about good public policy. I am very committed to the matter of mental health care.
 I have a mandate to make sure that Canadians have better mental health care, but I also have a responsibility to make sure that when we invest in mental health care, when we invest home care, when we invest in palliative care, that Canadians will see that they actually get better access to care.",Liberal,Markham—Stouffville,Jane Philpott,http://www.parl.gc.ca/MembersOfParliament/ProfileMP.aspx?Key=214328&Language=E
4684320,ca.proc.d.2016-10-20.9172571,2016-10-20,0c9d00b0-a035-46d3-ba51-0db3e8da19b8,217281,"Mr. Murray Rankin (Victoria, NDP)",,Oral Questions,Health,,"Mr. Speaker, the Liberals may be walking away from a new commitment to mental health funding. Quebec's health minister said that he was worried that funding for mental illness is not a priority for this finance minister or this Prime Minister because “they don't see a political gain on that.”
While it may not pay off like cash-for-access fundraisers, I can assure the House that for Canadians suffering from mental illness, there is much to gain.
Will the Liberals commit to real negotiations with the provinces based on that rather than based on political calculations?",New Democratic Party,Victoria,Murray Rankin,http://www.parl.gc.ca/MembersOfParliament/ProfileMP.aspx?Key=217281&Language=E
4684321,ca.proc.d.2016-10-20.9172574,2016-10-20,350c31fd-6260-4c63-bd17-0746cb6f4120,214328,"Hon. Jane Philpott (Minister of Health, Lib.)",,Oral Questions,Health,,"Mr. Speaker, when it comes to the matter of mental illness in this country, I will never play politics. I know that mental illness affects every Canadian. Every one of us in this chamber is affected by mental illness. This is a very serious matter.
When I met with my counterparts, they wanted to talk about money. I wanted to talk about health. I wanted to talk about how we can actually help Canadians to have better mental health care. I am determined to do that. I really look forward to working with my counterparts to make that happen.",Liberal,Markham—Stouffville,Jane Philpott,http://www.parl.gc.ca/MembersOfParliament/ProfileMP.aspx?Key=214328&Language=E
4684322,ca.proc.d.2016-10-20.9172576,2016-10-20,26a7c39b-6a77-446a-8986-1d3086f156fe,220480,"Mrs. Shannon Stubbs (Lakeland, CPC)",,Oral Questions,Ethics,,"Mr. Speaker, last year the Prime Minister said, “There should be no preferential access to government”, but his finance minister disobeyed that directive with a $1,500 per ticket fundraiser last week.
While Canadians are struggling to put food on their tables and keep a roof over their heads, the finance minister is giving special attention to his fellow rich Liberal friends, who paid $1,500 for the privilege of talking to him. 
When will the Liberals stop padding their pockets and start listening to average Canadians who cannot pay his $1,500 entry fee? ",Conservative,Lakeland,Shannon Stubbs,http://www.parl.gc.ca/MembersOfParliament/ProfileMP.aspx?Key=220480&Language=E
