basepk,hid,speechdate,pid,opid,speakeroldname,speakerposition,maintopic,subtopic,subsubtopic,speechtext,speakerparty,speakerriding,speakername,speakerurl
4694579,ca.proc.d.2016-12-14.9321347,2016-12-14,3176068f-62ee-4b2f-aacd-1131201c6db1,214707,The Speaker,,Oral Questions,Business of the House,,"Before proceeding, I would like to thank the hon. member for Victoria for mentioning Lynn Legault. Apparently she is not working in the House today. Perhaps she planned it that way since she is so modest. In any case, we will miss her.
The hon. member for Montcalm.",Liberal,Halifax West,Geoff Regan,http://www.parl.gc.ca/MembersOfParliament/ProfileMP.aspx?Key=214707&Language=E
4694580,ca.proc.d.2016-12-14.9321348,2016-12-14,530dc476-c9bf-477c-83e7-6efc545f2bf8,224177,"Mr. Luc Thériault (Montcalm, BQ)",,Oral Questions,Business of the House,,"Mr. Speaker, I would like to have the consent of the House to extend greetings on behalf of my party. Do I have consent?",Bloc Québécois,Montcalm,Luc Thériault,http://www.parl.gc.ca/MembersOfParliament/ProfileMP.aspx?Key=224177&Language=E
4694581,ca.proc.d.2016-12-14.p4710473,2016-12-14,,,,intervention,Oral Questions,Business of the House,, Agreed.,,,Some hon. members,
4694582,ca.proc.d.2016-12-14.p4710474,2016-12-14,530dc476-c9bf-477c-83e7-6efc545f2bf8,224177,Mr. Luc Thériault,,Oral Questions,Business of the House,," On behalf of my political party, the Bloc Québécois, and our members here in Parliament, we are pleased to extend our best wishes for Christmas. We wish you the very best for 2017. We salute your sense of fairness and your pursuit of equity in the House.
We would also like to extend our best wishes to the entire team, which serves us with exemplary dedication. As a user of their services, I would also like to acknowledge the excellent work of the interpreters in the House. Finally, we extend our best wishes for Christmas to all our colleagues from all parties. We wish them a very happy new year.
Although we are all proud representatives of our parties, we are also human beings who will be returning to our families today. We hope you will all enjoy the holidays. 
Until next time! May 2017 be as eventful as the year drawing to a close.",Bloc Québécois,Montcalm,Luc Thériault,http://www.parl.gc.ca/MembersOfParliament/ProfileMP.aspx?Key=224177&Language=E
4694583,ca.proc.d.2016-12-14.9321353,2016-12-14,eaa6694f-1e20-4aae-ad3b-e694b0e12c59,224170,"Ms. Elizabeth May (Saanich—Gulf Islands, GP)",,Oral Questions,Business of the House,,"Mr. Speaker, I have not many words to add. We have to thank all the team here on Parliament Hill. The only group that has been forgotten are the wonderful people who serve us in the cafeterias and the dining room, who get laid off right now and are rehired when we get back, so special thoughts for them, for all our security guards, the translators, the table officers, your team, Mr. Speaker, and each and every member of the House. 
My best wishes for the holidays! Merry Christmas!
Merry Christmas. For some of us, we await the arrival of the birth of our Lord and Saviour. For others, we just celebrate a great time among family and friends. For my dear friends of the Jewish community, it is a bit delayed now, but happy Hanukkah.
To everyone in the Conservative caucus who earlier raised Festivus, I do not want anyone left out, so Festivus for the rest of us. 
Merry Christmas. ",Green Party,Saanich—Gulf Islands,Elizabeth May,http://www.parl.gc.ca/MembersOfParliament/ProfileMP.aspx?Key=224170&Language=E
4694584,ca.proc.d.2016-12-14.9321354,2016-12-14,3176068f-62ee-4b2f-aacd-1131201c6db1,214707,The Speaker,,Oral Questions,Business of the House,,"I thank all those who have spoken, the House leaders and others, for their kind words and generous comments toward all colleagues and for thanking so many folks who work for us. 
I want to add my thanks to all members, the clerks, the pages, all the staff of the House of Commons, the Parliamentary Protective Service, and the Library of Parliament, who all provide such great help to us. 
As for the staff of members of Parliament and ministers who work either here in Ottawa or across the country, we could not do our jobs without them, and we are very grateful for the wonderful work they do. 
I am pleased to offer my best wishes to everyone for a merry Christmas and happy new year, happy Hanukkah, and happy holidays. Have a wonderful and safe season. 
Remember, many members of Parliament, and other Canadians, will be driving during this period. Members, especially from large rural ridings, do a lot of driving, and I am always concerned that they be careful when they do so, because sometimes they are tired. It is good to take a rest if need be. Keep that in mind, please.",Liberal,Halifax West,Geoff Regan,http://www.parl.gc.ca/MembersOfParliament/ProfileMP.aspx?Key=214707&Language=E
4694585,ca.proc.d.2016-12-14.9321357,2016-12-14,3dd9162a-4763-4000-8c8a-706a788f7e50,213971,"Hon. Chrystia Freeland (Minister of International Trade, Lib.)",,Routine Proceedings,Extractive Sector Corporate Social Responsibility Counsellor,,"Mr. Speaker, happy holidays to you and your team.
I have the honour to table, in both official languages, the 2016 annual report to Parliament on the activities of the Office of the Extractive Sector Corporate Social Responsibility Counsellor. This covers the May 2015 to May 2016 period. The report was prepared by the extractive sector corporate social responsibility counsellor. ",Liberal,University—Rosedale,Chrystia Freeland,http://www.parl.gc.ca/MembersOfParliament/ProfileMP.aspx?Key=213971&Language=E
4694586,ca.proc.d.2016-12-14.9321360,2016-12-14,07cf5767-802c-406c-92a7-7dc92af79b40,214668,"Mr. Kevin Lamoureux (Parliamentary Secretary to the Leader of the Government in the House of Commons, Lib.)",,Routine Proceedings,Government Response to Petitions,,"Mr. Speaker, pursuant to Standing Order 36(8), I have the honour to table, in both official languages, the government's response to 64 petitions.",Liberal,Winnipeg North,Kevin Lamoureux,http://www.parl.gc.ca/MembersOfParliament/ProfileMP.aspx?Key=214668&Language=E
4694587,ca.proc.d.2016-12-14.9321362,2016-12-14,6322565a-d236-4124-81f3-d869f865f7ef,219882,"Ms. Leona Alleslev (Parliamentary Secretary to the Minister of Public Services and Procurement, Lib.)",,Routine Proceedings,Interparliamentary Delegations,,"Mr. Speaker, pursuant to Standing Order 34(1), I have the honour to present to the House, in both official languages, the report of the Canadian parliamentary delegation respecting its participation at the election observation mission of the OSCE Parliamentary Assembly, held in Washington, D.C., and Raleigh, North Carolina, from November 5 to 8, 2016.",Liberal,Aurora—Oak Ridges—Richmond Hill,Leona Alleslev,http://www.parl.gc.ca/MembersOfParliament/ProfileMP.aspx?Key=219882&Language=E
4694588,ca.proc.d.2016-12-14.9321365,2016-12-14,7cff4486-6787-493d-a4ee-a59d48f68ab3,219527,"Hon. Denis Paradis (Brome—Missisquoi, Lib.)",,Routine Proceedings,Committees of the House,Official Languages,"Mr. Speaker, before I go ahead with the official tabling of the report of the Standing Committee on Official Languages regarding the action plan for the next five years, I would like to thank the House of Commons staff who contributed to that report, specifically the clerk, Christine Holke, and the research staff, Lucie Lecomte and Geneviève Gosselin.
A lot of time went into this report. I am proud to chair a committee that feels like a big family. I want to thank my fellow members of the Standing Committee on Official Languages. I congratulate the member for Perth—Wellington, who is a new father to a bilingual son. I thank the member for Drummond for his targeted contributions, the member for Madawaska—Restigouche for his collegiality, the member for Beauport—Côte-de-Beaupré—Île d'Orléans—Charlevoix for her dedication, the member for Montmagny—L'Islet—Kamouraska—Rivière-du-Loup for his bilingualism at home, the member for Rivière-des-Mille-Îles for her sensitivity to minority communities, the member for Sudbury for his energy and ability to bring people together, the member for Sackville—Preston—Chezzetcook for his joie de vivre as a proud Nova Scotian, and the member for Saint Boniface—Saint Vital for his commitment to his community.
I have the honour to present, in both official languages, the third report of the Standing Committee on Official Languages entitled, “Toward a New Action Plan for Official Languages and Building New Momentum for Immigration in Francophone Minority Communities”. Pursuant to Standing Order 109, the committee requests that the government table a comprehensive response to this report.",Liberal,Brome—Missisquoi,Denis Paradis,http://www.parl.gc.ca/MembersOfParliament/ProfileMP.aspx?Key=219527&Language=E
4694589,ca.proc.d.2016-12-14.9321368,2016-12-14,8c3e4bb0-ac84-4071-bc91-3b47268a13eb,220250,"Hon. Judy A. Sgro (Humber River—Black Creek, Lib.)",,Routine Proceedings,Committees of the House,"Transport, Infrastructure and Communities","Mr. Speaker, I too want to congratulate all the members of the House for a very successful year and wish everyone a merry Christmas and a very happy new year.
I have the great honour to present, in both official languages, the ninth report of the Standing Committee on Transport, Infrastructure and Communities in relation to its study of certain provisions of the Fair Rail for Grain Farmers Act. ",Liberal,Humber River—Black Creek,Judy Sgro,http://www.parl.gc.ca/MembersOfParliament/ProfileMP.aspx?Key=220250&Language=E
4694590,ca.proc.d.2016-12-14.9321371,2016-12-14,3378437f-1669-4fcb-9c2e-0c7c12626a1e,219102,"Mrs. Deborah Schulte (King—Vaughan, Lib.)",,Routine Proceedings,Committees of the House,Environment and Sustainable Development,"Mr. Speaker, I would also like to take this opportunity to thank all the staff who help this House run so smoothly, and I want to thank the great staff we have in the committee for their excellent work this year. We have been working very hard, and they have done an excellent job, and I just want to call them out in the House today.
I have the honour to present, in both official languages, the fourth report of the Standing Committee on Environment and Sustainable Development in relation to C-18, an act to amend the Rouge National Urban Park Act, the Parks Canada Agency Act and the Canada National Parks Act. The committee has studied the bill and has decided to report the bill back to the House, without amendment.
Happy Hanukkah and happy holidays to all.",Liberal,King—Vaughan,Deb Schulte,http://www.parl.gc.ca/MembersOfParliament/ProfileMP.aspx?Key=219102&Language=E
4694591,ca.proc.d.2016-12-14.9321375,2016-12-14,9c9a64e6-58f1-4367-9f49-93ad31744c96,217354,"Mrs. Cathy McLeod (Kamloops—Thompson—Cariboo, CPC)",,Routine Proceedings,Controlled Drugs and Substances Act,," moved for leave to introduce Bill C-330, An Act to amend the Controlled Drugs and Substances Act (landlord consent).
Mr. Speaker, this bill is looking for landlord consent. As members may be aware, medical marijuana can be grown in homes, and at times, landlords are absolutely devastated by the impact, with no control. I am seeking that if medical marijuana is to be grown in a home, the landlord needs to give permission first.
 (Motions deemed adopted, bill read the first time and printed) ",Conservative,Kamloops—Thompson—Cariboo,Cathy McLeod,http://www.parl.gc.ca/MembersOfParliament/ProfileMP.aspx?Key=217354&Language=E
4694592,ca.proc.d.2016-12-14.9321383,2016-12-14,b41c3b7e-c64f-4415-9f58-79d7462e5d8e,217341,"Mr. Peter Julian (New Westminster—Burnaby, NDP)",,Routine Proceedings,Federal Courts Act,," moved for leave to introduce Bill C-331, An Act to amend the Federal Courts Act (international promotion and protection of human rights).
Mr. Speaker, I thank the excellent member for Vancouver Kingsway for seconding my bill.
Some mining companies behave responsibly, but others ignore human, environmental, and labour rights. We can no longer ignore these human rights violations abroad. This is about fundamental Canadian values.
This legislation would create a new civil cause of action that would allow the Federal Court to hear claims for violations of international law that occur outside of Canada where there is no established impartial legal system.
The Canadian Association of Labour Lawyers has endorsed the bill.
My bill would help to end impunity by holding corporations accountable for violations of human rights wherever they occur.
I hope all members will support this initiative to protect and promote human rights around the world.
 (Motions deemed adopted, bill read the first time and printed) ",New Democratic Party,New Westminster—Burnaby,Peter Julian,http://www.parl.gc.ca/MembersOfParliament/ProfileMP.aspx?Key=217341&Language=E
4694593,ca.proc.d.2016-12-14.9321398,2016-12-14,dbb0dd7c-287c-4115-9424-4b2c55652877,215917,"Mr. Robert-Falcon Ouellette (Winnipeg Centre, Lib.)",,Routine Proceedings,United Nations Declaration on the Rights of Indigenous Peoples Reporting Act,," moved for leave to introduce Bill C-332, An Act to provide for reporting on compliance with the United Nations Declaration on the Rights of Indigenous Peoples.
Mr. Speaker, I am proud to have the support of the member for Etobicoke Centre. 
I rise today to present a bill that would offer a higher of accountability, an act to provide for reporting on compliance with the United Nations Declaration on the Rights of Indigenous Peoples. The federal government in consultations with provincial and territorial governments and with first nations, Métis, and Inuit peoples must report 15 sitting days after June 2 of every year. This legislation would fulfill the seven teachings of honesty, knowledge, humility, respect, love, effort, and courage.
[Member spoke in aboriginal language]
[English]
 (Motions deemed adopted, bill read the first time and printed) ",Liberal,Winnipeg Centre,Robert-Falcon Ouellette,http://www.parl.gc.ca/MembersOfParliament/ProfileMP.aspx?Key=215917&Language=E
4694594,ca.proc.d.2016-12-14.9321412,2016-12-14,c5b09363-414d-43b2-bc2c-274b997c8989,217112,"Ms. Jenny Kwan (Vancouver East, NDP)",,Routine Proceedings,Citizenship Act,," moved for leave to introduce Bill C-333, An Act to amend the Citizenship Act and the Immigration and Refugee Protection Act (granting and revoking of citizenship).
Mr. Speaker, this legislation seeks to address three issues, one being the Citizenship Act. The bill seeks to restore the procedural fairness for those who are faced with citizenship revocation, amendments that I tabled at committee that unfortunately did not pass. I am hopeful that they will get through by way of this private member's bill.
The other two aspects of the bill deal with the Immigration and Refugee Protection Act. One is on cessation, particularly for refugees who have had cessation of status as a result of travelling back to their country of origin. This is egregious and should be fixed.
Last but not least, due to a series of archaic laws over the years a number of Canadians have found themselves without their Canadian citizenship after many years. That should not be the case. Prior to the 150th anniversary of this country, we need to restore citizenship to those who have lost it because of these archaic laws.
 (Motions deemed adopted, bill read the first time and printed) ",New Democratic Party,Vancouver East,Jenny Kwan,http://www.parl.gc.ca/MembersOfParliament/ProfileMP.aspx?Key=217112&Language=E
4694595,ca.proc.d.2016-12-14.9321432,2016-12-14,b37cad30-26f6-40c6-8e4c-dd3a0ba841bb,217034,"Mrs. Cheryl Gallant (Renfrew—Nipissing—Pembroke, CPC)",,Routine Proceedings,Petitions,Small Business,"Mr. Speaker, I am pleased to present a petition signed by campers who stayed at the Castleton Hills RV Park in Castleton, Ontario, which is located in the tranquil rolling hills of Northumberland—Peterborough South. The petitioners call on the government to ensure that campgrounds with fewer than five full-time, year-round employees will continue to be recognized and taxed as small businesses.",Conservative,Renfrew—Nipissing—Pembroke,Cheryl Gallant,http://www.parl.gc.ca/MembersOfParliament/ProfileMP.aspx?Key=217034&Language=E
4694596,ca.proc.d.2016-12-14.9321438,2016-12-14,cedf1659-ebb1-4f26-b723-5c7c5353988b,214948,"Mrs. Carol Hughes (Algoma—Manitoulin—Kapuskasing, NDP)",,Routine Proceedings,Petitions,Telecommunications,"Mr. Speaker, I rise to present a petition signed by individuals from Wikwemikong First Nation, who see how media concentration and digital convergence have made community TV and media even more important and necessary. They point out that the Broadcasting Act stipulates that community, private, and public broadcasting should complement one another and that CRTC policy states, “the community channel should be primarily of a public service nature, facilitating self-expression through free and open access by members of the community”.
The petitioners are asking the government to enable a network of community-operated media centres. They feel this would ensure the survival of community TV, the availability of local media in areas not served by private or public media, and would give all Canadians access to multi-platform media skills training and content distribution in the digital economy.",New Democratic Party,Algoma—Manitoulin—Kapuskasing,Carol Hughes,http://www.parl.gc.ca/MembersOfParliament/ProfileMP.aspx?Key=214948&Language=E
4694597,ca.proc.d.2016-12-14.9321452,2016-12-14,030c04f1-a5d5-4ba8-b5f2-cd412d43e4bf,219651,"Ms. Julie Dabrusin (Toronto—Danforth, Lib.)",,Routine Proceedings,Petitions,Telecommunications,"Mr. Speaker, I rise to present three petitions on behalf of residents of the ridings of Toronto Centre, Toronto—St. Paul's, and Thunder Bay—Superior North, calling on the government to enable a network of community-operated media centres to ensure the survival of community TV, the availability of local media in towns and neighbourhoods not served by public or private media, and that all Canadian residents have access to multi-platform media skills training and content distribution in the digital economy.
I would like to thank Dawn Jobson, Cathy Edwards, Donna Mikeluk, and the Regent Park Focus Youth Media Arts Centre for their advocacy on this issue. ",Liberal,Toronto—Danforth,Julie Dabrusin,http://www.parl.gc.ca/MembersOfParliament/ProfileMP.aspx?Key=219651&Language=E
4694598,ca.proc.d.2016-12-14.9321458,2016-12-14,cad621a1-daf5-4d48-b500-1fc5344b5646,216984,"Mr. David Sweet (Flamborough—Glanbrook, CPC)",,Routine Proceedings,Petitions,Electoral Reform,"Mr. Speaker, it is my honour to present my first electronic petition, with 757 signatures by people who are demanding that if the government is going to change the federal electoral system, it first seek a mandate from the people through a referendum.
If you would give me the liberty for just one moment, a group of people that I think all of my colleagues would like to wish a very merry Christmas and a happy new year to would be our Canadian Forces and all first responders, who keep us safe, but, particularly, the Canadian Forces members who are in theatre right now and risking their lives in the Middle East. We want them to know that we will remember them throughout our holidays and will be praying for them and their families and that they continue to be safe while guarding all of those things that are valuable to us: democracy, human rights, and the rule of law.",Conservative,Flamborough—Glanbrook,David Sweet,http://www.parl.gc.ca/MembersOfParliament/ProfileMP.aspx?Key=216984&Language=E
4694599,ca.proc.d.2016-12-14.9321463,2016-12-14,3176068f-62ee-4b2f-aacd-1131201c6db1,214707,The Speaker,,Routine Proceedings,Petitions,Electoral Reform,I thank the hon. member for Flamborough—Glanbrook for mentioning our Canadian Forces personnel and first responders. I know that members would join him in that.,Liberal,Halifax West,Geoff Regan,http://www.parl.gc.ca/MembersOfParliament/ProfileMP.aspx?Key=214707&Language=E
4694600,ca.proc.d.2016-12-14.9321466,2016-12-14,661a3062-86d1-4ba3-9e70-81c866aa2fc3,224986,"Mr. David Anderson (Cypress Hills—Grasslands, CPC)",,Routine Proceedings,Petitions,Justice,"Mr. Speaker, I have two petitions to present.
In the first petition, a number of my constituents call upon the House of Commons to pass legislation that recognizes preborn children as separate victims when they are injured or killed during the commission of an offence against their mothers, which would allow two charges to be laid against the offender, instead of just one.",Conservative,Cypress Hills—Grasslands,David Anderson,http://www.parl.gc.ca/MembersOfParliament/ProfileMP.aspx?Key=224986&Language=E
4694601,ca.proc.d.2016-12-14.9321812,2016-12-14,661a3062-86d1-4ba3-9e70-81c866aa2fc3,224986,"Mr. David Anderson (Cypress Hills—Grasslands, CPC)",,Routine Proceedings,Petitions,Iran,"Mr. Speaker, my second petition calls on the Government of Canada to maintain the listing of the Islamic Republic of Iran as a state supporter of terrorism for as long as the Iranian regime continues to sponsor terrorism.
On a lighter note, I would like to wish the Speaker, all members, and all Canadians a very merry Christmas.",Conservative,Cypress Hills—Grasslands,David Anderson,http://www.parl.gc.ca/MembersOfParliament/ProfileMP.aspx?Key=224986&Language=E
4694602,ca.proc.d.2016-12-14.9321473,2016-12-14,95ed53a7-7538-4c0f-85a4-64af76065f95,218942,"Mr. Don Davies (Vancouver Kingsway, NDP)",,Routine Proceedings,Petitions,Telecommunications,"Mr. Speaker, I am pleased to present a petition signed by dozens of residents of Vancouver Kingsway calling on the government to enable a network of community-operated media centres to ensure the survival of community TV, the availability of local media in towns and neighbourhoods not served by public or private media, and that all Canadian residents have access to multi-platform media skills training and content distribution in the digital economy. These people recognize the vital importance of community media in this country as a complement to the private and public elements.
I also would like to extend my best wishes to the Speaker and all members of the House for a peaceful and joyous holiday season and best wishes for a happy new year.",New Democratic Party,Vancouver Kingsway,Don Davies,http://www.parl.gc.ca/MembersOfParliament/ProfileMP.aspx?Key=218942&Language=E
4694603,ca.proc.d.2016-12-14.9321486,2016-12-14,4efcc2e2-bd91-4234-b907-a24838d4f1aa,217139,"Ms. Christine Moore (Abitibi—Témiscamingue, NDP)",,Routine Proceedings,Petitions,Telecommunications,"Mr. Speaker, I am pleased to present a petition signed mainly by people from the region of Temiscaming in my riding. They believe that community television and access to local media is important. They are asking the government and the CRTC to take action on this matter.",New Democratic Party,Abitibi—Témiscamingue,Christine Moore,http://www.parl.gc.ca/MembersOfParliament/ProfileMP.aspx?Key=217139&Language=E
4694604,ca.proc.d.2016-12-14.9321493,2016-12-14,04ef6f9c-3039-4fb0-a1ad-82a6ba2f03bf,214660,"Mr. Peter Schiefke (Vaudreuil—Soulanges, Lib.)",,Routine Proceedings,Petitions,Telecommunications,"Mr. Speaker, I have a petition about community television and media signed by dozens of people in my riding, Vaudreuil—Soulanges. 
 The petitioners call on the government to enable a network of community-operated media centres to ensure, first, the survival of community television; second, the availability of local media in towns and neighbourhoods not served by public or private media; and last, that all Canadian residents have access to multi-platform media skills training and content distribution in the digital economy.",Liberal,Vaudreuil—Soulanges,Peter Schiefke,http://www.parl.gc.ca/MembersOfParliament/ProfileMP.aspx?Key=214660&Language=E
4694605,ca.proc.d.2016-12-14.9321498,2016-12-14,c5b09363-414d-43b2-bc2c-274b997c8989,217112,"Ms. Jenny Kwan (Vancouver East, NDP)",,Routine Proceedings,Petitions,Centerm Terminal,"Mr. Speaker, I rise to table a petition signed by over 4,000 people from Vancouver East and around the Lower Mainland. Joined with the online petition, this brings the number of signatories to over 10,000 people.
The petitioners wish to bring to the attention of the House the fact that Crab Park, a park for which the community fought long and hard, and was occupied crown land, was established back in 1984. 
The petitioners know that the Port of Vancouver will expand Centerm terminal by infilling an area the size of Crab Park. The community is very concerned with respect to the environmental impact, and how the enjoyment of the park will be impacted as a result of this expansion. 
The petitioners note that in 2015, the people of Vancouver East were caught by the smoke from a chemical fire in the Centerm terminal that required an evacuation. In our community, we have many seniors and disabled people who would be challenged as a result of this situation. They are very concerned with this expansion. 
They also note that the regulation brought forward by the former government grants the port sweeping powers, thereby giving it the authority to basically grant its own decisions and to review its own projects. They are calling on the government to conduct a full review of the port, to bring accountability back to the port, and call on the Minister of Transport to exercise his authority to stop the westward expansion of the Centerm terminal",New Democratic Party,Vancouver East,Jenny Kwan,http://www.parl.gc.ca/MembersOfParliament/ProfileMP.aspx?Key=217112&Language=E
