basepk,hid,speechdate,pid,opid,speakeroldname,speakerposition,maintopic,subtopic,subsubtopic,speechtext,speakerparty,speakerriding,speakername,speakerurl
4689787,ca.proc.d.2016-11-22.9248644,2016-11-22,72e2a81c-f40c-4c0f-8be0-09a9e61254c3,219070,"Hon. Robert Nault (Kenora, Lib.)",,Routine Proceedings,Interparliamentary Delegations,,"Mr. Speaker, pursuant to Standing Order 34(1), I have the honour to present to the House, in both official languages, the report of the Canadian section of ParlAmericas respecting its participation at the ParlAmericas annual gathering on climate change entitled “Parliamentary Action to Stop Climate Change”, held in Panama City, Panama, from August 3 to August 5, 2016.",Liberal,Kenora,Bob Nault,http://www.parl.gc.ca/MembersOfParliament/ProfileMP.aspx?Key=219070&Language=E
4689788,ca.proc.d.2016-11-22.9248654,2016-11-22,bd2068aa-74c7-430a-bdf5-6f17b14ca140,226924,"Mr. Tom Kmiec (Calgary Shepard, CPC)",,Routine Proceedings,Petitions,Electoral Reform,"Mr. Speaker, I rise today to table a petition on electoral reform. It is signed by 144 petitioners, who are calling upon the House of Commons to pass a motion affirming the need for a national referendum on any proposal to change Canada's current method of electing members of Parliament before that proposal is implemented into law.",Conservative,Calgary Shepard,Tom Kmiec,http://www.parl.gc.ca/MembersOfParliament/ProfileMP.aspx?Key=226924&Language=E
4689789,ca.proc.d.2016-11-22.9248657,2016-11-22,bb27e38b-4887-48e1-b182-ba18b39d411b,214426,"Mr. Gordon Brown (Leeds—Grenville—Thousand Islands and Rideau Lakes, CPC)",,Routine Proceedings,Petitions,Seniors,"Mr. Speaker, I tried to present this last Thursday. However, the government used its majority to interfere with routine proceedings. Therefore, today I am delighted to present a petition with respect to seniors. One in six Canadians is a senior. I am pleased to present this petition, signed by Canadians from across Canada, which calls upon Parliament to appoint a minister for seniors and to develop a national strategy for seniors.",Conservative,Leeds—Grenville—Thousand Islands and Rideau Lakes,Gord Brown,http://www.parl.gc.ca/MembersOfParliament/ProfileMP.aspx?Key=214426&Language=E
4689790,ca.proc.d.2016-11-22.9248660,2016-11-22,2428082e-6784-4ce4-ae08-dab7caa06e6b,217555,"Mr. Ron Liepert (Calgary Signal Hill, CPC)",,Routine Proceedings,Petitions,Falun Gong,"Mr. Speaker, I would like to table a petition on behalf of the Falun Gong members in my riding, who are asking the federal government to take action on the unethical harvesting of organs.",Conservative,Calgary Signal Hill,Ron Liepert,http://www.parl.gc.ca/MembersOfParliament/ProfileMP.aspx?Key=217555&Language=E
4689791,ca.proc.d.2016-11-22.9248664,2016-11-22,07cf5767-802c-406c-92a7-7dc92af79b40,214668,"Mr. Kevin Lamoureux (Parliamentary Secretary to the Leader of the Government in the House of Commons, Lib.)",,Routine Proceedings,Questions on the Order Paper,,"Mr. Speaker, I would ask that all questions be allowed to stand at this time.",Liberal,Winnipeg North,Kevin Lamoureux,http://www.parl.gc.ca/MembersOfParliament/ProfileMP.aspx?Key=214668&Language=E
4689792,ca.proc.d.2016-11-22.9248667,2016-11-22,3176068f-62ee-4b2f-aacd-1131201c6db1,214707,The Speaker,,Routine Proceedings,Questions on the Order Paper,,Is it agreed?,Liberal,Halifax West,Geoff Regan,http://www.parl.gc.ca/MembersOfParliament/ProfileMP.aspx?Key=214707&Language=E
4689793,ca.proc.d.2016-11-22.p4645187,2016-11-22,,,,intervention,Routine Proceedings,Questions on the Order Paper,, Agreed. ,,,Some hon. members,
4689794,ca.proc.d.2016-11-22.9248673,2016-11-22,b42374fa-e181-4337-93e9-2a5c41eb5d1e,216772,Hon. Rob Nicholson,,Routine Proceedings,Questions on the Order Paper,,"Mr. Speaker, I rise on a point of order. I wonder if we could go back for a moment to presenting petitions. Could I get the consent of the House to do that?",Conservative,Niagara Falls,Rob Nicholson,http://www.parl.gc.ca/MembersOfParliament/ProfileMP.aspx?Key=216772&Language=E
4689795,ca.proc.d.2016-11-22.9248674,2016-11-22,3176068f-62ee-4b2f-aacd-1131201c6db1,214707,The Speaker,,Routine Proceedings,Questions on the Order Paper,,The hon. member has asked for consent to return for a moment to presenting petitions. Is it agreed?,Liberal,Halifax West,Geoff Regan,http://www.parl.gc.ca/MembersOfParliament/ProfileMP.aspx?Key=214707&Language=E
4689796,ca.proc.d.2016-11-22.p4645190,2016-11-22,,,,intervention,Routine Proceedings,Questions on the Order Paper,, Agreed.,,,Some hon. members,
4689797,ca.proc.d.2016-11-22.9248678,2016-11-22,b42374fa-e181-4337-93e9-2a5c41eb5d1e,216772,"Hon. Rob Nicholson (Niagara Falls, CPC)",,Routine Proceedings,Petitions,Dementia,"Mr. Speaker, today I am pleased to present to the House of Commons a petition with respect to my private member's bill, Bill C-233. The bill supports developing strategies for patients and families of Alzheimer's and dementia victims. It has been certified by the clerk of petitions. I am proud to present this petition.",Conservative,Niagara Falls,Rob Nicholson,http://www.parl.gc.ca/MembersOfParliament/ProfileMP.aspx?Key=216772&Language=E
4689798,ca.proc.d.2016-11-22.p4645192,2016-11-22,,,,stagedirection,Government Orders,Canada-European Union Comprehensive Economic and Trade Agreement Implementation Act,,"The House resumed from November 21 consideration of the motion that Bill C-30, An Act to implement the Comprehensive Economic and Trade Agreement between Canada and the European Union and its Member States and to provide for certain other measures, be read the second time and referred to a committee.",,,,
4689799,ca.proc.d.2016-11-22.9248686,2016-11-22,eb417798-95f7-45a0-b1e9-ca3a6526d4db,217116,"Mr. Alistair MacGregor (Cowichan—Malahat—Langford, NDP)",,Government Orders,Canada-European Union Comprehensive Economic and Trade Agreement Implementation Act,,"Mr. Speaker, I had three minutes in my speech yesterday so I will be continuing along today. The point I want to underline is that we in the NDP will be here to provide reasoned and progressive elements to debate in this implementation act for CETA.
As I was saying in my saying in my speech on the bill yesterday, it remains a mystery as to why the government is trying to ram the bill through without letting parliamentarians conduct their proper research and oversight. I want to refer all members of this House to the open and accountable government publication from the Prime Minister that ministers were to treat Parliament with respect and provide the necessary information for parliamentarians to do their job. I quote from that document:
 Clear ministerial accountability to Parliament is fundamental to responsible government, and requires that Ministers provide Parliament with the information it needs to fulfill its roles of legislating, approving the appropriation of funds and holding the government to account. 
The Prime Minister expects ministers to demonstrate respect and support for the parliamentary process. However, if we look at the facts surrounding the introduction of the bill, on October 30 the Prime Minister signed CETA at the EU-Canada Leaders' Summit, and it was only two days later that the implementing legislation, Bill C-30, was introduced in Parliament. 
This rushed process violated the government's own policy on the tabling of treaties in Parliament, which requires the government to table a copy of the treaty, along with an explanatory memorandum that outlines the key components of the treaty, at least 21 sitting days before we debate. That was violated, and I would argue that the spirit of open and accountable government was clearly violated by ignoring that process.
Furthermore, we know that the international trade committee has already passed a motion that will restrict written submissions to only those witnesses who are selected to appear. Let me make that clear. No Canadians who do not appear before the committee will be allowed to provide written submissions, and only those who have the means to travel to Ottawa and the time to do so will be allowed to do so. We are in effect closing down exactly from whom we will hear on this.
If we compare that with the government's process on the trans-Pacific partnership, where the committee heard from over 400 witnesses and received written submissions from approximately 60,000 Canadians, there really is no comparison.
The underlying point here is that Parliament is essentially being asked to write a blank cheque with this implementation bill, despite the fact that each of the 28 EU member states will have to ratify CETA for all of the provisions to apply, and it is a process that is expected to take between two to five years. 
I ask again, what is the rush? What is the government trying to ram through here? Why is it not letting parliamentarians do due oversight when there is obviously enough time for us to examine the bill?
The next part I want to look at is on the investor-state dispute mechanism. New Democrats support trade deals that reduce tariffs and boost exports, but we will always remain firm that components like investor-state provisions that threaten our sovereignty have no place in trade deals. 
The new investor court system still allows foreign investors to seek compensation from any level of government over policy decisions they feel impact their profits. Furthermore, the Liberals still have not explained how they will ensure that environmental and health and safety regulations would be protected from foreign challenges. Even the joint interpretive statement about the investor court system falls outside the text of the treaty, and therefore does not have full legal weight.
If we look at the quote from the Canadian Environmental Law Association, it states that CETA “will significantly impact environmental protection and sustainable development in Canada. In particular, the inclusion of an investor-state dispute settlement mechanism....” It goes on to say that it will really “impact the federal and provincial governments' authority to protect the environment, promote resource conservation, or use green procurement as a means of advancing environmental policies and objectives.”
The other part I want to examine is particularly important to me, both as the NDP seniors critic and the member of Parliament for Cowichan—Malahat—Langford. It is the impact this deal would have on the cost of pharmaceutical drugs. I take the issue of pharmaceutical costs very seriously, because I have helped enough seniors over the last eight years to know that the high cost of these drugs can have a real impact on the quality of life of our seniors.
The chapter on intellectual property rights goes well beyond Canada's existing obligations. The increased patent protections granted to brand-name pharmaceuticals will have the effect of delaying the arrival of cheaper generics and will increase the cost of prescription drugs to Canadians by between $850 million and $2.8 billion per year. 
This is a cost that I do not think seniors are prepared to take on. Furthermore, I would argue it would hamper any efforts of bringing in a national pharmaceutical strategy both at the federal level and in what individual provinces are trying to do with their already ballooning health care costs.
I also want to quote Jim Keon, the president of the Canadian Generic Pharmaceutical Association, who said:
 A study prepared for the CGPA by two leading Canadian health economists in early 2011 estimated that, if adopted, the proposals would delay the introduction of new generic medicines in Canada by an average of three and a half years. The cost to pharmaceutical payers of this delay was estimated at $2.8 billion... 
Therefore, we do have validators of this opinion, we do have the research to back it up, and it is certainly a very real concern that we should be bringing up.
In conclusion, we are in favour of a trade deal with Europe. As I have stated previously, we have deep historical and cultural ties, and they are some of the most progressive democracies. However, we are concerned with specific measures in CETA as it is negotiated, and it is our job on this side of the House to uphold the interests of Canadians in process. 
The Liberals have missed key opportunities to fix this agreement, but the deal is still not done. We will continue to urge them to fix it. Furthermore, if Liberal members of Parliament are not prepared to stand up for the progressive interests of their constituents, we in the NDP are always ready to take on that rein, and we will do so proudly.",New Democratic Party,Cowichan—Malahat—Langford,Alistair MacGregor,http://www.parl.gc.ca/MembersOfParliament/ProfileMP.aspx?Key=217116&Language=E
4689800,ca.proc.d.2016-11-22.9248755,2016-11-22,07cf5767-802c-406c-92a7-7dc92af79b40,214668,"Mr. Kevin Lamoureux (Parliamentary Secretary to the Leader of the Government in the House of Commons, Lib.)",,Government Orders,Canada-European Union Comprehensive Economic and Trade Agreement Implementation Act,,"Madam Speaker, I can assure the member that Liberal members of Parliament are quite willing to stand up on the progressive nature of all trade agreements. 
 I am a bit surprised. From my perspective, it looks as if the NDP is trying to justify voting against yet another trade agreement. It seems to be part of the NDP DNA that trade agreements are bad. NDP members often cite that they supported one, and I think the one they say they supported was with Korea. However, I do not think they ever stood up and voted for a trade agreement.
At the end of the day, CETA is an agreement that the Liberal Party had supported virtually from the beginning. Throughout the election, Canadians understood that the Liberal Party was behind it.
Can the member please indicate to the House why NDP members feel that they can support Korea but not CETA?",Liberal,Winnipeg North,Kevin Lamoureux,http://www.parl.gc.ca/MembersOfParliament/ProfileMP.aspx?Key=214668&Language=E
4689801,ca.proc.d.2016-11-22.9248764,2016-11-22,eb417798-95f7-45a0-b1e9-ca3a6526d4db,217116,Mr. Alistair MacGregor,,Government Orders,Canada-European Union Comprehensive Economic and Trade Agreement Implementation Act,,"Madam Speaker, as I stated in my speech, if the Liberals and Conservatives are not going to stand up and raise concerns about the high cost of pharmaceuticals, about the impact of investor-state dispute resolutions, about the abilities of local governments to legislate and make laws in the public interest, then we will bring those issues forward for Canadians.
As I have stated, we support the overall intention of trade with Europe, but as long as these problematic provisions are in the trade agreement, we will give voice to those concerns. Furthermore, we have legitimate questions as to why the government side is rushing this through without due process. 
The government member knows very well that he has broken his own government's policies in this regard. They are trying to ram this through and limit the number of witnesses because they want to limit the amount of bad news they receive on the bill. Therefore, I say to the member that he should let Parliament do its job, not rush this process through, and allow the legitimate concerns of Canadians to have voice in the House, because it is not just a one-sided argument. There are many Canadians who have legitimate concerns. I will continue to proudly stand here and give voice to those concerns.",New Democratic Party,Cowichan—Malahat—Langford,Alistair MacGregor,http://www.parl.gc.ca/MembersOfParliament/ProfileMP.aspx?Key=217116&Language=E
4689802,ca.proc.d.2016-11-22.9248782,2016-11-22,78336f0e-962c-47d2-a5b8-b59a26592789,217339,"Mr. Matthew Dubé (Beloeil—Chambly, NDP)",,Government Orders,Canada-European Union Comprehensive Economic and Trade Agreement Implementation Act,,"Madam Speaker, I thank my colleague for his speech.
I would like to talk some more about transparency and how the debate process works because I really want to explain this for the people listening at home. Preventing witnesses and even experts from providing written submissions to the committee is an unprecedented decision. This is deeply troubling.
When a bill goes to committee, we often do not have enough time to hear witnesses because of our schedules and the different bills before us. Typically, the chair tells the committee members that we will ask for written submissions from experts who cannot attend the meetings, who are not available, or whom we do not have time to hear. That way, the committee can get a sense of all views on a particular subject.
We are not talking about radicals who send us wild and crazy submissions. We are talking about experts, such as university professors, lawyers, and pharmacists, who can tell us about the impact of this agreement on the price of pharmaceuticals.
Can my colleague describe to us how the Liberals are stifling debate with this kind of measure and tell us about how they are doing it even more than the Conservatives used to?",New Democratic Party,Beloeil—Chambly,Matthew Dubé,http://www.parl.gc.ca/MembersOfParliament/ProfileMP.aspx?Key=217339&Language=E
4689803,ca.proc.d.2016-11-22.9248804,2016-11-22,eb417798-95f7-45a0-b1e9-ca3a6526d4db,217116,Mr. Alistair MacGregor,,Government Orders,Canada-European Union Comprehensive Economic and Trade Agreement Implementation Act,,"Madam Speaker, I thank my hon. friend for bringing that question up, because I have before me a copy of the minutes of proceedings from the Standing Committee on International Trade, meeting No. 42, when it met on November 1st. Paragraph (b) of the motion that was passed at that in camera meeting states that the committee “consider testimony, written submissions and briefs only from the witnesses appearing before it”. That says to me that it wants to limit testimony to organizations that have the means to come forward. The committee is really trying to narrow down the depth of the conversation, so that when it provides its report to Parliament at report stage of the bill, it will seem as if it has the unanimous backing of Canadians, and that is going to be the furthest thing from the truth. 
This is yet another example of the Liberals limiting debate on an important issue on which all Canadians deserve to have a say.",New Democratic Party,Cowichan—Malahat—Langford,Alistair MacGregor,http://www.parl.gc.ca/MembersOfParliament/ProfileMP.aspx?Key=217116&Language=E
