basepk,hid,speechdate,pid,opid,speakeroldname,speakerposition,maintopic,subtopic,subsubtopic,speechtext,speakerparty,speakerriding,speakername,speakerurl
4693386,ca.proc.d.2016-12-08.9309190,2016-12-08,ae40e780-7dd1-4e34-bf90-4dbb35c18443,219902,"Mr. Jean-Claude Poissant (La Prairie, Lib.)",,Statements By Members,Family Farms,,"Mr. Speaker, as Canadians get ready to celebrate the holiday season and ring in the new year with family and friends, I would like to highlight the important contribution made by family farms and the agrifood industry in general, which make it possible for us to put high-quality, nutritious food on our tables.
Many Canadians will be working over the holidays. I am sure that these dedicated families, who work hard every day on our behalf, will be able to meet my colleagues' highest expectations. By supporting farmers and artisans in their regions, my colleagues will discover unique food products and will contribute to our country's economic success.
I therefore invite all members of the House to take a moment and spare a grateful thought for these families who help us savour the happy moments we share with loved ones.
Happy holidays.",Liberal,La Prairie,Jean-Claude Poissant,http://www.parl.gc.ca/MembersOfParliament/ProfileMP.aspx?Key=219902&Language=E
4693387,ca.proc.d.2016-12-08.9309197,2016-12-08,28d83c5f-3291-48a5-844c-0cc8b786fb15,224182,"Mrs. Sherry Romanado (Longueuil—Charles-LeMoyne, Lib.)",,Statements By Members,South Shore Media Fundraising Drive,,"Mr. Speaker, as the member for Longueuil—Charles-LeMoyne, I rise today because I want everyone in my riding and the greater Longueuil area to know that the 15th annual South Shore media fundraising drive is happening today. 
As the holiday season approaches, I encourage everyone to be generous to those less fortunate. Over the past 14 years, $3.7 million has been raised for organizations that help the underprivileged. I want to thank the precious volunteers, the municipalities of the greater Longueuil area, the corporate sponsors, the local and regional media, the board of directors of the fundraising drive, and its chair, Jean-Marie Girard. Thank you.",Liberal,Longueuil—Charles-LeMoyne,Sherry Romanado,http://www.parl.gc.ca/MembersOfParliament/ProfileMP.aspx?Key=224182&Language=E
4693388,ca.proc.d.2016-12-08.9309201,2016-12-08,661a3062-86d1-4ba3-9e70-81c866aa2fc3,224986,"Mr. David Anderson (Cypress Hills—Grasslands, CPC)",,Statements By Members,Human Rights,,"Mr. Speaker, December 10 will mark 68 years since the adoption of the Universal Declaration of Human Rights. This is the benchmark for the fundamental human rights to which all people are entitled, no matter their race, religion, ethnicity, sex, or status.
The universal declaration was created to help heal divides left by the Second World War, but it is just as important today. World events of 2016 have been poignant reminders of how fleeting and fragile human rights are for billions worldwide. Every day, freedom of religion is threatened, movement is restricted, free speech is stifled, and conflict creates additional turmoil for so many.
Human Rights Day is an annual reminder that this terrible reality exists. This year's focus encourages Canadians to stand up for victims of abuse in an increasingly interconnected world.
Countries like Canada have a responsibility to renew our commitment to protect those very basic rights; rights that vulnerable people often cannot address themselves.
I invite Canadians to reflect on what they can do to raise awareness and how they can participate in protecting and improving human rights.
Compassion never goes unnoticed or unrewarded.",Conservative,Cypress Hills—Grasslands,David Anderson,http://www.parl.gc.ca/MembersOfParliament/ProfileMP.aspx?Key=224986&Language=E
4693389,ca.proc.d.2016-12-08.9309206,2016-12-08,2d98e2df-3246-4a59-8048-8be83adb2c42,219871,"Mr. Marc Miller (Ville-Marie—Le Sud-Ouest—Île-des-Soeurs, Lib.)",,Statements By Members,Human Rights,,"Mr. Speaker, this Saturday we celebrate the 68th anniversary of the adoption of the Universal Declaration of Human Rights, drafted by John Peters Humphrey, an academic, human rights defender, and McGill graduate, of course. The declaration was the forerunner of countless human rights charters, including our own. It affirms the fundamental right of every individual to freedom and dignity and aims to transform states sweltering in the heat of oppression into oases of freedom and justice.
International Human Rights Day is an opportunity not only to mark the progress we have made, but also to think about all the work that remains to be done. Now more than ever, we must stand together to fight extremism, intolerance like Islamophobia, and violence.
I call on all members of the House as well as all Canadians to keep Mr. Humphrey's legacy alive and defend human rights all around the world, this Saturday and every day of the year.",Liberal,Ville-Marie—Le Sud-Ouest—Île-des-Soeurs,Marc Miller,http://www.parl.gc.ca/MembersOfParliament/ProfileMP.aspx?Key=219871&Language=E
4693390,ca.proc.d.2016-12-08.9309209,2016-12-08,e38f0ee9-418f-4b86-a6fd-2c859c05d475,220098,"Ms. Kamal Khera (Brampton West, Lib.)",,Statements By Members,"Immigration, Refugees and Citizenship",,"Mr. Speaker, I am proud to rise and acknowledge the work our government has done to reunite families. Over the last year, I have heard many heartbreaking stories from residents of Brampton West who have been separated from their partners for extended periods due to long application processing times and confusing requirements.
Yesterday, I joined the Minister of Immigration, Refugees and Citizenship in Brampton West as he announced that the processing times for spousal sponsorship applications would be reduced to 12 months from 26 months. Our government has simplified and streamlined the application process, resulting in a faster and more efficient system. The results speak for themselves. We have a government that listens and acts.
 I look forward to seeing the residents in my riding and across Canada reunited with their spouses, starting their families, and giving back to our society.",Liberal,Brampton West,Kamal Khera,http://www.parl.gc.ca/MembersOfParliament/ProfileMP.aspx?Key=220098&Language=E
4693391,ca.proc.d.2016-12-08.9309213,2016-12-08,3a48d31a-42fc-4320-a84f-da61c251bccd,219011,"Mr. Blaine Calkins (Red Deer—Lacombe, CPC)",,Statements By Members,Liberal Party of Canada,,"Mr. Speaker, there are reports of people smelling burnt toast on the Liberal front bench. Late last week, the Minister of Democratic Institutions was forced to stand in the House and apologize for what was termed an “outburst”. Insulting members of Parliament is not an outburst, it is outrageous. 
Recently, at a Senate committee, the Minister of Finance  apologized to the senators for not being prepared to answer their questions. Furthermore, the health minister and justice minister were made to pay back expenses they had wrongfully charged to Canadian taxpayers; the Ottawa minister completely bungled the selection of a new hospital site; and earlier this week, in order to avoid a walkout, the Prime Minister made his natural resources minister call and apologize to first nations chiefs. 
This all begs the question, does the Prime Minister still have confidence in his cabinet and might the new year bring a new front bench?",Conservative,Red Deer—Lacombe,Blaine Calkins,http://www.parl.gc.ca/MembersOfParliament/ProfileMP.aspx?Key=219011&Language=E
4693392,ca.proc.d.2016-12-08.9309216,2016-12-08,d5585b98-faca-4796-a7ea-a48d007cd58e,216077,"Mr. Gary Anandasangaree (Scarborough—Rouge Park, Lib.)",,Statements By Members,Scholars at Risk,,"Mr. Speaker, December 10 is Human Rights Day. The Universal Declaration of Human Rights defines our individual and collective rights. Brave women and men defend these rights in Canada and around the world each and every day. 
To mark this, we are proud to host the Scholars at Risk Network. The 450 academic institutions around the world, including 15 Canadian universities, protect scholars whose lives are at risk by giving them safety, security, and a reprieve from imminent danger. This ensures that human rights are protected, academic freedom is secured, and the right to free expression is sanctified. 
Today, we have five scholars joining us, along with their respective academic institutions: from Syria, Dr. Rana Mustafa, Dr. Nael Yasri, and Dr. Hanadi Ibrahim; from Palestine, Dr. Asmaa Abumuamar; and Dr. Homa Hoodfar,a Canadian academic who was held in Iran. We thank them for their bravery and enduring defence of human rights.",Liberal,Scarborough—Rouge Park,Gary Anandasangaree,http://www.parl.gc.ca/MembersOfParliament/ProfileMP.aspx?Key=216077&Language=E
4693393,ca.proc.d.2016-12-08.9309219,2016-12-08,0c9d00b0-a035-46d3-ba51-0db3e8da19b8,217281,"Mr. Murray Rankin (Victoria, NDP)",,Statements By Members,Scholars at Risk,,"Mr. Speaker, here on the Hill today, an organization called Scholars at Risk is meeting to discuss the importance of protecting academics around the world who are suffering grave threats to their lives, their liberty, and their very well-being merely because of the research they do. This organization works to promote and protect global academic freedom by arranging temporary research and teaching positions at Canadian universities that value the rights of these scholars to freely engage in their work. 
With this coming Saturday, December 10, marking Human Rights Day, I find it particularly timely to be highlighting the meaningful steps that this organization has taken to ensure that more than 700 scholars have found sanctuary since its inception in 2000 and that hundreds more have benefited from its referral services. This morning was pleased to join my parliamentary colleagues in meeting with this dedicated group. We will work together with the common goal of protecting and advancing academic freedom around the world.",New Democratic Party,Victoria,Murray Rankin,http://www.parl.gc.ca/MembersOfParliament/ProfileMP.aspx?Key=217281&Language=E
4693394,ca.proc.d.2016-12-08.9309250,2016-12-08,51d4e050-d737-4879-bead-20a3b672a36c,56126,"Hon. Diane Finley (Haldimand—Norfolk, CPC)",,Statements By Members,Thomas McQueen,,"Mr. Speaker, today, at the Beechwood National Military Cemetery, Canadian Air Force pilot, Capt. Thomas McQueen is being laid to rest. 
When he was eight years old, Thomas dreamed of being a fighter pilot. He designed paper airplanes. He went to air cadet camp, and he got top marks in school to get into training. An Afghanistan veteran, he even got to fly escort duty for Santa Claus. 
Thomas loved the outdoors. He loved speed, whether on land, on water, or in the air, and he was a notable handyman. When he decided that prices were too high in the furniture stores, he built his own furniture. 
He loved to make people laugh. But his real love was Caitlin. They were to be married right after Christmas. 
We thank Thomas for his service to our country. We extend our condolences to Caitlin; to his parents, Tom and Edith; and to his family and friends. A good man, a proud Christian, is now flying with the angels. ",Conservative,Haldimand—Norfolk,Diane Finley,http://www.parl.gc.ca/MembersOfParliament/ProfileMP.aspx?Key=56126&Language=E
4693395,ca.proc.d.2016-12-08.9309255,2016-12-08,4b18a0b6-bb17-4967-84ef-abb5a4dde893,219926,"Mr. Greg Fergus (Hull—Aylmer, Lib.)",,Statements By Members,Viola Desmond,,"Mr. Speaker, words and symbols matter. I was 4-years-old when I heard the N-word for the first time. I did not know what it meant, but the word stung.
Imagine how Viola Desmond felt when she was forced to leave her seat at the movie theatre.
Imagine the hurtfulness of that moment, the sting of being dragged out, arrested, and charged, the humiliation of losing her case in the courts. Her courageous act of standing up for her rights eventually led to a more just society.
For the first time, the image of a Canadian woman will be forever printed on a Canadian bank note. I thank the Minister of Finance for immortalizing this fight for human dignity.
Canadians of Afro-Canadian heritage are proud of what we are accomplishing. We, like all women, like Viola Desmond, strive to be fully equal, no more, no less. 
Words and symbols do matter. ",Liberal,Hull—Aylmer,Greg Fergus,http://www.parl.gc.ca/MembersOfParliament/ProfileMP.aspx?Key=219926&Language=E
4693396,ca.proc.d.2016-12-08.9309259,2016-12-08,cf6f39df-d304-45e1-a559-70a0cf20a720,214568,"Hon. Rona Ambrose (Leader of the Opposition, CPC)",,Oral Questions,The Economy,,"Mr. Speaker, I would like to welcome the outgoing vice-president to Canada today. We appreciate the good work that we all did together over the last decade. However, there are new challenges on the horizon with the United States, work that we fear the Prime Minister is not ready for.
While the new U.S. president-elect starts slashing taxes and looking out for American jobs first, the Prime Minister is doing photo ops and fundraisers. Meanwhile, there has not been a single additional full-time job created in this country in a year.
What is the Prime Minister's plan to compete and get Canadians back to work?",Conservative,Sturgeon River—Parkland,Rona Ambrose,http://www.parl.gc.ca/MembersOfParliament/ProfileMP.aspx?Key=214568&Language=E
4693397,ca.proc.d.2016-12-08.9309262,2016-12-08,b8c04eca-f237-48a8-8975-374ccd40d1a9,214115,"Right Hon. Justin Trudeau (Prime Minister, Lib.)",,Oral Questions,The Economy,,"Mr. Speaker, we presented our plan to grow the economy for the middle class last year during the election campaign, and Canadians overwhelmingly supported it. 
Since then we have been making record investments in infrastructure to put Canadians to work and to create opportunities for them to get to and from work with public transit. We have put more money in the pockets of the middle class by raising taxes on the wealthiest 1%, so we could lower them for middle-class Canadians. We are delivering a more generous Canada child benefit to the families that really need it by stopping sending it to millionaire families. 
These are some of the many things we are doing to help Canadians.",Liberal,Papineau,Justin Trudeau,http://www.parl.gc.ca/MembersOfParliament/ProfileMP.aspx?Key=214115&Language=E
4693398,ca.proc.d.2016-12-08.9309264,2016-12-08,cf6f39df-d304-45e1-a559-70a0cf20a720,214568,"Hon. Rona Ambrose (Leader of the Opposition, CPC)",,Oral Questions,The Economy,,"Mr. Speaker, here is why it is so important for the Prime Minister to start getting serious. 
In the U.S., the new administration is getting ready to slash taxes on businesses and families. It already has advantages over Canada in energy costs. Canada's competitiveness is at risk and jobs are going to go south even faster, unless the Prime Minister can get down to work.
Will the Prime Minister come back next year with a real low tax plan to keep jobs in Canada?",Conservative,Sturgeon River—Parkland,Rona Ambrose,http://www.parl.gc.ca/MembersOfParliament/ProfileMP.aspx?Key=214568&Language=E
4693399,ca.proc.d.2016-12-08.9309266,2016-12-08,b8c04eca-f237-48a8-8975-374ccd40d1a9,214115,"Right Hon. Justin Trudeau (Prime Minister, Lib.)",,Oral Questions,The Economy,,"Mr. Speaker, when the member opposite speaks about getting energy to markets, that is exactly what we have done by approving the Kinder Morgan TMX pipeline. That is going to allow us to diversify our energy markets and allow Alberta producers to finally get global prices for their natural resource.
On top of that, we continue to put forward growth and plans for investments that are going to help Canadians flourish right across the country.
We understand that building a strong economy and a strong environment go hand in hand, which the other party previously in government did not.",Liberal,Papineau,Justin Trudeau,http://www.parl.gc.ca/MembersOfParliament/ProfileMP.aspx?Key=214115&Language=E
4693400,ca.proc.d.2016-12-08.9309268,2016-12-08,cf6f39df-d304-45e1-a559-70a0cf20a720,214568,"Hon. Rona Ambrose (Leader of the Opposition, CPC)",,Oral Questions,The Economy,,"Mr. Speaker, high taxes are not creating jobs and with Trump's election, it is about to get worse.
The president-elect of our neighbour to the south has an aggressive approach to trade and protectionist policies to keep jobs in his country. That threatens Canadian jobs. To make matters worse, the Prime Minister suggested renegotiating NAFTA before anyone even asked him to.
Does the Prime Minister acknowledge that that was irresponsible?",Conservative,Sturgeon River—Parkland,Rona Ambrose,http://www.parl.gc.ca/MembersOfParliament/ProfileMP.aspx?Key=214568&Language=E
4693401,ca.proc.d.2016-12-08.9309270,2016-12-08,b8c04eca-f237-48a8-8975-374ccd40d1a9,214115,"Right Hon. Justin Trudeau (Prime Minister, Lib.)",,Oral Questions,The Economy,,"Mr. Speaker, all year long, opposition party members have spent their time criticizing the fact that we have been talking about global investment here in Canada, that I went to Davos and Sun Valley, and that we have talked to investors from around the world about investing in Canada. Decisions made by GE, GM, Amazon, and many other companies, including Thomson Reuters, indicate that we are on the right path to creating new, high-quality jobs here in Canada.
We understand what it means to be open to the world and to create jobs here. That is exactly what we are delivering to Canadians.",Liberal,Papineau,Justin Trudeau,http://www.parl.gc.ca/MembersOfParliament/ProfileMP.aspx?Key=214115&Language=E
4693402,ca.proc.d.2016-12-08.9309527,2016-12-08,cf6f39df-d304-45e1-a559-70a0cf20a720,214568,"Hon. Rona Ambrose (Leader of the Opposition, CPC)",,Oral Questions,Ethics,,"And not one new job in Canada, Mr. Speaker.
Yesterday, we asked about cash for access and the Prime Minister said, “there are a lot of questions about these issues”. He needs to answer them.
The Liberal Party is promoting these events as a chance to discuss business and lobby the government. The hosts of these fundraisers know it. The guests know it. The Prime Minister knows it, but he also knows that this is wrong.
When will the Prime Minister finally admit that selling access to raise money for the Liberal Party is unethical? When will he commit to stopping it?",Conservative,Sturgeon River—Parkland,Rona Ambrose,http://www.parl.gc.ca/MembersOfParliament/ProfileMP.aspx?Key=214568&Language=E
4693403,ca.proc.d.2016-12-08.9309276,2016-12-08,b8c04eca-f237-48a8-8975-374ccd40d1a9,214115,"Right Hon. Justin Trudeau (Prime Minister, Lib.)",,Oral Questions,Ethics,,"Mr. Speaker, despite what the members opposite say, Canadians can be reassured that we have some of the strongest rules in the country on political financing and fundraising. Those rules allow for openness, transparency, and accountability, which will reassure Canadians that everything is being done properly and within the rules.
That is exactly what the Liberal Party has always done. We follow all the rules and the values that underpin them.",Liberal,Papineau,Justin Trudeau,http://www.parl.gc.ca/MembersOfParliament/ProfileMP.aspx?Key=214115&Language=E
4693404,ca.proc.d.2016-12-08.9309279,2016-12-08,cf6f39df-d304-45e1-a559-70a0cf20a720,214568,"Hon. Rona Ambrose (Leader of the Opposition, CPC)",,Oral Questions,Ethics,,"Mr. Speaker, it is highly disappointing and it is actually disturbing to see the Prime Minister continue to blindly defend his actions of selling access to himself and the rest of the government. The Liberals are not even denying it anymore. They are explicitly linking government business with fundraising and raking in hundreds of thousands of dollars. Not only is the Prime Minister breaking his own ethical rules, but he appears to be breaking the conflict of interest laws.
Does the Prime Minister understand these facts and just does not care, or is the money too good to say no to?",Conservative,Sturgeon River—Parkland,Rona Ambrose,http://www.parl.gc.ca/MembersOfParliament/ProfileMP.aspx?Key=214568&Language=E
4693405,ca.proc.d.2016-12-08.9309281,2016-12-08,b8c04eca-f237-48a8-8975-374ccd40d1a9,214115,"Right Hon. Justin Trudeau (Prime Minister, Lib.)",,Oral Questions,Ethics,,"Mr. Speaker, despite the rhetoric and contentions of the members opposite, Canadians can be comfortable in knowing that, at the federal level, we have some of the strongest rules around fundraising and political financing across the country. Canadians can be reassured that we have always followed all the rules, and we always will, as well as upholding the principles and values under which Canadians have confidence in their government, principles like accountability, transparency and openness.",Liberal,Papineau,Justin Trudeau,http://www.parl.gc.ca/MembersOfParliament/ProfileMP.aspx?Key=214115&Language=E
4693406,ca.proc.d.2016-12-08.9309284,2016-12-08,551183c2-2f3e-41ba-8660-2d194cf60169,213985,"Hon. Thomas Mulcair (Outremont, NDP)",,Oral Questions,Ethics,,"Mr. Speaker, the Minister of Fisheries said that no government business was discussed during these exclusive fundraisers, but that turned out not to be true. 
I have a quote here that says, “There are questions about the inconsistencies in his own stories, his own contradictory statements, there are inconsistencies in what ministers of the Crown have been told to say to Parliament.” Do you know who said that? The Prime Minister himself, about the Conservatives' Senate scandal.
How can the Prime Minister justify becoming what he once criticized?",New Democratic Party,Outremont,Thomas Mulcair,http://www.parl.gc.ca/MembersOfParliament/ProfileMP.aspx?Key=213985&Language=E
4693407,ca.proc.d.2016-12-08.9309319,2016-12-08,b8c04eca-f237-48a8-8975-374ccd40d1a9,214115,"Right Hon. Justin Trudeau (Prime Minister, Lib.)",,Oral Questions,Ethics,,"Mr. Speaker, despite what the opposition members say, Canadians can be comfortable in knowing that, at the federal level, we have some of the strongest rules around political financing across the country. 
The reality is that Canadians can have confidence in the accountability, openness, and transparency of our electoral financing system. I can assure Canadians that the Liberal Party has always followed the rules and upheld their underlying values and principles. ",Liberal,Papineau,Justin Trudeau,http://www.parl.gc.ca/MembersOfParliament/ProfileMP.aspx?Key=214115&Language=E
4693408,ca.proc.d.2016-12-08.9309322,2016-12-08,551183c2-2f3e-41ba-8660-2d194cf60169,213985,"Hon. Thomas Mulcair (Outremont, NDP)",,Oral Questions,Ethics,,"Mr. Speaker, let us look at those rules. The Prime Minister himself said that he wrote rules banning cash for access events. He stated:
 There should be no preferential access to government...accorded to individuals...because they have made financial contributions to...political parties. 
I could not agree more with the words of the Prime Minister on that one.
Access to ministers and the Prime Minister should not be based on donations to a political party. Why? Because it is unethical. Therefore, my question for the Prime Minister is this. Where was he last night?",New Democratic Party,Outremont,Thomas Mulcair,http://www.parl.gc.ca/MembersOfParliament/ProfileMP.aspx?Key=213985&Language=E
4693409,ca.proc.d.2016-12-08.9309324,2016-12-08,b8c04eca-f237-48a8-8975-374ccd40d1a9,214115,"Right Hon. Justin Trudeau (Prime Minister, Lib.)",,Oral Questions,Ethics,,"Mr. Speaker, we all agree that the rules governing political financing are extremely important and need to be followed. That is why we always follow them. The principles of openness, transparency, and accountability are necessary for public trust in our institutions. That is why we are proud that we have among the strongest rules in the country for political fundraising, and we always follow them.",Liberal,Papineau,Justin Trudeau,http://www.parl.gc.ca/MembersOfParliament/ProfileMP.aspx?Key=214115&Language=E
4693410,ca.proc.d.2016-12-08.9309346,2016-12-08,551183c2-2f3e-41ba-8660-2d194cf60169,213985,"Hon. Thomas Mulcair (Outremont, NDP)",,Oral Questions,Democratic Reform,,"At another cash for access event.
Mr. Speaker, on democratic reform, I know the Prime Minister got a bit confused by my question yesterday, but I do acknowledge that he again recommitted to changing the voting system before the next election. We also know that in the past the Prime Minister has expressed his personal support for a system that greatly benefits the Liberals. 
My question for the Prime Minister is this. He would not unilaterally bring in a system that only helps the Liberals, would he?",New Democratic Party,Outremont,Thomas Mulcair,http://www.parl.gc.ca/MembersOfParliament/ProfileMP.aspx?Key=213985&Language=E
4693411,ca.proc.d.2016-12-08.9309358,2016-12-08,b8c04eca-f237-48a8-8975-374ccd40d1a9,214115,"Right Hon. Justin Trudeau (Prime Minister, Lib.)",,Oral Questions,Democratic Reform,,"Mr. Speaker, the fact is there are many, many different perspectives across this country on electoral reform. That is why I am so proud of the work that our minister and indeed the electoral reform committee, comprised of people from all parties, has done on this issue. 
We are also very pleased to be engaging directly with Canadians through MyDemocracy.ca, where I encourage Canadians to visit, fill out their perspectives, and share their thoughts on how we can improve our democracy and our electoral system. MyDemocracy.ca, I highly recommend it.",Liberal,Papineau,Justin Trudeau,http://www.parl.gc.ca/MembersOfParliament/ProfileMP.aspx?Key=214115&Language=E
