basepk,hid,speechdate,pid,opid,speakeroldname,speakerposition,maintopic,subtopic,subsubtopic,speechtext,speakerparty,speakerriding,speakername,speakerurl
4689963,ca.proc.d.2016-11-22.9251392,2016-11-22,f37d5cb2-a1ad-4ec9-a7de-ca265da02938,214560,"Hon. Harjit S. Sajjan (Minister of National Defence, Lib.)",,Oral Questions,National Defence,,"Mr. Speaker, the previous government could not get this done in the last 10 years, and it should have had it done. We should not be flying aircraft that are 30 years old. These aircraft should have been replaced a long time ago.
We will be launching an open and transparent competition once the defence review is complete. We will be putting in an interim capability as well for the gap. We are going to be investing in our Canadian Armed Forces to make sure they have the right tools to fulfill their missions. ",Liberal,Vancouver South,Harjit S. Sajjan,http://www.parl.gc.ca/MembersOfParliament/ProfileMP.aspx?Key=214560&Language=E
4689964,ca.proc.d.2016-11-22.9251395,2016-11-22,3176068f-62ee-4b2f-aacd-1131201c6db1,214707,The Speaker,,Oral Questions,National Defence,,"Most members are able to get through question period without reacting to what they hear, and all parties. I would encourage the member for Durham, and others to do the same.
The hon. member for Rimouski-Neigette—Témiscouata—Les Basques.",Liberal,Halifax West,Geoff Regan,http://www.parl.gc.ca/MembersOfParliament/ProfileMP.aspx?Key=214707&Language=E
4689965,ca.proc.d.2016-11-22.9251408,2016-11-22,a71a1741-7ff2-4246-b0da-4622e96b10cf,217230,"Mr. Guy Caron (Rimouski-Neigette—Témiscouata—Les Basques, NDP)",,Oral Questions,Infrastructure,,"Mr. Speaker, Stephen Harper's Conservatives never dared to go this far. The Liberals want to privatize our airports and are asking for advice from Credit Suisse, which is in the infrastructure-buying business.
The Liberals also want to privatize our ports and are asking for advice from Morgan Stanley, which also happens to be in the infrastructure-buying business.
I think that we can already guess what the Liberals are going to do, and that means that infrastructure that is key to Canada's economic development will be at the mercy of the private sector.
Where in their election platform did the Liberals talk about privatizing Canada's ports and airports?",New Democratic Party,Rimouski-Neigette—Témiscouata—Les Basques,Guy Caron,http://www.parl.gc.ca/MembersOfParliament/ProfileMP.aspx?Key=217230&Language=E
4689966,ca.proc.d.2016-11-22.9251421,2016-11-22,bc2e82f3-02f1-46e2-b9be-7d5f04ddddc9,214106,"Hon. Marc Garneau (Minister of Transport, Lib.)",,Oral Questions,Infrastructure,,"Mr. Speaker, we have not made any decisions regarding our ports and airports. I can guarantee that any decisions we make in the future regarding our airports will be in the best interests of travellers. That is our priority. In the case of ports, any decisions will be in the best interest of Canada's economy.",Liberal,Notre-Dame-de-Grâce—Westmount,Marc Garneau,http://www.parl.gc.ca/MembersOfParliament/ProfileMP.aspx?Key=214106&Language=E
4689967,ca.proc.d.2016-11-22.9251425,2016-11-22,4bc128a9-b349-4867-a545-ad05122c0e46,217242,"Ms. Niki Ashton (Churchill—Keewatinook Aski, NDP)",,Oral Questions,Infrastructure,,"Mr. Speaker, the made on Bay Street infrastructure privatization plan, while good for billionaire investors, is selling out Canadian jobs. The Port of Churchill is a devastating example of what happened the last time the Liberals privatized strategic infrastructure. They virtually gave the port away to an American billionaire who has since shut it down. People have lost their jobs, the community's future is in question, and we are all paying the price. 
When will the Liberals stand up for jobs and stop selling us out for the gain of private infrastructure?",New Democratic Party,Churchill—Keewatinook Aski,Niki Ashton,http://www.parl.gc.ca/MembersOfParliament/ProfileMP.aspx?Key=217242&Language=E
4689968,ca.proc.d.2016-11-22.9251428,2016-11-22,8908cde5-7474-4d2a-8c50-d05da5ee0712,214493,"Hon. Navdeep Bains (Minister of Innovation, Science and Economic Development, Lib.)",,Oral Questions,Infrastructure,,"Mr. Speaker, first I would like to take this opportunity to wish you a happy birthday before I respond to that question.
[Members sang Happy Birthday]",Liberal,Mississauga—Malton,Navdeep Bains,http://www.parl.gc.ca/MembersOfParliament/ProfileMP.aspx?Key=214493&Language=E
4689969,ca.proc.d.2016-11-22.9251431,2016-11-22,3176068f-62ee-4b2f-aacd-1131201c6db1,214707,The Speaker,,Oral Questions,Infrastructure,,"It is hard enough to get order in here. Thank you.
Order, please. The hon. Minister of Innovation, Science and Economic Development.",Liberal,Halifax West,Geoff Regan,http://www.parl.gc.ca/MembersOfParliament/ProfileMP.aspx?Key=214707&Language=E
4689970,ca.proc.d.2016-11-22.9251432,2016-11-22,8908cde5-7474-4d2a-8c50-d05da5ee0712,214493,Hon. Navdeep Bains,,Oral Questions,Infrastructure,,"Mr. Speaker I hope that does not go against my time allocation.
I want to take this opportunity again to highlight the very important initiative we put in place with regard to Churchill. We recognized the challenges there. That is why our government, through economic development, invested $4.6 million to create jobs to help the community before year-end.
We are concerned about economic development, we care about jobs, and we are making investments and growing the economy.",Liberal,Mississauga—Malton,Navdeep Bains,http://www.parl.gc.ca/MembersOfParliament/ProfileMP.aspx?Key=214493&Language=E
4689971,ca.proc.d.2016-11-22.9251434,2016-11-22,343b5c4a-fb8c-4248-8183-5ab683bc9f9f,219323,"Mr. Neil Ellis (Bay of Quinte, Lib.)",,Oral Questions,Agriculture and Agri-Food,,"Mr. Speaker, Canada is one of the world's largest pork exporters and represents 20% of the world's pork trade.
 Maintaining and opening up new markets to pork is critical to the Canadian hog industry, which drives economic growth in many rural regions across the country.
Could the Minister of Agriculture and Agri-Food update us on what our government is doing for the Canadian pork industry?",Liberal,Bay of Quinte,Neil Ellis,http://www.parl.gc.ca/MembersOfParliament/ProfileMP.aspx?Key=219323&Language=E
4689972,ca.proc.d.2016-11-22.9251439,2016-11-22,a25e0e6b-f3fa-46c7-a795-ad60037fe56e,213962,"Hon. Lawrence MacAulay (Minister of Agriculture and Agri-Food, Lib.)",,Oral Questions,Agriculture and Agri-Food,,"Mr. Speaker, I appreciate the concern of my hon. colleague.
Our government is firmly committed to pork producers. We secured repeal of the country of origin labelling, and have signed CETA, which will provide an additional $400 million in pork exports.
Last week, the Prime Minister made great progress in allowing the export of our pork to Argentina, which will provide even greater benefits for our pork producers.
Our government is committed to working hard to provide economic benefits for all Canadians.",Liberal,Cardigan,Lawrence MacAulay,http://www.parl.gc.ca/MembersOfParliament/ProfileMP.aspx?Key=213962&Language=E
4689973,ca.proc.d.2016-11-22.9251441,2016-11-22,febe5b3f-1a40-472b-873d-11be938a0e59,218106,"Hon. Gerry Ritz (Battlefords—Lloydminster, CPC)",,Oral Questions,International Trade,,"Mr. Speaker, the real advantage for pork is in the TPP.
Yesterday, the president-elect stated that the U.S. would withdraw from the TPP on his first day in office. In Canada, we have a Liberal government that does not know what to do about the TPP after the first year in office.
 The Minister of International Trade loves to espouse the pro-trade mantra, but her actions do not quite match up. 
Why will the Liberal government not get beyond consultation and move toward liberalizing trade in the Asia-Pacific with our remaining allies?",Conservative,Battlefords—Lloydminster,Gerry Ritz,http://www.parl.gc.ca/MembersOfParliament/ProfileMP.aspx?Key=218106&Language=E
4689974,ca.proc.d.2016-11-22.9251445,2016-11-22,3dd9162a-4763-4000-8c8a-706a788f7e50,213971,"Hon. Chrystia Freeland (Minister of International Trade, Lib.)",,Oral Questions,International Trade,,"Mr. Speaker, our pro-trade credentials are amply demonstrated by the fact that we got CETA signed, something the previous government did not.
 When it comes to the TPP, I welcome this opportunity to educate the member opposite about the technical details of an agreement his own government negotiated. That agreement, as negotiated by the members opposite, stipulates that the TPP can only come into force if it is ratified by the United States. Even if all 11 other countries ratify, there is no TPP.",Liberal,University—Rosedale,Chrystia Freeland,http://www.parl.gc.ca/MembersOfParliament/ProfileMP.aspx?Key=213971&Language=E
4689975,ca.proc.d.2016-11-22.9251447,2016-11-22,febe5b3f-1a40-472b-873d-11be938a0e59,218106,"Hon. Gerry Ritz (Battlefords—Lloydminster, CPC)",,Oral Questions,International Trade,,"That is absolutely false, Mr. Speaker. With the U.S. folding on TPP, since the Liberals will not ante up to fill the void, countries like China and Russia will step in. 
Japan and New Zealand will ratify the deal this year, with Australia and Mexico not be far behind. They will go it alone without the U.S. Why are we not part of that?
The Minister of International Trade also claims that TPP countries have two years. That is no longer the case. Everything has been moved forward now with the U.S. withdrawal. Therefore, when will the minister finally do her job to promote the TPP and actually implement this vitally important agreement?",Conservative,Battlefords—Lloydminster,Gerry Ritz,http://www.parl.gc.ca/MembersOfParliament/ProfileMP.aspx?Key=218106&Language=E
4689976,ca.proc.d.2016-11-22.9251449,2016-11-22,3dd9162a-4763-4000-8c8a-706a788f7e50,213971,"Hon. Chrystia Freeland (Minister of International Trade, Lib.)",,Oral Questions,International Trade,,"Mr. Speaker, I do not like embarrassing the member opposite, but the technical details of the TPP are that this agreement can only come into force if it is ratified by six countries which cover 85% of the GDP of the TPP countries. In practice, that means it must be ratified by the United States to come into force. Even if all other 11 ratify, there is no TPP.",Liberal,University—Rosedale,Chrystia Freeland,http://www.parl.gc.ca/MembersOfParliament/ProfileMP.aspx?Key=213971&Language=E
4689977,ca.proc.d.2016-11-22.9251451,2016-11-22,fc9a44ff-23e0-45df-8ec4-a9cccefa71e1,217758,"Hon. Ed Fast (Abbotsford, CPC)",,Oral Questions,International Trade,,"Mr. Speaker, it is clearly evident that the Liberal's trade agenda is in absolute chaos. There is no softwood lumber agreement, no TPP, and the Liberals have even undermined the protection of Canadian investors under our free trade agreement with the European Union.
The Liberal government does not even understand the damage it will cause to Canada's economy by imposing a massive carbon tax and increasing the price of electricity across Canada.
Why will the Liberals not champion trade, stand up for Canadian workers and businesses, and grow our economy?",Conservative,Abbotsford,Ed Fast,http://www.parl.gc.ca/MembersOfParliament/ProfileMP.aspx?Key=217758&Language=E
4689978,ca.proc.d.2016-11-22.9251456,2016-11-22,3dd9162a-4763-4000-8c8a-706a788f7e50,213971,"Hon. Chrystia Freeland (Minister of International Trade, Lib.)",,Oral Questions,International Trade,,"Mr. Speaker, I have the utmost personal respect and even great fondness for the member opposite. However, we have delivered on trade time after time when his government did not. 
We got the TPP signed. We got the discriminatory COOL measures removed. We secured access to Mexico and China for Canadian beef. Something I am personally proud of as a farmer's daughter, we got our canola sales to China done.",Liberal,University—Rosedale,Chrystia Freeland,http://www.parl.gc.ca/MembersOfParliament/ProfileMP.aspx?Key=213971&Language=E
4689979,ca.proc.d.2016-11-22.9251459,2016-11-22,fc9a44ff-23e0-45df-8ec4-a9cccefa71e1,217758,"Hon. Ed Fast (Abbotsford, CPC)",,Oral Questions,International Trade,,"Mr. Speaker, those were all our Conservative accomplishments.
I can go on and on about how the Liberals are failing Canadian families and workers. Why have they opened up a discussion with the United States on country of origin labelling, when Canada recently won its case at the World Trade Organization? Why did the Prime Minister break his promise to solve the softwood lumber dispute within 100 days of his meeting with President Obama? Do they remember that promise? Do the Liberals not realize how many jobs across Canada and in my home province of B.C. they have put at risk?",Conservative,Abbotsford,Ed Fast,http://www.parl.gc.ca/MembersOfParliament/ProfileMP.aspx?Key=217758&Language=E
4689980,ca.proc.d.2016-11-22.9251465,2016-11-22,3dd9162a-4763-4000-8c8a-706a788f7e50,213971,"Hon. Chrystia Freeland (Minister of International Trade, Lib.)",,Oral Questions,International Trade,,"Mr. Speaker, let me first clarify a misstatement by the member opposite. We have in no way opened up the COOL issue. In fact, I would like to remind everyone that our right to retaliate on COOL, as granted to us by the WTO, remains in place, and we are ready to use that right. 
When it comes to jobs, we have done a tremendous job of getting investment into Canada: Thomson Reuters, up to 1,500 jobs; GE, 200 jobs. The list goes—",Liberal,University—Rosedale,Chrystia Freeland,http://www.parl.gc.ca/MembersOfParliament/ProfileMP.aspx?Key=213971&Language=E
4689981,ca.proc.d.2016-11-22.9251467,2016-11-22,3176068f-62ee-4b2f-aacd-1131201c6db1,214707,The Speaker,,Oral Questions,International Trade,,The hon. member for Hochelaga.,Liberal,Halifax West,Geoff Regan,http://www.parl.gc.ca/MembersOfParliament/ProfileMP.aspx?Key=214707&Language=E
4689982,ca.proc.d.2016-11-22.9251468,2016-11-22,a710e2c4-20f9-4df8-ba6c-2dc50c03bb75,217321,"Ms. Marjolaine Boutin-Sweet (Hochelaga, NDP)",,Oral Questions,Housing,,"Mr. Speaker, today is National Housing Day. 
In the summary of the national housing strategy consultations, which was released this morning, the minister mentions the possibility of renewing the operating agreements with current operators that are set to expire. However, he made no mention of the agreements that have already expired. By the time a strategy is introduced in 2017, over 100,000 households will have lost their rent subsidies and may have to pay $200, $300, or $400 more a month for housing.
Does the minster also intend to renew the funding for agreements that have already expired?",New Democratic Party,Hochelaga,Marjolaine Boutin-Sweet,http://www.parl.gc.ca/MembersOfParliament/ProfileMP.aspx?Key=217321&Language=E
4689983,ca.proc.d.2016-11-22.9251473,2016-11-22,d67a49c2-65bd-411e-8bb4-29ff759c5829,214003,"Hon. Jean-Yves Duclos (Minister of Families, Children and Social Development, Lib.)",,Oral Questions,Housing,,"Mr. Speaker, I thank my colleague for giving me the opportunity to express just how honoured I have felt in recent months to participate in a consultation process that involved thousands of discussions between the Government of Canada, its partners in other governments, and the people who have been waiting for us for many years. They have been waiting for the federal government to recommit and to show leadership when it comes to helping Canadian families with their housing needs.",Liberal,Québec,Jean-Yves Duclos,http://www.parl.gc.ca/MembersOfParliament/ProfileMP.aspx?Key=214003&Language=E
4689984,ca.proc.d.2016-11-22.9251477,2016-11-22,f4efade5-e605-4926-b4d9-cea84ef76f14,217136,"Mr. Randall Garrison (Esquimalt—Saanich—Sooke, NDP)",,Oral Questions,National Defence,,"Mr. Speaker, it is clear that the Liberals' promise of an open competition to replace the CF-18s was not worth the paper it was written on. Instead, they are using the same approach as the Conservatives with the F-35s, this time hand-picking the Super Hornets without an open competition. Same approach, different jet. 
Everyone knows sole sourcing is the best way to get the worst price for taxpayers. Once again, the Liberals are breaking another major campaign promise. Does the minister really believe there can be an open competition five years from now after sole-sourcing nearly a third of the fleet?",New Democratic Party,Esquimalt—Saanich—Sooke,Randall Garrison,http://www.parl.gc.ca/MembersOfParliament/ProfileMP.aspx?Key=217136&Language=E
4689985,ca.proc.d.2016-11-22.9251479,2016-11-22,f37d5cb2-a1ad-4ec9-a7de-ca265da02938,214560,"Hon. Harjit S. Sajjan (Minister of National Defence, Lib.)",,Oral Questions,National Defence,,"Mr. Speaker, I would like to make sure that the member opposite understands how the process is going to work. After the defence policy is released, the process will begin for the permanent replacement of our fleet. In the interim, because of the capability gap, because we need to invest in the Canadian Armed Forces, we will be purchasing an interim fleet of 18 fighters to fill this gap.
I personally feel that investing in our Canadian Armed Forces is the right thing to do. That is exactly what our government promised to do, and that is exactly what we are doing.",Liberal,Vancouver South,Harjit S. Sajjan,http://www.parl.gc.ca/MembersOfParliament/ProfileMP.aspx?Key=214560&Language=E
4689986,ca.proc.d.2016-11-22.9251481,2016-11-22,9c9a64e6-58f1-4367-9f49-93ad31744c96,217354,"Mrs. Cathy McLeod (Kamloops—Thompson—Cariboo, CPC)",,Oral Questions,Indigenous Affairs,,"Mr. Speaker, as of this month, 88% of B.C. first nations have filed financial disclosures, because they recognize that empowering their members is the right thing to do, and that means giving them access to information.
Since the Liberals stopped enforcing the act, many more are falling very far behind in their filings, including the Semiahmoo, Popkum, and Skatin. How can the minister defend her disregard for grassroots members, and why will she not start empowering community members and enforce the law?",Conservative,Kamloops—Thompson—Cariboo,Cathy McLeod,http://www.parl.gc.ca/MembersOfParliament/ProfileMP.aspx?Key=217354&Language=E
4689987,ca.proc.d.2016-11-22.9251484,2016-11-22,f470e27a-a074-4b16-8304-960ffe8c9289,213975,"Hon. Carolyn Bennett (Minister of Indigenous and Northern Affairs, Lib.)",,Oral Questions,Indigenous Affairs,,"Mr. Speaker, once again I remind the member that the Kelowna Accord's collaborative approach led to a framework for accountability, which that party's members tore up. Transparency and accountability will only be improved by working in true partnership with first nations. 
What the member fails to understand is that top-down approaches do not work. Frankly, since her law was put in place, more first nations, on principle, have objected to reporting. This is not working, and therefore we have to work together to empower those community members she is talking about to be able to be—",Liberal,Toronto—St. Paul's,Carolyn Bennett,http://www.parl.gc.ca/MembersOfParliament/ProfileMP.aspx?Key=213975&Language=E
4689988,ca.proc.d.2016-11-22.9251485,2016-11-22,3176068f-62ee-4b2f-aacd-1131201c6db1,214707,The Speaker,,Oral Questions,Indigenous Affairs,,The hon. member for Kamloops—Thompson—Cariboo.,Liberal,Halifax West,Geoff Regan,http://www.parl.gc.ca/MembersOfParliament/ProfileMP.aspx?Key=214707&Language=E
4689989,ca.proc.d.2016-11-22.9251486,2016-11-22,9c9a64e6-58f1-4367-9f49-93ad31744c96,217354,"Mrs. Cathy McLeod (Kamloops—Thompson—Cariboo, CPC)",,Oral Questions,Indigenous Affairs,," Mr. Speaker, if empowering first nations is like Bill S-3, where they did not even bother to talk to the chief and defendant, that is a very poor example. Band members are having to take their leadership to court to get basic financial information.
On this side of the House, we are with people like Charmaine Stick, who the minister is forcing to go to court for this information. The Liberals should be ashamed. Why is the minister forcing Charmaine to go to court instead of showing some leadership and enforcing the law?",Conservative,Kamloops—Thompson—Cariboo,Cathy McLeod,http://www.parl.gc.ca/MembersOfParliament/ProfileMP.aspx?Key=217354&Language=E
4689990,ca.proc.d.2016-11-22.9251510,2016-11-22,f470e27a-a074-4b16-8304-960ffe8c9289,213975,"Hon. Carolyn Bennett (Minister of Indigenous and Northern Affairs, Lib.)",,Oral Questions,Indigenous Affairs,,"Mr. Speaker, I think the member fails to understand that there are certain things that are within the purview of my department in terms of indigenous affairs. There are other things that are actually own-source revenues of the band. 
What that community member is going to court to find are things that we cannot, as a department, determine, because it is not our money. It is the band's money. Therefore, the member needs to go through the regular process to get that information.",Liberal,Toronto—St. Paul's,Carolyn Bennett,http://www.parl.gc.ca/MembersOfParliament/ProfileMP.aspx?Key=213975&Language=E
4689991,ca.proc.d.2016-11-22.9251513,2016-11-22,9d3d2220-818c-494e-8d58-29f7cee7b65d,224944,"Hon. Candice Bergen (Portage—Lisgar, CPC)",,Oral Questions,Indigenous Affairs,,"Mr. Speaker, the problem is that every time the Liberals have a chance to empower grassroots first nation people, they do the opposite and give a pass to some unaccountable, all-powerful chiefs. 
Liberals opposed guaranteeing women on reserve the right to their own home after divorce. Why? It is because some chiefs did not like it. Now, because some chiefs do not like it, they are blocking the ability of first nations people to hold their leaders to account on what they spend.
Why are the Liberals more focused on protecting the chiefs than on empowering first nations grassroots people?",Conservative,Portage—Lisgar,Candice Bergen,http://www.parl.gc.ca/MembersOfParliament/ProfileMP.aspx?Key=224944&Language=E
4689992,ca.proc.d.2016-11-22.9251540,2016-11-22,f470e27a-a074-4b16-8304-960ffe8c9289,213975,"Hon. Carolyn Bennett (Minister of Indigenous and Northern Affairs, Lib.)",,Oral Questions,Indigenous Affairs,,"Mr. Speaker, we take all allegations of fraud very seriously. However, in the particular situation the member raises, the audit was stopped in July 2015, when the department sought a legal opinion on a jurisdiction matter. 
Just as I have explained, it was determined that the department does not have jurisdiction to investigate this matter. As a result, the audit was not completed, and there is no report.
In accordance with the department's usual practice, all complainants were informed of this outcome.",Liberal,Toronto—St. Paul's,Carolyn Bennett,http://www.parl.gc.ca/MembersOfParliament/ProfileMP.aspx?Key=213975&Language=E
4689993,ca.proc.d.2016-11-22.9251542,2016-11-22,ea3bdfb2-c01b-4b31-937f-51fafc045172,214023,"Mr. Fayçal El-Khoury (Laval—Les Îles, Lib.)",,Oral Questions,Housing,,"Mr. Speaker, today is a special day. It is National Housing Day. This is a perfect time to talk about the excellent work that our government is doing to improve Canadians' access to affordable housing.
Can the minister responsible update the House on the development of the national housing strategy?",Liberal,Laval—Les Îles,Fayçal El-Khoury,http://www.parl.gc.ca/MembersOfParliament/ProfileMP.aspx?Key=214023&Language=E
4689994,ca.proc.d.2016-11-22.9251545,2016-11-22,d67a49c2-65bd-411e-8bb4-29ff759c5829,214003,"Hon. Jean-Yves Duclos (Minister of Families, Children and Social Development, Lib.)",,Oral Questions,Housing,,"Mr. Speaker, I thank our colleague from Laval—Les Îles for the excellent work he is doing to help families in his community with their housing needs.
We believe that Canadians deserve suitable, affordable housing. In budget 2016, our government invested $2.3 billion over two years in affordable housing, which will help 200,000 families. The national housing strategy will be launched in 2017 and will ensure stable, predictable funding as part of a respectful, inclusive, and transparent partnership with all of our communities.",Liberal,Québec,Jean-Yves Duclos,http://www.parl.gc.ca/MembersOfParliament/ProfileMP.aspx?Key=214003&Language=E
4689995,ca.proc.d.2016-11-22.9251549,2016-11-22,ff7a7f13-0558-4282-8cfc-9bfdfcbf6a1a,216774,"Mr. Michael Cooper (St. Albert—Edmonton, CPC)",,Oral Questions,Justice,,"Mr. Speaker, the Minister of Justice  has said that she has a problem with mandatory jail sentences passed by the previous Conservative government.
The previous Conservative government passed mandatory jail sentences for child sexual predators. In light of the Prime Minister's defence of the disturbing decision of an Ontario Superior Court judge to throw out a mandatory jail sentence involving sexual interference involving a minor, would the Minister of Justice  stand in her place and assure Canadians that the government will not repeal mandatory jail—",Conservative,St. Albert—Edmonton,Michael Cooper,http://www.parl.gc.ca/MembersOfParliament/ProfileMP.aspx?Key=216774&Language=E
4689996,ca.proc.d.2016-11-22.9251551,2016-11-22,3176068f-62ee-4b2f-aacd-1131201c6db1,214707,The Speaker,,Oral Questions,Justice,,The hon. Minister of Justice.,Liberal,Halifax West,Geoff Regan,http://www.parl.gc.ca/MembersOfParliament/ProfileMP.aspx?Key=214707&Language=E
