basepk,hid,speechdate,pid,opid,speakeroldname,speakerposition,maintopic,subtopic,subsubtopic,speechtext,speakerparty,speakerriding,speakername,speakerurl
4684167,ca.proc.d.2016-10-20.9169575,2016-10-20,9d3d2220-818c-494e-8d58-29f7cee7b65d,224944,"Hon. Candice Bergen (Portage—Lisgar, CPC)",,Routine Proceedings,Business of the House,,"Mr. Speaker, if you seek it I believe you will find consent for the following motion.
I move:
 That, at the conclusion of today's debate on the opposition motion in the name of the member for Calgary—Nose Hill, all questions necessary to dispose of the motion be deemed put and a recorded division deemed requested and deferred until Tuesday, October 25, 2016, at the expiry of the time provided for Oral Questions. 
",Conservative,Portage—Lisgar,Candice Bergen,http://www.parl.gc.ca/MembersOfParliament/ProfileMP.aspx?Key=224944&Language=E
4684168,ca.proc.d.2016-10-20.9169584,2016-10-20,3176068f-62ee-4b2f-aacd-1131201c6db1,214707,The Speaker,,Routine Proceedings,Business of the House,,Does the hon. member have the unanimous consent of the House to move the motion?,Liberal,Halifax West,Geoff Regan,http://www.parl.gc.ca/MembersOfParliament/ProfileMP.aspx?Key=214707&Language=E
4684169,ca.proc.d.2016-10-20.p4559013,2016-10-20,,,,intervention,Routine Proceedings,Business of the House,, Agreed.,,,Some hon. members,
4684170,ca.proc.d.2016-10-20.p4559014,2016-10-20,3176068f-62ee-4b2f-aacd-1131201c6db1,214707,The Speaker,,Routine Proceedings,Business of the House,, The House has heard the terms of the motion. Is it the pleasure of the House to adopt the motion?,Liberal,Halifax West,Geoff Regan,http://www.parl.gc.ca/MembersOfParliament/ProfileMP.aspx?Key=214707&Language=E
4684171,ca.proc.d.2016-10-20.p4559015,2016-10-20,,,,intervention,Routine Proceedings,Business of the House,, Agreed.,,,Some hon. members,
4684172,ca.proc.d.2016-10-20.p2,2016-10-20,3176068f-62ee-4b2f-aacd-1131201c6db1,214707,The Speaker,,Routine Proceedings,Business of the House,,(Motion agreed to),Liberal,Halifax West,Geoff Regan,http://www.parl.gc.ca/MembersOfParliament/ProfileMP.aspx?Key=214707&Language=E
4684173,ca.proc.d.2016-10-20.9169598,2016-10-20,b37cad30-26f6-40c6-8e4c-dd3a0ba841bb,218638,"Mrs. Cheryl Gallant (Renfrew—Nipissing—Pembroke, CPC)",,Routine Proceedings,Petitions,Taxation,"Mr. Speaker, I am pleased to present a petition signed by close to 100 campers who stayed at Sequin Beach Kampground in Callander, Ontario, which is located on the pristine shores of Lake Nipissing, in the riding of Nipissing—Timiskaming. 
The petitioners call upon the government to ensure that campgrounds with fewer than five full-time year-round employees continue to be recognized and taxed as a small business.",Conservative,Renfrew—Nipissing—Pembroke,Cheryl Gallant,http://www.parl.gc.ca/MembersOfParliament/ProfileMP.aspx?Key=218638&Language=E
4684174,ca.proc.d.2016-10-20.9169602,2016-10-20,febe5b3f-1a40-472b-873d-11be938a0e59,216676,"Hon. Gerry Ritz (Battlefords—Lloydminster, CPC)",,Routine Proceedings,Petitions,Palliative Care,"Mr. Speaker, it is a pleasure to rise on behalf of the constituents of Battlefords—Lloydminster to present two petitions.
The first petition calls upon the government to implement the palliative care package of $3 billion over four years that it had campaigned on. The first year has passed, and we are already behind. Therefore, 100-plus petitioners are asking the government to move forward on that expeditiously.",Conservative,Battlefords—Lloydminster,Gerry Ritz,http://www.parl.gc.ca/MembersOfParliament/ProfileMP.aspx?Key=216676&Language=E
4684175,ca.proc.d.2016-10-20.9169999,2016-10-20,febe5b3f-1a40-472b-873d-11be938a0e59,216676,"Hon. Gerry Ritz (Battlefords—Lloydminster, CPC)",,Routine Proceedings,Petitions,Justice,"Mr. Speaker, the second petition demands that the government recognize the rights of the unborn. We had the vote last night on Cassie's law, which unfortunately failed. However, it is time to continue to move forward and make sure the government takes heed of this type of petition with its hundreds of signatures asking it to do exactly that.",Conservative,Battlefords—Lloydminster,Gerry Ritz,http://www.parl.gc.ca/MembersOfParliament/ProfileMP.aspx?Key=216676&Language=E
4684176,ca.proc.d.2016-10-20.9169609,2016-10-20,50a18bf1-9be3-4563-b657-6af367453ba0,217240,"Mr. Charlie Angus (Timmins—James Bay, NDP)",,Routine Proceedings,Petitions,Indigenous Affairs,"Mr. Speaker, I am proud to rise and present this petition from people across Canada who are growing increasingly concerned about the Prime Minister's disregard for the promises he made to first nations people and the string of broken promises made to the youth, particularly the promise he made of $50 million for post-secondary education, which was to flow this year. They have received zero. 
The petitioners are also concerned that the Prime Minister made the promise to lift the 2% cap. He made that promise publicly, and yet the 2% cap is still in place on post-secondary education, which is taking away the ability of this future generation of leaders to get the quality education that they deserve and that Canadians believe they deserve.
 The petitioners are calling upon the government to live up to its promises and stop breaking the promises it has made again and again. It is the longest con in Confederation, and it needs to end.",New Democratic Party,Timmins—James Bay,Charlie Angus,http://www.parl.gc.ca/MembersOfParliament/ProfileMP.aspx?Key=217240&Language=E
4684177,ca.proc.d.2016-10-20.9169622,2016-10-20,53eb10e4-f8e7-4ef7-9448-b4a10ec1dba3,217051,"Mrs. Cathay Wagantall (Yorkton—Melville, CPC)",,Routine Proceedings,Petitions,Justice,"Mr. Speaker, I stand today to present more petitions from Canadians who are requesting that the government consider protecting pregnant women and their unborn children. This is an issue that will not go away. I am pleased to stand again today and present these petitions.",Conservative,Yorkton—Melville,Cathay Wagantall,http://www.parl.gc.ca/MembersOfParliament/ProfileMP.aspx?Key=217051&Language=E
4684178,ca.proc.d.2016-10-20.9169633,2016-10-20,07cf5767-802c-406c-92a7-7dc92af79b40,214668,"Mr. Kevin Lamoureux (Parliamentary Secretary to the Leader of the Government in the House of Commons, Lib.)",,Routine Proceedings,Questions on the Order Paper,,"Mr. Speaker, I ask that all questions be allowed to stand at this time.",Liberal,Winnipeg North,Kevin Lamoureux,http://www.parl.gc.ca/MembersOfParliament/ProfileMP.aspx?Key=214668&Language=E
4684179,ca.proc.d.2016-10-20.p4559026,2016-10-20,3176068f-62ee-4b2f-aacd-1131201c6db1,214707,The Speaker,,Routine Proceedings,Questions on the Order Paper,, Is that agreed?,Liberal,Halifax West,Geoff Regan,http://www.parl.gc.ca/MembersOfParliament/ProfileMP.aspx?Key=214707&Language=E
4684180,ca.proc.d.2016-10-20.p4559027,2016-10-20,,,,intervention,Routine Proceedings,Questions on the Order Paper,, Agreed. ,,,Some hon. members,
4684181,ca.proc.d.2016-10-20.9169635,2016-10-20,3176068f-62ee-4b2f-aacd-1131201c6db1,214707,The Speaker,,Routine Proceedings,Business of the House,,"Before we go to orders of the day, the Chair would like to take a moment to provide some information to the House regarding the management of private members' business.
 As members know, after the order of precedence is replenished, the Chair reviews the new items so as to alert the House to bills which at first glance appear to infringe on the financial prerogative of the crown. This allows members the opportunity to intervene in a timely fashion to present their views about the need for those bills to be accompanied by a royal recommendation.
Accordingly, following the September 30 replenishment of the order of precedence with 15 new items, I wish to inform the House that there is one bill that gives the Chair some concern as to the spending provisions it contemplates.
 It is Bill C-245, an act concerning the development of a national poverty reduction strategy in Canada, standing in the name of the member for Saint-Hyacinthe—Bagot. 
I would encourage hon. members who would like to make arguments regarding the need for royal recommendation to accompany this bill or any of the other bills now on the order of precedence to do so at an early opportunity. I thank hon. members for their attention.",Liberal,Halifax West,Geoff Regan,http://www.parl.gc.ca/MembersOfParliament/ProfileMP.aspx?Key=214707&Language=E
4684182,ca.proc.d.2016-10-20.p4559033,2016-10-20,,,,stagedirection,Government Orders,Business of Supply,Opposition Motion—Genocide Against the Yazidi people," That the House (a) recognize that ISIS is committing genocide against the Yazidi people; (b) acknowledge that many Yazidi women and girls are still being held captive by ISIS as sexual slaves; (c) recognize that the government has neglected to provide this House with an appropriate plan and the corresponding action required to respond to this humanitarian crisis; (d) support recommendations found in the June 15, 2016, report issued by the United Nations Commission of Inquiry on Syria entitled, “They came to destroy: ISIS Crimes Against the Yazidis”; and (e) call on the government to (i) take immediate action upon all the recommendations found in sections 210, 212, and 213 of the said report, (ii) use its full authority to provide asylum to Yazidi women and girls within 30 days. 
",,,,
