basepk,hid,speechdate,pid,opid,speakeroldname,speakerposition,maintopic,subtopic,subsubtopic,speechtext,speakerparty,speakerriding,speakername,speakerurl
4694632,ca.proc.d.2016-12-14.9321748,2016-12-14,e277e13e-59ec-425f-a957-eb5e54d8cb62,226920,"Mr. Gérard Deltell (Louis-Saint-Laurent, CPC)",,Government Orders,"Budget Implementation Act, 2016, No. 2",,"Madam Speaker, on behalf of all of my colleagues, thank you for your good wishes. We also extend our best wishes to everyone who helps keep the House of Commons running smoothly.
As everyone knows, it gives me great pleasure to rise and speak in the House. Today especially, I am pleased to vote and speak in favour of the amendment presented by the Senate regarding Bill C-29. I do not like anything about this bill, but the proposed amendment is a fine moment for the House of Commons.
The politicking has been really obvious these past few days. Everyone is tugging on the blanket, saying that they are the ones who got things done. The reality is that all Canadians are the winners. Well done.
First, I want to commend the work of my colleague from Joliette, who on November 17, 2016, if I am not mistaken, was the first to raise the issue and bring the debate to parliamentary committee and to the House of Commons. I also want to commend my NDP colleague from Rimouski-Neigette—Témiscouata—Les Basques who is doing a great job, as well as the Chair for its co-operation.
I would also like to commend the government for finally listening to reason and making the right decision, after admittedly creating some unfortunate uncertainty. It is never easy in politics to backtrack, to take a step back and admit that the first step was not the right one and that we have to take another. The government did that, and that is good.
I also commend our Senate colleagues, Senator Carignan, leader of the official opposition, and Senator Pratte, a new independent senator, who also alerted the government to the problems related to consumer protection in Bill C-29.
In short, Bill C-29 contained what we would call a constitutional virus. There were several clauses, division 5 in its entirety, that directly affected consumer protection. From our perspective, that is a provincial jurisdiction.
There was input galore from the opposition parties here in the House, in the Senate, and also from the National Assembly, which, in a unanimous motion appealed to the government on this, on behalf of Quebec's justice minister and the member for the Outaouais region, and on behalf of the Premier of Quebec, who even warned the government that if by some misfortune this bill were passed, it was highly likely that the Government of Quebec would challenge it in court. Finally, each individual's efforts and sacrifice for the good of the many and this government's understanding, albeit a bit delayed, are why we are gathered here today.
Let me explain some of the history of this bill. We have to go back to 2012. At that time, the federal government tabled in the House of Commons a bill that covered and addressed a lot of issues about the banking system.
As members know, the banking system belongs to the federal government, but in 2012, this bill addressed some of the issues concerning consumer protection. Then, also in 2012, we were aware of that in the National Assembly. I am using the word “we” because I was there at the time. I was a member of the National Assembly. That may remind many colleagues of some bad memories.
However, I was one of those who voted for a unanimous resolution in the National Assembly, calling on the House of Commons, saying that consumer protection was a provincial jurisdiction, not a federal one.
In 2014, the Supreme Court, in the Marcotte decision, clearly identified that consumer protection was a provincial jurisdiction, not a federal one.
At the time, our government, having acknowledged the 2014 Supreme Court ruling, was preparing to make changes to prevent what has been happening over the past few weeks, and that is a law that allows the federal government to once again infringe on the provinces' jurisdiction.
Bill C-29 is the bill that will implement the Liberal's bad budget, which I will come back to later. Sadly, this bill contained what we call a constitutional virus, one that would have sent us straight for a brick wall. The only thing this bill would have accomplished is to give hundreds of thousands of dollars to lawyers who already knew it was a lost cause.
In 2014, the Supreme Court ruled that consumer protection was an area of provincial jurisdiction, not federal. The federal government was trying to take it over with Bill C-29. We were headed for constitutional disaster. That was not a good thing because it would have cost money and taken time to get back to where we started.
As I was saying earlier, everyone's hard work and sacrifices on behalf of Canadians have made the government see reason. Bill C-29 contained a constitutional virus, but that is going to be remedied today, which is wonderful.
However, this is still a bad bill because it implements bad measures from the Liberal's bad budget. I would like to talk more about that.
I want to remind members that this budget provides for a $30-billion deficit, which is three times the amount promised by the Liberals. During the election, the Liberal Party promised that it would run small $10-billion deficits and that it would balance the budget at the end of three years. However, the reality is quite different. We are talking about a $30-billion deficit. When will the budget be balanced? It will only be balanced when the Conservatives return to power in three years.
 Is this not the government that was boasting about taking a balanced approach, promising to change the tax code, promising that Canadians would be more fairly treated? Is the government aware that 65% of Canadians are not affected by the so-called tax cuts and that anyone earning $45,000 or less per year is not affected by the Liberal measures? Is the government aware that the people who will benefit the most from these supposed tax cuts are those earning between $144,000 and $199,000 per year? Are those people part of the middle class? No.
 I confess that I am in conflict of interest on this. As a member, I am among Bill C-29's privileged few, which means that I will be paying less income tax. I do not feel that this is a good thing. The people who earn $44,000 are members of the middle class. Yet the government is granting them no tax cuts.
 The government sees itself as a sort of noble Robin Hood figure, taking aim at the poor souls who have the misfortune of earning $200,000 a year. A word of caution, sometimes bowstrings can snap, as seems to have happened in this case. Those who are in greatest need are not affected by the proposed measures.
 Time is passing, the last thing I want is to get carried away. That never happens to me. The holiday season is upon us, so let us play nice. The holidays are coming and we all realize that we are in politics for the benefit of future generations. As inheritors of our parents' legacy, we now work for our children's future.
 I have been elected four times, and have served four terms as a member, whether of the National Assembly or the House of Commons. Tradition has it that I should appear at the ballot box accompanied by my parents and my children; that is part of my political commitment. I am there thanks to my parents and for my children. 
 In closing, then, allow me to salute those without whom I would not be here, namely my parents, who tomorrow, December 15, will be celebrating their 65th wedding anniversary.
 We all get carried away sometimes. That said, it will now be my pleasure to take my colleagues’ questions.",Conservative,Louis-Saint-Laurent,Gérard Deltell,http://www.parl.gc.ca/MembersOfParliament/ProfileMP.aspx?Key=226920&Language=E
4694633,ca.proc.d.2016-12-14.9321854,2016-12-14,cedf1659-ebb1-4f26-b723-5c7c5353988b,214948,The Assistant Deputy Speaker (Mrs. Carol Hughes),,Government Orders,"Budget Implementation Act, 2016, No. 2",," I wish a very happy wedding anniversary to the parents of the hon. member for Louis-Saint-Laurent. Sixty-five is a good many years.
 The honourable Parliamentary Secretary to the Minister of Finance has the floor.",New Democratic Party,Algoma—Manitoulin—Kapuskasing,Carol Hughes,http://www.parl.gc.ca/MembersOfParliament/ProfileMP.aspx?Key=214948&Language=E
4694634,ca.proc.d.2016-12-14.9321857,2016-12-14,c049fb93-b7d8-4021-8fc6-cf1c69f7200b,220002,"Mr. François-Philippe Champagne (Parliamentary Secretary to the Minister of Finance, Lib.)",,Government Orders,"Budget Implementation Act, 2016, No. 2",,"Mr. Speaker, I salute my colleague from Louis-Saint-Laurent's parents. I hope they are listening.
The only virus people were afflicted with was the Conservative virus. They found the antidote on October 19 when they elected a Liberal government. Canadians have spoken loud and clear.
People are watching us on television right now, and I know some of them in the riding of Louis-Saint-Laurent.
What does Bill C-29 mean? It means lower taxes for nine million Canadians, some of which live in my colleague's riding and are watching us right now. They will see if the member for Louis-Saint-Laurent is going to vote for or against this tax cut that will affect them. Some of these people live in Louis-Saint-Laurent, and also in Lévis—Lotbinière, a riding I know very well because my mother lives there.
Nine out of ten families from coast to coast will benefit from the Canada child benefit, including some who call the riding of Louis-Saint-Laurent home. Will the member for Louis-Saint-Laurent say yes or no to these families receiving a much needed cheque?
We enhanced seniors' pensions. Seniors in Louis-Saint-Laurent will be watching him . Will the member vote for or against seniors in his riding? I know him. He will do the right thing.",Liberal,Saint-Maurice—Champlain,François-Philippe Champagne,http://www.parl.gc.ca/MembersOfParliament/ProfileMP.aspx?Key=220002&Language=E
4694635,ca.proc.d.2016-12-14.9321891,2016-12-14,e277e13e-59ec-425f-a957-eb5e54d8cb62,226920,Mr. Gérard Deltell,,Government Orders,"Budget Implementation Act, 2016, No. 2",,"Mr. Speaker, one thing is for sure: I will never vote for a budget that creates a deficit that is three times larger than expected, especially considering that the government has never been able to tell us when the books will be balanced again, even if I asked 14 times and would ask again if I had more time.
I will vote against a budget that purports to help the have-nots while giving no tax breaks to the 65% of Canadians who earn $45,000 or less a year. Those who benefit the most from these so-called tax cuts are those who earn $199,000 a year.
I will vote against a budget that sends any kind of control over family benefits flying out the window. We Conservatives had four family benefits programs in place and we still managed to balance the budget.
This government introduced family benefits that are not even indexed. In any business, bookkeepers who did not index their numbers would be shown the door, which is not the case for this government.
However, in three years, this government will be the one to be shown the door.",Conservative,Louis-Saint-Laurent,Gérard Deltell,http://www.parl.gc.ca/MembersOfParliament/ProfileMP.aspx?Key=226920&Language=E
4694636,ca.proc.d.2016-12-14.9321911,2016-12-14,a71a1741-7ff2-4246-b0da-4622e96b10cf,217230,"Mr. Guy Caron (Rimouski-Neigette—Témiscouata—Les Basques, NDP)",,Government Orders,"Budget Implementation Act, 2016, No. 2",,"Mr. Speaker, I thank my hon. colleague from Louis-Saint-Laurent, who is always so entertaining. His parents are celebrating their 65th wedding anniversary tomorrow, and mine are celebrating their 50th in six months. A most pleasant coincidence! 
 I would like to ask him a question which, once again, concerns areas of jurisdiction. He has made a good statement, and I am going to make mine in the ensuing speech. I am truly concerned at the fact that the government seems not to understand the message that it has been sent.
 The consumer protection that the Liberals want to strengthen at the federal level lies within provincial jurisdiction. So I have a great deal of difficulty reconciling the federal government’s willingness to continue proposing such legislation even though it deals with a matter of provincial jurisdiction. 
 Would my colleague care to add something to this exchange, one which will hopefully significantly influence the direction that the government wishes to take on this issue?",New Democratic Party,Rimouski-Neigette—Témiscouata—Les Basques,Guy Caron,http://www.parl.gc.ca/MembersOfParliament/ProfileMP.aspx?Key=217230&Language=E
4694637,ca.proc.d.2016-12-14.9321921,2016-12-14,e277e13e-59ec-425f-a957-eb5e54d8cb62,226920,Mr. Gérard Deltell,,Government Orders,"Budget Implementation Act, 2016, No. 2",,"What wonderful news, Mr. Speaker. I offer my respects to the half-century of love between the parents of the hon. member for Rimouski-Neigette—Témiscouata—Les Basques.
 My colleague raises a very good and very important point. The government will have understood over the last few hours that consumer protection is a provincial responsibility. The banks are within federal jurisdiction, and consumer protection is within provincial jurisdiction. 
 Will there be flowery speeches about appropriate consultations and taking the time we need even though this will not be on our radar come April or May? If that is the case, then fine. Let us buy some time, friends. If that is what they want, no problem. We are not opposed. Let us keep consulting.
 I have one bit of advice for my colleague: let him call minister Jean-Marc Fournier, whom the people in his riding know very well since he is the former senior advisor to the former leader. I advise the hon. member to call Jean-Marc Fournier, a good friend of mine. He is so Liberal he is redder than the Canadian flag. He would advise the Liberals to let this go, because it is an area of provincial jurisdiction.",Conservative,Louis-Saint-Laurent,Gérard Deltell,http://www.parl.gc.ca/MembersOfParliament/ProfileMP.aspx?Key=226920&Language=E
4694638,ca.proc.d.2016-12-14.9321927,2016-12-14,cedf1659-ebb1-4f26-b723-5c7c5353988b,214948,The Assistant Deputy Speaker (Mrs. Carol Hughes),,Government Orders,"Budget Implementation Act, 2016, No. 2",,"This is the most active day we have seen in a good while, and it is our last. It is incredible. Everyone seems reinvigorated.
 Resuming debate, the member for Rimouski-Neigette—Témiscouata—Les Basques has the floor.",New Democratic Party,Algoma—Manitoulin—Kapuskasing,Carol Hughes,http://www.parl.gc.ca/MembersOfParliament/ProfileMP.aspx?Key=214948&Language=E
4694639,ca.proc.d.2016-12-14.9321929,2016-12-14,a71a1741-7ff2-4246-b0da-4622e96b10cf,217230,"Mr. Guy Caron (Rimouski-Neigette—Témiscouata—Les Basques, NDP)",,Government Orders,"Budget Implementation Act, 2016, No. 2",,"Madam Speaker, I rise in the House for the last time in 2016, and I wish every member of the House, especially my colleagues who sit on the finance committee, happy holidays, merry Christmas and all the best for 2017. I hope everyone will use the next few weeks to get some rest.
My final thoughts will not be in praise of the government. Today the government indulged in some interesting revisionism regarding what happened over the last weeks. Clearly, the parliamentary secretary should go back to Hansard so see what answers he gave in the House and what was discussed in the finance committee. He would realize that no one on the government side, no one among the 40 Liberal MPs from Quebec, not a single Liberal member of the House uttered a single word on consumer protection jurisdiction. Until very recently, before the minister did an about-face, the answers we got—the last one just two days ago—were still about defending the government's decision to go ahead with division 5, the amendments to the Bank Act.
The government decided to delete the provisions, thanks to the efforts of all opposition parties. Like my colleague from Louis-Saint-Laurent, I, too, would commend the members of the Bloc Québécois, the Conservative Party and the NDP on all their work. I also commend the Senate, particularly independent senator André Pratte, who kept pressing the issue. Consumer associations that were invited to appear before the committee to share their concerns about consumer protection and federal interference also helped to make sure that the government backed down on this issue.
Why is it so important? If I am concerned, it is because the government does not seem to understand that the main issue is not the level of protection enjoyed by Canadian bank customers. The main issue is that consumer protection is a provincial jurisdiction. Given what we have just heard, the minister is clearly trying to find another way of imposing a consumer protection framework even if that is outside federal jurisdiction.
 I am worried by the government’s interpretation of the famous Marcotte ruling. This was a class action against the Bank of Montreal. Mr. Marcotte went to court to challenge certain fees which he felt were far too high, in addition to being hidden. He went to court to complain about these fees. In the end, the Bank of Montreal and all the banks were saying that they did not need to comply with the Consumer Protection Act, because they operate under federal jurisdiction. The case went to the Supreme Court.
 Contrary to what the government has persisted in saying, the Supreme Court did not ask the government for jurisdictional clarification. The Supreme Court established that the Bank Act was applicable, the Consumer Protection Act was applicable, and the two could coexist very well, since they were complementary. The Bank Act covers the operation of the various banking programs, and the Consumer Protection Act, self-evidently, covers consumer protection.
 What the Marcotte ruling said was that the Consumer Protection Act was applicable. The Supreme Court never asked the government to look into the issue and assume control of the consumer protection issue, for Quebec or for the provinces generally.
 Why is this a problem? Why was it a problem with regard to the jurisdiction from which we will shortly be withdrawing? The legislation created a conflict between the federal statute and the provincial statute. There is a principle called the principle of federal paramountcy, which holds that if two laws, one federal and one provincial, touch upon the same issue, the federal law will have primacy.
 With regard to the Marcotte ruling, the Supreme Court said that there was no conflict, in spite of what the banks tried to make it say.
 In trying to recover these powers, in trying to impose this, they created a conflict between the federal side and the Consumer Protection Act. Having created that conflict, they found themselves invoking federal paramountcy. 
 I would argue this is where the government’s argument failed. It is the same kind of argument the consumer protection agencies, in particular, were making, saying that the government was trying to interfere and create a problem where there was none. Obviously, the Chambre des notaires and the Barreau du Québec were saying the same thing. 
 That is why we are happy to see these clauses being withdrawn, indeed, to see the entire opposition in this House working in the same direction to encourage the Senate to take a look at this. Quebec, starting with the opposition in Quebec City and then the government, saw that there was a major problem, and asked the federal government to make some changes and remove these clauses. The various civil society groups did the same thing. Finally the government has listened to reason. We hope that it will learn a valuable lesson from what has happened when the time comes to make decisions which could effectively encroach upon provincial jurisdictions. 
 In that sense, I invite the Liberals to do some soul-searching over the holidays. We will have a few weeks to replenish ourselves. This is the perfect time to do it. I am truly very happy to have been able to play a small part in this decision. Once again, all of the opposition parties have been involved in this. 
 I will close by adding a few more words on Bill C-29, and perhaps replying to what has been said on the government side. They talk often of the 9 million Canadians who are going to benefit from the tax cuts. But they are always silent about the fact that 23 million Canadians, most of them earning less than $45,000, will benefit in no way from these cuts. I would prefer that they show a little more honesty. Certainly, there will be a tax reduction. They will increase taxes on the 1% richest people, but that money will not be given to the middle class as a whole. It will be given in large part to the 9% of people who are the richest. My colleague from Louis-Saint-Laurent mentioned this: the people earning under $45,000 will receive nothing from the tax cut. Those earning between $45,000 and $90,000 will benefit a little from the tax reduction, but mostly it will be those earning over $90,000 and up to close to $200,000 who will benefit from it. Even those earning $210,000 per year will still enjoy a tax cut. But the people earning $45,000 will get nothing at all. That is one of the problems with the Liberal program. We tried to correct the situation by making it possible for people to get a tax reduction starting at $11,000, but the government would have nothing of it. 
 The second thing, also mentioned by my colleague from Louis-Saint-Laurent, is the fact that when the Canada child benefit program was set up, they forgot to index it. That is a major problem because the lack of indexing would have meant that the program would have been less advantageous for most families starting in 2022-2023. For this we can thank the parliamentary budget officer, who conducted a rigorous study on the subject. As if by chance, the afternoon after the report was published, the government finally said that it wanted to index the program and would do so starting in 2020-2021, that is, after the next federal election. 
 Can we really believe that this was part of the government’s plans? It never mentioned indexing when the program was announced, when it was set up. In the end, it took the publication of a report for them to realize that not indexing would mean that the government’s initiative was going to be less beneficial within six years. Even taking into account the amendments to Bill C-29, we are going to find ourselves in a situation where loss of purchasing power is going to come dangerously close to the level that families would have had with the old program.
So instead of congratulating ourselves on different initiatives—initiatives whose value or lack thereof we can debate, initiatives that are going to affect different groups of Canadians to different degrees—for 2017 I would like to wish the House debates that are more rigorous in terms of economic analysis. I am an economist by training, and I like rigour. There is always room for partisan viewpoints. That is normal: we function on the adversarial principle. It’s normal that we should have differing positions, but all the same, we ought to be more rigorous and disciplined in the exercise of our duties. 
 That is what I wish us all for 2017.",New Democratic Party,Rimouski-Neigette—Témiscouata—Les Basques,Guy Caron,http://www.parl.gc.ca/MembersOfParliament/ProfileMP.aspx?Key=217230&Language=E
4694640,ca.proc.d.2016-12-14.9322021,2016-12-14,c049fb93-b7d8-4021-8fc6-cf1c69f7200b,220002,"Mr. François-Philippe Champagne (Parliamentary Secretary to the Minister of Finance, Lib.)",,Government Orders,"Budget Implementation Act, 2016, No. 2",,"Madam Speaker, I listened with great interest to the speech made by the member for Rimouski. I am sorry, I always have a hard time stating the full name of his riding, Rimouski-Neigette—Témiscouata—Les Basques.
I think we all have made a step forward, not backwards. Society as a whole made a step forward, because our objective from the start was to establish the best possible framework for all consumers.
The hon. member, who sits on the finance committee and who speaks a lot about these issues, should also go back to Hansard. People talked about this in committee. I would like to review my colleague's comments. Since the holidays are upon us and a new year will begin soon, I hope he will help us deliver the best possible framework, not only for Quebeckers, but for all Canadians.
This is not about weakening the protection framework. What we are saying is that we need to take the best practices from all over the country and have all consumers benefit from them. That is our goal. I hope the hon. member will be on side. It would be illogical to sit at the federal level and not want to offer good protections in every province.
My wish for 2017 is to have the member share his ideas regarding the best possible consumer protection framework when it comes to banks.",Liberal,Saint-Maurice—Champlain,François-Philippe Champagne,http://www.parl.gc.ca/MembersOfParliament/ProfileMP.aspx?Key=220002&Language=E
