basepk,hid,speechdate,pid,opid,speakeroldname,speakerposition,maintopic,subtopic,subsubtopic,speechtext,speakerparty,speakerriding,speakername,speakerurl
4684229,ca.proc.d.2016-10-20.9171191,2016-10-20,782dab6a-6e60-4132-992b-4933293f30d4,214556,"Ms. Pam Goldsmith-Jones (Parliamentary Secretary to the Minister of Foreign Affairs, Lib.)",,Government Orders,Business of Supply,Opposition Motion—Genocide Against the Yazidi people,"Mr. Speaker, I will be splitting my time with the member for Markham—Unionville.
I thank the hon. member for putting this pressing issue on the agenda for a more thorough debate. This motion comes at a major turning point in the fight against Daesh. The Iraqi security forces, supported by the global coalition against Daesh, are currently approaching Mosul, the self-proclaimed capital of Daesh in Iraq and its last stronghold in that country. 
Canada has been a member of the coalition supporting Iraq since 2014. The training and expertise that we provide to the Iraqi forces and their partners will become invaluable in the coming weeks and months, as the fight against this terrorist organization continues.
However, Canada's role in Iraq goes beyond military support. Canada is investing over $1.6 billion over three years for countering Daesh, and responding to the crises in Iraq and Syria, and to address the significant and tragic impact on the wider region. This includes $840 million in humanitarian assistance, which goes directly to trusted partners for immediate work.
When the hon. member of the opposition calls on this House to support recommendations made by the UN Commission of Inquiry on Syria, this government can say with confidence that it agrees, and it can demonstrate that it is already acting on the recommendations raised in the inquiry. 
Ours was the first government to formerly call on the United Nations Security Council for urgent action with regard to the genocide occurring against the Yazidi people.
 Daesh and its followers have attacked innocent civilians around the world. Its vile message of hatred knows no borders, but its gravest abuses have been concentrated in Iraq and Syria. The majority of victims have been Muslim, though it has also perpetrated crimes against minority groups, including Christians, Shabaks, Turkmen, and Yazidis.
The Yazidis in northern Iraq have suffered the loss of as many as 5,000 members of their community; 7,000 have been captured, mainly in Syria. Women and girls are forced into sexual slavery; boys are indoctrinated and used as child soldiers.
In the face of genocide against the Yazidis, it is most fitting that all parties in the House join together in support of the opposition member's motion. The Government of Canada has recognized Daesh's crimes against the Yazidis. We have called on the Security Council to take action, and we have been, and continue to participate, in collecting and documenting evidence to ensure that those responsible are held to account.
In terms of immediate action, our government is supporting the delivery of critical psychosocial care to victims. Our humanitarian assistance is also helping to meet basic needs and improve the Yazidis' conditions in camps and host communities. Many of these are located within Iraq where access has been extraordinarily difficult. To ensure Yazidis have the option to return to their homes, we are also supporting the clearance of improvised explosive devices in areas of Iraq that have been newly liberated from Daesh.
Last month, the Minister of Foreign Affairs attended the United Nations General Assembly, where the questions raised by the commission of inquiry about Daesh's horrific crimes and the international community's response to these unspeakable crimes were his first priority. The commission's report documents grave violations of international humanitarian and criminal law.
 The minister has stayed focused on the evidence, and on taking action to bring Daesh to justice for its genocide against the Yazidi people. Canada is appalled by these widespread abuses, and the sexual and gender-based violence committed against religious and ethnic communities.
 Recent exchanges in New York with representatives of the Yazidi community and senior government officials have advanced our understanding of what steps the international community can and should take.
As leaders in the international community on this issue, I would like to update the House on the many efforts made by the Minister of Foreign Affairs in the fight against Daesh. 
With regard to the United Nations, twice, in May and again in June of this year, the Minister of Foreign Affairs wrote to the president of the Security Council to urge it to take action on the matter of Daesh's crimes. On June 16, the Minister of Foreign Affairs stood before the House to recognize the atrocities committed by Daesh against the Yazidis of Sinjar and to state, unequivocally, that these crimes constitute genocide. The Minister of Foreign Affairs continues to call on the UN Security Council to take steps to ensure that those responsible for the atrocious crimes perpetrated by Daesh in Iraq and Syria are held accountable. 
In July, my colleague, the Parliamentary Secretary to the Minister of Foreign Affairs, Consular Affairs, met with Ms. Nadia Murad, a member of the Yazidi community of Iraq and a survivor of sexual violence perpetrated by Daesh, to discuss the plight of her family, friends, and community. 
Our mission in Baghdad has been active in reaching out to Yazidi organizations and Iraqi authorities. 
In September, in New York, the Minister of Foreign Affairs participated in a dedicated session at the UN General Assembly on the subject of holding Daesh to account. At this high-level meeting, the Minister of Foreign Affairs called upon the UN to establish a special commission to investigate Daesh activities, and called for more action from the international community and, specifically, from the Security Council.
With regard to our international partners, we will be working closely with the U.K. and others in the coming months to activate a core group of actors, and coordinate between governments and relevant organizations as we work toward international consensus on which mechanisms are most effective in ensuring accountability for the atrocities committed by Daesh.
I would also like to express the importance of regional and national partnerships in documenting Daesh crimes and holding it responsible. Iraq's participation, in particular, is critical, which is why Canada supports the Iraqi government's effort to improve governance in the country, strengthen institutions, and mend ethnic and religious divides.
The government is undertaking an integrated approach to the crisis in Syria. 
To ensure that Daesh fighters are brought to justice and that victims receive healing support, the government is engaged in evidence collection, in support for courts, and in care for victims.
The starting point of justice and holding Daesh to account is securing the necessary evidence. Canada funds work by civil society organizations in Iraq and Syria to preserve critical evidence, which includes the mass graves that continue to be uncovered as territory is re-taken from Daesh.
Organizations we support, such as the Commission for International Justice and Accountability, have developed legal case files focusing on Daesh criminality in Iraq and Syria, including sexual slavery.
 In order to pursue Daesh, local governments and the international community will have to determine the right court system to pursue justice. Options that exist include the International Criminal Court, ad hoc international criminal tribunals or hybrid tribunals, state-level criminal prosecution, and civil actions.
Whichever judicial mechanism or mechanisms are pursued, it is critical that the government of Iraq and the international community, in general, be supported and engaged. The international courts only function if they have the necessary international co-operation. Domestic courts need to have the capacity to conduct fair and independent trials. Canada is actively looking at ways in which we can provide capacity-building to support the important elements of the Iraqi justice sector.
As the international community seeks justice for these crimes, it is important that the survivors of these grave abuses be provided with the care they need. In particular, victims of sexual violence and slavery require urgent psychosocial and medical assistance.
Since 2014, Canada has supported experienced humanitarian partners in Iraq, including the United Nations Population Fund.
The Minister of Foreign Affairs is deeply committed to pushing the international community to help alleviate the terrible suffering of the Yazidi victims of Daesh, as well as to lay the foundation for a process of transition in the societies affected by Daesh.
This government can say with confidence that we are actively advancing the issues contained in the commission's recommendations. We have been active in the military fight against Daesh, and we have led in calling on the United Nations Security Council to declare that crimes against the Yazidis constitute genocide. We have engaged international and local partners to be as effective as possible.
From the outset, we have insisted on evidence collection so that, together with our partners, we can hold Daesh accountable for the crime of genocide. We are engaged in assessing an appropriate court system to this end. Throughout, we are providing essential support for the victims who are at the centre of all of our efforts.
In closing, we recognized that the crimes committed by Daesh in Sinjar constituted genocide and we asked the Security Council to intervene. On behalf of the entire House, we are incredibly grateful to the Canadian men and women who work on the ground providing military intelligence, training, and support in the fight against Daesh, as well as ensuring the safety and security of the victims in Syria.",Liberal,West Vancouver—Sunshine Coast—Sea to Sky Country,Pam Goldsmith-Jones,http://www.parl.gc.ca/MembersOfParliament/ProfileMP.aspx?Key=214556&Language=E
4684230,ca.proc.d.2016-10-20.9171374,2016-10-20,bd2068aa-74c7-430a-bdf5-6f17b14ca140,218034,"Mr. Tom Kmiec (Calgary Shepard, CPC)",,Government Orders,Business of Supply,Opposition Motion—Genocide Against the Yazidi people,"Mr. Speaker, I would like to thank the parliamentary secretary for her contributions to this debate, so far.
Why did her government initially vote against the opposition motion that basically recognized the genocide that was going on, and continues to be going on? Does her government now recognize, as well, the genocide of Christians and Kurds in the region?",Conservative,Calgary Shepard,Tom Kmiec,http://www.parl.gc.ca/MembersOfParliament/ProfileMP.aspx?Key=218034&Language=E
4684231,ca.proc.d.2016-10-20.9171383,2016-10-20,782dab6a-6e60-4132-992b-4933293f30d4,214556,Ms. Pam Goldsmith-Jones,,Government Orders,Business of Supply,Opposition Motion—Genocide Against the Yazidi people,"Mr. Speaker, of course, at the time, members can see by our comprehensive and integrated approach, we were deliberate to get the steps in the right order. We appreciate the attention that the world focused on whether or not this was a case of genocide. We wished to have the evidence. We wished to participate in being able to prove it, and of course, we pushed the UN to make that declaration. The report has been most helpful.
 I would like to thank the members opposite for bringing this motion forward and articulating some of the findings. We are on a very solid foundation with regard to foreign policy, with regard to national defence, and with regard to an immigration and refugee policy for Canada, and for those who are the victims of genocide in Syria.",Liberal,West Vancouver—Sunshine Coast—Sea to Sky Country,Pam Goldsmith-Jones,http://www.parl.gc.ca/MembersOfParliament/ProfileMP.aspx?Key=214556&Language=E
4684232,ca.proc.d.2016-10-20.9171401,2016-10-20,6fda5a4f-19c6-4cf2-b72d-9a00b48e0d21,219053,"Ms. Hélène Laverdière (Laurier—Sainte-Marie, NDP)",,Government Orders,Business of Supply,Opposition Motion—Genocide Against the Yazidi people,"Mr. Speaker, I would like to thank my colleague for her speech.
It is vital that we give those people asylum as well as humanitarian assistance and psychosocial care because they have been traumatized by their experiences.
I heard my colleague say that those who commit these horrible crimes must be brought to justice and held responsible for their actions.
I would like to ask my colleague two questions. First, if that applies to ISIS, should we also investigate the actions of the Saudi-led coalition in Yemen and those of Bashar al-Assad?
Second, the search for justice requires on-the-ground investigations to collect medical and legal evidence. It is very painstaking work that requires a lot of resources. Will Canada finance such efforts on the ground?",New Democratic Party,Laurier—Sainte-Marie,Hélène Laverdière,http://www.parl.gc.ca/MembersOfParliament/ProfileMP.aspx?Key=219053&Language=E
4684233,ca.proc.d.2016-10-20.9171434,2016-10-20,782dab6a-6e60-4132-992b-4933293f30d4,214556,Ms. Pam Goldsmith-Jones,,Government Orders,Business of Supply,Opposition Motion—Genocide Against the Yazidi people,"Mr. Speaker, it is important to recognize that Canada is participating in a coalition of partners, and we are there to play our part. Absolutely, with regard to the investigation, we have devoted funds to making sure that evidence can be verified and documented and can get to the right place so that we can hold Daesh to account.
With regard to the first question, which is to bring a whole other matter into this discussion, I would rather we stay focused on what we are doing here as parliamentarians to defend the fact that the Yazidi are victims of genocide. We are in a unique position as a country to support that.",Liberal,West Vancouver—Sunshine Coast—Sea to Sky Country,Pam Goldsmith-Jones,http://www.parl.gc.ca/MembersOfParliament/ProfileMP.aspx?Key=214556&Language=E
4684234,ca.proc.d.2016-10-20.9171454,2016-10-20,07cf5767-802c-406c-92a7-7dc92af79b40,214668,"Mr. Kevin Lamoureux (Parliamentary Secretary to the Leader of the Government in the House of Commons, Lib.)",,Government Orders,Business of Supply,Opposition Motion—Genocide Against the Yazidi people,"Mr. Speaker, the member just said that we should focus our attention on the Yazidi. If we look at the Prime Minister's or this government's attitude toward refugees, in a very short time span, we were able to get a lot done. It is important to recognize our place in the world with respect to refugees. I would ask the member to comment on the support of refugees.",Liberal,Winnipeg North,Kevin Lamoureux,http://www.parl.gc.ca/MembersOfParliament/ProfileMP.aspx?Key=214668&Language=E
4684235,ca.proc.d.2016-10-20.9171471,2016-10-20,782dab6a-6e60-4132-992b-4933293f30d4,214556,Ms. Pam Goldsmith-Jones,,Government Orders,Business of Supply,Opposition Motion—Genocide Against the Yazidi people,"Mr. Speaker, my colleague, the Parliamentary Secretary to the Minister of Immigration, Refugees and Citizenship, mentioned earlier this morning the model of leadership the minister has provided, particularly with regard to bringing 30,000 refugees from Syria to Canada. It was a meticulous process to ensure the health of people, to ensure the safety and security of Canadians, and to make sure that we are helping the most vulnerable.
I have had the opportunity, as have many of my colleagues, I am sure, to speak to international audiences, and Canada is very highly respected for the efforts we have made for those refugees, and we will continue in that vein.",Liberal,West Vancouver—Sunshine Coast—Sea to Sky Country,Pam Goldsmith-Jones,http://www.parl.gc.ca/MembersOfParliament/ProfileMP.aspx?Key=214556&Language=E
4684236,ca.proc.d.2016-10-20.9171488,2016-10-20,826dc268-dbda-48fa-ae4a-eefebd5716e1,214209,"Hon. John McCallum (Minister of Immigration, Refugees and Citizenship, Lib.)",,Government Orders,Business of Supply,Opposition Motion—Genocide Against the Yazidi people,"Mr. Speaker, I am delighted to rise and speak on this subject. I think that crimes, even genocide, of which we are speaking, are so horrendous that this is an issue that should go beyond partisanship and on which we should be able to find agreement among all parties in the House. 
That is partly why I am speaking a little late in this debate, because we have been in discussions with representatives from the Conservative Party to see if we could come to a common understanding on a motion that we could all support. Those discussions are ongoing. I do not think we have come to an agreement yet, but I think all members would agree that it is worth an effort. We have certain differences between us and the Conservatives, and possibly the NDP, but those differences are very minor compared with the overall urgency and importance of the issue that is before the House today.
I would hope that further discussions, which are now ongoing, will lead to some agreement among the parties so that we can all agree on this motion. Whether or not those discussions bear fruit, I would like to single out the Conservative critic, the member for Calgary Nose Hill, for her commitment on this topic and for her willingness to enter into discussions with us to try to find an all-party agreement.
I would also like to single out my parliamentary secretary, the member for Parkdale—High Park, and in particular, the chair of the immigration committee, the member for Etobicoke Centre, for the undying passion he has exhibited on this question of the Yazidi. At the risk of leaving someone out, I would like to also draw attention to other colleagues in the Liberal Party and my caucus who have been very active on this file in favour of the Yazidi. This would include the members for Ville-Marie—Le Sud-Ouest—Île-des-Soeurs, York Centre, Mount Royal, West Vancouver—Sunshine Coast—Sea to Sky Country, and New Brunswick Southwest. I am sure there are others, such as the NDP member for Vancouver East.
 I know that members from all parties have been very active on this issue, because we are shocked and horrified by the atrocities brought against the Yazidi people, but also against so many others, by Daesh and also in the context of the Syrian civil war.
 That, of course, is why we did step up early in our mandate to commit to 25,000 refugees within a four-month period, a commitment that we honoured, and I am proud of that. 
We want to work with the Conservatives, but I would point out that in terms of resettled refugees, we are bringing in three to four times more in 2016 than was the case in 2015. I am proud that Canadians from all walks of life stepped up to the plate so forcefully in favour of the Syrian refugee effort, and I am also grateful to all of the opposition parties, which professed their support for this initiative from the beginning.
It is also true that other countries have shown great support and admiration for what we have done; so much so, in fact, that we launched an initiative at the United Nations to basically export our model for private sponsorship of refugees. Thirteen countries have already expressed an interest, including the United Kingdom and the United States. Canadians can therefore be proud of our efforts to help refugees.
However, we are talking more specifically about the Yazidi today, so let me report, as the parliamentary secretary has already said, that a group of officials from my department has recently returned from Iraq. We could not discuss this before they returned, because there are very dangerous conditions on the ground there, and indeed, that is one of the constraints on quick action in that part of the world. Not only is it dangerous, but there is a war going on, as we speak, in Mosul, which is not too far from where our officials were just recently.
That is one of the reasons why it is not easy to quickly address this issue. I have yet to receive a full debrief from my officials. They have just returned, but I know that they had a twofold mission. One was to interview Syrian refugees located in Iraq, and the second was to confer with the United Nations High Commissioner for Refugees and the International Organization for Migration, or the UNHCR and the IOM, on options regarding assistance for Yazidis and the opportunity to bring more of them to Canada. 
I might mention that the IOM and the UNHCR are absolutely critical to our efforts in this area. When we brought all the refugees from Syria, it was the UNHCR that provided the names of the vulnerable people, and the IOM provided indispensable help in terms of logistics. 
In terms of the Yazidi issue, it is Canada working with those international parties that will seek to bring to Canada many people who are victims of Daesh, including the Yazidi people, who have been subjected to unconscionable aggression in the form of genocide. 
I can report to the House that my department is working very actively and very assiduously to come up with a solution to this issue as soon as possible.
I might just say in closing, more generally, that in terms of the refugee crisis the world is facing, I think Canada did step up to the plate. I think we can be proud of our efforts. In terms of the numbers we took in, it may be three times more than in 2015, but it is still just a drop in the bucket compared with the millions of refugees around the world, and this is a worsening crisis. It is a crisis that is tearing apart various parts of the world, including the European Union. It has become an issue in the United States. I think we can be proud of what we have done, but it is obviously a major crisis for the world as a whole. 
I think there are really three parts to the solution to this. 
One is miliary action to end the war in Syria and to defeat ISIS, or Daesh. Members know that Canada is involved in that in an important way. The attempt to liberate Mosul is playing out as we speak. That is an important part of the overall solution.
The second important part is humanitarian relief. My colleague, the Minister of International Development, has announced assistance in the hundreds of millions of dollars for the region. 
I know from my visits that front-line countries like Jordan and Lebanon have had a huge burden imposed upon them, with as much as one-quarter or one-third of their populations consisting of refugees. It is as if in Canada we had some nine million or 10 million refugees in our midst. The burden they are bearing is enormous, so a second part of the operation is to provide assistance to those countries. 
Finally, last but not least, is to receive refugees, and we have done our bit. However, it would be desirable to extend the number of refugee-receiving countries beyond the usual performers: Australia, Canada, the United States. Possibly other countries around the world could be induced to do more in terms of receiving these refugees.
This is not a simple issue; it is very complex. However, I believe that the solution has three basic elements: first, a military component; second, financial aid for various countries; and third, the resettlement of refugees, not just here in Canada, but in other countries as well.
Finally, I do hope that the inter-party discussions will bear fruit and that we will be able to vote as a whole, together, on this motion. Whether or not that happens, I am confident that all of us, in slightly different, nuanced ways, nevertheless support a very major effort to assist the Yazidi in their hour of great need. ",Liberal,Markham—Thornhill,John McCallum,http://www.parl.gc.ca/MembersOfParliament/ProfileMP.aspx?Key=214209&Language=E
4684237,ca.proc.d.2016-10-20.9171668,2016-10-20,b6850f16-57dc-486c-b5bb-0fd191022af4,217669,"Mr. Garnett Genuis (Sherwood Park—Fort Saskatchewan, CPC)",,Government Orders,Business of Supply,Opposition Motion—Genocide Against the Yazidi people,"Mr. Speaker, it was interesting for me to listen to the Minister of Immigration's speech. I do note a change in his tone with respect to these issues, and I appreciate that change in tone. However, I do want to get his comment on something he said here in question period on October 5. He said:
 Mr. Speaker, we do not know how many Yazidi refugees have come to Canada, because when refugees come to Canada, we do not ask them their ethnicity or their religion. We do not discriminate by religion or ethnicity. 
What concerns me about that is that the minister does not really seem to appreciate, in that statement at least, the importance of the refugee definition, being that we take those who are most vulnerable and those who face persecution on the basis of identifiable characteristics. It seemed as well that the parliamentary secretary said something a bit different in his speech. He said that we do not track these things. It sounded like he was saying that we do ask the questions up front, but we just do not track it afterward.
I want to ask the minister to clarify. Does what he said on October 5 still hold? Is what he said correct or is what his parliamentary secretary said correct? Do we ask these questions? Will the government finally begin to keep track of the level of vulnerability of those who come to this country?",Conservative,Sherwood Park—Fort Saskatchewan,Garnett Genuis,http://www.parl.gc.ca/MembersOfParliament/ProfileMP.aspx?Key=217669&Language=E
