basepk,hid,speechdate,pid,opid,speakeroldname,speakerposition,maintopic,subtopic,subsubtopic,speechtext,speakerparty,speakerriding,speakername,speakerurl
4670473,ca.proc.d.2016-05-05.8901563,2016-05-05,ffeab63b-041e-4d87-bdad-1b79ff9a98c5,215886,"Mr. Dan Vandal (Saint Boniface—Saint Vital, Lib.)",,Government Orders,"Budget Implementation Act, 2016, No. 1.",Second Reading,"Mr. Speaker, I know that we have recently had the opportunity to spend a week in our home constituencies, and budget 2016 and Bill C-15 contain some extremely positive measures that will benefit Canadians from coast to coast to coast, including Canada's largest-ever infrastructure program and the Canada child benefit, which will benefit nine out of 10 Canadian families.
I am wondering if the hon. member can share with this chamber what his constituents are saying about both Bill C-15 and budget 2016.",Liberal,Saint Boniface—Saint Vital,Dan Vandal,http://www.parl.gc.ca/MembersOfParliament/ProfileMP.aspx?Key=215886&Language=E
4670474,ca.proc.d.2016-05-05.8901578,2016-05-05,6f563895-ecb5-41c5-bcec-9c45d63bed5c,216092,Mr. Seamus O'Regan,,Government Orders,"Budget Implementation Act, 2016, No. 1.",Second Reading,"Mr. Speaker, like many new members of the House who were campaigning for the first time in order to enter this honourable House, I was struck by how our constituents spoke to us and the concerns they held. Certainly, their ability to find some stability in a world that is so rapidly changing, to find some financial security for their children, and for them to have the choice on how to spend limited resources on their families and their children was something that was brought up time and again.
I am very happy that the Canada child benefit will come into effect on Canada Day, July 1. People will be receiving their cheques and families will be able to determine how best to spend the benefit on themselves and their families. 
I am a big believer in efficiencies. To take three separate, very disparate family benefits and turn them into one tangible cheque is one of the most tangible and most important parts of the budget. It is not just something we use at the end of the tax year, but a tangible benefit that Canadian families can feel, use, and spend throughout the year on their children to make better lives for themselves and their families.",Liberal,St. John's South—Mount Pearl,Seamus O'Regan,http://www.parl.gc.ca/MembersOfParliament/ProfileMP.aspx?Key=216092&Language=E
4670475,ca.proc.d.2016-05-05.8901601,2016-05-05,4bc128a9-b349-4867-a545-ad05122c0e46,217242,"Ms. Niki Ashton (Churchill—Keewatinook Aski, NDP)",,Government Orders,"Budget Implementation Act, 2016, No. 1.",Second Reading,"Mr. Speaker, I am pleased to rise in the House to speak to Bill C-15, an act to implement certain provisions of the budget tabled in Parliament on March 22, 2016 and other measures.
I would like to begin by noting that I will be splitting my time with the member for Saskatoon West. 
Budgets should reflect priorities, and the priorities of any government governing at this time in history ought to be the growing inequality in our country.
Over the last 30 years, we have seen the gap between the rich and everyone else grow. The richest 100 Canadians now hold as much wealth as the bottom 10 million combined. Just this week, Statistics Canada released a study that showed that over the last 30 years it has been getting harder and harder for Canadians to move up the income ladder, but it has been easier for the wealthy to hold on to that wealth.
This did not just happen. It is the result of decades of successive Liberal and Conservative governments that have chosen not to support the middle- and low-income Canadians in our country. This budget is sadly no different.
Early into the Liberal mandate, they prioritized the so-called middle-class tax cut. However, a study from the parliamentary budget officer proves the Liberal tax plan will give nothing to 60% of Canadians. The biggest breaks will go to the top 30% of income earners, and those making $200,000 or more will receive the maximum amount. This is on top of no action to help minimum wage workers earn a fair living.
Another broken promise to Canadians made by the Liberals in the campaign that we have now seen is not taking any action to close the stock option loophole for CEOs, a loophole that costs the public $800 million a year.
When we talk about the growing inequality in our country and the kind of crushing poverty we know to exist, I think many of our minds go to the experience of first nations. Let us talk about first nations youth. Half of all first nations children in Canada live in poverty. In Manitoba, my province, 62% of first nations children live below the poverty line.
What about this budget? We saw the Liberals choose not to live up to their promises to first nations children. This budget shortchanged first nations education by $230 million. Following a historic ruling by the Canadian Human Rights Tribunal, first nations child welfare saw $130 million less than was promised.
There is also no money for first nations health care, Jordan's principle, or mental health supports, while many isolated first nations, including communities in my own constituency, struggle with suicide crises.
We have also seen the Liberals choose to break their promise to invest in health care. After promising $3 billion over the next four years to help Canadians access high-quality home care, this budget has nothing.
We have also seen the way the Prime Minister, the self-appointed Minister of Youth, came up $170 million short on his commitment made to young Canadians. The millennial generation needs more than a selfie to help them grapple with the challenges they are facing: skyrocketing student debt, out-of-reach housing prices, and a labour market that is flooded with precarious, unstable, low-paying work.
Unfortunately, this is another missed opportunity by the Liberal government to reduce inequality.
When we look at the history of growing inequality in our country, we know that the 1990s, under successive Liberal governments, was the period of time in which the trend around inequality began to grow the fastest. We have heard from those who have studied that trend that one of the major contributors was the cuts to employment insurance. 
On that note, let us look at the recent changes that were made to EI. The system left in place by the Conservatives was nothing less than devastated. However, let us be clear. The system the Conservatives inherited was already deeply troubled. The Liberals plundered countless billions of dollars, in fact $54 billion, from the EI fund for political purposes, and supervised the biggest and most thorough attack on our social safety net as of yet.
If the Liberals believe that the only reason the EI system is in shambles is due to the Conservatives' reforms, I recommend that they look into their own history and uncover the real reasons why a majority of Canadians who are out of work today are left without access to EI. In fact, regarding the changes implemented by Bill C-15, we can see that they do not go far enough.
We know that while some extensions were made, areas like Edmonton and southern Saskatchewan were completely left out of the government's relief measures. When we asked the government why, the reply was blunt and brutal. It was because of “cold, hard math”. Those words are certainly cold comfort to Canadian workers out of a job.
The cold, hard math rhetoric they are basing their policies on has apparently come out of thin air. When we have asked for references to studies and government reports, we have seen nothing. We call on the minister to correct this mistake and to include Edmonton and southern Saskatchewan in the targeted regions immediately.
The broader picture, though, is the failure that the regional thresholds have met in trying to achieve more fairness for the EI system. The regional thresholds have been described as inadequate by countless stakeholders. We in the NDP will continue to advocate for a universal 360-hour threshold that would be fair and adequate for all workers.
Canada's social safety net is broken. The government likes to place the blame squarely at the feet of the previous government, which certainly did its share of damage, but the Liberals should take a look in the mirror. What they are now framing as a victory for workers is actually a return to a difficult time that bears the scars of damage done to our social safety net under Chrétien and Martin.
I would like to talk about the term “social safety net”. What does that represent? In our current economic context, the professional lives of a growing number of workers are hanging by a thread. When that thread breaks, the social safety net can prevent people from crashing to the floor. When it works, the social safety net enables people to pick themselves up, dust themselves off, and start all over again. 
The safety net has made it possible for many workers to get back into the job market relatively unscathed, but over the past few decades, more and more workers have been slipping through the holes in the net. Government after government has failed to ensure the integrity of our social safety net. Worse still, successive governments have come to power brandishing their scissors and cutting all kinds of holes in it. They seemed compelled to cut swiftly and indiscriminately.
The holes in our social safety net are well known. One of them is the notorious black hole that swallows up so many seasonal workers. The government could easily have enhanced the employment insurance system by renewing a pilot project that added five weeks of benefits, but it forgot about those workers, and they are once again slipping through the holes in the safety net. We are disappointed but not surprised.
People can count on the NDP to keep protecting workers' interests from the old parties' attacks.
Before I conclude I also want to spend some time talking about how this budget left out major promises to my own constituency, including a commitment that the Prime Minister made during the election to partner on the construction of the east side road.
The east ride road is a legacy project that would have allowed 11 first nations that are currently isolated in my constituency to access something that so many Canadians take for granted, a road.
Climate change has made their existence in isolated communities more difficult and more precarious. We are talking about communities that have as high as 80% of the population on welfare. We are talking about communities that are struggling day to day.
On September 29, 2015, the Prime Minister, when asked if he was going to be a partner on the east side road, said, “The full answer is yes, the federal government will be the partner Manitoba needs in order to deliver the infrastructure that is required”. Sadly, there is no such commitment in the budget. Therefore, whether it is on the east side road or whether it is on the other broken promises, we will remain vigilant.
 Much work needs to be done on the budget to understand exactly what it covers.
 I would like to seek unanimous consent to move the following motion: That, notwithstanding any order or usual practice of the House that Bill C-15, an act to implement certain provisions of the budget tabled in Parliament on March 22, 2016, and other measures be amended by removing the following clauses: (a) Clauses 80 to 116 related to the Canadian Forces Members and Veterans Re-establishment and Compensation Act; (b) Clauses 126 to 168 related to bank bail-ins and the bank recapitalization regime; (c) Clauses 188 to 191 related to the Old Age Security Act; and (d) Clauses 207 to 231 related to the Employment Insurance Act; that the clauses mentioned in section (a) of this motion do form Bill C-16; that Bill C-16 be deemed read a first time and be printed; that the order for second reading of the said bill provide for the referral to the Standing Committee on Veterans Affairs; that the clauses mentioned in section (b) of this motion do form Bill C-17; that Bill C-17 be deemed read a first time and be printed; that the order for second reading of the said bill provide for the referral to the Standing Committee on Finance; that the clauses mentioned in section (c) of this motion do form Bill C-18; that Bill C-18 be deemed read a first time and be printed; that the order for second reading of the said bill provide for the referral to the Standing Committee on Human Resources, Skills and Social Development and the Status of Persons with Disabilities; that the clauses mentioned in section (d) of this motion do form Bill C-19; that Bill C-19 be deemed read a first time and be printed; that the order for second reading of the said bill provide for the referral to the Standing Committee on Human Resources, Skills and Social Development and the Status of Persons with Disabilities; that Bill C-15 retain the status on the Order Paper that it had prior to the adoption of this order; and that Bill C-15 be reprinted as amended and the law clerk and the parliamentary counsel be authorized to make any technical changes or corrections as may be necessary to give effect to this motion.
We are proposing this motion in order to give the full scrutiny that is required by parliamentarians on behalf of Canadians.",New Democratic Party,Churchill—Keewatinook Aski,Niki Ashton,http://www.parl.gc.ca/MembersOfParliament/ProfileMP.aspx?Key=217242&Language=E
4670476,ca.proc.d.2016-05-05.8901793,2016-05-05,02c2cb20-f27d-46a5-8e78-ab4b405bf07b,214864,The Deputy Speaker,,Government Orders,"Budget Implementation Act, 2016, No. 1.",Second Reading,Does the hon. member for Churchill—Keewatinook Aski have the unanimous consent of the House to propose this motion?,Conservative,Simcoe North,Bruce Stanton,http://www.parl.gc.ca/MembersOfParliament/ProfileMP.aspx?Key=214864&Language=E
4670477,ca.proc.d.2016-05-05.p4322912,2016-05-05,,,,intervention,Government Orders,"Budget Implementation Act, 2016, No. 1.",Second Reading," Agreed.
 No.",,,Some hon. members,
4670478,ca.proc.d.2016-05-05.p4322914,2016-05-05,02c2cb20-f27d-46a5-8e78-ab4b405bf07b,214864,The Deputy Speaker,,Government Orders,"Budget Implementation Act, 2016, No. 1.",Second Reading, Questions and comments. The hon. member for Laurentides—Labelle.,Conservative,Simcoe North,Bruce Stanton,http://www.parl.gc.ca/MembersOfParliament/ProfileMP.aspx?Key=214864&Language=E
4670479,ca.proc.d.2016-05-05.8901799,2016-05-05,101111c4-d4b7-46a9-9f88-9bfa542bb606,215937,"Mr. David de Burgh Graham (Laurentides—Labelle, Lib.)",,Government Orders,"Budget Implementation Act, 2016, No. 1.",Second Reading,"Mr. Speaker, when faced with social inequality, a cause to which we are just as committed as my colleague, we must help everyone, help the entire economy, and invest in our infrastructure, our communities, and our future. If that means that we have to borrow to make investments, then that is part of our role as the government.
Can my colleague explain how the NPD could have helped anyone by promising to never run a deficit, even though there was already a deficit under the Conservatives? Where would the NDP's austerity have led us?",Liberal,Laurentides—Labelle,David Graham,http://www.parl.gc.ca/MembersOfParliament/ProfileMP.aspx?Key=215937&Language=E
4670480,ca.proc.d.2016-05-05.8901806,2016-05-05,4bc128a9-b349-4867-a545-ad05122c0e46,217242,Ms. Niki Ashton,,Government Orders,"Budget Implementation Act, 2016, No. 1.",Second Reading,"Mr. Speaker, while I appreciate efforts to change the channel, we are talking about an omnibus budget bill that includes broken promises to Canadians. I explained a laundry list, including broken promises to first nations children, among the poorest people in our country. It includes a failure to step up to important election commitments. 
When Canadians were presented with the tag line of real change, that is what they expected. They did not expect broken promises. They certainly did not expect more of the same, including omnibus bills. That is unfortunately what they are seeing from the Liberal government.",New Democratic Party,Churchill—Keewatinook Aski,Niki Ashton,http://www.parl.gc.ca/MembersOfParliament/ProfileMP.aspx?Key=217242&Language=E
4670481,ca.proc.d.2016-05-05.8901828,2016-05-05,c5b09363-414d-43b2-bc2c-274b997c8989,217263,"Ms. Jenny Kwan (Vancouver East, NDP)",,Government Orders,"Budget Implementation Act, 2016, No. 1.",Second Reading,"Mr. Speaker, the member cited some of the challenges that she faced in her community, particularly on the issue of income inequality. In many ways there are some similarities between her riding and mine. The issue that troubles me the most with the Liberal budget is the income tax cuts and who that benefits.
 Could the member elaborate on that and on how the government can make changes that will assist people in both of our communities, like so many Canadians who are in the greatest need?",New Democratic Party,Vancouver East,Jenny Kwan,http://www.parl.gc.ca/MembersOfParliament/ProfileMP.aspx?Key=217263&Language=E
4670482,ca.proc.d.2016-05-05.8901846,2016-05-05,4bc128a9-b349-4867-a545-ad05122c0e46,217242,Ms. Niki Ashton,,Government Orders,"Budget Implementation Act, 2016, No. 1.",Second Reading,"Mr. Speaker, my colleague is an incredible defender of issues that many people on the margins face, including in her own constituency, and her advocacy alongside many indigenous advocates who speak passionately about the issues of poverty and marginalization they face on an ongoing basis.
As the New Democrats have pointed out time and again, one of the first things the Liberal government came up with was a tax cut that it claimed would help middle-class Canadians. However, the parliamentary budget officer said that Canadians who made $200,000 or more a year stood to benefit the most. Despite the rhetoric, what is true is that the wealthiest Canadians continue to benefit more under the government while everyone else continues to lose out.
I can speak to a big issue that is on the minds of many people in my constituency, which is employment insurance, a program that should be there for Canadians when they have fallen on hard times. I referred to this as well in my speech. Unfortunately, this budget does not go nearly far enough in making EI more accessible to Canadians. Only 40% of Canadians are able to access it, so much more needs to be done.
Fundamentally, what this budget does not do is get at the structures that exacerbate inequality in our country. Under the Liberals, it continues to benefit those who have a lot already, while certainly not being on the side of everyone else.",New Democratic Party,Churchill—Keewatinook Aski,Niki Ashton,http://www.parl.gc.ca/MembersOfParliament/ProfileMP.aspx?Key=217242&Language=E
