basepk,hid,speechdate,pid,opid,speakeroldname,speakerposition,maintopic,subtopic,subsubtopic,speechtext,speakerparty,speakerriding,speakername,speakerurl
4694518,ca.proc.d.2016-12-14.9321207,2016-12-14,6bde42a3-d07c-4c1f-b9d4-9e14a124f465,213864,"Hon. Stéphane Dion (Minister of Foreign Affairs, Lib.)",,Oral Questions,Foreign Affairs,,"Mr. Speaker, the government does not export the same kind of weapons to Saudi Arabia as the United States did. The weapons in that case were air to ground bombs. We condemn the repeated, senseless attacks in Yemen, including the recent horrific attack on a funeral home. These violations of international law and humanitarian law are tragic and unacceptable.
Obviously, we have denounced those actions repeatedly, and we are not part of the the Saudi coalition. We want Saudi Arabia to honour its international obligations.",Liberal,Saint-Laurent,Stéphane Dion,http://www.parl.gc.ca/MembersOfParliament/ProfileMP.aspx?Key=213864&Language=E
4694519,ca.proc.d.2016-12-14.9321209,2016-12-14,ad4032f2-6bb1-497b-b146-f321cfb71ba9,226915,"Hon. Pierre Poilievre (Carleton, CPC)",,Oral Questions,Taxation,,"Mr. Speaker, as families look to buy Christmas gifts, they are haunted by worry, worry about the record household debt that has now reached $1.67 for every dollar of household earnings, worry compounded by the new taxes the government promises on wages, on gasoline, on home heating and electricity, and maybe even on health and dental plans.
As we get closer to Christmas, when will the government realize that many families have nothing more to give?",Conservative,Carleton,Pierre Poilievre,http://www.parl.gc.ca/MembersOfParliament/ProfileMP.aspx?Key=226915&Language=E
4694520,ca.proc.d.2016-12-14.9321213,2016-12-14,5d3dfa7b-f157-4019-ac2a-4dab0cb15f92,213961,"Hon. Bill Morneau (Minister of Finance, Lib.)",,Oral Questions,Taxation,,"Mr. Speaker, there have been some really important things that have happened this year. On January 1, taxes were lowered for middle-class Canadians. On March 22, we introduced a budget that increased the guaranteed income supplement for single seniors by 10%, $943. We also introduced the Canada child benefit, which is helping families with, on average, $2,300. 
We also changed student grants so they get 50% more for lower-income and middle-income families.
It has been a year of important initiatives, and we are looking forward to doing more for middle-class Canadians in 2017.",Liberal,Toronto Centre,Bill Morneau,http://www.parl.gc.ca/MembersOfParliament/ProfileMP.aspx?Key=213961&Language=E
4694521,ca.proc.d.2016-12-14.9321216,2016-12-14,ad4032f2-6bb1-497b-b146-f321cfb71ba9,226915,"Hon. Pierre Poilievre (Carleton, CPC)",,Oral Questions,Taxation,,"Mr. Speaker, by middle class, he apparently means the people who can afford to attend $1,500-a-plate fundraisers. That is why he cut taxes for people earning $200,000 a year. They got $800, but someone earning $45,000 got exactly zero. 
The new $100 billion in debts that Liberals are adding is great news for the billionaire bond holders who will collect interest on it, but for the working class people who have to pay that interest through their taxes, it is a nightmare. 
When will the finance minister realize that Canadians have their own debts and cannot afford to pay for his?",Conservative,Carleton,Pierre Poilievre,http://www.parl.gc.ca/MembersOfParliament/ProfileMP.aspx?Key=226915&Language=E
4694522,ca.proc.d.2016-12-14.9321218,2016-12-14,d67a49c2-65bd-411e-8bb4-29ff759c5829,214003,"Hon. Jean-Yves Duclos (Minister of Families, Children and Social Development, Lib.)",,Oral Questions,Taxation,,"Mr. Speaker, I am grateful for this opportunity to repeat that middle class families are our top priority. We have avoided sending cheques to families of millionaires, so we can send them to nine families out of ten, which means the families of six million children, with an average benefit of $600 per month, non-taxable. That is taking the families of 300,000 children out of poverty.",Liberal,Québec,Jean-Yves Duclos,http://www.parl.gc.ca/MembersOfParliament/ProfileMP.aspx?Key=214003&Language=E
4694523,ca.proc.d.2016-12-14.9321220,2016-12-14,e277e13e-59ec-425f-a957-eb5e54d8cb62,226920,"Mr. Gérard Deltell (Louis-Saint-Laurent, CPC)",,Oral Questions,Taxation,,"Mr. Speaker, the Liberal's greed keeps eating into the wallets of Canadian workers and it knows no bounds.
What is the Liberals' latest scheme? They want to tax health insurance and dental insurance, which is very bad news. What will that accomplish? This has existed in Quebec for a few years now. Does the minister know what happened? Unfortunately, 20% of Quebec's workers no longer have private dental and health insurance.
Does the minister want 2.6 million Canadians to lose their insurance?",Conservative,Louis-Saint-Laurent,Gérard Deltell,http://www.parl.gc.ca/MembersOfParliament/ProfileMP.aspx?Key=226920&Language=E
4694524,ca.proc.d.2016-12-14.9321223,2016-12-14,5d3dfa7b-f157-4019-ac2a-4dab0cb15f92,213961,"Hon. Bill Morneau (Minister of Finance, Lib.)",,Oral Questions,Taxation,,"Mr. Speaker, the numbers are clear. This was a good year in Canadian politics. 
We started with a tax cut for the middle class. We also improved life for seniors by enhancing old age security. We also created the Canada child benefit, which helps nine out of ten families have more money. These are the measures we have taken. Next year, we will continue to help the middle class.",Liberal,Toronto Centre,Bill Morneau,http://www.parl.gc.ca/MembersOfParliament/ProfileMP.aspx?Key=213961&Language=E
4694525,ca.proc.d.2016-12-14.9321226,2016-12-14,e277e13e-59ec-425f-a957-eb5e54d8cb62,226920,"Mr. Gérard Deltell (Louis-Saint-Laurent, CPC)",,Oral Questions,Taxation,,"Mr. Speaker, it is definitely not by taxing people's private insurance that they are going to achieve that goal.
In addition to taking money out of workers' wallets, the minister has nothing to put under the Christmas tree for business people, who are the creators of jobs and wealth. In the new year, they are going to have to deal with the Liberal tax on carbon, additional contributions to pension funds, the elimination of tax credits, and the refusal to lower business taxes. That is what our business people, our job creators, can expect.
As Christmas approaches, why is the minister acting like Scrooge towards our job creators?",Conservative,Louis-Saint-Laurent,Gérard Deltell,http://www.parl.gc.ca/MembersOfParliament/ProfileMP.aspx?Key=226920&Language=E
4694526,ca.proc.d.2016-12-14.9321228,2016-12-14,5d3dfa7b-f157-4019-ac2a-4dab0cb15f92,213961,"Hon. Bill Morneau (Minister of Finance, Lib.)",,Oral Questions,Taxation,,"Mr. Speaker, we want to make investments for the future while we help the middle class, and that is exactly what we are doing.
We have made historic investments in our country's infrastructure, which will improve Canada's future growth. 
Next year we will proceed with our program that will invest in the future of our children and grandchildren.",Liberal,Toronto Centre,Bill Morneau,http://www.parl.gc.ca/MembersOfParliament/ProfileMP.aspx?Key=213961&Language=E
4694527,ca.proc.d.2016-12-14.9321231,2016-12-14,08f8d23a-fbea-4e7b-ba41-34c9f62dde9e,214056,"Ms. Anne Minh-Thu Quach (Salaberry—Suroît, NDP)",,Oral Questions,Public Services and Procurement,,"Mr. Speaker, over the past two months, I have been calling on the government to do something to help students who are still not getting paid as a result of problems with Phoenix.
 Yesterday, we learned that nearly 1,700 student workers at Parks Canada have had problems with their pay. Students have a lot of expenses, particularly with the rising cost of tuition.
These young people finished working four months ago. They were not volunteers. When will the Minister of Public Services and Procurement be able to assure me that all of these students will get paid?",New Democratic Party,Salaberry—Suroît,Anne Minh-Thu Quach,http://www.parl.gc.ca/MembersOfParliament/ProfileMP.aspx?Key=214056&Language=E
4694528,ca.proc.d.2016-12-14.9321235,2016-12-14,669a6720-3704-48ff-a218-4035d05107a6,214324,"Hon. Judy Foote (Minister of Public Services and Procurement, Lib.)",,Oral Questions,Public Services and Procurement,,"Mr. Speaker, as I have said repeatedly, it is totally unacceptable for anyone to go without pay for work performed, certainly in the case of students. I can report today that there are three students who are still waiting for pay. We are working very hard on their cases in order to get them resolved as quickly as possible. ",Liberal,Bonavista—Burin—Trinity,Judy Foote,http://www.parl.gc.ca/MembersOfParliament/ProfileMP.aspx?Key=214324&Language=E
4694529,ca.proc.d.2016-12-14.9321237,2016-12-14,4bc128a9-b349-4867-a545-ad05122c0e46,217242,"Ms. Niki Ashton (Churchill—Keewatinook Aski, NDP)",,Oral Questions,Public Services and Procurement,,"Mr. Speaker, it has been two months since the Phoenix deadline, and 10,000 cases have yet to be fixed, meaning thousands of Canadians are still waiting to get paid, yet we have learned that executives in charge of this fiasco are getting bonuses. Let us get this straight. Executives are getting performance bonuses for a program that does not work.
With the holidays around the corner, this adds insult to injury to the so many who are still waiting to get paid. Will the minister prove that her government takes this seriously and halt the bonuses until Phoenix is fixed?",New Democratic Party,Churchill—Keewatinook Aski,Niki Ashton,http://www.parl.gc.ca/MembersOfParliament/ProfileMP.aspx?Key=217242&Language=E
4694530,ca.proc.d.2016-12-14.9321239,2016-12-14,669a6720-3704-48ff-a218-4035d05107a6,214324,"Hon. Judy Foote (Minister of Public Services and Procurement, Lib.)",,Oral Questions,Public Services and Procurement,,"Mr. Speaker, there is no one more concerned about this issue than I am as the minister responsible. We are working very hard. We have put measures in place, including satellite offices. We have hired 250 additional people to deal with these issues. We are now dealing with really complex issues. In fact, the 10,000 cases that remain are issues that have been outstanding, some going back three years. We are doing everything we can to deal with the issue, and we will continue to do that. 
In the interim, if there are any employees who are affected by this pay system, I encourage them to get in touch with us, and to make sure that they—",Liberal,Bonavista—Burin—Trinity,Judy Foote,http://www.parl.gc.ca/MembersOfParliament/ProfileMP.aspx?Key=214324&Language=E
4694531,ca.proc.d.2016-12-14.9321240,2016-12-14,3176068f-62ee-4b2f-aacd-1131201c6db1,214707,The Speaker,,Oral Questions,Public Services and Procurement,,The hon. member for Bay of Quinte.,Liberal,Halifax West,Geoff Regan,http://www.parl.gc.ca/MembersOfParliament/ProfileMP.aspx?Key=214707&Language=E
4694532,ca.proc.d.2016-12-14.9321242,2016-12-14,343b5c4a-fb8c-4248-8183-5ab683bc9f9f,219323,"Mr. Neil Ellis (Bay of Quinte, Lib.)",,Oral Questions,National Defence,,"Mr. Speaker, after three governments, four prime ministers, and 14 years since the project began, I was proud that our government has successfully acquired fixed-wing search and rescue aircraft. These aircraft play a critical role, carrying out search and rescue operations to respond to Canadians in distress across our vast country of over 18 million square kilometres.
Can the Minister of Public Services and Procurement please inform the House what this announcement will mean for all Canadians?",Liberal,Bay of Quinte,Neil Ellis,http://www.parl.gc.ca/MembersOfParliament/ProfileMP.aspx?Key=219323&Language=E
4694533,ca.proc.d.2016-12-14.9321246,2016-12-14,669a6720-3704-48ff-a218-4035d05107a6,214324,"Hon. Judy Foote (Minister of Public Services and Procurement, Lib.)",,Oral Questions,National Defence,,"Mr. Speaker, I thank the member for Bay of Quinte for his hard work.
Last week in Trenton, we announced the awarding of a contract to acquire a new fleet of 16 modern search and rescue aircraft. This announcement fulfills our commitment to ensure that men and women in uniform have the equipment they need to carry out the work expected of them. 
This contract will create middle class jobs for Canadians throughout the country and generate growth for Canada's aerospace and defence sector, but more importantly, these aircraft will help our military save the lives of Canadians everyday.",Liberal,Bonavista—Burin—Trinity,Judy Foote,http://www.parl.gc.ca/MembersOfParliament/ProfileMP.aspx?Key=214324&Language=E
4694534,ca.proc.d.2016-12-14.9321249,2016-12-14,72dace30-741a-4877-8c1c-31b5dc3e4a8e,216251,"Mr. James Bezan (Selkirk—Interlake—Eastman, CPC)",,Oral Questions,Foreign Affairs,,"Mr. Speaker, the Liberals have refused to provide any details about the deployment of 600 Canadian troops to a dangerous African mission. Canadians are demanding the facts. 
Yesterday, the defence minister broke his promise to provide Canadians with the information by the end of this year. He is now saying he is going to hide that information until next year. This is not like keeping our children's Christmas presents a surprise. The lives of our soldiers are on the line.
Will the Liberals finally start being transparent about their blatant political decision, and allow for a full debate and a vote before they deploy our troops to Mali?",Conservative,Selkirk—Interlake—Eastman,James Bezan,http://www.parl.gc.ca/MembersOfParliament/ProfileMP.aspx?Key=216251&Language=E
4694535,ca.proc.d.2016-12-14.9321253,2016-12-14,6bde42a3-d07c-4c1f-b9d4-9e14a124f465,213864,"Hon. Stéphane Dion (Minister of Foreign Affairs, Lib.)",,Oral Questions,Foreign Affairs,,"Mr. Speaker, my colleague is completely right. This is a very serious decision. It must be taken very seriously and in a comprehensive way. Where the member is in contradiction with himself is by asking me to do that in the next 10 seconds that I am allowed in the House. 
No, it will be done properly, in due time, with true transparency, and will show how much Canada will honour its commitment for peace.",Liberal,Saint-Laurent,Stéphane Dion,http://www.parl.gc.ca/MembersOfParliament/ProfileMP.aspx?Key=213864&Language=E
4694536,ca.proc.d.2016-12-14.9321255,2016-12-14,9fe7bceb-dae2-4f26-b87b-2de1f38b4b84,217920,"Mr. Pierre Paul-Hus (Charlesbourg—Haute-Saint-Charles, CPC)",,Oral Questions,Foreign Affairs,,"Mr. Speaker, the minister is not answering the question, so I will ask it another way.
Before the government decides to deploy any troops, as the Liberals are going to do with the mission in Africa, the Standing Senate Committee on National Security and Defence is asking it to inform the House of the size of the mission, its goals, the risks involved, the costs, and the rules of engagement, and to obtain the support of all parties. The Senate is making this recommendation based on the Dutch model, which focuses on transparency and reaching a consensus.
Will the Minister of National Defence heed this advice and provide the House with all the facts so that we can hold an informed debate, or will he hide the truth from Canadians?",Conservative,Charlesbourg—Haute-Saint-Charles,Pierre Paul-Hus,http://www.parl.gc.ca/MembersOfParliament/ProfileMP.aspx?Key=217920&Language=E
4694537,ca.proc.d.2016-12-14.9321257,2016-12-14,6bde42a3-d07c-4c1f-b9d4-9e14a124f465,213864,"Hon. Stéphane Dion (Minister of Foreign Affairs, Lib.)",,Oral Questions,Foreign Affairs,,"Mr. Speaker, that is the same question so I will give the same answer. It is very important that the Government of Canada be open and transparent about this fundamental decision to send our troops to support the cause of peace, as they always have. Canada is one of the few countries in the world that has never sent its troops abroad for reasons other than to protect democracy, peace, and justice. That is what we will do, and we will provide all the information to Canadians, because they have a right to know what is happening.",Liberal,Saint-Laurent,Stéphane Dion,http://www.parl.gc.ca/MembersOfParliament/ProfileMP.aspx?Key=213864&Language=E
4694538,ca.proc.d.2016-12-14.9321259,2016-12-14,61c83e21-f9a3-4e4b-b881-4b2d1ce33c43,226909,"Mr. John Brassard (Barrie—Innisfil, CPC)",,Oral Questions,National Defence,,"Mr. Speaker, Australia, the United States, and the U.K. have banned the use of mefloquine, the anti-malarial drug, by members of their armed forces. Last week, we learned Germany will no longer be administering the drug to their armed forces. This decision puts the Canadian Armed Forces one step behind our NATO and European allies. The drug has a toxic side effect, and leads to aggression and suicide. The defence minister continues to defend the use of mefloquine. 
Why can he not see that our allies have acted to protect their forces from mefloquine and do the same to protect Canadian troops?",Conservative,Barrie—Innisfil,John Brassard,http://www.parl.gc.ca/MembersOfParliament/ProfileMP.aspx?Key=226909&Language=E
4694539,ca.proc.d.2016-12-14.9321262,2016-12-14,fc02fe5c-f4bc-451c-b921-86c4794d1d1d,219872,"Hon. John McKay (Parliamentary Secretary to the Minister of National Defence, Lib.)",,Oral Questions,National Defence,,"Mr. Speaker, we take the health of our troops very seriously.
Malaria is a life-threatening disease present in many areas of the world. Individuals are carefully assessed and screened by their health services. The Chief of the Defence Staff stated lately that the Surgeon General is looking into the use of mefloquine and will report back imminently.",Liberal,Scarborough—Guildwood,John McKay,http://www.parl.gc.ca/MembersOfParliament/ProfileMP.aspx?Key=219872&Language=E
4694540,ca.proc.d.2016-12-14.9321264,2016-12-14,53eb10e4-f8e7-4ef7-9448-b4a10ec1dba3,217051,"Mrs. Cathay Wagantall (Yorkton—Melville, CPC)",,Oral Questions,National Defence,,"Mr. Speaker, all of our allies are facing that same malaria.
In August of this year, Lord Dannatt, head of the British army apologized to troops who had taken mefloquine while he was chief of the general staff. Although he did not take the drug himself, he saw first-hand its catastrophic side effects.
On September 15, the Australian department of veterans affairs established a dedicated mefloquine support team for its service members and veterans.
Why is the Liberal government willing to risk the health and lives of our soldiers by refusing to recognize the dangers of mefloquine, like our allies have, before it deploys them to Africa?",Conservative,Yorkton—Melville,Cathay Wagantall,http://www.parl.gc.ca/MembersOfParliament/ProfileMP.aspx?Key=217051&Language=E
4694541,ca.proc.d.2016-12-14.9321266,2016-12-14,fc02fe5c-f4bc-451c-b921-86c4794d1d1d,219872,"Hon. John McKay (Parliamentary Secretary to the Minister of National Defence, Lib.)",,Oral Questions,National Defence,,"Mr. Speaker, mefloquine is a Health Canada approved drug, and continues to be an option for malaria prophylaxis, as recommended by the Public Health Agency of Canada and by most public health and travel medicines around the world.
Having said that, however, the Chief of the Defence Staff has caused the Surgeon General to look into the use of mefloquine prior to any future deployments.",Liberal,Scarborough—Guildwood,John McKay,http://www.parl.gc.ca/MembersOfParliament/ProfileMP.aspx?Key=219872&Language=E
4694542,ca.proc.d.2016-12-14.9321268,2016-12-14,13a21d52-bc44-4a96-a206-f18432ef9191,228614,"Mr. Romeo Saganash (Abitibi—Baie-James—Nunavik—Eeyou, NDP)",,Oral Questions,Indigenous Affairs,,"Mr. Speaker, for more than a year now, the Prime Minister has been talking about how important the relationship with indigenous peoples is. For more than a year now, I have been rising in the House to ask why the government is not really sending that same message to first nations.
This morning, we learned that survivors of St. Anne residential school, where there was an electric chair and children were forced to eat their own vomit, have to go to court to fight for compensation and to ensure they will not have to cover the government's legal costs. That is what I call disgusting and despicable.
When will this government start walking the talk?",New Democratic Party,Abitibi—Baie-James—Nunavik—Eeyou,Romeo Saganash,http://www.parl.gc.ca/MembersOfParliament/ProfileMP.aspx?Key=228614&Language=E
4694543,ca.proc.d.2016-12-14.9321272,2016-12-14,f470e27a-a074-4b16-8304-960ffe8c9289,213975,"Hon. Carolyn Bennett (Minister of Indigenous and Northern Affairs, Lib.)",,Oral Questions,Indigenous Affairs,,"Mr. Speaker, our government is committed to justice for all victims of this dark chapter in our history and to ensuring that everyone who is eligible for compensation receives it.
 We do not typically seek to recover costs from claimants under the Indian Residential Schools Settlement Agreement. Generally, matters related to costs are resolved once the case is settled, not while it is before the court.",Liberal,Toronto—St. Paul's,Carolyn Bennett,http://www.parl.gc.ca/MembersOfParliament/ProfileMP.aspx?Key=213975&Language=E
4694544,ca.proc.d.2016-12-14.9321274,2016-12-14,0f7e3c8d-e579-44c0-b8b7-202b425758e4,218968,"Ms. Tracey Ramsey (Essex, NDP)",,Oral Questions,International Trade,,"Mr. Speaker, CETA will dramatically increase foreign takeovers of Canadian companies by raising the threshold for reviews from $600 million to $1.5 billion. This will apply to EU companies as well as American, Chinese, Russian, and many other foreign companies.
The EU is years away from fully ratifying CETA. Why is the government moving full steam ahead?
Instead of permitting more foreign takeovers, the Liberals should be standing up for Canadians by tightening the rules. Will the Liberals support the NDP's amendments to remove these dangerous provisions from CETA?",New Democratic Party,Essex,Tracey Ramsey,http://www.parl.gc.ca/MembersOfParliament/ProfileMP.aspx?Key=218968&Language=E
4694545,ca.proc.d.2016-12-14.9321276,2016-12-14,3dd9162a-4763-4000-8c8a-706a788f7e50,213971,"Hon. Chrystia Freeland (Minister of International Trade, Lib.)",,Oral Questions,International Trade,,"Mr. Speaker, I would like to thank the Conservatives and, particularly, the Bloc who joined us yesterday in supporting this progressive agreement that is going to add to Canadian GDP and create jobs. It is going to lead to an increase of 0.77% to our GDP, which translates to roughly $11.44 billion.
Kurtis McBride, CEO of Miovision Technologies in Kitchener, said that CETA will help his company “reap far greater gains from existing deals with European companies”. Baljit Sierra of Markham said that CETA will generate—",Liberal,University—Rosedale,Chrystia Freeland,http://www.parl.gc.ca/MembersOfParliament/ProfileMP.aspx?Key=213971&Language=E
4694546,ca.proc.d.2016-12-14.9321277,2016-12-14,3176068f-62ee-4b2f-aacd-1131201c6db1,214707,The Speaker,,Oral Questions,International Trade,,The hon. member for Kamloops—Thompson—Cariboo.,Liberal,Halifax West,Geoff Regan,http://www.parl.gc.ca/MembersOfParliament/ProfileMP.aspx?Key=214707&Language=E
4694547,ca.proc.d.2016-12-14.9321278,2016-12-14,9c9a64e6-58f1-4367-9f49-93ad31744c96,217354,"Mrs. Cathy McLeod (Kamloops—Thompson—Cariboo, CPC)",,Oral Questions,Indigenous Affairs,,"Mr. Speaker, today the CBC posted an article by Charmaine Stick of the Onion Lake Cree Nation, which was titled, “I starved myself for financial transparency at Onion Lake Cree Nation”.
She stated:
 For 13 days in June 2014, I went on a hunger strike. In actuality, the First Nations Financial Transparency Act — which the [Liberal] government stopped enforcing last December — was good for people. It was somewhere for the grassroots people to go to get answers...We need equality. Without the First Nations Financial Transparency Act, there's no equality for the membership in our community. 
When will the minister start empowering these courageous women and enforce the act?",Conservative,Kamloops—Thompson—Cariboo,Cathy McLeod,http://www.parl.gc.ca/MembersOfParliament/ProfileMP.aspx?Key=217354&Language=E
4694548,ca.proc.d.2016-12-14.9321282,2016-12-14,f470e27a-a074-4b16-8304-960ffe8c9289,213975,"Hon. Carolyn Bennett (Minister of Indigenous and Northern Affairs, Lib.)",,Oral Questions,Indigenous Affairs,,"Mr. Speaker, everyone, including first nation governments, wants increased transparency and accountability, but we will achieve this through working in full partnership with first nations leadership and organizations. Before and after the election, first nations from from coast to coast to coast were clear that top down, made-in-Ottawa solutions will not work. Our government is committed to reviewing the laws, including the FNFTA, and we will review it in full consultation with first nations.",Liberal,Toronto—St. Paul's,Carolyn Bennett,http://www.parl.gc.ca/MembersOfParliament/ProfileMP.aspx?Key=213975&Language=E
4694549,ca.proc.d.2016-12-14.9321284,2016-12-14,9c9a64e6-58f1-4367-9f49-93ad31744c96,217354,"Mrs. Cathy McLeod (Kamloops—Thompson—Cariboo, CPC)",,Oral Questions,Indigenous Affairs,,"Mr. Speaker, it has been over a year. I do not think it takes that long to consult and come up with a plan. We have now learned that the Liberals have set up a secretive four-person club that is concocting ways to transfer billions of dollars directly to the chiefs of first nations. The minister has stripped financial transparency protections for grassroots band members. Band members need more information, not less, so they can be empowered to hold their leadership accountable. 
When will the minister stop her attack on financial transparency and grassroots first nations?",Conservative,Kamloops—Thompson—Cariboo,Cathy McLeod,http://www.parl.gc.ca/MembersOfParliament/ProfileMP.aspx?Key=217354&Language=E
