basepk,hid,speechdate,pid,opid,speakeroldname,speakerposition,maintopic,subtopic,subsubtopic,speechtext,speakerparty,speakerriding,speakername,speakerurl
4654631,ca.proc.d.2016-03-09.17153.85,2016-03-09,cd83ba99-0c5b-4f51-a42b-a73504b91199,10273,"Hon. Jody Wilson-Raybould (Minister of Justice and Attorney General of Canada, Lib.)",,Oral Questions,Justice,,"Mr. Speaker, in terms of our approach, we are undertaking a comprehensive review of the criminal justice system. That includes sentencing reform to determine efficiencies and effectiveness in the process and I will ensure that I work with my colleagues, including the Minister of Public Safety, to look at bail reform and other matters with respect to how we can proceed and ensure fairness, equality, compliance with the Charter of Rights and Freedoms, and that the accused's rights are respected.",Liberal,Vancouver Granville,Jody Wilson-Raybould,
4654632,ca.proc.d.2016-03-09.17153.86,2016-03-09,363e30d6-e47b-4c39-91ad-667deb63009c,10055,"Ms. Sheila Malcolmson (Nanaimo—Ladysmith, NDP)",,Oral Questions,Indigenous Affairs,,"Mr. Speaker, the Prime Minister promised that no relationship was more important to him than that with indigenous peoples. That relationship has not been respected in the case of B.C.'s Site C dam, where there are three ongoing court cases with first nations. This is a litmus test of the Prime Minister's solemn commitment. Repeated letters from first nations have been ignored by the Liberals.
Will the government please cease and desist on approval for Site C until proper consultations can occur?",New Democratic Party,Nanaimo--Ladysmith,Sheila Malcolmson,
4654633,ca.proc.d.2016-03-09.17153.87,2016-03-09,858770e9-c9c2-4a95-a6e4-679c973912fd,10050,"Mr. Jonathan Wilkinson (Parliamentary Secretary to the Minister of Environment and Climate Change, Lib.)",,Oral Questions,Indigenous Affairs,,"Mr. Speaker, in the fall of 2014, as members know, the former government approved a project and set out a series of legally binding conditions with which the proponent must comply. B.C. Hydro must meet the requirements set out in these conditions and we are verifying that it is in fact the case. 
The minister has been involved and engaged in discussions with first nations people and other indigenous organizations to try to ensure that we are clearly understanding those concerns, and we will continue to engage on that basis going forward.",Liberal,North Vancouver,Jonathan Wilkinson,
4654634,ca.proc.d.2016-03-09.17153.88,2016-03-09,031462db-8f61-48ed-bf9f-b033eb8312bb,75,"Mr. Nathan Cullen (Skeena—Bulkley Valley, NDP)",,Oral Questions,Indigenous Affairs,,"Mr. Speaker, you have to wonder which first nations they are engaging with, because the first nations actually impacted by this mega-dam cannot even get their letters returned from the government. It seems to me that there are two Liberal Parties: one that is in campaign and makes sacred promises to first nations people, and one that governs to break them.
The question comes for the Liberal government here and now. Right now they are in the position of authorizing this mega-dam in northeastern British Columbia. First nations have pleaded with the government not to do so, to pause the process and allow the consultation the government promised to actually take place.
Which Liberal Party are we actually going to see?",New Democratic Party,Skeena--Bulkley Valley,Nathan Cullen,http://www.parl.gc.ca/parlinfo/Files/Parliamentarian.aspx?Item=031462db-8f61-48ed-bf9f-b033eb8312bb&Language=E&Section=ALL
4654635,ca.proc.d.2016-03-09.17153.89,2016-03-09,858770e9-c9c2-4a95-a6e4-679c973912fd,10050,"Mr. Jonathan Wilkinson (Parliamentary Secretary to the Minister of Environment and Climate Change, Lib.)",,Oral Questions,Indigenous Affairs,,"Mr. Speaker, as I said in my previous response, this government continues to engage with first nations and other indigenous organizations and peoples to ensure that we are developing a nation-to-nation approach. With respect to the specific matter of Site C that is before the court, I cannot comment on the specifics of it. However, there certainly are ongoing discussions that are relevant to the broader first nations and nation-to-nation relationship.",Liberal,North Vancouver,Jonathan Wilkinson,
4654636,ca.proc.d.2016-03-09.17153.90,2016-03-09,4626b9b7-420c-456d-9c7b-dea3794cb1c5,10040,"Mr. Alupa Clarke (Beauport—Limoilou, CPC)",,Oral Questions,Veterans,,"Mr. Speaker, yesterday, the Minister of Veterans Affairs indicated that he was working with the Department of Canadian Heritage to identify opportunities for advancing the construction of a memorial monument. However, we still do not know whether there will be a national monument specifically for the Afghanistan mission.
My question is for the minister. Will the budget include an envelope for the national monument announced by our Conservative government, yes or no?",Conservative,Beauport--Limoilou,Alupa Clarke,
4654637,ca.proc.d.2016-03-09.17153.91,2016-03-09,e4445566-ac85-47e6-8583-a705a8c2d0fa,9820,"Hon. Kent Hehr (Minister of Veterans Affairs and Associate Minister of National Defence, Lib.)",,Oral Questions,Veterans,,"Mr. Speaker, it is very important for us to honour the men and women who have served this country valiantly in Afghanistan. This government is aware of the motion put forward in 2014 supported by all members of the House. We are working very hard with the Minister of Canadian Heritage to see that is put through.
 However, I think it is also important for us to show care, compassion, and respect for those members through our veterans services, which we are doing right now. The member will also see that through our reopening of the nine offices that his party closed, as well our rehiring of staff that the Conservatives also let go.",Liberal,Calgary Centre,Kent Hehr,
4654638,ca.proc.d.2016-03-09.17153.92,2016-03-09,4626b9b7-420c-456d-9c7b-dea3794cb1c5,10040,"Mr. Alupa Clarke (Beauport—Limoilou, CPC)",,Oral Questions,Veterans,,"Mr. Speaker, contrary to what the minister has insinuated several times over the past four months, the previous Conservative government did more for veterans than any other Canadian government since the Pension Act of 1919 was passed. 
The Liberal government cancelled the community war memorial program. This clearly shows that this government is not interested in honouring our veterans. Properly honouring our men and women of the Canadian Armed Forces is not militarism, it is quite simply a moral imperative.
Now that the Liberals are cancelling this program, how do they intend to honour the achievements of members of the Royal Canadian Air Force who fought against ISIS?",Conservative,Beauport--Limoilou,Alupa Clarke,
4654639,ca.proc.d.2016-03-09.17153.93,2016-03-09,e4445566-ac85-47e6-8583-a705a8c2d0fa,9820,"Hon. Kent Hehr (Minister of Veterans Affairs and Associate Minister of National Defence, Lib.)",,Oral Questions,Veterans,,"Mr. Speaker, there is a saying in my neighbourhood, “You lie to your friends, I'll lie to my friends; let's not lie to each other.”
Here is the true record of what the Conservative government has done over the last 10 years. The Conservatives closed Veterans Affairs offices and cut staff by 800 people. For the last 10 years, it has really been a shame.
 We are working hard to ensure that we treat our men and women with care, compassion, and respect. I have an aggressive mandate letter from the Prime Minister that will result in more employment opportunities for veterans and support for their families. We plan on following through exactly with that. ",Liberal,Calgary Centre,Kent Hehr,
4654640,ca.proc.d.2016-03-09.17153.94,2016-03-09,3176068f-62ee-4b2f-aacd-1131201c6db1,242,The Speaker,,Oral Questions,Veterans,,"I know that the hon. minister did not accuse another member of lying. He came a little too close for my liking. I would encourage members not to use that kind of language.
The hon. member for Yorkton—Melville.",Liberal,Halifax West,Geoff Regan,http://www.parl.gc.ca/parlinfo/Files/Parliamentarian.aspx?Item=3176068f-62ee-4b2f-aacd-1131201c6db1&Language=E&Section=ALL
4654641,ca.proc.d.2016-03-09.17153.95,2016-03-09,53eb10e4-f8e7-4ef7-9448-b4a10ec1dba3,9804,"Mrs. Cathay Wagantall (Yorkton—Melville, CPC)",,Oral Questions,Veterans,,"Mr. Speaker, we learned this week that the Liberals are cancelling the community war memorial program. This program that was implemented by the Conservatives in 2010 has enabled communities and organizations across Canada to build new or to upgrade old cenotaphs and war memorials honouring the achievements and sacrifices of those who have served Canada in times of war and peace and military conflict.
The Department of Veterans Affairs acknowledges that there is a continued need for this essential program. Since they are listening, why do the Liberals think that cutting this project is a good idea?",Conservative,Yorkton--Melville,Cathay Wagantall,
4654642,ca.proc.d.2016-03-09.17153.96,2016-03-09,e4445566-ac85-47e6-8583-a705a8c2d0fa,9820,"Hon. Kent Hehr (Minister of Veterans Affairs and Associate Minister of National Defence, Lib.)",,Oral Questions,Veterans,,"Mr. Speaker, in the Department of Veterans Affairs, we understand that it is very important for us to commemorate those men and women who have served in our armed forces. We have done that as a country through Vimy Ridge, through World War II, through our Korean peacekeepers, through our role in Bosnia, and we will do so for Afghanistan. That is an important part of what we do in this department and what we do on this side of the House. We will continue to show in a meaningful way the respect that our men and women deserve who have served this great country. ",Liberal,Calgary Centre,Kent Hehr,
4654643,ca.proc.d.2016-03-09.17153.97,2016-03-09,22a6ff7d-fc39-47b2-8003-a016329ed224,9425,"Mr. Matt DeCourcey (Fredericton, Lib.)",,Oral Questions,"Immigration, Refugees and Citizenship",,"Mr. Speaker, it is important that Canada attract and retain top international students in order to remain competitive in the global economy.
In Fredericton, the University of New Brunswick, or UNB, and St. Thomas University are working hard to accomplish just that.
Can the Minister of Immigration, Refugees and Citizenship tell the House about the initiatives the government is taking to encourage top students to remain in Canada?",Liberal,Fredericton,Matt DeCourcey,
4654644,ca.proc.d.2016-03-09.17153.98,2016-03-09,826dc268-dbda-48fa-ae4a-eefebd5716e1,191,"Hon. John McCallum (Minister of Immigration, Refugees and Citizenship, Lib.)",,Oral Questions,"Immigration, Refugees and Citizenship",,"Mr. Speaker, I would like to thank my colleague from Fredericton for his excellent question.
International students are some of the best candidates for Canadian citizenship. They speak English or French, they received a good education here in Canada, and they know the country. It was therefore not very smart of the former government to do away with the 50% credit that these students received upon becoming Canadian citizens. I am very happy to say that we are going to restore that credit.",Liberal,Markham--Thornhill,John McCallum,http://www.parl.gc.ca/parlinfo/Files/Parliamentarian.aspx?Item=826dc268-dbda-48fa-ae4a-eefebd5716e1&Language=E&Section=ALL
4654645,ca.proc.d.2016-03-09.17153.99,2016-03-09,0bd5970c-e4c2-4044-8344-8123b16d75bd,594,"Hon. Peter Kent (Thornhill, CPC)",,Oral Questions,Foreign Affairs,,"Mr. Speaker, Iran today test fired two ballistic missiles that the regime said proved its ability to strike Israel. The missiles carried the words, “Israel must be wiped out”.
Former Liberal MP Irwin Cotler is on record saying, “I don't know if [the Prime Minister] has an appreciation of evil”. The Prime Minister  said this week that he thought Canada was sending exactly the right signals on Iran.
Is this not just another example of the Prime Minister's inability to appreciate evil?",Conservative,Thornhill,Peter Kent,http://www.parl.gc.ca/parlinfo/Files/Parliamentarian.aspx?Item=0bd5970c-e4c2-4044-8344-8123b16d75bd&Language=E&Section=ALL
4654646,ca.proc.d.2016-03-09.17153.100,2016-03-09,782dab6a-6e60-4132-992b-4933293f30d4,10414,"Ms. Pam Goldsmith-Jones (Parliamentary Secretary to the Minister of Foreign Affairs, Lib.)",,Oral Questions,Foreign Affairs,,"Mr. Speaker, our engagement with Iran does not mean we agree with its government. Also, to boycott Iran will not help Israel.
While we reduced some sanctions on Iran, together with our allies, related to progress in shutting down its nuclear program, we also added sanctions that targeted its ballistic missile program. Again, we did this in complete coordination with our allies.
We will continue to apply pressure on Iran to end its unacceptable missile development program, and we will continue to be strong friends with Israel. ",Liberal,West Vancouver--Sunshine Coast--Sea to Sky Country,Pam Goldsmith-Jones,
4654647,ca.proc.d.2016-03-09.17153.101,2016-03-09,3c3ee442-a873-4845-84d0-7da07a66ce61,939,"Mr. Alexandre Boulerice (Rosemont—La Petite-Patrie, NDP)",,Oral Questions,Air Transportation,,"Mr. Speaker, the aerospace industry is vital for Quebec. In the Montreal region alone, one out of every 100 jobs is associated with this industry. However, the Liberals do not seem to understand that.
During the election campaign, they did not present any plan or strategy for this sector. Nothing. What is more, we are still waiting for news on the Bombardier file. The industry is fragile right now and job losses are mounting.
When will the Liberal government wake up, support the Quebec economy and its workers, and present a real action plan for the aerospace industry?",New Democratic Party,Rosemont--La Petite-Patrie,Alexandre Boulerice,http://www.parl.gc.ca/parlinfo/Files/Parliamentarian.aspx?Item=3c3ee442-a873-4845-84d0-7da07a66ce61&Language=E&Section=ALL
4654648,ca.proc.d.2016-03-09.17153.102,2016-03-09,8908cde5-7474-4d2a-8c50-d05da5ee0712,16,"Hon. Navdeep Bains (Minister of Innovation, Science and Economic Development, Lib.)",,Oral Questions,Air Transportation,,"Mr. Speaker, our government understands and supports the aerospace sector. It is a sector that employs 180,000 people, not only in Montreal or Quebec but across Canada. It is a sector that contributes $29 billion to our GDP. That is why we take very seriously the engagement with Bombardier.
On December 11, it approached the federal government officially in writing to ask for up to $1 billion. We are doing our due diligence. We are looking at the business case. We understand the importance of not only Bombardier but this sector and we will ensure that any decision that we make will be in the best interests of Canadians and Quebeckers. ",Liberal,Mississauga--Malton,Navdeep Bains,http://www.parl.gc.ca/parlinfo/Files/Parliamentarian.aspx?Item=8908cde5-7474-4d2a-8c50-d05da5ee0712&Language=E&Section=ALL
4654649,ca.proc.d.2016-03-09.17153.103,2016-03-09,550141c4-bdc7-48ea-9e5e-6b40f5ad1bed,100,"Hon. Mark Eyking (Sydney—Victoria, Lib.)",,Oral Questions,Infrastructure,,"Mr. Speaker, the port of Sydney has long been an essential asset to the economy of Cape Breton. Studies have shown that construction of a second marine berth in the harbour will greatly enhance port traffic, especially in the cruise ship sector.
My question is for the Minister of Infrastructure. Does the minister see this project of a second berth for the port of Sydney as the type of project worthy of consideration for infrastructure?",Liberal,Sydney--Victoria,Mark Eyking,http://www.parl.gc.ca/parlinfo/Files/Parliamentarian.aspx?Item=550141c4-bdc7-48ea-9e5e-6b40f5ad1bed&Language=E&Section=ALL
4654650,ca.proc.d.2016-03-09.17153.104,2016-03-09,811a7b9a-4be5-4f9a-a302-088cb204bfba,9703,"Hon. Amarjeet Sohi (Minister of Infrastructure and Communities, Lib.)",,Oral Questions,Infrastructure,,"Mr. Speaker, I want to thank the member for Sydney—Victoria for his continued hard work regarding this project.
 We know there are significant benefits to infrastructure investment. That is why our government has committed to add $60 billion of new money into infrastructure over the next 10 years. We understand that well planned infrastructure investments in regions like Cape Breton generate economic growth, create jobs, and leave a lasting legacy for Canadians. 
I have met with my counterparts in Nova Scotia, and we will continue to work together on our shared infrastructure priorities. ",Liberal,Edmonton Mill Woods,Amarjeet Sohi,
4654651,ca.proc.d.2016-03-09.17153.105,2016-03-09,8c04baa6-daad-4fe5-8413-3973a24a2760,404,"Hon. Maxime Bernier (Beauce, CPC)",,Oral Questions,Air Transportation,,"Mr. Speaker, during the election campaign, the Liberals promised to raise the bar on transparency, but yesterday there was a dramatic turn of events.
The Liberal members of the Standing Committee on Industry, Science and Technology voted unanimously against a motion that we moved to invite Bombardier to testify before the committee. Committee members wanted to know why Bombardier needed $1.2 billion in support. 
My question today is for the chair of the Standing Committee on Industry, Science and Technology. Why is he determined to prevent Bombardier from testifying before parliamentarians?",Conservative,Beauce,Maxime Bernier,http://www.parl.gc.ca/parlinfo/Files/Parliamentarian.aspx?Item=8c04baa6-daad-4fe5-8413-3973a24a2760&Language=E&Section=ALL
4654652,ca.proc.d.2016-03-09.17153.106,2016-03-09,8908cde5-7474-4d2a-8c50-d05da5ee0712,16,"Hon. Navdeep Bains (Minister of Innovation, Science and Economic Development, Lib.)",,Oral Questions,Air Transportation,,"Mr. Speaker, as the member knows, committees are independent. The point that he has raised is an important one—",Liberal,Mississauga--Malton,Navdeep Bains,http://www.parl.gc.ca/parlinfo/Files/Parliamentarian.aspx?Item=8908cde5-7474-4d2a-8c50-d05da5ee0712&Language=E&Section=ALL
4654653,ca.proc.d.2016-03-09.17153.107,2016-03-09,,,,intervention,Oral Questions,Air Transportation,, Oh. oh!,,,Some hon. members,
4654654,ca.proc.d.2016-03-09.17153.108,2016-03-09,3176068f-62ee-4b2f-aacd-1131201c6db1,242,The Speaker,,Oral Questions,Air Transportation,,"Order, please. We have been doing so well. It has been a good a day. We cannot hear the answer. Let us settle down and listen to the answer from the hon. Minister of Economic Development.",Liberal,Halifax West,Geoff Regan,http://www.parl.gc.ca/parlinfo/Files/Parliamentarian.aspx?Item=3176068f-62ee-4b2f-aacd-1131201c6db1&Language=E&Section=ALL
4654655,ca.proc.d.2016-03-09.17153.109,2016-03-09,8908cde5-7474-4d2a-8c50-d05da5ee0712,16,Hon. Navdeep Bains,Interjection,Oral Questions,Air Transportation,,"Mr. Speaker, the point that the member has raised is an important one. He understands and appreciates that our government is open and transparent. I am glad to hear that the member understands this. The member also understands that he has an opportunity in committee to talk about these issues. 
One thing I can assure the member is that we will continue to engage with that company because we understand the importance of this sector. We understand the importance of creating jobs. We have a plan not only for the company and the sector, but we have a plan for all Canadians when it comes to growing the economy, and that will be demonstrated in our budget on March 22.",Liberal,Mississauga--Malton,Navdeep Bains,http://www.parl.gc.ca/parlinfo/Files/Parliamentarian.aspx?Item=8908cde5-7474-4d2a-8c50-d05da5ee0712&Language=E&Section=ALL
4654656,ca.proc.d.2016-03-09.17153.110,2016-03-09,eaa6694f-1e20-4aae-ad3b-e694b0e12c59,9187,"Ms. Elizabeth May (Saanich—Gulf Islands, GP)",,Oral Questions,Railway Transportation,,"Mr. Speaker, my question is for the Minister of Transport and it pertains to a critical threat to the survival of VIA Rail and our coast to coast service.
The previous minister of transportation convened a panel, chaired by former cabinet minister David Emerson, and it has now reported. Shockingly, it recommends that the Liberal government kill passenger rail service between Toronto and Vancouver. This transcontinental train, the Canadian, is an essential part of Sir John A. Macdonald's national dream.
Could the minister confirm that the government will protect VIA Rail, and restore and invest in our trans-Canada rail service?",Green Party,Saanich--Gulf Islands,Elizabeth May,http://www.parl.gc.ca/parlinfo/Files/Parliamentarian.aspx?Item=eaa6694f-1e20-4aae-ad3b-e694b0e12c59&Language=E&Section=ALL
4654657,ca.proc.d.2016-03-09.17153.111,2016-03-09,bc2e82f3-02f1-46e2-b9be-7d5f04ddddc9,572,"Hon. Marc Garneau (Minister of Transport, Lib.)",,Oral Questions,Railway Transportation,,"Mr. Speaker, it is important that other levels of government and stakeholders have an opportunity to read the CTA review report and share their perspectives on its findings before we address specific recommendations.
I have been mandated by the Prime Minister to respond to the review. I can assure Canadians that this government is committed to developing the best approach to delivering a safe, efficient, and reliable passenger rail service in Canada from coast to coast.",Liberal,Notre-Dame-de-Grâce--Westmount,Marc Garneau,http://www.parl.gc.ca/parlinfo/Files/Parliamentarian.aspx?Item=bc2e82f3-02f1-46e2-b9be-7d5f04ddddc9&Language=E&Section=ALL
4654658,ca.proc.d.2016-03-09.17153.112,2016-03-09,3176068f-62ee-4b2f-aacd-1131201c6db1,242,The Speaker,,Oral Questions,Presence in Gallery,,"I would like to draw the attention of hon. members to the presence in the gallery of the Hon. Donald Arseneault, Minister of Energy and Mines, Minister responsible for Efficiency NB, and Minister responsible for Official Languages for the province of New Brunswick.",Liberal,Halifax West,Geoff Regan,http://www.parl.gc.ca/parlinfo/Files/Parliamentarian.aspx?Item=3176068f-62ee-4b2f-aacd-1131201c6db1&Language=E&Section=ALL
4654659,ca.proc.d.2016-03-09.17153.113,2016-03-09,,,,intervention,Oral Questions,Presence in Gallery,," Hear, hear!",,,Some hon. members,
4654660,ca.proc.d.2016-03-09.17153.114,2016-03-09,27d8ca3d-1740-41b6-872b-6ceb646cdd31,243,Mr. Scott Reid,Interjection,Oral Questions,Presence in Gallery,,"Mr. Speaker, there have been widespread consultations, indeed, the widest consultations that have taken place in this Parliament. I think on a day like today, when we are all communicating together, we can all agree upon the importance of accepting a document produced by the Department of Finance Canada, the “Fiscal Monitor”, showing that we had a surplus of $2.2 billion at the end of 2015. ",Conservative,Lanark--Frontenac--Kingston,Scott Reid,http://www.parl.gc.ca/parlinfo/Files/Parliamentarian.aspx?Item=27d8ca3d-1740-41b6-872b-6ceb646cdd31&Language=E&Section=ALL
4654661,ca.proc.d.2016-03-09.17153.115,2016-03-09,3176068f-62ee-4b2f-aacd-1131201c6db1,242,The Speaker,,Oral Questions,Presence in Gallery,,Is there unanimous consent?,Liberal,Halifax West,Geoff Regan,http://www.parl.gc.ca/parlinfo/Files/Parliamentarian.aspx?Item=3176068f-62ee-4b2f-aacd-1131201c6db1&Language=E&Section=ALL
4654662,ca.proc.d.2016-03-09.17153.116,2016-03-09,,,,intervention,Oral Questions,Presence in Gallery,," Agreed.
 No.",,,Some hon. members,
4654663,ca.proc.d.2016-03-09.17153.117,2016-03-09,8c04baa6-daad-4fe5-8413-3973a24a2760,404,"Hon. Maxime Bernier (Beauce, CPC)",,Oral Questions,Points of Order,Oral Questions,"Mr. Speaker, earlier, I asked the chair of the Standing Committee on Industry, Science and Technology a question. In the House, when the person to whom a question is addressed is present, it is customary for that person to answer. I would like that person to answer my question today.",Conservative,Beauce,Maxime Bernier,http://www.parl.gc.ca/parlinfo/Files/Parliamentarian.aspx?Item=8c04baa6-daad-4fe5-8413-3973a24a2760&Language=E&Section=ALL
4654664,ca.proc.d.2016-03-09.17153.118,2016-03-09,3176068f-62ee-4b2f-aacd-1131201c6db1,242,The Speaker,,Oral Questions,Points of Order,Oral Questions,The hon. member has plenty of experience here. He knows that the government can decide who will answer questions. We must also determine whether the question itself was in order. It may not have been.,Liberal,Halifax West,Geoff Regan,http://www.parl.gc.ca/parlinfo/Files/Parliamentarian.aspx?Item=3176068f-62ee-4b2f-aacd-1131201c6db1&Language=E&Section=ALL
4654665,ca.proc.d.2016-03-09.17153.119,2016-03-09,,,,stagedirection,Government Orders,Business of Supply,Opposition Motion—Air Transportation,The House resumed from March 8 consideration of the motion.,,,,
4654666,ca.proc.d.2016-03-09.17153.120,2016-03-09,3176068f-62ee-4b2f-aacd-1131201c6db1,242,The Speaker,,Government Orders,Business of Supply,Opposition Motion—Air Transportation,"It being 3:27 p.m., pursuant to order made on Tuesday, March 8 the House will now proceed to the taking of the deferred recorded division on the motion relating to the business of supply.
Call in the members.
 And the bells having rung: ",Liberal,Halifax West,Geoff Regan,http://www.parl.gc.ca/parlinfo/Files/Parliamentarian.aspx?Item=3176068f-62ee-4b2f-aacd-1131201c6db1&Language=E&Section=ALL
4654667,ca.proc.d.2016-03-09.17153.121,2016-03-09,3176068f-62ee-4b2f-aacd-1131201c6db1,242,The Speaker,,Government Orders,Business of Supply,Opposition Motion—Air Transportation,The question is as follows. Shall I dispense?,Liberal,Halifax West,Geoff Regan,http://www.parl.gc.ca/parlinfo/Files/Parliamentarian.aspx?Item=3176068f-62ee-4b2f-aacd-1131201c6db1&Language=E&Section=ALL
4654668,ca.proc.d.2016-03-09.17153.122,2016-03-09,,,,intervention,Government Orders,Business of Supply,Opposition Motion—Air Transportation," Agreed.
 No.",,,Some hon. members,
