basepk,hid,speechdate,pid,opid,speakeroldname,speakerposition,maintopic,subtopic,subsubtopic,speechtext,speakerparty,speakerriding,speakername,speakerurl
4690043,ca.proc.d.2016-11-22.9252492,2016-11-22,d05df46d-aa51-4084-89b7-cb5f95ba0652,215908,"Mr. Sean Fraser (Central Nova, Lib.)",,Government Orders,Canada-European Union Comprehensive Economic and Trade Agreement Implementation Act,,"Mr. Speaker, I cannot tell members how excited I was when I saw that job creation in Central Nova was going to be on the docket for debate today, which is what international trade is all about.
Whether we are talking about the agrifood producers in the Musquodoboit Valley, the fisheries on the north Northumberland Strait on the eastern shore, small businesses in Antigonish, or manufacturers in Pictou county, international trade is about generating new business and ultimately creating jobs, which is my top priority as long as I hold this office. 
Before I begin, I would like to take a moment to highlight the global context within which this debate about the Canada-European Union comprehensive economic trade agreement takes place.
There is a growing trend toward what I will call inward facing politics. Quite honestly, I find this to be one of the most troubling political trends, and potentially the greatest intellectual debate that we may have in a generation next to climate change.
 What I see around the world, whether it is with Brexit or a rise of nationalism in different parts of the world, is an attitude that we do not need our neighbours to get by. When it comes to matters of immigration to security, economics or climate change, I firmly believe we are better when we work together, when we co-operate. 
It is easy to understand where this belief comes from. When we talk about billions and billions of dollars, when we frame everything in the context of GDP, I can empathize with many people at home who perhaps see these numbers and think that is not working for them. However, I could not disagree more strongly, because international trade is one of the avenues that we can pursue to help grow our economy and create jobs in my own community.
The starting point for me is that economic development is a good thing. Perhaps it is a bit obvious, but it is worth stating. It is not just because we have the opportunity to have more money in our bank accounts. With economic development, we see improved health care outcomes and better hospital care for our kids. We see improved economics and job creation in our communities so people have something meaningful to do with their career. We see better education opportunities for young people in our communities. We see more vibrant communities and ultimately a higher quality of life for Canadians. 
How do we get to economic development in Canada? 
I look at some of our assets. We have an abundance of natural resources. We have been blessed in every square inch of the country to be able to produce something. We also have an incredibly skilled workforce. We have tremendous education. We have the tools to make economic development work for our communities. 
However, one of the shortcoming we have as a country is a small population relative to the magnitude of our resources and our skilled workforce. What we have to do to turn these opportunities into jobs is start selling to customers outside of our own country. This is where international trade comes into the picture for me.
If we can open up new markets for our natural resources and the products we create with our skilled workforce, we will be able to put more people to work in our own communities. This is why I have been incredibly thrilled with the approach that the government has taken toward international trade. Indeed, after some strong advocacy by my colleagues in the Atlantic caucus on this side of the House, we have managed to secure investment and trade as a key pillar to the Atlantic growth strategy, which was announced this past summer.
With this context in mind, I would like to turn this into a more local discussion.
When I look at these small businesses in my riding, I need to look no further than MacKay Meters on Abercrombie Road in Pictou county to identify a perfect opportunity of how the Canada-European Union trade agreement is going to create jobs in my home town. This is an incredibly innovative company that makes parking metres. There is only a handful of companies that make parking metres in the global community, and these guys do it better than anybody. 
The company makes solar powered parking metres, sometimes made almost exclusively of recycled materials. It is also very close to working on a technology that can retrofit its parking metres to become electric vehicle chargers. It also holds a patent that allows it to accept major credit cards for payment for parking and potentially for charging electric vehicles.
When I look at what is going on around the world, I see the Netherlands has adopted legislation that says that after 2025, it will not be selling any more cars that use gas or diesel to move the wheels. It is going to be purchasing electric vehicles in Europe. If I want to be able to create an opportunity for a company that has a manufacturing base in my community and a research and development office in Halifax, I would look no further than this group that has powered automobiles across Europe for a generation.
It is not just one company. There are a lot of small and medium-sized businesses that generate positive economic outcomes. I can look at Velsoft, a company that creates computer training materials for tech giants like Microsoft, that will not face unfair tariffs and that will help expand its access to global markets. I can look at a company like Bionovations based in Antigonish that manufactures through its own research and development shipping containers that allow it to transport live seafood, which is our nation's second largest export, and a massive opportunity for eastern Canada.
While I am on the lobster fishery, we are already seeing incredible economic returns from a policy of engaging with the world when it comes to our seafood exports.
 In lobster fishing communities there are only a couple of things one can do to really have a bumper crop, so to speak. There could be more fish in the water, which is, for the most part, beyond the scope of government policy, or there could be a better price for the fish that we sell. Last year, it was incredible to see fishermen in my community getting $7.75 a pound, which is nearly unheard of. The best thing I can have for some of the communities that I represent, whether it is Sheet Harbour, Lismore, Sonora, is a high price on lobster. This is a terrific thing, although it might be personally inconvenient for me at times when I get hungry at home. 
This agreement will help sustain rural Canada. We are going to be saving little fishing communities along the eastern shore and the Northumberland Strait if we continue to engage with the world. The demand for Nova Scotia lobster creeps higher and higher with every conversation we have with another member of the global community.
It is not just the primary industry or the small manufacturers that are going to benefit. We have tremendous opportunity in 21st century sectors like the aerospace industry. We have Halifax international airport in my riding. The Aerotech Business Park is right there as well. Pratt &amp; Whitney Canada is currently subject to significant barriers to trade and tariffs when it comes to the EU, which is the largest importer of aerospace technology. I see an opportunity for these innovation players, like Pratt &amp; Whitney, in and around the airport. If that means there will be more aerospace engineers working in communities I have been elected to represent, I will feel as though I am doing my job fairly well.
We also have tremendous opportunities when it comes to transportation. I have two coasts in my riding, each of which is dotted with shipyards and ports. The port in Sheet Harbour would love to have open access for local markets to the European Union. It has a deepwater port that it would love to expand and take on the increased traffic that would be shipping. There would be more work for the stevedores and their community.
It is not just international trade from which we have such a great benefit. Embracing modern trade agreements like this also promote investment in our communities.
I need to look no further than the shipyard in Pictou where it manufactured turbines that went into commission just recently to generate 21st century clean power through tidal resources in Parrsboro. This is a benefit to the entire region, promoting clean energy, high skilled manufacturing jobs that we can do in Canada, and we need to be promoting them.
If we can give certainty to investors around the world so they have their international companies putting money from somewhere else into the communities that we represent in Canada, that create jobs for people in our communities, we can be very proud.
As I mentioned at the outset, my number one priority from the moment I stepped into this office was to create more jobs at home. By promoting international trade and opening up markets for Canadian businesses in the European Union, we will create opportunities for the private sector to grow and hire more people who live in Pictou county, Antigonish, the Musquodoboit Valley, the Eastern Shore, and everywhere in between. 
By standing up and speaking in support of this legislation, I will have done the job I have been elected to do and I will help businesses create work for the people who so desperately need jobs at home.",Liberal,Central Nova,Sean Fraser,http://www.parl.gc.ca/MembersOfParliament/ProfileMP.aspx?Key=215908&Language=E
4690044,ca.proc.d.2016-11-22.9252635,2016-11-22,4c0122f7-7958-4cbd-b99e-9d70a4dca1e8,217241,"Mr. Pierre-Luc Dusseault (Sherbrooke, NDP)",,Government Orders,Canada-European Union Comprehensive Economic and Trade Agreement Implementation Act,,"Mr. Speaker, I thank my colleague for his speech. 
I have a question for him about the investor state provisions and the right to have a legal system parallel to our own, domestic systems. Foreign businesses, that is to say those that are not Canadian, can take legal action against the federal government, provincial governments, even municipalities, if they are not satisfied or if their profits decline due to a regulation, law, or new rules implemented by a government in Canada.
Is my colleague concerned, as are the Europeans who are discussing this issue, about investor state provisions? The elected members of legislative assemblies adopt rules and represent the people. When a decision is made, the fact remains that foreign businesses sometimes have the last word in a legal system that operates parallel to our domestic system. In the end, businesses have every right to challenge the decisions of the elected representatives of the countries in which they operate. ",New Democratic Party,Sherbrooke,Pierre-Luc Dusseault,http://www.parl.gc.ca/MembersOfParliament/ProfileMP.aspx?Key=217241&Language=E
4690045,ca.proc.d.2016-11-22.9252656,2016-11-22,d05df46d-aa51-4084-89b7-cb5f95ba0652,215908,Mr. Sean Fraser,,Government Orders,Canada-European Union Comprehensive Economic and Trade Agreement Implementation Act,,"Mr. Speaker, that is an important question. No, I am not concerned. In fact, I have significant experience working on an international dispute resolution practice group for a major national Canadian law firm. Not primarily, but a major part of my practice did focus on investor-state dispute resolution.
The argument suggests, tacitly, that there is somehow an erosion of Canadian sovereignty when we allow a foreign investor to sue the Canadian government. It cannot be further from the truth. In fact, it is an act of sovereignty to adopt an agreement that provides rights to investors to secure investment.
However, if we want to look to a domestic example, constitutionally we cannot enter into a contract that fetters the discretion of the state. We know that well. Case after case has gone to the highest levels of court. The remedy is that if we pass a law that interferes with an investment, we have to pay the investors for the harm they have suffered. We have an option to either uphold the laws we have agreed to uphold, or change the laws and compensate the investors. To do otherwise puts a closed for business sign on our country's borders, which we cannot afford to do when the people in my community need to get back to work if they are to succeed.",Liberal,Central Nova,Sean Fraser,http://www.parl.gc.ca/MembersOfParliament/ProfileMP.aspx?Key=215908&Language=E
4690046,ca.proc.d.2016-11-22.9252688,2016-11-22,6da8653f-692f-4bbc-acb2-86e088f0d60d,219035,"Mr. Pierre Nantel (Longueuil—Saint-Hubert, NDP)",,Government Orders,Canada-European Union Comprehensive Economic and Trade Agreement Implementation Act,,"Mr. Speaker, I would like to know my colleague's position on the compromises and the addendums to the report, which were secured by the Walloon parliament. 
What does my colleague think of the amendments, especially those concerning the courts where investor state disputes will be heard?",New Democratic Party,Longueuil—Saint-Hubert,Pierre Nantel,http://www.parl.gc.ca/MembersOfParliament/ProfileMP.aspx?Key=219035&Language=E
4690047,ca.proc.d.2016-11-22.9252727,2016-11-22,d05df46d-aa51-4084-89b7-cb5f95ba0652,215908,Mr. Sean Fraser,,Government Orders,Canada-European Union Comprehensive Economic and Trade Agreement Implementation Act,,"Mr. Speaker, of course there will be a dispute resolution mechanism put in place and arbitrations between investors and the states in question. I will not deny that is part of the process.
 What we need to have, if we are to engage with the world community, is a fair and neutral place to serve as the forum of arbitration for our disputes. If we say that investors will make investments based on the current conditions that we have laid out in our laws in the form of a stability clause, it is only fair to them that they have some certainty. Without that certainty, their capital would go elsewhere.
I believe that Canada is now a party to in excess of 30 bilateral investment treaties. Of course this trade agreement would add, in effect, 28 more. We need to provide an opportunity not only for foreign investors to challenge decisions by the Canadian government, but for Canadian investors to challenge decisions by other governments as well. If we do not have this neutral place, we may find ourselves as Canadian investors trying to seek a dispute resolution forum in a country with a different legal tradition, with business practices we are unaware of, and a court that may or may not favour the host country.
In Canada, we do not have a history of expropriating the assets of foreign investors. We do have a history of adopting policy that serves our own national interest. The impact that those policies are going to have on foreign investment and international money coming into our communities is one important thing to consider, but not the only one.",Liberal,Central Nova,Sean Fraser,http://www.parl.gc.ca/MembersOfParliament/ProfileMP.aspx?Key=215908&Language=E
4690048,ca.proc.d.2016-11-22.9252758,2016-11-22,24b3616f-1e8d-4fd3-9420-0a3d7ab8b6d3,224991,"Mr. Todd Doherty (Cariboo—Prince George, CPC)",,Government Orders,Canada-European Union Comprehensive Economic and Trade Agreement Implementation Act,,"Mr. Speaker, I rise today to speak to the comprehensive economic and trade agreement between Canada and the European Union.
I have listened intently over the last few days to the debate. I think it is a healthy debate. Clearly, there are two groups here that support this agreement and are willing to move forward and create some Canadians jobs and, clearly, there are others in the House who appear to be against trade, despite their tweeting and facebooking on the iPhones and the Apple computers they have, which are products of trade. It is surprising to me that we have people here who put up every type of roadblock against trade.
I would like to start by acknowledging the hard work of our hon. colleagues on this side, the hon. members for Abbotsford, Battlefords—Lloydminster, and Prince Albert, who worked hard on this agreement under the previous government to get it to the point where it would come to fruition. I think it should be noted today that a lot of that heavy lifting was done by our Conservative government and our trade team, which did a considerable amount of work on this project in getting it to where it is today.
In light of the Canadian Football League and the Grey Cup that will be taking place this weekend, I am going to start my speech with a few football analogies, if I can. 
It was our previous minister of trade and our trade team that got us to first in goal. The present Minister of International Trade and trade team is now at fourth in inches, so to say. The heavy lifting, again, as I said, was done by us and our trade team. The hard work our trade team did got us to a goal line drive. It did an amazing job and brought us to the goal line drive and the present government has used every timeout and down to get us within inches of the goal.
Now, there is more to be done. I am not taking away from the Liberal government the work it has done to get us to this point and I am acknowledging that the present Minister of International Trade has got it to where it is today. However, I also would like to acknowledge the strong leadership of former Prime Minister Stephen Harper, who fought passionately for Canadian jobs and the Canadian industry.
Former Prime Minister Harper understood that Canada is first and foremost a trading nation. He understood that one in five jobs was dependent upon trade and that 70% of our GDP was driven by trade. When former Prime Minister Harper sat at the negotiating table, he got the job done and, surprise, surprise, not a selfie needed to be taken to get it done.
This deal was successful because of the leadership and efforts of our former Prime Minister Stephen Harper and his understanding that trade deals are what make our country competitive in an ever-increasing globalized world and that international trade agreements generate increased economic activities because diversification of our trade drives prosperity and job creation, I think it is definitely appropriate for us today to stand in the House and give kudos to our former strong trade team, former Prime Minister Stephen Harper and, as well, as I said, the present Minister of International Trade.
Our previous government signed 43 trade agreements over the course of its tenure. We made critical investments in industry, transportation, and market development. That set Canada as a leader on the international stage, which helped us weather the worst economic downturn since the 1930s. It was through former Prime Minister Harper's strong vision that Canada's trade diversified.
CETA is our country's biggest bilateral trade agreement and trade initiative since NAFTA. When it comes into force, Canada will be one of the few countries in the world to have guaranteed preferential access to the world's two largest economies, the U.S. and the EU.
Well, that was until just two weeks ago, when the Prime Minister finally decided he was going to renegotiate NAFTA—but that is a speech for another time.
Imagine, as we go down the path with TPP and CETA, that the TPP would connect Canada to a market of 800 million consumers, with a combined GDP of $29 trillion or 35% of global GDP, which combined with CETA would give Canada the opportunity to be a North American trade hub and to take advantage of something that our friends from the south are woefully, right now, kind of tossing in the wind.
We are here to talk about CETA, a deal that is good for all of Canada and, specifically, for my home province of British Columbia. CETA connects Canadian producers to 500 million consumers. It provides access to the largest economy in the world. It is a good deal for Canadian producers and a great deal for Canadian consumers. It will open trade, almost eliminating tariff lines for trade with the EU. 
Studies show that CETA would bring a 20% boost to our bilateral trade and a $12 billion increase to Canada's economy. That is the economic equivalent of adding $1,000 to the average Canadian family's income, or creating 80,000 jobs. Adding 80,000 new jobs is incredible. 
The EU is already B.C.'s fifth largest export destination and our fourth largest trading partner. British Columbia stands to benefit significantly from preferential access to the EU market. Once in force, CETA will eliminate tariffs on almost all of B.C.'s exports and provide access to new market opportunities in the EU. The provisions in CETA will help erase regulatory barriers, reinforce intellectual property rights, and ensure more transparent rules for market access. B.C. is well positioned to take competitive advantage of this new agreement.
CETA is good for our farmers. It has been said time and again by members on all sides, whether in regard to our dairy, our beef, or our pork producers, that this is something that will benefit our agricultural sector and those beef and dairy farmers who wake up every morning before the sun rises and hard at work long after the sun goes down. 
If the Liberals could only act in a similar way to the previous Conservative government and bring home a new softwood lumber agreement, everything would be amazing. Maybe we would even stand a chance of maintaining our current employment levels in our forestry industry. 
Our Conservative Party believes that Canada should strive to maximize the benefits we have as a strong trading nation. The establishment of trading relationships beyond North America is exactly what CETA accomplishes. 
Our fish and seafood exporters would also benefit from CETA, as the EU is the largest importer of fish and seafood, averaging $21 billion annually. The seafood industry has gone through many transitions and faces an uncertain future. When CETA comes into force, almost 96% of the EU tariff lines for fish and seafood will be duty free. In seven years, 100% of the products will be duty free. This is hugely important because, as I said, the EU is the world's largest importer of fish and seafood products. It comes down to a competitive advantage. Once the deal comes into force, Canada will have just that. 
I would like to turn my attention back to my province. Through the strong leadership of the Conservative government, investments were made in British Columbia ports, gateways, and structures that would allow Canadian consumers, as well as manufacturers, to take full advantage of trade deals. We invested in the Asia Pacific gateway fund. We invested in the Go Global program that allowed small and medium-sized companies the opportunity to find out, once they get a trade deal, how to take advantage of it and fully prepare themselves to enter those markets. Not only did we do that, but we invested in ports, airports, railways, and roadways, so we could get our goods to market. That is exactly what our government did. We understood.
B.C. is a strategic gateway and can take full advantage of this new agreement. As a matter of fact, in my riding alone, we have the port of Prince Rupert, one of the largest and fastest marine routes. We have the third longest runway in Canada in Prince George, which is equidistant to Europe and Asia. 
One of the things we need to talk about is what we do after we get this agreement in place. We need to look at our policies as to how we take full advantage of it. We need to develop programs for how we can invest in our markets and our small and medium-sized organizations so they can fully experience the full opportunities of this agreement.",Conservative,Cariboo—Prince George,Todd Doherty,http://www.parl.gc.ca/MembersOfParliament/ProfileMP.aspx?Key=224991&Language=E
4690049,ca.proc.d.2016-11-22.9252895,2016-11-22,02c2cb20-f27d-46a5-8e78-ab4b405bf07b,214864,The Deputy Speaker,,Government Orders,Canada-European Union Comprehensive Economic and Trade Agreement Implementation Act,,"Before we get to questions and comments for the hon. member for Cariboo—Prince George, it is my duty pursuant to Standing Order 38 to inform the House that the questions to be raised tonight at the time of adjournment are as follows: the hon. member for Nanaimo—Ladysmith, Status of Women; the hon. member for Salaberry—Suroît, the Environment; and the hon. member for Vancouver East, Immigration, Refugees and Citizenship.",Conservative,Simcoe North,Bruce Stanton,http://www.parl.gc.ca/MembersOfParliament/ProfileMP.aspx?Key=214864&Language=E
