basepk,hid,speechdate,pid,opid,speakeroldname,speakerposition,maintopic,subtopic,subsubtopic,speechtext,speakerparty,speakerriding,speakername,speakerurl
4685931,ca.proc.d.2016-10-31.9203998,2016-10-31,deea27ee-c7f2-4442-99ac-2417bbea8359,215919,"Mr. Steven MacKinnon (Gatineau, Lib.)",,Government Orders,"Budget Implementation Act, 2016, No. 2",,"Madam Speaker, I thank my hon. colleague from Edmonton-Centre for sharing his time with me.
 As always, it is an honour and a privilege to represent the citizens of Gatineau in the House. It is a great honour for any parliamentarian to represent the views and perspectives of their fellow citizens.
It is my great pleasure to add my support to Bill C-29, a second Act to implement certain provisions of the budget tabled in Parliament on March 22, 2016 and other measures.
 Last spring, our government tabled its first budget. On the whole, this is a budget that respects and keeps our election commitments. Furthermore, it is based on judicious investments to make our economy grow, to better help our middle class, and to ensure that our communities and our country continue to grow. Bill C-29 is also a follow-up to the plan of my hon. colleague the Minister of Finance, the plan for economic growth and fairness in Canada.
 This bill provides measures that will help families, provide seniors with greater flexibility, protect consumers, and improve the fairness and integrity of the tax system.
When working-class and middle-class Canadians have more money to save, invest, and grow the economy, everyone benefits. That is why, in budget 2016, the government decided to invest in the Canadian economy to set the stage for long-term growth. Canada has the lowest debt to GDP ratio of any G7 country and interest rates are at historic lows. Now is the ideal time for Canada to invest in its future success: in our young people, in our communities, and in ourselves. When we have an economy that works for the middle class, we have a country that works for everyone.
My colleagues opposite spoke of the pressure on families. We all have in our ridings families looking for more flexibility, for help making ends meet every moth, and for ways for their children to have an equal opportunity to succeed in life, go to university and take part in sports, art programs, recreational activities and so forth.
Speaking of investments, we on this side of the House put in place what is probably the most important social innovation of the past 10 or 20 years in Canada: the Canada child benefit. On July 20, families in Gatineau received their first Canada child benefit cheque, as announced in budget 2016. In the riding of Gatineau alone, the Canada child benefit is helping 10,600 families and 18,480 children.
The average monthly payment in Gatineau is around $520. That is $520 every month, tax-free, that can be used for food, skates, clothes, child care expenses, school supplies and more. That is $520 every month that goes back into the local and national economies.
On this side of the House, we are extremely proud of this social innovation, this benefit for the middle class, the parents in my community and all across Canada. It is the most important public policy in decades.
Moreover, under Bill C-29, the Canada child benefit will be fully indexed to inflation starting in 2020. This will ensure not only that this important measure will be sustainable, but also that benefits will rise every year starting in 2020.
The budget implementation act also supports our seniors by helping them to retire in more comfort and with dignity. In budget 2016, we repealed the provision in the Old Age Security Act that increased the age of eligibility for old age security and guaranteed income supplement benefits from 65 to 67, and allowance benefits from 60 to 62, over the 2023 to 2029 period. Budget 2016, also increased the guaranteed income supplement top-up benefit by up to $947 annually for the most vulnerable single seniors, starting in July 2016.
I do not know if it is the same for my colleagues, but I get asked by seniors what it means to have $80 more than expected at the end of the month. They ask me what that means for seniors on a fixed income and for their quality of life. Well, it helps them pay the rent and buy groceries, and it may even give them the means to take part in sports and other recreational activities, for example. That is very important at their age. I get comments like this a lot, as do all my colleagues in the House, I am sure.
This measure represents an investment of over $670 million per year, and will improve the financial security of about 900,000 single seniors across Canada.
That is not all. In this second budget implementation bill, we are delivering on the solemn promise we made in budget 2016 to support senior couples who face higher costs of living and are at an increased risk of poverty because they must live apart. We are all aware of cases where, unfortunately, because of health concerns or for other reasons, spouses are separated from one another because one of them has to be institutionalized.
When couples who are receiving the guaranteed income supplement and the spouse's allowance have to live apart for reasons beyond their control, each of them will receive benefits based on their individual income.
For seniors in such a situation, it will mean an average increase to household income of $3,500 per year. That is very important for our most vulnerable seniors, who will be treated more fairly and receive more help from the government through the guaranteed income supplement. These new measures enable the government to treat seniors with greater fairness and allow them to live with dignity in retirement.
Canadians deserve financial consumer protection that keeps pace with their needs. We have seen this debate all over the world in the wake of the financial crisis. Bill C-29 would amend the Bank Act in order to strengthen and modernize the financial consumer protection framework. The financial sector plays an important role in supporting economic growth. Canada's financial sector weathered the 2008 financial crisis well because it was built on solid foundations. The government is seeking to build on this strength.
Bill C-29 amends the Bank Act to consolidate and streamline provisions that apply to a bank or an authorized foreign bank in relation to the protection of customers and the public. This was another consumer protection commitment our government made in budget 2016 that will contribute to the financial security of Canadians.
The federal government is showing leadership by adopting targeted measures to better protect consumers of financial products. Regarding the tax system, our government committed to implementing an action plan to combat international tax evasion and aggressive tax avoidance.
All these measures contained in Bill C-29 or in the budget deliver on our commitment to get Canada's middle class back on its feet and make it once again a priority for the Government of Canada.",Liberal,Gatineau,Steven MacKinnon,http://www.parl.gc.ca/MembersOfParliament/ProfileMP.aspx?Key=215919&Language=E
4685932,ca.proc.d.2016-10-31.9204008,2016-10-31,aa073ec9-d887-4192-a2ff-f3acbd6709b2,217276,"Mr. Scott Duvall (Hamilton Mountain, NDP)",,Government Orders,"Budget Implementation Act, 2016, No. 2",,"Madam Speaker, during the election, the Liberals said that they would invest in Canadian infrastructure. That is on page 15 of their platform. During the last couple of weeks there have been reports suggesting the Liberals are considering selling off some of our public infrastructure, such as airports, bridges, and ports, which were not mentioned in their platform. 
Since budget 2016, the government has mused about asset recycling and flywheel for reinvestment. What do the Liberals mean by these fancy words? Is it to privatize our public infrastructure?",New Democratic Party,Hamilton Mountain,Scott Duvall,http://www.parl.gc.ca/MembersOfParliament/ProfileMP.aspx?Key=217276&Language=E
4685933,ca.proc.d.2016-10-31.9204010,2016-10-31,deea27ee-c7f2-4442-99ac-2417bbea8359,215919,Mr. Steven MacKinnon,,Government Orders,"Budget Implementation Act, 2016, No. 2",,"Madam Speaker, the commitment we made during the campaign was to double infrastructure spending to about $120 billion over 10 years, compared to the $65 billion mentioned or promised by the previous government. That is what we are going to do.
In communities from coast to coast to coast, including in Gatineau, we are starting to feel the effects of our basic infrastructure spending in social housing, recreational infrastructure, and so on.
Our platform also included the possibility of increasing our infrastructure spending through an infrastructure bank or some other alternative funding mechanism. The goal was to offer Canadiens other ways to fund strategic infrastructure in order to increase exports, create jobs, and boost trade.
I hope we will continue this debate.",Liberal,Gatineau,Steven MacKinnon,http://www.parl.gc.ca/MembersOfParliament/ProfileMP.aspx?Key=215919&Language=E
4685934,ca.proc.d.2016-10-31.9204012,2016-10-31,c049fb93-b7d8-4021-8fc6-cf1c69f7200b,220002,"Mr. François-Philippe Champagne (Parliamentary Secretary to the Minister of Finance, Lib.)",,Government Orders,"Budget Implementation Act, 2016, No. 2",,"Madam Speaker, I congratulate my colleague on an excellent speech. He reminded the House about all of the promises the Liberal government made and has kept, promises relating to youth, seniors, the middle class, and economic growth.
Can my hon. colleague talk about the impact those promises have had on youth, seniors, growth, the middle class, and job creation in his riding? I am sure he can share many examples from his riding because the Liberal plan is all about growth.",Liberal,Saint-Maurice—Champlain,François-Philippe Champagne,http://www.parl.gc.ca/MembersOfParliament/ProfileMP.aspx?Key=220002&Language=E
4685935,ca.proc.d.2016-10-31.9204016,2016-10-31,deea27ee-c7f2-4442-99ac-2417bbea8359,215919,Mr. Steven MacKinnon,,Government Orders,"Budget Implementation Act, 2016, No. 2",,"Madam Speaker, I thank my colleague from Saint-Maurice—Champlain.
Gatineau is a very dynamic city. It is constantly growing, and its population is younger than average. Its needs reflect that. The fact is that we have a growing need for basic infrastructure, such as roads, water and sewage, and waste water treatment.
The infrastructure investments our government will be making in partnership with the Government of Quebec and our municipal partners will enable us to meet the needs of a steadily growing community like Gatineau.
As a demographically young community, Gatineau has families and middle-class families with young children, all of whom benefit greatly from the Canada child benefit. For example, hockey and gymnastics clubs and our cultural associations will thrive because children will have more opportunities to participate in various activities. With an extra $520 or so per month tax free, parents will be able to invest in their children. This measure will help them make ends meet.",Liberal,Gatineau,Steven MacKinnon,http://www.parl.gc.ca/MembersOfParliament/ProfileMP.aspx?Key=215919&Language=E
4685936,ca.proc.d.2016-10-31.9204019,2016-10-31,fa2cbab8-f429-402f-b603-ea918add87c3,218471,"Mr. Kevin Waugh (Saskatoon—Grasswood, CPC)",,Government Orders,"Budget Implementation Act, 2016, No. 2",,"Madam Speaker, I am pleased to share my time this afternoon with the member for Richmond—Arthabaska.
It gives me great pleasure to speak to bill C-29, the budget implementation act. Seven months after tabling the budget, Canadians are beginning to recognize the consequences, and the picture is not pretty. Being as it is Halloween, it is appropriate that we refer to the budget as downright scary. It is like a vampire sucking the blood out of most Canadians. The Liberals love spinning the budget into a huge spiderweb to catch people. Small businesses are upset, thinking it is Frankenstein who has come back from the dead. 
Even with the low Canadian dollar, the Liberals have generated 20,000 fewer manufacturing jobs in our country. I thought for a moment it was Houdini, because these jobs just vanished. My province of Saskatchewan has lost 4,000 jobs in August over the same period from last year. The trend continued in September with 6,000 fewer people working during the same period as the year before. We have 42,000 unemployed in Saskatchewan currently.
 Doug Elliott, the publisher of Sask Trends Monitor, says that going back to 1986 this is the highest number of unemployment in the month of August. Saskatchewan could very well see its first year of negative job growth since the year 2001, and that is scary. We have not seen unemployment levels like this in over two decades. Small business owners do not want the trick or treat, they want an opportunity. They know how best to grow the economy. The Liberals promised a reduction in their tax from 11% to 9%, and we have yet to see that.
Then we have Dracula with his fangs out ready to suck more out of the economy with the proposed carbon tax. This dark cloud hanging over this haunted house will not help with job creation in our country. It is hard to suck blood out of a stone, but the Liberal government seems determined to try. The carbon tax was never mentioned a year ago during the election, and now we know it always was behind one of its trap doors.
To quote Marilyn Braun-Pollon of the Canadian Federation of Independent Business, the state of business health in our country has deteriorated. Hiring plans remain very weak, with only 10% of business owners looking to hire full time, while at the same time 17% are foreseeing layoffs. This is deeply concerning as we head into the holiday season where generally more opportunity exists, mainly though for part-time employment. Retail spending is effectively flat in our province this year, a broad category that includes everything from automobiles, to clothing, to furniture and food. When we adjust for inflation, that means the total sales volumes in the province have declined by more than 2% over last year at this time.
Even thefinance minister was quoted as saying that Canadians should get used to the so-called job churn. No wonder our youth were upset last week at the Prime Minister during a briefing. Our youth right now are experiencing record unemployment, and it is not what was promised to these millennials by the Liberals a year ago. It was all about sunny ways. Now we find out the clouds have rolled in and the government has no answers.
The full moon though has returned. The Liberals have gone back to their old ways of pay to play. Have they not heard from their previous skeletons in the closet? There are more ghosts and goblins as the Bank of Canada has determined more bad news for this economy, downgrading the country's growth outlook yet once again.
Ted Mallett, who is the CFIB's chief economist, says that employment is a big area of concern. While employment plans tend to experience, as we all know, seasonal fluctuation, this October's downward turn was sharper than we have ever seen it in the past. Investment plans have also dropped to a post-recession low.
Nearly 50% of Saskatchewan's small businesses plan to freeze or even cut salaries. We have not factored in the cost of a CPP increase or the much talked about carbon tax. This is more evidence that now is not the time for this carbon tax. I guess it is like CETA. The Liberals played a disappearing act and now they want to be Casper the Friendly Ghost, but I want to remind the House that it was the Conservative government that did all of the heavy lifting for this CETA agreement. 
While the Liberals promised a modest deficit of $10 billion to stimulate the economy, it looks like they were dead wrong. They continue to throw more deficit dollars at this problem. Let us remember that a year ago, the Liberals promised they could simply spend their way into prosperity. By most measures, I would say Canadian families are worse off than they were a year ago. Good jobs are in short supply and the vast majority of these new jobs created under the current government are really part time, which explains why weekly earnings for the average worker in this country are lower.
On the weekend, I was home in my riding of Saskatoon—Grasswood and had an opportunity to talk to several young people. Many said they had two and three part-time jobs just to make ends meet. Saskatchewan people, as many know, have always had a work ethic, but there comes a time when they see no light at the end of the tunnel. 
Instead of growing the middle class, the government is breaking the middle class. Just last week, the Parliamentary Budget Officer confirmed that our Conservative budget would have resulted in a $2.9 billion surplus for the year 2015-16, but we all know that a surplus is not in the Liberals' vocabulary. They continue to run massive debts. Where it will stop, no one knows. When will this circus stop?
The child care benefit will not be indexed until the year 2020. The PBO has estimated that indexing, in fact enriching, the CCB would cost over $42 million over the next five years. Where, then, will the Liberals get this money? This program would cost more than double the original amount budgeted if indexed over this five-year period.
The current government reminds me of the show a way back called The Munsters. It was televised back then in black and white. I ask the current government to step out of the dark ages and realize it is spending our children's and grandchildren's money, with no hope of ever balancing the budget.",Conservative,Saskatoon—Grasswood,Kevin Waugh,http://www.parl.gc.ca/MembersOfParliament/ProfileMP.aspx?Key=218471&Language=E
4685937,ca.proc.d.2016-10-31.9204050,2016-10-31,cedf1659-ebb1-4f26-b723-5c7c5353988b,214948,The Assistant Deputy Speaker (Mrs. Carol Hughes),,Government Orders,"Budget Implementation Act, 2016, No. 2",,"I would remind the member to address his comments to the Chair and not the government.
Questions and comments, the hon. Parliamentary Secretary to the Minister of Finance.",New Democratic Party,Algoma—Manitoulin—Kapuskasing,Carol Hughes,http://www.parl.gc.ca/MembersOfParliament/ProfileMP.aspx?Key=214948&Language=E
4685938,ca.proc.d.2016-10-31.9204052,2016-10-31,c049fb93-b7d8-4021-8fc6-cf1c69f7200b,220002,"Mr. François-Philippe Champagne (Parliamentary Secretary to the Minister of Finance, Lib.)",,Government Orders,"Budget Implementation Act, 2016, No. 2",,"Madam Speaker, for all of those watching and listening to us, what is really scary is that the Conservatives just do not get it. They voted against the middle-class tax cut, they do not believe in climate change, they do not believe in investing in Canadians, and they do not believe in a plan for growth. That is really scary. That is why people watching should be scared of members who voted against the tax cut for the middle class.
Our plan to invest in growth in this country, in Canadian families, in innovation, and in infrastructure was not only applauded by Canadians, it was applauded around the world. The IMF managing director said that she wished Canada's plan would go viral around the world. The front page of The Economist this week said that Canada is an example to the world. 
My question is simple. Why did the member, for whom I have enormous respect, vote against the middle-class tax cut for Canadians in this country?",Liberal,Saint-Maurice—Champlain,François-Philippe Champagne,http://www.parl.gc.ca/MembersOfParliament/ProfileMP.aspx?Key=220002&Language=E
4685939,ca.proc.d.2016-10-31.9204063,2016-10-31,fa2cbab8-f429-402f-b603-ea918add87c3,218471,Mr. Kevin Waugh,,Government Orders,"Budget Implementation Act, 2016, No. 2",,"Madam Speaker, it is interesting that Liberals talk about nine out of every 10 Canadians benefiting. However, I should mention, because I am a former sportscaster in my city, that they eliminated the sports tax rebate and arts tax rebate. The middle class was what the previous government believed in. Families cherished those two programs, in particular. It provided a chance for kids to get off the couch and participate. Those are two programs that sorely need to be reinstated in this country right now.",Conservative,Saskatoon—Grasswood,Kevin Waugh,http://www.parl.gc.ca/MembersOfParliament/ProfileMP.aspx?Key=218471&Language=E
4685940,ca.proc.d.2016-10-31.9204066,2016-10-31,6e88c64b-66df-4989-84da-2a037744909c,216991,"Mr. Jamie Schmale (Haliburton—Kawartha Lakes—Brock, CPC)",,Government Orders,"Budget Implementation Act, 2016, No. 2",,"Madam Speaker, I appreciate my colleague's words. They were very haunting. Some of the statistics he mentioned were bone-chilling. It is quite spooky when we look at the horizon. 
I am from Ontario and the member is from Saskatchewan. We see that the same staffers from Queen's Park who ran the McGuinty-Wynne Liberals have moved all the way up to Ottawa. We paid their expenses. They are welcome. When we look at their 12 years of massive Liberal spending, we see more taxes, more government red tape, and more jobs leaving. He listed a bunch of statistics about how his province is hurting, too. Maybe he could tell us how and why this type of thinking does not work.",Conservative,Haliburton—Kawartha Lakes—Brock,Jamie Schmale,http://www.parl.gc.ca/MembersOfParliament/ProfileMP.aspx?Key=216991&Language=E
4685941,ca.proc.d.2016-10-31.9204069,2016-10-31,fa2cbab8-f429-402f-b603-ea918add87c3,218471,Mr. Kevin Waugh,,Government Orders,"Budget Implementation Act, 2016, No. 2",,"Madam Speaker, yes, our province was the driving engine of this country for years, and now we are not. We are hurting, along with Alberta and Newfoundland and Labrador. We have seen commodity prices go down, but at the same time, the government wants to impose a carbon tax. Would our previous government in 2008 have imposed a tax against the auto manufacturers of Ontario? No, we did the right thing back then. We propped them up, because we knew the economy of Ontario was in serious trouble back in 2008 and 2009. 
Here we are with a government that wants to impose a carbon tax against our province and the rest of Canada at a time when Canadians, and my province of Saskatchewan, simply cannot afford it. ",Conservative,Saskatoon—Grasswood,Kevin Waugh,http://www.parl.gc.ca/MembersOfParliament/ProfileMP.aspx?Key=218471&Language=E
4685942,ca.proc.d.2016-10-31.9204078,2016-10-31,ab30a165-2ce2-4465-af10-19ae0fc1aec0,217227,"Ms. Sheri Benson (Saskatoon West, NDP)",,Government Orders,"Budget Implementation Act, 2016, No. 2",,"Madam Speaker, we are trying to address an ever-increasing child poverty rate. The last 10 years of the previous government saw this rate increase. I wonder if the member could comment on why today we find a poverty rate for children of over 11%.",New Democratic Party,Saskatoon West,Sheri Benson,http://www.parl.gc.ca/MembersOfParliament/ProfileMP.aspx?Key=217227&Language=E
4685943,ca.proc.d.2016-10-31.9204083,2016-10-31,fa2cbab8-f429-402f-b603-ea918add87c3,218471,Mr. Kevin Waugh,,Government Orders,"Budget Implementation Act, 2016, No. 2",,"Madam Speaker, I want to thank my colleague from Saskatoon West. In her former job as director of United Way in our city, she did a lot of work helping our community for years and years. 
She knows, as well as everyone in our city, that we have a poverty issue with children in our city and in our province right now. The food banks are used more than ever before. However, with a strong economy we can hope that this poverty issue can get dealt with in our province.",Conservative,Saskatoon—Grasswood,Kevin Waugh,http://www.parl.gc.ca/MembersOfParliament/ProfileMP.aspx?Key=218471&Language=E
