basepk,hid,speechdate,pid,opid,speakeroldname,speakerposition,maintopic,subtopic,subsubtopic,speechtext,speakerparty,speakerriding,speakername,speakerurl
4624125,ca.proc.d.2015-01-26.16574.65,2015-01-26,551183c2-2f3e-41ba-8660-2d194cf60169,546,"Hon. Thomas Mulcair (Leader of the Opposition, NDP)",,Oral Questions,National Defence,,"Mr. Speaker, of course they have to defend themselves, but the real question is why the government put them in harm's way after promising Canadians they would not be at the front. That is the real question.
We learned more today. We learned that our forces have been caught up in even more firefights. How many gun battles, how many air strikes, how many targets painted by our troops on the ground before the Prime Minister or this minister finally admits that our troops are indeed in a combat mission? Stop playing with words. Our troops deserve better.",New Democratic Party,Outremont,Thomas Mulcair,http://www.parl.gc.ca/parlinfo/Files/Parliamentarian.aspx?Item=551183c2-2f3e-41ba-8660-2d194cf60169&Language=E&Section=ALL
4624126,ca.proc.d.2015-01-26.16574.66,2015-01-26,b42374fa-e181-4337-93e9-2a5c41eb5d1e,212,"Hon. Rob Nicholson (Minister of National Defence, CPC)",,Oral Questions,National Defence,,"Mr. Speaker, we have been very clear throughout that we are there to assist the Iraqis in their fight against this terrorist organization and we are there in support of our air fighters who are operating out of Kuwait. I know the NDP has some problems with this, but I believe most Canadians are 100% with us behind our Canadian Armed Forces when they stand up against terrorism and take the fight to them.",Conservative,Niagara Falls,Rob Nicholson,http://www.parl.gc.ca/parlinfo/Files/Parliamentarian.aspx?Item=b42374fa-e181-4337-93e9-2a5c41eb5d1e&Language=E&Section=ALL
4624127,ca.proc.d.2015-01-26.16574.67,2015-01-26,551183c2-2f3e-41ba-8660-2d194cf60169,546,"Hon. Thomas Mulcair (Leader of the Opposition, NDP)",,Oral Questions,The Budget,,"Mr. Speaker, the Bank of Canada lowered its prime rate to less than 1%, the lowest rate since the financial crisis.
The bank seems to fully understand the economic risks and the potential impact on the middle class. Analysts and economists are sounding the alarm. We have been sounding the alarm for quite some time, but the Conservatives' only response has been to panic and delay the budget in the hope that things will work themselves out. Crossing one's fingers is not a good economic plan.
Where is the budget?",New Democratic Party,Outremont,Thomas Mulcair,http://www.parl.gc.ca/parlinfo/Files/Parliamentarian.aspx?Item=551183c2-2f3e-41ba-8660-2d194cf60169&Language=E&Section=ALL
4624128,ca.proc.d.2015-01-26.16574.68,2015-01-26,552d6797-c806-48a1-82de-d6c410a8b518,998,"Hon. Joe Oliver (Minister of Finance, CPC)",,Oral Questions,The Budget,,"Mr. Speaker, our growth rate is higher than that of most G7 countries.
The Bank of Canada itself has said that our economic growth will be superior to 2%. The IMF actually was more optimistic: it said 2.3%. We will honour our commitments to the provinces to increase our transfer payments, we will honour our promises to four million Canadian families, we will honour our promises to 780,000 small businesses, and we will balance our budget. ",Conservative,Eglinton--Lawrence,Joe Oliver,http://www.parl.gc.ca/parlinfo/Files/Parliamentarian.aspx?Item=552d6797-c806-48a1-82de-d6c410a8b518&Language=E&Section=ALL
4624129,ca.proc.d.2015-01-26.16574.69,2015-01-26,551183c2-2f3e-41ba-8660-2d194cf60169,546,"Hon. Thomas Mulcair (Leader of the Opposition, NDP)",,Oral Questions,The Budget,,"Mr. Speaker, for nine years the Prime Minister has put all of our economic eggs in the resource extraction basket, leaving our economy at the mercy of falling oil prices. The Prime Minister has dithered as hundreds of thousands of well-paid manufacturing jobs have disappeared. Now, with a string of bankruptcies across the retail industry, he is watching tens of thousands of those jobs disappear as well.
Where is the Prime Minister's plan? When will he start creating the next generation of middle-class jobs? Where is the budget?
The minister said one thing and its opposite day after day last week. He—",New Democratic Party,Outremont,Thomas Mulcair,http://www.parl.gc.ca/parlinfo/Files/Parliamentarian.aspx?Item=551183c2-2f3e-41ba-8660-2d194cf60169&Language=E&Section=ALL
4624130,ca.proc.d.2015-01-26.16574.70,2015-01-26,6519cfba-0080-419d-baa9-8ae6e56d032f,256,The Speaker,,Oral Questions,The Budget,,The hon. Minister of Finance.,Conservative,Regina--Qu'Appelle,Andrew Scheer,http://www.parl.gc.ca/parlinfo/Files/Parliamentarian.aspx?Item=6519cfba-0080-419d-baa9-8ae6e56d032f&Language=E&Section=ALL
4624131,ca.proc.d.2015-01-26.16574.71,2015-01-26,552d6797-c806-48a1-82de-d6c410a8b518,998,"Hon. Joe Oliver (Minister of Finance, CPC)",,Oral Questions,The Budget,,"Mr. Speaker, Canadians understand that we have a highly diversified economy. The manufacturing sector is something that we are proud of and that will continue to be an important contributor to the Canadian economy. It will be advantaged now by several things: the decline in energy prices and the fact that more growth will come to the global economy, particularly the U.S. economy.
We have a plan. The plan has created 1.2 million net new jobs. We have reduced taxes for Canadians. The last thing that Canada needs now is a high-tax plan, a bureaucratic plan, which will drive us—",Conservative,Eglinton--Lawrence,Joe Oliver,http://www.parl.gc.ca/parlinfo/Files/Parliamentarian.aspx?Item=552d6797-c806-48a1-82de-d6c410a8b518&Language=E&Section=ALL
4624132,ca.proc.d.2015-01-26.16574.72,2015-01-26,6519cfba-0080-419d-baa9-8ae6e56d032f,256,The Speaker,,Oral Questions,The Budget,,The hon. member for Papineau.,Conservative,Regina--Qu'Appelle,Andrew Scheer,http://www.parl.gc.ca/parlinfo/Files/Parliamentarian.aspx?Item=6519cfba-0080-419d-baa9-8ae6e56d032f&Language=E&Section=ALL
4624133,ca.proc.d.2015-01-26.16574.73,2015-01-26,b8c04eca-f237-48a8-8975-374ccd40d1a9,567,"Mr. Justin Trudeau (Papineau, Lib.)",,Oral Questions,The Economy,,"Mr. Speaker, instead of a plan to strengthen Canada's middle class, the Conservatives responded to the drop in oil prices with confusion, delays, and secrecy. In the fall the minister tabled an update rejecting $81 per barrel for oil. Today oil is closer to $45. Exactly how much has that difference cost the government so far?",Liberal,Papineau,Justin Trudeau,http://www.parl.gc.ca/parlinfo/Files/Parliamentarian.aspx?Item=b8c04eca-f237-48a8-8975-374ccd40d1a9&Language=E&Section=ALL
4624134,ca.proc.d.2015-01-26.16574.74,2015-01-26,552d6797-c806-48a1-82de-d6c410a8b518,998,"Hon. Joe Oliver (Minister of Finance, CPC)",,Oral Questions,The Economy,,"Mr. Speaker, when I presented the economic and fiscal action plan, we based our results, our bottom line, on the price then. We made an adjustment of $2.5 billion, and when we present our budget we will take into account the 15 private sector economists, as we always do, and will base our projections on their projections. 
What we are saying to Canadians is that they should be reassured that we have a strong economy. We will balance the budget and we will honour our commitments.",Conservative,Eglinton--Lawrence,Joe Oliver,http://www.parl.gc.ca/parlinfo/Files/Parliamentarian.aspx?Item=552d6797-c806-48a1-82de-d6c410a8b518&Language=E&Section=ALL
4624135,ca.proc.d.2015-01-26.16574.75,2015-01-26,b8c04eca-f237-48a8-8975-374ccd40d1a9,567,"Mr. Justin Trudeau (Papineau, Lib.)",,Oral Questions,The Economy,,"Mr. Speaker, the minister's officials have given him the answer to my question. He is choosing not to share that with Canadians.
The Minister of Employment and Social Development said that the government would refrain from using the contingency reserve. The Minister of Finance said the opposite, that the reserve might be used. All this ad libbing by the government is bad for Canada's economy.
Which of these two ministers, who head major departments, is right?",Liberal,Papineau,Justin Trudeau,http://www.parl.gc.ca/parlinfo/Files/Parliamentarian.aspx?Item=b8c04eca-f237-48a8-8975-374ccd40d1a9&Language=E&Section=ALL
4624136,ca.proc.d.2015-01-26.16574.76,2015-01-26,552d6797-c806-48a1-82de-d6c410a8b518,998,"Hon. Joe Oliver (Minister of Finance, CPC)",,Oral Questions,The Economy,,"Mr. Speaker, there is no difference in our economic forecast. We base it on private sector economists, all 15 of them. We take the average, and that is what we base our projections on.
Last week the leader of the Liberal Party told the hundreds of thousands of people working in the manufacturing sector that they should find another job. He has turned his back on manufacturing just at the moment that the manufacturing sector is emerging from the recession. It is the worst possible message to send to—",Conservative,Eglinton--Lawrence,Joe Oliver,http://www.parl.gc.ca/parlinfo/Files/Parliamentarian.aspx?Item=552d6797-c806-48a1-82de-d6c410a8b518&Language=E&Section=ALL
4624137,ca.proc.d.2015-01-26.16574.77,2015-01-26,6519cfba-0080-419d-baa9-8ae6e56d032f,256,The Speaker,,Oral Questions,The Economy,,The hon. member for Papineau.,Conservative,Regina--Qu'Appelle,Andrew Scheer,http://www.parl.gc.ca/parlinfo/Files/Parliamentarian.aspx?Item=6519cfba-0080-419d-baa9-8ae6e56d032f&Language=E&Section=ALL
4624138,ca.proc.d.2015-01-26.16574.78,2015-01-26,b8c04eca-f237-48a8-8975-374ccd40d1a9,567,"Mr. Justin Trudeau (Papineau, Lib.)",,Oral Questions,National Defence,,"Mr. Speaker, all Canadians support the right of our forces to defend themselves when they are sent into harm's way. The government said our ground forces would advise and assist, but not accompany, Iraqi troops. Now we find out they are routinely on the front lines. Why did the government mislead Canadians?",Liberal,Papineau,Justin Trudeau,http://www.parl.gc.ca/parlinfo/Files/Parliamentarian.aspx?Item=b8c04eca-f237-48a8-8975-374ccd40d1a9&Language=E&Section=ALL
4624139,ca.proc.d.2015-01-26.16574.79,2015-01-26,b42374fa-e181-4337-93e9-2a5c41eb5d1e,212,"Hon. Rob Nicholson (Minister of National Defence, CPC)",,Oral Questions,National Defence,,"Mr. Speaker, I am not sure we could train troops without accompanying them. We have been very clear that we would be in the business of assisting and training these individuals.
What I do not get is the Liberal position on this, which is that we should know the outcome before we get in there and expect others to do the heavy lifting. That has never been the Canadian way for 200 years. We do not stand on the sidelines; we get out there and stand up for those who are oppressed.",Conservative,Niagara Falls,Rob Nicholson,http://www.parl.gc.ca/parlinfo/Files/Parliamentarian.aspx?Item=b42374fa-e181-4337-93e9-2a5c41eb5d1e&Language=E&Section=ALL
4624140,ca.proc.d.2015-01-26.16574.80,2015-01-26,37174f12-1dc0-44f0-8065-4c09cf9ebca1,557,"Ms. Megan Leslie (Halifax, NDP)",,Oral Questions,The Economy,,"Mr. Speaker, the Conservatives can bury their heads in the sand, but they cannot hide from the fact that they have done such damage to our economy.
There have been 375,000 manufacturing jobs lost since 2006. There is a 13% youth unemployment rate. Family incomes are shrinking, and household debts have skyrocketed to 163% of disposable income.
Canadian families need help now, so why are the Conservatives making corporate giveaways a priority?",New Democratic Party,Halifax,Megan Leslie,http://www.parl.gc.ca/parlinfo/Files/Parliamentarian.aspx?Item=37174f12-1dc0-44f0-8065-4c09cf9ebca1&Language=E&Section=ALL
4624141,ca.proc.d.2015-01-26.16574.81,2015-01-26,552d6797-c806-48a1-82de-d6c410a8b518,998,"Hon. Joe Oliver (Minister of Finance, CPC)",,Oral Questions,The Economy,,"Mr. Speaker, I am proud that our government has presented a benefit plan for four million Canadian families, every one of them, a plan whereby two-thirds of the benefits will go to low- and middle-income families, with 25% going to families earning less than $30,000 a year. We are also providing a tax benefit for 780,000 small businesses, 90% of all businesses.
We are doing what is right for Canadians. What the NDP proposes would create deficits. It would cancel the tax plan and go back to the old days of high spending and high debt.",Conservative,Eglinton--Lawrence,Joe Oliver,http://www.parl.gc.ca/parlinfo/Files/Parliamentarian.aspx?Item=552d6797-c806-48a1-82de-d6c410a8b518&Language=E&Section=ALL
4624142,ca.proc.d.2015-01-26.16574.82,2015-01-26,37174f12-1dc0-44f0-8065-4c09cf9ebca1,557,"Ms. Megan Leslie (Halifax, NDP)",,Oral Questions,The Economy,,"Mr. Speaker, the Conservatives remain in denial, but job losses are mounting and the inequality gap between the privileged few and the middle class keeps on growing.
It is time to make the economy work for all Canadians. Instead, the government is taking billions away from hard-working families and giving it away to the wealthy few who do not need it.
Will the Conservatives finally admit their backward economic policies are failing the middle class?",New Democratic Party,Halifax,Megan Leslie,http://www.parl.gc.ca/parlinfo/Files/Parliamentarian.aspx?Item=37174f12-1dc0-44f0-8065-4c09cf9ebca1&Language=E&Section=ALL
4624143,ca.proc.d.2015-01-26.16574.83,2015-01-26,552d6797-c806-48a1-82de-d6c410a8b518,998,"Hon. Joe Oliver (Minister of Finance, CPC)",,Oral Questions,The Economy,,"Mr. Speaker, the member opposite does not seem to listen to the answers. I said that two-thirds of the benefits will be going to low- and middle-income Canadians.
There has been a 45% increase in the net worth of Canadians since we took office, a 10% increase in real income, and 14% for lower-income Canadians. We have created 1.2 million new jobs and we are continuing to grow at a superior rate to that of developed countries.
We have a lot to be proud of.",Conservative,Eglinton--Lawrence,Joe Oliver,http://www.parl.gc.ca/parlinfo/Files/Parliamentarian.aspx?Item=552d6797-c806-48a1-82de-d6c410a8b518&Language=E&Section=ALL
4624144,ca.proc.d.2015-01-26.16574.84,2015-01-26,000a129f-5449-40ed-94d2-7e21a262b0b1,8528,"Ms. Nycole Turmel (Hull—Aylmer, NDP)",,Oral Questions,Employment,,"Mr. Speaker, the Minister of Finance has postponed his budget. He claims he needs time to see where the economy is headed.
The Minister of Employment, however, is ready to get out the axe. He is suggesting that there will be another round of cuts in public services. He seems more keen to impose his ideological agenda than to take measures to stimulate the economy and job-creating businesses. 
When will the government show some economic leadership and address the needs of the middle class?",New Democratic Party,Hull--Aylmer,Nycole Turmel,http://www.parl.gc.ca/parlinfo/Files/Parliamentarian.aspx?Item=000a129f-5449-40ed-94d2-7e21a262b0b1&Language=E&Section=ALL
4624145,ca.proc.d.2015-01-26.16574.85,2015-01-26,106c623c-3606-40ae-a2f6-f4a619cf02f6,152,"Hon. Jason Kenney (Minister of Employment and Social Development and Minister for Multiculturalism, CPC)",,Oral Questions,Employment,,"Mr. Speaker, as the Minister of Finance just said, 1.2 million jobs have been created since the global recession and we continue to make significant investments in labour market training.
For example, we just launched the Canada apprentice loan, which will increase the number of young Canadians who apprentice in specialized trades and end up in very good jobs. 
We will keep making these investments and reduce the tax burden on Canadians in order to create jobs.",Conservative,Calgary Southeast,Jason Kenney,http://www.parl.gc.ca/parlinfo/Files/Parliamentarian.aspx?Item=106c623c-3606-40ae-a2f6-f4a619cf02f6&Language=E&Section=ALL
4624146,ca.proc.d.2015-01-26.16574.86,2015-01-26,000a129f-5449-40ed-94d2-7e21a262b0b1,8528,"Ms. Nycole Turmel (Hull—Aylmer, NDP)",,Oral Questions,Employment,,"Mr. Speaker, the Conservatives' deplorable management is hurting the Canadian economy.
Thousands of jobs have been lost since the beginning of the year. In the past three weeks, Target, Suncor, Sony, Bombardier, Mexx and Groupe Épicia have announced major layoffs. Job losses and bankruptcies are mounting, and the government is just watching from the sidelines.
Why is the government refusing to show economic leadership? Why has it abandoned the middle class?",New Democratic Party,Hull--Aylmer,Nycole Turmel,http://www.parl.gc.ca/parlinfo/Files/Parliamentarian.aspx?Item=000a129f-5449-40ed-94d2-7e21a262b0b1&Language=E&Section=ALL
4624147,ca.proc.d.2015-01-26.16574.87,2015-01-26,106c623c-3606-40ae-a2f6-f4a619cf02f6,152,"Hon. Jason Kenney (Minister of Employment and Social Development and Minister for Multiculturalism, CPC)",,Oral Questions,Employment,,"Mr. Speaker, the hon. member is absolutely wrong.
Our government has made job creation its top priority. That is why 1.2 million jobs have been created since the global recession.
In addition, as I just said, we have cut taxes and employment insurance benefits to help small businesses create new jobs, created new loans for apprentices and put forward a number of initiatives to support training. Thanks to these measures, we will continue to create new jobs.",Conservative,Calgary Southeast,Jason Kenney,http://www.parl.gc.ca/parlinfo/Files/Parliamentarian.aspx?Item=106c623c-3606-40ae-a2f6-f4a619cf02f6&Language=E&Section=ALL
4624148,ca.proc.d.2015-01-26.16574.88,2015-01-26,a71a1741-7ff2-4246-b0da-4622e96b10cf,1082,"Mr. Guy Caron (Rimouski-Neigette—Témiscouata—Les Basques, NDP)",,Oral Questions,The Economy,,"Mr. Speaker, the government is standing idly by while Canada loses thousands of jobs and slides into economic uncertainty. It is stubbornly refusing to face reality.
During the 2008 election campaign, on the eve of a major economic crisis, the Conservatives told us that there was no problem and that everything was under control. The opposition parties had to unite to force the government to react.
Rather than dragging his feet and refusing to face the facts, why does the Minister of Finance not show some leadership and help our businesses so that they can create jobs?",New Democratic Party,Rimouski-Neigette--Témiscouata--Les Basques,Guy Caron,http://www.parl.gc.ca/parlinfo/Files/Parliamentarian.aspx?Item=a71a1741-7ff2-4246-b0da-4622e96b10cf&Language=E&Section=ALL
4624149,ca.proc.d.2015-01-26.16574.89,2015-01-26,552d6797-c806-48a1-82de-d6c410a8b518,998,"Hon. Joe Oliver (Minister of Finance, CPC)",,Oral Questions,The Economy,,"Mr. Speaker, the government is focusing on what is important to Canadians: jobs and economic growth.
Over 1.2 million net new jobs have been created since the recession. The IMF and the OECD both predict that Canada will be among the G7 economies with the strongest growth in the coming years. According to a report published by the International Labour Organization on wages, Canada has the second-best wages of all the G20 countries. ",Conservative,Eglinton--Lawrence,Joe Oliver,http://www.parl.gc.ca/parlinfo/Files/Parliamentarian.aspx?Item=552d6797-c806-48a1-82de-d6c410a8b518&Language=E&Section=ALL
4624150,ca.proc.d.2015-01-26.16574.90,2015-01-26,a71a1741-7ff2-4246-b0da-4622e96b10cf,1082,"Mr. Guy Caron (Rimouski-Neigette—Témiscouata—Les Basques, NDP)",,Oral Questions,The Economy,,"Mr. Speaker, the Conservatives insist on denying the facts. We cannot wait until April for the government to bring down a budget and take action. Thousands of jobs are at stake here.
What we need is leadership, but the government seems more disorganized than ever. The Minister of Employment is calling for a new round of cuts, while the President of the Treasury Board is telling us that that is not necessary. The Minister of Finance does not know whether he will have enough revenue to balance his budget, but he knows he will have enough money to bring in his ineffective income splitting policy.
Why does the minister not give us an economic and fiscal update right now, so that Canadians know where we stand?",New Democratic Party,Rimouski-Neigette--Témiscouata--Les Basques,Guy Caron,http://www.parl.gc.ca/parlinfo/Files/Parliamentarian.aspx?Item=a71a1741-7ff2-4246-b0da-4622e96b10cf&Language=E&Section=ALL
4624151,ca.proc.d.2015-01-26.16574.91,2015-01-26,106c623c-3606-40ae-a2f6-f4a619cf02f6,152,"Hon. Jason Kenney (Minister of Employment and Social Development and Minister for Multiculturalism, CPC)",,Oral Questions,The Economy,,"Mr. Speaker, let us be clear. The NDP's only economic policy is to increase spending, taxes, the deficit and debt. All that does is kill jobs. The NDP's policy is wrong-headed. 
This government will continue to balance the budget and support training for young Canadians and the unemployed. We will continue to reduce the tax burden to create new jobs.",Conservative,Calgary Southeast,Jason Kenney,http://www.parl.gc.ca/parlinfo/Files/Parliamentarian.aspx?Item=106c623c-3606-40ae-a2f6-f4a619cf02f6&Language=E&Section=ALL
4624152,ca.proc.d.2015-01-26.16574.92,2015-01-26,031462db-8f61-48ed-bf9f-b033eb8312bb,75,"Mr. Nathan Cullen (Skeena—Bulkley Valley, NDP)",,Oral Questions,The Economy,,"Mr. Speaker, when it comes to the federal budget, it seems with Conservatives it is different day, different minister, different answers. If panic and confusion could get us out of this mess, Conservatives would actually be doing something right, but their economic plans and their credibility are in tatters. Maybe it was the employment minister just jumping the gun a little bit when he let slip that big cuts were coming in order to fix his own government's mess.
Will the minister confirm that he is willing to cut services to all Canadians just to pay for his reckless income-splitting scheme?",New Democratic Party,Skeena--Bulkley Valley,Nathan Cullen,http://www.parl.gc.ca/parlinfo/Files/Parliamentarian.aspx?Item=031462db-8f61-48ed-bf9f-b033eb8312bb&Language=E&Section=ALL
4624153,ca.proc.d.2015-01-26.16574.93,2015-01-26,552d6797-c806-48a1-82de-d6c410a8b518,998,"Hon. Joe Oliver (Minister of Finance, CPC)",,Oral Questions,The Economy,,"Mr. Speaker, we will not be cutting expenditures. We will be honouring our commitments to Canadians. We will be providing tax breaks to four million Canadian families and tax breaks to small businesses. We will continue on our low-tax plan for jobs and growth. We will reject the high-tax, high-spend policies of the NDP, which would bring us to ruin.",Conservative,Eglinton--Lawrence,Joe Oliver,http://www.parl.gc.ca/parlinfo/Files/Parliamentarian.aspx?Item=552d6797-c806-48a1-82de-d6c410a8b518&Language=E&Section=ALL
4624154,ca.proc.d.2015-01-26.16574.94,2015-01-26,031462db-8f61-48ed-bf9f-b033eb8312bb,75,"Mr. Nathan Cullen (Skeena—Bulkley Valley, NDP)",,Oral Questions,The Economy,,"Mr. Speaker, this is what their policies got us. They lost 400,000 manufacturing jobs, and just last year when things were supposedly good, the Canadian economy grew slower than our population grew, and these guys want a pat on the back. Everyone can see that Conservatives delaying the budget is pure politics.
Former parliamentary budget officer Kevin Page said that in spite of their rhetoric, Conservatives are bad economic managers, that they built their budgets on a “house of cards”. The Bank of Canada and the private sector economists are all saying our economy is in real trouble, but just as in 2008, the Conservatives are pretending that there is nothing to worry about.
Why will the Conservatives not come clean with Canadians and give us a real fiscal update on the situation now and be straight with Canadians for once?",New Democratic Party,Skeena--Bulkley Valley,Nathan Cullen,http://www.parl.gc.ca/parlinfo/Files/Parliamentarian.aspx?Item=031462db-8f61-48ed-bf9f-b033eb8312bb&Language=E&Section=ALL
4624155,ca.proc.d.2015-01-26.16574.95,2015-01-26,552d6797-c806-48a1-82de-d6c410a8b518,998,"Hon. Joe Oliver (Minister of Finance, CPC)",,Oral Questions,The Economy,,"Mr. Speaker, whenever I have an opportunity to attend an international conference, I am struck by how positive the experts, decision-makers, and economists from around the world are in the way they view Canada and the Canadian economy. Certainly that was the view at the World Economic Forum in Davos. 
In contrast to that, the opposition members are mired in negativity and a desire to talk down Canada's success, and they do that with all their lopsided presentations. Canadians have a more positive view of Canada, a more accurate view. It is our view. We will not talk down Canada. We will—",Conservative,Eglinton--Lawrence,Joe Oliver,http://www.parl.gc.ca/parlinfo/Files/Parliamentarian.aspx?Item=552d6797-c806-48a1-82de-d6c410a8b518&Language=E&Section=ALL
4624156,ca.proc.d.2015-01-26.16574.96,2015-01-26,6519cfba-0080-419d-baa9-8ae6e56d032f,256,The Speaker,,Oral Questions,The Economy,,The hon. member for St. John's South—Mount Pearl.,Conservative,Regina--Qu'Appelle,Andrew Scheer,http://www.parl.gc.ca/parlinfo/Files/Parliamentarian.aspx?Item=6519cfba-0080-419d-baa9-8ae6e56d032f&Language=E&Section=ALL
