basepk,hid,speechdate,pid,opid,speakeroldname,speakerposition,maintopic,subtopic,subsubtopic,speechtext,speakerparty,speakerriding,speakername,speakerurl
4624060,ca.proc.d.2015-01-26.16574.0,2015-01-26,6519cfba-0080-419d-baa9-8ae6e56d032f,256,The Speaker,,,Vacancy,Sudbury,"It is my duty to inform the House that a vacancy has occurred in the representation, namely: Mr. Thibeault, member for the electoral district of Sudbury, by resignation effective Monday, January 5, 2015.
Pursuant to subsection 25(1)(b) of the Parliament of Canada Act, I have addressed my warrant to the Chief Electoral Officer for the issue of a writ for the election of a member to fill this vacancy.",Conservative,Regina--Qu'Appelle,Andrew Scheer,http://www.parl.gc.ca/parlinfo/Files/Parliamentarian.aspx?Item=6519cfba-0080-419d-baa9-8ae6e56d032f&Language=E&Section=ALL
4624061,ca.proc.d.2015-01-26.16574.1,2015-01-26,6519cfba-0080-419d-baa9-8ae6e56d032f,256,The Speaker,,,Message from the Senate,,"I have the honour to inform the House that a message has been received from the Senate informing this House that the Senate has passed the following bill, to which the concurrence of the House is desired: Bill S-7, An Act to amend the Immigration and Refugee Protection Act, the Civil Marriage Act and the Criminal Code and to make consequential amendments to other Acts.",Conservative,Regina--Qu'Appelle,Andrew Scheer,http://www.parl.gc.ca/parlinfo/Files/Parliamentarian.aspx?Item=6519cfba-0080-419d-baa9-8ae6e56d032f&Language=E&Section=ALL
4624062,ca.proc.d.2015-01-26.16574.2,2015-01-26,,,,stagedirection,Private Members' Business,Protecting Taxpayers and Revoking Pensions of Convicted Politicians Act,,"The House proceeded to the consideration of Bill C-518, An Act to amend the Members of Parliament Retiring Allowances Act (withdrawal allowance), as reported with amendment from the committee.",,,,
4624063,ca.proc.d.2015-01-26.16574.3,2015-01-26,6519cfba-0080-419d-baa9-8ae6e56d032f,256,The Speaker,,Private Members' Business,Protecting Taxpayers and Revoking Pensions of Convicted Politicians Act,Speaker's Ruling,"There are three motions in amendment standing on the notice paper for the report stage of Bill C-518.
Motion No. 3 will not be selected by the Chair as it could have been presented in committee.
Motions Nos. 1 and 2 will be grouped for debate and voted upon according to the voting pattern available at the table.
I will now put Motions Nos. 1 and 2 to the House.",Conservative,Regina--Qu'Appelle,Andrew Scheer,http://www.parl.gc.ca/parlinfo/Files/Parliamentarian.aspx?Item=6519cfba-0080-419d-baa9-8ae6e56d032f&Language=E&Section=ALL
4624064,ca.proc.d.2015-01-26.16574.4,2015-01-26,b41c3b7e-c64f-4415-9f58-79d7462e5d8e,146,"Mr. Peter Julian (Burnaby—New Westminster, NDP)",,Private Members' Business,Protecting Taxpayers and Revoking Pensions of Convicted Politicians Act,Motions in Amendment,"moved:
 Motion No. 1 
 That Bill C-518, in Clause 2, be amended by replacing lines 12 to 16 on page 1 with the following: 
 “ceases or has ceased to be a member and who, on or after the day on which this subsection comes into force, is either convicted of an offence under the Criminal Code mentioned in subsection (4) or sentenced to a term of imprisonment of five years or more for an offence under any other Act of Parliament, if the offence arose out of conduct that in whole or in part occurred while the person was a member, a” 
 Motion No. 2 
 That Bill C-518, in Clause 3, be amended by replacing lines 20 to 25 on page 3 with the following: 
 “ceases or has ceased to be a member and who, on or after the day on which this subsection comes into force, is either convicted of an offence under the Criminal Code mentioned in subsection 19(4) or sentenced to a term of imprisonment of five years or more for an offence under any other Act of Parliament, if the offence arose out of conduct that in whole or in part occurred while the person was a member, a withdrawal” 
Mr. Speaker, I would like to wish you and all of the members here today a happy new year. We have a lot of work to do in the House of Commons over the coming months. Even though I was sad to leave my friends and family in Burnaby—New Westminster, I am pleased that we are all here to work for the people, for Canadians.
I think that this bill will be of great interest to Canadians. The Conservatives' amendments to this bill will also be of interest to people across the country. I am therefore pleased to rise in the House to deliver the first speech of 2015 and talk about Bill C-518.
As members know, the NDP was in favour of the bill in principle. In fact, when the bill was originally presented, we raised the fact that the former NDP government in Nova Scotia was a pioneer in this regard. It presented legislation in the Nova Scotia legislature that took away the ability of representatives who have been convicted to be able to fall back on a pension, coming out of that conviction. We supported it in principle, and we supported bringing it to committee.
Then, what I can only consider to be the centralized control of the Prime Minister's Office kicked in around this particular bill. That is why we are offering the amendments that have just been proposed by the Speaker. They are amendments that seek to close the loopholes that were opened up in committee. We certainly hope that the Conservative members of Parliament will support the amendments we are bringing forward. We believe that most Canadians support those amendments as well.
When this bill was brought forward, we raised the very clear concerns about loopholes around acts of Parliament that are violated. As we know, when an act of Parliament is violated, it is a serious breach of trust by any member of Parliament. We have seen it particularly in the Senate with Conservative and Liberal senators, but also here in the House of Commons. We can think of the former member Dean Del Mastro, who resigned just before Christmas.
Crimes were committed. In the case of Mr. Del Mastro, he was convicted in court. Crimes were brought about by this particular member of Parliament, and we felt it important that the legislation, Bill C-518, actually reference those criminal violations, which result from a violation of an act of Parliament.
To our surprise, in the heat of the scandal around Mr. Del Mastro, Conservative members at the committee that was given the task of studying Bill C-518 actually put in place an amendment that would simply subtract these types of criminal violations from the overall thrust of the bill. I do not fault the member who proposed the bill for this. I think he is very well meaning in this regard. I have a sense that he believes that the bill should cover every member of Parliament convicted of serious criminal violations including acts of Parliament.
However, at committee, the order came down, as we have seen with other pieces of legislation brought forward by Conservative members. The order came down from the Prime Minister's Office, I can only assume, and it basically subtracted any criminal violation of an act of Parliament from the overall thrust of the bill.
What does that mean? It means that there is the Del Mastro loophole, which is a sizeable loophole in this legislation. If this legislation were passed as is, it would allow the Conservative and Liberal senators the violations that they have committed, as well as violations that we have seen in the case of Dean Del Mastro. Even when it is a serious criminal conviction, the bill, as amended by the Conservatives in committee, would not allow for their retiring allowance to be withdrawn.
What we have is this curious cherry-picking of what offences would and would not be included. That is why we decided to bring forward the two motions, the amendments we have brought forward today. The idea is to assure that any serious violation or criminal conviction that includes violations of acts of Parliament, which are certainly breaches of trust by any member of Parliament as part of our duties to uphold the acts, be considered in withdrawing the retiring allowance.
That is why we are moving these two motions, and we hope the government members will support them.
The motion reads in part as follows:
 ...is either convicted of an offence under the Criminal Code mentioned in subsection (4)... 
This covers offences already included in the bill, as amended by the members of the committee, which has a Conservative majority.
The motion continues:
 ...or sentenced to a term of imprisonment of five years or more for an offence under any other Act of Parliament.... 
We would then be able to strip these members of their pensions.
Currently, there is a list that includes certain offences and of course refers to provisions of the Criminal Code. Certain sections are mentioned; however, offences under acts of Parliament, which we are supposed to uphold as MPs, are not included.
Of course, that is why we want to repair the damage done by the Conservative majority on the committee, because some acts were eliminated, which changed the scope of the bill. These amendments would make the bill more just, especially when it comes to serious offences, including those that carry a sentence of five years or more in prison. Such offences should be included in the scope of this bill.
It is just common sense. This is hardly a radical idea. I think the vast majority of Canadians agree with us on this. We are here to support federal laws and the Criminal Code. In both cases, if a serious offence was committed, then it must be dealt with accordingly.
In this situation, that is not the case. The bill refers to a few Criminal Code offences, but not offences under acts of Parliament, such as a violation of the Canada Elections Act.
In the case of former Conservative MP Mr. Del Mastro, it was a serious offence. The bill came before the committee that very week, and it was certainly the time for the Conservative members to send a message. The Conservatives undermined their own bill. We are repairing the damage.
Under the leadership of our very experienced Leader of the Official Opposition, we are ready to take action. In the months to come and this fall, we will repair the damage caused by the Conservative government. That is our plan. 
Today we will move motions and propose amendments that make sense, in order to repair the damage caused by the Conservative members of the committee when they removed offences under acts of Parliament and thereby changed the scope of Bill C-518.",New Democratic Party,Burnaby--New Westminster,Peter Julian,http://www.parl.gc.ca/parlinfo/Files/Parliamentarian.aspx?Item=b41c3b7e-c64f-4415-9f58-79d7462e5d8e&Language=E&Section=ALL
4624065,ca.proc.d.2015-01-26.16574.5,2015-01-26,26c8b0bc-42d4-4db5-bf7d-1e1544c7b4b5,9172,"Mr. Dan Albas (Parliamentary Secretary to the President of the Treasury Board, CPC)",,Private Members' Business,Protecting Taxpayers and Revoking Pensions of Convicted Politicians Act,Motions in Amendment,"Mr. Speaker, I am happy to be here with all my colleagues. 
I am pleased to have this opportunity to speak in support of Bill C-518, an act to amend the Members of Parliament Retiring Allowances Act (withdrawal allowance). This is a laudable bill put forward by an hon. member who is concerned that parliamentarians could break the law and walk away with pension benefits paid by the taxpayers of our country. 
All parliamentarians must be held to the highest standards of accountability. They have a duty to protect the integrity of our public institutions, and their actions should be based on integrity, trust and respect for the tax dollars of Canadians. The bill before us today is consistent with these key principles of our democracy, and that is why the government firmly supports it.
Specifically, the bill would disentitle the pension of a senator or a member of Parliament who would be convicted of any offence based on a specific threshold that I will discuss shortly. This would bring an important and welcome change to our system of government. 
As it stands, if a parliamentarian retires or resigns prior to being expelled or disqualified from Parliament as a result of him or her committing a crime, the individual is still entitled to a pension. In many circumstances this is unacceptable, particularly when the crime constituted is a serious offence under the Criminal Code. There are many situations where parliamentarians who are convicted of certain offences should not continue to receive a benefit from pension benefits funded by taxpayers.
The bill, as amended, clearly states what the disentitlement threshold would be. It is based on a list of prescribed offences under the Criminal Code, which would apply only if a conviction were rendered on or after the coming into force of this legislation. This includes serious offences such as bribery of an officer, perjury or intimidating Parliament, which all carry a maximum prison sentence of 14 years. It also includes offences such as obstructing justice and theft over $5,000, which carries a maximum prison sentence of 10 years.
Any parliamentarian affected by the bill would be entitled to only a withdrawal allowance, which is really a refund of his or her own pension contributions minus any retirement allowance already paid plus applicable interest. However, any contributions made by the employer would not be included. In addition, the parliamentarian would no longer be eligible for post-retirement health or dental benefits.
The government has already taken action to ensure that public sector pension plans are sustainable, fair and financially responsible. In 2012, we reformed the pensions of members of Parliament and public servants to make them more broadly consistent with the pension products offered by other jurisdictions, as well as fair relative to those offered in the private sector. As a result, contribution rates for public service employees and MPs will be moving to a fifty-fifty cost sharing model by 2017.
We have vowed to strengthen accountability and transparency in our public institutions, and we have delivered on that.
A major milestone was the implementation of the 2006 Federal Accountability Act and its companion action plan. Through the Federal Accountability Act and action plan, we implemented numerous measures to prevent undemocratic and criminal behaviour from impacting our system of government. For example, we created a new standard of accountability for the financing of political parties. We did that by reducing the maximum annual contribution by individuals to political entities and prohibited unions and corporations from making political contributions. 
We banned secret donations to political candidates by prohibiting electoral district associations and parties from transferring money to their candidates from trust funds. 
Our government introduced a new Conflict of Interest Act and granted powers to the new Conflict of Interest and Ethics Commissioner to enforce it.
We toughened the Lobbyist Registration Act by introducing stricter rules for lobbying activity and giving a new Commissioner of Lobbying enhanced powers to investigate and enforce them.
We reformed the procurement of government contracts by adding transparency to the process and by appointing an independent procurement ombudsman to provide additional oversight.
We strengthened the Access to Information Act by extending its reach and its scope. As a result, more government institutions than ever before are subject now to the act, including departments and agencies, crown corporations and wholly-owned subsidiaries. 
We strengthened the role of the Auditor General by expanding the office's investigative powers, which has helped parliamentarians to hold the government to account.
We strengthened auditing and accountability within departments by clarifying the managerial responsibilities of deputy heads within the framework of ministerial responsibility and by bolstering the internal audit function within departments and crown corporations.
In short, we have strengthened accountability in every corner of the government, from the Prime Minister to parliamentarians and public sector employees, and for all Canadians and businesses that receive government funding.
Canadians work hard, pay their taxes and play by the rules, and they expect accountability from their government. This is why we continue to pursue opportunities and support efforts that promise to make our public institutions more transparent, accountable and ethical. This includes measures such as Bill C-518, which is consistent with the spirit of our landmark Federal Accountability Act and action plan. It applies to members of both the House of Commons and the Senate, because those who make the laws should never be above the law. 
This is a bill we can all get behind. We also hope the bill will be another deterrent against criminal behaviour. As my hon. friend who sponsored the bill said so succinctly in debate, the point of the bill is to send the signal to people to not break the rules. If they do not break the rules, the pension will be there for them. 
The bill sends a strong message that if anyone breaks the law in our country, there are consequences. It is a very strong bill. More than that, it is consistent with our government's focus on accountability, transparency and protecting taxpayer dollars. It reflects Canadians' sense of honesty, hard work and fair play. That is why we support the legislation. I encourage all members of the House to join with me in voting for the bill. 
I also want to thank my hon. colleague again for his excellent work in preparing and putting forward the legislation. ",Conservative,Okanagan--Coquihalla,Dan Albas,http://www.parl.gc.ca/parlinfo/Files/Parliamentarian.aspx?Item=26c8b0bc-42d4-4db5-bf7d-1e1544c7b4b5&Language=E&Section=ALL
4624066,ca.proc.d.2015-01-26.16574.6,2015-01-26,07cf5767-802c-406c-92a7-7dc92af79b40,4264,"Mr. Kevin Lamoureux (Winnipeg North, Lib.)",,Private Members' Business,Protecting Taxpayers and Revoking Pensions of Convicted Politicians Act,Motions in Amendment,"Mr. Speaker, it is with pleasure that I rise today to speak to Bill C-518, a bill that, in principle, is worthy of support. The ultimate objectives and goals that the bill hopes to achieve are admirable.
Pensions have been a hot topic. I had the opportunity over the break to have a great deal of discussion on pensions. As much as it is nice to see the bill, there is a bigger concern related to pensions, which is real. I would have much preferred to talk about that today.
The member who spoke before me talked a lot about transparency, accountability and ethical behaviour. They are all wonderful things to admire, and I respect what the member attempted to say on that. However, as much as I will support the bill, I would have rather seen the government talk more about other issues related to pensions. 
Over the last number of years there has been a huge backlash toward the government's decisions with respect to Canada pension plan, and in particular the OAS, where it saw fit to increase the age of eligibility from 65 to 67. As much as the government wants to spend time dealing with pensions for members of Parliament, I would encourage it to also spend some time, effort and provide more debate toward the issue of pensions generally and recognize that the people who the budgetary measures really hurts are those individuals who depend on those public pensions. That is why it would be a mistake for me to rise in my place and not remind the government how bad it has missed the mark in supporting our seniors at a time in need, at a time in which they look for comfort with respect to their retirement. It was wrong for it to increase the age of retirement from 65 to 67.
With respect to the specifics, the bill would add a clause to the members of Parliament retiring allowance to take into account the situation where a senator or a member of Parliament would be convicted of an offence which arose out of his or her conduct and occurred while the individual was in office. It would do this by using the same mechanism already in place for politicians who have become disqualified from holding office. Currently if MPs or senators are kicked out of parliament, they lose their pensions. If members resign beforehand, they keep their pension. The purpose of this bill, and I sat on the committee, at least in part, has been designed intentionally to remove that loophole.
The issue of parliamentarians receiving pensions and those who have been disqualified to receive pensions because of inappropriate behaviour is nothing new per se. Other provinces have attempted to deal with this issue, some more successfully than others. Alberta and New Brunswick have both attempted to deal with the issue. As has been pointed out, back in 2013 Nova Scotia passed legislation that stripped away pensions.
What I liked about it was that we were provided a specific example where an independent MLA ended up losing his pension after he pleaded guilty to fraud and breach of trust charges arising from an expense scandal. That member had collected tax dollars after filing 10 false claims in 2008 and 2009. For the most part, due to that legislation and as a result of the conviction, the individual in question was not eligible to receive the MLA pension. 
Currently the law is fairly clear that if members of Parliament or senators are caught in the same sort of situation and are asked to leave the floor of the House of Commons through a vote, they will in fact lose their pensions. If they choose to take it upon themselves to resign prior to a conviction or to being kicked out of the House, they will in fact continue to be eligible.
Anyone looking at that situation would no doubt come to the conclusion, as I and many others have, that it is just not right. They are trying to escape justice by announcing their retirements to avoid being held accountable for their behaviour and so they can collect publicly financed pensions.
That is at the core. That is the way Bill C-518 was talked about at second reading. There was a need to close that loophole. It is for that reason that I feel comfortable supporting the legislation.
There were issues that came up in committee that raised some concerns with regard to other individuals who might have a bit of an entitlement, potentially, to a pension. An example raised was that of a spouse of a member, who, through divorce, would have had some form of entitlement and consideration. 
The answers I found to be somewhat wanting. However, at the end of the day, there have been enough assurances and information brought to the table that I think it is advisable to support the legislation as suggested by the government. At the very least, we should be aware that there are other things we need to take into consideration.
The overriding theme is that as elected officials, we have a responsibility. There is a moral high ground if one is an elected official in a legislative assembly or the House of Commons or if one is appointed to the Senate. These are bodies that review and bring in legislation that ultimately becomes law, and there is a expectation that we will follow the law.
In situations where politicians fall on the other side of the law, there needs to be a consequence. I believe it is appropriate to look at the pensions MLAs or members of Parliament would collect, recognizing that this legislation only applies to members of Parliament and senators.
This is a piece of legislation that would ultimately apply to a very few. If we look at some of the past comments, particularly at the committee stage, we can count on one hand the number of potential offenders over the decades who would have actually been impacted by this legislation.
There has been a great deal of public interest in regard to public trust because of what is happening in the Senate, with Pamela Wallin and Mike Duffy, and with other individuals, such as Dean Del Mastro.
It is necessary to pass this legislation. That is why, when it comes time for a vote, I will be voting in favour.",Liberal,Winnipeg North,Kevin Lamoureux,http://www.parl.gc.ca/parlinfo/Files/Parliamentarian.aspx?Item=07cf5767-802c-406c-92a7-7dc92af79b40&Language=E&Section=ALL
