basepk,hid,speechdate,pid,opid,speakeroldname,speakerposition,maintopic,subtopic,subsubtopic,speechtext,speakerparty,speakerriding,speakername,speakerurl
4678321,ca.proc.d.2016-05-12.8920261,2016-05-12,22a96405-bed6-45e9-811a-69d055416803,217593,"Hon. Steven Blaney (Bellechasse—Les Etchemins—Lévis, CPC)",,Oral Questions,Democratic Reform,,"Mr. Speaker, when the Liberals have a problem, their solution is to form a committee. Problems with Canada Post? Form a committee. Problems with defence? Form a committee. Problems with free trade? Form a committee.",Conservative,Bellechasse—Les Etchemins—Lévis,Steven Blaney,http://www.parl.gc.ca/MembersOfParliament/ProfileMP.aspx?Key=217593&Language=E
4678322,ca.proc.d.2016-05-12.p4339839,2016-05-12,,,,intervention,Oral Questions,Democratic Reform,," Oh, oh!",,,Some hon. members,
4678323,ca.proc.d.2016-05-12.8920263,2016-05-12,3176068f-62ee-4b2f-aacd-1131201c6db1,214707,The Speaker,,Oral Questions,Democratic Reform,,Order. The hon. member for Bellechasse—Les Etchemins—Lévis has the floor. He is the only one allowed to speak right now.,Liberal,Halifax West,Geoff Regan,http://www.parl.gc.ca/MembersOfParliament/ProfileMP.aspx?Key=214707&Language=E
4678324,ca.proc.d.2016-05-12.8920264,2016-05-12,22a96405-bed6-45e9-811a-69d055416803,217593,Hon. Steven Blaney,,Oral Questions,Democratic Reform,,"Mr. Speaker, I, for one, would like Canadians to be involved in democratic reform. 
Is the Minister of Democratic Institutions prepared to consult with Canadians through a referendum on democratic reform?",Conservative,Bellechasse—Les Etchemins—Lévis,Steven Blaney,http://www.parl.gc.ca/MembersOfParliament/ProfileMP.aspx?Key=217593&Language=E
4678325,ca.proc.d.2016-05-12.8920266,2016-05-12,60df4944-d66b-4133-a348-2bcde37c8752,214191,"Hon. Maryam Monsef (Minister of Democratic Institutions, Lib.)",,Oral Questions,Democratic Reform,,"Mr. Speaker, listening to Canadians is at the heart of a healthy democracy.
We are committed to ensuring that young people, new Canadians, indigenous persons, those with disabilities and exceptionalities, seniors, and those living in the rural and remote regions of our country, have a meaningful opportunity to engage in this process.",Liberal,Peterborough—Kawartha,Maryam Monsef,http://www.parl.gc.ca/MembersOfParliament/ProfileMP.aspx?Key=214191&Language=E
4678326,ca.proc.d.2016-05-12.8920269,2016-05-12,22a96405-bed6-45e9-811a-69d055416803,217593,"Hon. Steven Blaney (Bellechasse—Les Etchemins—Lévis, CPC)",,Oral Questions,Democratic Reform,,"Mr. Speaker, this is the ultimate irony. The Liberals have made a complete mess of this.
We have gone from sunny ways to a democratic black hole. First of all, the Liberals give themselves absolute power by stacking the committee. Then they change the rules of democracy by ignoring and thumbing their noses at Canadians. We have seen a Liberal-style benevolent dictatorship. Now we are faced with a selective “consultocracy”.
Is the minister trying to engage in some sort of political sleight-of-hand in order to lead Canadians astray?",Conservative,Bellechasse—Les Etchemins—Lévis,Steven Blaney,http://www.parl.gc.ca/MembersOfParliament/ProfileMP.aspx?Key=217593&Language=E
4678327,ca.proc.d.2016-05-12.8920274,2016-05-12,60df4944-d66b-4133-a348-2bcde37c8752,214191,"Hon. Maryam Monsef (Minister of Democratic Institutions, Lib.)",,Oral Questions,Democratic Reform,,"Mr. Speaker, I would like to remind all members of this House that no changes or reforms have yet been presented to this House.
Yesterday, we announced the first step towards hearing from Canadians about how to bring their democracy into the 21st century. We have begun the first step, and that includes listening to Canadians across 338 ridings and making a thoughtful and evidence-based decision that way.",Liberal,Peterborough—Kawartha,Maryam Monsef,http://www.parl.gc.ca/MembersOfParliament/ProfileMP.aspx?Key=214191&Language=E
4678328,ca.proc.d.2016-05-12.8920304,2016-05-12,a710e2c4-20f9-4df8-ba6c-2dc50c03bb75,217321,"Ms. Marjolaine Boutin-Sweet (Hochelaga, NDP)",,Oral Questions,Democratic Reform,,"Mr. Speaker, this makes absolutely no sense.
The Liberals say they want to make our system more democratic, and yet they give themselves a majority on the committee. They want to include the Green Party and the Bloc Québécois, but they do not give those parties the right to vote.
How can Canadians be sure that the process is not rigged from the start? Clearly, this reform is not off to a good start.
Will the government admit its mistake and give all parties the right to vote in committee?",New Democratic Party,Hochelaga,Marjolaine Boutin-Sweet,http://www.parl.gc.ca/MembersOfParliament/ProfileMP.aspx?Key=217321&Language=E
4678329,ca.proc.d.2016-05-12.8920311,2016-05-12,60df4944-d66b-4133-a348-2bcde37c8752,214191,"Hon. Maryam Monsef (Minister of Democratic Institutions, Lib.)",,Oral Questions,Democratic Reform,,"Mr. Speaker, we took the leadership to ensure that non-recognized parties would be at the table.
Under our proposal, members of the Bloc Québécois and the Green Party would be able to participate in developing the witness lists, question witnesses, travel with the committee for hearings across the country, and have the opportunity to provide their input into the final report.
The committee cannot do this work alone. It will require collaboration from all members of this House. I look forward to the contributions of every single member and every single party represented in this House.",Liberal,Peterborough—Kawartha,Maryam Monsef,http://www.parl.gc.ca/MembersOfParliament/ProfileMP.aspx?Key=214191&Language=E
4678330,ca.proc.d.2016-05-12.8920315,2016-05-12,a710e2c4-20f9-4df8-ba6c-2dc50c03bb75,217321,"Ms. Marjolaine Boutin-Sweet (Hochelaga, NDP)",,Oral Questions,Democratic Reform,,"Mr. Speaker, if the Liberals were really willing to work with the opposition, they would not be ramming bills through the House and giving themselves false majorities on a committee.
How can they claim that they want to end first past the post, and then strike a committee that models itself on first past the post?
We are talking about a once-in-a-generation voting reform. Will the minister reconsider her decision to give Liberals the power to unilaterally change our voting system?",New Democratic Party,Hochelaga,Marjolaine Boutin-Sweet,http://www.parl.gc.ca/MembersOfParliament/ProfileMP.aspx?Key=217321&Language=E
4678331,ca.proc.d.2016-05-12.8920318,2016-05-12,60df4944-d66b-4133-a348-2bcde37c8752,214191,"Hon. Maryam Monsef (Minister of Democratic Institutions, Lib.)",,Oral Questions,Democratic Reform,,"Mr. Speaker, this is indeed an historic opportunity for all of us to go out of our way to engage those Canadians who do not traditionally engage in the democratic process.
We are committed to creating a new electoral system that produces a Parliament that Canadians can be confident in, one that ensures their voices are heard and represented in this House. We all share this ideal in this House. I look forward to the contributions of all members towards that end.",Liberal,Peterborough—Kawartha,Maryam Monsef,http://www.parl.gc.ca/MembersOfParliament/ProfileMP.aspx?Key=214191&Language=E
4678332,ca.proc.d.2016-05-12.8920349,2016-05-12,6fda5a4f-19c6-4cf2-b72d-9a00b48e0d21,219053,"Ms. Hélène Laverdière (Laurier—Sainte-Marie, NDP)",,Oral Questions,Foreign Affairs,,"Mr. Speaker, the Liberal government's messaging around selling weapons to Saudi Arabia is really disturbing.
We have a video that clearly shows the kind of armoured vehicle we are going to sell to Saudi Arabia being used as we speak to crush the civilian population. The minister said that we are not selling those particular armoured vehicles and that we have not yet sold any to Saudi Arabia. That is not very convincing. He also said that there was an element of risk in the contract, but that it was a calculated risk.
Can the minister tell us how many dead civilians it will take for him to recalculate? What number would that be?",New Democratic Party,Laurier—Sainte-Marie,Hélène Laverdière,http://www.parl.gc.ca/MembersOfParliament/ProfileMP.aspx?Key=219053&Language=E
4678333,ca.proc.d.2016-05-12.8920355,2016-05-12,6bde42a3-d07c-4c1f-b9d4-9e14a124f465,213864,"Hon. Stéphane Dion (Minister of Foreign Affairs, Lib.)",,Oral Questions,Foreign Affairs,,"Mr. Speaker, the party that is being consistent on this issue is the Liberal Party.
The NDP promised to uphold the contract to win seats, but now that it has those seats, it wants to tell the families that depend on the contract they will lose their jobs because it will not sign the export permit for these Canadian vehicles. The issue here is the export permit for a made-in-Canada vehicle, and we have no evidence that it has been wrongly used even though Canada has been selling it since 1993.",Liberal,Saint-Laurent,Stéphane Dion,http://www.parl.gc.ca/MembersOfParliament/ProfileMP.aspx?Key=213864&Language=E
4678334,ca.proc.d.2016-05-12.8920384,2016-05-12,6fda5a4f-19c6-4cf2-b72d-9a00b48e0d21,219053,"Ms. Hélène Laverdière (Laurier—Sainte-Marie, NDP)",,Oral Questions,Foreign Affairs,,"Mr. Speaker, the Minister of Foreign Affairs said that he would cancel the export permits of military equipment to Saudi Arabia if there were new revelations of human rights abuses. But yesterday, the Prime Minister basically said there will be no cancellations. This is about human rights. This is about Canada's international commitments. The question is simple: Who should Canadians believe?",New Democratic Party,Laurier—Sainte-Marie,Hélène Laverdière,http://www.parl.gc.ca/MembersOfParliament/ProfileMP.aspx?Key=219053&Language=E
4678335,ca.proc.d.2016-05-12.8920389,2016-05-12,6bde42a3-d07c-4c1f-b9d4-9e14a124f465,213864,"Hon. Stéphane Dion (Minister of Foreign Affairs, Lib.)",,Oral Questions,Foreign Affairs,,"Mr. Speaker, they should believe the Government of Canada and the Prime Minister. This is not a party that switches views after the election, after committing to everything before the election. 
The Prime Minister asked me to make sure that the power that the Minister of Foreign Affairs has to block the export permits, if equipment is built in Canada but is wrongly used regarding human rights or national interests of Canada and its allies, is used with a lot of rigour and transparency, which is what I will do.",Liberal,Saint-Laurent,Stéphane Dion,http://www.parl.gc.ca/MembersOfParliament/ProfileMP.aspx?Key=213864&Language=E
4678336,ca.proc.d.2016-05-12.8920393,2016-05-12,27d8ca3d-1740-41b6-872b-6ceb646cdd31,224217,"Mr. Scott Reid (Lanark—Frontenac—Kingston, CPC)",,Oral Questions,Democratic Reform,,"Mr. Speaker, today's National Post says the government's committee process is no mandate for electoral reform. The Toronto Star's headline is “Let the people vote..”. The media agree that there should be a referendum to approve any change to the voting system, and the people also agree. Polls say that two-thirds believe there should be a referendum. Why does the Prime Minister not agree with Canadians? Why does he refuse to hold a referendum?",Conservative,Lanark—Frontenac—Kingston,Scott Reid,http://www.parl.gc.ca/MembersOfParliament/ProfileMP.aspx?Key=224217&Language=E
4678337,ca.proc.d.2016-05-12.8920397,2016-05-12,60df4944-d66b-4133-a348-2bcde37c8752,214191,"Hon. Maryam Monsef (Minister of Democratic Institutions, Lib.)",,Oral Questions,Democratic Reform,,"Mr. Speaker, an independent and constructive media is critical to the success and the health of our democracy. However, this particular reform process is about engaging those who do not have a platform to share their thoughts, their needs, and their aspirations, including young people, indigenous persons, women, those with disabilities and exceptionalities, new Canadians, those living in rural and remote regions of our country, and those of more humble socio-economic background. That is the inclusive approach that Canadians expect from us. That is what we will deliver.",Liberal,Peterborough—Kawartha,Maryam Monsef,http://www.parl.gc.ca/MembersOfParliament/ProfileMP.aspx?Key=214191&Language=E
4678338,ca.proc.d.2016-05-12.8920402,2016-05-12,27d8ca3d-1740-41b6-872b-6ceb646cdd31,224217,"Mr. Scott Reid (Lanark—Frontenac—Kingston, CPC)",,Oral Questions,Democratic Reform,,"Mr. Speaker, after 16 years on Parliament Hill, I can say there is no place that we are less likely to find a Canadian with exceptionality, a disabled Canadian, a minority, a disenfranchised person than at a parliamentary committee.
The government has articulated two contradictory positions on changing the voting system. The Prime Minister's tiresome oft-repeated line is that the 2015 election will be the last one ever fought on first past the post. That must mean no to a referendum under any circumstances, yet his ministers say that a referendum is a legitimate option. Which of these two positions actually reflect government policy? Will there be a referendum, or will there not?",Conservative,Lanark—Frontenac—Kingston,Scott Reid,http://www.parl.gc.ca/MembersOfParliament/ProfileMP.aspx?Key=224217&Language=E
4678339,ca.proc.d.2016-05-12.8920404,2016-05-12,60df4944-d66b-4133-a348-2bcde37c8752,214191,"Hon. Maryam Monsef (Minister of Democratic Institutions, Lib.)",,Oral Questions,Democratic Reform,,"Mr. Speaker, I share, I hope with all members of the House, a great deal of respect for the work of committees in this place. This committee will be shaped by an important set of broad-based principles that include pursuing an effective and legitimate voting system which more accurately reflects Canadians' electoral wishes, a system that better engages all Canadians, one that fosters civility, consensus building, cohesion, an accessible system, one with integrity, and one that enhances the connection between representatives and their constituents.",Liberal,Peterborough—Kawartha,Maryam Monsef,http://www.parl.gc.ca/MembersOfParliament/ProfileMP.aspx?Key=214191&Language=E
4678340,ca.proc.d.2016-05-12.8920411,2016-05-12,62bfd797-8d32-425b-91b1-1422ca16694f,224621,"Mr. Blake Richards (Banff—Airdrie, CPC)",,Oral Questions,Democratic Reform,,"Mr. Speaker, the Liberals are once again flip-flopping so much that they cannot even keep the same talking points together for a whole press conference. On the one hand, the Liberal House leader stated that all options are possible when asked if maintaining the current system was on the table. But then, a mere minute later, he stated that 2015 was the last first-past-the-post election. Flip flop. Maybe they can make it clear on one thing. Will the Liberals commit to giving each and every Canadian a direct say through a referendum?",Conservative,Banff—Airdrie,Blake Richards,http://www.parl.gc.ca/MembersOfParliament/ProfileMP.aspx?Key=224621&Language=E
4678341,ca.proc.d.2016-05-12.8920414,2016-05-12,60df4944-d66b-4133-a348-2bcde37c8752,214191,"Hon. Maryam Monsef (Minister of Democratic Institutions, Lib.)",,Oral Questions,Democratic Reform,,"Mr. Speaker, we have arrived in this place after the longest federal election in modern Canadian history, during which we were rather clear about our intention to reform our electoral system. Allow me to be clear for hon. members: 2015 was the last federal election conducted under the first-past-the-post system. It is time for a 21st century model of electing individuals to the House. That is what we promised. That is what we will deliver upon.",Liberal,Peterborough—Kawartha,Maryam Monsef,http://www.parl.gc.ca/MembersOfParliament/ProfileMP.aspx?Key=214191&Language=E
4678342,ca.proc.d.2016-05-12.8920417,2016-05-12,62bfd797-8d32-425b-91b1-1422ca16694f,224621,"Mr. Blake Richards (Banff—Airdrie, CPC)",,Oral Questions,Democratic Reform,,"Mr. Speaker, it is time to remind Canadians that they are in charge. That is what the Minister of Democratic Institutions claimed yesterday, but their actions do not match their words. All decisions about electoral reform will be made by six Liberals who form the majority on the committee, and the minister also stated that the ultimate decision on what system is proposed will be made by cabinet, not by Canadians.
 How can the Liberals claim that Canadians are in charge when the Prime Minister will not even trust them with an opportunity for a referendum?",Conservative,Banff—Airdrie,Blake Richards,http://www.parl.gc.ca/MembersOfParliament/ProfileMP.aspx?Key=224621&Language=E
4678343,ca.proc.d.2016-05-12.8920420,2016-05-12,60df4944-d66b-4133-a348-2bcde37c8752,214191,"Hon. Maryam Monsef (Minister of Democratic Institutions, Lib.)",,Oral Questions,Democratic Reform,,"Mr. Speaker, on the one hand, members' opposite ridicule the idea of listening to Canadians and on the other hand, they criticize us for not listening to Canadians. 
Let me make this clear. The first point of contact for all of us will be hearing from those Canadians who do not normally engage in the democratic process, those who have often been marginalized. A healthy democracy is one that includes their voices.
The final decision will be made by members of the House as well as those in the other place.",Liberal,Peterborough—Kawartha,Maryam Monsef,http://www.parl.gc.ca/MembersOfParliament/ProfileMP.aspx?Key=214191&Language=E
4678344,ca.proc.d.2016-05-12.8920423,2016-05-12,bd2068aa-74c7-430a-bdf5-6f17b14ca140,217659,"Mr. Tom Kmiec (Calgary Shepard, CPC)",,Oral Questions,Democratic Reform,,"Mr. Speaker, yesterday we learned about the Liberals' plan to change our democracy.
What was the first move by the Liberals? They are going to set up a committee with a majority of Liberal members. When you want to change the rules of democracy, the only majority that counts is the majority of Canadians.
Why not simply commit to consulting all Canadians through a referendum?",Conservative,Calgary Shepard,Tom Kmiec,http://www.parl.gc.ca/MembersOfParliament/ProfileMP.aspx?Key=217659&Language=E
4678345,ca.proc.d.2016-05-12.8920426,2016-05-12,60df4944-d66b-4133-a348-2bcde37c8752,214191,"Hon. Maryam Monsef (Minister of Democratic Institutions, Lib.)",,Oral Questions,Democratic Reform,,"Mr. Speaker, we are committed to hearing from all Canadians in all 338 ridings across this great nation. We are relying upon a collaborative approach among every single member of the House to ensure that the voices of those constituents in their ridings who do not normally get heard, who do not normally have a platform, are included and recognized in this important dialogue prior to arriving at a final conclusion.",Liberal,Peterborough—Kawartha,Maryam Monsef,http://www.parl.gc.ca/MembersOfParliament/ProfileMP.aspx?Key=214191&Language=E
4678346,ca.proc.d.2016-05-12.8920429,2016-05-12,bd2068aa-74c7-430a-bdf5-6f17b14ca140,217659,"Mr. Tom Kmiec (Calgary Shepard, CPC)",,Oral Questions,Democratic Reform,,"Mr. Speaker, repeating oneself is not the same as answering the question.
When we see the Liberal majority on the committee and the government's insistence on not really consulting Canadians, then we wonder what is really going on here.
It is simple. Ontario, British Columbia, and Prince Edward Island held referendums in the past, which legitimizes the process.
Will the Liberals have the courage of their convictions? Will they promise today in the House to hold a referendum to change the voting system?",Conservative,Calgary Shepard,Tom Kmiec,http://www.parl.gc.ca/MembersOfParliament/ProfileMP.aspx?Key=217659&Language=E
4678347,ca.proc.d.2016-05-12.8920432,2016-05-12,60df4944-d66b-4133-a348-2bcde37c8752,214191,"Hon. Maryam Monsef (Minister of Democratic Institutions, Lib.)",,Oral Questions,Democratic Reform,,"Mr. Speaker, our motivation with this whole process is to ensure that—",Liberal,Peterborough—Kawartha,Maryam Monsef,http://www.parl.gc.ca/MembersOfParliament/ProfileMP.aspx?Key=214191&Language=E
4678348,ca.proc.d.2016-05-12.p4339891,2016-05-12,,,,intervention,Oral Questions,Democratic Reform,," Oh, oh!",,,Some hon. members,
4678349,ca.proc.d.2016-05-12.8920433,2016-05-12,3176068f-62ee-4b2f-aacd-1131201c6db1,214707,The Speaker,,Oral Questions,Democratic Reform,,"Most members on all sides are able to listen to questions and answers that are often provocative without reacting. Let us have the rest do it too.
The hon. Minister of Democratic Institutions.",Liberal,Halifax West,Geoff Regan,http://www.parl.gc.ca/MembersOfParliament/ProfileMP.aspx?Key=214707&Language=E
4678350,ca.proc.d.2016-05-12.8920434,2016-05-12,60df4944-d66b-4133-a348-2bcde37c8752,214191,Hon. Maryam Monsef,,Oral Questions,Democratic Reform,,"Mr. Speaker, democratic reform is about ensuring that all voices are heard in the House. It is about ways that we can work together to ensure that we deliver the best government and the best governance to the people who sent us here.
I look forward to working with all members of the House toward that common goal.",Liberal,Peterborough—Kawartha,Maryam Monsef,http://www.parl.gc.ca/MembersOfParliament/ProfileMP.aspx?Key=214191&Language=E
4678351,ca.proc.d.2016-05-12.8920438,2016-05-12,53435570-da9e-42e1-a195-e5475a2f8b13,217110,"Ms. Georgina Jolibois (Desnethé—Missinippi—Churchill River, NDP)",,Oral Questions,Indigenous Affairs,,"Mr. Speaker, it has been almost four months since the shooting in La Loche and the Liberals are still not providing mental health care workers in my riding and many other communities. The government's budget allocated zero additional dollars for mental health care despite the urgent need. What about La Loche? What about Cross Lake? 
Will the government finally ensure that all first nations communities are able to access the support they need and deserve?",New Democratic Party,Desnethé—Missinippi—Churchill River,Georgina Jolibois,http://www.parl.gc.ca/MembersOfParliament/ProfileMP.aspx?Key=217110&Language=E
4678352,ca.proc.d.2016-05-12.8920443,2016-05-12,350c31fd-6260-4c63-bd17-0746cb6f4120,214328,"Hon. Jane Philpott (Minister of Health, Lib.)",,Oral Questions,Indigenous Affairs,,"Mr. Speaker, all Canadians, indigenous or otherwise, need to have access to the mental health care that is necessary and this is a responsibility of all of us.
In terms of indigenous communities, I am pleased to inform the member that I am in conversations with my officials and the first nations and Inuit health branch on a daily basis about how we could increase access to mental health services in communities like La Loche and Cross Lake. We are working toward a plan to be able to enhance those services and I will be pleased to report our progress at a further date.",Liberal,Markham—Stouffville,Jane Philpott,http://www.parl.gc.ca/MembersOfParliament/ProfileMP.aspx?Key=214328&Language=E
4678353,ca.proc.d.2016-05-12.8920445,2016-05-12,50a18bf1-9be3-4563-b657-6af367453ba0,217240,"Mr. Charlie Angus (Timmins—James Bay, NDP)",,Oral Questions,Indigenous Affairs,,"Mr. Speaker, Health Canada officials have confirmed that no money was set aside to implement Jordan's principle. This flies in the face of two rulings by the Human Rights Tribunal that ordered immediate action to end the systemic discrimination against indigenous children. The government ignored the ruling with its budget and now it has ignored the deadline with the new estimates, so there is no money to close the funding gap for child welfare and zero for Jordan's principle.
What part of the word “immediate” does the government not understand? With $30 billion in extra spending, could it not find a dime to help children who are still being denied their rights?",New Democratic Party,Timmins—James Bay,Charlie Angus,http://www.parl.gc.ca/MembersOfParliament/ProfileMP.aspx?Key=217240&Language=E
4678354,ca.proc.d.2016-05-12.8920447,2016-05-12,bc4bee2d-993a-4485-a436-4b45cb6553da,214468,"Ms. Yvonne Jones (Parliamentary Secretary to the Minister of Indigenous and Northern Affairs, Lib.)",,Oral Questions,Indigenous Affairs,,"Mr. Speaker, we know that child and family services on reserve must be overhauled and we have started working toward that process. We are investing money into child and family services and we are doing it across the board through various departments of government.
Our initiatives this year have provided $600 million and more over five years to be invested in children and families on reserve. We are going to continue to do that because we know it is necessary, because we know it is needed, and we are committed to it.",Liberal,Labrador,Yvonne Jones,http://www.parl.gc.ca/MembersOfParliament/ProfileMP.aspx?Key=214468&Language=E
4678355,ca.proc.d.2016-05-12.8920451,2016-05-12,ebbfc235-08c5-44f8-8c22-a60c671db398,218374,"Mr. Chris Warkentin (Grande Prairie—Mackenzie, CPC)",,Oral Questions,Ethics,,"Mr. Speaker, yesterday the Minister of Agriculture defended his chief of staff, saying that he wanted somebody with agricultural experience. Now his chief of staff has a very specific experience, that of owning a multi-million dollar egg empire.
However, that is the very experience that the Conflict of Interest Commissioner has specifically forbidden her from speaking about. If she cannot talk about the explicit experience that the minister said qualified her for the job, why is she still on the payroll?",Conservative,Grande Prairie—Mackenzie,Chris Warkentin,http://www.parl.gc.ca/MembersOfParliament/ProfileMP.aspx?Key=218374&Language=E
