basepk,hid,speechdate,pid,opid,speakeroldname,speakerposition,maintopic,subtopic,subsubtopic,speechtext,speakerparty,speakerriding,speakername,speakerurl
4678443,ca.proc.d.2016-05-12.8921050,2016-05-12,18e36567-4082-4ce3-a35b-d4aba65560ca,219811,"Mr. David Lametti (Parliamentary Secretary to the Minister of International Trade, Lib.)",,Government Orders,Business of Supply,Opposition Motion—Trans-Pacific Partnership,"Madam Speaker, I thank the hon. member for Foothills as well as the hon. member for Durham, who spoke before and just left, for their work on this file.
One of the problems with the other side of the House is that while they did consult on the TPP, they only consulted with people who actually agreed with them. When they cite studies, they tend to cite the Peterson Institute and the C.D. Howe Institute, which generally tend to favour, whereas our other friends at the other end of the House tend to cite Tufts and Jim Stanford. Therefore, we are consulting to figure out what is happening.
I would like to raise with the hon. member something that came from his predecessor's speech, the hon. member for Durham, who is back. We realize that it is part of the TPP. Data flows and services—",Liberal,LaSalle—Émard—Verdun,David Lametti,http://www.parl.gc.ca/MembersOfParliament/ProfileMP.aspx?Key=219811&Language=E
4678444,ca.proc.d.2016-05-12.8921053,2016-05-12,cedf1659-ebb1-4f26-b723-5c7c5353988b,214948,The Assistant Deputy Speaker (Mrs. Carol Hughes),,Government Orders,Business of Supply,Opposition Motion—Trans-Pacific Partnership,I just want to remind the member that he cannot say if another member is or is not in the House.,New Democratic Party,Algoma—Manitoulin—Kapuskasing,Carol Hughes,http://www.parl.gc.ca/MembersOfParliament/ProfileMP.aspx?Key=214948&Language=E
4678445,ca.proc.d.2016-05-12.8921056,2016-05-12,18e36567-4082-4ce3-a35b-d4aba65560ca,219811,Mr. David Lametti,,Government Orders,Business of Supply,Opposition Motion—Trans-Pacific Partnership,"Madam Speaker, data flows are an important part of the service industry, which our honoured friend has cited as an important part of the TPP. However, do our friends not have privacy concerns when this data flows out into other countries, which may or may not have privacy regimes that are as strong as ours in Canada?",Liberal,LaSalle—Émard—Verdun,David Lametti,http://www.parl.gc.ca/MembersOfParliament/ProfileMP.aspx?Key=219811&Language=E
4678446,ca.proc.d.2016-05-12.8921063,2016-05-12,55c46957-54e9-422a-8afd-7c709bcf16a0,218367,Mr. John Barlow,,Government Orders,Business of Supply,Opposition Motion—Trans-Pacific Partnership,"Madam Speaker, what we need to focus on is the Liberals continued consultation, their continued raising of these concerns that do not exist. 
I have consulted with farmers and ranchers in my riding, the Canadian Cattlemen's Association, the Canadian dairy farmers association, Alberta beef, Alberta dairy, and these groups are in support.
The Liberals say they are going around the country consulting with groups that are not in favour, but they need to show some leadership here. If they are trying to get consensus on something, they will be consulting from now until the end of time. It will not happen.
They need to say that there was an extensive consultation with the previous government as they negotiated this agreement and now they have consulted again. They have to show leadership and say they will never get consensus, but this is good for Canada and they should approve it.",Conservative,Foothills,John Barlow,http://www.parl.gc.ca/MembersOfParliament/ProfileMP.aspx?Key=218367&Language=E
4678447,ca.proc.d.2016-05-12.8921075,2016-05-12,95ed53a7-7538-4c0f-85a4-64af76065f95,218942,"Mr. Don Davies (Vancouver Kingsway, NDP)",,Government Orders,Business of Supply,Opposition Motion—Trans-Pacific Partnership,"Madam Speaker, just prior to the election the previous prime minister announced that if Canada ratified TPP, he would offer $4.3 billion of compensation to Canada's agricultural sector. Also, the Conservative cabinet announced that if TPP were signed, it would make a further $1 billion available in compensation to the auto sector. 
Taking those things together, it is quite obvious that his own Conservative Party recognized that over $5.3 billion of economic harm would be done to those two industries in Canada, unless the government was just giving money away, but I presume the reason it was giving compensation to the industries was to compensate them for the inevitable harm that would come to those industries as a result of TPP. 
Perhaps the hon. member could enlighten us and tell us why the former Conservative prime minister wanted to spend $5.3 billion of taxpayer money on those two sectors once we signed TPP.",New Democratic Party,Vancouver Kingsway,Don Davies,http://www.parl.gc.ca/MembersOfParliament/ProfileMP.aspx?Key=218942&Language=E
4678448,ca.proc.d.2016-05-12.8921085,2016-05-12,55c46957-54e9-422a-8afd-7c709bcf16a0,218367,Mr. John Barlow,,Government Orders,Business of Supply,Opposition Motion—Trans-Pacific Partnership,"Madam Speaker, I think my hon. colleague is being a little bit dramatic. This was not funding that said we knew this would have an impact. This was a safety net if anything were to happen, as a transition period as we go from the rules and regulations and the tariffs that are in place now to having those free trade agreements in place.
As I said in my speech, the information we have from very reputable think tanks and economists is that this could mean $15.9 billion to Canada's economy. 
Certainly there will be some situations in there with which we have to take some care, and that includes supply management. Representatives from the supply management industry came to us after this agreement was negotiated and said it was much better than anything they could have anticipated. They were very concerned about what sacrifices they would have to make as an industry.
Not only did we have that compensation package in place, but we now have a Liberal government that has removed that compensation package and has raised a great deal of fear within the supply management industry. ",Conservative,Foothills,John Barlow,http://www.parl.gc.ca/MembersOfParliament/ProfileMP.aspx?Key=218367&Language=E
4678449,ca.proc.d.2016-05-12.8921094,2016-05-12,95ed53a7-7538-4c0f-85a4-64af76065f95,218942,"Mr. Don Davies (Vancouver Kingsway, NDP)",,Government Orders,Business of Supply,Opposition Motion—Trans-Pacific Partnership,"Madam Speaker, I am pleased to split my time with the fabulous, hard-working member for Cowichan—Malahat—Langford.
When we talk trade in the House it always strikes me that we have two solitudes. One wants to approach trade from a position of jingoism and simplification and attack anybody who may want to question a particular trade deal as being “not interested” in trade, versus another approach to trade that values the concepts of consultation, of taking care in signing these large major agreements, and in making sure that there is a net benefit to Canada.
I would like to start my remarks today by assessing what the real state of affairs is around the impact of TPP today. There are a lot of exaggerated claims about what these trade agreements would do or would not do and there are some numbers, of course, that get generated.
The previous Conservative government liked to produce an economic impact assessment, keep it to itself, base it on completely wild assumptions like full employment and 100% capital reinvestment of all of the tariff savings back into the economy and all sorts of things that every reputable economist would tell us is just simply nonsense, and then just repeat those numbers.
Let us look at what the most recent numbers are, by sources that study these agreements, on the impact of TPP on Canada.
First of all I would like to point out that there is often confusion, particularly on the Conservative side of the House, when they talk about the size of the market of TPP. They often portray it as if signing this agreement would give us access to a market of so many billions of dollars and so many hundreds of millions of people, when in fact Canada already has access to those markets. The TPP would not give us new access. We already have access to these markets and we are already trading with them. 
Similarly, what is not pointed out enough is that of the 12 countries participating in the TPP, five of them already have free trade agreements, including Canada. We already trade with the United States on a free trade basis and with Mexico, Chile, and Peru. Those five countries make up over 80% of the GDP of this region already. What often is not said as well about the TPP is that 97% of Canadian exports entering TPP countries enter those markets tariff free today.
When we start assessing the impact of TPP, we have to put it in perspective but let us see what some reputable groups outside the House have to say.
The C.D. Howe Institute, no left-wing group here, has assessed the impact of TPP 10 years out as having a 0.6% boost to Canada's GDP. The World Bank has estimated that 10 years after TPP is signed it would have a 0.8% boost to Canada's GDP. The most recent study done by Tufts University's centre for global studies estimates it would be 0.28% boost to Canada's GDP 10 years out. If we average these three numbers, the consensus boost to the Canadian economy as a result of signing the TPP would be 0.56%.
In a $1.8 trillion economy, we will call it $2 trillion, that is $10 billion of GDP 10 years out. That is not nothing. That is important. However, clearly, on any rational assessment of the true state of affairs now and what the impact of TPP would be on GDP, it would not have the blockbuster impact touted by its most fervent boosters.
As a matter of fact, economists looking at the TPP also point out that the benefits of TPP would not flow uniformly among the 12 countries. They find that there would be negligible to negative impact on the United States and Canada as a result of this deal, when we look at a number of macroeconomic factors. Maybe that is why the two leading contenders for the U.S. president, Donald Trump and Hillary Clinton, are on record as opposing the TPP in the United States. 
They are joined by other people, and again, no left-wingers here. Jim Balsillie, one of Canada's premier entrepreneurs has called TPP an innovation killer for Canada. Nobel Prize-winning economist Joseph Stiglitz, as well, has said the TPP represents the worst trade deal negotiated in the globe today.
Let us talk about jobs. I was fortunate enough to be trade critic for the New Democratic Party for three years and I had the privilege of meeting and talking to many economists about their positions on trade. What I was told repeatedly is that the consensus in economics is that trade deals do not necessarily create jobs. There are many reasons, perhaps, to enter trade agreements, but job creation is not considered one of them by classical economics.
Generally, the consensus is that a trade deal may have a plus or minus 1% impact on jobs, depending on who the parties are and the terms of the deal. What trade deals do, however, is create job dislocation. In other words, some sectors benefit from the trade agreement and employment growth may go up and other sectors suffer damages by the trade agreement and lose employment. Therefore, we have to measure not only the quantitative aspect of job creation or loss but the types of jobs, because good jobs may be lost in one sector and lower-paying jobs may be increased in another sector. 
What is the assessment of TPP? It is that TPP is estimated to cost the Canadian economy 58,000 jobs. As I have been pointing out in the debate all day today, that is well known and acknowledged by the Conservatives, whose motion lies before the House, because they themselves told the Canadian public that if they signed the TPP, Canadian taxpayers would have to pay $5.3 billion, and that is not contingent upon losses like they said in other agreements. They would pay $5.3 billion to the agriculture and auto sectors in Canada to compensate them for the damage that even they acknowledged would happen to those two sectors. There is proof of that here.
I now want to talk about the auto sector. If we look at the actual provisions of the TPP, in the auto industry, as has been pointed out by my colleague from Windsor West today, this agreement was poorly negotiated in terms of protecting the Canadian auto sector, because the phase-out of tariffs among Canada and Malaysia and the United States differ.
The United States got a 25-year phase-out period for its auto tariffs. Malaysia got 12 years. Canada got five. Not only that, but the damage to the rules of origin provisions are even worse. Currently, for a car manufactured in North America to qualify for tariff removal between NAFTA countries, 65% of that car and the parts in it have to be made within that jurisdiction. What does the TPP say? It says 35%. That means a car made 65% in Malaysia or China can come into Canada tariff free. If anybody in the House thinks that cars coming into Canada tariff free are not going to damage auto production in Canada, then I want them to stand in the House and say so today, and we will see what happens in five years if this agreement is signed.
I will talk, as well, about agriculture. We all know that Australia and New Zealand were attacking Canada's supply-managed sector relentlessly throughout these negotiations. I will give credit, actually, to the Conservative government for holding firm on the supply-managed sector. However, again, the fact that $4.3 billion would have to be allocated to Canada's agricultural sector, including the supply-managed sector, tells us all we need to know about the impact of the TPP on the agriculture sector.
I want to talk about human rights, because that has not been mentioned enough in the House. Two of the countries that are partners in the TPP are Brunei and Vietnam. Brunei, last year, passed a form of sharia law that makes homosexuality and adultery crimes punishable by stoning to death. Vietnam today uses child labour, prison labour, and in some people's view, virtual slave labour, in addition to being a country that has no respect for democratic traditions whatsoever. Those are not the kinds of countries New Democrats say should be rewarded with economic preferences. 
Conservatives have said in the House that they want sanctions on Iran. As recently as last week, they were criticizing the Liberal government for warming relations with Iran. They say we should have sanctions, which is the opposite of preferential economic benefits. They want to punish Iran economically. Why? It is because the Conservatives do not like the politics of Iran. Why do they not say the same thing about the politics of Brunei? Let the Conservatives stand in the House and tell the GLBTQ community in this country that they should be sending economic privileges to a country where people will be put to death for their sexual preference.",New Democratic Party,Vancouver Kingsway,Don Davies,http://www.parl.gc.ca/MembersOfParliament/ProfileMP.aspx?Key=218942&Language=E
4678450,ca.proc.d.2016-05-12.8921250,2016-05-12,115aadf7-f4d7-4c9d-9537-860cf864ad0c,219641,"Mrs. Salma Zahid (Scarborough Centre, Lib.)",,Government Orders,Business of Supply,Opposition Motion—Trans-Pacific Partnership,"Madam Speaker, I am a strong advocate for free trade and a solid international economic presence.
 Given that approximately one in five jobs in Canada is export dependent, and that the NDP strongly supports the preservation and sustainability of Canadian jobs, I would like to ask the hon. member if he believes that Canada is a trading nation, and if so, whether he also agrees that we have a duty incumbent upon us to expand economic opportunities both domestically as well as internationally.",Liberal,Scarborough Centre,Salma Zahid,http://www.parl.gc.ca/MembersOfParliament/ProfileMP.aspx?Key=219641&Language=E
4678451,ca.proc.d.2016-05-12.8921261,2016-05-12,95ed53a7-7538-4c0f-85a4-64af76065f95,218942,Mr. Don Davies,,Government Orders,Business of Supply,Opposition Motion—Trans-Pacific Partnership,"Madam Speaker, of course the New Democrats believe in trade. Every single Canadian of every political persuasion believes in trade. It was only part of the chicanery, the demagoguery, over-simplification and, frankly, ideological simplification of the previous Conservative government when it wanted to turn the complex discussion of trade into one where either members supported the agreement the Conservatives signed or they were against trade. Canadians know that is nonsense, and that is why they booted them out of office.
For instance, the hon. member is a member of the Liberal Party, but the Liberals opposed the free trade agreement with the United States. They then said that they opposed NAFTA and said that if they won the election, they would rip up NAFTA, but they did not do that. 
 I would ask the member, does their opposition to those agreements mean that they were opposed to trade? Well, of course not. It meant that when there are complex agreements that are thousands of pages long, that have profound implications for our economy, we have to study them carefully and determine if they are of a net comprehensive value to Canada. Reasonable people can come to the conclusion that they do not, and the New Democrats believe that is the case with the TPP.",New Democratic Party,Vancouver Kingsway,Don Davies,http://www.parl.gc.ca/MembersOfParliament/ProfileMP.aspx?Key=218942&Language=E
4678452,ca.proc.d.2016-05-12.8921274,2016-05-12,96924c12-efff-4de2-9f9e-578fe5434342,217509,"Hon. Erin O'Toole (Durham, CPC)",,Government Orders,Business of Supply,Opposition Motion—Trans-Pacific Partnership,"Madam Speaker, I would like to thank my friend. I did enjoy time with him on the trade committee. I complimented him on having the NDP sign on to their first trade agreement in its history, the one with South Korea, and I know that was his influence.
There is something the member neglects to tell the House and Canadians when talking about trade. He quoted some modest GDP improvement numbers and said 0.5% GDP growth is not a blockbuster, and that sort of thing, and so I will pose the question I raised in my remarks.
What would happen if Canada did not sign on and our NAFTA partners were there? That would kill the auto sector. There would not be another dollar invested by North American or global manufacturers, because suddenly, our two NAFTA partners would have access to 800 million consumers, and Canadian operations would not. The member never talks about how our GDP would go down if suddenly Canada did not have preferred trade access with these countries. 
It is about getting a good deal, which I think the last government did. I would like the member to talk about whether it is an economic strategy to engage in navel-gazing and avoid trade with the rest of the world.",Conservative,Durham,Erin O'Toole,http://www.parl.gc.ca/MembersOfParliament/ProfileMP.aspx?Key=217509&Language=E
4678453,ca.proc.d.2016-05-12.8921290,2016-05-12,95ed53a7-7538-4c0f-85a4-64af76065f95,218942,Mr. Don Davies,,Government Orders,Business of Supply,Opposition Motion—Trans-Pacific Partnership,"Madam Speaker, first of all, my hon. colleague is incorrect. The NDP supported two trade agreements in the last Parliament, one with Jordan and one with South Korea.
I will grant that the member has a fair point. There is an argument to be made that if our NAFTA partners do sign the TPP and get preferential access to, say, the Japanese market, Canada, for purely defensive reasons, would be wise to join the TPP for that reason. It is one reason in the argument in favour of the TPP.
To counter that, I will repeat that if this agreement was good for the Canadian auto sector, why did the former prime minister in the last Parliament promise the auto sector $1 billion in compensation?
Also, as I said before, the different tariff phase-out periods, having the U.S. with 25 years and Canada with five years, may result in Canadian car manufacturers shifting their production to the U.S. to take advantage of those slower phase-out tariffs. It could be that the TPP does damage as well.",New Democratic Party,Vancouver Kingsway,Don Davies,http://www.parl.gc.ca/MembersOfParliament/ProfileMP.aspx?Key=218942&Language=E
4678454,ca.proc.d.2016-05-12.8921310,2016-05-12,c5b09363-414d-43b2-bc2c-274b997c8989,217263,"Ms. Jenny Kwan (Vancouver East, NDP)",,Government Orders,Business of Supply,Opposition Motion—Trans-Pacific Partnership,"Madam Speaker, I thank the member for Vancouver Kingsway for his comments. There is a lot of history there and knowledge as well.
I would like to the ask the member, as the health critic, what some of the concerns are that he may have with respect to the TPP on health implications, particularly with respect to pharmacare.",New Democratic Party,Vancouver East,Jenny Kwan,http://www.parl.gc.ca/MembersOfParliament/ProfileMP.aspx?Key=217263&Language=E
4678455,ca.proc.d.2016-05-12.8921321,2016-05-12,95ed53a7-7538-4c0f-85a4-64af76065f95,218942,Mr. Don Davies,,Government Orders,Business of Supply,Opposition Motion—Trans-Pacific Partnership,"Madam Speaker, there are two considerations.
First, the new intellectual property rules, everybody acknowledges, will delay the introduction of generics to market, which will no doubt have an impact on rising health care costs in Canada. Second, and this goes to my question earlier about the ISDS procedure, but ISDS under the TPP may result in companies being able to sue Canada for bringing in national programs, including perhaps a national pharmacare program. 
The Minister of International Trade says that CETA represents the gold standard in ISDS, which means the TPP represents the bronze standard. I do not think Canada should settle for bronze when it comes to a trade agreement.",New Democratic Party,Vancouver Kingsway,Don Davies,http://www.parl.gc.ca/MembersOfParliament/ProfileMP.aspx?Key=218942&Language=E
