basepk,hid,speechdate,pid,opid,speakeroldname,speakerposition,maintopic,subtopic,subsubtopic,speechtext,speakerparty,speakerriding,speakername,speakerurl
4674630,ca.proc.d.2016-06-02.8960632,2016-06-02,3176068f-62ee-4b2f-aacd-1131201c6db1,214707,The Speaker,,Routine Proceedings,Office of the Auditor General of Canada,,"I have the honour to lay upon the table the 2015-16 annual reports of the Office of the Auditor General of Canada on the Access to Information Act and the Privacy Act. These reports are deemed permanently referred to the Standing Committee on Access to Information, Privacy and Ethics. ",Liberal,Halifax West,Geoff Regan,http://www.parl.gc.ca/MembersOfParliament/ProfileMP.aspx?Key=214707&Language=E
4674631,ca.proc.d.2016-06-02.8960654,2016-06-02,07cf5767-802c-406c-92a7-7dc92af79b40,214668,"Mr. Kevin Lamoureux (Parliamentary Secretary to the Leader of the Government in the House of Commons, Lib.)",,Routine Proceedings,Government Response to Petitions,,"Mr. Speaker, pursuant to Standing Order 36(8), I have the honour to table, in both official languages, the government's response to four petitions.",Liberal,Winnipeg North,Kevin Lamoureux,http://www.parl.gc.ca/MembersOfParliament/ProfileMP.aspx?Key=214668&Language=E
4674632,ca.proc.d.2016-06-02.8960678,2016-06-02,031462db-8f61-48ed-bf9f-b033eb8312bb,224218,"Mr. Nathan Cullen (Skeena—Bulkley Valley, NDP)",,Routine Proceedings,Petitions,Palliative Care,"Mr. Speaker, I have a petition from a number of my constituents in northwestern British Columbia calling upon the government to initiate a national palliative care strategy.
 The petitioners have great concerns about the physician-assisted death legislation that, since the induction of this petition, has now passed through many stages of Parliament and in the Senate. They are concerned about the dignity of life. They are concerned that Canada still lacks a palliative care strategy so that we may care for our aged in their time of need. ",New Democratic Party,Skeena—Bulkley Valley,Nathan Cullen,http://www.parl.gc.ca/MembersOfParliament/ProfileMP.aspx?Key=224218&Language=E
4674633,ca.proc.d.2016-06-02.8960710,2016-06-02,eaa6694f-1e20-4aae-ad3b-e694b0e12c59,224170,"Ms. Elizabeth May (Saanich—Gulf Islands, GP)",,Routine Proceedings,Petitions,41st General Election,"Mr. Speaker, I am honoured to rise today to present two petitions.
The first is from petitioners across Canada calling on the government to pursue investigations to determine the illegal use of live calls or robocalls that interfered with Canada's electoral process in the 2011 election.",Green Party,Saanich—Gulf Islands,Elizabeth May,http://www.parl.gc.ca/MembersOfParliament/ProfileMP.aspx?Key=224170&Language=E
4674634,ca.proc.d.2016-06-02.8961226,2016-06-02,eaa6694f-1e20-4aae-ad3b-e694b0e12c59,224170,"Ms. Elizabeth May (Saanich—Gulf Islands, GP)",,Routine Proceedings,Petitions,Insecticides,"Mr. Speaker, the second petition is from people across Canada who are calling for our government, in the interest of protecting pollinators on this continent and elsewhere, to ban the use of neonicotinoid insecticides. ",Green Party,Saanich—Gulf Islands,Elizabeth May,http://www.parl.gc.ca/MembersOfParliament/ProfileMP.aspx?Key=224170&Language=E
4674635,ca.proc.d.2016-06-02.8960729,2016-06-02,07cf5767-802c-406c-92a7-7dc92af79b40,214668,"Mr. Kevin Lamoureux (Parliamentary Secretary to the Leader of the Government in the House of Commons, Lib.)",,Routine Proceedings,Questions on the Order Paper,,"Mr. Speaker, I ask that all questions be allowed to stand at this time.",Liberal,Winnipeg North,Kevin Lamoureux,http://www.parl.gc.ca/MembersOfParliament/ProfileMP.aspx?Key=214668&Language=E
4674636,ca.proc.d.2016-06-02.8960736,2016-06-02,3176068f-62ee-4b2f-aacd-1131201c6db1,214707,The Speaker,,Routine Proceedings,Questions on the Order Paper,,Is that agreed?,Liberal,Halifax West,Geoff Regan,http://www.parl.gc.ca/MembersOfParliament/ProfileMP.aspx?Key=214707&Language=E
4674637,ca.proc.d.2016-06-02.p4396359,2016-06-02,,,,intervention,Routine Proceedings,Questions on the Order Paper,, Agreed.,,,Some hon. members,
4674638,ca.proc.d.2016-06-02.8960868,2016-06-02,031462db-8f61-48ed-bf9f-b033eb8312bb,224218,"Mr. Nathan Cullen (Skeena—Bulkley Valley, NDP)",,Government Orders,Business of Supply,Opposition Motion—Special Committee on Electoral Reform," moved:
 That a Special Committee on electoral reform be appointed to identify and conduct a study of viable alternate voting systems to replace the first-past-the-post system, as well as to examine mandatory voting and online voting; 
 that the Committee be directed to issue an invitation to each Member of Parliament to conduct a town hall in their respective constituencies and provide the Committee with a written report of the input from their constituents to be filed with the Clerk of the Committee no later than November 1, 2016; 
 that the Committee be directed to take into account the applicable constitutional, legal and implementation parameters in the development of its recommendations; accordingly, the Committee should seek out expert testimony on these matters; 
 that the Committee be directed to consult broadly with relevant experts and organizations, take into consideration consultations that have been undertaken on the issue, examine relevant research studies and literature, and review models being used or developed in other jurisdictions; 
 that the Committee be directed to develop its consultation agenda, working methods, and recommendations on electoral reform with the goal of strengthening the inclusion of all Canadians in our diverse society, including women, Indigenous Peoples, youth, seniors, Canadians with disabilities, new Canadians, and residents of rural and remote communities; 
 that the Committee be directed to conduct a national engagement process that includes a comprehensive and inclusive consultation with Canadians, including through written submissions and online engagement tools; 
 that the Committee be composed of twelve (12) members of which five (5) shall be government members, three (3) shall be from the Official Opposition, two (2) shall be from the New Democratic Party, one (1) member shall be from the Bloc Québécois, and the Member for Saanich—Gulf Islands; 
 that changes in the membership of the Committee be effective immediately after notification by the Whip has been filed with the Clerk of the House; 
 that membership substitutions be permitted, if required, in the manner provided for in Standing Order 114(2); 
 that, with the exception of the Member for Saanich—Gulf Islands, all other members shall be named by their respective Whip by depositing with the Clerk of the House the list of their members to serve on the Committee no later than ten (10) sitting days following the adoption of this motion; 
 that the Committee be chaired by a member of the government party; that, in addition to the Chair, there be one (1) Vice-Chair from the Official Opposition and one (1) Vice-Chair from the New Democratic Party, and that, notwithstanding Standing Order 106(3), all candidates for the position of Chair or Vice-Chair from the Official Opposition shall be elected by secret ballot, and that each candidate be permitted to address the Committee for not more than three (3) minutes; 
 that the quorum of the Committee be as provided for in Standing Order 118, provided that at least four (4) members are present and provided that one (1) member from the government party and one (1) member from an opposition party are present; 
 that the Committee be granted all of the powers of a standing committee, as provided in the Standing Orders, as well as the power to travel, accompanied by the necessary staff, inside and outside of Canada; 
 that the Committee have the power to authorize video and audio broadcasting of any or all of its proceedings; and 
 that the Committee present its final report no later than December 1, 2016. 
Mr. Speaker, I am pleased to share my time with my colleague from Beloeil—Chambly today.
It is also a pleasure for me to speak to the motion. It is lengthy, but it is important, for many reasons. It is because of all of the issues that parliaments and governments face. Whether it is the economy, the environment, first nations, international relations, or war and peace, they all rest upon the foundation of our democracy, which is how Canadians vote governments in and out.
The motion that New Democrats have put forward today is to begin a process, in a fair and constructive way, to allow us to come to a fair and constructive result for Canadians, to modify it in an historic fashion. We have not to this point ever altered our democracy or changed the way that Canadians go forward and express their hopes and wishes to this fundamental nature.
 The commitment from the Prime Minister after the last election was that it would be the last one run under the unfair first past the post system. New Democrats have long advocated for this position, as have our colleagues from the Green Party. We believe this is an opportunity that we must take and we must get right. 
The essence of what New Democrats have proposed, and we put this to the government and to the public back in February, was to construct a committee that is charged with this historic task based essentially on the will of Canadians. It was to take the results of the last election, which was just eight months ago, and construct the committee based on how Canadians expressed their desire for how Parliament would look. 
May I be so bold as to suggest that a good electoral system would also be somewhat proportional, in that it would reflect the will of Canadians. This is the case in most successful democracies around the world. They use some element of proportionality in their voting, so that when a party acquires approximately 20% of the vote, their parliament is made up of about 20% of people from that party. If the party gets 40%, then it is 40%, and so on. 
What we have right now under first past the post is a system whereby this majority government, the previous majority government, and many in our past, were able to essentially obtain 100% of the power while acquiring less than 40% of support from Canadians, and that is of those who participated. When we look at the broad section of Canadians writ large, it can actually come down to 25%, or less, of voting-age Canadians voting in a government that then acquires 100% of the ability to pass whatever legislation it wants. It can do that sometimes in a draconian manner, by instituting closure on debate, shutting down committees, or by using quite a bit of force in the Westminister parliamentary system that we have adopted.
At its core, the idea for us is to include a notion of sanctity in what we are doing. It is that no one party in this place can act unilaterally when changing our voting system. We think that would be a very bad thing. There were some precedents in Canadian history that the government would never change the voting system in any fundamental way without the support of another party in Parliament. We do not want those changes to be partisan in nature, in a sense favouring one party over another. Canadians would look upon that with suspicion. When the previous government moved what it called the fair, we called it unfair, elections act, it moved it without the support of any other party in the House. In fact, in our view and in the view of many Canadians, it sought to disenfranchise very particular groups of Canadians from voting by requiring new voter identification, which Elections Canada said was not necessary. That was an unfortunate breaking of precedents. We do not want to repeat that. 
The new government has said it does not wish to go down that path. The committee, as we proposed it, would ensure that would not be possible. The original proposal from the Liberals in striking this committee would have allowed them to have a majority of seats on the committee, and therefore a majority ability to pass any reforms they want without the support of any opposition party. 
The committee, as we have constructed it, based upon the will of Canadians, would require the parties to work together. I know that might be a radical concept. There is often a lot of division and partisanship. Partisanship is a part of the House of Commons. It is a part of electoral politics, and, if done well, with passion and integrity, it can be of benefit to the country. 
However, partisanship for its own sake often undermines good ideas. It often undermines the integrity of this place. What we hope for, and what we have constructed in this committee, is to allow other parties to require other parties to seek support from one another, to say that no one party in this place has all of the right ideas for the problems that we are seeking to fix, and that the challenges that are in our electoral system will be fixed by us collectively, together. That is what Canadians want, that is what we believe Canadians need. The committee system that we have put forward allows us that, because if the process is fair it greatly improves the chances that the outcome will be fair, but if the process is skewed and biased, then unfortunately there is too great a chance that outcome would also be skewed and biased.
There are so many groups across the country that have been working diligently, some of them for decades, on improving our electoral system in Canada. I am thinking of Fair Vote Canada, Leadnow, the Broadbent Institute, the Dogwood Initiative, and Avaaz. Even columnists from The Globe and Mail, to Andrew Coyne, to other left wing radicals as the Conservatives like to say, have been long urging us to evolve our electoral system into this century, even evolve it from the last century.
It seems to me that there is an opportunity in front of us to do something novel, to be innovative, and to be courageous about the way we go about this conversation, while recognizing our own interests in this conversation, to put the interests of Canadians first, and to allow Canadians to have a greater voice in this. The committee would seek to hear from traditionally unrepresented and under-represented groups, such as first nations, women, young people, people living in poverty, and people with disabilities, who have almost in all cases in every election been dramatically under-represented at the polls and in the representation that we have in the House of Commons.
There is no silver bullet in this conversation. There is no perfect voting system out there that will achieve all things for all people. We understand that. However, certainly we can improve on a voting system that was invented before we invented the lightbulb and on a voting system that allows 39% of voters to produce 100% of the power. Certainly we can diminish that when voters go into the ballot box they are told they simply have to vote strategically, that they should not choose their first choice but their second or third choice in order to stop the thing they fear most. We believe that when voters step into the ballot box it is an expression of hope for the future, it is their will for the future, that they want to express to themselves, to their neighbours, and to their family what they want to see in the world, what kind of government they would like to see. A good electoral system and a good voting process allows that connection to be much stronger than what we have here today.
I represent northwestern British Columbia, an incredibly beautiful and powerful place. One of the great advantages I have in this honour of representing Skeena—Bulkley Valley is I often get to attend first nations events, ceremonies, and traditions. At one event, I was with the Haisla in Kitimat. During the course of this very long, important naming feast when a number of Haisla were acquiring important names, one of the elders got up to speak. Slowly, as he was progressing through his comments, one after another Haisla from his house group got up to stand very quietly and respectfully behind him. After a certain amount of time there must have been more than 100 or so folks standing behind this elder. I turned to a friend of mine who is Haisla and said, “I don't understand fully what's happening here, what this represents.” She said, “In our tradition, when his house stands behind him, what they're saying is that all of the words he speaks, it is as if they have spoken. The commitments he is making, they also make.”
 I often think what if we held that type of tradition here in this place, that first and foremost we always sought to represent the voices of those who stand behind us from all of the parts of this country that we represent, with the divergent views that we represent, those of us wishing to express the best of ourselves, the best of this country? I think that would allow us to avoid some of the traps we fall into as politicians, as members of Parliament, where that high road is so hard to maintain, that road of speaking with integrity as our friends, our families, and neighbours would like to speak with and do speak with, because that is at the heart of what this country is: a conversation about respect and about differences. The committee process we have put forward today, and the eventual result in a better electoral system, is an effort to honour that, to respect the very best of this country.",New Democratic Party,Skeena—Bulkley Valley,Nathan Cullen,http://www.parl.gc.ca/MembersOfParliament/ProfileMP.aspx?Key=224218&Language=E
4674639,ca.proc.d.2016-06-02.8961103,2016-06-02,0fd242c0-71bc-4c1b-a4e4-609a396eca76,214691,"Mr. Mark Holland (Parliamentary Secretary to the Minister of Democratic Institutions, Lib.)",,Government Orders,Business of Supply,Opposition Motion—Special Committee on Electoral Reform,"Mr. Speaker, I thank the member opposite for his comments and for his efforts in bringing forward the opposition motion today.
In his comments he talked about the need for parties to work together on this issue. I could not agree more. I think when we are working on modernizing our electoral system and taking advantage of this opportunity to bring our electoral system into the 21st century, it will require the input and participation of all parties to get there. I commend the efforts of the member today to try to move this process forward.
I am interested in his comments. He talked about the importance of the committee reaching out to constituencies that are not traditionally engaged, people who feel disenfranchised currently within the existing system. He talked about seniors, the disabled, aboriginal people, people who were not seen voting in large numbers, young people.
What are his thoughts about how the committee might reach out to some of those groups, engage them in this process, and ensure their voices are heard?",Liberal,Ajax,Mark Holland,http://www.parl.gc.ca/MembersOfParliament/ProfileMP.aspx?Key=214691&Language=E
4674640,ca.proc.d.2016-06-02.8961127,2016-06-02,031462db-8f61-48ed-bf9f-b033eb8312bb,224218,Mr. Nathan Cullen,,Government Orders,Business of Supply,Opposition Motion—Special Committee on Electoral Reform,"Mr. Speaker, I thank my friend from Ajax, the parliamentary secretary, for his comments and his efforts over the last number of months in trying to work with parliamentarians, as I do with my colleagues in the Conservative Party, the Green Party, and the Bloc Québécois to move this forward. 
One of our challenges is that it has been a number of months. The electoral reform needs to work with some sense of urgency, simply because Elections Canada needs to have in place, well before the next election, any changes that are coming to the voting system in order first to inform Canadians and also to conduct the vote fairly.
To the specific question of the hon. member about those groups that are not often reached by parliamentarians in traditional politics, I think of social media. I think there should be reaching out and certainly the committee has to travel. The committee has to get out of Ottawa, get out of the bubble and hear from Canadians, and not just those with a vested interest in the voting system, but those who care to participate more fully in our democracy, a number of the groups that he and I both just mentioned.",New Democratic Party,Skeena—Bulkley Valley,Nathan Cullen,http://www.parl.gc.ca/MembersOfParliament/ProfileMP.aspx?Key=224218&Language=E
4674641,ca.proc.d.2016-06-02.8961149,2016-06-02,a9fb83d8-ba9f-4794-9229-1fb53e7a1a1d,218338,"Ms. Rachael Harder (Lethbridge, CPC)",,Government Orders,Business of Supply,Opposition Motion—Special Committee on Electoral Reform,"Mr. Speaker, during the hon. member's speech, he said, “the heart of this country is conversation”. In his answer now he said that we need to get out of the Ottawa bubble and we need to hear from Canadians. I could not agree with the member more. We absolutely need to hear from Canadians.
In my estimation, the best way to hear from Canadians would be through holding a referendum. This seems like a way that we would be able to hear the voice of every single Canadian across this country from coast to coast to coast.
I am curious to hear whether or not the member would agree with me. Would he see the value in holding a national referendum?",Conservative,Lethbridge,Rachael Harder,http://www.parl.gc.ca/MembersOfParliament/ProfileMP.aspx?Key=218338&Language=E
4674642,ca.proc.d.2016-06-02.8961162,2016-06-02,031462db-8f61-48ed-bf9f-b033eb8312bb,224218,Mr. Nathan Cullen,,Government Orders,Business of Supply,Opposition Motion—Special Committee on Electoral Reform,"Mr. Speaker, I very much appreciate the sentiment for what many Conservatives and many others have called for, around the referendum. I think at its core it is a question about validity. Is what is produced valid and is it seen by Canadians as valid? A referendum is one instrument that can be used to validate or reject a proposal that is put forward by Parliament.
The challenge is that there is a notion of mandate. When governments get elected, as the previous Conservatives were elected, whenever they moved forward on a promise that was made in the election, they would say they had a mandate to do this and did not take it back to a referendum. Nor did the Conservatives go to a referendum when they moved their changes to the Electoral Act, so it is a little strange now that they are asking for a referendum.
I think if the process is sound, if Canadians see it and feel it is valid, then the energy around a referendum may shift. I have mused about this at various times because a referendum often faces the challenge of the fear of the unknown. People will reject an idea when they do not understand fully or are worried about what its consequences might be. 
However, there could be a notion, as New Zealand did, for example, of running a new electoral system for a couple of elections and then giving people the option at that point to say they do not like what this has done for our Parliament, for the way we work, and they would like to return to what they had before. I think it is a valid option that other countries—",New Democratic Party,Skeena—Bulkley Valley,Nathan Cullen,http://www.parl.gc.ca/MembersOfParliament/ProfileMP.aspx?Key=224218&Language=E
4674643,ca.proc.d.2016-06-02.8961216,2016-06-02,02c2cb20-f27d-46a5-8e78-ab4b405bf07b,214864,The Deputy Speaker,,Government Orders,Business of Supply,Opposition Motion—Special Committee on Electoral Reform,"Questions and comments, the hon. member for Saanich—Gulf Islands.",Conservative,Simcoe North,Bruce Stanton,http://www.parl.gc.ca/MembersOfParliament/ProfileMP.aspx?Key=214864&Language=E
4674644,ca.proc.d.2016-06-02.8961221,2016-06-02,eaa6694f-1e20-4aae-ad3b-e694b0e12c59,224170,"Ms. Elizabeth May (Saanich—Gulf Islands, GP)",,Government Orders,Business of Supply,Opposition Motion—Special Committee on Electoral Reform,"Mr. Speaker, I thank my friend from Skeena—Bulkley Valley for bringing forward a motion today that allows us to talk about how we can begin a process as we intend to continue a process in a non-partisan way, seeking what is best for all Canadians.
In his motion he suggests we will be looking at research. There is an astonishing amount of research that allows us to understand that changing our voting system is not a matter of opinion, that there is solid empirical evidence.
 Arend Lijphart is a professor at the University of California, San Diego. In his research, 36 democracies were surveyed and he came to a conclusion. This conclusion was that those democracies that have consensus-based, such as proportional representation, voting systems, actually have a stronger, better record with “regard to effective policy making” and the quality of democracy compared to majoritarian systems. 
I put to the member, can we bring such experts to the committee?",Green Party,Saanich—Gulf Islands,Elizabeth May,http://www.parl.gc.ca/MembersOfParliament/ProfileMP.aspx?Key=224170&Language=E
