basepk,hid,speechdate,pid,opid,speakeroldname,speakerposition,maintopic,subtopic,subsubtopic,speechtext,speakerparty,speakerriding,speakername,speakerurl
4681675,ca.proc.d.2016-09-30.9103981,2016-09-30,26a7c39b-6a77-446a-8986-1d3086f156fe,220480,"Mrs. Shannon Stubbs (Lakeland, CPC)",,Oral Questions,Natural Resources,,"Madam Speaker, the Pacific NorthWest LNG project is a $36-billion investment that would create thousands of well-paying jobs and allow Canada to export clean energy to the world.
Today Canadians see the news that the project's proponent is considering selling. In the spring, we warned the Liberals that delaying the rigorous assessment process longer would put the project at risk. While the Liberals held up the approval process, did they know the project's investors were considering getting out?",Conservative,Lakeland,Shannon Stubbs,http://www.parl.gc.ca/MembersOfParliament/ProfileMP.aspx?Key=220480&Language=E
4681676,ca.proc.d.2016-09-30.9103985,2016-09-30,cee27afa-cdf8-4e99-ab22-22290f86aa3a,214082,"Hon. Catherine McKenna (Minister of Environment and Climate Change, Lib.)",,Oral Questions,Natural Resources,,"Madam Speaker, unlike the party opposite, we understand that the only way resources will get to market in the 21st century is if we can get a balance between the environment and the economy.
We did a review. We spent the time necessary. We have conditions that are reasonable. I can quote from many different people who acknowledge that these are conditions that are normal with any project. They are conditions that are responsible. Really, it is up to the proponent to decide, and right now the issue is low commodity prices.",Liberal,Ottawa Centre,Catherine McKenna,http://www.parl.gc.ca/MembersOfParliament/ProfileMP.aspx?Key=214082&Language=E
4681677,ca.proc.d.2016-09-30.9103987,2016-09-30,26a7c39b-6a77-446a-8986-1d3086f156fe,220480,"Mrs. Shannon Stubbs (Lakeland, CPC)",,Oral Questions,Natural Resources,,"Madam Speaker, time is of the essence for LNG, but the Liberals added barriers to the process at the worst possible time. The Pacific NorthWest LNG project is supported by the vast majority of local first nations, the City of Fort St. John, the BC Chamber of Commerce, and the Government of B.C. It is important to all of Canada. Approval is one thing; getting it built is another.
Are the Liberals working with the proponents to ensure that none of the conditions are permanent roadblocks so the project can get started and Canadians can get back to work?",Conservative,Lakeland,Shannon Stubbs,http://www.parl.gc.ca/MembersOfParliament/ProfileMP.aspx?Key=220480&Language=E
4681678,ca.proc.d.2016-09-30.9103989,2016-09-30,cee27afa-cdf8-4e99-ab22-22290f86aa3a,214082,"Hon. Catherine McKenna (Minister of Environment and Climate Change, Lib.)",,Oral Questions,Natural Resources,,"Madam Speaker, we believe in rigorous environmental assessments, and we believe that what we have done has paved the way for the project to go ahead in a sustainable way. Once again, it is up to the proponents to determine if the economic conditions are there to go ahead.
 I can read from a number of different people, including the CEO of the Business Council of British Columbia:
 This decision paves the way for Canada to compete in the international LNG market while continuing our climate leadership on a global scale. 
",Liberal,Ottawa Centre,Catherine McKenna,http://www.parl.gc.ca/MembersOfParliament/ProfileMP.aspx?Key=214082&Language=E
4681679,ca.proc.d.2016-09-30.9103992,2016-09-30,a71a1741-7ff2-4246-b0da-4622e96b10cf,217230,"Mr. Guy Caron (Rimouski-Neigette—Témiscouata—Les Basques, NDP)",,Oral Questions,Health,,"Madam Speaker, when the Liberals took office, they said that the one-way conversations with the provinces were over. However, from what we have been hearing about the health transfer negotiations, it seems nothing has really changed.
The Quebec health minister thinks that the federal government's approach is a trap. Isn't that the truth. The Liberals are trying to sugar-coat it, but they are offering the provinces the same $36-billion cut to federal health transfers that the Conservatives before them were offering.
Can the minister explain the difference between the Conservatives' health care cuts and the Liberals'?",New Democratic Party,Rimouski-Neigette—Témiscouata—Les Basques,Guy Caron,http://www.parl.gc.ca/MembersOfParliament/ProfileMP.aspx?Key=217230&Language=E
4681680,ca.proc.d.2016-09-30.9103995,2016-09-30,350c31fd-6260-4c63-bd17-0746cb6f4120,214328,"Hon. Jane Philpott (Minister of Health, Lib.)",,Oral Questions,Health,,"Madam Speaker, the difference is that our government is working hard with the provinces and territories. We are having excellent discussions with my counterparts across the country. Yesterday, I spoke to the Quebec and Ontario health ministers. We will continue to work together.
I would like to remind members that the Canada health transfer is going to increase by over $1 billion next year, bringing it up to more than $37 billion. ",Liberal,Markham—Stouffville,Jane Philpott,http://www.parl.gc.ca/MembersOfParliament/ProfileMP.aspx?Key=214328&Language=E
4681681,ca.proc.d.2016-09-30.9103998,2016-09-30,95ed53a7-7538-4c0f-85a4-64af76065f95,218942,"Mr. Don Davies (Vancouver Kingsway, NDP)",,Oral Questions,Health,,"Madam Speaker, yesterday the Minister of Health called her cut to the health care escalator reasonable. 
The Liberals used different adjectives when this cut was first announced by Stephen Harper. The member for Vancouver Centre, who was the Liberal health critic, said it was walking away from medicare. The member for Toronto—St. Paul's, now a Liberal cabinet minister, said it would leave Canadians “out in the cold”. The member for Ottawa South called the Conservatives' approach “unconscionable and indefensible”.
How does the minister explain to Canadians this blatant, undeniable reversal?",New Democratic Party,Vancouver Kingsway,Don Davies,http://www.parl.gc.ca/MembersOfParliament/ProfileMP.aspx?Key=218942&Language=E
4681682,ca.proc.d.2016-09-30.9104000,2016-09-30,350c31fd-6260-4c63-bd17-0746cb6f4120,214328,"Hon. Jane Philpott (Minister of Health, Lib.)",,Oral Questions,Health,,"Madam Speaker, this is a government that is interested in collaborating with all of our partners across the country. I will remind the member opposite to clarify something that he said yesterday. He talked about health care spending increasing. In fact, according to the Canadian Institute for Health Information, across this country annual health care spending has declined by an average of 0.6% since 2011. That is in the context of the Canadian health transfer increasing by 6%.
We are going to increase it next year. There will be more than $1 billion extra added to the Canada health transfer. In addition to that, there will be new investments in the areas important to Canadians.",Liberal,Markham—Stouffville,Jane Philpott,http://www.parl.gc.ca/MembersOfParliament/ProfileMP.aspx?Key=214328&Language=E
4681683,ca.proc.d.2016-09-30.9104004,2016-09-30,16ec30ba-16f2-4777-ab8d-db372238e239,217605,"Mrs. Karen Vecchio (Elgin—Middlesex—London, CPC)",,Oral Questions,Ethics,,"Madam Speaker, last fall, the minister disclosed that he had a personal relationship with the Irvings. The Ethics Commissioner has banned him from any dealings with the Irvings. Apparently he does not think it applies to cocktails with Irving lawyers and lobbyists. Given that the minister is in charge of all litigation involving the government, could the minister tell us how many ongoing cases the federal government has with Irving or with Cox &amp; Palmer?",Conservative,Elgin—Middlesex—London,Karen Vecchio,http://www.parl.gc.ca/MembersOfParliament/ProfileMP.aspx?Key=217605&Language=E
4681684,ca.proc.d.2016-09-30.9104007,2016-09-30,7e23c9e2-cce8-4cd0-b5ed-200a809748cb,220018,"Mr. Serge Cormier (Parliamentary Secretary to the Minister of Fisheries, Oceans and the Canadian Coast Guard, Lib.)",,Oral Questions,Ethics,,"Madam Speaker, Canadians expect our ministers and MPs to adhere to very high ethical standards.
I therefore invite all opposition members to familiarize themselves with the document tabled in the House today. It clearly indicates that the minister's participation in the event is not a problem. The minister took it upon himself to seek the Ethics Commissioner's advice about the invitation. As everyone can see, her answer was very clear: the minister's attendance at the event is not a problem. ",Liberal,Acadie—Bathurst,Serge Cormier,http://www.parl.gc.ca/MembersOfParliament/ProfileMP.aspx?Key=220018&Language=E
4681685,ca.proc.d.2016-09-30.9104009,2016-09-30,16ec30ba-16f2-4777-ab8d-db372238e239,217605,"Mrs. Karen Vecchio (Elgin—Middlesex—London, CPC)",,Oral Questions,Ethics,,"Madam Speaker, the Minister of Fisheries, Oceans and the Canadian Coast Guard recently stated, “law firms are not able to confirm whether any person or company is a client, as such matters are confidential”. 
An easy Google search revealed that Cox &amp; Palmer represents the Irvings. When did the minister request a ruling from the Ethics Commissioner, and at that time, did he disclose that Cox &amp; Palmer represents the Irvings?",Conservative,Elgin—Middlesex—London,Karen Vecchio,http://www.parl.gc.ca/MembersOfParliament/ProfileMP.aspx?Key=217605&Language=E
4681686,ca.proc.d.2016-09-30.9104011,2016-09-30,7e23c9e2-cce8-4cd0-b5ed-200a809748cb,220018,"Mr. Serge Cormier (Parliamentary Secretary to the Minister of Fisheries, Oceans and the Canadian Coast Guard, Lib.)",,Oral Questions,Ethics,,"Madam Speaker, once again, I would invite the opposition members to consult the document that was tabled in the House, which states very clearly that the minister can attend the event.
This is an annual event organized by a law firm during which guests can meet with members of Toronto's business community. The minister has absolutely no access to the client lists of Canadian law firms, which they cannot legally disclose.
Once again, the minister got the Ethics Commissioner's permission to attend the event.",Liberal,Acadie—Bathurst,Serge Cormier,http://www.parl.gc.ca/MembersOfParliament/ProfileMP.aspx?Key=220018&Language=E
4681687,ca.proc.d.2016-09-30.9104013,2016-09-30,61c83e21-f9a3-4e4b-b881-4b2d1ce33c43,216661,"Mr. John Brassard (Barrie—Innisfil, CPC)",,Oral Questions,Ethics,,"Madam Speaker, moments ago the Liberal House leader tabled only one email of a string of several between the Minister of Fisheries and the Ethics Commissioner concerning his attendance at a law firm representing the Irvings. When will the Liberals table all emails and all documents between the minister and the commissioner? When will they tell the House the truth, and what is the minister hiding?",Conservative,Barrie—Innisfil,John Brassard,http://www.parl.gc.ca/MembersOfParliament/ProfileMP.aspx?Key=216661&Language=E
4681688,ca.proc.d.2016-09-30.9104016,2016-09-30,7e23c9e2-cce8-4cd0-b5ed-200a809748cb,220018,"Mr. Serge Cormier (Parliamentary Secretary to the Minister of Fisheries, Oceans and the Canadian Coast Guard, Lib.)",,Oral Questions,Ethics,,"Madam Speaker, once again, I would invite the opposition members to consult the document that was tabled in the House, in which the Ethics Commissioner states very clearly that the minister's participation in the event is perfectly acceptable.
I wonder if the members opposite are calling into question the work and ethics of the Ethics Commissioner, who gave the minister permission to participate in the event.
The minister will continue to participate in events where he can promote the interests of Atlantic Canada and the rest of the country.",Liberal,Acadie—Bathurst,Serge Cormier,http://www.parl.gc.ca/MembersOfParliament/ProfileMP.aspx?Key=220018&Language=E
4681689,ca.proc.d.2016-09-30.9104020,2016-09-30,9fe7bceb-dae2-4f26-b87b-2de1f38b4b84,217920,"Mr. Pierre Paul-Hus (Charlesbourg—Haute-Saint-Charles, CPC)",,Oral Questions,Ethics,,"Madam Speaker, the Minister of Fisheries confirmed that he will be the guest of honour at a cocktail party organized by the law firm that represents the Irving family.
Yes, the minister checked with the Ethics Commissioner, and the media is reporting that the minister provided some information. However, did he provide all the information? For instance, did he indicate that the law firm hosting the event represents the Irving family? We do not in any way question the work of the Ethics Commissioner, but we do wonder about what the minister told the Ethics Commissioner.
Did the minister indicate that the event is being hosted by the law firm that represents the Irvings?",Conservative,Charlesbourg—Haute-Saint-Charles,Pierre Paul-Hus,http://www.parl.gc.ca/MembersOfParliament/ProfileMP.aspx?Key=217920&Language=E
4681690,ca.proc.d.2016-09-30.9104022,2016-09-30,7e23c9e2-cce8-4cd0-b5ed-200a809748cb,220018,"Mr. Serge Cormier (Parliamentary Secretary to the Minister of Fisheries, Oceans and the Canadian Coast Guard, Lib.)",,Oral Questions,Ethics,,"Madam Speaker, I will repeat myself, because this is important. The minister got the green light from the Ethics Commissioner to attend this event.
They want to talk about it, let us talk about it. The interim Conservative leader charged taxpayers nearly $10,000 to stay in Ottawa while she was living in an official residence, also paid for by the public, according to records from the House of Commons. If they have a letter or document stating this, I would love to see it.",Liberal,Acadie—Bathurst,Serge Cormier,http://www.parl.gc.ca/MembersOfParliament/ProfileMP.aspx?Key=220018&Language=E
4681691,ca.proc.d.2016-09-30.9104025,2016-09-30,f40d602c-1ae6-414e-bac3-23a2f31f1cdf,217188,"Ms. Linda Duncan (Edmonton Strathcona, NDP)",,Oral Questions,The Environment,,"Madam Speaker, the Minister of Environment told CBC that she approved the Pacific NorthWest LNG project because measures will be taken to protect salmon spawning areas. The trouble is, these salmon do not spawn at the mouth of the river. What is actually threatened are juvenile salmon in what DFO has called one of the largest and most diverse wild salmon watersheds in the world.
How can Canadians have confidence that the minister's measures will actually protect the environment and our salmon when she does not even know where salmon spawn?",New Democratic Party,Edmonton Strathcona,Linda Duncan,http://www.parl.gc.ca/MembersOfParliament/ProfileMP.aspx?Key=217188&Language=E
4681692,ca.proc.d.2016-09-30.9104028,2016-09-30,cee27afa-cdf8-4e99-ab22-22290f86aa3a,214082,"Hon. Catherine McKenna (Minister of Environment and Climate Change, Lib.)",,Oral Questions,The Environment,,"Madam Speaker, our government makes decisions based on science and evidence, and we rely on our experts across government, who have been working on this file for the past three years. I apologize if I misspoke, but the reality is we rely on our expert public servants who are scientists to make decisions, and the 190 responsible conditions were based on that science.",Liberal,Ottawa Centre,Catherine McKenna,http://www.parl.gc.ca/MembersOfParliament/ProfileMP.aspx?Key=214082&Language=E
4681693,ca.proc.d.2016-09-30.9104032,2016-09-30,363e30d6-e47b-4c39-91ad-667deb63009c,219399,"Ms. Sheila Malcolmson (Nanaimo—Ladysmith, NDP)",,Oral Questions,The Environment,,"Madam Speaker, if the environment minister were standing up for the environment instead of paving the way for development, we would all feel better. 
On Wednesday, the Union of BC Municipalities passed two resolutions calling on the government to deal with an improved oil spill response in the marine environment, but the Liberals seem to be in favour of tanker increases that will further threaten those coasts. We have a continued legacy of serious gaps in our oil spill response capacity. Local governments are alarmed. Our local coastal environment and economy are at risk. 
I want to know what the government will do.",New Democratic Party,Nanaimo—Ladysmith,Sheila Malcolmson,http://www.parl.gc.ca/MembersOfParliament/ProfileMP.aspx?Key=219399&Language=E
4681694,ca.proc.d.2016-09-30.9104034,2016-09-30,bc2e82f3-02f1-46e2-b9be-7d5f04ddddc9,214106,"Hon. Marc Garneau (Minister of Transport, Lib.)",,Oral Questions,The Environment,,"Madam Speaker, Canada is very much focused on improving marine safety in our country. In fact, it was part of my mandate letter. I have been working with my colleagues from fisheries, from the environment, and from other portfolios to make sure that we in Canada will not only have proper marine safety measures put in place but that we will improve our capability to respond to spills on all of our three coasts.",Liberal,Notre-Dame-de-Grâce—Westmount,Marc Garneau,http://www.parl.gc.ca/MembersOfParliament/ProfileMP.aspx?Key=214106&Language=E
4681695,ca.proc.d.2016-09-30.9104036,2016-09-30,7bb531cc-945d-41fb-bd88-3e7bdfefa350,219415,"Mr. Anthony Housefather (Mount Royal, Lib.)",,Oral Questions,The Environment,,"Madam Speaker, the UN Civil Aviation Organization, the UN agency responsible for aviation, has its head office in Montreal, a source of pride to all Montrealers.
Montreal is also hosting that organization's 39th triennial assembly, which began on September 27.
Can the Minister of Transport tell us about some of the discussions taking place at the assembly regarding greenhouse gas emissions and the role our government is playing on this critical issue?",Liberal,Mount Royal,Anthony Housefather,http://www.parl.gc.ca/MembersOfParliament/ProfileMP.aspx?Key=219415&Language=E
4681696,ca.proc.d.2016-09-30.9104039,2016-09-30,bc2e82f3-02f1-46e2-b9be-7d5f04ddddc9,214106,"Hon. Marc Garneau (Minister of Transport, Lib.)",,Oral Questions,The Environment,,"Madam Speaker, I thank my colleague from Mount Royal for his question.
The Government of Canada is proposing concrete measures to reduce or limit greenhouse gas emissions in the international aviation sector. We are proud of our role. I was actually there for the opening of the ICAO assembly, where I gave a speech and met with my international counterparts. We believe it is extremely important for all 191 countries to reach an agreement to limit greenhouse gases, and Canada has an important role to play.",Liberal,Notre-Dame-de-Grâce—Westmount,Marc Garneau,http://www.parl.gc.ca/MembersOfParliament/ProfileMP.aspx?Key=214106&Language=E
4681697,ca.proc.d.2016-09-30.9104041,2016-09-30,ad4032f2-6bb1-497b-b146-f321cfb71ba9,218112,"Hon. Pierre Poilievre (Carleton, CPC)",,Oral Questions,Health,,"Madam Speaker, almost one year ago Ottawa's regional minister slammed on the brakes on plans for a new Civic Hospital in her own riding, because, we were told, hospital construction would interfere with valuable climate change research. Yet a report posted on the environment commissioner's website confirms that all the research happening on the land will be done at least five years before shovels even go in the ground for the new hospital.
Did the member of Parliament for the area and the environment minister read this information before she decided to block the construction of a hospital in her own riding for at least a year?",Conservative,Carleton,Pierre Poilievre,http://www.parl.gc.ca/MembersOfParliament/ProfileMP.aspx?Key=218112&Language=E
4681698,ca.proc.d.2016-09-30.9104047,2016-09-30,83cd3ab5-7dc7-414e-ab8b-e0dbc16b4c4a,214327,"Hon. Mélanie Joly (Minister of Canadian Heritage, Lib.)",,Oral Questions,Health,,"Madam Speaker, we are committed to a state-of-the-art hospital centrally located in Ottawa. 
We understand the need of the committee to make a decision quickly. Unlike the past government, this important decision cannot be taken behind closed doors. We really believe in a transparent and rigorous process, and that is why I asked the NCC to lead a site review process. I understand that the people in Ottawa are getting involved in this important public consultation process. 
I am confident in the NCC's ability to lead a thorough study to provide the government with—",Liberal,Ahuntsic-Cartierville,Mélanie Joly,http://www.parl.gc.ca/MembersOfParliament/ProfileMP.aspx?Key=214327&Language=E
4681699,ca.proc.d.2016-09-30.9104050,2016-09-30,cedf1659-ebb1-4f26-b723-5c7c5353988b,214948,The Assistant Deputy Speaker (Mrs. Carol Hughes),,Oral Questions,Health,,The hon. member for Carleton.,New Democratic Party,Algoma—Manitoulin—Kapuskasing,Carol Hughes,http://www.parl.gc.ca/MembersOfParliament/ProfileMP.aspx?Key=214948&Language=E
4681700,ca.proc.d.2016-09-30.9104051,2016-09-30,ad4032f2-6bb1-497b-b146-f321cfb71ba9,218112,"Hon. Pierre Poilievre (Carleton, CPC)",,Oral Questions,Health,,"Madam Speaker, my question was for Ottawa's regional minister, not Montreal's.
The member for Ottawa Centre is the one who triumphantly announced a year ago that she was reversing John Baird's decision to grant farmland to the hospital. When she later learned there was nowhere else to put it, she went into hiding and punted the matter to the minister for Montreal. Now our city is voiceless on a hospital in our city.
When will the minister take responsibility for her community and our city and let us build a new hospital?",Conservative,Carleton,Pierre Poilievre,http://www.parl.gc.ca/MembersOfParliament/ProfileMP.aspx?Key=218112&Language=E
4681701,ca.proc.d.2016-09-30.9104053,2016-09-30,83cd3ab5-7dc7-414e-ab8b-e0dbc16b4c4a,214327,"Hon. Mélanie Joly (Minister of Canadian Heritage, Lib.)",,Oral Questions,Health,,"Madam Speaker, I am very happy to be in charge of the National Capital Commission, the NCC, in order to make sure that Ottawa has a centrally located state-of-the-art hospital.
Unlike the past government, we really believe that this decision-making should not be done behind closed doors. That is why I will not take any recommendations or lessons from my counterpart.
We will make sure that we invest in an important and thorough NCC study. I look forward to getting all of the recommendations—",Liberal,Ahuntsic-Cartierville,Mélanie Joly,http://www.parl.gc.ca/MembersOfParliament/ProfileMP.aspx?Key=214327&Language=E
4681702,ca.proc.d.2016-09-30.p4488186,2016-09-30,,,,intervention,Oral Questions,Health,," Oh, oh!",,,Some hon. members,
4681703,ca.proc.d.2016-09-30.9104056,2016-09-30,cedf1659-ebb1-4f26-b723-5c7c5353988b,214948,The Assistant Deputy Speaker (Mrs. Carol Hughes),,Oral Questions,Health,,"I want to remind members that when someone has the floor, they are to listen, and then they will have an opportunity to ask questions at a later time.",New Democratic Party,Algoma—Manitoulin—Kapuskasing,Carol Hughes,http://www.parl.gc.ca/MembersOfParliament/ProfileMP.aspx?Key=214948&Language=E
4681704,ca.proc.d.2016-09-30.9104058,2016-09-30,62bfd797-8d32-425b-91b1-1422ca16694f,224621,"Mr. Blake Richards (Banff—Airdrie, CPC)",,Oral Questions,Democratic Reform,,"Madam Speaker, the government claims it is consulting on fundamental changes to our democracy, but then it is not actually listening to what Canadians have to say, so let us listen. 
Constituents Jeff and Annie wrote, “This is not a decision for only political parties to make”. Charles and Wynanda wrote, “It is unconscionable that a government in power would try to rig an election system to stay in power. This is what dictators do”. Denis says, “A referendum is essential”.
Will the Liberals finally agree to let each and every Canadian have a say in a referendum?",Conservative,Banff—Airdrie,Blake Richards,http://www.parl.gc.ca/MembersOfParliament/ProfileMP.aspx?Key=224621&Language=E
4681705,ca.proc.d.2016-09-30.9104061,2016-09-30,0fd242c0-71bc-4c1b-a4e4-609a396eca76,214691,"Mr. Mark Holland (Parliamentary Secretary to the Minister of Democratic Institutions, Lib.)",,Oral Questions,Democratic Reform,,"Madam Speaker, I know that the member's constituents, Jeff and Annie and Denis, would appreciate that feedback, but they would also like to have opportunities to be able to speak to their MPs. On this side of the House, more than 150 members of Parliament have either had or will have consultations in their riding on this issue. The Conservatives have had five. That is a lot better than the zero they had on the unfair elections act, I will grant them that. 
When are they going to let their constituents have their say on this issue? When are they going to consult their constituents and participate in the process of improving our democracy?",Liberal,Ajax,Mark Holland,http://www.parl.gc.ca/MembersOfParliament/ProfileMP.aspx?Key=214691&Language=E
4681706,ca.proc.d.2016-09-30.9104063,2016-09-30,33ef2052-c37d-446f-9d03-515d01591eba,218418,"Mr. Larry Maguire (Brandon—Souris, CPC)",,Oral Questions,Democratic Reform,,"Madam Speaker, last Saturday, I hosted an open house on electoral reform to hear what Canadians have to say. Let me tell members the results.
After tabulating the responses from my town hall, there was a clear majority who want a referendum, and over 800 people in my riding have now petitioned to have a vote before any change in electing MPs is implemented.
Will the Prime Minister listen to their demands and stop denying them their right to have a vote in a referendum?",Conservative,Brandon—Souris,Larry Maguire,http://www.parl.gc.ca/MembersOfParliament/ProfileMP.aspx?Key=218418&Language=E
