basepk,hid,speechdate,pid,opid,speakeroldname,speakerposition,maintopic,subtopic,subsubtopic,speechtext,speakerparty,speakerriding,speakername,speakerurl
4681626,ca.proc.d.2016-09-30.9103736,2016-09-30,68bad047-6aec-43e2-b870-7bc501110873,218470,"Mr. Ziad Aboultaif (Edmonton Manning, CPC)",,Government Orders,National Security and Intelligence Committee of Parliamentarians Act,,"Madam Speaker, I hope Canada will be safer after Bill C-22 is passed. How can the bill guarantee accountability and public trust when the chair of the committee is being parachuted into the position by the Prime Minister?",Conservative,Edmonton Manning,Ziad Aboultaif,http://www.parl.gc.ca/MembersOfParliament/ProfileMP.aspx?Key=218470&Language=E
4681627,ca.proc.d.2016-09-30.9103738,2016-09-30,0e1edc18-5616-4f5c-b9bd-535059ec8040,214070,Mr. Bill Blair,,Government Orders,National Security and Intelligence Committee of Parliamentarians Act,,"Madam Speaker, it is important to understand the function of this committee and its chair. As I have already stated, it will not be a parliamentary committee. We have parliamentary committees and well accepted rules among ourselves on how their leadership and chairs will be appointed.
This committee will have a special responsibility. It will not be a committee of the House but a committee of parliamentarians whom the Prime Minister is tasking with an important role. All Canadians and the House will be tasking the committee with an important role to provide effective, nonpartisan oversight of all the activities of government in maintaining national security and upholding our rights and freedoms. It is an incredibly important task.
I am proud that my government has proposed a committee that is not, as we have seen in the past, dominated by the majority of members of the governing party, but rather a committee that is truly representative of the great diversity of opinion and perspectives that is the House of Commons and this country.
 I am proud of the fact that this committee will comprise members of both sides of the House and of the other place to bring that diversity of perspective and to engender that public trust that must inevitably come from Canadians in knowing that their representatives, who are accountable to them, are there, know the secrets, and have access to sufficient information to hold accountable those who are entrusted with their safety.",Liberal,Scarborough Southwest,Bill Blair,http://www.parl.gc.ca/MembersOfParliament/ProfileMP.aspx?Key=214070&Language=E
4681628,ca.proc.d.2016-09-30.9103752,2016-09-30,6da8653f-692f-4bbc-acb2-86e088f0d60d,219035,"Mr. Pierre Nantel (Longueuil—Saint-Hubert, NDP)",,Government Orders,National Security and Intelligence Committee of Parliamentarians Act,,"Madam Speaker, I certainly do not have the kind of practical experience with this that my colleague opposite has. Logically, the committee's mandate should be to oversee the activities of our security and intelligence agencies. This talk about looking for a needle in a haystack makes it clear that the last thing we need is more hay, yet this committee would have more hay to search through to find mistakes, would it not?",New Democratic Party,Longueuil—Saint-Hubert,Pierre Nantel,http://www.parl.gc.ca/MembersOfParliament/ProfileMP.aspx?Key=219035&Language=E
4681629,ca.proc.d.2016-09-30.9103754,2016-09-30,0e1edc18-5616-4f5c-b9bd-535059ec8040,214070,Mr. Bill Blair,,Government Orders,National Security and Intelligence Committee of Parliamentarians Act,,"Madam Speaker, from my experience in dealing with matters of national security, I know that in order to be held accountable and to hold others accountable, it is important to have the right information at the right time. However, operational matters, because of their very nature, do require that certain information and certain types of intelligence gathering and certain ongoing operations remain secret. That is very much in the public interest. Nonetheless, I think we are making a huge step forward in creating greater transparency and far greater accountability.
Previously, the national security framework was mostly under the control of a government and a minister who kept those secrets closely guarded, and there was very little trust of the other members of the House. This is an act of trust. The bill says that we trust parliamentarians from the other parties and from all parts of Canada to do the job of protecting our rights and freedoms and making sure that our national security framework is effective at both keeping our citizens safe and protecting their freedoms.",Liberal,Scarborough Southwest,Bill Blair,http://www.parl.gc.ca/MembersOfParliament/ProfileMP.aspx?Key=214070&Language=E
4681630,ca.proc.d.2016-09-30.9103758,2016-09-30,86fed1de-3861-4448-8242-ad414073ef2e,220085,"Ms. Joyce Murray (Parliamentary Secretary to the President of the Treasury Board, Lib.)",,Government Orders,National Security and Intelligence Committee of Parliamentarians Act,,"Madam Speaker, I thank the member for Scarborough Southwest for his eloquent words. As someone who has had a security role at the highest level in his career and now is in the role of representing the citizenry and its concerns about security as well as respect for civil rights and privacy, could he share his thoughts about how this oversight and review committee will improve the results of our agencies on both those fronts, both security and privacy and rights?",Liberal,Vancouver Quadra,Joyce Murray,http://www.parl.gc.ca/MembersOfParliament/ProfileMP.aspx?Key=220085&Language=E
4681631,ca.proc.d.2016-09-30.9103761,2016-09-30,0e1edc18-5616-4f5c-b9bd-535059ec8040,214070,Mr. Bill Blair,,Government Orders,National Security and Intelligence Committee of Parliamentarians Act,,"Madam Speaker, in my experience, those who are tasked with the responsibility of keeping us safe often find themselves faced with difficult choices. The imperative of protecting our citizens and making cases against those who would harm us can sometimes lead to errors in judgment in the exercise of those authorities. 
My colleagues who do this important work across the country believe very sincerely that we need to have the value-added of strict oversight and governance, with a clear, impartial, independent review of how those extraordinary authorities are given to us. This is kind of a deal with everyone who engages in law enforcement or national security and public safety. We accept the additional authorities that are given to us by the government and by the people, and in return we must be fully accountable for the use of those authorities. We must uphold and respect the rule of law. 
To achieve that and to be able to reassure the country and its citizens that those extraordinary powers and authorities are being used in the public interest and according to the rule of law, independent oversight is critical. The bill finally provides that effective oversight and governance of those extraordinary authorities. I know with great confidence that the extraordinary men and women dedicated to keeping us safe and upholding our laws will welcome this level of oversight provided under the bill.",Liberal,Scarborough Southwest,Bill Blair,http://www.parl.gc.ca/MembersOfParliament/ProfileMP.aspx?Key=214070&Language=E
4681632,ca.proc.d.2016-09-30.9103765,2016-09-30,3c3175ff-595b-4f50-a58d-b41cd7b5b100,214600,"Hon. Hunter Tootoo (Nunavut, Ind.)",,Statements By Members,Orange Shirt Day,,"Madam Speaker, today is the fourth annual Orange Shirt Day: Every Child Matters. This nationally-recognized movement commemorates the thousands of indigenous children across Canada who were taken from their homes and sent to a residential school. 
The legacy of this day stems from the experience of a six-year-old girl, named Phyllis Webstad, who had her shiny, new orange shirt taken from her upon arriving at a residential school. The orange shirt represents the loss of culture, identity, and language for thousands of indigenous children, the effects of which are still felt to this day.
The Minister of Indigenous and Northern Affairs is mandated to work with indigenous communities to gain back the culture and identity that was lost. 
Although efforts such as the Truth and Reconciliation Commission of Canada have made strides in making amends with Canada's indigenous population, continued efforts are needed to heal the wounds inflicted by residential schools.",Independent,Nunavut,Hunter Tootoo,http://www.parl.gc.ca/MembersOfParliament/ProfileMP.aspx?Key=214600&Language=E
4681633,ca.proc.d.2016-09-30.9103768,2016-09-30,b078667f-922f-4979-a4c6-311e7bdc4068,214658,"Mrs. Celina Caesar-Chavannes (Whitby, Lib.)",,Statements By Members,Brooklin Harvest Festival,,"Madam Speaker, on September 10, residents in my riding of Whitby participated in the annual Brooklin Harvest Festival. This family-friendly day marks the start of the harvest season, and an opportunity to celebrate our local farmers and thank them for all they do for our community.
 This year's festival was a huge success. The new location was packed because so many people came. The marketplace was especially popular. Attendees had the opportunity to try local products, buy flowers and plants from local growers, and enjoy local entertainment. 
On behalf of all residents of Whitby, I extend my deepest appreciation to everyone who contributed to making this year's festival the best yet.",Liberal,Whitby,Celina Caesar-Chavannes,http://www.parl.gc.ca/MembersOfParliament/ProfileMP.aspx?Key=214658&Language=E
4681634,ca.proc.d.2016-09-30.9103773,2016-09-30,4437c848-d8c7-4a39-a948-1539969f3a90,218734,"Ms. Marilyn Gladu (Sarnia—Lambton, CPC)",,Statements By Members,Western Research Parks,,"Madam Speaker, scientific research is alive and well, not just across Canada but it is thriving in my riding as well. 
Yesterday, it was announced that the Western Research Parks, which includes the Western Sarnia-Lambton Research Park, received the 2016 Outstanding Research Park Award from the Association of University Research Parks.
This international recognition makes Western the first research park in Ontario to receive this award and the third in Canada. The award recognizes the effective operation and the quantifiable contribution the research park makes to its community.
I want to thank the park team and their board of directors.
I congratulate Tom Strifler, Katherine Albion, Aung Oo, and Caroline Craig. I recognize their excellence, Sarnia—Lambton recognizes their excellence, and now the world recognizes their excellence.",Conservative,Sarnia—Lambton,Marilyn Gladu,http://www.parl.gc.ca/MembersOfParliament/ProfileMP.aspx?Key=218734&Language=E
4681635,ca.proc.d.2016-09-30.9103778,2016-09-30,5e126a6d-7b4a-4e53-951f-7f1a7e9b5c0e,215947,"Mr. Ramesh Sangha (Brampton Centre, Lib.)",,Statements By Members,National Seniors Day,,"Madam Speaker, tomorrow, October 1, marks the international day for seniors. It reminds us to appreciate the sacrifices and contributions made by our seniors toward the progress of our country.
I have personal experience with my 96-year-old father, Sardar Parshottam Singh Sangha. I am certain the same applies to all of us. 
Summer events were the great opportunities to meet and listen to seniors. During Canada 55+ Games held in my riding, I had the honour to present medals to senior champions, aged 50 to 90. What a great inspiration for me. I will cherish it forever. 
Our seniors are reaching out to us. Let us all respond because we owe it to them.
“Action thy duty, reward not thy concern”, as in Bhagavad Gita.",Liberal,Brampton Centre,Ramesh Sangha,http://www.parl.gc.ca/MembersOfParliament/ProfileMP.aspx?Key=215947&Language=E
4681636,ca.proc.d.2016-09-30.9103786,2016-09-30,f4efade5-e605-4926-b4d9-cea84ef76f14,217342,"Mr. Randall Garrison (Esquimalt—Saanich—Sooke, NDP)",,Statements By Members,Public Safety,,"Madam Speaker, on Monday, I introduced my bill to repeal Bill C-51. The New Democrats are still saying today what we said from the beginning: Bill C-51 infringes on our civil liberties without doing anything to make us safer. 
The Minister of Public Safety and Emergency Preparedness now calls Bill C-22 the centrepiece of Liberal national security policy. During the campaign, of course, the Liberals' centrepiece was fixing Bill C-51.
 What we have in Bill C-22 is a necessary but flawed review committee, a case of bait and switch, plus more consultation. Yet, more consultation is cold comfort to Canadians whose rights are under threat, including those engaged in legitimate dissent, like first nations leaders and environmentalists, or even ordinary citizens who value their privacy. 
We all know what works when it comes to combatting terrorism. We need to devote adequate resources to de-radicalization and to traditional intelligence and enforcement work. Neither restricting our rights nor collecting so much information on all of us that we lose focus on the real threats will help keep us safe. That is why it is time to repeal Bill C-51.",New Democratic Party,Esquimalt—Saanich—Sooke,Randall Garrison,http://www.parl.gc.ca/MembersOfParliament/ProfileMP.aspx?Key=217342&Language=E
4681637,ca.proc.d.2016-09-30.9103797,2016-09-30,e321e85f-f1c1-4482-bf16-f640eb41e9f9,215966,"Mr. Ahmed Hussen (York South—Weston, Lib.)",,Statements By Members,Summer Jobs Program,,"Madam Speaker, I rise today to speak about the Canada summer jobs program and the impact that it has had in my riding of York South—Weston. This program is meant to fund organizations to create jobs for young people.
 Due to the rise in violence in certain parts of Toronto, York South—Weston received extra funding this year from the Canada summer jobs program. This funding was generously matched by Allan and Don Carswell and the Carswell Family Foundation.
Young people in my riding have told me of the positive impacts that this extra funding has had on their lives. They have told me how they have been able to assist organizations like the Boys &amp; Girls Clubs of Weston-Mount Dennis and Frontlines Toronto to deliver even more vital services to my constituents.
 I am very proud to be part of a government that invests in young people, and believes in investing in young people. I am happy to thank the organizations that participated, and the Carswell Foundation, for ensuring that young people will have a meaningful work experience as they start their careers.",Liberal,York South—Weston,Ahmed Hussen,http://www.parl.gc.ca/MembersOfParliament/ProfileMP.aspx?Key=215966&Language=E
4681638,ca.proc.d.2016-09-30.9103800,2016-09-30,f2313477-3104-468f-9384-a371bedc7d09,216633,"Mr. Robert Kitchen (Souris—Moose Mountain, CPC)",,Statements By Members,Ronald McDonald House,,"Madam Speaker, on August 5, while millions of Canadians and others around the world watched the opening ceremonies of the Rio summer Olympic games, the town of Carlyle, Saskatchewan, and the people of Souris—Moose Mountain, were focused on 12-year old Carter Morrison.
Carter was born with achondroplasia, an inherited growth disorder. He was chosen to lead Team Canada into Maracana Stadium alongside flag-bearer Rosie MacLennan. Carter was also fortunate to lead Team Mongolia through the stadium. He carried with him a tree, which was later planted following the opening ceremonies.
This was the first time ever that children, the Olympics Kids, could walk in the opening ceremonies of the Olympics. Ronald McDonald House brought nearly 100 people from around the world to Brazil, and it has been bringing children to the Olympics since 1986. Carter has stayed at Ronald McDonald houses in Saskatchewan, Manitoba and Alberta since he was a baby.
I thank Ronald McDonald House. Carter has done a great job and has been a fantastic ambassador for Canada. ",Conservative,Souris—Moose Mountain,Robert Gordon Kitchen,http://www.parl.gc.ca/MembersOfParliament/ProfileMP.aspx?Key=216633&Language=E
4681639,ca.proc.d.2016-09-30.9103805,2016-09-30,bc4bee2d-993a-4485-a436-4b45cb6553da,214468,"Ms. Yvonne Jones (Labrador, Lib.)",,Statements By Members,Diabetes,,"Madam Speaker, I rise today to acknowledge the steadfast determination of one indigenous Labradorian. Guy Poole began walking to raise money and awareness for diabetes after his wife passed away due to complications related to the disease.
Now 72 years young, committed and energized, Guy has walked over 3,000 kilometres in Newfoundland and Labrador, and has raised over $100,000. He most recently finished a walk from Gander to St. John's, Newfoundland.
Diabetes is a disease that disproportionately affects first nations, Inuit and Métis people, up to four times higher in indigenous communities versus non-indigenous communities. That rate is on the rise in both indigenous and non-indigenous populations within Canada.
I sincerely thank Guy Poole, I congratulate him, and I acknowledge him and the many others who have worked so hard to raise awareness and money for the prevention, treatment and a cure for diabetes.",Liberal,Labrador,Yvonne Jones,http://www.parl.gc.ca/MembersOfParliament/ProfileMP.aspx?Key=214468&Language=E
4681640,ca.proc.d.2016-09-30.9103810,2016-09-30,6322565a-d236-4124-81f3-d869f865f7ef,214352,"Ms. Leona Alleslev (Aurora—Oak Ridges—Richmond Hill, Lib.)",,Statements By Members,Canada Gazette,,"Madam Speaker, I am pleased to inform members that October 2 marks the 175th anniversary of the Canada Gazette, the Government of Canada's official newspaper.
 Since 1841, the Canada Gazette has documented proclamations of war and peace, notices of royal assent, regulations and judicial appointments.
The Canada Gazette is much more than just a way for the government to keep Canadians informed. It is also a key communication channel through which Canadians can reach their government. The government's regulatory proposals are posted on the Canada Gazette website for all to see, and Canadians are invited to share their views.
I congratulate the Public Services and Procurement Canada in its role as the Queen's printer, and I thank the Canada Gazette employees whose efforts contribute to our country's democracy.",Liberal,Aurora—Oak Ridges—Richmond Hill,Leona Alleslev,http://www.parl.gc.ca/MembersOfParliament/ProfileMP.aspx?Key=214352&Language=E
4681641,ca.proc.d.2016-09-30.9103813,2016-09-30,62bfd797-8d32-425b-91b1-1422ca16694f,224621,"Mr. Blake Richards (Banff—Airdrie, CPC)",,Statements By Members,Sudden Infant Death Syndrome,,"Madam Speaker, every year about a thousand Canadian babies fall asleep and never wake up. They die from sudden infant death syndrome. SIDS is the number one cause of death in babies under the age of one.
 Quinn Isla Cormier of Airdrie was one of those babies. She was loved, and she is still missed. Her death, like all SIDS or undetermined deaths, could not have been predicted or prevented.
I rise to acknowledge Quinn's mother, Sarah Cormier, and her family for creating an organization dedicated to helping families that have lost an infant suddenly and unexpectedly.
Ms. Cormier and Quinn’s Legacy Society Run are building awareness through fundraising initiatives and advocacy. In partnership with SIDS Calgary Society, the funds raised go to parents who have lost an infant to SIDS and face financial hardship due to the loss of government benefits.
Tomorrow marks the beginning of Pregnancy and Infant Loss Awareness Month, an important reminder of the babies lost and the families that survive them, to help raise awareness and to reflect on whether our current policies are adequately supporting SIDS' families.",Conservative,Banff—Airdrie,Blake Richards,http://www.parl.gc.ca/MembersOfParliament/ProfileMP.aspx?Key=224621&Language=E
4681642,ca.proc.d.2016-09-30.9103818,2016-09-30,101111c4-d4b7-46a9-9f88-9bfa542bb606,215937,"Mr. David de Burgh Graham (Laurentides—Labelle, Lib.)",,Statements By Members,Retirement Congratulations,,"Madam Speaker, I rise today to pay tribute to an institution inside the Liberal Party of Canada, the aptly named Paul Quirk. As a fresh Liberal volunteer in Ottawa, my first stop on the tour of the party office was the print shop, with Paul at the helm. 
Never arriving later than sunrise, never shying away from a challenge, the 72-year-old keeps the machinery greased and the wheels turning, rain or shine. He has solved problems, he has given guidance, he has worked miracles. I have learned tricks from him to efficiently stuff envelopes that everyone here would appreciate, and some I might tell.
At the end of 19 years, 7 national elections, and more than 50 by-elections, with some 119 million pieces produced, Paul is ready to take his next step. We will hold the presses until we hear what his new career will be.
It has been an immense pleasure to work with Paul and to learn from him. I wish him all the very best in his retirement.",Liberal,Laurentides—Labelle,David Graham,http://www.parl.gc.ca/MembersOfParliament/ProfileMP.aspx?Key=215937&Language=E
4681643,ca.proc.d.2016-09-30.9103824,2016-09-30,4c0685b7-4ab9-4321-bb90-a5cb3ae307da,213916,"Mr. Terry Duguid (Winnipeg South, Lib.)",,Statements By Members,National Seniors Day,,"Madam Speaker, I am pleased to rise in the House to let people know that tomorrow, October 1, is National Seniors Day. We believe Canada is at its best when all citizens are treated fairly and have the opportunity to reach their full potential, including seniors.
Through budget 2016, we are making historic investments that will change the lives of seniors, both now and in the future, by addressing income security, social inclusion, poverty, affordable housing, as well as more generous and flexible leave for caregivers.
 Let us take the opportunity on National Seniors Day to celebrate and pay tribute to all seniors for the valuable contributions they have made, and continue to make, to our families, workplaces, communities, and to Canada.
I would particularly like to take this opportunity to recognize a great organization in my riding of Winnipeg South, Pembina Active Living (55+), which provides valuable programs and community services to older adults.",Liberal,Winnipeg South,Terry Duguid,http://www.parl.gc.ca/MembersOfParliament/ProfileMP.aspx?Key=213916&Language=E
4681644,ca.proc.d.2016-09-30.9103831,2016-09-30,9c9a64e6-58f1-4367-9f49-93ad31744c96,217354,"Mrs. Cathy McLeod (Kamloops—Thompson—Cariboo, CPC)",,Statements By Members,Orange Shirt Day,,"Madam Speaker, today I rise to recognize Orange Shirt Day. This was launched in the province of British Columbia and was created to educate students and communities of the history and legacy of Canada's residential schools.
Most of us in the chamber remember our first days of school very fondly, our new clothes and shiny shoes, and we would go off with pride. The experience for Phyllis Webstad, who was six years old when she began attending St. Joseph's mission school in Williams Lake, was nothing like many experienced. On her first day, her new orange shirt, a gift from her grandmother, was taken away from her. This profoundly affected her for many years.
Today, we need to continue the important work we started with the apology in the chamber and recognize the legacy of the residential schools. I hope all members in the chamber will stand and recognize Orange Shirt Day in Canada.",Conservative,Kamloops—Thompson—Cariboo,Cathy McLeod,http://www.parl.gc.ca/MembersOfParliament/ProfileMP.aspx?Key=217354&Language=E
4681645,ca.proc.d.2016-09-30.9103835,2016-09-30,0fd242c0-71bc-4c1b-a4e4-609a396eca76,214691,"Mr. Mark Holland (Ajax, Lib.)",,Statements By Members,Tobacco Control,,"Madam Speaker, for a generation, Canada led the world in tobacco control. Successive Liberal and Conservative governments worked with not-for-profit organizations like the Heart &amp; Stroke Foundation, the Canadian Cancer Society, and The Lung Association to drive down youth prevalence rates and see smoking reduced to some of the lowest levels in the world. 
Then, for a decade, that leadership was lost and Canada watched as the rest of the world passed us by in tobacco control. We watched as stagnant rates in Canada on smoking continued. This means that about 37,000 die every year in the leading cause of preventable death. To give an idea of scope, that is the equivalent of an entire riding disappearing every three years.
We have an opportunity to re-establish leadership in areas like plain packaging, where we have seen Australia, the United Kingdom, and others take action. We made a commitment to act and we know that will work. It is time for us to lead again.",Liberal,Ajax,Mark Holland,http://www.parl.gc.ca/MembersOfParliament/ProfileMP.aspx?Key=214691&Language=E
