basepk,hid,speechdate,pid,opid,speakeroldname,speakerposition,maintopic,subtopic,subsubtopic,speechtext,speakerparty,speakerriding,speakername,speakerurl
4679711,ca.proc.d.2016-09-21.9044163,2016-09-21,3176068f-62ee-4b2f-aacd-1131201c6db1,214707,The Speaker,,,,,"It being Wednesday, we will now have the singing of the national anthem led by the hon. member for Bruce—Grey—Owen Sound.
[Members sang the national anthem]",Liberal,Halifax West,Geoff Regan,http://www.parl.gc.ca/MembersOfParliament/ProfileMP.aspx?Key=214707&Language=E
4679712,ca.proc.d.2016-09-21.9044177,2016-09-21,9e05a099-6a0b-4fe2-9e9b-0a8b91b7807b,214054,"Ms. Monique Pauzé (Repentigny, BQ)",,Statements By Members,Energy East Project,,"Mr. Speaker, two petitions about the energy east pipeline have been presented in the House.
One was from Quebeckers who oppose the project because it goes against our values and our interests. The other was from English Canada, and it was in favour of a pipeline to move dirty oil across Quebec without giving us a say in the matter.
Two petitions have been presented. The Quebec one said no to energy east, no to people shoving the pipeline down our throats, and no to a project where we end up with all of the risk and none of the benefit. The other petition said yes to energy east with or without Quebec's consent.
Here is how the Bloc Québécois sees it: nothing happens in Quebec without Quebeckers' say-so. It is for the Government of Quebec alone to decide. It is high time the government understood that.",Bloc Québécois,Repentigny,Monique Pauzé,http://www.parl.gc.ca/MembersOfParliament/ProfileMP.aspx?Key=214054&Language=E
4679713,ca.proc.d.2016-09-21.9044184,2016-09-21,330c0119-cf49-4e85-9407-539367825c2b,219879,"Mr. Chris Bittle (St. Catharines, Lib.)",,Statements By Members,Niagara Wine Festival,,"Mr. Speaker, it is not as if one needs an excuse to bend elbows with fellow community members, but I have a perfect one happening this weekend.
Niagara is famous for many things: Niagara Falls, rolling hills, beautiful landscapes, two great lakes, and beautiful beaches. However, only one Niagara speciality gets a two-week celebration every September. If members have not figured it out yet, I am talking about fine Niagara wine.
I often hear fellow members talking about local festivals and fairs, but call me biased for believing that the Niagara Wine Festival takes the trophy as best in class. For over 65 years, patrons have come from across Canada to enjoy beautifully transformed Montebello Park and celebrate a year's harvest of world-class Niagara grapes. With over 29 vintners set up to promote and provide samples of their wine, there is just no comparison to the Niagara Wine Festival.
 On behalf of residents, I would like to congratulate organizers and volunteers on another successful year.",Liberal,St. Catharines,Chris Bittle,http://www.parl.gc.ca/MembersOfParliament/ProfileMP.aspx?Key=219879&Language=E
4679714,ca.proc.d.2016-09-21.9044187,2016-09-21,61c83e21-f9a3-4e4b-b881-4b2d1ce33c43,216661,"Mr. John Brassard (Barrie—Innisfil, CPC)",,Statements By Members,Terry Fox Run,,"Mr. Speaker, I was honoured to be part of the Terry Fox Run this past weekend, along with over 1,000 runners and walkers of all ages.
The Barrie Terry Fox Run, which is held annually along the shores of beautiful Kempenfelt Bay, has raised more than $2 million since its inception, and this has been without the help of any corporate sponsors.
I want to specifically recognize one individual's incredible and tireless advocacy on behalf of cancer research. Local icon, Will Dwyer has singlehandedly collected approximately $750,000 for the Terry Fox Run over the past 36 years. This unsung Canadian hero is not done yet. He hopes to reach $1 million before he hangs up his running shoes.
On behalf of the people of Barrie—Innisfil, I want to thank Mr. Dwyer from the bottom of my heart. I hope his story inspires a new generation of Canadians to continue on with his legacy.",Conservative,Barrie—Innisfil,John Brassard,http://www.parl.gc.ca/MembersOfParliament/ProfileMP.aspx?Key=216661&Language=E
4679715,ca.proc.d.2016-09-21.9044191,2016-09-21,af4d6069-8435-4361-9a6f-d38c96e9d50a,215916,"Mr. Francesco Sorbara (Vaughan—Woodbridge, Lib.)",,Statements By Members,Prostate Cancer Awareness Month,,"Mr. Speaker, I rise today to recognize September as Prostate Cancer Awareness Month.
The month is dedicated toward engaging and connecting with Canadians around a disease that one in eight men will be diagnosed with in their lifetime. Through community fundraising events, public service and research announcements, Prostate Cancer Canada attempts to alert people to the most common cancer in men.
Our riding of Vaughan—Woodbridge will be one of six communities across Canada hosting a breakfast for Prostate Cancer Awareness Month. The last 20 years has seen the death rate from prostate cancer drop by almost 40%, but still an estimated 4,100 Canadian men died from the disease in 2015 alone.
There is still a lot of work to be done to decrease the death toll further, and the increased awareness that comes from Prostate Cancer Awareness Month is a great place to start.
Please join me in attending an event, raising funds, or just sharing information about Prostate Cancer Awareness Month.",Liberal,Vaughan—Woodbridge,Francesco Sorbara,http://www.parl.gc.ca/MembersOfParliament/ProfileMP.aspx?Key=215916&Language=E
4679716,ca.proc.d.2016-09-21.9044274,2016-09-21,95ed53a7-7538-4c0f-85a4-64af76065f95,218942,"Mr. Don Davies (Vancouver Kingsway, NDP)",,Statements By Members,World Alzheimer's Day,,"Mr. Speaker, September is World Alzheimer's Month, and today is World Alzheimer's Day. The theme for these events is “Remember Me”, and it could not be more appropriate. 
Today, we must remember those who are living with Alzheimer's and their caregivers. As a country, we need to be doing everything we can to support our friends, our neighbours and our communities, which have been impacted by this condition. We can do this in a number of ways. Committing to more research, better understanding, and ultimately achieving prevention and a cure are our ultimate goals.
 I am sure that everyone in this chamber has been touched by Alzheimer's disease in some way, through our families and friends.
I ask all of us to remember them and to honour them by working together to eliminate Alzheimer's and all other forms of dementia.",New Democratic Party,Vancouver Kingsway,Don Davies,http://www.parl.gc.ca/MembersOfParliament/ProfileMP.aspx?Key=218942&Language=E
4679717,ca.proc.d.2016-09-21.9044344,2016-09-21,2c7cfe15-cb1e-43c5-831d-6ad09d4a16b6,214867,"Mr. Arnold Chan (Scarborough—Agincourt, Lib.)",,Statements By Members,Armenia,,"Mr. Speaker, today we join the Armenian community, in Canada, in Armenia, and around the world, in celebrating the country's 25th independence day.
As chair of the Canada-Armenia Parliamentary Friendship Group and as an MP for my riding in Scarborough—Agincourt, which represents a vibrant Armenian community, I am honoured to join my colleagues today in celebrating this significant milestone.
Canada and the Republic of Armenia enjoy a dynamic and friendly relationship. As Canadians, we continue to support our Armenian friends, whether it is through our shared values of democracy, freedom, bilateral relations, or through our continued recognition of the Armenian genocide that was successfully established in the House of Commons.
Today, we reflect on the important contributions of the Armenian community in Canada, not only toward our national fabric but also through the demonstration of leadership by showing what it truly means to be Canadian during the Syrian refugee crisis.
I invite all my colleagues in joining me to offer our best wishes to the Armenian community on this important milestone as we continue to look forward to many more celebrations to come.",Liberal,Scarborough—Agincourt,Arnold Chan,http://www.parl.gc.ca/MembersOfParliament/ProfileMP.aspx?Key=214867&Language=E
4679718,ca.proc.d.2016-09-21.9044213,2016-09-21,7f45dfd9-dd4b-4b04-8dc9-20cb0730d279,218376,"Mr. Jacques Gourde (Lévis—Lotbinière, CPC)",,Statements By Members,Jean-Louis Béland,,"Mr. Speaker, I rise today to recognize the irrefutable contribution made by Jean-Louis Béland, a former member of the National Assembly for my riding, a man who is passionately dedicated to his community. With roots in agriculture, he studied and worked in aviculture and silviculture. Mr. Béland has always been a champion of our democracy, and thanks to his convictions, he remains well known in our region today. He is very involved in his community, having served as Ralliement créditiste member for Lotbinière, mayor of Saint-Gilles, founder of the Caisse d'établissement Bellerive in Saint-Romuald, president of the Office des producteurs de bois de Lotbinière, and vice-president of Assurance mutuelle de Lotbinière, as well as serving on numerous boards. He has been a proud Knight of Columbus, 4th degree, for many years, and there can be no doubt that Mr. Béland has made a tremendous contribution to the development of our community.
I am pleased to rise in the House to pay tribute to such a warm man. Thank you, Jean-Louis Béland.",Conservative,Lévis—Lotbinière,Jacques Gourde,http://www.parl.gc.ca/MembersOfParliament/ProfileMP.aspx?Key=218376&Language=E
4679719,ca.proc.d.2016-09-21.9044216,2016-09-21,86fed1de-3861-4448-8242-ad414073ef2e,220085,"Ms. Joyce Murray (Vancouver Quadra, Lib.)",,Statements By Members,Mauril Bélanger,,"Mr. Speaker, I rise to remember a former colleague and dear friend whose passionate voice and courage continue to resonate within our Parliament. Through his many years of service and throughout his battle with ALS, Mauril Bélanger was, to the very end, a stellar example to all parliamentarians.
Mauril is survived by his dedicated and loving wife and partner, Catherine, and we wish Catherine and their family all our love and warm wishes through this difficult time.
I had the honour of working alongside Mauril for eight years. He was a mentor to new MPs, and none of us will forget his infectious enthusiasm as he shared his latest innovative project to serve constituents. Mauril was a bright light for his community, colleagues, party, and country. This chamber will be dimmer without him.
I thank Mauril for how generously he gave of himself. He is very much missed.",Liberal,Vancouver Quadra,Joyce Murray,http://www.parl.gc.ca/MembersOfParliament/ProfileMP.aspx?Key=220085&Language=E
4679720,ca.proc.d.2016-09-21.9044220,2016-09-21,6cef02a4-e5dd-44f0-9355-faf30afbb856,220020,"Mr. Borys Wrzesnewskyj (Etobicoke Centre, Lib.)",,Statements By Members,Babi Yar Massacre,,"Mr. Speaker, today marks the 75th anniversary of the Babi Yar massacre. On this date, in 1941, in Kiev, 34,000 Jewish men, women, children, and infants, were rounded up, stripped of their possessions, shot, and dumped into the Babi Yar ravine by the Nazis. So began the “Holocaust by bullets” in Eastern Europe.
This week, a series of memorial events are being held on this horrific anniversary. The Babi Yar memorial project was spearheaded by the Ukrainian Jewish Encounter, a groundbreaking group founded and funded by Ukranian-Canadian businessman and visionary James Temerty.
Thousands of forgotten “Holocaust by bullets” sites are deserving of remembrance. One such site is at the ancient Jewish cemetery of Sambir where, on the first day of Passover in 1943, 2,000 Jews were massacred. After seven years of patient and meticulous work, my friend Mark Freiman and I signed a memorandum of understanding with the mayor of Sambir, Yurii Hamar, this September 8 to memorialize this site.
May their souls be bound in the bond of eternal life.",Liberal,Etobicoke Centre,Borys Wrzesnewskyj,http://www.parl.gc.ca/MembersOfParliament/ProfileMP.aspx?Key=220020&Language=E
4679721,ca.proc.d.2016-09-21.9044225,2016-09-21,3a48d31a-42fc-4320-a84f-da61c251bccd,219011,"Mr. Blaine Calkins (Red Deer—Lacombe, CPC)",,Statements By Members,Retirement Congratulations,,"Mr. Speaker, as members of Parliament, we are afforded many challenges and opportunities in our daily lives. To help us with these challenges, we are blessed to be able to have staff to help us along the way. I am rising today to pay tribute to one of my staff.
Christine Riske has been in my employment since my first election on January 23, 2006, and before that worked for Dale Johnston, the previous MP, for six years. Christine is retiring at the end of this month, after 17 years of loyal service to the people of central Alberta. 
Christine hails from an era where people came to work no matter what. Today, I would like to thank Christine, who is in Ottawa with her husband Duane. I would like to thank her for making sure the office was always open, rain, shine, or blizzard. I would like to thank her for taking call after call from constituents who needed assistance, many of them desperate and at their wit's end. I would like to thank her for making sure the office was fully supplied, that deadlines were always met, that invoices were always paid, and that important tasks were always done. I would like to thank her for her patience, her understanding, her wisdom, and her guidance. I would like to thank her for her friendship. She will be missed. 
I wish Christine and Duane good health and a long, fun, and wonderful retirement.",Conservative,Red Deer—Lacombe,Blaine Calkins,http://www.parl.gc.ca/MembersOfParliament/ProfileMP.aspx?Key=219011&Language=E
4679722,ca.proc.d.2016-09-21.9044232,2016-09-21,6322565a-d236-4124-81f3-d869f865f7ef,214352,"Ms. Leona Alleslev (Aurora—Oak Ridges—Richmond Hill, Lib.)",,Statements By Members,Aerospace Industry,,"Mr. Speaker, as chair of the Liberal aerospace caucus, I would like to give a warm welcome to the Aerospace Industries Association of Canada, which is hosting aerospace day on the Hill, today. 
 The aerospace sector is one of Canada's most innovative, export-oriented sectors. It is made up of 700 businesses, and represents more than 180,000 quality jobs. It contributes over $29 billion to our GDP and the Canadian economy every year. 
The Canadian aerospace industry is a large economic driver in our country. It includes engineering, manufacturing, and in-service support for everything from planes to helicopters to satellites, spaceships, and more. 
The aerospace industry is not only a passion of mine, but it is an important part of the innovation agenda and an integral part of Canada's economy.
I thank the AIAC and welcome it to Parliament Hill today.",Liberal,Aurora—Oak Ridges—Richmond Hill,Leona Alleslev,http://www.parl.gc.ca/MembersOfParliament/ProfileMP.aspx?Key=214352&Language=E
4679723,ca.proc.d.2016-09-21.9044239,2016-09-21,eda66e22-490c-4221-b4a0-4eaedacd34e1,218838,"Hon. Ginette Petitpas Taylor (Moncton—Riverview—Dieppe, Lib.)",,Statements By Members,World Alzheimer's Day,,"Mr. Speaker, I rise today to bring awareness of the impact that Alzheimer's disease and other forms of dementia have on Canadians. I know the personal toll that it can have on a family as my mother lives with Lewy body dementia.
Today is World Alzheimer's Day.
Mr. Speaker, the New Brunswick Alzheimer Society's six resource centres are organizing a week of activities to promote the different programs they offer and to acknowledge the 17,000 families in New Brunswick that benefit from their services, as well as the 3,000 people who will be diagnosed this year. Educational programs such as The Alzheimer Journey, the caregiver support network, and the memory café provide people with hope and help them cope with the black cloud of dementia.
 Families struggle every day with the effects of dementia. They struggle to get information, they struggle to get a diagnosis, and they struggle to access services.
Let us all take a moment today to acknowledge their efforts, to recognize their struggles, and to remind them that they are not alone.",Liberal,Moncton—Riverview—Dieppe,Ginette Petitpas Taylor,http://www.parl.gc.ca/MembersOfParliament/ProfileMP.aspx?Key=218838&Language=E
4679724,ca.proc.d.2016-09-21.9044246,2016-09-21,b6808e95-1c75-4909-ab86-319d3519016a,217735,"Hon. Lisa Raitt (Milton, CPC)",,Statements By Members,World Alzheimer's Day,,"Mr. Speaker, Alzheimer's disease is the leading form of dementia, accounting for over two-thirds of dementia cases in Canada. Many of us are justifiably afraid of this fatal disease. There is no cure for it, we do not know exactly what causes it, and we do not know why some get it and others do not. Sometimes, we only talk about it in whispers. 
However, I know this. The more we talk about Alzheimer's and the more knowledge we share, the quicker we will get past the stigma and get to the people affected by this disease the support and the care they need.
 Today, in recognition of World Alzheimer's Day, I want to pay tribute to the caregivers, to the service providers, and to the advocates in each and every province and territory across this great country whose work it is to lessen the burden of those who have this disease. 
I thank them from the bottom of my heart.",Conservative,Milton,Lisa Raitt,http://www.parl.gc.ca/MembersOfParliament/ProfileMP.aspx?Key=217735&Language=E
4679725,ca.proc.d.2016-09-21.9044253,2016-09-21,5836b275-89f1-49ce-9b8c-7de46b261c3d,214690,"Mr. Pablo Rodriguez (Honoré-Mercier, Lib.)",,Statements By Members,International Day of Peace,,"Mr. Speaker, it is with pleasure that I rise today to draw attention to the International Day of Peace. This day of hope was chosen by the United Nations in order to draw attention to non-violence and the end of conflicts. 
The International Day of Peace is celebrated on September 21 every year. It is dedicated to peace and, more specifically, to the absence of war. The day is marked by a ceasefire in combat zones and those ceasefires have been observed in many conflicts since the day's creation in 1981.
This symbolic day sends the entire world a powerful message about our aspiration for peace and the hope that peace represents.
Regardless of the conflict, whether it is internal, between peoples or between nations, the message remains the same: let this day when hostilities are suspended be a prelude to a lasting ceasefire. Let this day become the rule and not the exception. ",Liberal,Honoré-Mercier,Pablo Rodriguez,http://www.parl.gc.ca/MembersOfParliament/ProfileMP.aspx?Key=214690&Language=E
4679726,ca.proc.d.2016-09-21.9044257,2016-09-21,6fda5a4f-19c6-4cf2-b72d-9a00b48e0d21,219053,"Ms. Hélène Laverdière (Laurier—Sainte-Marie, NDP)",,Statements By Members,International Day of Peace,,"Mr. Speaker, on this International Day of Peace, we celebrate the important role women play in peace processes around the world.
When women's groups are included in the peace process and are at the table as negotiators, mediators, and witnesses to peace agreements, those agreements are far more likely to succeed over the long term.
Last month, I had the pleasure of meeting women in Colombia and Guatemala who actively contribute to building peace in their communities. Their work is further proof that Canada must support women's full participation in peace efforts.
This year, Canada must ensure that the next national action plan on women, peace, and security includes long-term financial and diplomatic support for women peace builders, not only because it is the right thing to do but also because it is the wise thing to do.",New Democratic Party,Laurier—Sainte-Marie,Hélène Laverdière,http://www.parl.gc.ca/MembersOfParliament/ProfileMP.aspx?Key=219053&Language=E
4679727,ca.proc.d.2016-09-21.9044263,2016-09-21,0bd5970c-e4c2-4044-8344-8123b16d75bd,217884,"Hon. Peter Kent (Thornhill, CPC)",,Statements By Members,Armenia’s Independence Day,,"Mr. Speaker, I would like to take this opportunity to wish Armenians right across Canada and all around the world a very happy Independence Day. Twenty-five years ago today, Armenians voted in favour of full independence from the Soviet Union after almost seven decades under communist rule. 
Canada and the Republic of Armenia share an important relationship. Canada of course is home to a proud and hard-working Armenian community. Canada and Armenia have also signed a number of bilateral trade agreements. Furthermore, in 2006, the Government of Canada recognized the events of 1915 as genocide.
Once again, I would like to extend my best wishes to Armenians here in Canada and around the world. Happy Independence Day.",Conservative,Thornhill,Peter Kent,http://www.parl.gc.ca/MembersOfParliament/ProfileMP.aspx?Key=217884&Language=E
4679728,ca.proc.d.2016-09-21.9044273,2016-09-21,4b18a0b6-bb17-4967-84ef-abb5a4dde893,219781,"Mr. Greg Fergus (Hull—Aylmer, Lib.)",,Statements By Members,Mauril Bélanger,,"Mr. Speaker, it is a great honour for me to rise in the House to celebrate the life of our friend and colleague, the man from Mattawa, the Hon. Mauril Bélanger.
I want to recognize his exceptional work on behalf of cultural communities, especially the Haitian community in the Outaouais and Ottawa.
Following the 2010 earthquake, Mauril Bélanger established two scholarships, one at the University of Ottawa and the other at the Université du Québec en Outaouais, for gifted university students from Ottawa-Gatineau's Haitian community.
 The University of Ottawa scholarship reached its goal of $100,000 in 2015. The UQO scholarship, which will now be known as the Maurice Bélanger scholarship, needs $30,000 to reach its goal of $100,000.
These scholarships, like everything Mauril Bélanger was involved in, will continue to improve people's lives.
Well done, Mauril.",Liberal,Hull—Aylmer,Greg Fergus,http://www.parl.gc.ca/MembersOfParliament/ProfileMP.aspx?Key=219781&Language=E
4679729,ca.proc.d.2016-09-21.9044282,2016-09-21,cf6f39df-d304-45e1-a559-70a0cf20a720,214568,"Hon. Rona Ambrose (Leader of the Opposition, CPC)",,Oral Questions,The Economy,,"Mr. Speaker, I would like to welcome the Prime Minister back to this place called Parliament. I know the economy has not been necessarily his top priority lately, so let me update him.
While he was away, our economy has completely stalled. Unemployment has gone up, and 110,000 energy workers have lost their jobs. 
What is the Prime Minister's solution? Raising existing taxes and bringing in new ones, like a new carbon tax and a whopping CPP tax hike. His high tax, high spending plan is not helping, it is is hurting. 
When will the Prime Minister realize this plan is failing Canadians?",Conservative,Sturgeon River—Parkland,Rona Ambrose,http://www.parl.gc.ca/MembersOfParliament/ProfileMP.aspx?Key=214568&Language=E
4679730,ca.proc.d.2016-09-21.9044285,2016-09-21,b8c04eca-f237-48a8-8975-374ccd40d1a9,214115,"Right Hon. Justin Trudeau (Prime Minister, Lib.)",,Oral Questions,The Economy,,"Mr. Speaker, the fact is, like all parliamentarians, we were busy all summer meeting with Canadians, talking about their concerns, and talking about the opportunities to grow the economy in meaningful ways. That is why I am so surprised to hear the hon. member criticize the fact that we raised taxes on the wealthiest 1%, so that we could lower them for the middle class. 
Not only are the Conservatives so disconnected from their constituents that they did not vote in favour of raising taxes on the wealthy, so that we could lower them for the middle class, but the member continues to suggest that maybe we should not be raising taxes on the wealthiest. That did not work for 10 years, and it will not work now for them.",Liberal,Papineau,Justin Trudeau,http://www.parl.gc.ca/MembersOfParliament/ProfileMP.aspx?Key=214115&Language=E
4679731,ca.proc.d.2016-09-21.9044289,2016-09-21,cf6f39df-d304-45e1-a559-70a0cf20a720,214568,"Hon. Rona Ambrose (Leader of the Opposition, CPC)",,Oral Questions,Human Rights,,"Mr. Speaker, yesterday the Liberals confirmed that they are in negotiations on an extradition treaty with China, a country whose justice system has one of the worst human rights records in the world. Our allies, like Australia, the U.S., and New Zealand, do not have treaties of this type with China. 
Just last month, the immigration minister said that this was off the table. Has there been a change in China's human rights record? 
What exactly changed between now and then, and why is the Prime Minister not being straight-up with Canadians?",Conservative,Sturgeon River—Parkland,Rona Ambrose,http://www.parl.gc.ca/MembersOfParliament/ProfileMP.aspx?Key=214568&Language=E
4679732,ca.proc.d.2016-09-21.9044293,2016-09-21,b8c04eca-f237-48a8-8975-374ccd40d1a9,214115,"Right Hon. Justin Trudeau (Prime Minister, Lib.)",,Oral Questions,Human Rights,,"Mr. Speaker, the change is that after 10 years of a government that was hot and cold with the world's second largest economy, we have created a dialogue that allows us to deal with difficult issues, and deliver on priorities for Canadians, whether they be consular cases or investment opportunities for Canadian businesses, and small and medium-sized businesses across the country accessing the Chinese consumer market.
The fact is that Canada has extraordinarily high standards for extradition treaties, and those will always be upheld with anyone around the world.",Liberal,Papineau,Justin Trudeau,http://www.parl.gc.ca/MembersOfParliament/ProfileMP.aspx?Key=214115&Language=E
