basepk,hid,speechdate,pid,opid,speakeroldname,speakerposition,maintopic,subtopic,subsubtopic,speechtext,speakerparty,speakerriding,speakername,speakerurl
4650800,ca.proc.d.2016-02-03.17056.173,2016-02-03,9d4edb74-dcdc-4751-8541-6e42405e2bc5,9430,"Ms. Julie Dzerowicz (Davenport, Lib.)",,Government Orders,Canada Labour Code,,"Madam Speaker, I will follow the wonderful example of the hon. member for Kenora and start by giving members a bit about my background and some context.
I first want to mention that before I became an MP, I was privileged to work as a director of a large corporation. I worked for big business and was very proud to do so.
I also come from a family where my father worked for Canada Post for almost 30 years and was part of the union there. The only reason my mother does not live in poverty at the moment is that we very much benefit from his ongoing pension. The reason I mention this is that I believe we should treat all of our partners in the economy in a fair and balanced way, whether big business or unions. This is very much the principle that is behind the bill that I will be speaking to today, Bill C-4.
I am the very proud member of Parliament for Davenport, which is a riding in downtown west Toronto. We have a number of union members there, whether in the construction and labour trades, such as painters, carpenters, or from the public sector or Canada Post. There are many other unions that I have not mentioned. However, the point I want to make is that we have a lot of union members who want a fair and balanced federal labour policy, as do all Canadians. That is what we are trying to do with Bill C-4.
I welcome the opportunity to speak in support of Bill C-4, which aims to repeal the legislative changes made by Bill C-377 and Bill C-525. I would also invite all members of the House to support this important bill.
As mentioned in my introduction, in the broadest of strokes, Bill C-4 aims to restore a fair and balanced approach to labour relations in Canada. Because this government has promised Canadians that we will do things differently from the start, the words “fairness"" and “balance"" resonate with me. We believe that how we do things is just as important as what we do. The laws that throw a wrench into positive working relationships between government and unions, between employers and employees, and between different levels of government do not help anyone. Negative and contentious labour relations are destructive. They gnaw away at the foundation of a structure until it can no longer stand. However, it is that structure that supports workers, employers, and our economy as a whole. Therefore, we need that structure to be strong.
My colleague the Minister of Labour has taken members through some of the finer points of Bill C-377 and Bill C-525. I would like to use my time today to explain the impact these bills have on unions and workers and how they and in turn all Canadians would benefit from the repeal of the legislative changes made by Bill C-377 and Bill C-525.
I will begin by commenting on Bill C-377. Members should consider the fact that this bill forces labour organizations and labour trusts to provide very detailed financial and other information to the Canada Revenue Agency, such as salaries and time spent working on political or lobbying activities.
The bill also requires disclosure of all disbursements greater than $5,000 by unions, including names and addresses of anyone whose goods or services are purchased. There are a lot of other data requirements, which I will not go into. However, the key point is that the bill requires information that no other organization is required to provide, be it a public, private, non-profit, or charitable organization, or even a political party. To some this may not seem entirely unreasonable at first glance. However, if we dig a little deeper we would find that it could have serious and substantial ramifications.
First, it creates an extra level of unnecessary red tape, which could be particularly problematic for smaller organizations with fewer resources at their disposal. The Canada Revenue Agency would share that burden. It would have to develop new and expensive IT systems and other administrative systems to implement the bill. That is an unnecessary cost that would fall to Canadians. It is unnecessary because we already have legislation in place to ensure that unions are financially accountable to their members, as we heard today during the earlier debate. All of this is referred to in the Canada Labour Code.
Furthermore, similar accountability measures have been put in place by almost every province. Bill C-377 would impose a large financial and administrative burden on labour organizations, labour trusts, and government bodies, among others, for information that is not required from other organizations. As though that were not enough, if these organizations do not report on time, they must pay a fine of $1,000 for every day they are late, up to a maximum of $25,000.
Fortunately, my colleague, the Minister of National Revenue, took all the necessary steps to waive reporting for the time being. However, we know that this is a temporary solution since the waiver only applies to the 2016 fiscal period. In addition to the administrative burden being significant and unjust overall, the effect that the reporting requirements would have on the collective bargaining process would also give an unfair advantage to employers at the bargaining table. For example, detailed information about union strike funds would be available to employers, which means that employers would be able to calculate how long union members might be able to stay off the job in a labour dispute. If that is not uneven footing, I do not know what is.
It is clear that Bill C-377 is unnecessary and discriminatory. It clearly disadvantages unions during the collective bargaining process. At the root of it, I believe it is an attempt to make things harder for unions and to drive a wedge between employer and employee relations in Canada. 
This brings me to Bill C-525. This bill made changes to the Canada Labour Code, the Parliamentary Employment and Staff Relations Act, and the Public Service Labour Relations Act that affect how unions are certified and decertified. It makes it harder for unions to be certified as collective bargaining agents and easier for a bargaining agent to be decertified. The changes mean the process is more susceptible to employer interference and makes unionization more difficult.
Bill C-525 is not just problematic for unions but imposes some serious burdens on others as well. For example, there are real implications for bodies such as the Canada Industrial Relations Board, as well as the Public Service Labour Relations and Employment Board. Both boards are responsible for the full cost and logistical responsibilities involved in holding representation votes. Under these changes, the Canada Industrial Relations Board would be required to hold a vote to certify a union not just when less than a majority of workers have signed union cards, but would need to do so in all cases. This would mean a fivefold increase in the board's workload.
These bills do not represent a positive contribution to labour relations in Canada. In fact, they cause real harm. It is no surprise that when policies are developed without proper consultation, as was the case with both of these bills, they often end up causing more harm than good. Liberals believe in reforming labour policies through meaningful engagement with unions, employers, stakeholders, provinces and territories, and the Canadian public. It is the only way to ensure a fair and balanced approach to labour relations in Canada. As we have said before, sound labour relations is essential for protecting the rights of Canadian workers and helping the middle class grow and prosper. It is also the necessary foundation of a system where both employers and unions play valuable roles in ensuring that workers receive decent wages and are treated fairly.
I urge all of my colleagues in the House to support Bill C-4 and bring back the fair and balanced labour relations approach all Canadians want and deserve.",Liberal,Davenport,Julie Dzerowicz,
4650801,ca.proc.d.2016-02-03.17056.174,2016-02-03,5848c1f7-b3d9-4dd3-af1c-019e0a321f7a,9984,"Mr. Erin Weir (Regina—Lewvan, NDP)",,Government Orders,Canada Labour Code,,"Mr. Speaker, I would mention that another way of improving wages and living conditions is through a strong minimum-wage policy. Unfortunately, a previous Liberal government removed the federal minimum wage in 1996. When this issue came up in the last Parliament, the Liberals voted in favour of reinstating the federal minimum wage. During the election, they cast some doubt on that idea.
I am wondering if the member for Davenport could clarify whether her government will do the right thing and reinstate a federal minimum wage.",New Democratic Party,Regina--Lewvan,Erin Weir,
4650802,ca.proc.d.2016-02-03.17056.175,2016-02-03,9d4edb74-dcdc-4751-8541-6e42405e2bc5,9430,Ms. Julie Dzerowicz,Interjection,Government Orders,Canada Labour Code,,"Mr. Speaker, I will be speaking to Bill C-4 today. The Government of Canada believes that we should be treating our unions in a fair and balanced way. This is the principle behind repealing Bill C-377 and Bill C-525. The other reason we are also repealing this is the whole process. If there are issues around workers or unions or just human resource policy in Canada, the best way for us to go about dealing with it is in an open, transparent, and consultative way.
To me, that is the way we should be dealing with any of the issues, both now and moving forward.",Liberal,Davenport,Julie Dzerowicz,
4650803,ca.proc.d.2016-02-03.17056.176,2016-02-03,775ebcdb-4561-4bd0-8c84-d14531f2c726,10301,"Mr. John Nater (Perth—Wellington, CPC)",,Government Orders,Canada Labour Code,,"Mr. Speaker, I find it interesting that the Liberal Party, which always talks about empowering the backbenchers, would be so anti-backbench, anti-private members' bills that the previous Parliament passed. It is as though there were something sinister about private members' business in this House. The fact of the matter is, two private members' bills were passed that had support of union members across the country.
I find it fascinating that a party that would tout the benefits of backbenchers and private members' business would then degrade two private members' bills that go to help union members across the country improve transparency. 
There is nothing wrong with private members' business. This party had the most bills passed in a generation under private members' business. 
Will the hon. member comment on why she sees such a negative connotation with private members' business?",Conservative,Perth--Wellington,John Nater,
4650804,ca.proc.d.2016-02-03.17056.177,2016-02-03,9d4edb74-dcdc-4751-8541-6e42405e2bc5,9430,Ms. Julie Dzerowicz,Interjection,Government Orders,Canada Labour Code,,"Mr. Speaker, part of the reason we are repealing this bill is that we believe that there was a huge issue around the process. 
The bill was highly discriminatory and deeply ideological. For it to go through a normal process, it has to be open, transparent, and consultative. The process of a private member's bill did not allow for the intensity of dialogue in consultation with the broad array of stakeholders, as if we went through a normal process.
That is why we are repealing both Bill C-377 and Bill C-525.",Liberal,Davenport,Julie Dzerowicz,
4650805,ca.proc.d.2016-02-03.17056.178,2016-02-03,4abeb9b5-279b-4117-9e04-b8901d9ccc53,255,"Mr. Francis Scarpaleggia (Lac-Saint-Louis, Lib.)",,Government Orders,Canada Labour Code,,"Mr. Speaker, just to the hon. member's point about all the private members' bills that were adopted in the last Parliament, I do not know if he is aware that most of those private members' bills were government bills dressed up as private members' bills, and the government used its majority to get them through. That is why so many were passed.
I think it is quite clear that the previous government was trying to weaken the labour movement. We all agree on that. The question is why was it doing that. If we asked members on the other side, they would say because it would solve problems, it would solve economic problems and solve other problems.
Does the hon. member think that the problems we are having with the economy today are a result of the fact that we have unions, or are there other reasons we are in an economic slowdown?
On the social side, by getting rid of unions, would we have better education? Would we have better health care?",Liberal,Lac-Saint-Louis,Francis Scarpaleggia,http://www.parl.gc.ca/parlinfo/Files/Parliamentarian.aspx?Item=4abeb9b5-279b-4117-9e04-b8901d9ccc53&Language=E&Section=ALL
4650806,ca.proc.d.2016-02-03.17056.179,2016-02-03,9d4edb74-dcdc-4751-8541-6e42405e2bc5,9430,Ms. Julie Dzerowicz,Interjection,Government Orders,Canada Labour Code,,"Mr. Speaker, we very much believe that for Canada to have a strong middle class and a strong economy, we need to have a strong labour movement. We believe that unions play an important role in protecting the rights of Canadian workers and helping unionized workers to access benefits and pensions in addition to what I have just mentioned, helping the middle class grow and prosper.
This is why we are very much committing to repealing Bill C-377 and Bill C-525.",Liberal,Davenport,Julie Dzerowicz,
4650807,ca.proc.d.2016-02-03.17056.180,2016-02-03,3a48d31a-42fc-4320-a84f-da61c251bccd,412,"Mr. Blaine Calkins (Red Deer—Lacombe, CPC)",,Government Orders,Canada Labour Code,,"Mr. Speaker, I am honoured to rise in my place to speak to this today. I will be splitting my time with the member for Central Okanagan—Similkameen—Nicola.
First, I want to thank everyone in the previous Parliament who passed my private member's Bill C-525. I am very disappointed at how this debate has been framed by members in the Liberal Party, the NDP, and others.
My bill is not an anti-union bill. It has been long established that unions have the right to exist and that Canadians have a charter right to associate and affiliate with one another. That is not what is in question here.
My bill is not anti-union. My bill is pro-democracy, and it worked in part with Bill C-377, which is pro-transparency. Those were the issues.
My bill came about as a result of consultations with my constituents. Every time we hear a Liberal MP or an NDP MP talk about consultations, the only people they are talking to are union leaders, or big business.
The Conservative Party actually talks to everyday ordinary Canadians. We know we are on the right side on this issue. We know we are right because polling information clearly indicates where Canadians are and where workers are, in particular where union workers are on this issue.
I already have had a number of calls from constituents and card carrying union members who are disappointed that it is a priority of the Liberal government to undo what we were able to do in the last Parliament, which was bestow a mandatory secret ballot in the process of certifying or decertifying a union.
How can it be called democracy if we take away the right to a secret ballot? It has been established long ago that the hallmark of any modern democracy is a secret ballot vote. Would members of Parliament feel that they were here legitimately if they were able to go door knocking and stand on people's doorsteps, make their pitch and say that they happened to have a ballot in their hands, and a couple of their friends with them, and encourage people to sign those ballots and vote for them. That is exactly what the card check process is.
I have been a member of a union, and my union served me well in times when I needed it. However, I was also in the hall where I heard my union representatives use these kinds of tactics, tactics that we hear of all the time, threats and intimidation, boisterousness, the louder they spoke, the more forceful their point was. It does not matter how right they were, it just mattered how loud they were. It was not necessary. I did not need to be convinced. I was going to support whatever we decided to do as a group. I did not need to be intimidated or beat into line on these issues.
I have also sat across the table as a municipal councillor negotiating on behalf of taxpayers for a public union. I saw through those secret negotiations, much like the ones the NDP always claimed, when we were doing trade negotiations. Every negotiation was done this way. I never heard an NDP member of Parliament say that union negotiations should be done in front of the entire world for everybody to see. Those members think TPP should be done that way, but they do not think a union negotiation should be done that way.
Notwithstanding that hypocrisy, I have been there. I have seen who was looking after who in these negotiations. I saw union leaders ensure that whatever the contract was, if it started to go bad for the union people, the people at the very top, the people with the seniority, not the new people, not the new workers, not the most vulnerable workers in the union, the ones who had the least seniority, but the ones who had the most seniority, the people with the most seniority looked after themselves. They were the ones who rose up to the top of the union leadership. The ones with the least seniority were vulnerable. Whatever negotiations happened, the people at the top made sure they took care of themselves first. 
Where would that union member's right be to hold his or her union leaders to account if they were not actually representing even a junior member of the union to the best of their ability? There was no way because there was no mandatory secret ballot vote to determine who would represent those people at the collective bargaining table. This is absolutely fundamental.
We hear the other side complaining about a number of these issues, that Bill C-525 is anti-union, that it is creating disparity. Bill C-525 actually created the same process for creating a union as decertifying a union. Yet, the minister right now claims that they are going back to a more balanced approach. In her opinion, a more balanced approach would make it far easier for a union to be created and far harder for a union to be decertified. If it is the same way going in as it is going out, I do not understand how that tips the scales. That makes the scales level.
As a union leader, would a person not want to have his or her presence as a collective bargaining agent on behalf of the employees ratified by a secret ballot vote? Would he or she not like to carry that forward in confidence, knowing full well that he or she has 50% plus one of the membership of the union supporting him or her to negotiate a deal that is in their best interests?
The way it worked before my bill was passed was with a card check system. That is fine. A card check system is still used. It is just used to determine the threshold for when a vote should be called. That is fine. We must have some way of gauging interest.
However, we can do a card check under any guise. We can take a card to someone who is neither fluent in English nor French and tell them that they needed to sign this card to receive their pay and benefits. So, they sign a card. They do not know what they are signing. All of a sudden, there is 50% plus one of the members of the union. It was automatic. It is 50% plus one. It was automatic.
Is this not problematic? Does anyone not see an issue with this? It was open to abuse. It was open to intimidation.
What is wrong with a secret ballot?
I do not know whom the members in the Liberal Party consulted. They had closed-door meetings shortly after the election, but every union leader who came before the human resources committee during the deliberations on Bill C-525 had nothing but good things to say about the secret ballot.
 The Christian Labour Association of Canada said that “CLAC supports efforts to...strengthen the democratic rights of workers” and stated that it looked forward to further speaking to the legislation when the Senate dealt with it. The CLAC representative repeated, “Yes, we are in favour of secret ballots.” That is a union leader who said that.
 Robyn Benson of the Public Service Alliance of Canada, the largest public service union in Canada, said:
 Contrary to what you may have heard, PSAC has no issue with voting by secret ballot. We do it regularly to elect our officers, ratify collective agreements, and vote for strike actions, as examples. 
Really? Robyn Benson said that in front of the committee. What is the problem? What is the issue? They want to be legitimized. They want to have that process legitimized.
 FETCO also agreed with it. Mr. Farrell from FETCO said:
 I believe the major disadvantage is that there's no clear evidence that all of the potential union members have had an opportunity to seriously consider the question of a unionization and to express their opinion behind the screen of a ballot box in a secret ballot vote. 
What Mr. Farrell was actually saying and responding to there was a question that is very fundamental. If they do a card check system they actually would not even have to check with all the members of the bargaining unit. They could just go until they got 50% plus one, wipe their hands, call it a day. They did not even check with everyone. People can show up the next day at work never knowing that a union drive had even taken place and be an automatic member of the union.
How is that fair? How is that a democratic process? People do not even have an opportunity to discuss it.
I have a lot more examples. There are numerous polls by Leger and Nanos and ask the question, “Should Canadians have the right to a secret ballot before they decide to join a union or not? What is their best interest?” In every case, as confirmed by the testimony of union leaders themselves, Canadians overwhelmingly, over 70%, and sometimes over 80%, say, “Yes, this is true”. And when they asked an actual union member of someone who was in a union, that number even got higher, sometimes up into the high 80s percentages. 
It makes absolutely no sense. There is not a problem here that needs to be undone, contrary to what these folks over there want Canadians to believe.
We on this side of the House, the Conservative Party, and only the Conservative Party, stand up for transparency and for accountability for workers. 
If anyone in Canada has any doubts who is on the side of the everyday working man and woman in this country, it is Conservative members of Parliament.",Conservative,Red Deer--Lacombe,Blaine Calkins,http://www.parl.gc.ca/parlinfo/Files/Parliamentarian.aspx?Item=3a48d31a-42fc-4320-a84f-da61c251bccd&Language=E&Section=ALL
4650808,ca.proc.d.2016-02-03.17056.181,2016-02-03,07cf5767-802c-406c-92a7-7dc92af79b40,4264,"Mr. Kevin Lamoureux (Parliamentary Secretary to the Leader of the Government in the House of Commons, Lib.)",,Government Orders,Canada Labour Code,,"Mr. Speaker, the member attempts to be compelling in terms of his argument, but let me make a suggestion. Government has a responsibility to promote and encourage harmony and a sense of consensus related to labour relations between big business and unions, and all the different associated stakeholders. That is why we have a process that receives advice and opinions in the formation of legislation that has an impact that could take away from that harmony.
The member might want to crow about his private member's bill, but it was a private member's bill as opposed to a government piece of legislation that would have gone through a process of consultation and working with a wide number of stakeholders that are necessary in order to encourage and promote that harmony.
Why does the member believe the former Conservative government went against good practices of labour relations in adopting and bringing forward legislation and instead took it upon itself to cause mischief when it was just not called for?",Liberal,Winnipeg North,Kevin Lamoureux,http://www.parl.gc.ca/parlinfo/Files/Parliamentarian.aspx?Item=07cf5767-802c-406c-92a7-7dc92af79b40&Language=E&Section=ALL
