basepk,hid,speechdate,pid,opid,speakeroldname,speakerposition,maintopic,subtopic,subsubtopic,speechtext,speakerparty,speakerriding,speakername,speakerurl
4674770,ca.proc.d.2016-06-02.8963454,2016-06-02,60df4944-d66b-4133-a348-2bcde37c8752,214191,"Hon. Maryam Monsef (Minister of Democratic Institutions, Lib.)",,Oral Questions,Democratic Reform,,"Mr. Speaker, our approach from the very beginning has been to bring together a committee made up of all elected parliamentarians to act as a forum for the people of this country, to have their voices, their needs, and their hopes and aspirations known. 
Today, we did something a bit different, according to the members opposite. We were elected on a promise to do politics differently. That means co-operating, that means recognizing that good ideas can come from all parties. I thank all members for their contributions to this healthy debate and look forward to hearing from Canadians.",Liberal,Peterborough—Kawartha,Maryam Monsef,http://www.parl.gc.ca/MembersOfParliament/ProfileMP.aspx?Key=214191&Language=E
4674771,ca.proc.d.2016-06-02.8963456,2016-06-02,cf6f39df-d304-45e1-a559-70a0cf20a720,214568,"Hon. Rona Ambrose (Leader of the Opposition, CPC)",,Oral Questions,Democratic Reform,,"Mr. Speaker, this is not a decision for politicians to make; it is a decision for Canadians to make.
Instead, the Liberals and the NDP negotiate in secret, making deals in the backroom to actually take that decision away from Canadians. No matter who the committee talks to and no matter what report it writes, at the end of the day it is up to Canadians to say yes or no.
Why are the NDP and the Liberals taking that right away from Canadians?",Conservative,Sturgeon River—Parkland,Rona Ambrose,http://www.parl.gc.ca/MembersOfParliament/ProfileMP.aspx?Key=214568&Language=E
4674772,ca.proc.d.2016-06-02.8963458,2016-06-02,60df4944-d66b-4133-a348-2bcde37c8752,214191,"Hon. Maryam Monsef (Minister of Democratic Institutions, Lib.)",,Oral Questions,Democratic Reform,,"Mr. Speaker, we are going to do three things. First, we are going to engage Canadians on their electoral reform. That is what the committee, on which we no longer have a majority, is going to do. Second, based on the committee's feedback and the input we receive from all Canadians, we are going to bring recommendations to this place. It will be up to all members to debate that. Third, we will not move forward on changes without the consent of Canadians.",Liberal,Peterborough—Kawartha,Maryam Monsef,http://www.parl.gc.ca/MembersOfParliament/ProfileMP.aspx?Key=214191&Language=E
4674773,ca.proc.d.2016-06-02.8963463,2016-06-02,75d4be3f-f1cf-499d-882b-6415247900e6,217508,"Mr. Alain Rayes (Richmond—Arthabaska, CPC)",,Oral Questions,Democratic Reform,,"Mr. Speaker, we already know that the government has shown no interest in really consulting Canadians and is refusing to hold a referendum. Now, today, it has the audacity to ally itself with the NDP.
What the government is trying to sell as co-operation is actually a secret agreement between two parties that do not care about what Canadians want.
The real question is this: will the Liberals try to change the rules of democracy to their advantage or are they trying out an agreement with the NDP rather than consulting Canadians directly through a referendum?",Conservative,Richmond—Arthabaska,Alain Rayes,http://www.parl.gc.ca/MembersOfParliament/ProfileMP.aspx?Key=217508&Language=E
4674774,ca.proc.d.2016-06-02.8963471,2016-06-02,60df4944-d66b-4133-a348-2bcde37c8752,214191,"Hon. Maryam Monsef (Minister of Democratic Institutions, Lib.)",,Oral Questions,Democratic Reform,,"Mr. Speaker, it is unfortunate that the Conservatives cannot move beyond their narrow political interests in protecting the status quo and allow Canadians to have a say in this process.
The concept of asking a committee to reach out to Canadians may be a strange one to the members opposite, but it makes most sense to Canadians and most of us on this side of the aisle—",Liberal,Peterborough—Kawartha,Maryam Monsef,http://www.parl.gc.ca/MembersOfParliament/ProfileMP.aspx?Key=214191&Language=E
4674775,ca.proc.d.2016-06-02.p4397010,2016-06-02,,,,intervention,Oral Questions,Democratic Reform,," Oh, oh!",,,Some hon. members,
4674776,ca.proc.d.2016-06-02.8963473,2016-06-02,3176068f-62ee-4b2f-aacd-1131201c6db1,214707,The Speaker,,Oral Questions,Democratic Reform,,"Most members are able to listen to the question and the answer, even though they do not like what they hear, without reacting. That is the polite thing to do, so let us do that.
The hon. member for Richmond—Arthabaska.",Liberal,Halifax West,Geoff Regan,http://www.parl.gc.ca/MembersOfParliament/ProfileMP.aspx?Key=214707&Language=E
4674777,ca.proc.d.2016-06-02.8963475,2016-06-02,75d4be3f-f1cf-499d-882b-6415247900e6,217508,"Mr. Alain Rayes (Richmond—Arthabaska, CPC)",,Oral Questions,Democratic Reform,,"Mr. Speaker, we are beginning to see through the Liberals' little game.
Canadians must be extremely worried about what they are seeing today. We have been saying from the start that it does not make any sense to change the voting system, the very basis of our democracy, through a committee. The fact that two parties have agreed to call the shots together does not make the situation any better. The only way to make an electoral reform legitimate is to seek Canadians' approval. 
Will the Liberals finally agree to hold a referendum to ask Canadians directly, yes or no? Will they set partisanship aside?",Conservative,Richmond—Arthabaska,Alain Rayes,http://www.parl.gc.ca/MembersOfParliament/ProfileMP.aspx?Key=217508&Language=E
4674778,ca.proc.d.2016-06-02.8963477,2016-06-02,60df4944-d66b-4133-a348-2bcde37c8752,214191,"Hon. Maryam Monsef (Minister of Democratic Institutions, Lib.)",,Oral Questions,Democratic Reform,,"Mr. Speaker, unlike the member opposite, we have a great deal of respect for the work that committees have done and continue to do on behalf of Canadians. The special all-party committee is going to come together. The Bloc and the Green Party will have a vote. The government does not have a majority on the committee, but the opposition does.",Liberal,Peterborough—Kawartha,Maryam Monsef,http://www.parl.gc.ca/MembersOfParliament/ProfileMP.aspx?Key=214191&Language=E
4674779,ca.proc.d.2016-06-02.8963480,2016-06-02,a710e2c4-20f9-4df8-ba6c-2dc50c03bb75,217321,"Ms. Marjolaine Boutin-Sweet (Hochelaga, NDP)",,Oral Questions,Dairy Industry,,"Mr. Speaker, the last time that dairy farmers came to protest on the Hill, the government told them not to worry, that it would take 30 days to hold discussions and find a solution. It has been more than 30 days, and we still have nothing.
Today, the farmers are back, and there are even more of them. For them, it is a matter of survival.
Will the government finally listen to their pleas and fix the diafiltered milk problem once and for all?",New Democratic Party,Hochelaga,Marjolaine Boutin-Sweet,http://www.parl.gc.ca/MembersOfParliament/ProfileMP.aspx?Key=217321&Language=E
4674780,ca.proc.d.2016-06-02.8963483,2016-06-02,ae40e780-7dd1-4e34-bf90-4dbb35c18443,219902,"Mr. Jean-Claude Poissant (Parliamentary Secretary to the Minister of Agriculture and Agri-Food, Lib.)",,Oral Questions,Dairy Industry,,"Mr. Speaker, as a producer, I am proud to see so many farmers coming together today to honour of World Milk Day and to protect the supply management system that some want to abolish.
With respect to our commitment, we are still listening to the people in the industry. This morning, we met with the organizers of today's event. We will defend our supply management system, which provides stability to thousands of Canadian families. We fought to bring in supply management, and we will fight to defend Canadian families.",Liberal,La Prairie,Jean-Claude Poissant,http://www.parl.gc.ca/MembersOfParliament/ProfileMP.aspx?Key=219902&Language=E
4674781,ca.proc.d.2016-06-02.8963488,2016-06-02,a710e2c4-20f9-4df8-ba6c-2dc50c03bb75,217321,"Ms. Marjolaine Boutin-Sweet (Hochelaga, NDP)",,Oral Questions,Dairy Industry,,"Mr. Speaker, we are hearing plenty of rhetoric and talking points, but what farmers want is action.
Dairy farmers are losing tens of thousands of dollars a week because the government continues to drag its feet. Our supply management system has helped our farmers prosper, but the many cracks are jeopardizing their future.
When the government gives in to free trade agreements, it promises compensation, but no one has seen any cash yet.
Why is the government treating our farmers with such contempt?",New Democratic Party,Hochelaga,Marjolaine Boutin-Sweet,http://www.parl.gc.ca/MembersOfParliament/ProfileMP.aspx?Key=217321&Language=E
4674782,ca.proc.d.2016-06-02.8963490,2016-06-02,ae40e780-7dd1-4e34-bf90-4dbb35c18443,219902,"Mr. Jean-Claude Poissant (Parliamentary Secretary to the Minister of Agriculture and Agri-Food, Lib.)",,Oral Questions,Dairy Industry,,"Mr. Speaker, this is the government that set up supply management and this is the government that will defend it.
As promised, we are meeting with industry stakeholders across the country. Over the past few weeks, we have listened to them and had many very productive discussions that will help us develop a sustainable, long-term strategy for the entire sector.",Liberal,La Prairie,Jean-Claude Poissant,http://www.parl.gc.ca/MembersOfParliament/ProfileMP.aspx?Key=219902&Language=E
4674783,ca.proc.d.2016-06-02.8963492,2016-06-02,0f7e3c8d-e579-44c0-b8b7-202b425758e4,218968,"Ms. Tracey Ramsey (Essex, NDP)",,Oral Questions,Dairy Industry,,"Mr. Speaker, the fact is for decades, supply management has guaranteed reliable and safe poultry and milk, meaning stable livelihoods for hundreds of thousands of Canadians. But now Liberals are pushing ahead with a job-killing TPP trade deal with no sign of compensation for dairy producers who stand to lose big from this bad deal. 
Canadian farmers are tired of the deafening silence from the government. Why are Liberals backing away from their commitment to Canadian farmers?",New Democratic Party,Essex,Tracey Ramsey,http://www.parl.gc.ca/MembersOfParliament/ProfileMP.aspx?Key=218968&Language=E
4674784,ca.proc.d.2016-06-02.8963494,2016-06-02,ae40e780-7dd1-4e34-bf90-4dbb35c18443,219902,"Mr. Jean-Claude Poissant (Parliamentary Secretary to the Minister of Agriculture and Agri-Food, Lib.)",,Oral Questions,Dairy Industry,,"Mr. Speaker, as I just said, we are aware of the industry's concerns about the use of diafiltered milk in cheese production. 
The government and the industry are working together to come up with a sustainable, long-term solution for all Canadians. Our government fully supports supply management.",Liberal,La Prairie,Jean-Claude Poissant,http://www.parl.gc.ca/MembersOfParliament/ProfileMP.aspx?Key=219902&Language=E
4674785,ca.proc.d.2016-06-02.8963496,2016-06-02,0f7e3c8d-e579-44c0-b8b7-202b425758e4,218968,"Ms. Tracey Ramsey (Essex, NDP)",,Oral Questions,Dairy Industry,,"Mr. Speaker, that was the story 30 days ago and remains the same today with more farmers standing here on the Hill. I know the Liberal MPs were quick to shake hands with the dairy farmers on the lawn, but when it comes to rolling up their sleeves and taking action to defend dairy producers, Liberals are nowhere to be seen. Imported diafiltered milk undermines our supply-managed system and cost Canadian dairy producers more than $220 million just last year. A fix is simple and quick. Why are the Liberals failing to enforce laws and protect Canadian dairy farmers?",New Democratic Party,Essex,Tracey Ramsey,http://www.parl.gc.ca/MembersOfParliament/ProfileMP.aspx?Key=218968&Language=E
4674786,ca.proc.d.2016-06-02.8963498,2016-06-02,ae40e780-7dd1-4e34-bf90-4dbb35c18443,219902,"Mr. Jean-Claude Poissant (Parliamentary Secretary to the Minister of Agriculture and Agri-Food, Lib.)",,Oral Questions,Dairy Industry,,"Mr. Speaker, supply management is part of our values as a government. 
Unlike the members of the official opposition, who are advocating to eliminate it, we will protect it. On this side of the House, our priority is to have a modern, prosperous industry that will continue to grow in this ever-changing global economy, and to ensure stability for our farm families.",Liberal,La Prairie,Jean-Claude Poissant,http://www.parl.gc.ca/MembersOfParliament/ProfileMP.aspx?Key=219902&Language=E
4674787,ca.proc.d.2016-06-02.8963501,2016-06-02,a10a55d4-becb-4b98-b780-9fa8cfd5aa12,218767,"Mr. Phil McColeman (Brantford—Brant, CPC)",,Oral Questions,Democratic Reform,,"Mr. Speaker, it is time for the Minister of Democratic Institutions to stop using persons with disabilities as tools to prop up her argument. Elections Canada is constantly working to make voting easier for persons with disabilities. She knows that work is ongoing and she knows that the work has absolutely nothing to do with changing the voting system.
Will the Minister of Democratic Institutions stop using persons with disabilities as a ploy for her increasingly weak arguments against holding a referendum?",Conservative,Brantford—Brant,Phil McColeman,http://www.parl.gc.ca/MembersOfParliament/ProfileMP.aspx?Key=218767&Language=E
4674788,ca.proc.d.2016-06-02.8963504,2016-06-02,60df4944-d66b-4133-a348-2bcde37c8752,214191,"Hon. Maryam Monsef (Minister of Democratic Institutions, Lib.)",,Oral Questions,Democratic Reform,,"Mr. Speaker, days ago I met, along with the Minister of Sport and Persons with Disabilities, with the Elections Canada advisory group on persons with disabilities. 
During this conversation, we were asked to bring their voices to this place. We were told that the very act of voting remains an obstacle course for many persons with disabilities. Our job in the House is not to just speak on behalf of those who have privilege and means. Our job is to ensure that the voices of the marginalized are included in this conversation.",Liberal,Peterborough—Kawartha,Maryam Monsef,http://www.parl.gc.ca/MembersOfParliament/ProfileMP.aspx?Key=214191&Language=E
4674789,ca.proc.d.2016-06-02.8963507,2016-06-02,00c812a1-d71b-48b6-8c98-8633505a63b4,213951,"Hon. Mike Lake (Edmonton—Wetaskiwin, CPC)",,Oral Questions,Democratic Reform,,"Mr. Speaker, the minister's repeated use of people with disabilities as strategic pieces in her political game is not okay.
My son Jaden has autism and he cast his first vote in October. The Elections Canada folks were absolutely wonderful in helping him through that process. 
Having a referendum on which voting system to use will have absolutely no impact on Jaden's ability to vote. Will the minister please call a referendum and let all Canadians, including every Canadian with a disability, have their say on this important issue?",Conservative,Edmonton—Wetaskiwin,Mike Lake,http://www.parl.gc.ca/MembersOfParliament/ProfileMP.aspx?Key=213951&Language=E
4674790,ca.proc.d.2016-06-02.8963509,2016-06-02,60df4944-d66b-4133-a348-2bcde37c8752,214191,"Hon. Maryam Monsef (Minister of Democratic Institutions, Lib.)",,Oral Questions,Democratic Reform,,"Mr. Speaker, I am grateful that Jaden has had a positive experience in participating in the democratic process. That is the kind of full participation that we would like to see from all persons with disabilities and exceptionalities.
Our intent is to enhance the number of those who vote. Our intent is to enhance accessibility. Out intent is to be more inclusive in our approach to good governance, and we will deliver on that intent by continuing to listen to Canadians and by speaking on behalf of those who do not have as big a voice in this place.",Liberal,Peterborough—Kawartha,Maryam Monsef,http://www.parl.gc.ca/MembersOfParliament/ProfileMP.aspx?Key=214191&Language=E
4674791,ca.proc.d.2016-06-02.8963514,2016-06-02,62bfd797-8d32-425b-91b1-1422ca16694f,224621,"Mr. Blake Richards (Banff—Airdrie, CPC)",,Oral Questions,Democratic Reform,,"Mr. Speaker, the Minister of Democratic Institutions claims that she wants to have a conversation, but instead seems to be doing a really good job of dancing around the real question.
It is a question to which millions of Canadians are demanding an answer. It is also a question I have asked the minister several times in a very straightforward yes or no manner, and I have heard nothing but platitudes in return.
Let me try once again. Will the Liberals finally drop the platitudes and commit to a referendum, yes or no?",Conservative,Banff—Airdrie,Blake Richards,http://www.parl.gc.ca/MembersOfParliament/ProfileMP.aspx?Key=224621&Language=E
4674792,ca.proc.d.2016-06-02.8963518,2016-06-02,60df4944-d66b-4133-a348-2bcde37c8752,214191,"Hon. Maryam Monsef (Minister of Democratic Institutions, Lib.)",,Oral Questions,Democratic Reform,,"Mr. Speaker, today we did something that is a little different for the members opposite. We reached out across the aisle and worked collaboratively with the parties opposite to enhance the process.
We need to move this debate away from a debate on process and get to the substance of hearing from Canadians what their thoughts and ideas are for electoral reform. Only then can we begin to discover ways to determine how to engage their broad support on any changes we move forward. 
Today was step one, and I look forward to working with all members of the House.",Liberal,Peterborough—Kawartha,Maryam Monsef,http://www.parl.gc.ca/MembersOfParliament/ProfileMP.aspx?Key=214191&Language=E
4674793,ca.proc.d.2016-06-02.8963521,2016-06-02,62bfd797-8d32-425b-91b1-1422ca16694f,224621,"Mr. Blake Richards (Banff—Airdrie, CPC)",,Oral Questions,Democratic Reform,,"Mr. Speaker, the Liberals claim they want to consult, but the whole point of consultation is to ask people their opinion, not to have backroom deals with other political parties.
What better way to get the opinion of every single Canadian than to ask them in a referendum? The Liberals are refusing to give Canadians a final say. 
Why do they not commit to giving this important decision to all Canadians, not to political parties, through a referendum?",Conservative,Banff—Airdrie,Blake Richards,http://www.parl.gc.ca/MembersOfParliament/ProfileMP.aspx?Key=224621&Language=E
4674794,ca.proc.d.2016-06-02.8963523,2016-06-02,60df4944-d66b-4133-a348-2bcde37c8752,214191,"Hon. Maryam Monsef (Minister of Democratic Institutions, Lib.)",,Oral Questions,Democratic Reform,,"Mr. Speaker, when the former government decided to bring forward the Fair Elections Act, did the Conservatives consult with parliamentarians? Did they consult with Canadians? Did they hold a referendum? Did they include the voice of the Chief Electoral Officer and include his feedback in the changes they brought forward? They did not.
We have learned from their mistakes. We will engage with Canadians. 
We have empowered a special all-party committee to hear from Canadians what their views are before thoughtfully bringing forward a plan for the House for deliberation. We will do that in a respectful and inclusive manner.",Liberal,Peterborough—Kawartha,Maryam Monsef,http://www.parl.gc.ca/MembersOfParliament/ProfileMP.aspx?Key=214191&Language=E
4674795,ca.proc.d.2016-06-02.8963525,2016-06-02,27d8ca3d-1740-41b6-872b-6ceb646cdd31,224217,"Mr. Scott Reid (Lanark—Frontenac—Kingston, CPC)",,Oral Questions,Democratic Reform,,"Mr. Speaker, if I understand the first part of the minister's response, she said the last government acted inexcusably and now it is her party's turn to do so.
The only protection Canadians have against the Liberal plan to rig the next election is the de facto veto afforded by a referendum.
The Prime Minister said today that he does not think his proposal could win the support of the Canadian people. Is that not the best reason for having a referendum?",Conservative,Lanark—Frontenac—Kingston,Scott Reid,http://www.parl.gc.ca/MembersOfParliament/ProfileMP.aspx?Key=224217&Language=E
4674796,ca.proc.d.2016-06-02.8963529,2016-06-02,60df4944-d66b-4133-a348-2bcde37c8752,214191,"Hon. Maryam Monsef (Minister of Democratic Institutions, Lib.)",,Oral Questions,Democratic Reform,,"Mr. Speaker, after 10 years of undermining our democratic institutions, the party opposite was asked to stay in opposition. 
Canadians provided us with a mandate for change. They asked us to do politics differently. They asked us to work collaboratively with other parties. They asked us to listen to their ideas before unilaterally making any changes.
Today we demonstrated that this is the way we will govern. This is good governance. We will continue to listen to Canadians and we look forward to bringing our electoral system into the 21st century. ",Liberal,Peterborough—Kawartha,Maryam Monsef,http://www.parl.gc.ca/MembersOfParliament/ProfileMP.aspx?Key=214191&Language=E
4674797,ca.proc.d.2016-06-02.8963534,2016-06-02,3176068f-62ee-4b2f-aacd-1131201c6db1,214707,The Speaker,,Oral Questions,Democratic Reform,,"We are hearing a lot of banter and response when ministers are answering questions. I think that colleagues ought to have confidence in the ability of their colleagues to offer arguments in response to an answer, or a question for that matter, without having to intervene when they do not have a mic on anyway. 
Now the mic will be on for the hon. member for Lanark—Frontenac—Kingston. Let us listen to him.",Liberal,Halifax West,Geoff Regan,http://www.parl.gc.ca/MembersOfParliament/ProfileMP.aspx?Key=214707&Language=E
4674798,ca.proc.d.2016-06-02.8963535,2016-06-02,27d8ca3d-1740-41b6-872b-6ceb646cdd31,224217,"Mr. Scott Reid (Lanark—Frontenac—Kingston, CPC)",,Oral Questions,Democratic Reform,,"Mr. Speaker, on May 10, the minister defended the then structure of the proposed special committee on electoral reform by saying that after the committee had done its work, their team will then “present cabinet with a proposal”. 
In other words, there is a committee on which the Green Party, the Bloc, and the NDP will sit, but when the actual decision gets made, when the actual proposal is designed, the actual legislation that will come before Canadians to change our electoral system, only Liberals will be in the room. It will happen in secret. Nobody will be present. We will have no way of finding out what is going on. 
The Liberals maintain their monopoly. That is inexcusable. Why will the member not allow the Canadian citizenry to make the final choice in a referendum?",Conservative,Lanark—Frontenac—Kingston,Scott Reid,http://www.parl.gc.ca/MembersOfParliament/ProfileMP.aspx?Key=224217&Language=E
4674799,ca.proc.d.2016-06-02.8963538,2016-06-02,60df4944-d66b-4133-a348-2bcde37c8752,214191,"Hon. Maryam Monsef (Minister of Democratic Institutions, Lib.)",,Oral Questions,Democratic Reform,,"Mr. Speaker, on October 19, Canadians made a choice. They mandated us to govern this country in an inclusive and responsible manner. 
On May 10, I put forward a motion to begin the work of hearing from Canadians what their thoughts are. We did so with the complete intent of hearing from all Canadians and all parties on ways to improve this process. The New Democratic Party provided valuable insight, as did all members of the House. We took that into consideration and we came to this place with a refined approach. 
We look forward to working with all members of the House to continue to enhance this.",Liberal,Peterborough—Kawartha,Maryam Monsef,http://www.parl.gc.ca/MembersOfParliament/ProfileMP.aspx?Key=214191&Language=E
4674800,ca.proc.d.2016-06-02.8963540,2016-06-02,08f8d23a-fbea-4e7b-ba41-34c9f62dde9e,214056,"Ms. Anne Minh-Thu Quach (Salaberry—Suroît, NDP)",,Oral Questions,Dairy Industry,,"Mr. Speaker, at noon today, hundreds of dairy producers from the Montérégie region demonstrated on Parliament Hill to protest the Liberals' inaction.
The government promised to resolve the diafiltered milk problem before today, but that fake milk is still streaming across the border.
Our producers lost $220 million last year alone because of this. Our regional economies and the next generation of farmers are in jeopardy. This situation is beyond urgent.
Why is the government dragging its feet and forcing dairy producers to struggle through more lean years instead of simply enforcing its own rules?",New Democratic Party,Salaberry—Suroît,Anne Minh-Thu Quach,http://www.parl.gc.ca/MembersOfParliament/ProfileMP.aspx?Key=214056&Language=E
4674801,ca.proc.d.2016-06-02.8963544,2016-06-02,ae40e780-7dd1-4e34-bf90-4dbb35c18443,219902,"Mr. Jean-Claude Poissant (Parliamentary Secretary to the Minister of Agriculture and Agri-Food, Lib.)",,Oral Questions,Dairy Industry,,"Mr. Speaker, as I just said, we are aware of the industry's concerns about the use of diafiltered milk. As promised, we are meeting with people from the industry across the country. Our government will protect supply management.",Liberal,La Prairie,Jean-Claude Poissant,http://www.parl.gc.ca/MembersOfParliament/ProfileMP.aspx?Key=219902&Language=E
4674802,ca.proc.d.2016-06-02.8963546,2016-06-02,f1ca301b-cd67-48b5-9dd4-0f6c2af5454e,217309,"Ms. Karine Trudel (Jonquière, NDP)",,Oral Questions,Dairy Industry,,"Mr. Speaker, I am sick and tired of the same old lines, and if you do not mind, I am going to throw a little tantrum.
The Liberals are so frustrating. This problem should have been dealt with immediately. They promised that the diafiltered milk issue would be resolved by now. They are obviously not walking the talk. 
The government has to stop saying that enforcing the law is complicated. Either the stuff is milk or it is an ingredient. Pick one. 
In Saguenay—Lac-Saint-Jean alone, farmers are losing $3 million in revenue.
Will the government keep its promise, or was that all just talk?",New Democratic Party,Jonquière,Karine Trudel,http://www.parl.gc.ca/MembersOfParliament/ProfileMP.aspx?Key=217309&Language=E
