basepk,hid,speechdate,pid,opid,speakeroldname,speakerposition,maintopic,subtopic,subsubtopic,speechtext,speakerparty,speakerriding,speakername,speakerurl
4689578,ca.proc.d.2016-11-23.9255894,2016-11-23,3176068f-62ee-4b2f-aacd-1131201c6db1,214707,The Speaker,,,,," It being Wednesday, we will now have the singing of the national anthem, led by the hon. member for Abitibi—Témiscamingue.
  [Members sang the national anthem]  ",Liberal,Halifax West,Geoff Regan,http://www.parl.gc.ca/MembersOfParliament/ProfileMP.aspx?Key=214707&Language=E
4689579,ca.proc.d.2016-11-23.9255902,2016-11-23,86fed1de-3861-4448-8242-ad414073ef2e,220085,"Ms. Joyce Murray (Vancouver Quadra, Lib.)",,Statements By Members,Small Business,,"Mr. Speaker, small business is the lifeblood of communities across Canada, and all Canadians benefit when we promote local businesses. 
Small Business BC, which is supported by Western Economic Diversification Canada, is seeking nominations this month for the Small Business BC Awards, and I encourage all British Columbians to nominate an entrepreneur in their community by November 30.
In my community of Vancouver Quadra, the West Broadway Business Improvement Association has a “Stars on Broadway” initiative, which is shining a light on merchants who have been in business for more than 20 years. We have more than 70 of these unsung pillars of the community between Collingwood and Larch Street alone, from Ace Cycles, established in 1946, to the Toybox in 1972, Kidsbooks in 1983, and Nat's pizza in 1992, plus so many more.
From their stores to their stories, small businesses matter. I invite all members of this House to check out and thank the small businesses in their communities.",Liberal,Vancouver Quadra,Joyce Murray,http://www.parl.gc.ca/MembersOfParliament/ProfileMP.aspx?Key=220085&Language=E
4689580,ca.proc.d.2016-11-23.9255905,2016-11-23,b6808e95-1c75-4909-ab86-319d3519016a,217735,"Hon. Lisa Raitt (Milton, CPC)",,Statements By Members,Energy Costs,,"Mr. Speaker, the Liberals are already demanding that families in my riding of Milton, Ontario, and all across Canada, pay a new carbon tax that will drive up the cost of everything and force businesses to lay off workers; but wait, there is more.
To appease special interest friends, they are now overriding the provinces and dictating how they generate electricity and in the process are driving up hydro bills. Even Kathleen Wynne has admitted that she was wrong to force Ontario families to suffer in this way. 
When will the Prime Minister have to apologize for the suffering his hydro price hike will cause?
This has nothing to do with the environment. It has to do with a Liberal government arrogantly thinking it can force people to change their lifestyles just to fall in line with Liberal ideology.
Some provinces need coal-fired electricity, especially in the winter months. Forcing provinces to replace this capacity, without any real plan to do so, will cost billions of dollars and jobs across Canada.",Conservative,Milton,Lisa Raitt,http://www.parl.gc.ca/MembersOfParliament/ProfileMP.aspx?Key=217735&Language=E
4689581,ca.proc.d.2016-11-23.9255921,2016-11-23,3b9aadd7-086c-4788-8f4e-bbb6cc46f2c9,224996,"Mrs. Brenda Shanahan (Châteauguay—Lacolle, Lib.)",,Statements By Members,Danielle Wolfe,,"Mr. Speaker, I would like to pay tribute to an individual who made a tremendous contribution to the development of Châteauguay—Lacolle. Danielle Wolfe died of cancer on October 25 at the age of 57. 
Originally from Saint-Rémi, Danielle was well known in the community for her remarkable social involvement. She spent the past 10 years valiantly heading up a local volunteer centre, the Centre d'action bénévole du Grand Châteauguay. 
A trained social worker, she was involved in numerous causes, including women's shelters and women's centres. Fighting for women's rights was her life's work, her hobby, and her passion. Danielle was awarded the National Assembly medal for her many hours of volunteer work. Although she left us too soon, Danielle leaves behind an admirable legacy.",Liberal,Châteauguay—Lacolle,Brenda Shanahan,http://www.parl.gc.ca/MembersOfParliament/ProfileMP.aspx?Key=224996&Language=E
4689582,ca.proc.d.2016-11-23.9255924,2016-11-23,f1ca301b-cd67-48b5-9dd4-0f6c2af5454e,217309,"Ms. Karine Trudel (Jonquière, NDP)",,Statements By Members,Jonquière Community Centre,,"Mr. Speaker, 2016 will have been yet another fantastic year for Patro de Jonquière, an organization that reaches out to over 15,000 youth every year thanks to the energy and dedication of its entire team. What a great success story.
The organization is able to have this huge impact on the community thanks to the efforts of 200 volunteers and dozens of young people who work as assistants and facilitators every year. As it is constantly evolving, Patro now needs a new gymnasium in order to continue offering quality services to youth in the entire Jonquière region.
With the help of its inspiring team and the community, we sincerely hope to see Patro inaugurate a new gymnasium in time for its 70th anniversary.
I am proud to support Patro de Jonquière and wish them many years of success. ",New Democratic Party,Jonquière,Karine Trudel,http://www.parl.gc.ca/MembersOfParliament/ProfileMP.aspx?Key=217309&Language=E
4689583,ca.proc.d.2016-11-23.9255927,2016-11-23,6f563895-ecb5-41c5-bcec-9c45d63bed5c,216092,"Mr. Seamus O'Regan (St. John's South—Mount Pearl, Lib.)",,Statements By Members,Volunteer Firefighters,,"Mr. Speaker, last month I went to the 40th anniversary of the Goulds Volunteers fire department at St. Kevin's Parish Hall, along with the hon. John Crosbie and his wife, Jane.
It was a marvellous evening during which Mr. Crosbie took a moment to give his thoughts on the then impending U.S. election in the tactful, diplomatic language for which he is known in this House. 
As I was leaving, one of the firemen pulled me aside and said, “I have heard you give statements in the House of Commons. I think you should give one to honour all the volunteer firemen in Canada and all the families who wait for them at home.” I told him I would. 
I thank all our volunteer firemen and their families for their time, their courage, and their heart. Keep safe, and thanks for keeping us safe. ",Liberal,St. John's South—Mount Pearl,Seamus O'Regan,http://www.parl.gc.ca/MembersOfParliament/ProfileMP.aspx?Key=216092&Language=E
4689584,ca.proc.d.2016-11-23.9255931,2016-11-23,77945d39-8e4a-4fd1-9786-441ff928f6f9,218595,"Mr. Bev Shipley (Lambton—Kent—Middlesex, CPC)",,Statements By Members,Small Business,,"Mr. Speaker, I want to give a shout-out to all the amazing small businesses in my riding of Lambton—Kent—Middlesex. Every day they work hard and greatly contribute to our communities. 
Two young hockey-player entrepreneurs, Matt Laberge and Dan Black, created Clap Balm, a hand deodorizer that gets the smell of hockey gloves off players' hands. They saw a hole in the market for a necessary product and took a shot at it, with great success. This is just one example of the ingenuity and initiative I see all the time in our small towns and rural areas.
My colleagues and I continue to encourage the government to stop raising taxes on small businesses. Rather, assist these people who provide so much in our rural communities. ",Conservative,Lambton—Kent—Middlesex,Bev Shipley,http://www.parl.gc.ca/MembersOfParliament/ProfileMP.aspx?Key=218595&Language=E
4689585,ca.proc.d.2016-11-23.9255934,2016-11-23,330c0119-cf49-4e85-9407-539367825c2b,219879,"Mr. Chris Bittle (St. Catharines, Lib.)",,Statements By Members,Baseball Hall of Fame,,"Mr. Speaker, I rise today to speak of an upcoming ballot. This is not a matter for the Minister of Democratic Institutions. I am speaking about the Baseball Hall of Fame ballot. Though it may seem unusual to speak about baseball in this frigid week in Ottawa, a player is on the ballot in his final year of eligibility and is worthy of our support: Tim Raines.
 Raines was one of the finest baseball players of the 1980s. He was the National League batting champion in 1986. For five years he was measured as the most valuable player in the National League and had an impressive on-base percentage, on par with Tony Gwynn, who is a hall of famer. Raines was one of the greatest leadoff hitters of all time and is fifth in stolen bases. Why is he not in the hall of fame already? The only knock against Raines is that he played his best years for the Montreal Expos. 
As an ESPN columnist pointed out, when one googles the phrase “Tim Raines shouldn't be in the hall of fame”, it produces zero results.
I call upon the voters, the members of the Baseball Writers' Association, to right this wrong and vote Tim Raines into the hall of fame.",Liberal,St. Catharines,Chris Bittle,http://www.parl.gc.ca/MembersOfParliament/ProfileMP.aspx?Key=219879&Language=E
4689586,ca.proc.d.2016-11-23.9255938,2016-11-23,8942c6f2-bfc8-4275-97bb-a5086a07138e,215862,"Mr. Gagan Sikand (Mississauga—Streetsville, Lib.)",,Statements By Members,Mississauga—Streetsville Youth Council,,"Mr. Speaker, this past weekend I hosted the first Mississauga—Streetsville youth council meeting. Youth from all across my riding met with me to bring their concerns to my attention and to suggest how our government can improve and what we need to focus on. 
I was especially pleased about the mature manner in which they discussed mental health and how comfortable they were sharing their pressures with me. 
 Speaking with my young constituents was informative. The ideas of young Canadians are crucial, as they will inherit the decisions we make today. I would like to thank Dev'Roux, Stephanie, Julien, Aiyhab, Shre, Hammad, Shayan, Mohammad, Arielle, Fatima, Gunjan, Melissa, William, Jassimar, Gurkaran, Saad, Joyce, Zain, and Saara.",Liberal,Mississauga—Streetsville,Gagan Sikand,http://www.parl.gc.ca/MembersOfParliament/ProfileMP.aspx?Key=215862&Language=E
4689587,ca.proc.d.2016-11-23.9255951,2016-11-23,3838746e-29a4-4a93-8239-a2b17a3b387f,216782,"Mr. Mark Warawa (Langley—Aldergrove, CPC)",,Statements By Members,Holodomor,,"Mr. Speaker, there are 1.3 million Canadians of Ukrainian descent, and I am honoured to be one of them. I encourage everyone to stand with Ukrainians to remember another horrific genocide of the last century, known as Holodomor. 
On November 26, we remember millions of Ukrainian men, women, and children who were killed by starvation from 1932-1933. This atrocity was perpetrated by the brutal Stalin regime. Stalin had all the food in eastern Ukraine confiscated. Ten million died by starvation.
 We are blessed to live in Canada, a country that values human rights, democracy, and the rule of law. It is our responsibility to remember what happened during Holodomor and to recommit ourselves to defending human rights and the dignity of every person. We stand with Ukrainians by sharing in their grief and sharing their hope. 
 Vechnaya Pamyat. ",Conservative,Langley—Aldergrove,Mark Warawa,http://www.parl.gc.ca/MembersOfParliament/ProfileMP.aspx?Key=216782&Language=E
4689588,ca.proc.d.2016-11-23.9255955,2016-11-23,e321e85f-f1c1-4482-bf16-f640eb41e9f9,219678,"Mr. Ahmed Hussen (York South—Weston, Lib.)",,Statements By Members,International Decade for People of African Descent,,"Mr. Speaker, the UN General Assembly has proclaimed 2015 to 2024 the international Decade for People of African Descent. 
 Themes for this decade are recognition, justice, and development. Each theme sets out a list of goals that all countries should try to meet. We can achieve these goals by bringing back Canada's action plan against racism to address the problem of systemic racism directed at African Canadians.
The African Canadian community is the third-largest visible minority. Many disproportionately live in poverty and are overrepresented in correctional institutions. We must take action together. This decade provides us that opportunity.
I urge our government to exercise its leadership to ensure that the objectives of the decade are achieved. We must stay true to our core Canadian values and continue to remove barriers to full opportunity and equality for all Canadians. ",Liberal,York South—Weston,Ahmed Hussen,http://www.parl.gc.ca/MembersOfParliament/ProfileMP.aspx?Key=219678&Language=E
4689589,ca.proc.d.2016-11-23.9255960,2016-11-23,e1f28a5b-c4f6-453e-8d78-f346683e1fb8,215948,"Mr. Dan Ruimy (Pitt Meadows—Maple Ridge, Lib.)",,Statements By Members,Dennis TeBoekhorst,,"Mr. Speaker, it is with great sorrow and gratitude that I rise today to honour the life of one of my constituents, Lieutenant Dennis TeBoekhorst, who passed away while fishing, which was one of his great passions.
We often hear about great people in this House, and he was one of the best. Lieutenant TeBoekhorst dedicated his life to protecting others by serving as a firefighter with the Maple Ridge Fire Department.
In 2010, his daughter was in kidney failure, and without hesitation he donated one of his kidneys to young Grace. Just hours after his death, he demonstrated his selflessness yet again when he saved the lives of 10 people by donating his remaining kidney along with his liver, lungs, eyes, and other tissues. Even in death, Lieutenant Dennis TeBoekhorst is a true hero.
I offer my sincerest condolences to his wife Melissa, and his two beloved children Grace and Calym. I want them to know that our community and indeed the nation are behind them.",Liberal,Pitt Meadows—Maple Ridge,Dan Ruimy,http://www.parl.gc.ca/MembersOfParliament/ProfileMP.aspx?Key=215948&Language=E
4689590,ca.proc.d.2016-11-23.9255964,2016-11-23,113d2f8f-bc0d-4db5-86e8-99f31c86216f,218669,"Mr. Martin Shields (Bow River, CPC)",,Statements By Members,Domestic Violence Intervention Team,,"Mr. Speaker, the domestic violence intervention team known as DVIT has worked to bring a unique approach to tackling domestic violence in the city of Brooks and the county of Newell. The Cantara Safe House, Victims Services, and the local RCMP detachment agreed that it was time to stop working in silos, so they formed a partnership, which became DVIT. This partnership provides an immediate response to domestic violence incidents and works with victims to create individualized service plans that assist all affected to obtain services available in their community. 
We offer our gratitude for the incredible work of Shauna Bell of Cantara Safe House, Sergeant McNulty of the Brooks RCMP, and the many others who have helped make this incredible team become a reality. The unique program has received awards at the provincial level. This is helping drop the number of domestic violence calls, and making our community safer for families and children. 
I would like to thank the whole domestic violence intervention team.",Conservative,Bow River,Martin Shields,http://www.parl.gc.ca/MembersOfParliament/ProfileMP.aspx?Key=218669&Language=E
4689591,ca.proc.d.2016-11-23.9255968,2016-11-23,22a6ff7d-fc39-47b2-8003-a016329ed224,224186,"Mr. Matt DeCourcey (Fredericton, Lib.)",,Statements By Members,Common Ground II,,"Mr. Speaker, the riding I represent is proudly home to 5th Canadian Division Support Base Gagetown, where this week over 1,000 members of the Canadian Army will conclude the pivotal combat training exercise Common Ground II.
The base housing the Combat Training Centre employs 5,500 soldiers and 1,100 civilians. CFB Gagetown is the third largest employer in New Brunswick, injecting more than $600 million annually into the province's economy.
In many respects, the base is integral to prosperity in our region, from the jobs it creates and the economic impact it has on local business to the tremendous community involvement of veterans groups, and the women and men who serve in uniform, whom we respect, support, and recognize for their contributions to peace and security in Canada and around the world.",Liberal,Fredericton,Matt DeCourcey,http://www.parl.gc.ca/MembersOfParliament/ProfileMP.aspx?Key=224186&Language=E
4689592,ca.proc.d.2016-11-23.9255984,2016-11-23,cedf1659-ebb1-4f26-b723-5c7c5353988b,214948,"Mrs. Carol Hughes (Algoma—Manitoulin—Kapuskasing, NDP)",,Statements By Members,International Day for the Elimination of Violence Against Women,,"Mr. Speaker, November 25 is the International Day for the Elimination of Violence Against Women and marks the beginning of 16 days of activism against gender-based violence.
In their lifetime, 25% of women will be affected by gender-based violence.
This is simply unacceptable. Twenty years after committing at the United Nations to promote the protection of women and girls, Canada still does not have a national action plan. Without this national plan of action, rates of violence against women have remained largely unchanged.
Now is the time for MPs to work together to create an expanded strategy to end violence against women. It is time for a well-funded network of women's domestic violence shelters that includes shelters for indigenous women. It is time for action on a national plan that includes addressing issues in the justice, law enforcement, and education systems. It is time for action because #ActionsMatter.",New Democratic Party,Algoma—Manitoulin—Kapuskasing,Carol Hughes,http://www.parl.gc.ca/MembersOfParliament/ProfileMP.aspx?Key=214948&Language=E
4689593,ca.proc.d.2016-11-23.9255988,2016-11-23,24b3616f-1e8d-4fd3-9420-0a3d7ab8b6d3,224991,"Mr. Todd Doherty (Cariboo—Prince George, CPC)",,Statements By Members,Residents of Cariboo—Prince George,,"Mr. Speaker, I am so proud today to rise to recognize two exceptional constituents who are visiting Ottawa this week, Dr. Nadine Caron and her daughter Aliyah. Dr. Nadine Caron is Canada's first female first nations surgeon in Canada, and the first one to attend medical school in this country. Since graduating, she has worked tirelessly as a surgeon, a doctor, a mentor, and an advocate.
 I had the opportunity to have dinner with Dr. Caron and Aliyah this week, and to hear about the incredible work she is doing in the health sciences field. While maintaining an office and a practice in Prince George, Dr. Caron also teaches at the University of Northern British Columbia, the University of British Columbia, and Johns Hopkins University. Dr. Caron is spearheading a northern biobank, with the goal of building greater knowledge of and bringing better health care to rural, indigenous, and marginalized populations. 
Aliyah is bilingual en français, and in grade 5. She is someone who I think one day could be sitting in the Prime Minister's seat.
 I would like to say to Dr. Caron and Aliyah that it truly was a pleasure to spend time with them this week. I would like to thank Dr. Caron for all that she does, for inspiring all of us, and for giving back to our community. ",Conservative,Cariboo—Prince George,Todd Doherty,http://www.parl.gc.ca/MembersOfParliament/ProfileMP.aspx?Key=224991&Language=E
4689594,ca.proc.d.2016-11-23.9255991,2016-11-23,0ac173b3-8d7f-40ce-a34c-aabda1c5b54e,215918,"Ms. Jennifer O'Connell (Pickering—Uxbridge, Lib.)",,Statements By Members,Decorations for Bravery,,"Mr. Speaker, last month, I was honoured to have attended the Governor General's presentation of Decorations for Bravery. A constituent of mine, Daniel Patrick Greene, of Uxbridge, Ontario, was being honoured for his courageous actions on January 30, 2015.
Daniel was in Trent Lakes that day, when he witnessed a man's ATV go through the ice on Buckhorn Lake. Knowing he had to act quickly, Daniel grabbed a broom and rushed to assist the victim who was holding onto his overturned ATV. The threat of nearby open water loomed large. After several attempts, Daniel managed to pull the victim to safety and stayed with him on the solid ice until help arrived.
It was a pleasure to meet Mr. Greene and his wife at the ceremony and to hear more about the events of that day. He is a true hero and serves as an example of how selflessness and bravery can change, or even save, a life.",Liberal,Pickering—Uxbridge,Jennifer O'Connell,http://www.parl.gc.ca/MembersOfParliament/ProfileMP.aspx?Key=215918&Language=E
4689595,ca.proc.d.2016-11-23.9255995,2016-11-23,cf6f39df-d304-45e1-a559-70a0cf20a720,214568,"Hon. Rona Ambrose (Leader of the Opposition, CPC)",,Oral Questions,Ethics,,"Mr. Speaker, the Prime Minister has had a serious lapse in judgment.
 He is hosting Liberal Party fundraisers with Chinese billionaires. These are the Chinese 1%. These are also people who are in the upper echelons of the Communist Party. They do not have Canada's national interest at heart. In fact, they have been linked to engaging in corporate espionage and hacking our own government servers.
Why is the Prime Minister willing to sell out our national interest for a donation to the Liberal Party?",Conservative,Sturgeon River—Parkland,Rona Ambrose,http://www.parl.gc.ca/MembersOfParliament/ProfileMP.aspx?Key=214568&Language=E
4689596,ca.proc.d.2016-11-23.9255997,2016-11-23,44647433-13cb-467e-8632-d49b131d5bb6,223727,"Hon. Dominic LeBlanc (Minister of Fisheries, Oceans and the Canadian Coast Guard, Lib.)",,Oral Questions,Ethics,,"Mr. Speaker, the Leader of the Opposition knows full well that, at all times, our party follows the fundraising rules applicable.
She also knows that only Canadians can contribute to Canadian political fundraising efforts. She also knows that the names of every individual who attends these very routine fundraisers is disclosed publicly, as the law requires.
The Liberal Party has had a considerable record of following the fundraising rules, something that her party cannot say.",Liberal,Beauséjour,Dominic LeBlanc,http://www.parl.gc.ca/MembersOfParliament/ProfileMP.aspx?Key=223727&Language=E
4689597,ca.proc.d.2016-11-23.9255999,2016-11-23,cf6f39df-d304-45e1-a559-70a0cf20a720,214568,"Hon. Rona Ambrose (Leader of the Opposition, CPC)",,Oral Questions,Ethics,,"Mr. Speaker, yesterday in response to my question about hosting this cash for access fundraiser with Chinese billionaires, the Prime Minister said himself, “That is why we have committed to engaging positively with the world to draw in investment.”
He admitted that he is discussing government business at a fundraiser, which clearly violates his own ethical guidelines. We have said it before, these fundraisers do not pass the smell test.
Will the Prime Minister do the right thing, and stop these cash for access programs?",Conservative,Sturgeon River—Parkland,Rona Ambrose,http://www.parl.gc.ca/MembersOfParliament/ProfileMP.aspx?Key=214568&Language=E
4689598,ca.proc.d.2016-11-23.9256002,2016-11-23,44647433-13cb-467e-8632-d49b131d5bb6,223727,"Hon. Dominic LeBlanc (Minister of Fisheries, Oceans and the Canadian Coast Guard, Lib.)",,Oral Questions,Ethics,,"Mr. Speaker, the Leader of the Opposition knows that when ministers, members of Parliament, and the Prime Minister attend partisan fundraisers, it is done to raise money for election campaign preparedness. Every single party in this House does exactly the same thing.
When we go to those fundraisers, we talk to Canadians about a whole range of issues, as we do in thousands and thousands of open public events across the country, something her government never did.",Liberal,Beauséjour,Dominic LeBlanc,http://www.parl.gc.ca/MembersOfParliament/ProfileMP.aspx?Key=223727&Language=E
4689599,ca.proc.d.2016-11-23.9256004,2016-11-23,cf6f39df-d304-45e1-a559-70a0cf20a720,214568,"Hon. Rona Ambrose (Leader of the Opposition, CPC)",,Oral Questions,Justice,,"Mr. Speaker, yesterday I asked about a case where a 50-year-old man sexually assaulted a 15-year-old girl, and the judge refused to give a one-year sentence to the perpetrator. Apparently one year was too much.
However, the Prime Minister's response was staggering. He defended the judge and said that they “make responsible, reasonable decisions about the cases before them.”
He could have stood up for the victim, but instead he stood up for the judge. Does the Prime Minister understand that comments like that make it harder for women to come forward when they are sexually assaulted?",Conservative,Sturgeon River—Parkland,Rona Ambrose,http://www.parl.gc.ca/MembersOfParliament/ProfileMP.aspx?Key=214568&Language=E
4689600,ca.proc.d.2016-11-23.9256007,2016-11-23,cd83ba99-0c5b-4f51-a42b-a73504b91199,214903,"Hon. Jody Wilson-Raybould (Minister of Justice and Attorney General of Canada, Lib.)",,Oral Questions,Justice,,"Mr. Speaker, I appreciate the opportunity to answer this question again.
Child sexual assault is incredibly serious, and our government will take every step that we can in order to protect children, in part doing a broad review of the criminal justice system to ensure that we look at it broadly, including sentencing reform, including mandatory minimum penalties, to ensure that we provide the necessary discretion to judges to ensure that we have foremost in our minds public safety, as well as ensuring that we are compliant with the Constitution of the country.",Liberal,Vancouver Granville,Jody Wilson-Raybould,http://www.parl.gc.ca/MembersOfParliament/ProfileMP.aspx?Key=214903&Language=E
