basepk,hid,speechdate,pid,opid,speakeroldname,speakerposition,maintopic,subtopic,subsubtopic,speechtext,speakerparty,speakerriding,speakername,speakerurl
4689668,ca.proc.d.2016-11-23.9256169,2016-11-23,131b0f70-8840-4d9a-94ff-fa579a1ef7af,214246,"Hon. Jim Carr (Minister of Natural Resources, Lib.)",,Oral Questions,Natural Resources,,"Mr. Speaker, I am going to ask the member one of his favourite questions. How many kilometres of pipeline did his government build to export markets? The answer is zero. The reason the answer is zero is because the people of Canada lost credibility in the process. 
In order to rebuild that credibility, we have established a set of rules that will govern those projects currently under review that will lead to long-term reform of the National Energy Board, which is in Canada's interests.",Liberal,Winnipeg South Centre,Jim Carr,http://www.parl.gc.ca/MembersOfParliament/ProfileMP.aspx?Key=214246&Language=E
4689669,ca.proc.d.2016-11-23.9256172,2016-11-23,9c9a64e6-58f1-4367-9f49-93ad31744c96,217354,"Mrs. Cathy McLeod (Kamloops—Thompson—Cariboo, CPC)",,Oral Questions,Natural Resources,,"Mr. Speaker, 31 aboriginal communities are partners, equity owners, in the northern gateway project. As they wrote in statement last September, “Collectively, our communities stand to benefit from more than $2 billion directly from this Project.” That is going to be $2 billion for jobs, for businesses, for educational opportunities, and for long-term benefit.
Will the minister follow the court order and immediately start consultations with the indigenous communities?",Conservative,Kamloops—Thompson—Cariboo,Cathy McLeod,http://www.parl.gc.ca/MembersOfParliament/ProfileMP.aspx?Key=217354&Language=E
4689670,ca.proc.d.2016-11-23.9256175,2016-11-23,131b0f70-8840-4d9a-94ff-fa579a1ef7af,214246,"Hon. Jim Carr (Minister of Natural Resources, Lib.)",,Oral Questions,Natural Resources,,"Mr. Speaker, if those members really want to refer to what the Federal Court of Appeal said in the northern gateway case, it said that the Harper government had insufficiently consulted indigenous peoples. That was the reason. It was not because of the proponent, not because of the regulator but because of her government. Canadians deserve a better process, and that is what we are giving them.",Liberal,Winnipeg South Centre,Jim Carr,http://www.parl.gc.ca/MembersOfParliament/ProfileMP.aspx?Key=214246&Language=E
4689671,ca.proc.d.2016-11-23.9256204,2016-11-23,d337fa82-07cb-4116-aa1f-1ec090e1ef4c,219841,"Mr. Marco Mendicino (Eglinton—Lawrence, Lib.)",,Oral Questions,Justice,,"Mr. Speaker, the Minister of Justice and Attorney General of Canada was given a mandate to ensure the government maintained the greatest possible respect for the Charter of Rights and Freedoms in all of its legislation. 
Could my hon. colleague inform the House what concrete steps the government is taking to demonstrate its commitment to the charter on behalf of all Canadians, including the LGBTQ2 community that has long advocated for equality of rights when it comes to sexual orientation?",Liberal,Eglinton—Lawrence,Marco Mendicino,http://www.parl.gc.ca/MembersOfParliament/ProfileMP.aspx?Key=219841&Language=E
4689672,ca.proc.d.2016-11-23.9256219,2016-11-23,cd83ba99-0c5b-4f51-a42b-a73504b91199,214903,"Hon. Jody Wilson-Raybould (Minister of Justice and Attorney General of Canada, Lib.)",,Oral Questions,Justice,,"Mr. Speaker, the Charter of Rights and Freedoms is the pride of all Canadians, and our government is committed to ensuring our legislation is constitutional and ensures the highest standards that Canadians expect.
As with all legislation that I have introduced as minister, I was very pleased last week to introduce a charter statement on Bill C-32, an act related to the repeal of section 159 of the Criminal Code, and in tabling a charter statement, ensuring that we invite the public and parliamentarians into the thinking and the review I have undertaken to ensure our legislation is constitutional.",Liberal,Vancouver Granville,Jody Wilson-Raybould,http://www.parl.gc.ca/MembersOfParliament/ProfileMP.aspx?Key=214903&Language=E
4689673,ca.proc.d.2016-11-23.9256221,2016-11-23,fc9a44ff-23e0-45df-8ec4-a9cccefa71e1,217758,"Hon. Ed Fast (Abbotsford, CPC)",,Oral Questions,The Environment,,"Mr. Speaker, the government has announced a coal plan that will drive up electricity costs across Canada.
 We have seen the story before. In Ontario, Gerald Butts orchestrated the infamous green energy plan, where electricity rates skyrocketed to the highest in North America. The policy was such a disaster that Premier Wynne had to publicly apologize. Now Mr. Butts has convinced the Prime Minister to adopt the same crazy plan.
Why are the Liberals so intent on driving seniors out of their homes and businesses out of our country, and why will the Prime Minister not stop this insanity before he also has to apologize?",Conservative,Abbotsford,Ed Fast,http://www.parl.gc.ca/MembersOfParliament/ProfileMP.aspx?Key=217758&Language=E
4689674,ca.proc.d.2016-11-23.9256224,2016-11-23,cee27afa-cdf8-4e99-ab22-22290f86aa3a,214082,"Hon. Catherine McKenna (Minister of Environment and Climate Change, Lib.)",,Oral Questions,The Environment,,"Mr. Speaker, I am extraordinarily proud of the action taken by our government to phase-out coal-fired power by 2030. This is a very important measure. It will not only reduce greenhouse gas emissions, it will improve the health of Canadians. It will improve the health of elderly people and young kids who have asthma. It will stop premature deaths.
 We will be working with all of the provinces and territories to ensure we have a win-win solution for ratepayers, workers, and for the economy.",Liberal,Ottawa Centre,Catherine McKenna,http://www.parl.gc.ca/MembersOfParliament/ProfileMP.aspx?Key=214082&Language=E
4689675,ca.proc.d.2016-11-23.9256227,2016-11-23,c861cfd8-ac30-4ddf-9d31-79dd34dcc59e,217165,"Ms. Ruth Ellen Brosseau (Berthier—Maskinongé, NDP)",,Oral Questions,Air Transportation,,"Mr. Speaker, the Liberals promised that they would be transparent and work on behalf of all Canadians.
However, with regard to the Saint-Cuthbert, Terrebonne and Mascouche aerodromes, the Minister of Transport is satisfied with completely subjective and bungled consultations that benefit only the developers, not Canadians. The government is not doing its due diligence.
Can the minister set the record straight on the Saint-Cuthbert aerodrome?
Will he listen to the people of Saint-Cuthbert and put a stop to the aerodrome project?",New Democratic Party,Berthier—Maskinongé,Ruth Ellen Brosseau,http://www.parl.gc.ca/MembersOfParliament/ProfileMP.aspx?Key=217165&Language=E
4689676,ca.proc.d.2016-11-23.9256231,2016-11-23,bc2e82f3-02f1-46e2-b9be-7d5f04ddddc9,214106,"Hon. Marc Garneau (Minister of Transport, Lib.)",,Oral Questions,Air Transportation,,"Mr. Speaker, it is the federal government's responsibility to review airport construction applications. We are doing just that, with the public interest and security in mind.
As for Mascouche and Saint-Cuthbert, I issued a ministerial order to force the developers in each case to hold consultations. It is an important process that I insisted on before making a decision. No decision has yet been made regarding Saint-Cuthbert.",Liberal,Notre-Dame-de-Grâce—Westmount,Marc Garneau,http://www.parl.gc.ca/MembersOfParliament/ProfileMP.aspx?Key=214106&Language=E
4689677,ca.proc.d.2016-11-23.9256233,2016-11-23,3106c3be-f49e-4c55-9d12-fb6441875251,219988,"Mr. Randeep Sarai (Surrey Centre, Lib.)",,Oral Questions,Health,,"Mr. Speaker, as all members in the House are painfully aware, there is an opioid overdose crisis going on in B.C. and across Canada. Could the minister update the House on what she is doing to work with our partners in health from across Canada?",Liberal,Surrey Centre,Randeep Sarai,http://www.parl.gc.ca/MembersOfParliament/ProfileMP.aspx?Key=219988&Language=E
4689678,ca.proc.d.2016-11-23.9256236,2016-11-23,350c31fd-6260-4c63-bd17-0746cb6f4120,214328,"Hon. Jane Philpott (Minister of Health, Lib.)",,Oral Questions,Health,,"Mr. Speaker, as the member for Surrey Centre well knows, we are facing a growing and serious public health crisis in our country as it relates to opioids. 
We are determined to make sure that we proceed actively on a drug policy that is collaborative, comprehensive, compassionate, and evidence-based. It is for this reason that last week I co-hosted a conference and summit in Ottawa, where we brought together people with lived experiences, their families, health care professionals, and every level of government. We had educators and regulators there, and we all worked together on a plan to address this crisis.
We will work in partnership to find immediate solutions to address the problem—",Liberal,Markham—Stouffville,Jane Philpott,http://www.parl.gc.ca/MembersOfParliament/ProfileMP.aspx?Key=214328&Language=E
4689679,ca.proc.d.2016-11-23.9256237,2016-11-23,3176068f-62ee-4b2f-aacd-1131201c6db1,214707,The Speaker,,Oral Questions,Health,,The hon. member for Lakeland.,Liberal,Halifax West,Geoff Regan,http://www.parl.gc.ca/MembersOfParliament/ProfileMP.aspx?Key=214707&Language=E
4689680,ca.proc.d.2016-11-23.9256238,2016-11-23,26a7c39b-6a77-446a-8986-1d3086f156fe,220480,"Mrs. Shannon Stubbs (Lakeland, CPC)",,Oral Questions,"Immigration, Refugees and Citizenship",,"Mr. Speaker, when the minister says closing the Vegreville immigration centre is to “ensure tax dollars are spent on quality services”, he insults my constituents. In fact, officials have praised Vegreville staff, saying that it is a model, and an innovative office doing exemplary work and exceeding targets. Claiming the closure is to improve efficiencies is a slap in the face to the hard-working staff there.
When will the minister stop attacking my constituents and reverse this edict?",Conservative,Lakeland,Shannon Stubbs,http://www.parl.gc.ca/MembersOfParliament/ProfileMP.aspx?Key=220480&Language=E
4689681,ca.proc.d.2016-11-23.9256242,2016-11-23,826dc268-dbda-48fa-ae4a-eefebd5716e1,214209,"Hon. John McCallum (Minister of Immigration, Refugees and Citizenship, Lib.)",,Oral Questions,"Immigration, Refugees and Citizenship",,"Mr. Speaker, we have certainly reached out to the mayor of Vegreville, through my staff. I have offered to have a meeting with the member opposite. However, the fact remains that this is a decision, driven by the need to produce lower processing times, better service and a growing immigration service.
There will be a net addition of jobs in Alberta. All those currently working in Vegreville will be able to work in Alberta in the future.",Liberal,Markham—Thornhill,John McCallum,http://www.parl.gc.ca/MembersOfParliament/ProfileMP.aspx?Key=214209&Language=E
4689682,ca.proc.d.2016-11-23.9256247,2016-11-23,3a48d31a-42fc-4320-a84f-da61c251bccd,219011,Mr. Blaine Calkins,,Oral Questions,"Immigration, Refugees and Citizenship",,"Mr. Speaker, I rise on a point of order. I would like to read to you from a document, which states:
 Ministers and Parliamentary Secretaries must avoid conflict of interest, the appearance of conflict of interest and situations that have the potential to involve conflicts of interest.... There should be no preferential access to government, or appearance of preferential access, accorded to individuals— 
",Conservative,Red Deer—Lacombe,Blaine Calkins,http://www.parl.gc.ca/MembersOfParliament/ProfileMP.aspx?Key=219011&Language=E
4689683,ca.proc.d.2016-11-23.9256248,2016-11-23,3176068f-62ee-4b2f-aacd-1131201c6db1,214707,The Speaker,,Oral Questions,"Immigration, Refugees and Citizenship",,Order. This sounds like debate. I encourage the member to get to his point of order very quickly.,Liberal,Halifax West,Geoff Regan,http://www.parl.gc.ca/MembersOfParliament/ProfileMP.aspx?Key=214707&Language=E
4689684,ca.proc.d.2016-11-23.9256367,2016-11-23,3a48d31a-42fc-4320-a84f-da61c251bccd,219011,Mr. Blaine Calkins,,Oral Questions,"Immigration, Refugees and Citizenship",,"Mr. Speaker, in his answer today, the Minister of Fisheries actually referred to this document as artificial. It is the “Open and Accountable Government” document.
I would like to seek unanimous consent to table this document in the House.",Conservative,Red Deer—Lacombe,Blaine Calkins,http://www.parl.gc.ca/MembersOfParliament/ProfileMP.aspx?Key=219011&Language=E
4689685,ca.proc.d.2016-11-23.p4648929,2016-11-23,,,,intervention,Oral Questions,"Immigration, Refugees and Citizenship",, No. ,,,Some hon. members,
4689686,ca.proc.d.2016-11-23.9256418,2016-11-23,3176068f-62ee-4b2f-aacd-1131201c6db1,214707,The Speaker,,Oral Questions,"Immigration, Refugees and Citizenship",,It appears that there is not unanimous consent.,Liberal,Halifax West,Geoff Regan,http://www.parl.gc.ca/MembersOfParliament/ProfileMP.aspx?Key=214707&Language=E
4689687,ca.proc.d.2016-11-23.9256254,2016-11-23,68bad047-6aec-43e2-b870-7bc501110873,218470,"Mr. Ziad Aboultaif (Edmonton Manning, CPC)",,Routine Proceedings,Petitions,Seniors,"Mr. Speaker, I am pleased to present a petition concerning seniors in Canada. We will soon see a dramatic demographic shift in Canadians over the age of 65. Currently one in six Canadians is a senior. In 14 years, that will shift to one in four. Canada needs to prepare for this dramatically changing demographic and the unique needs of seniors. That is why the petitioners are calling on Parliament to appoint a minister for seniors and to develop a national strategy for seniors.",Conservative,Edmonton Manning,Ziad Aboultaif,http://www.parl.gc.ca/MembersOfParliament/ProfileMP.aspx?Key=218470&Language=E
4689688,ca.proc.d.2016-11-23.9256277,2016-11-23,b37cad30-26f6-40c6-8e4c-dd3a0ba841bb,218638,"Mrs. Cheryl Gallant (Renfrew—Nipissing—Pembroke, CPC)",,Routine Proceedings,Petitions,Taxation,"Mr. Speaker, I am pleased to present a petition signed by campers who stayed at the Cedar Shade Campground in Alfred, Ontario, a small paradise located in the riding of Glengarry—Prescott—Russell. The petitioners call on the government to ensure that campgrounds with fewer than five full-time employees year round will continue to be recognized and taxed as small businesses.",Conservative,Renfrew—Nipissing—Pembroke,Cheryl Gallant,http://www.parl.gc.ca/MembersOfParliament/ProfileMP.aspx?Key=218638&Language=E
4689689,ca.proc.d.2016-11-23.9256283,2016-11-23,cedf1659-ebb1-4f26-b723-5c7c5353988b,214948,"Mrs. Carol Hughes (Algoma—Manitoulin—Kapuskasing, NDP)",,Routine Proceedings,Petitions,Algoma Central Railway,"Mr. Speaker, I am pleased to rise to table a petition. The petitioners are from Sprague, Blind River, Elliot Lake, Echo Bay, Prince Township, Goulais, Labrador City, and Sault Ste. Marie.
The issue is that the passenger train is no longer running, and it is causing substantial hardship for residents and businesses. There has not been proper consultation with first nations. 
The Algoma passenger train has been the only safe, affordable, all-season access to the Algoma wilderness rail corridor for more than 100 years. There is a significant economic impact there, and the petitioners are asking the Minister of Transport to put the Algoma passenger train back in service to ensure the mission of Transport Canada to “serve the public interest through the promotion of a safe and secure, efficient and environmentally responsible transportation system in Canada”. ",New Democratic Party,Algoma—Manitoulin—Kapuskasing,Carol Hughes,http://www.parl.gc.ca/MembersOfParliament/ProfileMP.aspx?Key=214948&Language=E
4689690,ca.proc.d.2016-11-23.9256285,2016-11-23,6e88c64b-66df-4989-84da-2a037744909c,216991,"Mr. Jamie Schmale (Haliburton—Kawartha Lakes—Brock, CPC)",,Routine Proceedings,Petitions,Public Health,"Mr. Speaker, I am pleased to present a petition signed by Canadians from my neighbouring riding of Peterborough. The petitioners are concerned about the accessibility and impact of violent and degrading sexually explicit material online and its impact on public health, especially the well-being of women and girls. As such, the petitioners call upon the House of Commons to adopt Motion No. 47.",Conservative,Haliburton—Kawartha Lakes—Brock,Jamie Schmale,http://www.parl.gc.ca/MembersOfParliament/ProfileMP.aspx?Key=216991&Language=E
4689691,ca.proc.d.2016-11-23.9256289,2016-11-23,7f01c656-5f94-4743-9018-ad3a89bb2fc4,217214,"Ms. Brigitte Sansoucy (Saint-Hyacinthe—Bagot, NDP)",,Routine Proceedings,Petitions,Poverty,"Mr. Speaker, a scathing report was published this past week in Quebec. According to that report, 50% of children aged six and under have experienced various types of violence. One of the reasons for this could be the fact that too many of the families in question have to spend over 30% of their income on housing. That is why we need to take immediate action.
I am very proud to table, again today, petitions from Canadians who support Bill C-245. By voting in favour of this bill on November 30, we can immediately begin working on a poverty reduction strategy. With 1.3 million Canadian children living in poverty, we must act now.",New Democratic Party,Saint-Hyacinthe—Bagot,Brigitte Sansoucy,http://www.parl.gc.ca/MembersOfParliament/ProfileMP.aspx?Key=217214&Language=E
4689692,ca.proc.d.2016-11-23.9256291,2016-11-23,d013e8ca-fdd5-4eb4-a0e4-b5f0782a8f6d,217187,"Mr. Fin Donnelly (Port Moody—Coquitlam, NDP)",,Routine Proceedings,Petitions,Fisheries,"Mr. Speaker, as support for my private member's bill continues to grow right across the country, today I am pleased to table a petition from the prairie provinces calling for the adoption of my bill, Bill C-228. The petitioners are asking the government to show leadership and embrace the innovation and technology that will help save wild salmon and make Canada a world leader in sustainable aquaculture.",New Democratic Party,Port Moody—Coquitlam,Fin Donnelly,http://www.parl.gc.ca/MembersOfParliament/ProfileMP.aspx?Key=217187&Language=E
4689693,ca.proc.d.2016-11-23.9256296,2016-11-23,0f7e3c8d-e579-44c0-b8b7-202b425758e4,218968,"Ms. Tracey Ramsey (Essex, NDP)",,Routine Proceedings,Petitions,Veterans,"Mr. Speaker, I am pleased to rise today to table a petition on veterans. Those who signed the petition are calling on the government to honour the social, legal, and financial covenants with our veterans that we hold dear.
The petitioners are asking the government to immediately halt the proceedings against the veterans group Equitas. They also ask that the government hold to the commitments made in the last election and go back to the negotiating table and restore their pension plans.",New Democratic Party,Essex,Tracey Ramsey,http://www.parl.gc.ca/MembersOfParliament/ProfileMP.aspx?Key=218968&Language=E
4689694,ca.proc.d.2016-11-23.9256298,2016-11-23,ea197684-00f6-458f-a46b-5bea7db6f7f3,217304,"Mr. Daniel Blaikie (Elmwood—Transcona, NDP)",,Routine Proceedings,Petitions,Labour Relations,"Mr. Speaker, I am pleased to rise today to table a petition, signed by RCMP members and their families, calling on the government to fix Bill C-7 and remove the exclusion of bargaining items they fought very hard in court to get the right to bargain for.",New Democratic Party,Elmwood—Transcona,Daniel Blaikie,http://www.parl.gc.ca/MembersOfParliament/ProfileMP.aspx?Key=217304&Language=E
4689695,ca.proc.d.2016-11-23.9256300,2016-11-23,07cf5767-802c-406c-92a7-7dc92af79b40,214668,"Mr. Kevin Lamoureux (Parliamentary Secretary to the Leader of the Government in the House of Commons, Lib.)",,Routine Proceedings,Questions on the Order Paper,," Mr. Speaker, I ask that all questions be allowed to stand.",Liberal,Winnipeg North,Kevin Lamoureux,http://www.parl.gc.ca/MembersOfParliament/ProfileMP.aspx?Key=214668&Language=E
4689696,ca.proc.d.2016-11-23.9256299,2016-11-23,3176068f-62ee-4b2f-aacd-1131201c6db1,214707,The Speaker,,Routine Proceedings,Questions on the Order Paper,,Is that agreed?,Liberal,Halifax West,Geoff Regan,http://www.parl.gc.ca/MembersOfParliament/ProfileMP.aspx?Key=214707&Language=E
4689697,ca.proc.d.2016-11-23.p4648945,2016-11-23,,,,intervention,Routine Proceedings,Questions on the Order Paper,, Agreed.,,,Some hon. members,
4689698,ca.proc.d.2016-11-23.9256303,2016-11-23,07cf5767-802c-406c-92a7-7dc92af79b40,214668,"Mr. Kevin Lamoureux (Parliamentary Secretary to the Leader of the Government in the House of Commons, Lib.)",,Routine Proceedings,Motions for Papers,,"Mr. Speaker, I ask that all other notices of motions for the production of papers be allowed to stand.",Liberal,Winnipeg North,Kevin Lamoureux,http://www.parl.gc.ca/MembersOfParliament/ProfileMP.aspx?Key=214668&Language=E
4689699,ca.proc.d.2016-11-23.9256305,2016-11-23,3176068f-62ee-4b2f-aacd-1131201c6db1,214707,The Speaker,,Routine Proceedings,Motions for Papers,,Is that agreed?,Liberal,Halifax West,Geoff Regan,http://www.parl.gc.ca/MembersOfParliament/ProfileMP.aspx?Key=214707&Language=E
4689700,ca.proc.d.2016-11-23.p4648948,2016-11-23,,,,intervention,Routine Proceedings,Motions for Papers,, Agreed.,,,Some hon. members,
4689701,ca.proc.d.2016-11-23.9256788,2016-11-23,3176068f-62ee-4b2f-aacd-1131201c6db1,214707,The Speaker,,Routine Proceedings,Request for Emergency Debate,Jobs Crisis in Alberta's Energy Sector,"Order, please. The Chair has notice of a request for an emergency debate from the hon. member for Calgary Shepard.",Liberal,Halifax West,Geoff Regan,http://www.parl.gc.ca/MembersOfParliament/ProfileMP.aspx?Key=214707&Language=E
4689702,ca.proc.d.2016-11-23.9256306,2016-11-23,bd2068aa-74c7-430a-bdf5-6f17b14ca140,226924,"Mr. Tom Kmiec (Calgary Shepard, CPC)",,Routine Proceedings,Request for Emergency Debate,Jobs Crisis in Alberta's Energy Sector,"Mr. Speaker, I wrote to you to press for an emergency debate on the jobs crisis in Alberta's energy sector, pursuant to Standing Order 52.
Albertans are facing the worst economic headwinds in several generations. Over 122,000 energy workers have lost their jobs since the oil crash, and Alberta's unemployment rate now sits at 8.5%. Calgary's unemployment rate is 10.2%, and climbing unabated. In Edmonton, excluding the public sector, it is over 10%.
The vacancy rate for commercial lease space is climbing to record highs of 30%, and this year, over 11,000 businesses have failed or moved in Calgary. This small business extinction is unlike anything we have seen in 40 years.
A generation of young Albertans have no jobs waiting for them upon graduation. One in nine Calgarians are now using food banks. Food bank use is up 60% across Alberta. Divorce rates are at record highs, substance abuse of fentanyl is rampant, and domestic abuse is on the rise. Our communities are suffering. Families are struggling, and a generation of young people have no career prospects.
The impact of the Alberta recession goes far beyond its provincial borders. Pipeline manufacturers, skilled workers in Atlantic Canada, and the financial services sector in Toronto are deeply invested in the mining and energy industries.
I draw your attention, Mr. Speaker, to past emergency debates granted on softwood lumber job losses, on November 1, 2001, on page 6807 of the House of Commons Debates; on the fisheries industry job losses, on April 28, 2003, on page 5456 of the House of Commons Debates; and finally, on livestock industry job losses, on February 13, 2008, on page 3012 of the House of Commons Debates.
Mr. Speaker, I humbly ask you, on behalf of Alberta families, to give us a chance to be heard here on the impact of the disastrous job losses in the energy sector and the knock-on effects all across Canada.",Conservative,Calgary Shepard,Tom Kmiec,http://www.parl.gc.ca/MembersOfParliament/ProfileMP.aspx?Key=226924&Language=E
4689703,ca.proc.d.2016-11-23.9256309,2016-11-23,3176068f-62ee-4b2f-aacd-1131201c6db1,214707,The Speaker,,Routine Proceedings,Request for Emergency Debate,Jobs Crisis in Alberta's Energy Sector,"I thank the hon. member for raising this question and for an excellent intervention. While I do not find that it meets the very strict requirements of the Standing Order, I am aware that his party has an opposition day coming up. He is obviously very persuasive. Perhaps he will be able to persuade the party to choose that topic for the opposition day.
Now I have a point of order. The hon. member for Kingston and the Islands.",Liberal,Halifax West,Geoff Regan,http://www.parl.gc.ca/MembersOfParliament/ProfileMP.aspx?Key=214707&Language=E
