basepk,hid,speechdate,pid,opid,speakeroldname,speakerposition,maintopic,subtopic,subsubtopic,speechtext,speakerparty,speakerriding,speakername,speakerurl
4681756,ca.proc.d.2016-09-30.9104216,2016-09-30,6da8653f-692f-4bbc-acb2-86e088f0d60d,219035,"Mr. Pierre Nantel (Longueuil—Saint-Hubert, NDP)",,Government Orders,National Security and Intelligence Committee of Parliamentarians Act,,"Mr. Speaker, in light of some of the reports we have heard on CBC over the past week, clearly, it seems appropriate to ask some questions. There were reports of incredible abuses committed against Canadian citizens who were literally sent to be tortured at the request of various Canadian agencies. That is precisely why I am pleased to rise here today to speak to Bill C-22 at second reading.
My good friend, the member for Victoria, has been handling this issue skilfully and intelligently. I will therefore be voting in favour of the bill at this stage so that it can be studied further in committee. As always, that is where the real work is done for the benefit of Quebeckers and Canadians.
We certainly commend the government's initiative in bringing this bill forward. Not only does it respond to a very clear call from various commissions of inquiry over the past several decades, but it also fulfills a promise made during the election campaign last fall regarding some recent issues. 
This bill to create a national security and intelligence committee of parliamentarians is crucial. The committee has to be formed not only with the greatest of care, but also with the necessary tools to be credible in the eyes of everyone, citizens and politicians alike, as well on the international stage. Half measures are not an option.
When it comes to credibility and legitimacy regarding national security, the truth is that the previous Conservative government missed the mark with Bill C-51 in the last Parliament. They went in exactly the wrong direction. A critical mass of national security experts were against that bill that was rammed through. 
The NDP was the only party that firmly opposed this bill, and Canadians overwhelmingly rejected this intrusive approach that did nothing to balance national security with the protection of the individual freedoms of Quebeckers and Canadians.
Let us be clear: the Liberals have to keep their promise to get rid of the problematic provisions in Bill C-51. We will hold them to it. If we as parliamentarians, and the government MPs in particular, want to win back the trust of Quebeckers and Canadians, then this is definitely the right first step.
Honestly, the public's trust in our institutions should be among the primary objectives of Canada's security policy. Let me explain.
We live in a world that is constantly evolving and, unfortunately, as shown by the tragic events in Istanbul, London, New York, Paris, and Brussels, it is unpredictable and quite dangerous. The length of this list should be enough to attest to that.
We must ensure that our national security organizations, the RCMP, CSE, and CSIS, have the necessary tools and resources to do their job, but that they also do not operate without administrative transparency, so that Canadians can know that they are effective and that they protect Canadians' rights in the best possible way.
Make no mistake, the world in which we live is not a John le Carré or Ian Fleming novel set in the cold war. The duty to protect is particularly important, but entails a responsibility.
I agree, our national security organizations already have oversight bodies, but the truth is that these bodies operate somewhat haphazardly and do not have full and systematic access to sensitive information.
The mandate of oversight and review bodies is limited to examining the work of their target organization. They are unable to follow the thread that connects them to various government organizations.
 I want to remind everyone that the annual budget for CSIS, the RCMP, and CSE is close to $4 billion. That responsibility, not to mention the significant amount of taxpayer money involved, justifies the creation of this committee of parliamentarians. I know that every MP represents his or her constituents admirably. That is the spirit in which the members of this parliamentary committee will be tasked with overseeing these operations.
To get back to my first point, the committee must be put together very carefully. All of our allies have parliamentary committees for international security, but they differ in their makeup and especially in their mandate. We can learn from both their experience and their flaws to ensure that our review committee is robust.
Quebeckers and Canadians want a watchdog with sharp teeth. The new committee must have full access to classified information, sufficient resources, and independence. Within reasonable limits, it must be able to share its findings with Canadians in an informative and transparent way. 
Twelve years ago, an interim committee of parliamentarians on national security recommended that, should such a committee be created, it should have complete access to all of the information it needs. 
Of course, the NDP will be working hard to ensure that this new committee has access to that information.
In that regard, Kent Roach and Craig Forcese, legal experts and authors of a book that was recently published on Bill C-51 and Canada's anti-terrorism laws, have said that without full access to classified information, the committee would not be able to accomplish its task. Mr. Forcese added that this is a good bill, albeit one with inevitable flaws, which likely reflect compromises designed to reconcile elements within the government. Bill C-22 is a good start, but even the best review mechanism in the world cannot make up for flawed legislation, such as Bill C-51. It is therefore important not to lose sight of the bigger picture. These are very clear statements from very competent individuals.
It seems obvious to me that the new parliamentary oversight committee must act as a sufficient counterbalance to restore Canadians' confidence and, more importantly, prevent the kind of abuse that we have seen or bring it to light.
On that note, in order to demonstrate why we need an oversight committee with adequate powers, I would like to draw the House's attention to fact that the excellent journalists at CBC/Radio-Canada managed to report that, from 2001 to 2004, Canadians were imprisoned and tortured in Syria with the complicity of Canadian authorities.
Following the September 11, 2001, attacks in New York, CSIS and the RCMP wanted to find al-Qaeda cells located within the country. In the end, that contributed to massive human rights violations and complicity in the torture of three individuals in Syria. CBC/Radio-Canada had to comb through some 18,000 documents to bring this story to light.
Let us be clear: complicity in torture is unacceptable. It is unacceptable for our authorities to use such an approach. While waiting for a proper parliamentary committee with the right tools to be set up, it is up to talented reporters, like the ones at CBC/Radio-Canada, to ensure that our national security institutions do not engage in this sort of abuse.
I think it is high time that we had this tool so that Quebeckers and Canadians can have confidence in the institutions responsible for protecting us.",New Democratic Party,Longueuil—Saint-Hubert,Pierre Nantel,http://www.parl.gc.ca/MembersOfParliament/ProfileMP.aspx?Key=219035&Language=E
4681757,ca.proc.d.2016-09-30.9104233,2016-09-30,78cd5419-2f3c-4798-9c5b-0e55843ef9fb,217703,"Mrs. Kelly Block (Carlton Trail—Eagle Creek, CPC)",,Government Orders,National Security and Intelligence Committee of Parliamentarians Act,,"Mr. Speaker, I note that in correspondence sent from the Conservative Party opposition critic for public safety and emergency preparedness several attempts to foster a collaborative and informed dialogue on our national security and its oversight were made by both our caucus and the NDP caucus, without any response and no consultations with members on the opposition side of the House. Could the member comment on that?",Conservative,Carlton Trail—Eagle Creek,Kelly Block,http://www.parl.gc.ca/MembersOfParliament/ProfileMP.aspx?Key=217703&Language=E
4681758,ca.proc.d.2016-09-30.9104235,2016-09-30,6da8653f-692f-4bbc-acb2-86e088f0d60d,219035,Mr. Pierre Nantel,,Government Orders,National Security and Intelligence Committee of Parliamentarians Act,,"Mr. Speaker, I thank my colleague for her question. She is quite right. She has put her finger on something that is a hallmark of this government.
If there is one thing this government has mastered, it is communications. It knows what it is doing. We must give credit where credit is due. The Liberal Party sure knows how to spin its sunny ways, its assurances that everything will be great, and so on. 
The message is really consistent. It is a very solid, well-backed campaign. The media are thrilled, and everyone is feeding us the same news. It is all around us. Everything is great and the dark times are over.
The reality, however, is that all this comes with a severe case of “consultitis”, and it takes forever to see any action on any number of issues. Then again, during the summer, there were some announcements about fundamental decisions that parliamentarians should have been allowed to contribute to.
With that in mind, it should come as no surprise that the Prime Minister is being given the right to choose everything here and that the committee is full of empty promises. Honestly, in just one year, the Liberals have already severely disappointed Canadians in terms of the transparency and brilliance that were promised during the 2015 election campaign.",New Democratic Party,Longueuil—Saint-Hubert,Pierre Nantel,http://www.parl.gc.ca/MembersOfParliament/ProfileMP.aspx?Key=219035&Language=E
4681759,ca.proc.d.2016-09-30.9104242,2016-09-30,711a47d7-2f48-4673-a4b1-a79126bd8e85,215926,"Mr. Ken Hardie (Fleetwood—Port Kells, Lib.)",,Government Orders,National Security and Intelligence Committee of Parliamentarians Act,,"Mr. Speaker, as a first step, the bill will move us a lot farther down the road than we have been. With the dynamics of our friends on the opposite side, better is always possible, which is the terms we have used, so we will work on that.
I wanted to specifically focus in on one thing and ask the hon. member about the value of having the work of this committee apply to the work in progress by the agencies, not after the fact, not just when something has come up, but the ability to see the moving parts and to perhaps intervene and comment at that time.",Liberal,Fleetwood—Port Kells,Ken Hardie,http://www.parl.gc.ca/MembersOfParliament/ProfileMP.aspx?Key=215926&Language=E
4681760,ca.proc.d.2016-09-30.9104244,2016-09-30,6da8653f-692f-4bbc-acb2-86e088f0d60d,219035,Mr. Pierre Nantel,,Government Orders,National Security and Intelligence Committee of Parliamentarians Act,,"Mr. Speaker, I thank my colleague for his very appropriate question.
I am not an expert in national security and police inspections, but I think that people back home are well aware of the value of wanting to oversee operations in real time and not after the fact, as my colleague says.
That being said, I would say to my colleague that his government repeatedly announced that it would make changes to Bill C-51. Now that is being pushed back. The government has decided to form a committee to oversee operations, but under Bill C-51, this adds to everyone's work because almost everyone is potentially under surveillance.
To use a very fine analogy: this work is like looking for a needle in a haystack. Bill C-51 essentially dumps a pile of hay on the bale. That is just great.",New Democratic Party,Longueuil—Saint-Hubert,Pierre Nantel,http://www.parl.gc.ca/MembersOfParliament/ProfileMP.aspx?Key=219035&Language=E
4681761,ca.proc.d.2016-09-30.9104246,2016-09-30,f40d602c-1ae6-414e-bac3-23a2f31f1cdf,217188,"Ms. Linda Duncan (Edmonton Strathcona, NDP)",,Government Orders,National Security and Intelligence Committee of Parliamentarians Act,,"Mr. Speaker, it sounded like there are a good number of people in this place who would like some changes in this process. Why are we just starting? Why do we not actually implement the oversight committee?
I think a number of amendments will be brought forward by our members. Certainly there is concern that the government can still pre-emptively halt the confidential investigation by the committee on national security. Is that not the very point of the committee?",New Democratic Party,Edmonton Strathcona,Linda Duncan,http://www.parl.gc.ca/MembersOfParliament/ProfileMP.aspx?Key=217188&Language=E
4681762,ca.proc.d.2016-09-30.9104248,2016-09-30,6da8653f-692f-4bbc-acb2-86e088f0d60d,219035,Mr. Pierre Nantel,,Government Orders,National Security and Intelligence Committee of Parliamentarians Act,,"Mr. Speaker, we see that an attempt is being made to solve problems that really resonate with people. Many people considered these security issues to be important.
I have to say that that people talk about them constantly and for good reason. We all share this planet and we are grappling with complicated issues. Everyone is concerned about potential abuses. I am thinking first and foremost of indigenous people who, under Bill C-51, will come under suspicion if they oppose a pipeline route. We must resolve these issues.
What remains worrisome is that the Liberal election campaign identified a popular issue and promised the moon. We must watch the Liberals because they have a habit of signalling left and then turning right after an election.",New Democratic Party,Longueuil—Saint-Hubert,Pierre Nantel,http://www.parl.gc.ca/MembersOfParliament/ProfileMP.aspx?Key=219035&Language=E
4681763,ca.proc.d.2016-09-30.9104250,2016-09-30,16c839d3-0183-4ed6-892a-8d7bdc37c474,214972,The Assistant Deputy Speaker (Mr. Anthony Rota),,Government Orders,National Security and Intelligence Committee of Parliamentarians Act,,"Resuming debate?
Seeing none, is the House ready for the question? ",Liberal,Nipissing—Timiskaming,Anthony Rota,http://www.parl.gc.ca/MembersOfParliament/ProfileMP.aspx?Key=214972&Language=E
4681764,ca.proc.d.2016-09-30.p4488370,2016-09-30,,,,intervention,Government Orders,National Security and Intelligence Committee of Parliamentarians Act,, Question. ,,,Some hon. members,
4681765,ca.proc.d.2016-09-30.p4488371,2016-09-30,16c839d3-0183-4ed6-892a-8d7bdc37c474,214972,The Assistant Deputy Speaker (Mr. Anthony Rota),,Government Orders,National Security and Intelligence Committee of Parliamentarians Act,, The question is on the motion. Is it the pleasure of the House to adopt the motion? ,Liberal,Nipissing—Timiskaming,Anthony Rota,http://www.parl.gc.ca/MembersOfParliament/ProfileMP.aspx?Key=214972&Language=E
4681766,ca.proc.d.2016-09-30.p4488372,2016-09-30,,,,intervention,Government Orders,National Security and Intelligence Committee of Parliamentarians Act,," Agreed. 
 No. ",,,Some hon. members,
4681767,ca.proc.d.2016-09-30.p4488374,2016-09-30,16c839d3-0183-4ed6-892a-8d7bdc37c474,214972,The Assistant Deputy Speaker (Mr. Anthony Rota),,Government Orders,National Security and Intelligence Committee of Parliamentarians Act,, All those in favour of the motion will please say yea. ,Liberal,Nipissing—Timiskaming,Anthony Rota,http://www.parl.gc.ca/MembersOfParliament/ProfileMP.aspx?Key=214972&Language=E
4681768,ca.proc.d.2016-09-30.p4488375,2016-09-30,,,,intervention,Government Orders,National Security and Intelligence Committee of Parliamentarians Act,, Yea. ,,,Some hon. members,
4681769,ca.proc.d.2016-09-30.p4488376,2016-09-30,16c839d3-0183-4ed6-892a-8d7bdc37c474,214972,The Assistant Deputy Speaker (Mr. Anthony Rota),,Government Orders,National Security and Intelligence Committee of Parliamentarians Act,, All those opposed will please say nay. ,Liberal,Nipissing—Timiskaming,Anthony Rota,http://www.parl.gc.ca/MembersOfParliament/ProfileMP.aspx?Key=214972&Language=E
4681770,ca.proc.d.2016-09-30.p4488377,2016-09-30,,,,intervention,Government Orders,National Security and Intelligence Committee of Parliamentarians Act,, Nay. ,,,Some hon. members,
4681771,ca.proc.d.2016-09-30.p4488378,2016-09-30,16c839d3-0183-4ed6-892a-8d7bdc37c474,214972,The Assistant Deputy Speaker (Mr. Anthony Rota),,Government Orders,National Security and Intelligence Committee of Parliamentarians Act,," In my opinion the yeas have it. 
 And five or more members having risen: 
 Pursuant to Standing Order 45, the recorded division stands deferred until Monday, October 3, 2016, at the ordinary hour of daily adjournment. ",Liberal,Nipissing—Timiskaming,Anthony Rota,http://www.parl.gc.ca/MembersOfParliament/ProfileMP.aspx?Key=214972&Language=E
4681772,ca.proc.d.2016-09-30.9104251,2016-09-30,eed67a03-db05-4376-89b3-8e038fa83728,214167,"Hon. Andrew Leslie (Orléans, Lib.)",,Government Orders,National Security and Intelligence Committee of Parliamentarians Act,,"Mr. Speaker, I think if you seek it, you would find unanimous consent for the following motion:
 That notwithstanding any standing order or usual practice of the House, the recorded division on the motion for second reading of Bill C-22, an act to establish the National Security and Intelligence Committee of Parliamentarians and to make consequential amendments to certain Acts be further deferred until the expiry of the time provided for oral questions on Tuesday, October 4, 2016. 
",Liberal,Orléans,Andrew Leslie,http://www.parl.gc.ca/MembersOfParliament/ProfileMP.aspx?Key=214167&Language=E
4681773,ca.proc.d.2016-09-30.9104252,2016-09-30,16c839d3-0183-4ed6-892a-8d7bdc37c474,214972,The Assistant Deputy Speaker (Mr. Anthony Rota),,Government Orders,National Security and Intelligence Committee of Parliamentarians Act,,Does the hon. member have the unanimous consent of the House to propose the motion?,Liberal,Nipissing—Timiskaming,Anthony Rota,http://www.parl.gc.ca/MembersOfParliament/ProfileMP.aspx?Key=214972&Language=E
4681774,ca.proc.d.2016-09-30.p4488384,2016-09-30,,,,intervention,Government Orders,National Security and Intelligence Committee of Parliamentarians Act,, Agreed.,,,Some hon. members,
4681775,ca.proc.d.2016-09-30.p4488385,2016-09-30,16c839d3-0183-4ed6-892a-8d7bdc37c474,214972,The Assistant Deputy Speaker (Mr. Anthony Rota),,Government Orders,National Security and Intelligence Committee of Parliamentarians Act,, The House has heard the terms of the motion. Is it the pleasure of the House to adopt the motion?,Liberal,Nipissing—Timiskaming,Anthony Rota,http://www.parl.gc.ca/MembersOfParliament/ProfileMP.aspx?Key=214972&Language=E
4681776,ca.proc.d.2016-09-30.p4488386,2016-09-30,,,,intervention,Government Orders,National Security and Intelligence Committee of Parliamentarians Act,, Agreed.,,,Some hon. members,
4681777,ca.proc.d.2016-09-30.p8,2016-09-30,16c839d3-0183-4ed6-892a-8d7bdc37c474,214972,The Assistant Deputy Speaker (Mr. Anthony Rota),,Government Orders,National Security and Intelligence Committee of Parliamentarians Act,,(Motion agreed to),Liberal,Nipissing—Timiskaming,Anthony Rota,http://www.parl.gc.ca/MembersOfParliament/ProfileMP.aspx?Key=214972&Language=E
4681778,ca.proc.d.2016-09-30.9104254,2016-09-30,eed67a03-db05-4376-89b3-8e038fa83728,214167,Hon. Andrew Leslie,,Government Orders,National Security and Intelligence Committee of Parliamentarians Act,,"Mr. Speaker, if you seek it, I think you would find unanimous consent to see the clock at 1:30.",Liberal,Orléans,Andrew Leslie,http://www.parl.gc.ca/MembersOfParliament/ProfileMP.aspx?Key=214167&Language=E
4681779,ca.proc.d.2016-09-30.9104255,2016-09-30,16c839d3-0183-4ed6-892a-8d7bdc37c474,214972,The Assistant Deputy Speaker (Mr. Anthony Rota),,Government Orders,National Security and Intelligence Committee of Parliamentarians Act,,Is that agreed?,Liberal,Nipissing—Timiskaming,Anthony Rota,http://www.parl.gc.ca/MembersOfParliament/ProfileMP.aspx?Key=214972&Language=E
4681780,ca.proc.d.2016-09-30.p4488389,2016-09-30,,,,intervention,Government Orders,National Security and Intelligence Committee of Parliamentarians Act,, Agreed.,,,Some hon. members,
4681781,ca.proc.d.2016-09-30.p4488390,2016-09-30,16c839d3-0183-4ed6-892a-8d7bdc37c474,214972,The Assistant Deputy Speaker (Mr. Anthony Rota),,Government Orders,National Security and Intelligence Committee of Parliamentarians Act,," It being 1:30 p.m. the House will now proceed to the consideration of private members' business, as listed on today's order paper.",Liberal,Nipissing—Timiskaming,Anthony Rota,http://www.parl.gc.ca/MembersOfParliament/ProfileMP.aspx?Key=214972&Language=E
4681782,ca.proc.d.2016-09-30.p4488391,2016-09-30,,,,stagedirection,Private Members' Business,Department of Public Works and Government Services Act,,"The House resumed from May 11 consideration of the motion that Bill C-227, An Act to amend the Department of Public Works and Government Services Act (community benefit), be read the second time and referred to a committee.",,,,
