basepk,hid,speechdate,pid,opid,speakeroldname,speakerposition,maintopic,subtopic,subsubtopic,speechtext,speakerparty,speakerriding,speakername,speakerurl
4689721,ca.proc.d.2016-11-23.9256715,2016-11-23,78336f0e-962c-47d2-a5b8-b59a26592789,217339,"Mr. Matthew Dubé (Beloeil—Chambly, NDP)",,Government Orders,Canada-European Union Comprehensive Economic and Trade Agreement Implementation Act,,"Madam Speaker, my colleague spoke about the importance of promoting free trade with partners like Europe that have similar laws on human rights, environmental regulation, and more specifically labour rights. I would like to draw his attention to the matter of environmental regulation and the investor-state provisions.
Let us look at a specific example of the use of chapter 11 of NAFTA. In 2011, Quebec refused to issue a fracking permit to Lone Pine Resources, a Calgary-based company with subsidiaries in the United States. That company took advantage of the loophole to take the Government of Canada to court and seek $230 million in restitution.
Under the investor-state provisions, a European company could do the same, so although I believe that the European countries are acting in good faith when it comes to their relationship with Canada, unfortunately, I do not have the same trust in their corporations.
Is my colleague not worried about this type of provision and that fact that it puts the federal government and other levels of government in Canada at risk?",New Democratic Party,Beloeil—Chambly,Matthew Dubé,http://www.parl.gc.ca/MembersOfParliament/ProfileMP.aspx?Key=217339&Language=E
4689722,ca.proc.d.2016-11-23.9256738,2016-11-23,831322ab-9fa6-437e-92ba-1b4525f8242d,218278,Mr. Pat Kelly,,Government Orders,Canada-European Union Comprehensive Economic and Trade Agreement Implementation Act,,"Madam Speaker, I am not entirely familiar with the details of the case that the member makes specific reference to under NAFTA.
However, in the broadest terms, we cannot lose the opportunity to ratify this agreement. If we want to seek out reasons why we should not do an agreement, because in an agreement of this size there is a portion of it that is unacceptable, we could talk ourselves out of just any agreement.
We need to seize the opportunity we have before us, take advantage of the work that has happened, and get this agreement approved.",Conservative,Calgary Rocky Ridge,Pat Kelly,http://www.parl.gc.ca/MembersOfParliament/ProfileMP.aspx?Key=218278&Language=E
4689723,ca.proc.d.2016-11-23.9256758,2016-11-23,62c4052f-dd41-418a-9b5b-1715c0baa84d,216816,"Mr. Kelly McCauley (Edmonton West, CPC)",,Government Orders,Canada-European Union Comprehensive Economic and Trade Agreement Implementation Act,,"Madam Speaker, I am very pleased to rise in the House today to speak to Bill C-30, an act to implement the comprehensive economic and trade agreement between Canada, the European Union, and its member states. 
A trade agreement of this nature is long overdue and has long been fought for.
 Before I speak to the merits of this agreement, I want to join my colleagues in thanking the members for Abbotsford and Battlefords—Lloydminster for their long years of work to negotiate this agreement, as well as all of the members of the previous and current governments who had a hand in establishing, negotiating, and concluding this agreement. 
I also want to thank the Right Honourable Stephen Harper for his leadership on this and many other trade files. Under his leadership, we signed more trade agreements than any other Canadian government. 
Members could probably take it as a given, by virtue of my membership in this party, that I am a strong proponent of free trade. With the recent waves of protectionist sentiment sweeping the globe, it is important to once again reiterate the benefits of freer trade, and why a country like Canada must continue to reach new markets for our products, investment, and labour.
 I want to talk about four points today: the objective benefits of free trade; the benefits of free trade to Canada, and the specific components of CETA that benefit Canada; the specific benefits of CETA to my home province of Alberta; and the benefits of CETA for accessing EU government procurement business. 
Trade is good for Canada. We have an enormous amount of products, resources, and skills that require access to other markets in order to reach a meaningful potential. The EU represents roughly 500 million people and almost $20 trillion in economic activity. The EU's annual imports alone are worth more than our entire GDP. These are customers and businesses that Canada needs to access in order to maximize our economic growth. 
We strongly support international trade initiatives which strengthen the bonds with friendly countries, increase economic productivity, and drive prosperity and job creation. When we complete trade deals, Canadian job prospects increase substantially as we access larger markets. Prices for goods decrease as we eliminate tariffs on goods entering our country. The benefits to Canadian consumers, Canadian workers, and Canadian businesses are enormous, and CETA helps us realize these benefits on a bigger, global scale. 
Specifically, CETA is projected to lead to a $12 billion annual increase to Canada's economy, which is equivalent to adding $1,000 dollars to the average family income every year, or almost 80,000 new jobs. Nearly 100% of all EU tariffs on non-agricultural products will be duty-free, and nearly 94% of EU tariffs on agricultural products will be duty-free. This is an offer we cannot refuse. 
More importantly, for my constituents in Edmonton West, and those of my colleagues across Alberta, CETA will increase Alberta's economic potential to a substantial extent. The European Union is already Alberta's fourth largest export destination, and is our third-largest trading partner. For the past five years, on average Alberta has had exports of $1.4 billion to the European Union, driven by the agricultural, metals and minerals, and advanced manufacturing sectors. 
Once in force, CETA will eliminate tariffs on almost all of Alberta's exports, and provide access to new market opportunities in the EU. CETA includes provisions that ease regulatory barriers, reinforce intellectual property rights, and ensure more transparent rules for market access. CETA will provide Alberta exporters with a competitive advantage over exporters from other countries that do not have a free trade agreement with the EU.
 On the day CETA's provisions enter into force, 98% of EU tariffs on Canadian goods will be duty-free, including those on key Alberta exports, such as metals and mineral products, manufactured goods, and chemicals and plastics. For agricultural and agri-food products, almost 94% of EU tariffs on Canadian goods will be duty-free, which rises up to 95% once all phase-outs are complete, seven years after CETA enters into force. This duty-free access will give Canadian agricultural goods, such as beef, pork, and bison, preferential access to the EU market. 
I do not think I need to tell the House how important beef is to the Alberta economy, but I do want to mention some specific potential benefits to industries affected by the tariff reductions listed in CETA.
 According to the CBC, with CETA, Canada is poised to supply about 1% of the European Union's beef needs under the new pact, which could mean almost $600 million in revenue. 
In addition to beef and agriculture products, CETA would also provide for increases in eligible trade for products with high sugar content. I want to talk about a small business in Edmonton that started in a basement in Sherwood Park. It is a much-renowned startup company called Jacek Chocolate Couture. It has expanded from Sherwood Park to downtown Edmonton and now to Canmore, Alberta. The company sells its famous chocolates across our entire country, and now could reach a massive new customer base, growing its revenues and creating new jobs.
We know how things are tough in Alberta right now. Therefore, it makes perfect sense that we approve this trade agreement which would have demonstrable benefits to Alberta's industries. This agreement would create jobs by opening the European Union's market to more Alberta goods and would lower prices for importing EU products. Lower prices and more customers for business are exactly what Alberta needs right now. 
Specific to oil and gas, CETA would increase market access for Alberta products. This comes at an ideal time, as supplier diversification is one of EU's top energy priorities. Currently, Russia holds over 30% of the EU's oil and gas market share, placing it first. Canada comes in 26th, with just 1%. 
It is well known that Russian President Putin uses his country's oil and gas reserves as a weapon and, given that Russia supplies almost a third of the European Union's oil and gas, his position is strong. The EU needs to diversify and wants to diversify, and Alberta has plenty to offer. As CETA would eliminate tariffs on oil and gas products, Canada and Alberta are well poised to fill this gap and become a crucial energy ally. This is an opportunity that we should not and, frankly, cannot pass up.
The elimination of tariffs and barriers would also have advantages to procurement opportunities. Under CETA, Canadian firms could bid on contracts to supply their goods and services to the three main EU-level institutions: the European Commission, the European Parliament, and the European Council. Canadian firms would also be able to bid on EU member-state government contracts and those of thousands of regional and local government entities. 
The EU procurement market is worth $3.3 trillion annually, and holds significant potential for Canadian suppliers. This kind of preferential market access would benefit Alberta-based multinational firms such as PCL and Stantec, who both have their headquarters in Edmonton. Indeed, by virtue of the fact that Alberta has long been the entrepreneurial province, there are hundreds if not thousands of businesses in Edmonton, Calgary, and throughout Alberta that would benefit from access to this $3.3 trillion procurement market.
Trade is good. Trade lowers prices and enables competitive and valued Canadian businesses to expand, hire new employees, and prosper in a globalized world. Free trade would allow billions of dollars in Canadian exports to reach new markets, and ensure that European goods flow in at competitive prices for Canadian consumers. Free trade would help Alberta's businesses grow and prosper at a time when Alberta needs it most.
 I am proud to support this agreement that would help Alberta's small and large businesses, Albertan consumers, Canadian industry, and Canadian producers, and that would also deepen the long-standing ties between Canada and Europe.",Conservative,Edmonton West,Kelly McCauley,http://www.parl.gc.ca/MembersOfParliament/ProfileMP.aspx?Key=216816&Language=E
4689724,ca.proc.d.2016-11-23.9256902,2016-11-23,0f7e3c8d-e579-44c0-b8b7-202b425758e4,218968,"Ms. Tracey Ramsey (Essex, NDP)",,Government Orders,Canada-European Union Comprehensive Economic and Trade Agreement Implementation Act,,"Madam Speaker, I want to point out something. The previous Conservative government promised a compensation package that would be attached to the losses that dairy would incur in CETA and across TPP. The previous Conservative government negotiated that CETA would see an expropriation of up to 2% of Canadian milk production, and farmers say this would cost them $116 million a year in perpetual lost revenues. 
Yet, the Liberals are only providing this compensation package, worth $250 million, over five years. Does the member agree with the NDP that this math simply does not add up to the losses that dairy farms and supply-managed sectors would see in our country?",New Democratic Party,Essex,Tracey Ramsey,http://www.parl.gc.ca/MembersOfParliament/ProfileMP.aspx?Key=218968&Language=E
4689725,ca.proc.d.2016-11-23.9256912,2016-11-23,62c4052f-dd41-418a-9b5b-1715c0baa84d,216816,Mr. Kelly McCauley,,Government Orders,Canada-European Union Comprehensive Economic and Trade Agreement Implementation Act,,"Madam Speaker, that is an excellent question and bears looking into. This plan would provide compensation to farmers. It may not be at the level previously done by the Conservative Party, but this plan would also open up a vast new market for our farmers, our beef producers, for Alberta and Quebec farmers. 
In the long-term, it will be a benefit to all Canadians.",Conservative,Edmonton West,Kelly McCauley,http://www.parl.gc.ca/MembersOfParliament/ProfileMP.aspx?Key=216816&Language=E
4689726,ca.proc.d.2016-11-23.9256920,2016-11-23,b6850f16-57dc-486c-b5bb-0fd191022af4,218735,"Mr. Garnett Genuis (Sherwood Park—Fort Saskatchewan, CPC)",,Government Orders,Canada-European Union Comprehensive Economic and Trade Agreement Implementation Act,,"Madam Speaker, I particularly appreciate that the member referenced Jacek Chocolate Couture, which is a phenomenal business in my constituency. I had an opportunity to go on a tour there recently.
 I do want to ask the member an important question about NAFTA. We have had the current government, right out of the gate with the new president-elect, basically not show confidence in the importance of this trade deal; basically throw it under the bus and say, “Sure we would be happy to negotiate it”. 
We should all appreciate the benefits that come from NAFTA, a trade deal that has been in place for a very long time. The protectionist talk that we are hearing from the United States is not about trading more. It is about tightening that deal, not expanding it.
Could the member comment on the importance of international trade, and why we actually need to have a government that understands the benefits that come with NAFTA, and these other trade deals, and that is actually going to stand up and defend them?",Conservative,Sherwood Park—Fort Saskatchewan,Garnett Genuis,http://www.parl.gc.ca/MembersOfParliament/ProfileMP.aspx?Key=218735&Language=E
4689727,ca.proc.d.2016-11-23.9256937,2016-11-23,62c4052f-dd41-418a-9b5b-1715c0baa84d,216816,Mr. Kelly McCauley,,Government Orders,Canada-European Union Comprehensive Economic and Trade Agreement Implementation Act,,"Madam Speaker, it is very important, now more than ever, with what is happening in the U.S., and also in various countries around the world as they start talking about throwing up protective walls. We know that it is going to do the exact opposite. We saw during the Great Depression that protectionist barriers made the economy across the entire world worse.
 It is very important that we continue the great work of Prime Minister Harper and the previous government in expanding our trade markets across the world, not only to find new markets but also to counter the effects of protectionism that we see growing down in the United States and in other countries.",Conservative,Edmonton West,Kelly McCauley,http://www.parl.gc.ca/MembersOfParliament/ProfileMP.aspx?Key=216816&Language=E
4689728,ca.proc.d.2016-11-23.9256944,2016-11-23,78336f0e-962c-47d2-a5b8-b59a26592789,217339,"Mr. Matthew Dubé (Beloeil—Chambly, NDP)",,Government Orders,Canada-European Union Comprehensive Economic and Trade Agreement Implementation Act,,"Madam Speaker, the member in his speech talked about an offer we cannot refuse. The last time I heard that line, things did not go so well in that particular situation.
All kidding aside, I would like to ask my colleague a question about the cost of prescription drugs. That issue is often forgotten in this debate. We have been talking a lot about the investor-state dispute settlement clauses and the impact on the dairy industry, particularly in my province of Quebec, and with good reason. However, the cost of medication is going to increase by approximately $850 million, which will affect not only the provinces, which administer the health care system, but also the people who have to pay for those medications.
Although we recognize the importance of free trade with Europe, I would like to know what my colleague thinks about the impact this will actually have on the cost of living of people who need medication, particularly seniors.",New Democratic Party,Beloeil—Chambly,Matthew Dubé,http://www.parl.gc.ca/MembersOfParliament/ProfileMP.aspx?Key=217339&Language=E
4689729,ca.proc.d.2016-11-23.9256953,2016-11-23,62c4052f-dd41-418a-9b5b-1715c0baa84d,216816,Mr. Kelly McCauley,,Government Orders,Canada-European Union Comprehensive Economic and Trade Agreement Implementation Act,,"Madam Speaker, that is an excellent question, and again, like the previous questions from my colleagues in the NDP, it probably bears a bit more thought and more investigation.
On the pharmaceutical front, we must consider that the pharmaceutical industry in Canada is worth over 27,000 jobs and involves over $1 billion in R and D. This is only going to increase as we have much greater access to the European market. I will comment that it is about $800 million in new drugs and only a small percentage of that is in generic drugs.",Conservative,Edmonton West,Kelly McCauley,http://www.parl.gc.ca/MembersOfParliament/ProfileMP.aspx?Key=216816&Language=E
4689730,ca.proc.d.2016-11-23.9256965,2016-11-23,a10a55d4-becb-4b98-b780-9fa8cfd5aa12,218767,"Mr. Phil McColeman (Brantford—Brant, CPC)",,Government Orders,Canada-European Union Comprehensive Economic and Trade Agreement Implementation Act,,"Madam Speaker, it is a pleasure to stand today to support the CETA agreement.
 I would like to talk about a couple of things, basically that this comprehensive trade agreement opens up opportunities to many investors on both sides of the agreement, Canadian investors and European investors. I will move on from there to talk about some of the things that an agreement like this inspires and that, hopefully, can move this country toward, including by dealing with the trade barriers that exist within our own border.
The Canada-European Union comprehensive economic and trade agreement, CETA, will create jobs, strengthen economic relations, and boost Canada's trade with the second largest market on the globe.
As I think back to the time I have been in Parliament and part of the previous two governments, I recall the words of Prime Minister Harper on many occasions when he spoke about getting the business fundamentals correct. What CETA and the 40-plus other trade agreements the Harper government put together did was to focus on business fundamentals.
 What are the business fundamentals in this country? They include things like keeping taxes low. In fact, compared to the United States, the total business tax load in this country is 46% lower. That was something we worked on during more than 10 years of government. We made that particular goal of setting and making sure the fundamental of keeping taxes low for business was right. 
Why is that important in the context of a free trade agreement? It is important because we have to look good to investors from Europe. Europeans can now come here with this free trade agreement, know that goods can flow back and forth freely between our countries and consider making investments here, such as the one that we have in my community of Brantford, which is the Ferrero Company, a family company that came to this country nine years ago. The family came to North America. They decided where they would have their North American operation, and thankfully they landed in Brantford, Ontario, for all of their North American product lines. People will know Rocher, Tic Tac, and many of the products the company makes, with close to 1.5 million square feet of production. 
I bring up that example because when companies like Ferrero, an Italian family company, make a decision, they make it based on research into what type of business environment they would be going into, what type of country, and how they will be treated as investors.
Among its other benefits that CETA provides in its market access provisions is enhanced investor protection. CETA will provide Canadian and EU investors with greater certainty, transparency, and protection for their investments, easing investment restrictions. The net benefit review threshold under the Investment Canada Act will be raised from the current $60 million Canadian to $1.5 billion, following CETA's entry into force. 
The advantage over other countries is very significant, especially in the Americas. None of the other top destinations for EU investment in the Americas—the U.S., Mexico, and Brazil—have investment treaties in place with the 28 EU member states, because only CETA provides that. CETA is an agreement, as I said from the outset, and many people have talked today about the scope of CETA, the potential 80,000 jobs, the potential $1,000 per family benefit it would brings if we extend the benefits across our population. It brings us into a privileged environment in the world in terms of being free traders, allowing us to say to the globe that we can negotiate a deal like this when other countries are not about to do so.
I would like to transition into talking about what we face in this country today, namely the enormous trade barriers within our own borders, the provincial trade barriers today facing certain industries. Obviously, the debate we had earlier in this Parliament that my colleague entitled “free the beer” was an aspect of that. I am going to describe it from the point of view of my background, from having been in the construction industry in Ontario and trying to do business in other provinces.
First of all, what we need in this country more than anything else is a keen focus by the current government and the provincial governments on removing those trade barriers. I was very disappointed that the government chose not to vote for the free the beer initiative of my friend. That would have been a beginning, sending a signal to other industries to do that.
In the construction industry, particularly with tradespeople, this is significant, especially when there are downturns in certain parts of the country while other areas of the country are prospering. A person can have credentials as an electrician, plumber, carpenter, or whatever, and may be a licenced carpenter within Ontario's borders, but as soon as that person wants to practice that trade in other parts of the country, those credentials are not accepted as proper. One has to go through a retraining and certification process all over again in certain jurisdictions. 
More so, when electrical companies or plumbing companies expand to a certain size and want to expand across the country, when they look at projects in other provinces, they are restricted from bidding on those jobs. They are told that they are restricted, because they are Ontario-based companies. This happens right here in the Ottawa area with our neighbouring province, Quebec, all the time.
However, it depends on the province. The Quebec contractors can come over to Ottawa and do work here, but Ottawa contractors cannot go to Quebec and do work there. These are the types of provincial barriers that I am talking about, which we need to focus keenly on reducing in this country. 
 I recall the 1988 debates around the NAFTA agreement. The NAFTA agreement in 1988, for all kinds of reasons, was opposed by different political parties, including the opposition and the typical groups right across this country. They thought we were going to lose our national identity from all of it, that we were going to lose our autonomy, and that our water was going to be taken away from us. All of these exaggerations were disproven.
The visionary part of a free trade agreement goes right to the top, reflecting who the prime minister of the day is. I can recall in those days looking to Prime Minister Mulroney and thinking that his was leadership that could hold the ground. He had the backbone to stand up to the type of opposition at that time, fight an election over it, and bring that free trade agreement, NAFTA, into existence. 
I can tell members that today I feel the exact same way about Prime Minister Harper, who made free trade agreements a focus of his. CETA is part of the legacy of his leadership. I am proud to be here today to support this important free trade agreement and to have been part of the hard work since 2007 on that by Prime Minister Harper and the leadership of the Conservative Party.",Conservative,Brantford—Brant,Phil McColeman,http://www.parl.gc.ca/MembersOfParliament/ProfileMP.aspx?Key=218767&Language=E
