basepk,hid,speechdate,pid,opid,speakeroldname,speakerposition,maintopic,subtopic,subsubtopic,speechtext,speakerparty,speakerriding,speakername,speakerurl
4679850,ca.proc.d.2016-09-21.9045261,2016-09-21,ad4032f2-6bb1-497b-b146-f321cfb71ba9,216546,"Hon. Pierre Poilievre (Carleton, CPC)",,Government Orders,"Economic Action Plan 2015 Act, No. 1",,"Madam Speaker, the President of the Treasury Board has just accused me of being a general waging an old battle. I rise today to say that the right of working people to chart their own destiny through the use of a secret ballot, though an ancient right, will never get old. That is a basic, fundamental freedom upon which this august chamber is based and by which every real democratic decision is ultimately and finally made: the right of the deciders—that is, the people—to go into a secret place and mark their preference free from intimidation or scrutiny by those who have authority over them. The hon. member might consider that to be “regressive”, a word that he chose himself, but it is the methodology that allowed him to be here in the first place.
 I do not know if the member is going to rise in the question and comment period to claim that he should not have been elected by those means, but instead should have been allowed to go around his community and ask people to elect him through a petition system, whereby they, standing right in front of him, would be asked to put their name beside his name or the name of his opponent. Imagine if Parliament were chosen in such a truly regressive way. Unfortunately, prior to the later days of the previous government, that is how many federally regulated workers in the private and public sector had the decision of unionization imposed upon them.
 Furthermore, this is not yesterday's battle. Currently, the government has legislation before Parliament that would strip away the recently won gain that workers enjoy to vote secretly on whether to unionize their bargaining unit. That legislation is before the Senate and it is not simply one bill. There are two bills related to that right. One broadly speaks to the right of workers in the federal sphere; and the other speaks specifically to the right of RCMP members who, due to a Supreme Court ruling, will soon be granted the right to organize and collectively bargain in their workplace. We know from the unfolding controversies related to the union drive of multiple organizations seeking to represent the Mounties as the bargaining agent that RCMP personnel would benefit from the right to decide that by secret ballot, rather than under the watchful eye of either the employer or a prospective bargaining agent. The reason that a secret ballot is so primordial is not just to protect the worker against intimidation by a prospective bargaining agent or union, but also to protect the employee from intimidation by an employer. On this point, I would like to spend some time.
When I asked the President of the Treasury Board this, he said he wanted to develop a balanced legislative framework between business and unions. He totally forgot the primary stakeholder. The primary stakeholder in labour laws is not business or unions; it is the worker. It is worker that all of our laws and all of our rules should be designed to serve.
This is not a battle for yesteryear. It is a debate that is alive and well today. I would suggest that he, as the President of the Treasury Board, has an opportunity to rethink his position and that of his government and come around to the position that workers should have the right to vote. By the way, that is the policy in five of ten Canadian provinces. Jurisdictions governed by various different political parties give this right to provincially regulated workers in their jurisdiction.
This is not an extreme or exotic concept. It is broadly practised in jurisdictions not only in Canada but around the world. We merely suggest that in the federally regulated sector, that right should continue to exist.
I represent the riding of Carleton. It neighbours on the community of Barrhaven, which was formerly part of my riding. Members will find the headquarters of the RCMP there, an organization that will face union drives as the Supreme Court's ruling permitting its personnel to unionize comes into effect. It is my duty as a member, and the duty of all members in this place who do represent RCMP personnel, to stand up for the right of those who put their lives on the line every day and, through the use of a secret ballot, make their decision free from intimidation.
I will depart ever so temporarily from the subject at hand just to point out that the approach of the government on the secret ballot vote for workers on the question of unionizing workplaces is consistent with its opposition to a referendum on the subject of electoral reform. For some reason, the government seems to be against voting. A government that was put in place by such means opposes those very means. The Liberals seem to have an inherent bias against allowing the people affected by decisions to make the final decision themselves. 
On those points, I strongly disagree with the early direction of the current government with respect to labour relations. However, I do have faith that the President of the Treasury Board will change his mind, and perhaps he is changing his mind right now as he listens to these words. 
On the subject of sick leave, the President of the Treasury Board has introduced legislation and has committed to the House of Commons that he will work with bargaining agents to come up with an improved sick leave system—and, hopefully, a short-term disability system to augment it—that will serve both taxpayers and public servants. On this point, I think both parties are broadly in agreement. It seems to me that the President of the Treasury Board and the government of the day are trying to work with the bargaining agent to find a solution to the ongoing problem that exists in a whole host of workplaces and to single out the best way to deal with sickness and injury for employees.
One of the problems that I have identified, not only as a member of Parliament and Treasury Board critic but also as a representative of the Ottawa area, is that 60% of public servants do not have enough banked sick days to get them to the full period required for eligibility for short-term disability. For the majority of public servants who fall seriously ill, they cannot cover the span between the day they leave work and the day they become eligible for short-term disability, because they have yet to accumulate enough sick days to fill that gap. 
Some 25% of employees have accumulated fewer than 10 days. Many employees, especially the new and the young, have no sick days accumulated at all. Meanwhile, some long-tenured workers, many of them executives, the best paid and compensated workers, have far more banked sick leave days than they will ever use. This is through no fault of their own. It is the result of the fact they have diligently gone to work every day and, as a result, their sick-leave allocation has just accumulated and stacked up year after year. This is a sign of a responsible, diligent employee, but it does not address the problem of roughly 14 million accumulated sick days banked in the system right now, many of which are out of reach of the majority of public servants who are younger and, therefore, have not had such an opportunity. 
I know that the President of the Treasury Board shares the objective of the previous government to find ways to get sick and injured public servants well and back to work as quickly as possible. I believe that the negotiating mandate he has with his officials reflects that goal as well. 
Therefore, I would encourage him to continue to work toward the mutually supportive goals, first, of protecting taxpayers and, second, of ensuring that public servants have a sick leave and short-term disability system that protects them when they need it and helps them get back to active, productive lives as quickly as possible. That is the sweet spot that we are all attempting to reach and I wish the President of the Treasury Board well in his endeavours to achieve it.",Conservative,Carleton,Pierre Poilievre,http://www.parl.gc.ca/MembersOfParliament/ProfileMP.aspx?Key=216546&Language=E
4679851,ca.proc.d.2016-09-21.9045476,2016-09-21,6d680702-120b-4bcf-8da9-aae3e38ca0cf,214346,"Hon. Scott Brison (President of the Treasury Board, Lib.)",,Government Orders,"Economic Action Plan 2015 Act, No. 1",,"Madam Speaker, the hon. member and I may not agree on everything, but based on his comments, I think we have a desire to have a sick leave regime within the public service that will ensure that public servants receive the support they need when they need it.
He has identified an issue that I alluded to as well, that people who have not been in the public service for a particularly long time and have not necessarily accumulated time in the public service, young people in particular, and who may have some form of long-term or chronic illness, are not well served by the current system. We view this as important to address, and we are addressing it now in negotiations with the public service unions. It is one of the things that we need to change if we are going to attract more young people to the public service. It is only one.
As for other things, we are told that the hierarchical nature of decision-making within government is an issue. There are even issues around the hiring processes, and also the ability to develop an idea within a department or agency of government and to share it with somebody else in government and to work together to achieve it.
The hon. member was a minister in the previous government and is just a bit younger than me, so I would appreciate his thoughts on what we need to do as a government to attract more young people to the public service and to give them the opportunity to paint on a larger canvas and make a difference in the lives of Canadians.",Liberal,Kings—Hants,Scott Brison,http://www.parl.gc.ca/MembersOfParliament/ProfileMP.aspx?Key=214346&Language=E
4679852,ca.proc.d.2016-09-21.9045498,2016-09-21,ad4032f2-6bb1-497b-b146-f321cfb71ba9,216546,Hon. Pierre Poilievre,,Government Orders,"Economic Action Plan 2015 Act, No. 1",,"Madam Speaker, I thank the member for his question and his reference to my age. When I was first elected, a member told me that my youth was an illness that would be cured little by little each day. Since that time, gray hairs have been sprouting and, slowly but surely, I am curing the flaw that I had. 
I appreciate the member's giving me the opportunity to comment on attracting young people—younger than me—to work in the public service. I think that the number one thing we can do to attract more young people is to make the public service as entrepreneurial as possible. The millennial generation is all about getting it done. We see that through great innovations like Uber, and through communications via social media and the ability of young people to acquire information rapidly and to solve problems almost instantaneously without following all of the bureaucratic steps that older people like me still go through. It is phenomenal to see how solution-focused young people are. 
Unfortunately, government at all levels and in all places in the world tends to have an attitude that an operation was a success and the patient died. We follow a whole series of procedural steps, and even if we do not achieve any result, it is regarded as a success because we ticked all the boxes. We need to transform government at all levels to become more results driven, more entrepreneurial and more dynamic so that we focus on getting things done. That will be the best way we could possibly attract the young millennial generation, whose desire is to get in, make things happen, and to achieve things.",Conservative,Carleton,Pierre Poilievre,http://www.parl.gc.ca/MembersOfParliament/ProfileMP.aspx?Key=216546&Language=E
4679853,ca.proc.d.2016-09-21.9045535,2016-09-21,2490b23e-4439-4513-9d54-6fceb6320267,221288,"Ms. Cheryl Hardcastle (Windsor—Tecumseh, NDP)",,Government Orders,"Economic Action Plan 2015 Act, No. 1",,"Madam Speaker, I heard such intriguing discussion from the hon. member with regard to his vision of the fundamental right of public service workers to be free of intimidation. Does this mean that this member thinks we should be moving quickly in other areas to restore the fundamental right of a public service worker to refuse unsafe work conditions?",New Democratic Party,Windsor—Tecumseh,Cheryl Hardcastle,http://www.parl.gc.ca/MembersOfParliament/ProfileMP.aspx?Key=221288&Language=E
4679854,ca.proc.d.2016-09-21.9045542,2016-09-21,ad4032f2-6bb1-497b-b146-f321cfb71ba9,216546,Hon. Pierre Poilievre,,Government Orders,"Economic Action Plan 2015 Act, No. 1",,"Madam Speaker, I think we all agree that workers should have the ability to protect themselves in unsafe working conditions where there are extensive regulations that protect employees, both private and public sector and federally and provincially regulated, and I think we all want to see those rules employed and respected.
My point was regarding an equally important right, which is the right of collective self-determination of employees in a given bargaining unit and their right to choose, through a secret ballot, whether to be represented by a union. 
That is a right that exists for provincially regulated employees in five different provincial jurisdictions and is one that continues to exist in Canada at the national level because of a bill passed in the previous Parliament.
 Unfortunately, that right is currently in jeopardy because of legislation the current government has introduced that would effectively abolish the secret ballot for union certification. 
I am asking the government to reconsider that approach. I think it is very reasonable, moderate, and sensible to expect that workers would be able to choose their own destiny without intimidation from either the proposed bargaining agent or the employer.",Conservative,Carleton,Pierre Poilievre,http://www.parl.gc.ca/MembersOfParliament/ProfileMP.aspx?Key=216546&Language=E
4679855,ca.proc.d.2016-09-21.9045570,2016-09-21,844f3193-503d-479c-a776-5f343b6bd267,214042,"Hon. Alice Wong (Richmond Centre, CPC)",,Government Orders,"Economic Action Plan 2015 Act, No. 1",,"Madam Speaker, I applaud my colleague's attempt to let us know what the true picture is in our public service.
I have been consulting a lot in the private sector lately about the need for productivity and to create more jobs and to make sure that the government spends money wisely.
Many of the small and medium-sized business people in my riding said that they want to make sure that there is productivity in their workplace.
We can look at all the benefits public servants are getting. They are banking all those sick days, 114.7 million sick leave days. Those will be paid, and have been paid, by private sector taxpayers.
How do you justify having only the public sector benefiting and reaping all the good benefits while the private sector is sacrificing? ",Conservative,Richmond Centre,Alice Wong,http://www.parl.gc.ca/MembersOfParliament/ProfileMP.aspx?Key=214042&Language=E
4679856,ca.proc.d.2016-09-21.9045586,2016-09-21,cedf1659-ebb1-4f26-b723-5c7c5353988b,214948,The Assistant Deputy Speaker (Mrs. Carol Hughes),,Government Orders,"Economic Action Plan 2015 Act, No. 1",,I just remind the hon. member to address the questions to the chair.,New Democratic Party,Algoma—Manitoulin—Kapuskasing,Carol Hughes,http://www.parl.gc.ca/MembersOfParliament/ProfileMP.aspx?Key=214948&Language=E
4679857,ca.proc.d.2016-09-21.9045593,2016-09-21,ad4032f2-6bb1-497b-b146-f321cfb71ba9,216546,Hon. Pierre Poilievre,,Government Orders,"Economic Action Plan 2015 Act, No. 1",,"Madam Speaker, I thank the member, the former minister, for her question. 
I think this is the balance the previous government and the current government are trying to strike, which is between respect for taxpayers, that is, the private sector, as the member refers to it, and public servants in delivering a sick leave and short-term disability program that is there for public servants when they need it and is affordable for the taxpayers who are paying all the bills.
I am hopeful that the President of the Treasury Board continues with a mandate for his officials to achieve that balance, because there are better ways. We have right now a system in which younger public servants, or those new to the federal public service, do not even have enough sick leave days to get through to a short-term disability plan if, God forbid, they fall terribly ill.
Our previous government had attempted to rectify that problem by extending short-term disability through a fairer, balanced, and affordable regime. I think the current government has picked up that approach and hopefully is making progress with its partners and the bargaining agent to achieve something that will work for both taxpayers and employees.",Conservative,Carleton,Pierre Poilievre,http://www.parl.gc.ca/MembersOfParliament/ProfileMP.aspx?Key=216546&Language=E
4679858,ca.proc.d.2016-09-21.9045601,2016-09-21,cedf1659-ebb1-4f26-b723-5c7c5353988b,214948,The Assistant Deputy Speaker (Mrs. Carol Hughes),,Government Orders,"Economic Action Plan 2015 Act, No. 1",,"Order. It is my duty pursuant to Standing Order 38 to inform the House that the questions to be raised tonight at the time of adjournment are as follows: the hon. member for Drummond, Official Languages; the hon. member for Saskatoon West, Indigenous Affairs.",New Democratic Party,Algoma—Manitoulin—Kapuskasing,Carol Hughes,http://www.parl.gc.ca/MembersOfParliament/ProfileMP.aspx?Key=214948&Language=E
