basepk,hid,speechdate,pid,opid,speakeroldname,speakerposition,maintopic,subtopic,subsubtopic,speechtext,speakerparty,speakerriding,speakername,speakerurl
4674882,ca.proc.d.2016-06-02.8964405,2016-06-02,2f8fed89-2dde-4683-b1f0-03d1f782d96a,220086,"Mr. Nathaniel Erskine-Smith (Beaches—East York, Lib.)",,Government Orders,Business of Supply,Opposition Motion—Special Committee on Electoral Reform,"Mr. Speaker, I thank the member and his colleagues for putting this motion forward, and I thank my government for working with the NDP and agreeing to the motion. Co-operation is a sign of strength, in my opinion.
I want to ask the member about fairness. I agree that proportional representation is a fairer system. It is not just me or the member opposite who thinks that. The 2004 Law Reform Commission report also agrees, after extensive consultation. In its view, mixed member proportional representation was chosen out of nine options that were surveyed.
Does the member, in speaking about proportional representation, have one particular view of the matter? For mixed member proportional representation, there are party lists, PR and single transferable vote. There are different models. 
When we talk about fairness of process, this is an important first step, obviously, in agreeing to the committee. When we talk about legitimacy of process, what are the member's views on a referendum, a supermajority? Are other there others avenues we might arrive at that would grant this process legitimacy?",Liberal,Beaches—East York,Nathaniel Erskine-Smith,http://www.parl.gc.ca/MembersOfParliament/ProfileMP.aspx?Key=220086&Language=E
4674883,ca.proc.d.2016-06-02.8964432,2016-06-02,0c9d00b0-a035-46d3-ba51-0db3e8da19b8,217281,Mr. Murray Rankin,,Government Orders,Business of Supply,Opposition Motion—Special Committee on Electoral Reform,"Mr. Speaker, I agree with my friend from Beaches—East York's premise that co-operation is a sign of strength. I am pleased that through co-operation in this place, we are modelling that kind of strength in the House of Commons.
I agree with my friend that proportional representation was studied in 2004 by the Law Reform Commission. I agree that MMPR was the model it thought best. However, I am agnostic at this stage because I want the committee to do its work, hear from Canadians, and figure it out. To come into it with prejudged positions would be self-defeating. As long a those values that I spoke of in my remarks are at play, I am confident that people of goodwill sitting around the table in a representative capacity will get it right for Canadians.",New Democratic Party,Victoria,Murray Rankin,http://www.parl.gc.ca/MembersOfParliament/ProfileMP.aspx?Key=217281&Language=E
4674884,ca.proc.d.2016-06-02.8964446,2016-06-02,62bfd797-8d32-425b-91b1-1422ca16694f,224621,"Mr. Blake Richards (Banff—Airdrie, CPC)",,Government Orders,Business of Supply,Opposition Motion—Special Committee on Electoral Reform,"Mr. Speaker, I listened to the member's comments. I know him to be an honourable member and I am sure he is quite sincere. I know he believes in the position of his party in its desire for a proportional-type system. However, I think the concern many Canadians have right now is that they are seeing these backroom deals going on between his party and the Liberal party. I think they are wondering where is there chance to have a voice. I know we are talking about having some consultations, but the real voice of Canadians gets to be heard when every Canadian gets to have a say. 
This is not about political parties getting a say. This is not about politicians getting a say. This is about every Canadian. The one way that can happen is through a referendum. Therefore, I want to know this. Sure, there are processes that will take place and a committee will be struck. However, at the end of the day, if his constituents say to him that they demand a referendum, that they want the chance to have a say, that they do not think political parties should make this decision, that they believe all Canadians should make the decision, where would he stand on that?",Conservative,Banff—Airdrie,Blake Richards,http://www.parl.gc.ca/MembersOfParliament/ProfileMP.aspx?Key=224621&Language=E
4674885,ca.proc.d.2016-06-02.8964464,2016-06-02,0c9d00b0-a035-46d3-ba51-0db3e8da19b8,217281,Mr. Murray Rankin,,Government Orders,Business of Supply,Opposition Motion—Special Committee on Electoral Reform,"Mr. Speaker, my colleague identified the position I advocated on, which is proportional representation, as one of my party's. I want to make it clear that it has been a personal view of mine for many years. I am pleased that it is reflected in the position of the New Democratic Party, but it is to reduce the impact of proportional representation, to think of it in partisan terms. Around the world, proportional representation has been adopted by advanced democracies. That is the key point.
When the lightbulb went on for me was when the member for Skeena—Bulkley Valley yesterday asked the government whether it was prepared to move alone on a previous approach that did not involve one of the major parties in the House. That tells all, and the government has accepted that is not the appropriate way to move forward. I am confident we can get it right this time for all Canadians.",New Democratic Party,Victoria,Murray Rankin,http://www.parl.gc.ca/MembersOfParliament/ProfileMP.aspx?Key=217281&Language=E
4674886,ca.proc.d.2016-06-02.8964472,2016-06-02,95ed53a7-7538-4c0f-85a4-64af76065f95,218942,"Mr. Don Davies (Vancouver Kingsway, NDP)",,Government Orders,Business of Supply,Opposition Motion—Special Committee on Electoral Reform,"Mr. Speaker, I would like to congratulate my hon. colleague from Victoria on what I think is one of the most powerful, well-reasoned and cogent speeches that I have heard in the House in eight years on any subject. I was particularly interested in his accurate and powerful description of the extension of the franchise and his narrative of democracy being a living organism and not a static kind of concept. He pointed out that in Canadian democracy, we have gradually expanded the vote from white men with property to people with property to women to aboriginals to non-Caucasian people, from people who are 21 years of age down to those who are 18. 
My question to him is this. Several people on different sides of the House have proposed that it is time to expand the franchise to reduce the voting age to 16, so 16 and 17 year olds, who we tax, who drive, who can marry, who can join the army, can also have a say in their democratic structure. As we explore our democratic reform system, is this an opportunity for us to take the next step and actually continue that process of enlarging the franchise to get more Canadian citizens involved in their democracy?",New Democratic Party,Vancouver Kingsway,Don Davies,http://www.parl.gc.ca/MembersOfParliament/ProfileMP.aspx?Key=218942&Language=E
4674887,ca.proc.d.2016-06-02.8964488,2016-06-02,0c9d00b0-a035-46d3-ba51-0db3e8da19b8,217281,Mr. Murray Rankin,,Government Orders,Business of Supply,Opposition Motion—Special Committee on Electoral Reform,"Mr. Speaker, I thank my colleague and friend from Vancouver Kingsway for his very generous remarks.
I am personally committed to lowering the voting age. It is the right thing to do for a number of reasons, the least of which is because the kids today are a lot smarter than I was when I was that age and are much more involved. This would be an opportunity to engage them more. Rather than phoney events in their high schools where they vote for the student union, imagine if real politicians came in and were trying to achieve their vote? To me, that is a really important test. If we can hook young people on democracy at a young age, I suspect that positive addiction will continue throughout their lifetime. There are a number of good reasons for doing so. I hope the committee will study that as well.",New Democratic Party,Victoria,Murray Rankin,http://www.parl.gc.ca/MembersOfParliament/ProfileMP.aspx?Key=217281&Language=E
4674888,ca.proc.d.2016-06-02.8964499,2016-06-02,62bfd797-8d32-425b-91b1-1422ca16694f,224621,"Mr. Blake Richards (Banff—Airdrie, CPC)",,Government Orders,Business of Supply,Opposition Motion—Special Committee on Electoral Reform,"Mr. Speaker, I rise today to stand up for Canadians and for their right to have a direct say in any changes to the method of voting, to the method of our democracy. 
I have listened to a lot of speeches today, and what I have heard deeply concerns me. I am hearing a lot of talk about what is best for political parties, what is best for politicians, how do we best ensure that all political parties, or at least one other political party, is happy. It is not just about the governing party or the Liberal Party.
It is all about this proposed competition in the community and what is best and what is fairest for political parties, what is fairest for politicians, and what is fairest for their partisan interest. This discussion should not be all about political parties. It should not be about politicians. It should be about the Canadian people. It is their method of voting. It is their democracy. This discussion needs to be about Canadians, all Canadians. It should not be about politicians. It needs to be about ensuring that each and every Canadian has an opportunity to have a direct say.
When we are thinking about the motion today and discussing it, more than on any other occasion, we have to ensure that what we have at heart is the best interests of all Canadians. When we get down to that, when we are changing the most basic rules of democracy, everyone gets a vote, a direct say. It should not be just the Prime Minister and the Liberal cabinet. It should not be just politicians or political parties, especially when we are talking about backroom deals. It needs to be about each and every Canadian, everyone getting a direct say. That must be the absolute essence of any discussion we have in Parliament about electoral reform. Canadians absolutely must have the final say in a national referendum on any proposed changes to how they elect their representatives.
It was actually the Minister of Democratic Institutions who said, “...listening to Canadians is at the heart of a healthy democracy”. It is unfortunate that what we are seeing in the actions of her Liberal government is reflecting the exact opposite of that.
I want to touch a bit on the party's positions. First. Mr. Speaker, that I am sharing my time with the member for Richmond—Arthabaska.
When we talk about this, a lot of claims have been made about the fact that Canadians voted for a party that wanted to change the system somehow. Different positions have been taken by the different political parties. The New Democrats, from their platform, want to make an individual's vote truly count by bringing in a system of mixed member proportional representation. That is their position. About 19.7% of Canadians voted for them. 
The Green Party talks about replacing the first past the post system with proportional representation. Therefore, we have one party talking about mixed member proportional representation and another one talking about some form of proportional representation. The Green Party got about 3.4% or 3.5% of the vote in the last election.
Members of the Liberal Party, which is typical of the Liberal Party, have taken a position of riding the fence, putting themselves in a bunch of different camps so one candidate can claim one thing and one can claim another. At the end of the day, they will do what they want. They have said that they might look at a variety of different types of systems. They got the support of 39.5% of Canadians. They have taken all these numbers, put them together and they think that somehow that gives them the right to change the system without asking Canadians, without talking to Canadians, giving them a chance to have a direct say. I do not think that is what has happened at all. I think they are just trying to avoid the ability of Canadians to have that say, but this has to be about them.
If we are truly to have a discussion on electoral reform and a very open discussion on it, as the Liberal government claims, and the fix is not already in and there has not already been these backroom deals to some kind of conclusion as to what will be put in place, why have the Liberals taken one of the options off the table before they even have had the conversation with Canadians, which is our current method of voting, the one we have had since Confederation? Some people claim that makes it a bad system just because it has been around for a long time. That is up to Canadians to decide. That is not up to the politicians in this room to decide or for the political parties to decide. 
It seems to show a lot of arrogance, in my mind, towards Canadians to have political parties say that they will have a conversation with Canadians and give them some options, but they will take one option out, it is gone, and it is off table before we even have a conversation with Canadians. It seems like a lot of arrogance to say that it is not an option and Canadians cannot choose it. They can choose one of the things we might like them to choose, but not this other option. This needs to be their decision. 
A few days ago, The Huffington Post was reporting on one of the Liberal members, the parliamentary secretary for Veterans Affairs, the member of Parliament for Kanata—Carleton. She recently had an electoral reform town hall in her riding. The one thing I noted in the story was that the member was quoted as having laughed when she recounted a story about a citizen who said he did not think there was anything wrong with our electoral system. Well, that was his opinion and he has a right to have that opinion. Is that the attitude that we can expect from the current Liberal government when it is consulting with Canadians; laughing at those who have a different opinion from its opinion? 
If the Liberals are truly interested in listening, they would not laugh off the opinions of Canadians. This comes back to that arrogance of their party. I think when we talk about some of the backroom dealings going on with the NDP, there is arrogance being shown here, which is a real concern, because Canadians need to have that say, and not these political parties with their backroom deals. 
One thing that I think has been abundantly clear when I look at the actions of the Liberal government is that the members' actions are in their own self-interest. They are in the interest of politicians and not in the interest of Canadians. The Minister of Democratic Institutions stated that she wants to listen to Canadians, but instead the Liberals are charging ahead with a plan that, unfortunately, does not give Canadians the ultimate say. It is one that does not leave all the options on the table. It tells Canadians that they know better than Canadians, that this option is not available to them, that they can pick from some of these other choices, but Liberals are going to decide what those choices are. 
I think it is clear that the Liberal government and the Prime Minister seem to think that only those people who agree with them and with the committee that has political partisan interests, that was created through backroom deals, is who should get the say. The Prime Minister has been quite clear about how he opposes directly consulting Canadians through a referendum on any fundamental changes to how we vote. In fact, he told students at the University of Ottawa exactly that. He said, “the fact is that referendums are a pretty good way of not getting any electoral reform”. 
Well, I do not know, that may or may not be the truth, but the bottom line is that it is not his decision to make; that is Canadians' decision to make. I would say to the Prime Minister that the fact is that referendums are the best way and probably the only way to ensure that Canadians get a direct say, the ultimate say, on their democracy.
We looked at a lot of other jurisdictions that have made decisions or looked at proposed changes to their electoral system, such as Ontario, Prince Edward Island, British Columbia, and other democracies like the United Kingdom and New Zealand. They have all done this. All of them have given the direct say, the ultimate decision, to their citizens through a referendum, not to their politicians. 
I am really quite concerned to see what I am seeing today. The fact of the matter is that three-quarters of Canadians have said that they want to have the referendum on any electoral reform before the government proceeded. Therefore, they want to have that say, they want to have the choice of all the options, which has been made quite clear by Canadians, and it is being made quite clear. It is the only way that the current government can ensure that the changes the Liberals are making are supported by all Canadians and that their plan is fair and transparent. 
Whatever the government decides to do, Canadians need a vote, they want a vote, and they want to be able to say yes or no. What better way to consult with all Canadians than through a referendum? A committee of parliamentarians, no matter what its makeup, no matter what the party stripes, no matter what their partisan interest, is not and never will be a substitute for all Canadians having a say and having their voices heard directly through a referendum. 
In 1992, there was a referendum held on the Charlottetown accord. Three-quarters of eligible Canadians voted. Almost 14 million Canadians voted. To be able to reach the same number of people with this town hall proposal, 40,000 Canadians would have to show up to a town hall meeting in each and every single riding. That is 40,000 Canadians in each of 338 ridings. I cannot for the life of me understand how the current government would not choose to give each and every Canadian a say in a referendum before it changes the very method by which they vote in elections.",Conservative,Banff—Airdrie,Blake Richards,http://www.parl.gc.ca/MembersOfParliament/ProfileMP.aspx?Key=224621&Language=E
4674889,ca.proc.d.2016-06-02.8964668,2016-06-02,0fd242c0-71bc-4c1b-a4e4-609a396eca76,214691,"Mr. Mark Holland (Parliamentary Secretary to the Minister of Democratic Institutions, Lib.)",,Government Orders,Business of Supply,Opposition Motion—Special Committee on Electoral Reform,"Mr. Speaker, I listened with interest to the member opposite. There were a lot of conspiracies there. I do not think I have heard that many conspiracies anywhere, maybe not even at an alien convention.
The reality is that when the member talks about backroom deals, I am confused. There were many conversations that took place with the critic for the member's party, that took place with all of the critics for the different parties. We have had a debate on this particular matter for weeks around what the composition of the committee would be, with members from the Conservative Party saying that the proposal that was put forward by the NDP was a good idea. I heard that many different times. We have tried to work constructively to build that bridge and pull people together and say, “Let us find middle ground, a place to work together”. I am confused here today that there is no movement from the Conservative Party.
There is a channel to have a debate as to how best to engage Canadians. That is the committee, and that is the motion that we have in front of us. Given the fact that there was such a clear iteration in the last election that the status quo was not acceptable, will the member not work with us in the way that the Conservatives were talking about before, and ensure that we have a method to productively modernize the Canadian electoral system?",Liberal,Ajax,Mark Holland,http://www.parl.gc.ca/MembersOfParliament/ProfileMP.aspx?Key=214691&Language=E
4674890,ca.proc.d.2016-06-02.8964689,2016-06-02,62bfd797-8d32-425b-91b1-1422ca16694f,224621,Mr. Blake Richards,,Government Orders,Business of Supply,Opposition Motion—Special Committee on Electoral Reform,"Mr. Speaker, I am really sorry to hear of the member's confusion. I do not think there should be any confusion here.
The bottom line is that it is not up to the Liberal government, it is not up to politicians, and it is not up to political parties to be able to decide for all Canadians how their voting system should work. The very fundamental basic of our democracy is how we vote. For there to be these conversations, or whatever he wants to call them—backroom deals, as I call them—or whatever we want to call them, the bottom line is it should not be up to politicians or the political parties to make this decision. That is what I keep hearing in this debate today, and it is what I keep hearing from the current government: “We are going to work with the political parties”. 
Canadians get to have a say. Members do not just take one of the options off the table. They have to say to Canadians that they are going to give them all of the options, let them have a say, and then at the end of the process let Canadians decide yes or no with a referendum.",Conservative,Banff—Airdrie,Blake Richards,http://www.parl.gc.ca/MembersOfParliament/ProfileMP.aspx?Key=224621&Language=E
4674891,ca.proc.d.2016-06-02.8964698,2016-06-02,77945d39-8e4a-4fd1-9786-441ff928f6f9,218595,"Mr. Bev Shipley (Lambton—Kent—Middlesex, CPC)",,Government Orders,Business of Supply,Opposition Motion—Special Committee on Electoral Reform,"Mr. Speaker, it is unbelievable. We just heard from the parliamentary secretary how he does not believe that the Canadian people should have a choice, but actually that the parties should have the choice in how Canadians elect their representative.
Earlier on, we had the Prime Minister reference that the reason he does not want to actually go to a referendum is because he would not likely get the result that he wanted. Then today in question period, we actually had the minister refer to the people who want to have a referendum as being narrow minded. That is a disservice to Canadians. That is a disservice to everyone who sits in this great House.
Why is it important that we have a referendum in Canada and allow the people to have a say on all of the options that are available for them in how they select their members of Parliament?",Conservative,Lambton—Kent—Middlesex,Bev Shipley,http://www.parl.gc.ca/MembersOfParliament/ProfileMP.aspx?Key=218595&Language=E
4674892,ca.proc.d.2016-06-02.8964707,2016-06-02,62bfd797-8d32-425b-91b1-1422ca16694f,224621,Mr. Blake Richards,,Government Orders,Business of Supply,Opposition Motion—Special Committee on Electoral Reform,"Mr. Speaker, I thank the member for that question. It gives me the opportunity to reiterate the most absolutely fundamental, important point in this whole debate, and it is the one that I am not hearing from any of the other parties in this House. I am not hearing about this because all I keep hearing about is the interests of political parties.
This is about Canadians. This is about the way they vote. This should be a conversation first, but then it needs to be given to every Canadian. It needs to be put in Canadians' hands and they need to be given that choice. They need to be given all of the options available to them and they need to be able to make that choice and say, for the system that is being chosen, “I agree” or “I disagree”, yes or no, as to whether they want to change the voting system or they do not.
 That is the conversation that needs to be had with Canadians, but it also needs to be given to every Canadian to have a direct say and the final say. It is not the Prime Minister's choice and it is not political parties' choice, it is Canadians' choice.",Conservative,Banff—Airdrie,Blake Richards,http://www.parl.gc.ca/MembersOfParliament/ProfileMP.aspx?Key=224621&Language=E
4674893,ca.proc.d.2016-06-02.8964719,2016-06-02,a710e2c4-20f9-4df8-ba6c-2dc50c03bb75,217321,"Ms. Marjolaine Boutin-Sweet (Hochelaga, NDP)",,Government Orders,Business of Supply,Opposition Motion—Special Committee on Electoral Reform,"Mr. Speaker, before today, we had a committee that had a clear Liberal majority.
Now we have a committee made up of 12 voting members, including five Liberals and three Conservatives, by the way, if we are talking about backroom deals. The Conservatives are going to be in the room.
Which of the two does the member think is more democratic?",New Democratic Party,Hochelaga,Marjolaine Boutin-Sweet,http://www.parl.gc.ca/MembersOfParliament/ProfileMP.aspx?Key=217321&Language=E
4674894,ca.proc.d.2016-06-02.8964726,2016-06-02,62bfd797-8d32-425b-91b1-1422ca16694f,224621,Mr. Blake Richards,,Government Orders,Business of Supply,Opposition Motion—Special Committee on Electoral Reform,"Mr. Speaker, there is one thing that would make this completely democratic and that is to say at the end of the process, Canadians get to have a say. The composition of a committee does not matter. If it is a majority of Liberals, or if there is somehow agreement between two of the parties, or whatever it might be, at the end of the day it is not up to politicians to make that decision. It is up to Canadians. The composition of a committee does not change anything in terms of the fact that Canadians need to have the final say in a referendum to say “yes” or “no”.",Conservative,Banff—Airdrie,Blake Richards,http://www.parl.gc.ca/MembersOfParliament/ProfileMP.aspx?Key=224621&Language=E
