basepk,hid,speechdate,pid,opid,speakeroldname,speakerposition,maintopic,subtopic,subsubtopic,speechtext,speakerparty,speakerriding,speakername,speakerurl
4650779,ca.proc.d.2016-02-03.17056.152,2016-02-03,e277e13e-59ec-425f-a957-eb5e54d8cb62,9341,Mr. Gérard Deltell,Interjection,Government Orders,Canada Labour Code,,"Madam Speaker, before I address the substance of the question, I would like to remind members that I mentioned men and women, so yes, I was also talking about mothers who get up in the morning, who work hard, who are required to pay union dues, and who want to get their money's worth. 
I have been a union member. I worked for the TQS Network. It shut down seven years ago. It was very tough on all of us. Let me be clear, our union leader worked for us, not for a political purpose. That is the main difference here.
The main difference is that we strongly support unions when it is time to work for the people, for the workers. That is exactly what my union did seven years ago and I praise them. I welcome this kind of question to be clear. We do support unions when they work for union workers instead of political agendas, as they did for the last year against the Conservative Party of Canada.",Conservative,Louis-Saint-Laurent,Gérard Deltell,
4650780,ca.proc.d.2016-02-03.17056.153,2016-02-03,3a48d31a-42fc-4320-a84f-da61c251bccd,412,"Mr. Blaine Calkins (Red Deer—Lacombe, CPC)",,Government Orders,Canada Labour Code,,"Madam Speaker, I would like to congratulate my colleague on an excellent speech. I appreciate his passion for this.
I was very pleased to have Bill C-525 passed. It is not very often we see a private member's bill passed. It is something I thought was going to be a hallmark of change in this country when it came to establishing democracy and democratic rights.
I, too, have been a member of a union. I have also been part of collective bargaining on the other side, sitting across the table. I know exactly who the union leaders are looking out for in these negotiations. In not all cases is it in the best interests of the workers they claim to represent.
My questions for my hon. friend who gave this speech are based on the information we have on the polling information that was conducted. Is there any clear indication as to whether or not actual union workers support the notion of having a mandatory secret ballot?
Second, could the member edify the House on why he thinks, after nine years of Conservative government, a private member's bill was passed?
Third, why, all of a sudden, is one of the first things the Liberal government does is make a move to remove democracy and accountability in this House with one of its first bills?",Conservative,Red Deer--Lacombe,Blaine Calkins,http://www.parl.gc.ca/parlinfo/Files/Parliamentarian.aspx?Item=3a48d31a-42fc-4320-a84f-da61c251bccd&Language=E&Section=ALL
4650781,ca.proc.d.2016-02-03.17056.154,2016-02-03,e277e13e-59ec-425f-a957-eb5e54d8cb62,9341,Mr. Gérard Deltell,Interjection,Government Orders,Canada Labour Code,,"Madam Speaker, I want to thank my hon. colleague for his question, but first and foremost for the job he has done for democracy in this country with Bill C-525. 
Yes, some polls were conducted a few years ago about this issue, in 2013 Leger Marketing in Quebec and also by Nanos in 2011. What was the support for that kind of bill, that kind of democracy? It was 84% and 86%. How many members here have been elected with that score? No one. I could only dream of that. I would have been proud to have had that result. Je ne fais pas pitié. I got 51% and a majority of 19,000 votes.
On the other aspect, it is quite important to recognize that the first bill the Conservative government put forward was the clarity bill, the transparency and accountability bill. Throughout the campaign, the Liberals said they want transparency and all that stuff. What was their first bill? A direct attack on democracy, accountability, and also transparency. Shame on them.",Conservative,Louis-Saint-Laurent,Gérard Deltell,
4650782,ca.proc.d.2016-02-03.17056.155,2016-02-03,72e2a81c-f40c-4c0f-8be0-09a9e61254c3,4566,"Hon. Robert Nault (Kenora, Lib.)",,Government Orders,Canada Labour Code,,"Madam Speaker, I appreciate the member's comments, even though, to some extent, I cannot understand what he is trying to accomplish.
I will ask a simple question. If there are problems with labour and employee relations, could he explain to the House exactly what they are? Before these bills were presented, I did not see any major issues in the relationship between unions and employers in this country, so I wonder what the motivation would be for the previous government to present the bills that it did.",Liberal,Kenora,Bob Nault,http://www.parl.gc.ca/parlinfo/Files/Parliamentarian.aspx?Item=72e2a81c-f40c-4c0f-8be0-09a9e61254c3&Language=E&Section=ALL
4650783,ca.proc.d.2016-02-03.17056.156,2016-02-03,e277e13e-59ec-425f-a957-eb5e54d8cb62,9341,Mr. Gérard Deltell,Interjection,Government Orders,Canada Labour Code,,"Madam Speaker, it is obvious. The purpose of the bills was to strengthen unions' moral authority.
It always pays to have more democracy, more accountability, and more transparency. Making a vote secret improves credibility.
We know what we are talking about. We were all elected by secret ballot.",Conservative,Louis-Saint-Laurent,Gérard Deltell,
4650784,ca.proc.d.2016-02-03.17056.157,2016-02-03,cedf1659-ebb1-4f26-b723-5c7c5353988b,573,The Assistant Deputy Speaker (Mrs. Carol Hughes),,Government Orders,Canada Labour Code,," It is my duty, pursuant to Standing Order 38, to inform the House that the questions to be raised tonight at the time of adjournment are as follows: the hon. member for Terrebonne, Intergovernmental Relations; and the hon. member for Elmwood—Transcona, Canada Post.",New Democratic Party,Algoma--Manitoulin--Kapuskasing,Carol Hughes,http://www.parl.gc.ca/parlinfo/Files/Parliamentarian.aspx?Item=cedf1659-ebb1-4f26-b723-5c7c5353988b&Language=E&Section=ALL
4650785,ca.proc.d.2016-02-03.17056.158,2016-02-03,ab30a165-2ce2-4465-af10-19ae0fc1aec0,9791,"Ms. Sheri Benson (Saskatoon West, NDP)",,Government Orders,Canada Labour Code,,"Madam Speaker, that will be a hard act to follow, but I think I will be able to provide the House with some more content, and perhaps clarification on some facts.
I would like to thank the hard-working Canadians in Saskatoon West who voted me to be their voice in the House of Commons. Today especially, I feel it is important and I acknowledge their support, because it is important to remind me of who I am here to serve and why. It is also important that all of us here remember exactly who is affected, positively or negatively, by the decisions we make each and every day. This is a responsibility I do not take lightly.
Many of the individuals in my riding work part time or contract positions. The majority of them work in the retail and hospitality sector. Quite a few of my constituents work in unionized workplaces. Others have been impacted by the slowdown in the resource sector. Some own businesses and have employees of their own. A great number of my constituents are new Canadians, immigrants or refugees, working two or three casual or part-time jobs, trying to balance a family, a new country, a new language, and an unfamiliar culture. Every one of these workers deserves to be protected. 
With this in mind, Bill C-4  is beyond partisan politics. It is about the individuals who brought us here and about making things better for the people we all represent. That is why I support the bill. I support it as a person who cares about the rights and well-being of my constituents and my fellow Canadians. 
Bill C-4 is a small step forward toward a return to recognizing and respecting the rights of the hard-working individuals, men and women, who make up our country. It is not hard for me as a member of the NDP caucus to acknowledge the support for Bill C-4. I guess it will not come as a surprise to anyone that our party supports the bill. 
However, it should come as a surprise to all Canadians that the government is having to, with no small amount of shame I hope, return to the people of Canada their hard-earned rights, their constitutional rights, their right to privacy, their rights of freedom of association, and freedom of speech, rights that took decades to achieve. As such, today is a day of mixed emotions. 
On one hand, we are happy to see critical rights restored to hard-working Canadians. On the other hand, we worry about the erosion of workers' rights that took place under the previous government. Today, we ask the current government to be vigilant in restoring each and every one of the rights stolen from the Canadian people. We also ask that it update parts of the Canada Labour Code that are about 60 years out of date. 
A great way to help rectify that problem would be to immediately act on the recommendations of the final report of the 2006 review of the labour code. It is long overdue. Many of these recommendations and much-needed updates would benefit the many hard-working Canadians working two or three part-time jobs, trying to support a family and purchase or maintain a home, a home whose affordability is increasingly out of reach of most middle-class Canadians in Canada, let alone for those individuals working multiple jobs at minimum wage. 
It is a simple and perhaps obvious truth that it is easier to destroy things than to build them. For anyone who has wrestled with a blank page, a canvas, a drafting table, or a freshly surveyed drilling site knows, creating something new is hard work. It takes time, persistence, and patience, and is not for the faint of heart. Destruction, on the other hand, is something we have been able to accomplish with ease since we were all very young. At the age of one, a child will happily smash, in a matter of seconds, a birthday cake that took his or her parents an hour and a half to create. Over the past decade, we have witnessed more than our fair share of destruction, a destruction far less playful and humorous than the smashing of the cake. 
In a few short years, we have seen the dismantling of the rights for each and every individual across the nation, rights that have taken decades to create, nurture, and grow, rights that protect each one of us, but also, and more important, rights that protect the most vulnerable among us. 
The previous government, in a few short years, trampled on and set fire to those rights most dear to individual Canadians, and certainly to those individuals who care about the environment, social services, workers' rights, women's right, the poor and every other marginalized individual and community in this great land; also to those individuals who care about good, honest fiscal management and the economy, and children's education and futures; and especially to those who care about indigenous communities, their languages, cultures and people. These are not and should not be seen as mutually exclusive things. They work together. Each of us is better off by including the other.
Thankfully, today is a new day, and Bill C-4 is a great first step. However, we must do better, be better, and dream much bigger, because we have a lot of ground to make up.
I implore the governing party to be bold, to take the time to recognize respect, and provide rights to individuals who brought them here, because these are individuals who make up our great country. Each of them is a hard-working Canadian.
Today we also know that many Canadians are hurting. Many have lost their jobs and are in danger of, or have already, losing their homes. Many regularly use food banks and emergency shelter that, in some cases, is becoming their everyday shelter. This is unacceptable in a country as great as Canada. We can and must do better.
Bill C-377 was an unnecessary, discriminatory law designed to impose onerous and absurdly detailed reporting requirements on a particular segment, on unions. The bill was pushed through Parliament by the previous government, despite widespread opposition from a wide variety of interests, not just unions. Why? Because the negative effects of the bill would harshly impact each and every Canadian. 
Each of these groups and associations represent individuals whose rights they consider important, whether one belongs to a union or not. Some of those individuals and groups were constitutional and privacy experts, for example, the NHL Players Association, provincial governments, Conservative and Liberal senators, the Privacy Commissioner of Canada, the Canadian Bar Association, and the insurance and mutual fund industry. 
Likewise, along with the Privacy Commissioner of Canada, we believe this bill goes against the Canadian Charter of Rights and Freedoms. If not repealed, this bill will be defeated by the courts.
The New Democrats opposed the bill at every stage, because the legislation was as unnecessary as it was irresponsible. It corrupted the very idea of fairness and balance in negotiations between parties and undermined the fundamental right of free collective bargaining. It was a partisan assault on the men and women who went to work every day to provide for their families.
Canada needs a strong and healthy trade union movement. Historically speaking, unions in Canada have done much, not only for their members, but for Canadian society as a whole. When unions are weakened, all working people feel it. Why? Because, contrary to the rhetoric of those threatened by workers' associations, namely the wealthy 1% and a few misguided Conservatives, attacks on collective bargaining do not promote economic growth. Attacks like these promote inequality, not a healthy economy.
In 2002, documents based on more than 1,000 studies of the impact of unions on domestic economies, the World Bank found that a high rate of unionization led to greater income equality, lower unemployment and inflation, higher productivity, and a quicker response to economic downturns. A quick response to an economic downturn seems like it might be a positive thing right about now.
The previous government claimed at the time that it was acting in the name of transparency, but the Conservatives failed to mention that unions were already required to make their financial information available to their members. The bill is an unnecessary redundancy solving a non-existent problem.
Something we have not heard yet is that the bill would cost taxpayers a great deal of money to achieve absolutely nothing.
The Parliamentary Budget Officer estimated that it would cost much more than the $2.4 million allocated by the CRA to do this level of monitoring. In fact, it was estimated that Bill C-377 would cost the Canada Revenue Agency approximately $21 million to establish the electronic database over the first two years, and approximately $2.1 million per year for subsequent years. Many estimates were even much higher than that. I am being conservative.
As such, implementing the requirements in this bill will be ridiculously expensive for what is clearly redundant and unnecessary harassment. Repealing Bill C-377 would save millions of dollars annually, both for government and for unions, money that could be much better spent creating jobs rather than stifling them. In short, this bill should never have seen the light of day, and repealing it is just common sense.
Similarly, Bill C-525 was a private member's bill supported by the previous government. The bill was designed to make it harder for workers to unionize, and easier for unions to be decertified. Once again, the previous government was solving a non-existent problem.
 Bill C-525 attacks the fundamental right of association by making certification of new worker associations or unions much more difficult and the decertification of existing unions much easier. The labour law changes were made despite there being zero evidence of a problem with the previous system of union certification.
A union, like any other type of association, such as the Association of Information Technology Professionals or the Canadian Society for Civil Engineers, exists to provide support and a voice for its members. What right does a government have to meddle in the daily management of the Canadian Association of Petroleum Producers, for example? None. Therefore, why should the government meddle in daily management of a worker association or union? On the surface, it just seems silly.
It seems a government should have much more important things to accomplish with its time, its budget, and its efforts. However, the efforts of such destructive meddling are much more nefarious than a bizarrely childish obsessiveness with union busting, and these effects have a negative impact on all Canadians. Whether a person supports unions or not, the fact is unions have been a driving force in ensuring all hard-working Canadians, whether unionized or not, receive a basic level of rights, freedoms, and protections.
The health of Canadian unions is at the heart of the health of Canadian workers' rights for each and every working Canadian. Moreover, as mentioned previously, the organized association of working people is important to Canadians and the economy. Higher wages negotiated by unions improve the lives of everyday Canadians and inject an additional $786 million into the Canadian economy each week. Standing in the way of the well-being of hard-working Canadians is bad policy, bad governance, bad fiscal management, and bad for the economy.
As such, the NDP and Canadian unions are pleased that the federal government has tabled legislation to repeal the controversial bills, Bill C-377 and Bill C-525.
 The CLC president, Hassan Yussuff said:
 ...these bills were nothing more than an attempt to undermine unions’ ability to do important work like protecting jobs, promoting health and safety in the workplace, and advocating on behalf of all Canadian workers. 
 Mark Hancock, the national president of CUPE, confirmed, saying:
 This is good news for all Canadian workers. These bills were nothing more than political attacks on unions and we are happy that the new government is moving quickly to correct these wrongs...This is a good step in re-establishing a sense of respect for unions, the democratic voice of working people. 
Likewise, Paul Meinema, the national president of UFCW, said:
 UFCW is pleased to see the government tabling Bill C-4. Our union campaigned vigorously against the Conservative Government`s Bill C-377 in the last parliament. The bill was undemocratic, and part of the Conservative government`s campaign against workers and workplace democracy. It was also a major invasion of the privacy of individual union members and it infringed on provincial jurisdiction over labour issues. Repealing Bill C-377 is positive for all Canadians as this bill would have been expensive for the government to implement and monitor. 
The NDP will continue to push the government to restore and enhance collective bargaining rights as well as fair working conditions for all Canadians. The NDP will continue to pressure the government to reinstate a federal minimum wage and to enact anti-scab and proactive pay equity legislation. Likewise, the NDP will push the government to repeal the previous government's dangerous legislation, just to confuse things also called Bill C-4. Larry Rousseau, in a 2013 article published by the The Huffington Post, called the previous Bill C-4 explosive, claiming the bill turned back the clock almost 50 years. A bill this backward, overtly ideological and explosive needs to be repealed, not just reviewed.
What value does a bill limiting a person's right to refuse unsafe work bring to the table? What exactly needs to be reviewed in a bill that does away with independent health and safety officers and that prevents federal public service workers from accessing the Canadian Human Rights Commission and tribunal over workplace discrimination and complaints? A review legitimizes this offensive legislation. It is time to just repeal it.
Having fought hard against these unnecessary and irresponsible bills, the NDP welcomes the changes tabled by the current government. The rights of working people have been under attack for far too long and the repeal of these bills is a good first step, but there is so much more to do for workers' rights and working conditions for Canadian men and women.
The NDP will push the government to restore good faith bargaining with our public sector workers. We will push the government to reinstate a federal minimum wage and ensure that workers have fair and independent health and safety protections. We will push the government to adopt anti-scab and pay equity legislation, because all Canadian workers deserve fairness and respect.",New Democratic Party,Saskatoon West,Sheri Benson,
4650786,ca.proc.d.2016-02-03.17056.159,2016-02-03,cedf1659-ebb1-4f26-b723-5c7c5353988b,573,The Assistant Deputy Speaker (Mrs. Carol Hughes),Interjection,Government Orders,Canada Labour Code,,"Before we go to questions and comments, I do want to go back to the question that was asked on the amendment by the member for Hochelaga who happens to be the whip of the second opposition party. I can indicate that on June 8, 1999, Acting Speaker McCLellan was seized with a similar question with respect to the seconder of the motion not being in his seat. At that time the Acting Speaker declared that the member needs only to be in the House. Therefore, the amendment was in order and accepted. Therefore, the motion that has been tabled is in order and is accepted by this Speaker.
Resuming debate.",New Democratic Party,Algoma--Manitoulin--Kapuskasing,Carol Hughes,http://www.parl.gc.ca/parlinfo/Files/Parliamentarian.aspx?Item=cedf1659-ebb1-4f26-b723-5c7c5353988b&Language=E&Section=ALL
4650787,ca.proc.d.2016-02-03.17056.160,2016-02-03,96924c12-efff-4de2-9f9e-578fe5434342,9243,"Hon. Erin O'Toole (Durham, CPC)",,Government Orders,Canada Labour Code,,"Madam Speaker, at times there are speeches in this place that are passionate but are also bordering on absurd. I heard terms in the member's speech of “destruction”, “dismantling of rights”, but she did not go into the specifics of the content of those bills. 
Bill C-525 is a secret ballot. Is that a destructive right? Canadians have enjoyed that since 1874. That is a right.
The second bill, Bill C-377, deals with disclosure. The Access to Information Act was brought to the House in 1983 by Pierre Trudeau. The member's province had the same legislation in 1991. Politicians on all levels expect, and it is on my website, if people pay taxes or anything by compulsion like union dues, they should be able to know easily where it goes. This goes for charities. The member used to run the United Way. I can check what it spent online. These are reasonable measures and it is 2016.
Why is the only section of Canadian society that is resisting disclosure the labour movement?",Conservative,Durham,Erin O'Toole,http://www.parl.gc.ca/parlinfo/Files/Parliamentarian.aspx?Item=96924c12-efff-4de2-9f9e-578fe5434342&Language=E&Section=ALL
4650788,ca.proc.d.2016-02-03.17056.161,2016-02-03,ab30a165-2ce2-4465-af10-19ae0fc1aec0,9791,Ms. Sheri Benson,Interjection,Government Orders,Canada Labour Code,,"Madam Speaker, there are some things I would like to clarify; specifically, around the fact that there are many organizations, private organizations, for-profit organizations, which receive government credit, government grants, which do not have the same type of reporting requirements that this bill was requesting of unions. We are going to disagree about this, obviously. That is the reason we say, and rightfully so, it was an attack on a particular group, and it did go in line with all the other attacks on all the other groups, including charities. The previous government worked behind the scenes in order to have audits done on those charities that disagreed with it. That is why I made the comment that we need to look at this in its totality.
The other thing I would like to mention is that although the member likes to talk about a secret vote as being sort of principle of Bill C-525, he needs to know that in that bill one of the secret votes was if a person was not there, somehow it secretly voted for him or her that he or she was against certification of the union. The fact that a person was not there and did not vote, it was a secret to him or her that he or she had voted “no”. It was just absurd.",New Democratic Party,Saskatoon West,Sheri Benson,
