basepk,hid,speechdate,pid,opid,speakeroldname,speakerposition,maintopic,subtopic,subsubtopic,speechtext,speakerparty,speakerriding,speakername,speakerurl
4689759,ca.proc.d.2016-11-23.9258096,2016-11-23,4437c848-d8c7-4a39-a948-1539969f3a90,218734,"Ms. Marilyn Gladu (Sarnia—Lambton, CPC)",,Private Members' Business,Framework on Palliative Care in Canada Act,," moved that Bill C-277, an act providing for the development of a framework on palliative care in Canada, be read the second time and referred to a committee. 
Mr. Speaker, today, I am pleased to stand before the House to bring a private member's bill that would benefit not only my riding of Sarnia—Lambton, but all Canadians. 
All of us will eventually come to the end of our lives. We all want to ensure that we live as well as we can for as long as we can. That is why Canadians need proper palliative and end-of-life care. Bill C-277 would provide a framework for palliative care in Canada.
Last parliamentary session, the Parliamentary Committee on Palliative and Compassionate Care studied the matter and came forward with recommendations. This bill is the result of those recommendations.
The committee published an excellent report outlining the current Canadian situation with respect to palliative care. The preamble for my bill is directly pulled from its report. This committee did a complete assessment of current palliative care options in Canada and identified specific areas and needs to be addressed. The report outlined the importance of strong and consistent palliative care options in Canada as well as the necessity of a framework under which to conduct these efforts.
This bill is also timely since, as a result of the Carter decision on assisted dying, the external committee report also recommended that palliative care be available to all Canadians.
The final report of the external committee on options for a legislative response to Carter v. Canada emphasized the importance of palliative care in the context of medically-assisted dying. It stated that a request for medically-assisted death could not be truly voluntary if the option of proper palliative care was not available to alleviate a person's suffering.
As we all can attest, each of the parties in the House has shown itself to be in favour of implementing a palliative care program in Canada, but very little has been formally announced. We can all agree on the importance of palliative care as well as the importance of making these measures accessible, in a consistent fashion, to all Canadians who need them.
Bill C-277 would define the services to be covered. It would establish standard training requirements for the various levels of service providers. It would come with a plan to achieve consistent access to palliative care for all Canadians. It would define the mechanism by which this is best achieved, with the measurements and data needed to track success. 
Canada has an ever-growing number of individuals of all ages experiencing chronic and terminal conditions. Good palliative care covers a wide range of services, such as acute care, hospice care, home care, crisis care, and spiritual and psychological counselling.
A palliative philosophy of care is needed to address a whole variety of needs through an adapted and patient-centred process. The creation and implementation of a palliative care framework would give Canadians access to consistent, high-quality palliative care through hospitals, home care, long-term care facilities, as well as through residential hospices.
When we look at the current palliative care system, we can recognize the work that needs to be done. Current programs are evolving provincially and many are fragmented with little consistency and communication between the parts. A palliative care framework will bring these fragmented parts together in an effort to create a more cohesive, patient-based program, with a common definition of services covered, training standards, and a plan to ensure equal access for all.
There is a need for governance of the consistent implementation and monitoring of palliative and home care. This would require clear and open communication between federal and provincial governments as well as medical practitioners, institutions, and patients.
I would like to acknowledge the Canadian Medical Association, the Canadian Cancer Society, the Canadian Nurses Association, the Canadian Society of Palliative Care Physicians, Pallium Canada, ARPA, the Canadian Hospice Palliative Care Association, and many of their member hospices, like Bruyère Continuing Care, St. Joseph's Hospice, and West Island Palliative Care Residence, the Heart and Stroke Foundation of Canada, the Kidney Foundation, the ALS Society, the Canadian Association of Occupational Therapists, and the more than 50 organization members of the Quality End-of-Life Care Coalition of Canada for their ongoing promotion and support of this bill. 
It is through organizations and groups like these that we can integrate palliative care into the current health care system and make a true difference in the lives of Canadians.
Support from across Canada is also evident in the 83 petitions on palliative care that have been presented to the House in this session alone. Thousands of letters have been received by members of Parliament on all sides of the House.
 The current palliative care options in Canada are simply inadequate and do not meet the needs of Canadians. 
In 2011, it is estimated that only 16% to 30% of those in need were receiving proper palliative and end-of-life care. Our current health care system favours short-term acute care, which it does extremely well. However, it lacks the capacity and the funding to properly, and consistently, provide quality long-term palliative and end-of-life care. The cost of acute care is four times that of hospice palliative care, so there is an opportunity to provide more of this kind of care for less money. 
Regional accessibility is also an important issue. Currently, palliative care options are available in most heavily populated regions. However, the availability of palliative care in remote or less populated areas is often very limited or non-existent. There is a pressing need for a plan to address how to provide services to these areas. The region where you live should have no impact on whether palliative care is or is not available to you. 
Palliative care would also offer an enhanced quality of life for those who, for various reasons, do not choose medically assisted dying. Data in countries that offer assisted dying shows that where good palliative care is available, 95% of people choose to live as well as they can for as long as they can. Palliative care will provide an option that would be preferable to many medical practitioners, nurse practitioners, and health care institutions that for religious and conscience reasons would prefer to help their patients live well.
With those 65 and older making up approximately 15% of the Canadian population, the geriatric and palliative care needs of Canadians will only increase. Palliative care can be cost efficiently delivered within the home or in community-based systems, such as hospices, nursing homes, and long-term care homes.
Funding palliative care in homes and in stand-alone facilities will alleviate pressure on hospitals and free up many much-needed hospital beds.
 The proper training of medical practitioners and nurse practitioners is an important step in creating a comprehensive and well-equipped palliative care structure. On average, medical and nursing students spend as little as 20 hours of their four years of study learning about palliative and end-of-life care. In 2011, there were fewer than 200 geriatricians in Canada. Today, the estimated need is upwards of 600. 
This bill will also have a positive impact on the lives of caregivers. In 2011, there were an estimated 4 million to 5 million family caregivers in Canada, who contribute $25 billion to the Canadian economy. These same caregivers often have a heavier financial burden and have to miss one or more months of work because of their duties. Family caregivers provide 80% of all home care in Canada, and 77% of these caregivers are women. 
This might seem like a lot of statistics, but these numbers are not to be taken lightly. Caregivers experience financial, social, and physical burdens that can have lasting effects on their lives. I quote the Canadian Cancer Society when I say that “Canadian caregivers are the invisible backbone of the health care system, providing $25 billion in unpaid care”. 
This added support will encourage palliative care in the home, which has been demonstrated to be beneficial for everyone involved. Allowing patients to stay in their homes for as long as possible is a wise and compassionate choice that should be offered to every Canadian.
 As we can imagine, long-term data on the subject is hard to come by. What data we do have shows that Canada has a lot of work to do in the field of palliative care. Dr. Fred McGinn, of the Hospice Society of Halifax, calculated that in 2011 there were over 200 residential hospices in the United Kingdom and over 1,300 residential hospices in the United States. However, there were only 30 free-standing residential hospices in Canada.
Canada needs to develop its capacity for residential and hospice palliative care. In terms of actual spending, it costs between $600 and $800 a day to have a palliative care bed in a hospital. Comparatively, it costs only $55 a day to have palliative care beds at home. In-between these, it costs $200 to $300 a day to have a palliative care bed in hospice. In extreme cases, it could cost upward of $1,200 a day for beds in acute care in hospital while a patient is awaiting other accommodations, so it would be much more cost-effective to fund quality at-home and in-hospice palliative care beds over beds in hospitals.
Our lack of data and research on palliative care is why I believe it is essential we include further research and data collection in the bill. Many other UN countries have or have had laws in place with regard to palliative care. 
A report from the United Nations and World Wide Palliative Care Alliance suggests that the cost of care at end of life, measures between 25% and 30% of all medical expenditures. Shockingly in Canada, 50% of palliative care funding currently has to come from charitable donations. This report determined that overall, the utilization of hospital based and in-home based hospice and palliative care services significantly reduced the cost of care, while providing equal if not better quality care for patients.
 In this House, the government has stated it would allocate $3 billion to home care and to palliative care over the next four years.
This bill to create an overarching framework guaranteeing quality palliative care would provide an ideal complimentary legislation to Bill C-14 in the sense that it will take into account the concerns expressed by health professionals all while creating a quality palliative care strategy. Having end-of-life options gives patients a real choice in an already difficult situation.
Establishing a clear and comprehensive palliative care framework will allow patients to make well-informed decisions about how they spend their remaining time with family and friends.
I believe that my riding of Sarnia—Lambton is an excellent example of palliative care done right. One in five residents of Sarnia is 65 or over, and this number is on the rise. Sarnia is considered to be ahead of many communities with its 10-bed hospice and eight to 10-bed hospital palliative care unit. We have more than five palliative care specialists in our area, and as a community, Sarnia—Lambton has many institutions and groups that support and deliver palliative care, such as St. Joseph's Hospice, the Bluewater Health Palliative Care Unit, and the Erie St. Clair Community Care Access Centre and the VON.
Unfortunately, resources such as these are not abundant everywhere. This has been attributed to a lack of medical training and personnel in this field and a lack of funding. A very small number of Canadians in need of palliative care are able to receive it. With less than 30% of Canadians having access to quality palliative care, concrete changes need to be made. 
As a large portion of our population approaches retirement, the issue will just continue to grow. I am looking to create a framework to implement consistent and quality palliative care across Canada. No Canadian should be denied these essential end of life programs and services because of their region or their finances. Every Canadian deserves the right to be able to end their life in peace and comfort knowing that they had the final choice. The bill will result in Canadians having that real choice.
I would once again like to thank the numerous groups, organizations and hospices for their support. After all, 95% of people who have good palliative choose to live as well as they can for as long as they can. I believe every Canadian should be given that option, so let us join together with one voice to call for quality palliative care as a right of all Canadians by supporting Bill C-277.",Conservative,Sarnia—Lambton,Marilyn Gladu,http://www.parl.gc.ca/MembersOfParliament/ProfileMP.aspx?Key=218734&Language=E
4689760,ca.proc.d.2016-11-23.9258201,2016-11-23,500229ce-460b-45f9-93ce-abf974f9787d,219729,"Ms. Kate Young (Parliamentary Secretary to the Minister of Transport, Lib.)",,Private Members' Business,Framework on Palliative Care in Canada Act,,"Mr. Speaker, it gives me great pleasure to stand in the House to say that I will be supporting this bill. I am very happy to because of my own personal experience watching my mother struggle at the end of her life 15 years ago. Even in a city the size of London, we did not have enough beds 15 years ago, and I would not want anyone to go through that.
I have a question about whether the member has considered aligning the bill with some of the best practices of the provinces that are well ahead of the federal government on this.",Liberal,London West,Kate Young,http://www.parl.gc.ca/MembersOfParliament/ProfileMP.aspx?Key=219729&Language=E
4689761,ca.proc.d.2016-11-23.9258203,2016-11-23,4437c848-d8c7-4a39-a948-1539969f3a90,218734,Ms. Marilyn Gladu,,Private Members' Business,Framework on Palliative Care in Canada Act,,"Mr. Speaker, now is the time to start to leverage the best practices the provinces are starting to implement. Some are further ahead than others. Organizations like Pallium Canada, the Canadian Society of Palliative Care Physicians, and the Canadian Nurses Association have best practices and are able to help leverage them. Now is the time to get the framework and define the services we would have and the standard training requirements and make sure that we roll this out in the most efficient way possible.",Conservative,Sarnia—Lambton,Marilyn Gladu,http://www.parl.gc.ca/MembersOfParliament/ProfileMP.aspx?Key=218734&Language=E
4689762,ca.proc.d.2016-11-23.9258208,2016-11-23,b41c3b7e-c64f-4415-9f58-79d7462e5d8e,217341,"Mr. Peter Julian (New Westminster—Burnaby, NDP)",,Private Members' Business,Framework on Palliative Care in Canada Act,,"Mr. Speaker, the member for Sarnia—Lambton makes a great contribution to this House of Commons. Certainly the New Democrats will be supportive of this bill as well.
That being said, I recall that just a few years ago in this House, the Conservative government cut the national Secretariat on Palliative and End-of-Life Care. I am hoping that this signifies a change in direction for the Conservative Party. 
Can the member acknowledge that this is a change in direction for the Conservative Party and that all Conservative members will be supporting her bill?",New Democratic Party,New Westminster—Burnaby,Peter Julian,http://www.parl.gc.ca/MembersOfParliament/ProfileMP.aspx?Key=217341&Language=E
4689763,ca.proc.d.2016-11-23.9258210,2016-11-23,4437c848-d8c7-4a39-a948-1539969f3a90,218734,Ms. Marilyn Gladu,,Private Members' Business,Framework on Palliative Care in Canada Act,,"Mr. Speaker, as the member knows, I am bringing a fresh perspective to this place. All of the members of the Conservative Party will be supporting this bill, because we recognize that all Canadians need this. 
When we studied Bill C-14 this year, we heard all of the witnesses and the people who were providing input say that we need to have good palliative care if we are going to have a true choice. To find out that 70% of Canadians have no access to any kind of palliative care was astounding to me. Therefore, I am happy to say that we will support this, and that is a change. ",Conservative,Sarnia—Lambton,Marilyn Gladu,http://www.parl.gc.ca/MembersOfParliament/ProfileMP.aspx?Key=218734&Language=E
4689764,ca.proc.d.2016-11-23.9258212,2016-11-23,2b5e6bf0-39d0-4d35-bcaa-dacd1834246d,218274,"Mr. Harold Albrecht (Kitchener—Conestoga, CPC)",,Private Members' Business,Framework on Palliative Care in Canada Act,,"Mr. Speaker, I also want to add my congratulations to my colleague from Sarnia—Lambton for the incredible amount of work she has done in bringing us to this point today. She mentioned in her speech a number of national organizations that are supporting her bill.
 In my own area, I have the privilege of having a number of hospices that provide excellent palliative care. We have Innisfree House and Lisaard House and the HopeSpring Cancer Support Centre. I am wondering if my colleague would expand a bit on her knowledge of the palliative care agency in her area, Bluewater Health, which provides excellent palliative care. I have had the privilege of visiting it, but I would like to hear a bit more about the kind of service it provides.",Conservative,Kitchener—Conestoga,Harold Albrecht,http://www.parl.gc.ca/MembersOfParliament/ProfileMP.aspx?Key=218274&Language=E
4689765,ca.proc.d.2016-11-23.9258214,2016-11-23,4437c848-d8c7-4a39-a948-1539969f3a90,218734,Ms. Marilyn Gladu,,Private Members' Business,Framework on Palliative Care in Canada Act,,"Mr. Speaker, I would like to thank the member, because he was one of the members of the parliamentary committee that first brought this forward. I appreciate all the work that committee did.
Definitely in my riding we have a very integrated approach. There is St. Joseph's Hospice, and there are palliative care beds in the hospital. There is also community care and the VON home care types of services. They are all working in partnership under five palliative care specialists, who are incredibly rare in Canada. For a community as small as Sarnia to have this kind of expertise and for them to be working that way together is a real model we want to leverage. 
As I was putting the bill together, I talked to different hospices, excellent hospices, in other places in the country. Those best practice models are what we need to learn from and implement as we go ahead. There is an opportunity for the government, with a lot of flexibility, to determine how we will apply the solutions that are needed, how we will bring the infrastructure, and what the timing of all of those things will be. 
I look forward to working with all my colleagues on all sides of the House to get a better solution for Canadians.",Conservative,Sarnia—Lambton,Marilyn Gladu,http://www.parl.gc.ca/MembersOfParliament/ProfileMP.aspx?Key=218734&Language=E
