basepk,hid,speechdate,pid,opid,speakeroldname,speakerposition,maintopic,subtopic,subsubtopic,speechtext,speakerparty,speakerriding,speakername,speakerurl
4678236,ca.proc.d.2016-05-12.8919236,2016-05-12,fc9a44ff-23e0-45df-8ec4-a9cccefa71e1,217758,"Hon. Ed Fast (Abbotsford, CPC)",,Government Orders,Business of Supply,Opposition Motion—Trans-Pacific Partnership,"Madam Speaker, I thank my colleague for her speech and for the work she is doing as the new Minister of International Trade.
 I just want to disabuse the member of one thing. I met with Flavio Volpe well before trade negotiations on TPP were completed. In fact, it was Canada that walked away from the table in Maui exactly because the auto part outcome was not to our liking and because the supply management outcome was not to our liking. We walked away, and then when we went back to Atlanta to finalize the agreement, we got a superior outcome on both of those.
I did take note of the fact that the member was praising NAFTA. I think what she is doing is engaging in revisionist history. The member may remember that back in 1993 it was Jean Chrétien and Paul Martin who actually threatened to tear up NAFTA, the Canada-U.S. free trade agreement, over which an election was fought in 1988. The Liberals vociferously opposed that agreement, yet today here they are praising those very agreements that Conservative governments negotiated. 
I remind the member that CETA was negotiated by a Conservative government, and that TPP was negotiated by a Conservative government. In fact, of all the trade agreements Canada has with countries around the world, 48 of them were negotiated by Conservative governments and only three were negotiated by Liberal governments.
My question for the member is this. As she moves forward with ratifying TPP, which I hope she will do, will she be a leader rather than following the United States' lead? Will she be a leader rather than a laggard on trade?",Conservative,Abbotsford,Ed Fast,http://www.parl.gc.ca/MembersOfParliament/ProfileMP.aspx?Key=217758&Language=E
4678237,ca.proc.d.2016-05-12.8919264,2016-05-12,3dd9162a-4763-4000-8c8a-706a788f7e50,213971,Hon. Chrystia Freeland,,Government Orders,Business of Supply,Opposition Motion—Trans-Pacific Partnership,"Madam Speaker, I would like to start by thanking the member for Abbotsford for his really hard work on Canada's trade agenda. As trade critic, I enjoyed working with him when he was minister.
To the point that the member makes, the reality of Canada's trade relationships with the world is that it takes a Liberal government to get the deal done. That was true with NAFTA and that will be true with CETA. The member knows very well that the agreement was not signed and the legal scrub was not completed on his watch. CETA was languishing from September 2015 until we came into office. With CETA, we were able to get the deal done.",Liberal,University—Rosedale,Chrystia Freeland,http://www.parl.gc.ca/MembersOfParliament/ProfileMP.aspx?Key=213971&Language=E
4678238,ca.proc.d.2016-05-12.8919273,2016-05-12,c861cfd8-ac30-4ddf-9d31-79dd34dcc59e,217165,"Ms. Ruth Ellen Brosseau (Berthier—Maskinongé, NDP)",,Government Orders,Business of Supply,Opposition Motion—Trans-Pacific Partnership,"Madam Speaker, I thank the minister for speaking to the House about the Conservatives' opposition motion. 
I would just like to comment, as the member was speaking a lot about consultation and being progressive and transparent. At the agriculture committee, I had a motion on the floor when we were to, hopefully, study the TPP. It was actually voted out by some of the Liberal members on the agriculture committee, which was quite shameful and sad.
One of the questions I would have for the Minister of International Trade is this. The Conservatives proposed compensation for the dairy industry. It was $4.3 billion. It was not honoured in the last budget, and I know that the government is going to be consulting. I was just wondering whether the minister could follow up on where the Liberals are on the compensation package; and, if she could maybe comment on the importance of dealing with diafiltered milk because that was part of the compensation for the industry, which is being negatively impacted by the trade agreements.",New Democratic Party,Berthier—Maskinongé,Ruth Ellen Brosseau,http://www.parl.gc.ca/MembersOfParliament/ProfileMP.aspx?Key=217165&Language=E
4678239,ca.proc.d.2016-05-12.8919288,2016-05-12,3dd9162a-4763-4000-8c8a-706a788f7e50,213971,Hon. Chrystia Freeland,,Government Orders,Business of Supply,Opposition Motion—Trans-Pacific Partnership,"Madam Speaker, I would like to thank the member for her hard work on this issue.
When it comes to compensation, I spoke in my remarks about the need for a progressive trade agenda, an agenda that engages Canadians and builds their trust. Assuring Canadians that compensation for sectors of people displaced by trade agreements will be forthcoming and appropriate is an essential part of that progressive trade agenda. That is why with CETA, where we have pledged with the European Union to sign the deal in the fall and we hope it will come into force at the beginning of next year, we have begun consultations with, among others, the agricultural producers on compensation.
On TPP, as we are discussing today, our government's belief is that now is the time for discussion and debate about the agreement itself. However, we understand the need for compensation, absolutely.",Liberal,University—Rosedale,Chrystia Freeland,http://www.parl.gc.ca/MembersOfParliament/ProfileMP.aspx?Key=213971&Language=E
4678240,ca.proc.d.2016-05-12.8919302,2016-05-12,3da57866-49d8-42d1-9f5b-c78561f67c9d,215963,"Mr. Sukh Dhaliwal (Surrey—Newton, Lib.)",,Government Orders,Business of Supply,Opposition Motion—Trans-Pacific Partnership,"Madam Speaker, the Minister of International Trade has done a good job of explaining the importance of expanding trade and market access for Canada. Early in her mandate, she was in British Columbia consulting with the stakeholders. In my own home province, 40% of the exports are destined for high-growth Asia-Pacific markets. 
Protectionist rhetoric seems to be spreading across the globe as economies face difficulty. Could the minister elaborate on how the government's approach is working to overcome this protectionist sentiment in order to protect Canadian jobs linked to trade?",Liberal,Surrey—Newton,Sukh Dhaliwal,http://www.parl.gc.ca/MembersOfParliament/ProfileMP.aspx?Key=215963&Language=E
4678241,ca.proc.d.2016-05-12.8919313,2016-05-12,3dd9162a-4763-4000-8c8a-706a788f7e50,213971,Hon. Chrystia Freeland,,Government Orders,Business of Supply,Opposition Motion—Trans-Pacific Partnership,"Madam Speaker, as I said in my remarks, and as he suggested, now is a worrying time for all of those who, like us, appreciate the importance of trade and of an open world economy for good-paying Canadian middle-class jobs.
The only way for us to fight that protectionist current is to advance a truly progressive trade agenda. There are two essential ways to do that. One is to have an open, democratic, and consultative process so that people do not fear, as they have sometimes done in the past, that deals are done behind their backs and in secret. The second is to advance truly progressive goals, like protection of the environment, like strong labour standards, like rights for women in small businesses in trade agreements.",Liberal,University—Rosedale,Chrystia Freeland,http://www.parl.gc.ca/MembersOfParliament/ProfileMP.aspx?Key=213971&Language=E
4678242,ca.proc.d.2016-05-12.8919323,2016-05-12,c80fcb28-a347-4594-9e11-63ac3c37e428,214017,"Mr. Simon Marcil (Mirabel, BQ)",,Government Orders,Business of Supply,Opposition Motion—Trans-Pacific Partnership,"Madam Speaker, I would remind the minister that before anyone quotes Mr. Martin, it is important to remember the Canada Steamship Lines scandal. He was hiding money in tax havens when he should have been paying taxes on it here. She should maybe think twice before she quotes the former prime minister.
I know we are talking about the TPP and some of the progressive compensation that will be paid, but can the minister explain why the budget makes absolutely no mention of the $300 million promised to Quebec's cheese producers as part of the Canada-European Union comprehensive economic and trade agreement? Not one red cent of that money has been delivered.",Bloc Québécois,Mirabel,Simon Marcil,http://www.parl.gc.ca/MembersOfParliament/ProfileMP.aspx?Key=214017&Language=E
4678243,ca.proc.d.2016-05-12.8919335,2016-05-12,3dd9162a-4763-4000-8c8a-706a788f7e50,213971,Hon. Chrystia Freeland,,Government Orders,Business of Supply,Opposition Motion—Trans-Pacific Partnership,"Madam Speaker, I thank my colleague for his question. 
First of all, I am very proud to quote Mr. Martin because he was an excellent finance minister and an excellent prime minister. I am proud that he was a Liberal.
As for compensation, as I have already said, we are currently in talks with agricultural producers. We have said so publicly. It is a very important discussion. We will reach an agreement on compensation, because we are absolutely in favour of that.",Liberal,University—Rosedale,Chrystia Freeland,http://www.parl.gc.ca/MembersOfParliament/ProfileMP.aspx?Key=213971&Language=E
4678244,ca.proc.d.2016-05-12.8919347,2016-05-12,fc9a44ff-23e0-45df-8ec4-a9cccefa71e1,217758,Hon. Ed Fast,,Government Orders,Business of Supply,Opposition Motion—Trans-Pacific Partnership,"Madam Speaker, I would like to ask the minister a question about the mitigation that the previous Conservative government promised to the supply-managed sector.
The United States is well known for exploiting loopholes in trade laws to try to get products into Canada that should not be in Canada. For example, there is the ultra-diafiltered milk issue, the spent fowl issue, and the sauce-pack issue for the chickens. 
We had made clear commitments to the supply-managed sector that we were going to plug those holes. One of those holes we plugged already was the pizza-kit issue. That was under our previous Conservative government and the industry was very happy with that. 
Unfortunately, the Liberal government has not yet committed to implementing those mitigation measures. I am wondering if the minister can now, in the House, tell us that she will actually move forward to address the concerns of our supply-managed farmers.",Conservative,Abbotsford,Ed Fast,http://www.parl.gc.ca/MembersOfParliament/ProfileMP.aspx?Key=217758&Language=E
4678245,ca.proc.d.2016-05-12.8919364,2016-05-12,3dd9162a-4763-4000-8c8a-706a788f7e50,213971,Hon. Chrystia Freeland,,Government Orders,Business of Supply,Opposition Motion—Trans-Pacific Partnership,"Madam Speaker, I have the utmost respect for the member for Abbotsford.
Since I only have a brief answer, I will say that you had from 2011 to plug that hole and you guys did not get the job done. It was the same with COOL, so—",Liberal,University—Rosedale,Chrystia Freeland,http://www.parl.gc.ca/MembersOfParliament/ProfileMP.aspx?Key=213971&Language=E
4678246,ca.proc.d.2016-05-12.8919367,2016-05-12,cedf1659-ebb1-4f26-b723-5c7c5353988b,214948,The Assistant Deputy Speaker (Mrs. Carol Hughes),,Government Orders,Business of Supply,Opposition Motion—Trans-Pacific Partnership,"I will remind the minister that she needs to address her questions to the chair, because, yes, I would have gotten the job done as well.
I just want to make sure that you are not insinuating anything on my behalf. Thank you very much.
Resuming debate, the hon. member for Calgary Forest Lawn.",New Democratic Party,Algoma—Manitoulin—Kapuskasing,Carol Hughes,http://www.parl.gc.ca/MembersOfParliament/ProfileMP.aspx?Key=214948&Language=E
4678247,ca.proc.d.2016-05-12.8919374,2016-05-12,9f0040ba-a9d7-4aa4-b2e4-f3213a4e024f,217922,"Hon. Deepak Obhrai (Calgary Forest Lawn, CPC)",,Government Orders,Business of Supply,Opposition Motion—Trans-Pacific Partnership,"Madam Speaker, I will be sharing my time with my colleague from Oshawa.
It is a pleasure to speak on the motion. Before I start, I want to thank my colleague, the member for Abbotsford, who worked diligently on this file. We were in Bali together, along with the former prime minister, to talk about and negotiate the TPP. He put incalculable hours into it and, finally, we reached an agreement.
If I listened carefully enough to the Liberals and the Minister of International Trade, they all agree with the TPP. They just do not want to move ahead because, as they said during the campaign, they want to be a little different from the Conservatives. They do not want to give us credit for it. To be very frank, they will agree to this because it is a great deal for this country.
The minister already elaborated in her speech how great the trade agenda is for the government. She quoted the former prime minister, who was very well known as Mr. Dithers. The fact of the matter remains that the TPP is a great deal. It is a good deal for this country.
I have travelled across the world with my colleague from Abbotsford and the former prime minister. One of the most important things for this country is trade. The Conservative government had a great record, contrary to what the Liberal government says, of signing trade agreements around the world. It signed more trade agreements than when the Liberals were in power before the Conservatives took over.
Nevertheless, it is recognition of the fact—and I am sure my colleagues on the other side will recognize it as well—that we all have to work toward ensuring our prosperity. We are a resource-rich country and have excellent industries. We are a powerhouse on the world stage, and we want to remain a powerhouse on the world stage.
There will be some issues, but in the end, the TPP agreement will put Canada in a place where it will have access to markets that make up 60% of the world's population. That is a huge benefit to businesses and exporters.
The Liberal member for Surrey—Newton raised a question about the protectionism that is taking place around world. There is a referendum taking place in Britain and yesterday the former governor of the Bank of Canada, Mr. Carney, for whom I have a great deal of respect, announced that Britain would go into recession should it leave the European Union. Why would that be? It is because it would suddenly lose market access. We have to look at the factor of having market access. We are a medium-sized country with a very small population. We are rich in resources and we have to sell them.
Look at what is happening in my province of Alberta. Due to low oil prices, Alberta has been massively impacted. It is not only Alberta, but the whole country has been massively impacted by the low oil prices, the resource that we export. One of the biggest problems in Alberta right now, which everybody is talking about, is how to export our resources. We all agree that it should go through environmentally friendly reviews with first nations and everything else, which is a good thing. 
However, ultimately, my colleagues on the other side, in the NDP and even the premier of Alberta, Premier Notley, agree that resources must reach tidewater so that we can sell them. If we do not sell them in the world market, then we will be facing massive problems, which we are already seeing right now in Calgary, in Alberta, where thousands of people are losing jobs. This impact is going across the country.
During the recession of 2008, we had massive infrastructure spending. Our government rose to the occasion. We helped the auto industry stay on its feet. The auto industry is an excellent example of why the export market is necessary. Most of our cars are marketed in the U.S.A.
Let us look at the huge market with respect to the TPP: Chile, Argentina, Japan, New Zealand, Australia, the Philippines, Indonesia, Malaysia. The TPP will put us into this massive market. Our businesses look forward to the TPP.
When I was the parliamentary secretary, business delegations would travel with us to other countries. Even the previous Liberal government took a lot of business delegations around the world in order to build a vibrant export market for Canada. Canada needs an export market to ensure we have good jobs and an economy that will be able to meet all the other important social needs such as health care, education, and other things.
We encourage the Liberals to get the message out. There is nothing wrong with us taking the ball and running with it. The minister has said that we will wait for the others but we do not need to wait for them. This agreement would be good for us. We are ready to go forward and sign it. We want to go forward. We do not want to wait for others to tell us. The Conservative government had an excellent track record of doing things. 
The minister spoke about the trade committee. She talked about Paul Martin. I have been in this Parliament for 18 years so I know our committees are important. Canadians can appear at committees and give their views. Committee travel is not something new that the Liberal government has just come up with. When we were in government, committees travelled. That is their job. The Liberal government needs to understand that committees belong to Parliament. They do not belong to the government. Our committees respond to Parliament. Therefore, committee travel is a normal part of the consultation process. I am glad the committees are there.
We need to listen. We all know we need trade agreements for our country to prosper. We are a resource rich country and the agreements we have signed have always been in favour of Canada. NAFTA is an example.",Conservative,Calgary Forest Lawn,Deepak Obhrai,http://www.parl.gc.ca/MembersOfParliament/ProfileMP.aspx?Key=217922&Language=E
4678248,ca.proc.d.2016-05-12.8919469,2016-05-12,3da57866-49d8-42d1-9f5b-c78561f67c9d,215963,"Mr. Sukh Dhaliwal (Surrey—Newton, Lib.)",,Government Orders,Business of Supply,Opposition Motion—Trans-Pacific Partnership,"Madam Speaker, the hon. member for Calgary Forest Lawn might recall how great the Right Hon. Prime Minister Paul Martin was. He was the one who put our country on the strong financial footing, which we all enjoy today.
Coming back to the TPP, I had the opportunity to sit on the international trade committee. We travelled to the member's hometown of Calgary. We listened to the people across western Canada. Some people were in favour of the TPP and others were not. 
The committee and the minister are doing great work consulting with Canadians. The member for Calgary Forest Lawn has to understand the importance of consulting with Canadians.",Liberal,Surrey—Newton,Sukh Dhaliwal,http://www.parl.gc.ca/MembersOfParliament/ProfileMP.aspx?Key=215963&Language=E
4678249,ca.proc.d.2016-05-12.8919490,2016-05-12,9f0040ba-a9d7-4aa4-b2e4-f3213a4e024f,217922,Hon. Deepak Obhrai,,Government Orders,Business of Supply,Opposition Motion—Trans-Pacific Partnership,"Let me get it straight, Madam Speaker. The member just paid a great tribute to former prime minister Paul Martin for balancing the budget, for getting it right. What is wrong with his government which is now going into deficit? Why is his party not willing to take any lessons from the gentleman who the member called such a great prime minister because he balanced a budget? His government is now going on a massive deficit spending spree without even having a plan on how to get back to a balanced budget. Maybe he should take some lessons from his former finance minister.
The fact is that we have been negotiating the TPP for a long time. It is better to send out the message to everybody that the TPP will be favourable to Canada. That is what we are trying to say.",Conservative,Calgary Forest Lawn,Deepak Obhrai,http://www.parl.gc.ca/MembersOfParliament/ProfileMP.aspx?Key=217922&Language=E
4678250,ca.proc.d.2016-05-12.8919501,2016-05-12,7f01c656-5f94-4743-9018-ad3a89bb2fc4,217214,"Ms. Brigitte Sansoucy (Saint-Hyacinthe—Bagot, NDP)",,Government Orders,Business of Supply,Opposition Motion—Trans-Pacific Partnership,"Madam Speaker, I thank my colleague for his speech.
I would like him to explain how he reconciles his support for the TPP with statements made by experts like Joseph Stiglitz, who called the TPP “the worst trade deal ever”, or Jim Balsillie, who said that there will never be another large Canadian tech company under the TPP.",New Democratic Party,Saint-Hyacinthe—Bagot,Brigitte Sansoucy,http://www.parl.gc.ca/MembersOfParliament/ProfileMP.aspx?Key=217214&Language=E
4678251,ca.proc.d.2016-05-12.8919509,2016-05-12,9f0040ba-a9d7-4aa4-b2e4-f3213a4e024f,217922,Hon. Deepak Obhrai,,Government Orders,Business of Supply,Opposition Motion—Trans-Pacific Partnership,"Madam Speaker, we expect some people not to agree with the TPP. However, the best example is NAFTA. When NAFTA was being negotiated, the Liberals and her party fought against it. The ultimate result is that we all agree NAFTA is a benefit for Canada. That should answer her question.
There are questions, and maybe people do not like the TPP, like in the case of Mr. Balsillie. His company is already facing problems, but nevertheless BlackBerry is a great company.
NAFTA, which faced massive opposition by the others, has turned out to be a great agreement and has benefited Canada.",Conservative,Calgary Forest Lawn,Deepak Obhrai,http://www.parl.gc.ca/MembersOfParliament/ProfileMP.aspx?Key=217922&Language=E
4678252,ca.proc.d.2016-05-12.8919515,2016-05-12,b4442fcd-62cf-456e-a49b-625ea35069b5,215953,"Mr. Lloyd Longfield (Guelph, Lib.)",,Government Orders,Business of Supply,Opposition Motion—Trans-Pacific Partnership,"Madam Speaker, I thank the member across the way for his work in the House and on behalf of the Canada-India Parliamentary Friendship Group, which started up again last night.
This motion would not recognize the work of the committees, which he was defending as an important part of Parliament, where discussions are ongoing right now. We have not heard back from the trade committee, yet, on these talks.
Would the hon. member comment on not only the value of listening to Canadians, but taking their opinions into consideration when we are making decisions in the House?",Liberal,Guelph,Lloyd Longfield,http://www.parl.gc.ca/MembersOfParliament/ProfileMP.aspx?Key=215953&Language=E
4678253,ca.proc.d.2016-05-12.8919525,2016-05-12,9f0040ba-a9d7-4aa4-b2e4-f3213a4e024f,217922,Hon. Deepak Obhrai,,Government Orders,Business of Supply,Opposition Motion—Trans-Pacific Partnership,"Madam Speaker, it is very important to listen to Canadians. Committees do that. It is great when they come back. The committee is already out there doing that. The committee will come back with recommendations, and the recommendation will be to move forward with adjustments here and there.
It is a great thing that the committee are out there listening to Canadians. There could be other venues where they can also consult Canadians. However, it is not wrong for the government to say that in principle it supports the TPP. It is time for the government to say that it is ready, in principle, to support the TPP.",Conservative,Calgary Forest Lawn,Deepak Obhrai,http://www.parl.gc.ca/MembersOfParliament/ProfileMP.aspx?Key=217922&Language=E
